	Unnamed: 0	Link	Text	Title	Terms	Topics
5	5	http://www.cnn.com/2016/09/19/politics/bill-clinton-npr-interview-clinton-foundation/index.html	"""It was natural for people who've been our political allies and personal friends to call and ask for things. And I trusted the State Department wouldn't do anything they shouldn't do,"" Clinton told NPR in an interview that aired Monday morning.  He also maintained that he would sever his connection to the Clinton Foundation if Hillary Clinton is elected president to remove any conflict-of-interest concerns, though he acknowledged the move would be ""hard.""""It is hard, but you know, if Hillary is elected, I'm looking forward to it,"" Clinton said. He noted that he's worked for the foundation ""longer than I've ever had any job -- and I loved it."" ""And you know, we always say in response to our critics that nobody in my family ever took a penny out of this foundation and put millions of dollars in. But I would have paid more to do this job. It was the most fun thing I've ever done,"" Clinton added.The former president pushed back on criticism that donors to the Clintons Foundation engaged in a ""pay-to-play"" scheme, whereby donations to the foundation bought influence with Hillary Clinton during her term as Secretary of State. He pointed to the lack of evidence of any such quid-pro-quos, and accused critics of ""smearing"" him and his wife, according to NPR.""In real life, if somebody tells a lie about you, and I find out it is, I like you more and them less. In political life, they just keep on smearing you -- even if it all comes to nothing -- people will like you less and won't hold anybody accountable for what they say.""Clinton also praised his wife for weathering criticism during her presidential campaign. ""I wonder if there's a man in America that could have taken what she's been through in the last year and a half."""	"Bill Clinton: ""Natural"" for foundation donors to seek favors"	['Clinton']	[]
6	6	http://www.cnn.com/2016/09/19/politics/obama-to-us-dont-succumb-to-that-fear-following-suspected-bombing-incidents/index.html	"During two appearances in New York, Obama praised the swift work of law enforcement authorities looking into duel bomb attacks in New York and New Jersey over the weekend. And he urged Americans to follow the lead of residents here by not submitting to fear.""I think it is important to remember what terrorists and violent extremists are trying to do. They are trying to hurt innocent people, but they also want to inspire fear in all of us, and disrupt the way we live to undermine our values,"" Obama said. ""We all have a role to play as citizens in making sure that we don't succumb to that fear. And there is no better example of that than the people of New York and New Jersey.""""Folks around here, you know, they don't get scared. They are tough, they are resilient, they go about their business every single day. And that kind of toughness and resoluteness and a recognition that neither individuals nor organizations like ISIL can ultimately undermine our way of life,"" Obama said. ""That's the kind of strength that makes me so proud to be an American.""The President was speaking Monday morning from a hotel in midtown Manhattan, where he's attending his final United Nations General Assembly meeting. Two miles south, in Chelsea, investigations were still piecing together evidence following a bomb explosion in a dumpster Saturday night, which injured dozens.RELATED: NY, NJ bombings: Suspect wounded, arrested after shootout; 2 officers hitThe attack appeared linked to another explosion in Seaside Park, New Jersey, and a series of pipe bombs found in a backpack Sunday night in Elizabeth, New Jersey. A third incident in Minnesota, where a man stabbed nine people before being shot, is being investigated separately as a ""potential act of terrorism,"" Obama said.Monday afternoon, Obama said he'd spoken with law enforcement officers who helped apprehend Ahmad Khan Rahami, a suspect in this weekend's bomb attacks in New York and New Jersey, and hailed their actions as heroic. He also said he phoned an off-duty officer who neutralized the attacker in Minnesota.""It's just one more reminder of the skill and sacrifice and what they put on the line every single day to make sure we're safe,"" Obama said following talks with Iraq's prime minister Haider al-Abadi.An ISIS wing claimed responsibility for the Minnesota attack, though Obama avoided pinning any specific motivation on the attacks during his appearances on Monday. He did, however, insist his administration was going after the terror group aggressively to prevent any further violence.""We will continue to lead the global coalition on the fight to destroy ISIL, which is instigating a lot of people over the internet, to carry out attacks,"" Obama said, using the administration's term for the Islamic State group. ""We are going to continue to go after them. We're going to take out their leaders, we're going to take out their infrastructure.""Following his talks with Abadi, Obama  conceded retaking Iraq's second largest city from the terror group would be difficult.""This is going to be challenging,"" Obama said of long-held plans to liberate Mosul. ""We feel confident that we will be in a position to move forward fairly rapidly.""""It will be a tough fight...This is going to be hard, this is going to be challenging,"" Obama continued, adding he would support and assistance from other countries and from US lawmakers."	Obama in NYC: 'We all have a role to play' in terror fight after suspected bombings	['Obama']	[]
7	7	http://www.cnn.com/2016/09/19/politics/syria-coalition-airstrike/index.html	Officials said they now think the personnel bombed may have been Syrian military prisoners, according to several US defense officials. That's a working theory of how US, British, Danish and Australian aircraft may have incorrectly assessed intelligence and targeted the site that killed more than 60 Syrian personnel near Deir Ezzor in eastern Syria. The UK Ministry of Defence is saying it used drones in the strike.Officials emphasized there are no final conclusions by the US about who was struck. Overhead imagery and interviews with those involved will have to be assessed.But the US is not disputing that Syrian personnel were hit. The US is trying to determine what specifically led to the mistaken strike and how the personnel may have been misidentified.Syria ceasefire under threat after US-led strikes kill regime troops, Russia saysOfficials told CNN they believe a likely scenario is the personnel hit were prisoners of the regime, perhaps military personnel being detained, although that is not certain. The initial signs indicate they were dressed in civilian clothing. They also may not have had the typical weapons of a Syrian military unit but rather trucks with weapons mounted on top of them.It is also not known if they were deliberately placed there to potentially deceive the coalition.The strike happened about two kilometres outside the airport in Deir Ezzor, where the US did not expect Syrian forces to be located. The US had struck ISIS strongholds in the area of Deir Ezzor dozens of times in recent months, but had not seen Syrian forces at this location.Syria ceasefire: Is Bashar al-Assad preparing to breach it?Gen. Joseph Votel, head of US Central Command, has appointed a one-star general to conduct an investigation, but as of early Monday that name had not been released. The US expressed regret for the incident, but it still sparked a furious diplomatic row at an emergency UN Security Council meeting over the weekend. The US remains insistent that it does not target Syrian forces, only ISIS and al Qaeda, officials said.       While the strike has raised tensions with Russia over the effort to make a potential ceasefire work, it also comes as the pace of operations against ISIS strongholds in Iraq's Mosul and Syria's Raqqa is picking up. In northern Syria, US Special Operations Forces remain partnered with Turkish forces and plan to move with them throughout the area, including the town of Al Rai. US officials told CNN that despite video emerging last week that appeared to show Turkish and US forces being asked to leave the town, they have remained in the area.There is also growing intelligence that ISIS is hunkering down for major combat in Mosul as Iraqi forces draw closer. US surveillance has shown a growing number of improvised explosive devices, bombs, tunnels, trenches and firepits have been dug. The US also believes ISIS has put bombs on all the major bridges into the city, one official said.	US develops working theory on what happening in Syrian	[]	[]
8	8	http://www.cnn.com/2016/09/19/politics/ivanka-trump-paul-ryan-meet/index.html	"The meeting was requested by Ivanka Trump, according to the speaker's office. ""It was a productive conversation where Ryan spoke about his 2012 experience and Ivanka shared updates about her father's campaign,"" the aide said. Ryan was in town to address a luncheon at the Economic Club of New York. The meeting was first reported by Politico.Ryan and Donald Trump have had a tense relationship throughout the 2016 campaign. Ryan: Trump should release his taxesAfter Trump became the presumptive nominee, Ryan publicly hesitated to endorse him, saying he needed time to decide. He eventually did endorse Trump, and the two have met. But Ryan has also remained critical of some of Trump's policies and rhetoric.Trump has returned the favor to Ryan, echoing his wait-and-see language on endorsing the speaker during his primary race.Ivanka Trump is one of Trump's closest confidantes. She has also been involved in policy development, recently pushing her father to unveil a childcare proposal.Ryan boasted about his own daughter's new political position during his speech on Monday, revealing that she won a school election to become vice president of her 9th grade class at her high school in Wisconsin.""It goes to show that at least somebody in our family can get elected to vice president, so we broke that curse,"" Ryan, who served as the GOP's 2012 vice presidential nominee joked."	Ivanka Trump, Paul Ryan meet	['Trump']	[]
9	9	http://www.cnn.com/2016/09/19/politics/election-2016-hillary-clinton-barack-obama-voters/index.html	"The Democratic nominee's effort to win over voters who twice put Barack Obama in the White House -- and who represent her best chance of victory in November -- will reach new intensity this week in the run-up to her first crucial debate clash in seven days.Young, college-educated and minority voters formed the backbone of Obama's majority in 2008, helping to put once reliably Republican states like Virginia and North Carolina in the Democratic column and shore up the battered incumbent in swing states like Ohio and Florida in 2012.But recent polls indicate the race tightened dramatically in recent weeks, with GOP nominee Donald Trump on a roll. They suggest that Clinton is lagging behind Obama with younger voters and that she has failed to kindle the enthusiasm that drove them to the polls four and eight years ago.Questions are also mounting about the scale of likely turnout among black and Hispanic voters, who are expected to vote disproportionately for Clinton but could let her down if they do not show up in sufficient numbers in battleground states. Obama delivered a direct appeal to these voters over the weekend at the Congressional Black Caucus dinner where he made a passionate plea to his supporters to show up in November for Clinton. Clinton eyes NC as a firewall in tightening raceAfter appealing to forums of African-American and Hispanic leaders in recent days, Clinton will travel to crucial Pennsylvania on Monday to highlight the stakes for millennials.She previewed the likely thrust of her remarks last week in North Carolina in a more personal, emotive stump speech that she retooled while laid up with pneumonia.""I am running for young people like so many of you here who dream of changing our world for the better,"" Clinton said.In that speech, the Democratic nominee also reached out to other sectors of the Obama coalition, including LGBT voters, African Americans and those who secured health care under the current president.Clinton's running mate, Virginia Sen. Tim Kaine, made a forceful push for millennial votes on NBC's ""Meet the Press"" Sunday, arguing that on the issues young people care about most, like climate change, women's health, college affordability, immigration reform and LGBT equality, there was only one possible choice in November.""It's on our shoulders to make the case. But on at least five litmus test issues, the differences between Hillary Clinton and Donald Trump are vast,"" Kaine said.Clinton's need to improve her standing among young voters has become apparent in recent polling. A Quinnipiac University poll this month found that Clinton was backed by 31% of voters aged 18-34 while 29% favored Trump. But 44% of that group said they would vote for Libertarian Gary Johnson or Green Party leader Jill Stein.Other polls have also shown Clinton needing to improve her standing among the younger demographic. If she does not, it could harm her election chances because she is far more dependent on the youth vote than Trump, as the core Republican vote skews much older.A CNN/ORC poll last week had Clinton leading Trump by 54% to 29% among voters under the age of 45. But she's running behind Obama, who beat Romney 60% to 37% among the same group in 2012.While the former secretary of state has work to do to electrify the Democratic coalition, she could not have better allies. Most prominently, Obama himself, enjoying some of the best approval ratings of his presidency, is emerging as a passionate, adamant fighter for her cause. First lady Michelle Obama is also taking on a key role. Following her acclaimed speech at the Democratic National Convention this July, she told young voters in Virginia last week that their choice in November would decide whether they could afford a college education and keep their health care when they graduate.Even Clinton's bitter primary rival, Bernie Sanders, who became a rock star on college campuses and among young voters, is beginning to become more prominent as an advocate warning of the dangers of a Trump presidency.However, transferring support from one candidate to another is not just a simple matter of passing the baton.Obama's popularity among Democrats seems intimately attached to the President himself. His efforts to boost Democrats in mid-term elections in 2010 and 2014 had little effect, and his record on picking winners in off-year races is also patchy. It's left the impression that his is a uniquely ""Obama"" coalition that cannot be easily bequeathed to a successor.RELATED: Obama: Would be 'personal insult' to legacy if black voters don't back ClintonThat may be one reason why Obama's appeal to black voters at the Congressional Black Caucus dinner on Saturday was so striking; he figuratively put himself on the ticket in November, urging African Americans to vote for him and his legacy.""My name may not be on the ballot, but our progress is on the ballot,"" he said.""After we have achieved historic turnout in 2008 and 2012, especially in the African-American community, I will consider it a personal insult, an insult to my legacy, if this community lets down its guard and fails to activate itself in this election,"" Obama said in strikingly direct remarks. ""You want to give me a good sendoff? Go vote.""Obama's press secretary Josh Earnest told CNN's ""New Day"" on Monday that the President's comments were aimed at voters who were turned off by the negativity of the campaign that the ""stakes are too high"" to tune out.""I think the impact is to send a clear message to the President's supporters across the country that even though his name isn't on the ballot, he feels passionately about the outcome of this race,"" Earnest said.The process of transferring Obama's African-American support to Clinton was given a significant lift by Trump's clumsy effort to lay to rest the ""birther"" controversy over his repeated false claims that the President may not have been born in the United States, and hence wasn't eligible for the country's highest office.Though the GOP nominee finally admitted on Friday that Obama was indeed born on American soil, he gave the controversy fresh life by claiming inaccurately that Clinton's 2008 campaign started the furor and that he ended it -- despite pushing the rumor years after Obama produced his birth certificate.""If you would ask me to come up with one thing that would ruin Donald Trump's momentum over the last three weeks, I would say bringing up the birther thing,"" said Kevin Madden, a former top Romney strategist, on CNN's ""State of the Union Sunday. ""In many ways it has brought up new questions and in many ways it has put the spotlight again on Donald Trump in a very negative way.""For her part, Clinton, despite facing the historically daunting task of trying to win a third consecutive White House term for her party, is hugging Obama close.She paid a fulsome tribute to the President at the CBC dinner and vowed to work tirelessly for a strong African-American turnout in November.""I want you to know I'm not taking your vote or anyone's vote for granted,"" she said. ""I need your help over the next 52 days to bring our campaign across the finish line together.""Trump's cause, however, has been boosted by a string of recent polls showing that the GOP nominee has all but neutralized Clinton's big convention bounce. And his campaign is suggesting that she will fail to pull off the kind of high turnout among key Democratic constituencies she needs to win in November. ""Bernie Sanders had an event yesterday in Ohio for Hillary Clinton. There were 150 people there,"" Trump campaign manager KellyAnne Conway said on CBS ""Face the Nation"" Sunday. ""That's like a second wedding where I come from. This is not a big movement for Hillary Clinton.""While the activity of last week and the coming one suggests that the Clinton campaign is concerned about its candidate's progress in reassembling the Obama coalition, the countdown to Election Day could serve to concentrate the minds of Democratic voters.Young voters are notoriously less likely to show up at the polls than older ones, but they confounded conventional wisdom when they repeatedly answered Obama's call in primary elections and general elections.In 2012, Republicans backing Romney were adamant that Obama would never recreate the kind of historic turnout, especially among black voters, that he had managed in 2008 when he leveraged the historic potential of the first African-American presidency.It was only on Election Day, when returns started trickling in from key counties in swing states from Florida to Ohio, that the Romney brain trust learned how wrong they were.But with Clinton's fate on the line, that coalition is now facing its final -- and most daunting -- test."	Election 2016: Can Hillary Clinton rebuild Obama's coalition?	['Sanders', 'Clinton', 'Trump', 'Romney', 'Black', 'Obama', 'Kaine']	[]
