	Unnamed: 0	Link	Text	Title	Terms	Topics
0	0	http://www.cnn.com/2016/09/19/politics/zika-funding-congress/index.html	"""Everything's a little up in the (air),"" Sen. John Cornyn of Texas, a member of the Republican leadership told reporters crowded outside his office waiting for word of an agreement. ""Hope springs eternal.""With no deal at hand, Senate leaders delayed until at least Tuesday a procedural vote to begin debate on the bill in hopes it might be ready then.In one sign of possible progress late Monday, Sen. Chuck Schumer of New York, who is a member of the Democratic leadership, told reporters that negotiators had resolved a key sticking point over language in the Zika measure that would prevent funds from going to a Planned Parenthood partner in Puerto Rico, something Democrats strongly oppose.""Yes, it's resolved,"" Schumer told reporters. ""The whole Zika issue has been resolved.""But a top Senate GOP leadership aide declined to confirm Schumer's pronouncement. And about an hour before Schumer spoke, Sen. Roy Blunt of Missouri, a senior Republican in the talks, said it would be ""very, very premature"" for Democrats to say the Zika language had been resolved. ""None of this done until it's all done,"" Blunt said. Some senators and aides of both parties predicted a hand-shake agreement on the overall deal could be reached as early as Tuesday but others doubted the partisan divide could be bridged so quickly, especially since the deadline for the government to run out of money is not until the end of the month. With control of the Senate up for grabs in November, GOP leaders are anxious to wrap up the high-priority legislation and get their vulnerable members up for re-election home to campaign. Democrats denied Republican charges they were slow-walking a final agreement but privately acknowledged that they felt no pressure to accept a quick deal they didn't like just to let Republicans go home to campaign. Among the issues being negotiated, Sen. Ted Cruz, R-Texas, is pushing to add language to the government funding bill that would prevent the US from turning over to an international organization control over Internet domain names. Some Democrats are pressing for changes to the Export-Import Bank board to get around GOP opposition to confirming open slots on the board, which is disrupting some operations of the bank. Other issues include funding for Flint, Michigan's water supply problem, disaster aid for states hit my major flooding, disclosure requirements for political giving by corporations, and the number of hours truckers are allowed to drive in a week to limit driver fatigue. Some GOP lawmakers have been pushing for aid to help with damage caused by the recent Louisiana flooding.But Schumer suggested that both Flint and Louisiana would need to be addressed in a separate disaster aid package, saying the GOP was blocking additional money for Flint in the government funding package.""They want to do Louisiana, we want to do Flint,"" Schumer said. ""They don't want to do Flint.""Negotiators are also working to get offsets for the cost of the $1.1 billion Zika funding. Democrats initially pressed for it all to be considered emergency funding but there were signs they were prepared to meet GOP demands for some offsets."	Still no deal on Zika and government funding	['Cornyn', 'Schumer', 'Blunt']	[]
1	1	http://www.cnn.com/2016/09/19/politics/us-citizens-deported-report-fingerprints/index.html	"The failure occurred, in part, because older fingerprint records were not digitized as part of DHS or the FBI fingerprint databases and therefore could not be readily searched thereby preventing those who had been ordered deported or removed from being identified. The Department of Homeland Security Inspector General report said there are still ""about 148,000 older fingerprint records that have not been digitized of aliens with final deportation orders or who are criminals or fugitives.""Failure to digitize these records risks ""making naturalization decisions without complete information and, as a result, naturalizing additional individuals who may be ineligible for citizenship or who may be trying to obtain US citizenship fraudulently,"" the report added.""US Citizenship and Immigration Services granted US citizenship to at least 858 individuals from special interest countries who had been ordered deported or removed under another name,"" according to the Department of Homeland Security Inspector General report.The report describes special interest countries as ""generally defined as countries that are of concern to the national security of the United States."" At least one of the people identified as having improperly been granted citizenship is now working in law enforcement, the report said.It recommends the remaining older fingerprint records be digitized and that DHS review ""the eligibility of each naturalized citizen whose fingerprint records reveal deportation orders under a different identity"" and decide whether to seek denaturalization.The report noted that the department has concurred with its recommendations and has begun implementing corrective actions.Department of Homeland Security spokesperson Neema Hakim told CNN that ""DHS is and has been taking steps to address this issue"" including working to digitize the 1990s-era fingerprint records.But Hakim added, ""The fact that fingerprint records in these cases may have been incomplete at the time of the naturalization interview does not necessarily mean that the applicant was in fact granted naturalization, or that the applicant obtained naturalization fraudulently.""""Where the DHS review process finds that naturalization was obtained fraudulently, DHS will appropriately refer the case to the Department of Justice for civil or criminal proceedings, including for denaturalization,"" Hakim said. ""This failure represents a significant risk to America's national security as these naturalized individuals have access to serve in positions of public trust and the ability to obtain security clearances,"" Republican Sen. Ron Johnson of Wisconsin, the chairman of the Senate Homeland Security and Governmental Affairs Committee, wrote in an open letter to Secretary of Homeland Security Jeh Johnson. Failure to properly screen applicants for US citizenship, particularly from ""special interest countries,"" is likely to further fuel controversy over the screening of immigrants, a contentious topic during the 2016 election cycle.Republican presidential nominee Donald Trump has called for immigration bans targeted at countries with connections to terrorism. He had previously called for a temporary prohibition of Muslim immigrants. The apprehension of Ahmad Khan Rahami, the suspected perpetrator of the recent bombings in New York and New Jersey, is similarly likely to draw attention to the screening process as Rahami immigrated to the US from Afghanistan and subsequently was granted US citizenship. "	Over 800 immigrants wrongly given US citizenship, DHS report says	['Trump']	[]
2	2	http://www.cnn.com/2016/09/19/politics/georgia-monmouth-poll-donald-trump-hillary-clinton/index.html	The Republican candidate has 45% to Clinton's 42% in the Monmouth University poll, within the poll's margin of error. Libertarian Gary Johnson had the support of 8% of likely voters. Trump is underperforming previous GOP candidates. Mitt Romney won the state by 8 points in 2012 over President Barack Obama. The incumbent Republican senator is also out-polling Trump. Sen. Johnny Isakson has a 16-point lead over challenger Jim Barksdale, 50% to 34%. Clinton's strength comes from the Atlanta area, where she leads Trump 55% to 35%. But Trump leads her 51% to 33% elsewhere in the Peach State. She leads 88% to 4% among the state's black voters, but trails 20% to 66% among white voters. Clinton and Trump have similar favorability ratings in the state. Clinton is viewed 32% favorably and 56% unfavorably. Trump is viewed favorably by 33% of likely voters and unfavorably by 50%. Monmouth surveyed 401 like Georgia voters from September 15 to 18 for the poll, which has a margin of error of plus or minus 4.9 percentage points.  	Georgia poll: Donald Trump, Hillary Clinton in tight race	['Romney', 'Isakson', 'Clinton', 'Trump', 'Obama']	[]
3	3	http://www.cnn.com/2016/09/19/politics/unga-meetings-obama/index.html	"That's the agenda as more than 140 heads of state and government descend on New York this week for the annual United Nations General Assembly.As the world grapples with these and other pressing issues, US domestic politics may claim space on the New York stage: Democratic presidential candidate Hillary Clinton is set to meet some world leaders in Manhattan this week as her family's controversial charitable foundation hosts the final meeting of the Clinton Global Initiative.The UN will mark its own endings, too, as both President Barack Obama and UN Secretary General Ban Ki-moon attend for the last time in their current capacities.The agenda for the 71st assembly, as aspirational as it is daunting, comes at a particularly uncertain moment.  In Asia, North Korea's largest-ever nuclear test this month has cast a new shadow over a region that accounts for 40% of the global economy. In the Middle East, the world is watching to see if a shaky ceasefire will take root in Syria, where the five-year-old civil war and the brutality of ISIS have destabilized the region.That destabilization has seen European countries overwhelmed by record-breaking numbers of refugees moving across their borders, redefining the continent's political landscape and heightening the threat of terrorist infiltrators.It's the world's toughest ""to do"" list: stop violent extremism, solve the worst global refugee crisis in a quarter century, foster peace in the ravaged Middle East and -- in the meantime -- work to end poverty, disease, hunger and the threat of nuclear weapons.That's the agenda as more than 140 heads of state and government descend on New York this week for the annual United Nations General Assembly.As the world grapples with these and other pressing issues, US domestic politics may claim space on the New York stage: Democratic presidential candidate Hillary Clinton is set to meet some world leaders in Manhattan this week as her family's controversial charitable foundation hosts the final meeting of the Clinton Global Initiative.The UN will mark its own endings, too, as both President Barack Obama and UN Secretary General Ban Ki-moon attend for the last time in their current capacities.The agenda for the 71st assembly, as aspirational as it is daunting, comes at a particularly uncertain moment.  In Asia, North Korea's largest-ever nuclear test this month has cast a new shadow over a region that accounts for 40% of the global economy. In the Middle East, the world is watching to see if a shaky ceasefire will take root in Syria, where the five-year-old civil war and the brutality of ISIS have destabilized the region.That destabilization has seen European countries overwhelmed by record-breaking numbers of refugees moving across their borders, redefining the continent's political landscape and heightening the threat of terrorist infiltrators.Terror threatTerrorism is already casting a particularly dark shadow over this meeting, as New York police investigate a Saturday bombing in Manhattan that injured 29 people.It occurred on the same day that a blast disrupted a Marine Corps charity run in New Jersey and a man stabbed nine people at a Minnesota mall. All three incidents are being investigated as possible terror attacks and security around UN events will likely be even more stringent than usual.   Global leaders will hold special breakout sessions on refugees, Syria and Libya, where instability has also created openings for ISIS and other extremist groups. They'll address other priorities, too, including climate change, human rights, sustainable development and UN reform.Heightened tensionOn the sidelines, Obama will meet with world leaders. On Monday, he's set to discuss North Korea's nuclear tests and other Asian issues with Chinese Premier Li Keqiang. On Wednesday, Obama will review a newly signed $38 billion aid package for Israel with its Prime Minister Benjamin Netanyahu and discuss the prospects for Mideast peace. He'll also meet with leaders such as Iraqi Prime Minister Haider al-Abadi and Colombian President Juan Manuel Santos.Amid the week-long swirl of meetings at the iconic rectangular UN building bordering Manhattan's East River, there will also be the usual smaller dramas: the leaders who use their speeches to denounce rivals in impolitic ways and heated speculation about potentially fraught or historic meetings.Last year, a tense meeting between Obama and Russian President Vladimir Putin was swiftly followed by Moscow's intervention in Syria. This year, existing tensions will be heightened by a US strike on Syrian forces that the military had thought was an ISIS target, administration officials said. Russia called an emergency UN Security Council meeting, arguing that the Saturday strike showed the US isn't fully committed to cooperating with Moscow on the fight against militant groups including ISIS and warned that the Syrian ceasefire might break down as a result.""We consider what happened as a natural result of the persistent refusal of the United States from the establishment of close cooperation with Russia in the fight against ISIS, Jabhat al-Nusra and other affiliated terrorist groups,"" the Russian Foreign Ministry said in a statement Sunday. Secretary of State John Kerry and Russian Foreign Minister Sergei Lavrov, the architects of the nascent ceasefire, are expected to meet and may offer an update on its progress.The US Ambassador to the UN, Samantha Power, expressed regret for the loss of life Saturday, but added that, ""Even by Russia's standards, tonight's stunt -- a stunt replete with moralism and grandstanding -- is uniquely cynical and hypocritical."" Iran questionSince 2011, Power said, ""the Assad regime has been intentionally striking civilian targets with horrifying, predictable regularity."" The 2015 General Assembly also featured a historic handshake between Obama and Iranian president Hassan Rouhani. This year, with the Iran nuclear deal under fire in Tehran and a tight US presidential campaign underway, political observers wonder if the two men will meet again.State Department deputy spokesman Mark Toner couldn't say if even Kerry will meet officially with his Iranian counterparts, men he knows well from months of nuclear talks.""We just don't have anything to confirm at this point,"" Toner said.Kerry also met Sunday with Asian allies to discuss North Korea and tensions in the South China Sea as a rising Beijing asserts itself in the region.  Amid all this, the US will be focusing on ""three topline priorities,"" according to Bathsheba Crocker, the State Department's assistant secretary for international organizations, listing ""humanitarian response, peace and security, and countering terrorism and violent extremism.""  Kerry will touch on humanitarian needs at a high-level Monday meeting on refugees. The next day, Obama hosts a Leaders Summit on Refugees.The US announced Wednesday that it will increase the number of refugees it absorbs from 85,000 this year to 110,000 in 2017. And on Friday, the administration said it would give $11 million to a UN fund that helps countries accepting refugees. Waves of people fleeing countries such as Syria, South Sudan and Afghanistan have overwhelmed the international refugee system. Unprecedented strainsAccording to the UN, more than 21 million people are displaced today, half of them children, all of them in need of food, shelter, safety and livelihoods.They are placing unprecedented strains on their host countries, driving the rise of right-leaning anti-immigrant political parties in Europe and becoming a divisive US presidential campaign issue as well.In April, Republican candidate Donald Trump warned a crowd to ""lock your doors"" to stay safe from Syrian refugees, and in June added that ""a lot of those people are ISIS.""Crocker said Obama's leader summit on Tuesday aims to yield ""significant sustained commitments to UN humanitarian appeals, expanded refugee resettlement programs or alternative legal pathways for admission, and new opportunities for refugees and their host communities to benefit from improved refugee access to education and legal employment.""Tuesday will also mark Obama's final address to the UN as president."	UN General Assembly: Leaders tackle world's worst to-do list	['Hassan', 'Israel', 'Clinton', 'Trump', 'Obama']	[]
4	4	http://www.cnn.com/2016/09/19/politics/trump-clinton-egypt-fattah-el-sisi/index.html	"Both Clinton and Trump met with Egyptian President Abdel Fattah el-Sisi Monday, as the grueling presidential contest enters its final weeks.The ""Jon Stewart of Egypt"" takes on Donald TrumpClinton, who served for four years as President Barack Obama's secretary of state, also met with Japanese Prime Minister Shinzo Abe and Ukrainian President Petro Poroshenko.While the stakes are high for both candidates, there is likely more on the line for Trump who, as a foreign policy novice, is still looking to prove his chops before the first presidential debate next Monday.Trump used the meetings to try to convince voters that despite his often explosive personality he is qualified to serve as commander in chief. The key for the blunt businessman is the visuals of the meeting, hoping that voters see a president as they observe him with a world leader.""I will say that with all the folks being in New York, I've had a lot of calls from a lot of different people on the basis that I'm doing well and, you know, they seem to think it's important to maybe meet,"" Trump said Monday on Fox News. ""I don't want to comment specifically on who but a couple of people are coming over.""He later said, ""I've already met with a couple,"" but refused to say which ones.Clinton used the meetings with the three world leaders, in contrast, to stress her facility with high-level diplomacy gained by years of experience on the world stage. Her meetings are also certain to be watched in various parts of the world for signs of how she would direct US foreign policy as president.Clinton addressed prickly topics with each world leader, according to aides in the room. Clinton touched on North Korea and the rise of China with Japan's Abe, while Clinton addressing the need for a more vibrant -- and free -- civil society with Egypt while she met with Sisi.While reporters were in the room, Clinton told Sisi that she looked forward to talking about the ""path we are taking in order to build up a new civil society, a new modern country that upholds the rule of law, that respects human rights and liberties.""Trump also met with Sisi on Monday evening in New York where the two discussed ""the strategic bilateral relationship between the US and Egypt,"" according to a Trump campaign statement after the meeting.Sen. Jeff Sessions of Alabama and Lt. Gen. Michael Flynn (ret.), two of Trump's top foreign policy advisers, joined Trump for the meeting.""Mr. Trump expressed to President el-Sisi his strong support for Egypt's war on terrorism, and how under a Trump administration, the United States of America will be a loyal friend, not simply an ally, that Egypt can count on in the days and years ahead,"" the Trump campaign said.The Republican nominee, who has faced widespread condemnation in the Muslim world for his proposal to ban Muslims from the U.S. and his blanket statements about Islam, also shared his ""high regard for peace-loving Muslims,"" the campaign added.The campaign also said Trump called the US-Egypt relationship ""vital to help promote peace and stability in the Middle East.""Sisi is the second foreign leader Trump has met with since becoming the Republican nominee. He first met with the Mexican president in Mexico last month.Sitting with Poroshenko, Clinton said she was looking forward to talking about the challenges Ukraine faces, primarily ""the very real problems and threats from Russian aggression."" Clinton added that she was ""anxious to know how we can be supportive of those efforts.""Clinton's meetings were announced before Trump's, and a senior advisor to the former top diplomat said Friday that they were less about furthering a political argument than preparing her to hit the ground running immediately if she wins the White House.""If she is elected, she wants to be sure she is prepared (not only) to handle the challenges but to seize the opportunities on Day One,"" said a senior Clinton advisor granted anonymity to talk about her foreign policy views. ""While she has remained a candidate, she is also focused on what it would take to govern if she wins.""The meetings also set up possible contrasts that could pose a challenge for Trump given Clinton's lengthy record on the international stage as both secretary of state and first lady.Trump has tried to shore up his foreign policy credentials before, taking a trip last month to meet Mexican President Enrique Peña Nieto earlier this year.The meeting ended awkwardly after Trump said they never talked about his proposed border wall, but Peña Nieto said he told Trump during the meeting that Mexico would not pay for it.Clinton's campaign seized on the public back-and-forth between the Mexican leader and Trump, with the Democratic nominee calling it Trump's ""embarrassing international incident.""""When you see that he can't even go to a foreign country without getting into a public feud with the president, I think the answer is clear: Donald Trump does not have the temperament to be our commander in chief,"" Clinton told voters in Ohio after the meeting.For her part, Clinton has decided to forgo the standard foreign tour as a candidate because her aides feel she doesn't need to burnish her foreign policy credentials.Instead, she'll take the opportunity afforded in her home state to hobnob with foreign heavyweights -- and try to score political points.Clinton's meeting with Poroshenko, in the eyes of her aides, attempted to highlight the differences between the Democratic and Republican nominee on policy toward Moscow. Clinton's campaign and other Democrats have accused Trump of cozying up to Putin, who has built his foreign policy on thwarting US goals and failing to confront Moscow over its annexation of Crimea in Ukraine.Clinton's adviser said that she believed that Washington needed to do more to stand up to Russian ""aggression"" in Ukraine and to allow the Kiev government to defend itself.Currently, the Obama administration has offered logistical help to Ukraine's armed forces but has fallen short of lethal assistance as some Republicans have championed. The official did not say, however, whether Clinton would move toward lethal aid but said that she would take a look at any requests from the Ukrainians.Clinton's meeting with Sisi will make waves in the Middle East because of the recent estrangement between the Egyptian President's government and the Obama administration.Clinton, according to an aide in the room, ""emphasized the importance of respect for rule of law and human rights to Egypt's future progress"" and ""discussed ways to deepen counterterrorism cooperation, particularly in the fight against ISIS.""Clinton also used the meeting to call for the release of US citizen Aya Hijazi, who has been imprisoned in Egypt since 2014 after operating a non-profit in the country.Clinton's adviser cautioned that the meeting on Monday did not augur any kind of policy change towards Egypt. But nevertheless, the official said, Clinton does understand the complexity and complications of US relations with Egypt, a nation that is pivotal to the balance of power in the Middle East, is facing its own terror threats and would be critical to any renewed effort at Israeli-Palestinian peace.Sisi assumed power following a coup against the elected Muslim Brotherhood government in Egypt in 2013. Clinton had been secretary of state when the US helped push Egypt's longtime strongman Hosni Mubarak from power after a popular uprising, but was seen as less pro-active than other members of Obama's cabinet in cutting loose a crucial, long-standing US ally.""There are a lot of things that the Sisi government is doing that are concerning,"" the official said.Trump's positions on foreign policy, among them on Egypt, are more opaque than those of Clinton. But in his terrorism speech in August, he vowed to work with leaders in the Middle East -- including Sisi -- who ""recognize that this ideology of death"" must be extinguished.Clinton's meeting with Abe comes at a time of increased tensions in Asia following North Korea's latest nuclear weapons test. The meeting will likely highlight Clinton's commitment to US alliances in Japan and South Korea and the US belief that it is up to China to do more to convince its ally in Pyongyang to turn away from its nuclear path.  Clinton, according to an aide, discussed ""the threat from North Korea"" and ""relations with China"" during the meeting. And Abe brought up the Trans-Pacific Partnership, a massive 12-country trade deal that the Japanese prime minister has backed and Clinton has rejected.There is significant concern among US allies the region about the prospect of a Trump presidency -- not least because the GOP nominee has warned that both nations must pay more to keep US forces in their countries and raised the possibility that Pyongyang's growing threat could force both states to develop their own nuclear weapons, a step neither nation wants to take."	Clinton, Trump meet world leaders for very different reasons	['Stewart', 'Clinton', 'Trump', 'Obama']	[]
