	Link	Text	Title
0	http://www.cnn.com/2016/09/23/politics/obama-slavery-8-year-old/index.html	"""I think even most 8-year-olds will tell you that whole slavery thing wasn't very good for black people,"" Obama told ABC News in an interview that aired Friday on ""Good Morning America."" ""Jim Crow wasn't very good for black people. What we have to do is use our history to propel us to make even more progress in the future.""Obama's comments reflected the wide gulf between the President and Trump that came into greater focus this week as race again became a top issue in the 2016 campaign following fatal police shootings of African-American men in Oklahoma and North Carolina. Speaking before a mostly white audience Tuesday in Kenansville, North Carolina, Trump spoke of the need to ""rebuild our inner cities.""""Our African-American communities are absolutely in the worst shape that they've ever been in before. Ever. Ever. Ever,"" Trump said. The speech was part of a high-profile push by the Trump campaign to plug gaps in poll numbers with minority voters, and also to win over white voters turned off by divisive rhetoric from Trump that critics have repeatedly labeled as racist. Still, the effort has stumbled. By proposing the expansion of the controversial ""stop-and-frisk"" program as a way to improve urban policing -- and by engaging in a public re-litigation of the baseless ""birther"" controversy that critics labeled racist -- Trump spent much of the last week doing damage control with the same voters he'd hoped to attract. All the while, Obama has positioned himself as one of Trump's most vocal critics -- and rival Hillary Clinton's biggest cheerleader. Speaking to reporters gathered in the Oval Office last Friday, Obama sarcastically dismissed Trump's ""birther"" capitulation. ""I was pretty confident about where I was born, I think most people were as well,"" he said. ""My hope would be the presidential election reflects more serious issues than that.""And the president made a more earnest effort to rebut Trump when he spoke at the Congressional Black Caucus gala on Saturday, and said that he would consider it a ""personal insult"" to his legacy if black voters didn't turn out for Clinton.Newest absentee, registration numbers promising for Clinton""If I hear anybody saying their vote does not matter, that it doesn't matter who we elect -- read up on your history. It matters. We've got to get people to vote,"" Obama said. ""I will consider it a personal insult -- an insult to my legacy -- if this community lets down its guard and fails to activate itself in this election. You want to give me a good sendoff? Go vote.""At the event, Obama also criticized Trump for using hyperbolic language when discussing African-Americans, and suggested that Trump visit the Smithsonian's new National Museum of African American History and Culture for perspective. ""You may have heard Hillary's opponent in this election say that there's never been a worse time to be a black person. I mean, he missed that whole civics lesson about slavery or Jim Crow,"" he said. ""But we've got a museum for him to visit, so he can tune in. We will educate him.""Obama speaks at the museum's opening Friday. "	Obama on Trump: 'Even most 8-year-olds' know slavery was a bad time for black people
1	http://www.cnn.com/2016/09/23/politics/ted-cruz-endorses-donald-trump/index.html	"""After many months of careful consideration, of prayer and searching my own conscience, I have decided that on Election Day, I will vote for the Republican nominee, Donald Trump,"" Cruz wrote in a Facebook post.""A year ago, I pledged to endorse the Republican nominee, and I am honoring that commitment. And if you don't want to see a Hillary Clinton presidency, I encourage you to vote for him.""""I am greatly honored by the endorsement of Senator Cruz,"" Trump said in a statement obtained by CNN. ""We have fought the battle and he was a tough and brilliant opponent. I look forward to working with him for many years to come in order to make America great again.""The move -- three days before Trump's critical first debate with Clinton -- comes as the Trump and Cruz camps have moved closer in recent weeks.Trump's vice presidential nominee Mike Pence played a key role in bringing Cruz into the fold. Pence and Cruz traded multiple messages, then spoke at length once on the phone and again in person, when Pence visited Capitol Hill a few weeks ago, a source close to Pence said.Ted Cruz fast factsTrump has hired key Cruz allies such as Kellyanne Conway as his campaign manager, and Jason Miller as a spokesman. Wednesday, Trump's campaign expressed support for a Cruz-backed, Internet-related proposal in government funding talks in the Senate. Friday, Trump released a new list of conservative judges likely to appeal to the former Supreme Court clerk -- including perhaps Cruz's closest friend in Congress, Utah Sen. Mike Lee. Cruz cited Trump's pledges on the judiciary in his Facebook post. ""We know, without a doubt, that every Clinton appointee would be a left-wing ideologue. Trump, in contrast, has promised to appoint justices 'in the mold of (the late Antonin) Scalia,' Cruz wrote. ""For some time, I have been seeking greater specificity on this issue, and today the Trump campaign provided that, releasing a very strong list of potential Supreme Court nominees — including Sen. Mike Lee, who would make an extraordinary justice — and making an explicit commitment to nominate only from that list.""A Cruz endorsement could be the last pillar to helping Trump shore up the support of conservatives who have remained reticent about supporting his campaign.Trump has already gotten most Republicans and conservatives on board with his campaign -- largely by reassuring them on the Supreme Court and on issues like the Second Amendment and abortion. But Cruz's principled opposition to offering his support has given some conservatives high-profile cover.Just as Cruz's refusal to endorse Trump at the RNC fueled Democrats' efforts to paint Trump as divisive even within his own party, Cruz's endorsement will help undermine that narrative -- suggesting to conservatives unsure about Trump that perhaps the brash billionaire has changed, and can be trusted to bring conservative change to Washington.'Lyin' Ted' and 'utterly amoral'The move marks a dramatic turnaround from the personal insults Cruz and Trump traded during the previous year.The two men clashed repeatedly during the primaries, as Trump taunted the senator with the nickname ""Lyin' Ted,"" suggested Cruz wasn't eligible to be president due to his Canadian birthplace, and even speculated that Cruz's father was involved in the JFK assassination. Trump also said Cruz should ""be careful"" or he would ""spill the beans on your wife,"" and retweeted an unflattering picture of Heidi Cruz. Those tweets have not been deleted from Trump's account.On his last day of the GOP campaign -- the Indiana primary in early May -- Cruz let loose against Trump, calling the businessman a ""serial philanderer,"" ""utterly amoral,"" and ""a narcissist at a level I don't think this country's ever seen. At the RNC in Cleveland, Cruz gave a memorable speech espousing conservative values but ended without endorsing Trump, as Trump allies booed from the convention floor. ""Don't stay home in November,"" Cruz said. ""Stand and speak and vote your conscience.""The next day, he defended the move by citing Trump's attacks against his family. ""I'm not in the habit of supporting people who attack my wife and attack my father,"" Cruz told members of the Texas delegation. ""That pledge was not a blanket commitment that if you go and slander and attack Heidi that I'm going to nonetheless come as a servile puppy dog and say, 'Thank you very much for maligning my wife and maligning my father.'""After the convention, Trump said that he would not accept Cruz's endorsement if he offered it.""I don't want his endorsement. If he gives it, I will not accept it, just so you understand. If he gives it I will -- I will not accept. It won't matter. Honestly he should've done it because nobody cares and he would've been in better shape for four years from now,"" Trump said.Facing Senate primary in 2018?Cruz's move may also be politically expedient. He faces a possible 2018 Senate primary challenge from Texas Rep. Michael McCaul, the chairman of the House Homeland Security Committee, who has increasingly made an issue of Cruz's failure to endorse Trump. Republican National Committee Chairman Reince Priebus has said Republicans who don't back Trump could pay a price down the road. And Trump also floated the idea of setting up a super PAC to oppose Cruz if he decided to run for office again.Clinton's campaign, after Cruz's message posted on Facebook, was happy to note a number of shots Cruz took at Trump during the primary, including when he called on the businessman to release his tax returns.Clinton's official twitter account retweeted a tweet Cruz sent during the primary that said, ""I've released 9 years of tax returns. RT if you agree it's time for Donald Trump to release his!""Clinton's campaign has been hounding Trump to release his taxes, arguing that he isn't doing so because they show shady business deals and ties to Russia. Trump has said he would release his taxes after an IRS audit.Clinton's vice presidential nominee Tim Kaine, campaigning in Austin, Texas, Friday, said he couldn't support someone who used the same language Trump did about Cruz's father.""I just can't help but say this,"" Kaine said. ""Donald Trump suggested that Ted Cruz's dad was involved in the JFK assassination. Now we know that that is false, but false isn't, there's not the right word to describe what that is. It is so outrageously false. And as far as I know Donald Trump has not retracted it. As far as I know he has not apologized for it. And so if somebody said that about my dad they would never have me as a supporter for anything.""Radio host Steve Deace tweeted his disappointment, calling the move a mistake and speculating that Cruz backers may not all follow the senator. ""I think it's the worst political miscalculation of my lifetime. I hope I am wrong. The people will decide that,"" Deace tweeted."	Ted Cruz endorses Donald Trump
2	http://www.cnn.com/2016/09/23/politics/cuba-ballet-chicago-dancer-havana/index.html	"She arrived, ready for her adventure in Havana a day after commercial flights from the US to the communist country started back up last month. ""I feel incredibly honored to be the first American to come here (to train) and symbolize the two countries coming together,"" she told CNN. ""A few years ago -- even last year -- this wouldn't have been possible.""Conley, who graduated from high school last spring, is the first American since U.S. and Cuba moved toward normalized relations to study at the world renowned National School of Ballet in Havana. She will train with some of the best dancers her age and she's put college on hold to do it.Conley has been dancing since she was a child and trained at the Ruth Page Center for the Arts in Chicago. During a visit to the US the director at Cuba's national school of ballet saw Catherine dance and she was impressed.Ballet is considered one of Cuba's greatest exports -- classes are subsidized by the Cuban government -- and Conley said there is even a television channel dedicated to the form of dance that all Cuban citizens can watch.Cuba has produced some of the most famous ballerinas in the world -- including Alicia Alonso, who founded the National School of Ballet.""I love the culture here,"" Conley said. ""The kids here enter into the school to become ballet dancers. They're not doing it for a hobby so therefore the training is really, really intense.""Conley said she hopes she will be the first of many ballet students to come and train in Havana with the National School of Ballet.""(The people at the school) have been so open and welcoming,"" she said. ""I think that's reflective of where the two countries are looking to go.""CNN was not allowed access to the ballet school during a trip there.Cuban ballerina Xiomara Reyes, who leads the Washington School of Ballet, said the art form shouldn't be political when it comes to the rocky relationship between the United States and Cuba.""I don't think ballet should be political,"" Reyes said. ""We are actually an art form that doesn't have words."""	American ballerina to spend year in Cuba training ballet
3	http://www.cnn.com/2016/09/23/politics/jill-stein-op-ed-debates/index.html	"In USA Today, Stein urged that all four presidential candidates -- herself, Johnson, Hillary Clinton and Donald Trump -- should be on the stage for the debates: ""every candidate who would win a majority of the electoral college."" She cited the growing appeal of independent candidates and seized on voters' displeasure with the major parties' options in 2016.""Democrats and Republicans nominated the two most unpopular candidates in history, both parties are shrinking, and the largest group of voters are independents. Four candidates should be included,"" she wrote. Stein also sharply condemned what she called efforts by the parties to ""silence their competition.""""The Democrats and Republicans should not exclude their competitors,"" the Green Party candidate wrote. ""The debate commission is a deception created by the parties to keep competition out. It undermines democracy for two parties to silence their competition.""Stein also rebuked Clinton and Trump and sought to cast herself as the only candidate discussing key issues like climate change and college affordability, even arguing that ""only I discuss systemic racism.""Stein missed the cut for the first presidential debate, failing the reach the requisite 15% polling average in surveys approved by the presidential debate commission. At the time of the cut, Stein's average was 3.2%. Johnson, also excluded, averaged 8.4% support.  "	Jill Stein on debates: Let me in!
4	http://www.cnn.com/2016/09/23/politics/syria-kerry-russia-action-call/index.html	"""We exchanged some ideas and we had a little bit of progress,"" Kerry said of the meeting. ""We're evaluating some mutual ideas in a constructive way.""  A senior State Department official characterized the conversation, which took place on the sidelines of a meeting of the Middle East Quartet, as brief and informal, but added that it was a ""constructive discussion.""""We have no proposals to read out,"" the official said. A frustrated Kerry called on Thursday for ""immediate"" and ""significant"" action from Russia and Syria to prove their commitment to a ceasefire agreement reached this month.""We can't be the only ones trying to hold this door open,"" the US secretary of state said. ""Russia and the (Bashar al-Assad) regime must do their part.""Otherwise, Kerry said, there's ""no chance"" for the process to continue. Addressing the media from a podium at the Palace hotel in New York, where he is attending the United Nations General Assembly, Kerry opened by noting reports of a regime offensive in Aleppo, which he said is ""exactly the kind of regime action that has done so much damage to this process and to the credibility of the concept of restraint or cease fire.""""Obviously no one can possibly be satisfied with the events that have unfolded in the last few days,"" Kerry said. ""Far, far from it.""""Absent a major gesture, we don't believe there is a point in making more promises,"" he insisted, suggesting the US was on the verge of scrapping the agreement if it didn't see a cessation of air activities by the Russian and Syrian militaries, or similarly concrete action.But Kerry insisted the US is committed to seeking a resumption of the ceasefire and would be meeting with Lavrov and member nations of the International Syria Support Group in the coming days.""We remain absolutely convinced there is no such thing as a military solution,"" Kerry said.A senior administration official told reporters in a conference call that Russia would need to take ""extraordinary steps"" to get the process back on track.""We are not sure at this point whether they are ready and willing to take those kinds of steps.""After the meeting with Kerry on Friday, Lavrov addressed the United Nations General Assembly, saying diplomatic discussions on Syria must be restarted ""without any preconditions.""But Lavrov blamed the disruption of the agreement on ""sabotage"" by ""specific people from abroad with their mentors and supporters,"" seemingly a rebuke of the United States and its coalition partners.Russia believes ""the reason lies in an attempt to try to change the regime,"" Lavrov added."	"Kerry calls for 'immediate action' from Russia and Syria Kerry calls for ""immediate"" and ""significant"" action from Russia and Syria"
5	http://www.cnn.com/2016/09/23/politics/critical-counties-wake-north-carolina-raleigh/index.html	"Few counties could prove more decisive in this election than Wake County, North Carolina. A historically competitive county whose fortunes are on the rise, Wake could help deliver Hillary Clinton a win in a key battleground state -- or dash her hopes for the presidency. Simply put, if Clinton performs well in the highly educated research triangle, then election night bodes well for her. If Wake County doesn't come out for Clinton, Donald Trump's path to the White House would grow much clearer.The county is rapidly expanding, and the influx of new people and industries could reshape the race. Meanwhile, the turmoil across the state in Charlotte after a police officer shot and killed a black man could add another focal point in the election — search data from Google Trends shows Wake County's spiking interest in ""police brutality"" this week.Keep your eye on Wake County, and take a look at the fundamentals below.PopulationNew in townRepresentationPopularityTop searchesWho's searching?TrendingSearches by candidate"	Critical counties: Wake County, NC, could put up a fight
6	http://www.cnn.com/2016/09/23/politics/ohio-voters-federal-appeals-court/index.html	"The ruling by the Sixth Circuit Court of Appeals is a victory for the American Civil Liberties Union of Ohio and other groups who had argued the program violated the National Voter Registration Act and expressed concern that the purge would effect ""many thousands"" of Ohio voters. They hope the lower court will move quickly to direct that names that were improperly removed should be put back on the voting list or that voters not on the list be allowed to file a provisional ballot.The appeals court said that Ohio's so-called ""Supplemental Process,"" where ""a voter is purged from the rolls after six years of inactivity -- even if he or she did not move and otherwise remains eligible to vote,"" is in violation of the NVRA.""We are very happy that the court found that (Secretary of State Jon Husted's) process of purging voters in Ohio is illegal and must stop,"" Mike Brickner, Senior Policy Director at the ACLU, said in a statement. ""We don't believe that any voters should be removed from the rolls simply because they haven't voted in a few elections.""Friday's ruling reverses a district court ruling that had gone in favor of Secretary of State Jon Husted. The lower court had held that Ohio's ""public interest is being served"" and that the ""procedures of maintaining the voter registration rolls ensure the integrity of  the election process. ""In a statement, Husted said the ruling ""overturns 20 years of Ohio law and practice, which has been carried out by the last four secretaries of state, both democrat and republican.""He questioned how the lower court -- charged with finding an appropriate remedy -- will proceed.""It is one thing to strike down a longstanding procedure; it is another to craft a workable remedy. To that end, if the final resolution requires us to reinstate voting eligibility to individuals who have died or moved out of Ohio, we will appeal."""	Federal appeals court: Ohio's removal of voters violates law
7	http://www.cnn.com/2016/09/23/politics/tim-kaine-libertarian-ticket/index.html	"""The argument against the ticket is, I think, everybody knows that they're not going to win,"" Kaine said of the Gary Johnson and Bill Weld Libertarian ticket in an interview with Yahoo News' Katie Couric this week. Hillary Clinton's running mate pointed to the 2000 election as evidence that a protest vote for a third-party candidate can affect the outcome of the race -- and history. RELATED: Gary Johnson: Running mate Bill Weld not dropping out""My argument against the (Johnson-Weld) ticket is the Al Gore-George W. Bush race in 2000. The third party candidacy of Ralph Nader cost Gore electoral votes in New Hampshire and Florida. And if Gore had been president, we probably wouldn't had a war in Iraq,"" he said. ""Casting a vote, a protest vote, for a third-party candidate that's going to lose may well affect the outcome. It may well lead to a consequence that is deeply, deeply troubling. That's not a speculation, we've seen it in our country's history."" RELATED: Johnson, Stein fail to qualify for first debateAs the race tightens nationally and in key swing states, Kaine cautioned against a protest vote, but acknowledged he and Clinton need to make that case to voters who may be considering Johnson. ""We're going to make the affirmative case for Hillary, we're going to draw the contrast with Donald Trump, but we're also going to tell people, the way you make a difference to your nation is not by doing a protest vote. It's picking the next leader of the country."" RELATED: National poll: Clinton leads Trump by 6 ahead of debate"	Tim Kaine on Libertarian ticket: 'Everybody knows they're not going to win'
8	http://www.cnn.com/2016/09/23/politics/donald-trump-debate-prep/index.html	"A source familiar with his preparations described Trump's preparation, which has been described as far more minimal than Clinton's, who is currently off the campaign trail to practice before the highly anticipated, nationally broadcast event. Trump has huddled with his closest advisers in his prep session, including Republican National Committee Chairman Reince Priebus, who sat in on last weekend's meeting, the source said. Priebus will join Trump again this weekend.Clinton is similarly watching tape of Trump's Republican primary debates, according to several people familiar with her debate preparation. She took notes on what agitated him, particularly in his exchanges with rival Ted Cruz, and studied his style.To knock Trump off his game, people advising Clinton have been looking for a one-line retort that will be a memorable moment from the contest.But Democrats worry the first debate will give Trump a chance to show a more moderate, controlled side, while millions of people watch, possibly for the first time. This, according to people who have recently talked with the former secretary of state, is not lost on Clinton. Earlier this week, a top Trump aide mocked Clinton's extensive preparations for Monday's debate in an internal campaign memo.""These are hallmarks of a career politician who has spent too much time seeking and clinging to power,"" Trump spokesman Jason Miller said in the memo. ""He's not rehearsing canned 30-second soundbites or spending hours in the film room like an NFL player. He will be prepared, but most importantly, he will be himself,"" Miller added. In contrast to those lowered expectations set by Trump's staff, the GOP nominee may have raised the bar for himself by poking fun at Clinton's debate preparations at a rally in Pennsylvania Thursday night, suggesting she is still recovering from her recent bout with pneumonia.""Well they say she's been practicing for the debate. Some people think she's sleeping,"" Trump quipped at the event."	Trump watching highlight reels of Clinton to prep for debate
