	Unnamed: 0	Link	Text	Title	Terms	Topics
0	0	http://www.cnn.com/2016/11/17/politics/donald-trump-transition-works-to-right-ship/index.html	"On Thursday afternoon, the White House confirmed it had received necessary paperwork from the Trump transition to allow staff members to begin moving into key federal agencies as part of the process to prepare to take over the government, a step that had been stymied by confusion about who would be leading the effort. Who could be in Trump's CabinetTrump teams for the Defense, State and Justice departments, as well as the National Security Council, have begun to reach out to their Obama administration counterparts, a transition aide and the White House confirmed. The transition team expected to identify those individuals on their website on Friday morning.  Meanwhile, former Trump campaign manager Kellyanne Conway was actively directing individuals meeting with the President-elect in Trump Tower to speak with reporters gathered in the lobby, all of them delivering a message that things were moving along nicely. Trump met with Japanese Prime Minister Shinzo Abe, South Carolina Gov. Nikki Haley and former Secretary of State Henry Kissinger, among others.On Saturday, Trump will meet with former GOP presidential nominee Mitt Romney -- a discussion fueling speculation about a possible nomination as secretary of state.The process of landing teams had formally been held up by paperwork. The White House needed the transition to provide names of the individuals who would be moving into agencies and have those people make certain declarations regarding a code of conduct and conflict of interest policy. That had been delayed by the change in leadership of the transition last week from Chris Christie to Mike Pence and a new anti-lobbying policy installed early this week.Slowing things down The beginnings of normalcy came after a week of confusion within the transition brought on by Trump's surprise win.  Trump himself and his inner circle of advisers had paid no attention to the work that former transition chairman Christie had been supervising for months prior to the election, and discovered on Thursday after a meeting with the New Jersey governor that they were not satisfied with the results, senior Republican and transition officials told CNN.On Friday, the transition announced it moved Christie to vice chairman, along with other key Trump surrogates and advisers from the campaign, and declared Vice President-elect Mike Pence as chairman and the former chief of staff to Sen. Jeff Sessions, Rick Dearborn, as the executive director, replacing a close Christie ally. They moved very quickly to announce Republican National Committee Chairman Reince Priebus as Trump's White House chief of staff and former Breitbart and campaign executive Steve Bannon as a senior adviser. Initially, the team felt announcements about further personnel had to come quickly. But late last week, they realized that time was needed to get organized and figure out how they would search and vet people beyond the inner circle, the sources said.  The decision was made to slow things down and get a process in place. Sources: Kushner at the center of Trump team 'infighting'Reaching out to RepublicansPart of the strategy established was to take a wider look at candidates beyond inner circle loyalists to see who Trump might be comfortable with to round out a Cabinet.  As with any transition, time was also being taken to vet possible candidates and screen for potential confirmation trouble before naming any names. Another part of the redirection was a strategy to reach out to people who did not support Trump to show that he is unifying the party. Now, sources say, there is a more organized search to talk to candidates beyond the inner circle and establish protocols and  procedures. The sources point to the parade of more establishment-oriented Republicans like Haley, former Texas Gov. Rick Perry and a scheduled weekend meeting with Mitt Romney -- who spoke forcefully against Trump through the election. The transition team has begun holding daily press briefings with the media to update the press and tamp down confusion, in addition to making insiders available in Trump Tower.The first time there was a printed agenda was at one of the first senior staff meetings Sunday evening, a transition official said. The gesture was seen as a message to everyone that there needs to be an order first before moving to the big things.  Confusion at the outsetChristie had been chairman of the transition leading up to the election and had built out a robust team of staff dedicated to agency engagement, policy development and developing and vetting a cabinet.But on the Thursday after the election, the Trump team met with Christie to go over the transition memo, which included staffing and cabinet positions for the President-elect's administration. Trump's team considered the memo a non-starter because it reflected the Washington establishment, including lobbyists, a source said.Christie was called in on Friday, demoted and marginalized. He was told that this did not reflect the future Trump administration -- that it wasn't what Trump campaigned on and it didn't ""drain the swamp.""It was after that meeting that Pence was elevated to take charge of the transition and effectively was put in a position to start all over.Pence on Tuesday moved to ban lobbyists from the transition -- though it was initially unclear in the first few days what that meant.  Trump transition delays cause confusion in WashingtonCNN obtained an organizational chart of the transition's staff from before the announcement, and at least eight agency leads had been a registered lobbyist, though some had already been let go of the transition for other reasons. On the policy side of the transition, a review of the chart showed that eight out of 17 names listed had been registered lobbyists at one time.On Thursday, transition officials told the press that lobbyists on the transition were being asked to sign affidavits that they had deregistered as lobbyists before they could continue working with the transition, and that any former lobbyist that joined the administration would be prohibited from lobbying for five years after leaving the transition. But not all sources familiar with the transition said the narrative was entirely accurate.Trump himself defended the lobbyists serving with his transition in a ""60 Minutes"" interview on Sunday. ""That's the only people you have down there,"" when asked about the number of lobbyists on his transition. ""Everybody's a lobbyist down there ... But everybody that works for government, they then leave government and they become a lobbyist, essentially. I mean, the whole place is one big lobbyist.""He said the goal would be to end the system over time, adding: ""I'm saying that they know the system right now, but we're going to phase that out.""Focus on Christie's roleA source close to Christie and the transition said the early transition process didn't have a choice but to hire lobbyists, and that Christie was a convenient fall guy to blame. The source said some Washington Republicans who joined the transition pre-election were making sort of ""back-door bets"" to ""hedge"" their future, meaning they could work on the plans for the Trump administration without tying their career to his campaign. ""That backfired,"" the source said, meaning the individuals involved are now being forced to choose between their current job status and continuing work on the transition and, possibly, the administration. The phenomenon of Republicans wanting to have it both ways with Trump, and a ""paucity of people to pick"" from, led to many lobbyists being on the team. Thus Christie had an ""imperfect situation to work with which was in conflict with the campaign post-election,"" the source said. That is being ""reconciled"" now, the source added. Leaks that Christie was pushed out because of lobbyists' involvement came after reports that Trump's son-in-law Jared Kushner was rubbing allies the wrong way in efforts to purge the transition team of Christie associates, per other sources. The source close to Christie said it could be strategic to spin a narrative that Christie was too reliant on lobbyists and not delivering, saying, the story ""has been leveraged to deepen the wound -- particularly in the New York media market.""Christie himself, once rumored to be a leading contender for a number of Cabinet positions before convictions were handed down to some of his former top aides in the Bridgegate trial, said Thursday he would not be serving in the administration. ""For everyone worried about what I'm going to do, and what job I should take and where I should live -- let me give you all an update. I have every intention of serving out my full term of governor and I have no reason to believe as we stand here today that I will do anything other than serve out my full term as governor,"" Christie said in a news conference in New Jersey on Thursday."	Inside the Donald Trump transition overhaul	['Perry', 'Trump', 'Haley', 'Romney', 'Christie', 'Pence', 'Obama']	[]
1	1	http://www.cnn.com/2016/11/18/politics/conservative-lawyers-cheer-trump-scalia-replacement/index.html	"What a difference a few weeks makes. The subject of the conference, sponsored by the conservative Federalist Society, was the jurisprudence of the late Justice Antonin Scalia. But the talk in the hallways was devoted to the unexpected election results and the pending Supreme Court nomination -- expected to be a conservative who would continue Scalia's legacy. Indeed, several of the judges Trump is considering for the Supreme Court were milling about in the hallways, dodging journalists and moderating various panels. ""It's not the wake we thought it was going to be,"" said Randy Barnett, a professor of Georgetown law who was an architect of the first legal challenge against the Affordable Care Act.The Republican blueprint for Supreme Court nominations John Malcolm of the conservative Heritage Foundation said that when he was planning to come to the conference a few weeks ago, he thought the lawyers might join together to ""commiserate"" Clinton's win. Instead, he said, ""we are here to celebrate."" Luther Strange III, the attorney general of Alabama spoke about the dozens of lawsuits he and other Republican state attorneys general filed against the Obama administration in areas such as immigration, transgender rights and the Clean Power Plan. ""We are no longer the last line of defense,"" Strange said. ""We are now the spear."" The annual event, always popular, held several panels with standing room only crowds. Malcolm pointed to attendees wearing lanyards attached to event ID cards and joked that some of the people populating the rooms should have their resumes attached to the lanyard. ""Many are surprised that they have a shot at a position in government,"" he said. Leonard Leo, executive vice president of the Federalist Society, met with Trump in New York on Wednesday. After that meeting, Leo offered few clues to the gathered journalists outside of Trump Tower. ""I would say that he's looking for someone who is independent, courageous, smart, very high quality,"" Leo said. He added that he thought Trump would move forward ""as swiftly as he can to make sure that the court's full 9-member bench is restored."" The Republican blueprint for Supreme Court nominationsTrump has often repeated that he will seek a nominee in Scalia's mold to take the seat. He's released a list of 21 potential successors -- all of whom are very conservative. Of that list, a short list is already being circulating in judicial circles emphasizing two qualities: a commitment to principles of limited government and experience outside of Washington. ""All the people who I know on the short list are going to be sympathetic to interpreting the Constitution according to its original meaning,"" said Barnett. Ilya Shapiro, who works for the libertarian Cato Institute noted that the event would have been very different had Clinton won. ""It's cautious optimism now,"" he said. ""We dodged one bullet, and things should go in the right direction now."" Judges Diane Sykes, William Pryor, Thomas Hardiman, David Stras and Joan Larsen moderated panels but they kept their comments to Scalia's jurisprudence. In his remarks Thursday morning, Alito highlighted his late colleague's contributions, not only in the areas of constitutional interpretation and the structure of government, but also Scalia's impact on hot button issues such as the Second Amendment and freedom of religion. ""We've had 26 argument days"" since Scalia's death, Alito said. ""On every single one of them there has been a palpable emptiness."" Thomas was more forward-looking in a speech Thursday evening. Reading through some of Scalia's most well-known opinions, Thomas suggested that his late colleague's words should carry on.""Justice Scalia has done his part,"" Thomas said. And then he charged the audience with the responsibility of ensuring ""that these words spoken and written by Justice Scalia"" not be ""the final words.""""Rather, they ought to be a prologue,"" he said."	Conservatives consider Antonin Scalia's replacement	['Larsen', 'Clinton', 'Trump', 'Obama']	[]
2	2	http://www.cnn.com/2016/11/18/politics/jd-vance-trump-appointment/index.html	"""I don't think people are going to be concerned about this back home,"" said J.D. Vance, a former Marine and Yaw Law School graduate who wrote ""Hillbilly Elegy,"" a memoir of his childhood in a poor town in rural Ohio.Where he's from, Vance said, ""People don't pay that much attention to the day-to-day politics.""""I think what Trump will be judged on by the folks that voted for him ... is whether things start to get a little bit better over the next few years. And ultimately that doesn't depend on whether Jeff Sessions is the attorney general,"" he said, referring to the President-elect's decision that the senator from Alabama should lead the Justice Department.Trump announced his nominations Friday for top national security posts, proposing Sessions as attorney general, US Rep. Mike Pompeo of Kansas as CIA director and retired Army Lt. Gen. Michael Flynn as national security adviser.Vance noted that Trump had ""rewarded the loyalists"" with his appointments so far.""But that list is getting shorter by the day,"" Vance said.""Unless he wants to appoint (his daughter) Ivanka as secretary of defense, he's got to start expanding beyond the circle,"" he added."	Trump voters not concerned about Cabinet picks, author J.D. Vance says	['Trump', 'Pompeo']	[]
3	3	http://www.cnn.com/2016/11/17/politics/donald-trump-nuclear-codes/index.html	"Just like his predecessors, whether he is at the White House, in a motorcade, aboard Air Force One or on a trip overseas, he will never be more than an arm's reach away from the aide and his satchel.""You have to be ready anytime, for any moment,"" said Pete Metzger, who often carried the nuclear launch suitcase during Ronald Reagan's presidency. ""The time is so short between alert and execution.""Less than 15 minutes in the case of an emergencyTrump, like other presidents before him, could have less than 15 minutes in the case of an emergency to get briefed by military aides and make a decision on whether to order a nuclear strike.""Donald Trump will have the unfettered ability to wage nuclear war,"" said Joseph Cirincione at The Ploughshares Fund, an anti-nuclear organization. ""He can launch one weapon or a thousand weapons, and no one can stop him, outside of mutiny by the armed forces.""Contrary to popular mythology, the ""nuclear football"" does not contain a button but instead the equipment and the decision-making papers that Trump would use to authenticate his orders and launch a strike.The Presidential Emergency Satchel, as it is formally called, contains four things, according to former White House Military Office Director Bill Gulley's book ""Breaking Cover.""There is a black book listing a menu of strike options; a 3-by-5-inch card with authentication codes for the president to confirm his identity; a list of secure bunkers where the president can be sheltered; and instructions for using the Emergency Broadcast System.On Inauguration Day, the aide with the satchel will arrive at the swearing-in accompanying President Barack Obama, and after the ceremony, will accompany Trump. Trusting Trump with nuclear codesNot everyone is comfortable with the prospect.""How can you trust him with the nuclear codes?"" Obama said at a rally in Durham, North Carolina, earlier this month. ""You can't do it.""And Bruce Blair, a former nuclear missile launch officer who supported Hillary Clinton, says his concerns about Trump persist. ""He has proved himself over and over again to be quick-tempered, defensive, prone to lash out,"" he wrote in Politico. If a nuclear crisis arises, ""Trump's erratic and volatile personality makes for low confidence in his ability to reach the right decision.""A president's order could only be stopped by mutiny, according to Kingston Reif at the Arms Control Association, and only if more than one person were to disobey the president's orders.""The president has supreme authority to decide whether to use America's nuclear weapons, period,"" he said. ""Full stop.""Trump's transition team did not respond to an inquiry to clarify his nuclear policy. But his rhetoric on the campaign trail may have fed the concerns of his national security critics.""Somebody hits us within ISIS, you wouldn't fight back with a nuke?"" he said to Chris Matthews on MSNBC in March.But he was more tempered during an interview on NBC's ""Today"" show in April. ""I will be the last to use it. I will not be a happy trigger, like some people might be,"" he said.Trump's stance on Iran worries proliferation expertsStill, Trump's disdain for the agreement with Iran to limit their nuclear program has worried proliferation experts, as has his stated openness to allies like Japan obtaining nuclear weapons of their own if they refuse to contribute more to American military protection.""Wouldn't you rather in a certain sense have Japan have nuclear weapons when North Korea has nuclear weapons?"" he said to CNN in March.A few days later, he walked that back -- but only partially.""I would rather have them not armed,"" he said at a rally in Wisconsin. ""But I'm not going to continue to lose this tremendous amount of money. And frankly, the case could be made that, let them protect themselves against North Korea.""Cirincione said that Trump is undermining a decades-long American stance against nuclear proliferation. And by making America's defense of allies like South Korea and Japan contingent on their paying more to the US, he said, Trump may prompt nervous allies to wonder whether they need to obtain nuclear weapons systems of their own.""The president of the United States must be absolutely clear that we do not want them to do that,"" he said. ""That is not the path to security.""Metzger said that, in his experience at least, the president takes the responsibility of the nuclear codes very seriously.""The president is well enough rehearsed in these things to know, if I come in and look them in the eye, he or she knows there's something going on. I'm not coming in to order breakfast,"" he said.""The result of a decision the president would make is so grotesquely horrible -- it would change the face of the earth, it would change humanity, it would change mankind."""	Wherever Trump goes, nuclear 'football' to follow	['Trump', 'Obama']	[]
4	4	http://www.cnn.com/2016/11/18/politics/donald-trump-drain-the-swamp/index.html	"That's because they've heard and seen this before.""I am in this race to tell the corporate lobbyists that their days of setting the agenda in Washington are over,"" then-Sen. Barack Obama said in November 2007. His administration put a two-year ban on lobbying post-service.In 2016, Trump channeled the same anger against Washington and is proposing to build on the same policies Obama instituted. ""Every day you turn on the nightly news, you hear about how some self-interested banker or some Washington insider says they oppose the Trump campaign. That's because I don't need them. I don't want them. I'm going to do what's good for you,"" Trump said in Akron, Ohio, in August. ""Or some big-time lobbyist says they oppose Donald Trump's campaign. Because I don't want the lobbyists. I've had plenty of lobbyists. They do a good job. They give you whatever you want. I wear their opposition as a badge of honor.""The announcement the President-elect would ban administration officials from returning to lobbying for five years after they leave government sent shockwaves through the influence industry on Thursday, even if the exact definition of ""lobbyist"" wasn't given.The move, along with a lifetime ban on lobbying for foreign governments, immediately introduces another disincentive for an administration already struggling to retain top talent and raises the prospect of a vibrant lobbying industry that hums along as well as ever — but underground and hidden from disclosure, not eradicated.The chaser: as under Obama, the swamp need not be drained, merely sprayed with Febreze.""The swamp is so deep in Washington that simply saying that there are some people who can have jobs in the administration but can't cash in for five years is such a weak response to the pretty significant message that America just delivered last week,"" said David Donnelly of Every Voice, one of the many good-government groups split by the new Trump guidelines. ""If this is the only thing he did, they will see that nothing has changed.""Transition officials said Wednesday that they would expand upon Obama's executive order which forbid administration officials from registering as lobbyists for two years after serving him, a rule that many influence-peddlers today say has done little to actually curb ethics breaches or impact K Street. The Trump aides added Thursday that the new policy would apply to officials looking to work for overseas governments, too, for their entire lives.Yet the worry among lobbying officials on Thursday wasn't that they would suddenly be out of a line of work. The five-year ban would merely redouble their resourcefulness as they search for workarounds that allow them to not technically classify as ""lobbyists"" once leaving the administration but rather to occupy some other very similar role in Washington officialdom.""People will escape: 'I'm a grassroots person.' 'I'm a digital person.' 'I'm this or that.' But you're actually doing the same thing I'm doing,"" said Paul Miller, a leader for a Washington lobbying trade group. ""If you implement this, you're going to have a chilling effect.""Miller said he was already fielding conversations on Thursday from concerned lobbyists worried about the emergence of a ""shadow lobbying community"" that operates free from disclosure laws meant to shine a spotlight on how influence is created and wielded in Washington. Miller said he had contacted Trump Tower on behalf of the lobbying industry but had not fetched a response.He chalked the move up to pure politics.""I have to question the motives. You had a campaign that at the 11th hour in October decided to pull out ethics reform,"" Miller argued, who said his worries spiked this week when the transition team purged its corps of lobbyists, even though they sorely needed the experience. ""You better not be skeptical. You better take this as a real threat — not just this. We are a target.""Questions remain outstanding: How will officials enforce a five-year-ban that theoretically could outlast a one-term president? Will the administration monitor and penalize lobbyists who de-register in order to avoid the stricter guidelines? And how will Trump learn from Obama, who came into Washington preaching hope and change but largely disappointed ethics-reformers who dreamed of a gridlock-free government?""They were worthy of praise, but at the same time it became pretty apparent over the next eight years that there were big holes,"" said Paul Ryan, a prominent Washington ethics reformer, of the Obama platform points. ""I would not call this cosmetic. I would say this is one small step."""	Can Trump actually drain the swamp? The answer is murky	['Paul', 'Obama', 'Donnelly', 'Trump']	[]
