	Link	Title	Text
0	https://www.washingtonpost.com/national/trump-reassuring-the-world-hes-focusing-on-foreign-policy/2016/11/17/94fea478-ad23-11e6-8f19-21a1c65d2043_story.html	Pushing US policy rightward, Trump taps Sessions and Flynn	" NEW YORK -- President-elect Donald Trump signaled a sharp rightward shift in U.S. national security policy Friday with his announcement that he will nominate Alabama Sen. Jeff Sessions as attorney general and Kansas Rep. Mike Pompeo to head the CIA, turning to a pair of staunch conservatives as he begins to fill out his Cabinet. Trump also named retired Lt. Gen Michael Flynn as his national security adviser. A former military intelligence chief, Flynn has accused the Obama administration of being too soft on terrorism and has cast Islam as a ""political ideology"" and driver of extremism. Sessions and Flynn were ardent Trump supporters during the campaign, and their promotions were seen in part as a reward for their loyalty. The selections form the first outlines of Trump's Cabinet and national security teams. Given his lack of governing experience and vague policy proposals during the campaign, his selection of advisers is being scrutinized both in the U.S. and abroad. Trump's initial decisions suggest a more aggressive military involvement in counterterror strategy and a greater emphasis on Islam's role in stoking extremism. Sessions, who is best known for his hard-line immigration views, has questioned whether terror suspects should benefit from the rights available in U.S. courts. Pompeo has said Muslim leaders are ""potentially complicit"" in attacks if they do not denounce violence carried out in the name of Islam. Pompeo's nomination to lead the CIA also opens the prospect of the U.S. resuming torture of detainees. Trump has backed harsh interrogation techniques that President Barack Obama and Congress have banned, saying the U.S. ""should go tougher than waterboarding,"" which simulates drowning. In 2014, Pompeo criticized Obama for ""ending our interrogation program"" and said intelligence officials ""are not torturers, they are patriots."" In a separate matter Friday, it was announced that Trump had agreed to a $25 million settlement to resolve three lawsuits over Trump University, his former school for real estate investors. The lawsuits alleged the school misled students and failed to deliver on its promises in programs that cost up to $35,000. Trump has denied the allegations and has said repeatedly he would not settle. New York Attorney General Eric Schneiderman, who announced the settlement, called it ""a stunning reversal by Donald Trump and a major victory for the over 6,000 victims of his fraudulent university."" Messages seeking comment from Trump attorneys and a spokeswoman were not immediately returned. Trump did not announce his Cabinet choices in person, instead releasing a statement. He has made no public appearances this week, holing up in his New York skyscraper for meetings. He is spending the weekend at his New Jersey golf club. Sessions and Pompeo would both require Senate confirmation before assuming their designated roles; Flynn would not. Members of minority groups have voiced alarm at Trump's staff appointments so far, saying his choices threaten national unity and promise to turn back the clock on progress for racial, religious and sexual minorities. They say comments attributed to Trump's picks could embolden some Americans to lash out at members of minority groups Most of Trump's nominees are expected to be confirmed relatively easily given the GOP majority in the Senate. However, potential roadblocks exist, particularly for Sessions, the first senator to endorse Trump and one of the chamber's most conservative members. His last Senate confirmation hearing, in 1986 for a federal judgeship, was derailed over allegations that he made racist comments, including calling a black assistant U.S. attorney ""boy"" in conversation. Sessions denied the accusation, but withdrew from consideration. Republicans were supportive on Friday. Senate Majority Leader Mitch McConnell called his Senate colleague ""principled, forthright, and hardworking."" Sessions would bring to the Justice Department a consistently conservative voice. He has objected to the planned closure of the Guantanamo Bay detention facility and has given prominence to the specter of voting fraud, a problem that current Justice Department leaders believe is negligible. Pompeo, who graduated first in his class at the U.S. Military Academy at West Point, is a conservative Republican and a strong critic of Obama's nuclear deal with Iran. He has said former National Security Agency contractor Edward Snowden should enjoy due process and then be sentenced to death for taking and releasing secret documents about surveillance programs in which the U.S. government collected the phone records of millions of Americans. Anthony Romero, the director of the American Civil Liberties Union, said Pompeo's views raise concerns about ""privacy and due process."" Of Trump's new personnel picks, Flynn will have the most direct access to the president. The national security adviser works from the West Wing and is often one of the last people to meet with the president before major foreign policy decisions are made. Flynn built a reputation in the military intelligence community as an astute professional and unconventional thinker. He asserted that he was forced out of the Defense Intelligence Agency in 2014 because he disagreed with Obama's approach to combating extremism, though his critics claimed he mismanaged the agency. He shares Trump's belief that Washington should work more closely with Moscow, and his warmth toward Russia worries some national security experts. Flynn traveled last year to Moscow, where he joined Russian President Vladimir Putin and other Russian officials in a celebration of the RT network, a Russian government-controlled television channel. Flynn said he was paid for taking part in the event, but brushed aside concerns that he was aiding a Russian propaganda effort. The president-elect is still weighing a range of candidates for other leading national security posts. Possibilities for secretary of state are said to include former New York City Mayor Rudy Giuliani, former U.S. Ambassador to the United Nations John Bolton, Tennessee Sen. Bob Corker and South Carolina Gov. Nikki Haley, who met with Trump Thursday. On Saturday, Trump is to meet with retired Gen. James Mattis, a contender to lead the Pentagon. He was also meeting with 2012 Republican presidential nominee Mitt Romney, who lambasted Trump as a ""con man"" and a ""fraud"" in a stinging speech in March. Trump responded by repeatedly referring to Romney as a ""loser."" ___ Pace reported from Washington. Associated Press writers Errin Whack, Catherine Lucey, Jill Colvin, Stephen Braun, Robert Burns and Jack Gillum and Elliot Spagat in San Diego contributed to this report. ___ Follow Julie Pace at http://twitter.com/jpaceDC and Jonathan Lemire at http://twitter.com/JonLemire Copyright 2016 The Associated Press. All rights reserved. This material may not be published, broadcast, rewritten or redistributed. "
1	https://www.washingtonpost.com/national/ap-fact-check-trump-auto-industry-statements-are-misleading/2016/11/18/0a116a20-addd-11e6-8f19-21a1c65d2043_story.html	AP FACT CHECK: Trump auto industry statements are misleading	" DETROIT -- President-elect Donald Trump has a long list of deceptive statements about Ford Motor Co. and the auto industry, and he added to that list this week. Trump's tweet on Thursday asserting that he had dissuaded Ford from moving a Kentucky factory to Mexico was a stretch, at the very least. The company has no intention of moving the plant, and it had already agreed to keep production of one specific model there. Throughout the campaign, Trump accused Ford of exporting U.S. jobs south of the border and, in alarming terms, contended that auto jobs are leaving the country in mass. He also misstated the impact of trade agreements on U.S. auto jobs and has threatened to impose a 35 percent tariff on goods imported from Mexico. While it's true that Ford and others have spent billions of dollars on assembly and parts plants in Mexico, the industry also has added thousands of U.S. jobs since auto sales recovered from the Great Recession. There aren't as many jobs at U.S. auto plants as there were a decade ago, but that's due more to automation than to the free-trade agreements that Trump has criticized. Here are how Trump's statements about Ford and the industry stack up with the facts: TRUMP: ""Just got a call from my friend Bill Ford, Chairman of Ford, who advised me that he will be keeping the Lincoln plant in Kentucky - no Mexico."" THE FACTS: Ford never had any intention of moving a factory from Kentucky to Mexico. But it did propose shifting production of the Lincoln MKC small SUV from Louisville to Cuautitlan, Mexico. The idea was to free assembly-line space to make more Ford Escapes, which are made on the same line as the MKC. In a deal with the United Auto Workers union, Ford agreed to invest $700 million in the plant and not cut any jobs, since workers would still make Escapes. So, while Trump may have been responsible for keeping production of the MKC in Louisville -- Ford wouldn't say if he directly played a role -- there should be little if any impact on the Louisville plant's 4,700 workers. Ford has sold only 21,000 MKCs so far this year, compared with 258,000 Escapes. Also, Escape sales have been falling since July, so the need for added factory capacity to build more of them isn't needed. ___ TRUMP: ""Our jobs are fleeing the country. They're going to Mexico. They're going to many other countries. ... Ford is leaving ... thousands of jobs leaving Michigan, leaving Ohio."" THE FACTS: Trump was referring to Ford's plans to shift all small-car production to Mexico to take advantage of lower wages. The company announced this year that it would move the Ford Focus and C-Max from suburban Detroit to a new plant south of the border. But the move wouldn't cost any U.S. jobs. The 3,700 workers at the plant in Wayne, Michigan, that now makes the small cars will stay employed building a new SUV and small pickup truck. Trump and his supporters contend the Mexican jobs could have been added in the U.S. if Ford built a new factory here instead of in Mexico. But Ford says it's nearly impossible to make money building small cars in the U.S., while Mexico's lower costs of production, including wages, allow the automaker to turn a profit on the vehicles. As for jobs fleeing the U.S., the U.S. auto industry has actually added 300,000 jobs since June 2009, when the recession ended. ___ TRUMP: When he becomes president ""The auto industry will come roaring back."" THE FACTS: The industry has already roared back from the financial crisis. Total U.S. auto sales reached a record level of 17.5 million last year. They may tail off slightly this year, but sales are expected to stay near the record or even grow during the next several years. The resurgence has benefited both U.S.-based and foreign automakers, many of which have U.S. factories. ___ TRUMP: ""According to the Bureau of Labor Statistics, before NAFTA went into effect, there were 285,000 auto workers in Michigan. Today, that number is only 160,000."" THE FACTS: Michigan actually added jobs after the North American Free Trade Agreement began in 1994, when auto-manufacturing and auto-parts plants employed roughly 280,000 workers. Over the next six years, their ranks increased to 320,000. But the jobs started falling in Michigan as U.S. automakers lost market share, automation increased and the Great Recession hit. Auto employment bottomed out at 95,000 in 2009 and recovered to about 165,000 as of September. EDITOR'S NOTE _ A look at the veracity of claims by political figures Copyright 2016 The Associated Press. All rights reserved. This material may not be published, broadcast, rewritten or redistributed. "
2	https://www.washingtonpost.com/local/md-politics/bail-reform-in-maryland-clears-major-hurdle/2016/11/18/374c5340-ac22-11e6-8b45-f8e493f06fcd_story.html	Bail reform in Maryland clears major hurdle	" Judges in Maryland would not be able to set bail that is too high for a poor defendant to pay unless the defendant is considered a flight risk or a danger to society, under a rule change that a key judiciary committee voted Friday to recommend to the state's highest court. The Standing Committee on Rules of Practice and Procedure of the Maryland Court of Appeals voted 18 to 5 to recommend an overhaul of the state's money-based bail system, which critics say is unfair to poor and minority defendants. The public will have 30 days to review the rule change -- which is opposed by bail bondsmen, most state prosecutors and some state lawmakers -- before it is considered by the Court of Appeals. ""We saw a problem that needed to be fixed,"" said retired judge Alan M.Wilner, the chair of the rules committee, after the nearly five-hour hearing. ""The impact of setting bail that a person cannot make is irrational. It is not really setting bail -- it is putting them in jail, and it has a disparate impact first on poor people, for sure, and on people of color."" Advocates in Maryland and across the country have been fighting for years to change the bail system, which can leave poor people in jail for months awaiting trial while those charged with similar crimes but who can pay go free.    (ENRIQUE CASTRO-MENDIVIL/REUTERS)  Among those testifying in favor of a change was Attorney General Brian E. Frosh (D), who asked the rules committee to consider a change after his office issued an opinion that the state's system probably was unconstitutional, and Prince George's County State's Attorney Angela Alsobrooks (D), who broke from most of her colleagues. ""I'm almost ashamed to admit that we have a two-tiered system,"" Alsobrooks said. ""I have become devastated about the way we have operated our criminal justice system."" Opponents of limiting cash bail said the state is not equipped to handle such a change and would struggle, for example, to find a way to deal with defendants who do not show up for trial. As part of an effort to lobby against a change, bail bondsmen have begun disseminating data about the growing number of defendants released on recognizance since last month, when District Court Chief Judge John P. Morrissey advised judges and commissioners to impose the ""least onerous"" conditions on those awaiting trial.  [Md. attorney general's office raises questions about cash bail system]  Frosh said eliminating cash bail for poor defendants would have a major impact. ""People will no longer be sitting in jail waiting for trial because they can't afford to pay for bail,"" he said. ""If they are a danger, they should be locked up; if they are not going to show up for trial, they should be locked up. But if they are not a threat to anybody . . . they should not be sitting in jail for weeks or months awaiting trial."" Del. Joseph F. Vallario Jr. (D-Prince George's), a member of the rules committee and chairman of the House Judiciary Committee, was one of five people who voted Friday against recommending the change to the Court of Appeals. Vallario argued that the issue should be handled by the legislature, not the courts, and accused the committee of a ""rush to judgment."" Previous attempts to pass laws reforming the bail system have stalled in the General Assembly, including bills sponsored by Frosh when he was a state senator. In a letter to the rules committee this week, state Senate President Thomas V. Mike Miller Jr. (D-Calvert) and Sen. Robert A. Zirkin (D-Baltimore County), the chairman of the Senate Judicial Proceedings Committee, also tried to discourage the committee from taking action on the rule change. Zirkin said in an interview that the court system usually makes rule changes after legislation has been enacted, and he noted that the General Assembly could pass legislation that negates any changes the Court of Appeals makes. Gerard Evans, a lobbyist for the bail bondsmen, accused Frosh of trying to dodge the legislative process. But Frosh said the action was ""completely within the purview of the courts."" The five Democratic lawmakers who initially sought the attorney general's opinion -- Dels. Kathleen M. Dumais (Montgomery), Erek L. Barron (Prince George's), Shelly L. Hettleman (Baltimore County), Marc A. Korman (Montgomery) and Brooke E. Lierman (Baltimore City) -- say they support a rules change and plan to introduce additional legislation addressing bail and other pretrial issues in the upcoming legislative session. ""This has been legislatively debated, and nothing has happened,"" Robert Zarbin, an attorney and a member of the rules committee, said during the hearing. ""If we pass this rule, something will happen in Annapolis. This is the best catalyst to get people talking."" "
3	https://www.washingtonpost.com/politics/whitehouse/flynns-reputation-astute-intelligence-pro-straight-talker/2016/11/17/ba3a944a-ad2d-11e6-8f19-21a1c65d2043_story.html	Flynn: Critic of Muslim militancy and culture	" WASHINGTON -- Michael Flynn, the retired Army lieutenant general and intelligence officer who is Donald Trump's pick to serve as his national security adviser, is a harsh critic of Muslim extremism and the religion itself, calling ""radical Islam"" an existential threat to the United States. In strident speeches and public comments, including a fiery address at the Republican National Convention, Flynn has aggressively argued that Islamic State militants pose a threat on a global scale and demanded a far more aggressive U.S. military campaign against the group. In a June interview with CNN, Flynn complained the U.S. needs to ""discredit"" radical Islam, but that ""we're not allowed to do that right now."" But his comments about Islam, a religion practiced by more than 1.5 billion people worldwide, have at times gone beyond condemning radicals inside the faith. In Flynn's book, ""The Field of Fight: How We Can Win the Global War Against Radical Islam and its Allies,"" he condemned U.S. leaders who have called Islam a religion of peace. ""This insistence on denying the existence of jihad led President Obama to the absurd claim that the Islamic State has nothing to do with Islam,"" Flynn wrote. In August, he spoke at an event in Dallas hosted by the anti-Islamist group Act for America, calling Islam a ""cancer"" and a ""political ideology"" that ""definitely hides behind being a religion."" Muslim Advocates, a civil rights group based in California, said in a statement that Flynn's appointment ""signals support for anti-Muslim policies and sentiment that will undermine our nation's security and exacerbate an already unsafe climate for Muslims and all Americans."" The role of national security adviser has varied by administration, but usually centers on coordinating the policy positions of the secretaries of state, defense, justice and other members of a president's national security team. It is an especially powerful position because of the national security adviser's access to the president in the West Wing of the White House. The adviser acts as a gatekeeper on a wide range of issues, including matters of war and peace as well as diplomacy and intelligence. Flynn, who turns 58 in December, served for more than three decades in the Army following his commissioning in 1981 as a second lieutenant in military intelligence. His career included a stint as director of intelligence for the Joint Chiefs of Staff and intelligence chief for the U.S.-led International Security Assistance Force in Afghanistan. It ended, however, when he was forced to resign from his post as head of the Defense Intelligence Agency in 2014 after two turbulent years leading the Pentagon's top spy agency. After leaving the agency, Flynn became a harsh critic of the Obama administration's prosecution of the fight against the Islamic State group and emerged as one of Trump's most vocal backers. Throughout the campaign, Flynn championed many of Trump's foreign policy provisions, including renegotiating a seven-country agreement with Iran aimed at curbing its nuclear program in exchange for a lifting of economic sanctions. Yet while Flynn has publicly issued dark warnings about the risks of Islamic violence, his private consulting firm has lobbied for a company headed by a Turkish businessman tied to Turkey's authoritarian, Islamist-leaning government, which cracked down on dissent and jailed thousands of opponents after a failed coup in July against Turkish President Recep Tayyip Erdogan. The businessman, Ekim Alptekin, told The Associated Press on Friday that he had no relationship with Erdogan's government, even though he is member of a Turkish foreign economic relations board managed by the country's Economic Ministry. In an op-ed for the Washington newspaper The Hill just before the election, Flynn wrote that Turkey needs support and echoed Erdogan's warnings that a ""shady"" Turkish Muslim cleric living in Pennsylvania should not be given safe harbor in the U.S. Erdogan has accused the cleric, Fethullah Gullen, of orchestrating the July coup attempt and called for his extradition. The Obama administration has not complied. Alptekin said Friday that Flynn's editorial supporting Erdogan was not connected to his company's lobbying or the Turkish government. ""The Turkish government did not order that,"" he said. The Flynn Intel Group also lobbied Congress even as Flynn joined Trump in a presidential intelligence briefing in August -- a possible security misstep, according to several ethics law experts.  ""If the general was receiving classified information that could affect his business interests, that would be an obvious concern,"" said Joe Sandler, a campaign ethics lawyer and expert on the law that requires lobbyists for foreign governments to register their activities. Sandler and others also questioned why Flynn's firm registered as lobbyists with Congress instead of the Justice Department's stricter Foreign Agent unit, which requires more detailed reporting of activities under the federal Foreign Agent Registration Act.  ""If a foreign entity is lobbying Congress with the aim of influencing U.S policy, they're required to file under the foreign agent act,"" said Lydia Bennett, an expert in foreign agent work with the non-partisan Project on Government Oversight in Washington. Flynn's consulting group registered with Congress as a lobbyist in September for Inovo BV, a company Alptekin set up in the Netherlands in 2005. Alptekin said the lobbying project was designed to support an energy firm that he declined to identify. Alptekin said a lobbyist for Flynn's firm, Robert Kelley, had suggested it aim to improve U.S.-Turkish relations as part of its work for the energy firm. Kelley and Flynn Intel Group did not respond to calls and emails from the AP, and the Trump transition team did not respond to requests for comment. Flynn said in a statement Kelley provided to Yahoo News that ""if I return to government service, my relationship with my company will be severed."" Copyright 2016 The Associated Press. All rights reserved. This material may not be published, broadcast, rewritten or redistributed. "
