	Link	Title	Text
4	https://www.washingtonpost.com/politics/federal_government/key-lawmaker-trump-favors-privatizing-air-traffic-control/2016/11/18/03028006-adc5-11e6-8f19-21a1c65d2043_story.html	House chairman: Trump favors privatizing air traffic control	" WASHINGTON -- A House committee chairman says President-elect Donald Trump likes the idea of spinning off air traffic control operations from the government and placing them under the control of a private, non-profit corporation chartered by Congress. Rep. Bill Shuster, head of the House transportation committee, told The Associated Press that he spoke to Trump about the idea several times both before and during the presidential election. He said he believes the president-elect would be supportive, although details would have to be worked out.  ""I have spoken to him on a number of occasions and he generally likes the idea,"" Shuster said. ""We do need to sit down and put meat on the bones ... I think in general he sees it as something that's positive and we need to work on it."" The Republican lawmaker endorsed Trump early on and campaigned twice with him in his Pennsylvania congressional district. He also campaigned twice with Vice President-elect Mike Pence. Since the election, Shuster has met with Shirley Ybarra, a former Virginia transportation secretary who is working with the Trump transition team on transportation matters. Ybarra and the Trump transition team didn't immediately respond to requests for comment. Shuster and most of the airline industry have been pressing for air traffic control privatization. They say the Federal Aviation Administration is moving too slowly to adopt new technology and that airlines haven't seen the benefits they expected from the agency's air traffic control modernization program, which has been in the works for more than a decade. Earlier this year, Shuster included a plan to privatize air traffic control in a bill to extend the FAA's operating authority. The bill was approved by the transportation committee, but Shuster was unable to get it to the House floor after several influential lawmakers, including the Ways and Means Committee chairman and the House and Senate Appropriations Committee chairmen, raised objections. Democrats, some segments of the aviation industry and some FAA unions also oppose the plan, although the National Air Traffic Controllers Association endorsed the bill. Sen. John Thune, R-S.D., the Commerce, Science and Transportation Committee chairman and Shuster's Senate counterpart, hasn't taken a position on the issue. He said Friday that the FAA hasn't been successful in bringing fundamental change to how air traffic is managed despite spending billions of dollars.  ""Congress has different options, and we will continue to explore them, but the case for changing the FAA's approach to air traffic control modernization has become stronger,"" Thune told the AP. Rep. Peter DeFazio, D-Ore., the senior Democrat on the House transportation committee, cautioned earlier this week that any proposal to overhaul the existing air traffic system ""must be thoroughly vetted, not rushed through Congress just because the political landscape makes it easier."" Sen. Bill Nelson, D-Fla., raised objections Friday to what he described as an attempt by House proponents of air traffic control privatization to include language in a defense policy bill that would effectively squelch military objections to the plan. Nelson described his concerns in a letter Friday to Senate Armed Committee Chairman John McCain, R-Ariz., and Sen. Jack Reed, D-R.I., the committee's senior Democrat. ___ Follow Joan Lowy at http://twitter.com/AP_Joan_Lowy. Her work can be found at http://bigstory.ap.org/content/joan-lowy Copyright 2016 The Associated Press. All rights reserved. This material may not be published, broadcast, rewritten or redistributed. "
5	https://www.washingtonpost.com/world/europe/bulgarias-government-resigns-clearing-way-for-new-election/2016/11/16/baf33f82-ac0a-11e6-8f19-21a1c65d2043_story.html	Bulgaria’s government resigns, clearing way for new election	" SOFIA, Bulgaria -- Bulgaria's parliament on Wednesday approved the resignation of the center-right prime minister, who stepped down after the candidate of the opposition Socialist Party capitalized on popular discontent with the government to score a landslide victory in last weekend's presidential election. Although the presidential vote isn't directly linked to the executive, Boiko Borisov announced that he was stepping down because there wasn't enough popular support for his GERB party. Parliament on Wednesday voted 218-0 to approve the resignation of Borisov's government. Borisov, whose party had triumphed in all national elections over the last decade, told legislators that ""the vote gave a clear signal that society wants a change."" He said that he would ensure a smooth transition and stay in office until a new government has been formed. Halfway into its four-year term, Borisov's coalition government has managed to restore political stability after months of anti-corruption protests. But its popularity has faded because of the slow pace of reforms to eliminate graft and poverty, and overhaul the judicial system. The government's resignation triggers a constitutional procedure, by which the president must offer a mandate to seek to form a government three times. If these attempts fail, the president appoints a caretaker government. President Rosen Plevneliev, whose term expires on Jan. 22, is barred by the constitution from dissolving parliament because he is in his final three months in office. It will be up to his successor, Rumen Radev, to dissolve the assembly and declare parliamentary elections within 60 days. Preliminary estimates indicate that an election could be held in in April. Copyright 2016 The Associated Press. All rights reserved. This material may not be published, broadcast, rewritten or redistributed. "
6	https://www.washingtonpost.com/politics/trumps-school-choice-expansion-plan-may-face-uphill-battle/2016/11/16/980c2e78-abda-11e6-8f19-21a1c65d2043_story.html	Trump’s school choice expansion plan may face uphill battle	" WASHINGTON -- School voucher programs in the nation's capital and Vice President-elect Mike Pence's home state of Indiana could serve as a blueprint for a Trump administration plan to use public money to enable disadvantaged students to attend the public or private school of their choice. President-elect Donald Trump made clear that school choice would be an education priority. When Trump spoke at a Cleveland charter school in September, he pledged to funnel $20 billion in existing federal dollars into scholarships for low-income students. That idea would require approval from Congress, which last year passed a bipartisan overhaul of No Child Left Behind and is unlikely to alter it in the near future. Still, there are smaller-scale ways Trump could reshape public education. A first step might be asking Congress to restore funding to the D.C. Opportunity Scholarship Program, the country's first federally funded, private school voucher program. The House voted to extend funding earlier this year, but a companion bill has stalled in the Senate. Gerard Robinson, a resident fellow at the conservative American Enterprise Institute who advised the Trump campaign on education policy, called the D.C. program ""a good place to start."" Created in 2004, the program last year gave vouchers to about 1,200 low-income students. The vouchers are capped at $8,452 for kindergarten through 8th grade and $12,679 for high school. Among the 40-plus schools participating are elite private schools like Sidwell Friends, which has counted among its students Chelsea Clinton and Malia and Sasha Obama. The idea of allowing public funds to follow individual students to a charter, magnet or private school isn't new. Programs are already in place in states like Indiana, where Pence, as governor, oversaw a dramatic expansion of vouchers in the state. Nearly 33,000 students participated last school year, up from nearly 4,000 in 2011-12. The vouchers are awarded on a sliding scale based on income and family size. For 2015-2016, the top voucher averaged nearly $5,500 for a high school student. The Indiana Supreme Court upheld the program in 2013, ruling that it didn't violate a state constitutional provision against public funding for religious programs. At the federal level, Congress considered allowing Title I funds targeted for low-income students to follow them to the school where they enroll, but that idea was ultimately scrapped in the final version of NCLB's successor, the Every Students Succeeds Act. Vic Klatt, a principal of Penn Hill Group who has worked on federal education policy for more than two decades, says school choice has a better chance now, but it won't be easy.  ""There will be tons of support for charters. Full-scale private choice will be a battle,"" Klatt said at an Education Writers Association panel discussion this week. ""It's going to depend on how much emphasis this president and his people put on private school choice as an issue."" Education observers said there are other ways to push that agenda, including tax incentives to move children from public to private schools or a Race to the Top-style grant program in which states are encouraged to adopt choice-friendly policies in exchange for funds. The Obama administration's Race to the Top competition gave $4 billion to states that vowed to adopt more rigorous standards and turn around failing schools. States that adopted the Common Core standards in math and reading were more likely to win a slice of the pie. Trump repeatedly promised to ""put an end to Common Core,"" but the standards were adopted by individual states and the new education law explicitly prohibits the federal government from telling states which standards to adopt, Common Core or otherwise. Trump's campaign plan for school choice was scant on details: He did not say where the $20 billion in federal funding would come from or how it would be doled out.  ""I think what you're going to hear from him is a shift from the term school choice to parental choice,"" Robinson said in an interview with The Associated Press, adding that he was speaking for himself, not the Trump transition team. Robinson has been mentioned as a possible education secretary in a Trump administration. Research on school choice programs like the D.C. Opportunity Scholarship suggests mixed results. One evaluation of the D.C. voucher program found students had slightly higher reading scores but no significant improvements in math. A subsequent review of that study, however, found it downplayed results showing higher scores were concentrated among certain groups of students.  ""I would have hoped for and expected better results than we saw,"" said Kevin Welner, director of the National Education Policy Center at the University of Colorado Boulder. Some education leaders expressed doubt that Trump's proposal would be roundly welcomed at a time when there has been increasing skepticism of large-scale expansions of alternatives like charters. Voters in Massachusetts and Georgia rejected ballot measures that would have paved the way for the creation of more charter schools.  ""I think you would get a limited number of states that would take advantage of it,"" said Kristen Amundson, executive director of the National Association of State Boards of Education. ""It's not something that is being universally asked for."" ___ Armario reported from Los Angeles. Associated Press writer Tom Davies in Indianapolis contributed to this report. ___ Follow Christine Armario on Twitter at: http://www.twitter.com/cearmario and Jennifer C. Kerr on Twitter at: https://twitter.com/jckerr9 Copyright 2016 The Associated Press. All rights reserved. This material may not be published, broadcast, rewritten or redistributed. "
7	https://www.washingtonpost.com/world/middle_east/yemeni-troops-push-rebels-back-in-western-city/2016/11/16/2eb8aabc-ac09-11e6-8f19-21a1c65d2043_story.html	Yemeni troops push rebels back in western city	 SANAA, Yemen -- Witnesses and activists say Yemeni troops have driven Shiite Houthi rebels out of a presidential palace and military hospital in the western city of Taiz, where heavy clashes are underway. Activists posted photos online that appeared to have been taken inside both facilities, and witnesses confirmed Wednesday's advance. Medical officials say dozens of fighters have been killed on both sides. The witnesses spoke on condition of anonymity because of security concerns and the medics because they were not authorized to release the information. Yemen's conflict pits pro-government forces and a Saudi-led coalition against the rebels and allied security forces loyal to a former president. The rebels captured the capital, Sanaa, in 2014. The two sides have been fighting for Taiz for more than two years. Copyright 2016 The Associated Press. All rights reserved. This material may not be published, broadcast, rewritten or redistributed. 
8	https://www.washingtonpost.com/37232c46-abfe-11e6-a31b-4b6397e625d0_story.html	Transition ‘is going so smoothly,’ Trump tweets	" President-elect Donald Trump took to Twitter on Wednesday to push back against news coverage describing a chaotic transition to power, saying the process of selecting Cabinet secretaries and working with the Obama administration ""is going so smoothly.'' As Trump met with senior advisers to discuss potential Cabinet candidates, there were further signs that power in his transition effort was consolidating within an ever-smaller group of loyalists generally not aligned with Republican members of the Washington establishment.  [The latest news on the Trump presidential transition]  Among them is Sen. Jeff Sessions (R-Ala.), a top Trump adviser known for his hard-line views on immigration. His former staff director at the Senate Judiciary Committee, Brian Benczkowski, is now helping to manage the Justice Department transition for Trump's team, according to two prominent Republican lawyers with knowledge of the matter. Benczkowski replaced Kevin O'Connor, a former U.S. attorney and associate attorney general who had been managing the Justice Department transition, the lawyers said. A white-collar defense attorney at Kirkland & Ellis, Benczkowski previously worked in a number of senior Justice Department jobs and is a respected lawyer.         1 of 10       Full Screen Autoplay  Close                                           Skip Ad   x           Here's what president-elect Donald Trump has been doing after the election      View Photos   He has been holding interviews and meeting with Congress and the president as he prepares to transition into the White House.    Caption   He has been holding interviews and meeting with Congress and the president as he prepares to transition into the White House.  Nov. 18, 2016 A motorcade vehicle transporting President-elect Donald Trump arrives at Trump National Golf Club in Bedminster, N.J. Jabin Botsford/The Washington Post  Buy Photo          Wait 1 second to continue.   .wp-volt-gal-preroll-video{width:100%;height:100%}        His elevation is likely another indication that power has shifted away from New Jersey Gov. Chris Christie (R), who was recently replaced as head of the transition team by Vice President-elect Mike Pence and who had been considered an emissary to more mainstream Republicans. Benczkowski declined to comment. Pence is scheduled to meet with Congressional leaders in Washington on Thursday, including House Speaker Paul Ryan (R-Wis.), Senate Majority Leader Mitch McConnell (R-Ky.), Senate Minority Leader Charles Schumer (D-N.Y.) and House Minority Leader Nancy Pelosi (D-Calif.). The new developments came as Sessions himself emerged as a top candidate for defense secretary, along with Sen. Tom Cotton (R-Ark.). Both would bring hawkish views and military experience, but neither has executive experience running a massive bureaucracy such as the Pentagon. Trump was also visited Wednesday by New York Mayor Bill de Blasio, who emerged from a meeting with the president-elect saying that he told Trump that ""so many New Yorkers are fearful"" of what he plans to do as president. De Blasio, a liberal Democrat, has clashed with Trump in the past. And like mayors in many of the nation's major cities with diverse cultures, he has said New York City authorities would not assist federal immigration officials with the deportations of immigrants who are here illegally, providing them sanctuary. Despite such differences, De Blasio said the hour-long session was ""respectful"" and added that Trump ""loves this city.''     Here are the people whose names have been floated for Trump's Cabinet View Graphic     Here are the people whose names have been floated for Trump's Cabinet  From the lobby of Trump tower, reporters spotted a coterie of guests entering the building, including New York Jets owner and Republican megadonor Woody Johnson, Trump's children, Donald Trump Jr., Eric Trump and his wife Lara Trump and former New York mayor Rudy Giuliani, who is considered a potential Cabinet nominee. Transition turmoil On his Twitter account, Trump took particular aim at a favorite target, the New York Times, which reported Wednesday that the transition has been marked by firings and infighting, and that U.S. allies were having trouble reaching Trump at New York's Trump Tower as he plans his government. ""The failing @nytimes story is so totally wrong on transition. . . . I have received and taken calls from many foreign leaders,'' Trump wrote in a series of posts on the microblogging site. He also denied reports that his transition team has sought security clearances for his children. In his tweets, Trump falsely implies the Times reported that he had not spoken with foreign leaders and never points out exactly what the Times had in error. The Times did report that American allies were ""blindly dialing in to Trump Tower"" in an attempt to reach the president-elect and that key members of the transition team had been fired. The paper reported that even key U.S. allies such as Israeli Prime Minister Benjamin Netanyahu and British Prime Minister Theresa May had been patched through to Trump ""with little warning,"" citing a Western diplomat. Later in the day, the transition team released a list of foreign leaders that Trump and Pence have spoked with.   [Trump's gripes about the Times are usually about stories that prove accurate]  The Washington Post has also reported about turbulence in Trump's transition. But Peter Hoekstra, a Republican former congressman from Michigan, defended Trump in an interview Wednesday, saying the president-elect's team has ""a monumental job to do and a short time to do it."" ""I'm just watching all the sniping coming in. They're not doing this right. They're not doing that right,'' said Hoekstra, a former House Intelligence Committee chairman who is reportedly under consideration for CIA director. ""This is what any transition team would do. You start with the people who brought you. I think the Trump team is going to expand its outreach, absolutely. But they're going to do it in a methodical way.'' The reported bloodletting in Trump's transition team that began with last week's ouster of Christie had escalated Tuesday with new departures, particularly in the area of national security.  Former congressman Mike Rogers (R-Mich.) announced that he had left his position as the transition's senior national security adviser. Rogers, a former chairman of the House Intelligence Committee and the leading candidate for CIA director, was among at least four transition officials purged this week, apparently because of perceived connections to Christie. As turbulence within the team grew, some key members of Trump's party began to question his views and the remaining candidates for top positions. Sen. John McCain (R-Ariz.) said Trump's efforts to work more closely with Russian President Vladimir Putin amounted to ""complicity in [the] butchery of the Syrian people"" and ""an unacceptable price for a great nation."" Trump met Tuesday with Pence, who replaced Christie at the head of the transition Friday, to discuss Cabinet and White House personnel choices. Little to no information was released by the transition office, leaving a clutch of reporters gathered in the lobby of Trump Tower to hustle after team members passing between the front doors and the elevators.   Trump posted a message Tuesday night on Twitter saying that a ""very organized process [is] taking place"" as he decides on Cabinet and other positions. ""I am the only one who knows who the finalists are!""  As he had during the campaign, Trump appeared to be increasingly uncomfortable with outsiders and suspicious of those considered part of what one insider called the ""bicoastal elite,"" who are perceived as trying to ""insinuate"" themselves into positions of power. Those in the inner circle reportedly were winnowed to loyalists who had stuck with Trump throughout the campaign and helped devise his winning strategy. They include Sessions, former Breitbart News head Stephen K. Bannon, retired Lt. Gen. Michael Flynn, and members of Trump's family, including son-in-law Jared Kushner. ""This is a very insular, pretty closely held circle of people,"" said Philip D. Zelikow, a former director of the Miller Center of Public Affairs at the University of Virginia and a senior figure in the George W. Bush transition. ""Confusion is the norm"" for transitions, he said, ""but there are some unusual features here, because they're trying to make some statements."" ""They feel like their election was a lot of the American people wanting to throw a brick through a window,"" Zelikow said. ""They want to make appointments that make it sound like glass is being broken.""  [President Obama warns against 'a crude sort of nationalism' in the U.S.]  Increasingly, among the shards are more mainline Republicans in the national security field. In an angry Twitter post Tuesday, Eliot A. Cohen, a leading voice of opposition to Trump during the campaign who had advised those interested in administration jobs to take them, abruptly changed his mind, saying the transition ""will be ugly."" After responding to a transition insider seeking names of possible appointees, Cohen said, he received what he described as an ""unhinged"" email from the same person saying ""YOU LOST"" and accusing Trump critics of trying to infiltrate the administration's ranks. ""It became clear to me that they view jobs as lollipops, things you give out to good boys and girls, instead of the sense that actually what you're trying to do is recruit the best possible talent to fill the most important, demanding, lowest-paying executive jobs in the world,"" Cohen said. Rogers's departure coincided with word from Sen. Bob Corker (R-Tenn.), chairman of the Senate Foreign Relations Committee, whose possible selection as secretary of state comforted more mainline Republicans, that he was unlikely to be chosen. ""Has my name been in the mix? I'm pretty sure, yeah. Have I been having intimate conversations? No,"" Corker said in an interview. ""Do I understand that it's likely that people who've been involved in the center of this for some time, and have been surrogating on television, are likely front-runners? I would say that's likely, yes."" The two people whose names are mentioned most often for the diplomatic job -- Giuliani and John R. Bolton, an undersecretary of state and one-year ambassador to the United Nations during the George W. Bush administration -- are Trump loyalists. But both could be problematic, even among Republicans who would have to confirm them. Giuliani, thought to be an early choice for attorney general, was said by a person close to the transition team to have personally appealed to Trump for the diplomatic job. He has virtually no diplomatic experience or knowledge of the State Department bureaucracy. Bolton, a national security hawk who got his U.N. job through a recess appointment after the Senate refused to confirm him, was a leading advocate for the 2003 invasion of Iraq, contradicting Trump's campaign position opposing it. Congress voices concern Sen. Rand Paul (R-Ky.) said Tuesday that Bolton would be a ""disaster"" and that he would actively oppose his nomination. Others were more supportive. ""If he picks John Bolton, then I'll support John Bolton. If he picks Rudy, I'll support Rudy,"" said Sen. Lindsey O. Graham (R-S.C.). The shortlist for defense secretary is said to include Sessions, Flynn and Cotton. Although Sessions serves on the Armed Services Committee, his main issue there has been immigration. Cotton is a Harvard Law School graduate who just seven years ago was a first lieutenant in the Army. Senate confirmation of Flynn, who also has voiced interest in serving as director of national intelligence, could be difficult, said the person close to the transition team. He was forced out as director of the Defense Intelligence Agency after two years over concerns about his leadership, and he has potentially problematic connections to foreign governments.                                Ellen Nakashima, Philip Rucker, Robert Costa, Missy Ryan, Adam Entous and Julie Tate contributed to this report. "
