	Link	Title	Text
0	https://www.washingtonpost.com/local/protests-expected-as-white-nationalists-meet-in-dc-saturday-and-celebrate-trump-win/2016/11/18/2b495d02-adaa-11e6-977a-1030f822fc35_story.html	Protesters try to confront white nationalists in D.C. for conference	" A white nationalist organization that has come under fire for promoting racism will host a conference Saturday at the Ronald Reagan Building and International Trade Center in downtown Washington -- a gathering of more than 250 that will celebrate Donald Trump's presidential victory. ""The past 12 months might be remembered as the year of Donald Trump . . . and the year of the Alt Right,"" according to the website for the National Policy Institute, which is hosting the event. ""It was a time when more people joined our movement then [sic] ever before and when our ideas began invading the mainstream."" The conference is expected to draw dozens if not hundreds of protesters, who have launched a Facebook page asking that people join them ""to defeat this hate."" The institute's president, Richard Spencer, who coined the term ""alt-right,"" is a leading promoter of white identity. He and his followers oppose immigration and multiculturalism. Friday night as prospective attendees of the Saturday conference gathered at a restaurant for a private dinner, protesters rushed up a flight of stairs toward them. They were prevented from reaching them, however, and went back outside to continue protesting.      About 200 people protested a gathering of white nationalists sponsored by the National Policy Institute at the Ronald Reagan Building and International Trade Center on Nov. 19 in downtown Washington. (Facebook/Tauhid Chappell)   The Southern Poverty Law Center describes the National Policy Institute as an extreme right-wing group whose core belief ""is that 'white identity' is under attack by multicultural forces using 'political correctness' and 'social justice' to undermine white people and 'their' civilization.""  [What's the alt-right? A primer]   The movement gained national prominence during the 2016 presidential campaign as supporters crusaded on Twitter and Facebook for Trump, whose blunt talk and immigrant bashing resonated with them. When the president-elect named as chief White House strategist the former Breitbart News chief Stephen K. Bannon -- who is closely associated with the movement -- the alt-right's leadership touted the appointment as another enormous victory for their cause. "" 'Strategist' is the best possible position for Steve Bannon in the Trump White House,"" Spencer wrote on Twitter, just days before the social media platform, without explanation, suspended him and a number of like-minded users. Saturday's speaker lineup features a number of prominent, and controversial, white nationalists, including Kevin MacDonald, a retired professor of psychology at the California State University at Long Beach, who is considered deeply anti-Semitic by Jewish groups. He is, the SPLC says, ""the neo-Nazi movement's favorite academic."" Peter Brimelow, an author and anti-immigration activist who leads the VDare Foundation, will also address the gathering. Spencer, a 38-year-old with degrees from the universities of Virginia and Chicago, has worked for months to inject the movement's ideology into the mainstream, offering interviews to dozens of major media publications.  Although people have fiercely objected to the Reagan building hosting Saturday's conference, the management has said it can't discriminate because the building is federal. On its Facebook page, the anti-fascist group ""Smash Racism DC"" celebrated that the Hamilton had canceled a Friday-night dinner the institute intended to host at the restaurant. ""We didn't really know the nature of the event,"" said Hamilton spokeswoman Molly Quigley. ""Once there was a threat of protest and disruption, we canceled it for the safety of our guests and employees and our business."" The restaurant, she said, had been inundated with calls from activists. However, a group of prospective conference attendees gathered for dinner at another restaurant, Maggiano's in the Friendship Heights area, and protesters tried to confront them inside.  Midway through the private dinner, more than 30 demonstrators swarmed into the restaurant and tried to reach the second floor area where the dinner was going on.  Restaurant personnel blocked the protesters from reaching the diners,and police later forced them outside. A protest continued on the Wisconsin Avenue sidewalk for about an hour and a half, with posters and chants. At one point during the turbulence inside the restaurant, a foul-smelling liquid was sprayed on Spencer.  ""They're total scum"" he told a reporter later. ""They attacked me, they attacked the employees of this restaurant.""  Among protesters' chants was ""No Nazis, No KKK, No Fascist USA.""     Read more:    Donald Trump first swept into the nation's capital 40 years ago. It didn't go well.     A Marine fights to prove he's innocent of sexual misconduct. Then a lost cellphone is found.    A beloved mayor. An alleged meth-for-sex scheme. And a secret life exposed.    'I don't want them to die': She was pregnant with twins. Then a gunman opened fire.    "
1	https://www.washingtonpost.com/news/where-we-live/wp/2016/11/14/they-came-they-saw-they-slept-properties-of-the-powerful-up-for-sale/	They came, they saw, they slept: Properties of the powerful up for sale	"         1 of 29       Full Screen Autoplay  Close                   Former Irish president Mary Robinson's estate                Former French first lady Carla Bruni-Sarkozy's childhood home               Former U.S. consul general's residence in Bermuda                Former U.S. ministerial residence in Canada                              Skip Ad   x           Where heads of states have laid their heads      View Photos   The world's political leaders resided in or visited these houses around the globe that are now up for sale.    Caption   The world's political leaders resided in or visited these houses around the globe that are now up for sale.    Winston Churchill's former home in London, No. 28 Hyde Park Gate, Kensington, is on the market for $27,724,400. Courtesy of Christie's International Real Estate  Buy Photo          Wait 1 second to continue.   .wp-volt-gal-preroll-video{width:100%;height:100%}        When not in their official residences, world leaders need somewhere to live. Their choice in homes or their childhood abodes offer a peek into their lives away from the pomp and circumstance. Below are houses where some of the world's politicians resided or visited that are on the market:    Winston Churchill's former home in London, No. 28 Hyde Park Gate, Kensington, is on the market for $27,724,400. (Courtesy of Christie's International Real Estate)   Winston Churchill's former home in London No. 28 Hyde Park Gate, Kensington  Winston Churchill, who was prime minister of Britain from 1940 to 1945 and again from 1951 to 1955, bought No. 28 during World War II and No. 27 after the war. He combined the duplex into one unit with offices for his secretaries. Over the years, the home sprouted a dormered third floor and a variety of additions, including a walled entrance porch. According to a 1965 Chicago Tribune article, Churchill's favorite room in the home was the dining room. He lowered its floor so that it was even with the garden. Two bay windows made it the brightest room in the house. When Churchill became prime minister again in 1951, he lived at 10 Downing Street, but he later returned to No. 28 Hyde Park Gate. He died there in 1965. Churchill met many world leaders in his home, including George Marshall, then the U.S. secretary of state, in 1947. A 1965 New York Times story noted that the No. 28 address ""became over the postwar years almost as well-known as 10 Downing Street."" After his death, Churchill's widow auctioned off the property. Samuel Leonard Simpson, chairman of Simpson's department store in Piccadilly, bought the home for $287,000 in October 1965. The 5,763-square-foot house has seven bedrooms, a wine cellar, a plant room and a 55-foot-long, west-facing garden. It is listed at $27,724,400.    Former Irish president Mary Robinson's estate, Massbrook House in Country Mayo, is on the market for $3,002,839. (Courtesy of Christie's International Realty)   Former Irish president Mary Robinson's estate Massbrook House, Lough Conn, County Mayo, Ireland  Former Irish president Mary Robison bought Massbrook House in 1994 while she was still in office. The Harvard-educated Robinson, the first female president of Ireland, served from 1990 to 1997 and then became U.N. High Commissioner for Human Rights. Robinson and her husband are selling the house and moving to Dublin to be closer to their children and grandchildren. The house dates from 1890 and was designed by Sir Thomas Drew, the consulting architect for St. Patrick's Cathedral and Christ Church Cathedral in Dublin. The entrance hall has its original wood paneling and solid wood floors. The drawing and dining rooms each have fireplaces with marble surrounds. The 6,800-square-foot home has five bedrooms and five bathrooms. Many of the bedrooms have lake views. Located three hours from Dublin, the 113-acre estate includes nearly a mile of waterfront on the shores of Lough Conn and spectacular views of Nephin, the second-highest peak in Connacht. ""We hope that whoever buys Massbrook House will find, as we did, a haven of peace and tranquility,"" Robinson told the Irish Mirror. Massbrook House is on the market for $3,002,839.    (Photo by Simon Palfrader) Former French first lady Carla Bruni-Sarkozy's childhood home, Castagneto Po, in Turin, Italy is on the market.   Former French first lady Carla Bruni-Sarkozy's childhood home Castagneto Po, Turin, Italy  Atop a private peninsula that juts into the Mediterranean Sea is the castle where Carla Bruni-Sarkozy grew up. Bruni-Sarkozy is the wife of Nicolas Sarkozy, the former French president who is trying to reclaim the office he held from 2007 to 2012. The castle reportedly dates back to 1019. It was destroyed in 1705 and rebuilt based on the drawings of architect Nicolis de Robilant. Ernesto Melano, architect to the King of Italy, completed the renovation in 1835. By the end of 1800, the castle passed to the counts of Ceriana. Billionaire industrialist Alberto Bruni-Tedeschi acquired the 21,000-square-foot castle in 1952. The family vacated the property in the early 1970s, fearing reprisals by Marxist guerrilla groups. They held onto the property until Saudi Arabian billionaire Prince Alwaleed bin Talal bought it in 2009 for $25 million. The 40-room castle is surrounded by an English-style garden and an ancient forest on 173 acres. Valeria Bruni-Tedeschi, Carla's sister, directed and stared in a movie ""Un Chateau en Italie"" (""A Castle in Italy""), much of which was shot in the family home. The International Herald Tribune called the movie ""a Chekhovian comedy with dark autobiographical moments."" The Guardian panned it, calling the movie ""tiresome and insufferably self-regarding, all too obviously a twee personal 'project.' "" The price for Castagneto Po was not made available.    Former U.S. consul general's residence in Bermuda is for sale. It was once an inventor's home. (Courtesy of Christie's International Real Estate)   Former U.S. consul general's residence in Bermuda Chelston, 12 Grape Bay Dr., Paget Parish  The villa was built between 1939 and 1941 for Carbon Petroleum Dubbs, an inventor who perfected the method for making gasoline from crude oil. His father Jesse, also an inventor, named his son Carbon after one of the elemental constituents of oil. Carbon Dubbs added a middle initial ""P"" later in life because he liked the way it sounded. Because of his work, people eventually started calling him Carbon Petroleum, and the name stuck. Carbon Petroleum Dubbs was as quirky as his name. He reportedly wore roller skates to go from room to room because the house was so large. After he died in 1962, his heirs gave the private beachfront compound to the U.S. government. For more than 30 years, it served as the official Bermuda residence of the U.S. consul general. The 14-acre gated estate includes a 10,000-square-foot main house, three three-bedroom guest cottages, a two-bedroom staff cottage, a 75-foot swimming pool and a croquet lawn. Over the years, many high-ranking politicians have visited the home, including President George H.W. Bush, Vice President Dan Quayle, Sen. John F. Kerry, Sen. Edward Kennedy, Sen. Chris Dodd, Sen. John Breaux, Gen. Colin Powell, former Democratic presidential nominee Michael Dukakis, Attorney General Edwin Meese and Secretary of State Henry Kissinger. Other prominent guests have included syndicated columnist Ann Landers, actor Michael Douglas and actress Brooke Shields. The estate is on the market for $45 million.    The former U.S. ministerial residence in Ottawa is on the market for $2,945,343. (Courtesy of Christie's International Real Estate)   Former U.S. ministerial residence in Canada 400 Acacia Ave., Ottawa, Ontario  Designed by the highly respected architect A.J. Hazelgrove and built in 1930 for lumber baron Walter Bronson, the house in the exclusive Rockcliffe Park community of Ottawa belonged to the U.S. Embassy for 58 years. The three-story, 4,800-square-foot home has six bedrooms and four bathrooms. The house is on a landscaped, three-quarters-of-an-acre lot with mature trees. The house was featured in the film ""Mr. and Mrs. Bridge"" as the home of the characters played by Paul Newman and Joanne Woodward. It is listed at $2,945,343.  "
2	https://www.washingtonpost.com/news/morning-mix/wp/2016/11/14/the-return-of-michael-moore/	The return of Michael Moore, showman of the left	"      Documentary filmmaker Michael Moore left a note for President-elect Donald Trump at Trump Towers on Nov. 12. (The Washington Post)   On Saturday afternoon, the scruffy liberal activist and documentary filmmaker Michael Moore arrived at the base of Trump Tower in Manhattan, hoping to deliver a message to the president-elect. Wearing a dark sweater and a San Francisco 49ers hat, he rode the escalators through the gold-and-marble interior, looking for the elevators to take him to the business mogul's offices. Camera crews followed close behind, as did a crowd of onlookers, their smartphones out. Moore streamed the entire affair on Facebook Live. ""We'll see if they let me talk to him,"" he said into the camera at one point. Someone asked how far he planned to go. ""I don't know,"" Moore replied, telling followers he was surprised that police had let him into the building in the first place. Secret Service agents stopped him at the security desk. After trying unsuccessfully to negotiate his way to the high floors, Moore scribbled a note on a folded piece of paper. ""Mr. Trump. I'm here,"" it read. ""I want to talk to you."" In a tweet later in the day, he said:   I was able to get into Trump Tower & deliver him a message: ""You lost. Step aside."" SS took the note I wrote up & went 2 give it to him. -- Michael Moore (@MMFlint) November 12, 2016   It was a classic Michael Moore moment. For decades now, Moore has reveled in his role as a gadfly of the left, and cornering powerful figures -- often in awkward or unannounced appearances at their homes and offices -- has been a key part of his M.O. But it was the type of stunt that hasn't made headlines for the 62-year-old filmmaker in recent years. Indeed, it was fitting that it took the ascendance of one consummate showman, Trump, to bring out another, Michael Moore. Both have been called demagogues. After rising to hero status among liberals during the administration of President George W. Bush, Moore seemed to fade from public view when President Obama entered the White House. He continued to champion liberal causes, but some of his targets became more provincial. In the meantime, personal problems cropped up. In 2011, he fought a year-long legal battle against his financial backers over profits from his blockbuster documentary ""Fahrenheit 9/11."" In 2014, his two-decade marriage ended in a messy divorce. He went six years without putting out a film. But the 2016 presidential election has brought Moore back into the spotlight, or more accurately, he has thrust himself back into the spotlight, and Saturday's visit to Trump Tower was the latest reminder of his skills as a propagandist and his capacity to grab attention. Moore, who prides himself on his understanding of working class Americans, was one of few to predict Trump would win the nomination, telling Business Insider in December that Trump would ""absolutely"" be the Republican candidate. In July, he was one of even fewer people who saw the writing on the wall for Hillary Clinton, saying in a post on his website that Trump would be elected president, despite poll after poll indicating otherwise. ""This wretched, ignorant, dangerous part-time clown and full time sociopath is going to be our next president,"" Moore said. ""President Trump. Go ahead and say the words, 'cause you'll be saying them for the next four years."" ""Never in my life have I wanted to be proven wrong more than I do right now,"" he added. As Election Day approached, Moore fought for the Democratic nominee, releasing ""Michael Moore In TrumpLand,"" a slapdash pro-Clinton film seeking to win over skeptical voters. In a four-minute recording made during a promotional event for the film and posted to YouTube, Moore said Trump's forthcoming win would be ""the biggest 'f-- you' ever recorded in human history."" It drew a response from Trump himself:   I agree, @MMFlint- To all Americans, I see you & I hear you. I am your voice. Vote to #DrainTheSwamp w/ me on 11/8. https://t.co/D7nBwkogBb -- Donald J. Trump (@realDonaldTrump) October 27, 2016   Moore seized the moment again last week after Clinton's stunning loss in the Electoral College. On Nov. 9, he published a five-point ""Morning After To-Do List,"" calling on Trump opponents to take over the Democratic Party, fire political pundits and pollsters and take other steps to mobilize against the new Republican-led administration and Congress. Meanwhile, he has made the rounds on cable news, most recently CNN's ""State of the Union,"" where he told Jake Tapper that Democrats would have been better off running Oprah Winfrey or Tom Hanks instead of Clinton. It's a version of the Michael Moore persona that was more visible during the Bush years than the Obama years. Moore developed a following in the late 1980s with his documentary debut, ""Roger and Me,"" a critique of General Motors CEO Roger Smith's decision to close auto plants in Moore's hometown of Flint, Mich., and the impact it had on workers. But it wasn't until the early 2000s that Moore became a household name -- not to mention, a nemesis of the political right -- with a pair of enormously successful films. In 2002, he released ""Bowling for Columbine,"" a probe of gun violence in the United States told in the wake of the massacre at Columbine High School in Colorado. The film won the Academy Award for best documentary the following year. In 2004, Moore put out ""Fahrenheit 9/11,"" a conspiratorial attack on the Bush administration and the rationale for war in Iraq and Afghanistan. Bringing in more than $222 million at the box office, it still ranks as the highest-grossing documentary of all time, according to Box Office Mojo. The films propelled Moore into celebrity status, and in 2005 he was named one of Time's 100 most influential people. Actor Sean Penn wrote up the segment on Moore: ""Through endless appearances on talk shows and cable news networks, Moore never backed down from his impossible level of righteousness, even when Katie Couric referred to him as a jerk,"" Penn wrote. ""By doing so, Moore, the Bobby Knight of the left, inspired his fellow Democrats with a workingman's toughness they have lacked for some time."" But ""Fahrenheit 9/11"" had its harsh critics, most notably, the late Christopher Hitchens. He called the film ""a sinister exercise in moral frivolity"" and Moore a ""silly and shady man."" ""To describe this film as dishonest and demagogic would almost be to promote those terms to the level of respectability,"" Hitchens wrote. ""To describe this film as a piece of crap would be to run the risk of a discourse that would never again rise above the excremental."" Confrontation has always been one of Moore's specialties. In ""Roger and Me,"" he repeatedly needled General Motors staffers and others in hopes of getting an interview with Smith, eventually infiltrating a shareholder meeting to fire off his questions. In ""Bowling for Columbine,"" he presented the former National Rifle Association president with a picture of a gun violence victim, ending what was already a painfully awkward interview. And in ""Fahrenheit 9/11,"" he read the entire text of the Patriot Act to Congress through a loudspeaker on an ice cream truck. The trip to Trump Tower on Saturday had all the same hallmarks. ""It went well,"" Moore said of the visit. ""They didn't kick me out."" More from Morning Mix The post-election hate spike: How long will it last? Joe Biden reimagined, pranking Donald Trump Video shows group viciously beating man in Chicago, yelling, 'You voted Trump' and 'Don't vote Trump'"
3	https://www.washingtonpost.com/sports/dcunited/former-fifa-vp-hawit-faces-life-ban-for-bribery/2016/11/11/83ebe752-a81b-11e6-ba46-53db57f0e351_story.html	Former FIFA VP Hawit faces life ban for bribery	 ZURICH -- FIFA ethics prosecutors want former FIFA vice president Alfredo Hawit banned for life for taking bribes. The investigatory chamber of FIFA's ethics committee says the ban is requested in a final report to ethics judges. A verdict is expected within weeks. Hawit pleaded guilty in Brooklyn federal court in April to charges of racketeering conspiracy, wire fraud conspiracy, and conspiracy to obstruct justice. The 65-year-old Honduran official agreed to forfeit $950,000 upon sentencing. Hawit was acting president for CONCACAF when he was arrested at a Zurich hotel last December. A U.S. Justice Department indictment said Hawit took $250,000 in 2011 to steer CONCACAF commercial rights toward an Argentina-based agency. He was also implicated in bribery linked to World Cup qualifying matches involving Honduras. Copyright 2016 The Associated Press. All rights reserved. This material may not be published, broadcast, rewritten or redistributed. 
