	Link	Title	Text
5	https://www.washingtonpost.com/world/europe/slovakia-comes-to-grips-with-proudly-neo-nazi-party/2016/11/18/ce567cd6-ad83-11e6-8f19-21a1c65d2043_story.html	Slovakia comes to grips with proudly neo-Nazi party	" BRATISLAVA, Slovakia -- The wave of far-right parties across Europe has been gathering steam from Greece to France and Germany. While most of the continent's extreme forces have taken pains to steer clear of Nazi imagery, Slovakia's answer to the trend celebrates it. Kotleba -- The People's Party Our Slovakia -- won almost 10 percent of the seats in Parliament in March. It openly admires the Nazi puppet state which the country was during the World War II. Party members use Nazi salutes, blame Roma for crime in deprived areas, consider NATO a terror group and want the country out of the alliance and the European Union. The party takes its name from its leader, Marian Kotleba, previously chairman of the banned neo-Nazi Slovak Togetherness-National Party, which organized anti-Roma rallies and admired Nazi rule in Slovakia. Thousands have signed a petition demanding that the party be banned. Analysts say the party's popularity could grow even further. Its simple slogan -- ""With courage against the system!"" -- attracts young people fed up with corruption and the inability of mainstream parties to deal effectively with the post-communist country's problems. In contrast to most of Europe's far-right groups, ""it's truly neo-Nazi, it advocates the legacy of the Nazi war state,"" says Eduard Chmelar, a Slovak political analyst. Miroslav Mares, an expert on extremism from the Masaryk University in the Czech city of Brno, said the party belongs to the ""hard core of right-wing extremism"" in Europe. He said it has only some features similar to Greece's Golden Dawn party and to Hungary's Jobbik at its beginning. What they have in common is targeting the mainstream politics.  ""The parties like that are not looking for solutions, it's all about protests,"" Chmelar said. ""You can see it globally. It's the same with Donald Trump, it's the same with (Marine) Le Pen in France. What's important is to be against the system. They're all riding on a wave of public dissatisfaction that has been growing."" These parties ""communicate and cooperate with each other, and that dramatically changes the situation in Europe, and that's dangerous,"" Chmelar said. ""So far, there's no recipe to stop them."" Kotleba's new party made news by launching patrols on trains in April in a reaction to a robbery blamed on a member of the Roma minority. Parliament banned such activities in October. The party has proposed legislation to label non-governmental organizations that receive funding from abroad as foreign agents, and is trying to get the 350,000 signatures needed to force nationwide referendums on the country's membership in NATO and the European Union.  ""Among our major goals is above all a creation of an independent and self-sufficient Slovakia, that is Slovakia which has an autonomous foreign policy that is not dictated by any foreign structure, such as the European Union,"" Milan Uhrik, a deputy chairman of the party, told The Associated Press in a rare interview. Kotleba refuses to talk to foreign media, The AP was told. Speaking in the Parliament building, Uhrik said the EU has been turning into a super state with Brussels in power. ""What's the worst is that EU legislation is above Slovak law,"" he said. NATO is another target.  ""It's important for Slovakia to leave NATO because we consider NATO a terrorist organization. It doesn't bring peace to the world, quite the contrary,"" Uhrik said.  ""NATO is in fact a military organization of the United States and we are militarily subordinated to the United States."" A celebration of wartime Slovakia remains particularly controversial, but Uhrik says it is not about fascism.  ""As nationalists, we cannot reject the first independent Slovak state,"" he argued. ""We recognize the Slovak (war) state because it was the first Slovak state, not because it was a fascist state."" On Oct. 13, party members celebrated the 129th anniversary of the birth of Jozef Tiso, a Catholic priest and politician who was Slovakia's war president. During his rule, some 60,000 Slovak Jews were transported to Nazi death camps. He was sentenced to death and hanged in 1947. Rights activists have submitted a petition with 20,000 signatures calling for the party to be banned. Prosecutors are reviewing that request.  ""Racism, xenophobia, anti-Semitism, Holocaust denials and other such things have no place in democracy,"" said Peter Weisenbacher from Bratislava's Human Rights Institute. Kotleba is not a newcomer on Slovakia's political scene. In 2013, he was elected the head of a regional government, campaigning on a strong anti-Roma ticket. He promised to have a recipe to solve problems with the embattled minority, calling its members ""Gypsy parasites."" He defeated a candidate of the ruling leftist Smer-Social Democracy party in a runoff vote despite that party's chairman, Prime Minister Robert Fico, claiming that ""a bag of potatoes"" would beat Kotleba.  ""It was a shock for me when (Kotleba) won the regional election,"" said Ingrid Kosova, a Roma activist. ""I remember people were calling me every day saying that they were ridiculed on the streets, they were not allowed to board buses, they were really afraid. Later on the situation calmed down but until now they live with worries and fears."" In a region hit by unemployment around 15 percent, and over 25 percent in one county, Kosova said Kotleba succeeded in poor areas where the problems with the Roma minority are felt, and ""which he misused to get to power."" When the party won seats in Parliament, ""I was abroad in the Czech Republic and I was considering staying there for good,"" Kosova said. During the celebration of the 70th anniversary of the Slovak National Uprising against the Nazi rule in 2014, with foreign presidents and other dignitaries in the central city of Banska Bystrica, the seat of Kotleba's region, Kotleba was flying a black flag from his office and unveiled banners saying ""Yankees go home!"" and ""Stop NATO!"" The Uprising is considered a defining moment of the Slovak history, and for most Slovaks a source of national pride because they stood against the Nazi rule. Peter Gogola was mayor there at the time.  ""I can't forgive him that,"" Gogola said. ""My grandpa was forced to fight in the Hungarian fascist army and died at Stalingrad. I can't stand fascism."" Martin Slosiarik, the head of Bratislava-based pollster Focus, said 70 percent of those who voted for Kotleba are under 40. He said most of them voted for him not because they would share his extremist views but because he promised ""to deal with the Roma and get rid of corruption.""  ""They've learned how to work with the public opinion to create a picture that they're the only force ready to challenge the current corrupt system,"" Chmelar said. He predicted the party could reach more than 10 percent of the popular vote at the next election. Copyright 2016 The Associated Press. All rights reserved. This material may not be published, broadcast, rewritten or redistributed. "
6	https://www.washingtonpost.com/politics/congress/the-latest-ohio-dem-hints-at-challenge-to-pelosi/2016/11/17/290a8990-ace1-11e6-8f19-21a1c65d2043_story.html	The Latest: Ohio Dem to challenge Pelosi for minority leader	" WASHINGTON -- The Latest on Congress (all times local): 3:20 p.m. Ohio Rep. Tim Ryan says he'll challenge Nancy Pelosi for the party's top House leadership position, saying ""what we are doing right now is not working"" after a shellacking in last week's election. Ryan announced his run in a letter to colleagues Thursday. House Democrats will hold leadership elections Nov. 30. In the letter, Ryan noted that over the past 18 years, Democrats have only been in the majority in the House for two terms, and ""last week's election results set us back even further,"" he said. Pelosi is well-known for her ability to count votes. She said Wednesday she has the backing of two-thirds of the caucus. Ryan has dismissed that claim. House Democrats gained a handful of seats in last week's election, not nearly as many as Pelosi had predicted. ___ 10:35 a.m. Democratic leader Nancy Pelosi says a letter by FBI Director James Comey announcing a probe into additional emails related to the bureau's investigation of Hillary Clinton was a ""foul deed"" that cost Democrats the election. The California Democrat told reporters that Comey's letter ""really just changed everything"" and ""was dispositive of the election."" Pelosi noted that Comey declined to talk about the hacking by the Russians of the emails of Clinton Campaign chair John Podesta and other Democrats because of a bureau policy of avoiding statements that could affect the election. ___ 10:52 a.m. Ohio Rep. Tim Ryan is strongly hinting that he'll challenge Democratic leader Nancy Pelosi. Ryan said Thursday that he would make a decision soon and he believes he would have a chance to unseat the California lawmaker who has led her party for more than a decade. Some discontented Democrats have been clamoring for new leadership after their shellacking last week. The party lost the White House and only made small gains in the House and the Senate, leaving Democrats in the minority. Ryan says there's a lot of anxiety in the caucus and a lot of people want some change. He added: ""I would think it has to be at the top."" Democrats were supposed to vote on Thursday but postponed the vote to Nov. 30. ___ House Republicans leaders say President-elect Donald Trump wants a short-term spending bill to keep the government running through March of next year. The current stopgap spending bill runs out in less than a month, on Dec. 9. House and Senate negotiators are working on a bill they could pass before leaving for the holidays. House Republicans met Thursday behind closed doors with Vice President-elect Mike Pence. Speaker Paul Ryan told them the new administration prefers a four-month extension of spending. Such a move would let the Republican-controlled government boost military spending while making deep cuts in domestic programs next year. Copyright 2016 The Associated Press. All rights reserved. This material may not be published, broadcast, rewritten or redistributed. "
7	https://www.washingtonpost.com/local/virginia-politics/kaine-will-not-run-for-president-in-2020-will-seek-reelection-to-the-senate/2016/11/17/63ee17d4-acf5-11e6-a31b-4b6397e625d0_story.html	After a crushing defeat, Sen. Tim Kaine looks ahead	" If the world didn't know that Sen. Tim Kaine had just lost the vice presidency, a crushing defeat for the man, the Democratic Party and millions of American voters, nothing about his demeanor would give it away. Smiling broadly, Kaine sat in his Senate office Thursday with the air of a man who had just won the lottery. ""I'm disappointed because I think I would have done a good job and I think Hillary would have been a great president, but I have a job to do here that in some ways may have gotten more important,"" he said, bluegrass music playing in the background. He ruled out a run for the White House in 2020 but will seek reelection in 2018, and Republicans are gunning for him. They are bolstered by a sense of dominance over American politics not felt since 1928 and believe they have a deep bench in Virginia. ""I'm assuming it's going to be the hardest race I've ever run,"" he said. ""Presidential elections we do well. Off-year elections are tough.""     While introducing Hillary Clinton at her concession speech on Nov. 9 in New York City, Sen. Tim Kaine (D-Va.) drew cheers and applause when he quoted William Faulkner's words, ""They kilt us but they ain't whupped us yit,"" as a way to encourage Democrats to move forward. (The Washington Post)   Pressed repeatedly, Kaine did not want to talk about what went wrong for Democrats this election.  ""While I have some thoughts, I'm not objective about it,"" he said. Joining the ticket just three months before Election Day, Kaine couldn't have had much say in strategy or the contours of the race. He said Hillary Clinton ran into historic head winds trying to be the first female president and noted that only two Democratic presidents were elected following a two-term Democratic presidency -- Martin Van Buren and Harry S. Truman.  Kaine, chosen in part because of his ability to communicate with Latino voters in fluent Spanish, offered no explanation for why the campaign didn't win more Hispanic votes, except to say that no minority group is monolithic. He said he understood why daily protests continue around the country more than a week after an election in which Clinton won the popular vote but Donald Trump won the office. ""I view it as people are afraid, and I think they have reason to be afraid,"" he said, adding that he will go to battle over what he called the ""normalization"" of bigotry that he sees in President-elect Donald Trump's appointment of Stephen K. Bannon as his chief strategist. Kaine said he had no advice for protesters other than to encourage them to get involved in politics at the state and local level. ""Look, civil disobedience has an important role in the history of this country,"" he said. ""I'm not encouraging folks, and I'm not discouraging them."" Kaine said he always thought there was a chance he and Clinton could lose, but on election night, the results from the conservative Richmond suburb of Chesterfield, where Trump had a relatively weak showing, convinced him that they would win. It hadn't occurred to him, he said, that Democrats could win Virginia by a bigger margin than President Obama did in 2012, and win the popular vote by more than 1 million votes, and still lose. Kaine moved to Virginia's capital city and served as Richmond's mayor, as well as lieutenant governor and governor, in hopes of making the state more progressive, he said. He had never lost an election. Kaine said he had felt an ""interesting set of emotions"" once it became clear that Trump was surging ahead in the electoral college count. Like much of the country, Kaine stayed awake past midnight to await the final results. Then he took a nap. Late the next morning, he introduced Clinton with hastily prepared notes scrawled on a piece of hotel stationery. After the speech, his wife, former Virginia secretary of education Anne Holton, kept the paper for their children to cherish. The William Faulkner quote he recited -- ""They kilt us, but they ain't whupped us yit,"" -- was one he clung to when he lost difficult cases during his 17 years as a civil rights lawyer. He and Holton spent the weekend in the Outer Banks of North Carolina, where they ""kvetched"" a bit but mostly reflected on the good things in their lives, he said. They will celebrate their 32nd anniversary on Thanksgiving Day. On Tuesday, Kaine drove himself to Washington, returning to the predictable rhythms of the Senate and his Russell Building office. On Friday, he plans to travel with Sen. John McCain (R-Ariz.) and other lawmakers to a national security forum in Halifax, Nova Scotia, a trip he has made every year as senator. Kaine sits on the Foreign Relations and Armed Services committees, and although he's not officially part of the leadership, he said he plans to vigorously defend principles such as the constitutional powers of Congress, which could be crucial under Trump. Calling the Democratic Senate minority the ""only emergency brake"" on matters of fundamental values, Kaine said he is proud of his colleagues for focusing on Bannon and ""not allowing the appointment of someone who has connections to anti-Semitism and white nationalism to be just normalized."" But common ground could be found with the Trump administration over a sweeping infrastructure bill that was also a Clinton priority, he said. He has said he would like to fashion his Senate service after retired senator John Warner (R-Va.), who spent 30 years in office. Virginia Republicans had praised Kaine's bipartisanship in the past but criticized his presence on the national ticket and his comment Thursday that he will seek reelection. Virginia GOP Chairman John Whitbeck said the announcement suggests he's inappropriately mixing government service and politics.  After nonstop travel to 40 states, Kaine relishes his return to home life in Northside Richmond, ""where nobody calls me Senator."" The day after the election, he and Holton flew back to Richmond from New York on the campaign plane. After they said an emotional goodbye to the Secret Service officers with whom they had grown close, Kaine said, he climbed the back steps to his kitchen and puttered around for a few minutes before going into his home office. Peering out the window, he watched the government vehicles pull away one by one. A wave of emotion came over him, he said. It was relief. "
8	https://www.washingtonpost.com/business/trumps-tangled-businesses-pose-potential-for-conflicts/2016/11/16/0892f27c-ac25-11e6-8f19-21a1c65d2043_story.html	‘Tangled web’: Trump’s businesses could create conflicts	" NEW YORK -- Asked on TV earlier this year whether a President Donald Trump would ever mix politics with business, his eldest son, Donald Jr., said there was no risk of that. The son, an executive in his father's company, insisted the two wouldn't discuss the business if Dad ever got to the White House. Then Donald Jr. added two words: ""Trust me."" The American people may have little choice. The tradition stretching back to Jimmy Carter in the late 1970s is for presidents to put personal holdings such as stocks into a ""blind trust"" run by an independent trustee with no ties to the occupant of the Oval Office. But as with so many other areas of politics, Trump looks ready to upend this time-honored practice. Trump's plans to hand control of his Trump Organization to three of his adult children and not a trustee cannot be considered a blind trust, said Kenneth Gross, head of political law at the firm Skadden, Arps, Slate, Meagher & Flom. Even if the president-elect were to appoint a trustee with no family ties, that would probably not remove the potential for Trump to use his new power over policy to enrich himself. Liquidating Trump's holdings would be difficult, and so he would always be aware of what assets he holds. Voters have long worried about elected officials using their power to line their pockets -- or those of business partners -- and shape policies to advance their private interests. But rarely has an incoming president represented such potential for conflicts of interest. No previous commander in chief has brought with him such a sprawling business empire with so much complexity, opaqueness and opportunity for self-dealing. Trump owns golf clubs, office towers and other properties in several countries. He holds ownership stakes in more than 500 companies. He has struck licensing deals for use of his name on hotels and other buildings around the world and has been landing new business in even more countries -- in the Middle East, India and South America. Gross calls Trump's holdings ""unprecedented"" in size and complexity for a president, a ""tangled web"" of potential conflicts that would be difficult to unravel. As it turns out, Trump doesn't even have to try. Presidents are not required to set up blind trusts. In fact, they can even run a business from the White House, though Trump has said he will not. Federal ethics rules put strict limits on nearly all government employees and elected officials to prevent self-dealing, but the rules do not apply to the president. One area where the public interest could clash with the personal involves Trump's influence over federal agencies whose decisions affect his businesses. In turning the government-owned Old Post Office into his new Washington hotel, Trump struck a complex rental and management deal with the General Services Administration. As president, he will appoint the head of the GSA. And one of Trump's lenders, Deutsche Bank, is in settlement talks with the Justice Department over its role in the mortgage blowup that sparked the 2008 financial crisis. Trump will appoint the head of that agency, too. For his part, Trump has dismissed the idea that he is even interested in his business now. In an interview with CBS' ""60 Minutes"" on Sunday, he said he was fully engaged in efforts to ""save our country.""  ""I don't care about hotel occupancy,"" he added. He called matters like that ""peanuts."" The Trump Organization said in a statement that it is ""vetting various structures"" with the goal of transferring management to three of Trump's children, along with a ""team of highly skilled executives."" Carter started the tradition of presidential blind trusts when he put his peanut farm in one. All the presidents who followed also set up one, according to Gross, save for Barack Obama, who mostly had holdings in plain-vanilla index funds. With a blind trust, owners can't control their portfolio and may not even know what's in it. Trustees sometimes sell off holdings and invest the money elsewhere without the owner's knowledge.  ""It's one thing to sell 1,500 shares of Procter & Gamble. You can do that easily,"" Gross said. ""It's another thing to sell a golf course in a foreign country or extricate from a branding contract."" In the 2012 presidential election, Republican nominee Mitt Romney, who had vast holdings from working at buyout firm Bain Capital, pledged to put his wealth in a blind trust certified by the Office of Government Ethics. On CNN on Sunday, Trump adviser Rudy Giuliani suggested the president-elect could set up a blind trust. Later he suggested a more flexible arrangement might be necessary given the role of Trump's children in his business. He called the situation ""very unusual.""  ""There's no perfect way to do this,"" Giuliani said. ""You have to have some confidence in the integrity of the president."" ___ Bernard Condon can be reached at http://twitter.com/BernardFCondon. Copyright 2016 The Associated Press. All rights reserved. This material may not be published, broadcast, rewritten or redistributed. "
