	Link	Title	Text
0	https://www.washingtonpost.com/local/baltimore-appeals-ruling-on-pregnancy-center-sign-ordinance/2016/11/17/6f317948-acf4-11e6-8f19-21a1c65d2043_story.html	Baltimore appeals ruling on pregnancy center sign ordinance	 BALTIMORE -- Lawyers for the city of Baltimore have asked the 4th U.S. Circuit Court of Appeals to overturn a lower-court ruling that a 2009 Baltimore ordinance cannot force a pregnancy center to post a disclaimer stating that it won't refer women for abortions. The Daily Record of Baltimore reports (http://bit.ly/2fZN1e2) the city made the appeal Wednesday. Senior U.S. District Court Judge Marvin Garbis ruled last month that the ordinance violates the Center for Pregnancy Concern's free speech rights. The center, which operates in buildings owned by the Catholic Church, provides free pregnancy services to women but does not refer them for abortions. Enforcement of the ordinance is on hold until the litigation is resolved. ___ Information from: The Daily Record of Baltimore, http://www.thedailyrecord.com Copyright 2016 The Associated Press. All rights reserved. This material may not be published, broadcast, rewritten or redistributed. 
1	https://www.washingtonpost.com/business/average-us-30-year-mortgage-rate-jumps-to-394-percent/2016/11/17/0cbef26a-acd9-11e6-8f19-21a1c65d2043_story.html	Mortgage rates surge, but homebuyers advised to be patient	" WASHINGTON -- With mortgage rates surging following the election win of Donald Trump, homebuyers may feel compelled to snap up loans before rates rocket even higher. But housing experts say consumers shouldn't get carried away by the post-election wave. The advance of the past week or so, stoked by a surprise victory that turned economic expectations on their head, could soon settle.  ""Consumers considering buying or refinancing now should stay patient, as we'll likely see rates stabilize once markets find a new equilibrium,"" says Erin Lantz, vice president of mortgages at Zillow. In the week ended Thursday, the average rate on the 30-year fixed-rate loan jumped to 3.94 percent from 3.57 percent the previous week, mortgage company Freddie Mac reported. That put the benchmark rate close to its year-ago level of 3.97 percent. The average for a 15-year mortgage, a popular choice for people who are refinancing, climbed to 3.14 percent from 2.88 percent. The rate rise was powered by a sustained decline in U.S. government bond prices in the days after Trump's victory became known early last Wednesday. Bond investors looked toward tax cuts and beefed-up spending to upgrade roads, bridges and airports under a Trump administration, which could fuel inflation. That would depress prices of long-term Treasury bonds because inflation would erode their value over time. The selling wave dubbed the ""Trump Dump"" lifted bond yields, which move opposite to prices and influence long-term mortgage rates. The yield on the 10-year Treasury bond zoomed to 2.06 percent last Wednesday from 1.87 percent on Election Day Tuesday. By this Thursday morning, it was at 2.25 percent Thursday. Adding to the expectations of higher interest rates, Federal Reserve Chair Janet Yellen sketched a picture Thursday of an improving U.S. economy and said the case for an increase in rates has strengthened. The Fed is widely expected to raise rates when it meets in mid-December. Spilling over into the mortgage market, prospective buyers have appeared to be streaming in.  ""We are seeing borrower demand up,"" said Sam Mischner, senior vice president of sales at LendingTree. Still, mortgage rates remain near historically low levels. The all-time low for the 30-year rate was 3.31 percent in November 2012.  ""Rates are so low,"" said Patrick Newport, U.S. economist at HIS Global Insight. If the new expectations for the economy and interest rates ""make a dent in the housing market, it shouldn't be much."" The low rates have helped boost home sales and prices this year. But there are economic unknowns as the new administration's economic policy starts to take shape. And constraints on home purchases like tight credit standards and affordability remain, bolstered by market expectations of further rate increases. Steadily rising rates would ultimately limit the number of possible buyers and how much they can afford to pay. And existing homeowners who might otherwise be looking for an upgrade could choose to stay put rather than face higher interest costs. The median sales price of existing homes has climbed 5.6 percent from a year ago to $234,200, according to the National Association of Realtors. To calculate average mortgage rates, Freddie Mac surveys lenders across the country between Monday and Wednesday each week. The average doesn't include extra fees, known as points, which most borrowers must pay to get the lowest rates. One point equals 1 percent of the loan amount. The average fee for a 30-year mortgage was unchanged from last week at 0.5 point. The fee for a 15-year loan also held steady at 0.5 point. Rates on adjustable five-year mortgages averaged 3.07 percent, up sharply from 2.88 percent last week. The fee remained at 0.4 point. Copyright 2016 The Associated Press. All rights reserved. This material may not be published, broadcast, rewritten or redistributed. "
2	https://www.washingtonpost.com/news/early-lead/wp/2016/11/17/white-texas-teens-chant-build-that-wall-at-hispanics-during-high-school-volleyball-match/	White Texas teens chant ‘build that wall’ at Hispanics during high school volleyball match	" ""Build that wall."" It's a phrase that became synonymous with Donald Trump's high-intensity campaign rallies, an expression that became more rallying cry than policy proposal during his rise to political power. As Trump's candidacy gained momentum over the past year, calls for shoring up America's southern border became something else -- a form of teenage bullying. One of the latest examples came at a high school volleyball tournament in Snyder, Tex., where Archer City High was facing off with Fort Hancock on Friday. Clumped in the stands, according to the Dallas Morning News, a group of Archer City students holding Trump/Pence signs and wearing wigs, trucker hats and fake mustaches directed a chant toward their opponents on the other side of the gym: ""Build that wall."" Fort Hancock is about an hour south of El Paso, along the Mexican border. The Fort Hancock Independent School District's student population is 97 percent Hispanic, according to the Fort Worth Star-Telegram. Archer City is about two hours northwest of Dallas, near the Oklahoma border. The Star-Telegram, citing the Texas Education Agency, noted that Archer City High had an enrollment of 384 students last year, 83 percent of whom were white. Just 9 percent of the students were Hispanic. The Archer City students also held a Texas flag and a second one declaring, ""Come and Take It."" The latter is an iconic emblem of the Texas revolution that was flown at the Battle of Gonzales, the first military clash between Texans and Mexican forces. Known to anyone who's taken an eighth-grade history class in the state, it remains a source of antagonistically tinged pride among some Texans who look down upon their southern neighbor.   [A Baylor student was shoved and called the n-word. This is how the school responded.]   For some in the crowd, the chant and the flag were highly offensive. ""No doubt in my mind that this sentiment has always existed with groups of people but to display it so openly is so not correct!,"" Carlos Urias wrote in a post on Facebook the next day. ""I guess it makes it easier to treat others in this manner being that this sentiment was modeled verbally during the course of the presidential campaign. ........Sad."" The ""Build that wall"" chant had become a fixture of Trump's raucous rallies, The Washington Post's Jenna Johnson reported in February: ""The wall nearly always comes up in Trump's rally speeches and it often prompts laughter and applause -- and protesters with signs outside the rallies,"" Johnson reported. ""The wall is so popular with his supporters that Trump gleefully realized at a recent rally that he could drown out a protester who was starting to act out by suddenly switching topics and mentioning the wall. At Trump's rally at the University of South Florida in Tampa on Friday, one guy dressed up as the wall, wearing a white bodysuit with bricks drawn on it and a sign reading: ""The Trump Wall."" As the promise of the Trump's wall becomes bigger, grander and more fantastical, it is sometimes difficult to tell if Trump is joking or sharing a serious policy development. Trump said Friday that he's dead serious. ""These people come up to me, they say: 'Donald! You don't really mean we're going to build a wall, do you?' And I say, I say: 'Absolutely, we're going to build a wall,'"" Trump said, as the crowd yet again cheered. ""Hundred percent.""   [Middle schoolers chant 'build that wall' during lunch in aftermath of Trump win]   The Archer City School District said in a Facebook statement Sunday that administrators were ""aware of some offensive language used by our student section during the Ft. Hancock game"" and were taking ""appropriate action ... to address this behavior."" ""In no way do we condone this type of language or behavior,"" the statement read. ""We apologize to the students and community of Ft. Hancock. The administration is making every effort to ensure this doesn't happen again."" Archer City Superintendent C.D. Knobloch told the Star-Telegram that he suspected heated emotions from the election spilled over into the volleyball match. ""In my opinion it is stemming from the presidential election,"" Knoblock told the paper. ""If we hadn't had that election last week, this wouldn't have happened. Our students are not racists. It's as simple as that."" ""We're sorry this happened,"" Knobloch added. ""The whole community is torn up about it."" Fort Hancock Superintendent Jose Franco told the Star-Telegram that he accepted Archer City's apology. ""I guess what bothered me most was no adults, no officials did anything about it while the match was going on,"" Franco told the paper. ""We come from a very competitive district where's there's plenty of trash talk and that's just part of the game, having fun with it, but this is the first time it has ever crossed the line."" ""Little did they know that Hudspeth County where we live went for Trump,"" Franco added. Sixty-seven percent of Hudspeth County, in fact, voted for the Republican candidate while 28 percent voted for Hillary Clinton, according to the Texas Secretary of State. In Archer County, Trump collected 88 percent of the vote to Clinton's 9 percent. Perhaps even more absurd, Franco told the Star-Telegram, was the concept of chanting ""build that wall"" at Texans who live near the Mexican border. ""You know the wall is a joke, right?"" Franco said. ""My office sits less than a mile from the Rio Grande port of entry. We have a wall. It looks like something out of Jurassic Park. It goes two miles each way from the port of entry and then it ends in nothing.""   ['Bye, Donald Trump lover': Video shows mother kicking her young son out over mock election vote]   The Texas chant was one of numerous incidents that occurred in the wake of Trump's Election Day victory. Students at a Michigan middle school began chanting ""build the wall!"" during lunch on the day after Trump's election.      Students at a middle school in Royal Oak, Mich., chanted ""build the wall"" in the school cafeteria, following Donald Trump's presidential win Nov. 9. (Anonymous via Storyful)   A black student at Baylor said she was shoved by a white male while walking to class on the morning after the election. Her assailant, a fellow student, told her ""no n---s allowed on the sidewalk,"" she said -- then echoed Trump's campaign slogan, declaring: ""I'm just trying to make America great again."" Days later, a University of Michigan student was approached by a stranger who threatened to set her on fire if she didn't remove her hijab, campus police said. At a high school in Pennsylvania, two students paraded through the hallways with a Trump sign as one student shouted, ""White power!"" -- a moment that was captured on video. On Saturday, an Episcopal church in Maryland was vandalized with a chilling message: ""Trump nation. Whites only."" The following morning, in central Indiana, the organist at an Episcopal church discovered a swastika, an anti-gay slur and ""HEIL TRUMP"" spray-painted on the outside walls. In an interview with CBS's ""60 Minutes"" broadcast Sunday night, Trump said that he was ""so saddened to hear"" that people were harassing others in his name. ""And I say, 'Stop it,'"" the president-elect said. ""If it -- if it helps, I will say this, and I will say it right to the cameras: 'Stop it.'"" Three days later, a Maryland high school student wearing a red ""Make America Great Again"" hat was injured and taken to the hospital after he scuffled with a group of anti-Trump protesters who punched and kicked him.          1 of 10       Full Screen Autoplay  Close                                           Skip Ad   x           Here's what president-elect Donald Trump has been doing after the election      View Photos   He has been holding interviews and meeting with Congress and the president as he prepares to transition into the White House.    Caption   He has been holding interviews and meeting with Congress and the president as he prepares to transition into the White House.  Nov. 18, 2016 A motorcade vehicle transporting President-elect Donald Trump arrives at Trump National Golf Club in Bedminster, N.J. Jabin Botsford/The Washington Post  Buy Photo          Wait 1 second to continue.   .wp-volt-gal-preroll-video{width:100%;height:100%}        MORE READING:  Marc Gasol buries the Clippers, dances like no one's looking Hoping for unity, Kent State basketball puts a new spin on the national anthem LeBron James to donate $2.5 million for Muhammad Ali exhibit"
3	https://www.washingtonpost.com/national/conservative-indiana-lawmaker-proposes-state-abortion-ban/2016/11/17/3266292a-acf2-11e6-8f19-21a1c65d2043_story.html	Conservative Indiana lawmaker proposes state abortion ban	 INDIANAPOLIS -- An Indiana Republican lawmaker says he will propose legislation next year that would effectively ban abortion in the state, despite a 1973 U.S. Supreme Court decision that established a nationwide right to abortion. State Rep. Curt Nisly, of Goshen, says he'll sponsor the bill when the Legislature meets in January. Abortion-rights groups are certain to oppose the measure, and it is doubtful that it will advance in the Statehouse. But anti-abortion groups are emboldened by Donald Trump's election and hope the Republican president-elect will appoint Supreme Court justices who will overturn Roe v. Wade. Social conservative activist Monica Boyer says now is the time to push for legislation like Nisly's. She and other abortion opponents hope a legal challenge would reach the nation's highest court. Copyright 2016 The Associated Press. All rights reserved. This material may not be published, broadcast, rewritten or redistributed. 
4	https://www.washingtonpost.com/world/middle_east/1-month-in-iraq-still-faces-grueling-urban-combat-in-mosul/2016/11/17/03c416fc-acd6-11e6-8f19-21a1c65d2043_story.html	1 month in, Iraq still faces grueling urban combat in Mosul	" MOSUL, Iraq -- Layers of hastily erected barricades built from rubble and twisted metal trace Mosul's eastern front line where Iraqi forces and Islamic State group fighters are facing off in the dense neighborhoods and narrow alleyways of the country's second largest city. As the operation to retake Mosul enters its second month on Thursday, Iraqi forces are preparing for prolonged, grueling urban combat. They have slowed the tempo of their operations, advancing just a few hundred meters at a time. Iraqi forces have gathered troops many times the estimated 5,000 IS fighters in the city. But hundreds of thousands of civilians still remain in the city. And the ferocity and magnitude of IS counterattacks and defenses in Mosul is unlike anything Iraqi forces have confronted in the fight against the militant group so far. As a result, overwhelming force can't bring swift victory, and the campaign is likely to take weeks. THE EASTERN FRONT Iraqi forces have advanced the furthest and faced the heaviest resistance in Mosul's east. Iraq's special forces say they control significant pockets of four of Mosul's easternmost neighborhoods: Zahra, Qadisiya, Tahrir and Gogjali. The territory measures less than a tenth of the city's total area. Inside those neighborhoods, Iraqi forces are now surrounded by thousands of civilians as they continue to push to the city center. The presence of civilians has already thwarted the use of overwhelming air power to clear territory. Iraqi officers say they also worry that IS supporters among the civilians are helping the group.  ""We control all of this area,"" Iraqi special forces Maj. Ahmed Mamouri said, speaking in the Zahra district. ""We've cleared the territory of fighters, but some of the civilians still support Daesh,"" he said using the Arabic acronym for the Islamic State group. Mamouri said he believes IS supporters still living in this neighborhood are acting as spotters to aim mortar attacks and scout targets for suicide bombers. That forces his men to not only focus on the front-line fight, but also look backward and repeatedly screen the thousands living among his men's positions, supply lines and defenses. When IS initially swept into Mosul in 2014 the group was met with significant popular support from residents, who are overwhelmingly from the Sunni Muslim minority that has long resented marginalization by the Shiite-dominated central government. That support has eroded under more than two years of harsh militant rule and dire living conditions, Iraqi and coalition officials believe. ___ A COMPLEX, BLOODY FIGHT AHEAD Over the past year, Iraqi forces have slowly clawed back territory from IS. Facing a militant organization that proclaimed itself a state, Iraq's security forces battled IS with conventional military tactics: cutting supply lines, besieging cities and measuring victory in square kilometers. In Mosul, Iraqi forces are undertaking a much more complex fight. Mosul is not yet surrounded by Iraqi forces and has smuggling routes and supply lines with IS territory in Syria. Iraq has mobilized some 100,000 troops from the military, as well as tribal and militia fighters, to take on the estimated 5,000 IS fighters inside Mosul. Also, the U.S.-led coalition has deployed some 100 U.S. troops to Iraqi front lines to help. The coalition has also launched more than 4,000 airstrike the past month, mainly around Mosul, and provided Iraqi forces with surveillance and intelligence. The individual tactics employed by IS mirror past fights: extensive tunnel systems, large, armored car bombs, snipers and small units of fighters left behind to fight to the death. But the sheer scale of IS defenses and counterattacks in Mosul has stunned Iraq's military. During a single week, Iraqi special forces Lt. Col. Muhanad al-Tamimi said more than 30 car bombs attacked his troops on Mosul's eastern edge. The U.S.-led coalition estimates that since the operation was formally announced, coalition airstrikes destroyed hundreds of meters of IS tunnel networks. The group has deployed 158 car bombs since the assault on Mosul began, according to a senior Iraqi official who spoke on condition of anonymity to disclose the number. Col. John Dorrian, a spokesman for the U.S.-led forces supporting the operation, said Tuesday that airstrikes had destroyed 59 suicide car bombs and over 80 tunnels used by Islamic State fighters. ___ HUMANITARIAN FALLOUT In past fights against IS in Ramadi and Fallujah, Iraqi ground forces emptied entire cities of their civilian populations, simplifying the battlefield. In Mosul, a city more than five times the size of Ramadi, that's not an option. Aid groups warn that the massive displacement of those still living in Mosul would overwhelm humanitarian organizations and the Iraqi government. Iraqi commanders responded by telling people to stay in their homes and wait out the fight. But aid groups and government agencies can't reach the thousands sheltering so close to the front line.  ""We give them everything,"" said al-Tamimi, who commands one of the divisions leading the Mosul advance. He says his men distribute extra food and water to civilians when they can, but eventually the government needs to step in. Convoys of black armored Humvees weave past small groups of civilians sitting on street corners and crowds lining up outside a handful of reopened shops. Hundreds of civilians also continue to flee daily from areas still under IS control, filing past front lines and holding white flags fashioned from scraps of fabric. ___ SOUTHERN AND WESTERN ADVANCES Iraqi forces to the south, north and west of the city are struggling to cut supply lines and tighten their hold on the city. On the city's southern approach, Iraqi forces advanced more than 40 kilometers (24 miles) over the past month, largely up the Tigris River valley. They are now preparing to launch an operation to retake Mosul's airport on the city's southern edge. Over 60 kilometers (36 miles) west of Mosul, government-sanctioned Shiite militia forces are slowly working to surrounded the historically Turkmen town of Tal Afar, which sits on a key supply line linking IS-controlled territory in Iraq to the group's holdings in Syria. ___ ONE FAMILY'S STORY Since the operation began, more than 56,000 civilians around northern Iraq have been forced from their homes, according to the United Nations. Inside Mosul, thousands remain in neighborhoods retaken by government forces. But thousands more have been driven from their homes by the fighting. Mahmoud and his family waited out weeks of airstrikes and shelling in Mosul's Qadisiya al-Thaniya neighborhood. Loud explosions that shook the house and broke windows became commonplace. Early in the operation, an airstrike destroyed a car bomb just two houses away.  ""The shrapnel landed on the roof of our house and in the garden,"" he said. He spoke on condition only his first name be used, fearing for the safety of family still in IS-held parts of Mosul. When clashes broke out on his street, Mahmoud decided to pick up and move a few blocks away from the front line with his wife, children and their grandparents. Everyone packed small bags and waited until the fighting subsided at dawn to flee. Then just minutes after leaving their home, Mahmoud's father in law stepped on a booby-trapped explosive. The blast killed him instantly. The rest of the family suffered shrapnel wounds. After the blast, Iraqi troops evacuated the entire family to a front-line field clinic on the city's outskirts.  ""I haven't told my children yet that their grandfather is gone,"" Mahmoud whispered, his eyes welling with tears. From here, he said he was told his family would be taken to a camp for displaced civilians to wait until it's safe to return.  ""This war will be difficult,"" he said, ""I don't expect to go home for at least a year."" Copyright 2016 The Associated Press. All rights reserved. This material may not be published, broadcast, rewritten or redistributed. "
