	Link	Title	Text
5	https://www.washingtonpost.com/express/wp/2016/11/17/8-things-to-do-in-d-c-maryland-and-virginia-from-nov-17-23/	8 things to do in D.C., Maryland and Virginia from Nov. 17-23	"   Joe Mande has to figure out how to make the election funny in D.C. this weekend. (Getty Images)  Nov. 17-19: Joe Mande Drafthouse Comedy, 1100 13th St. NW; Thu., 7 p.m., Fri., 8 & 10 p.m., Sat., 7 & 9 p.m., $25. Joe Mande, a former writer for ""Parks and Recreation"" (where he also played Pawnee townie Morris), is currently on his Drake-referencing ""Autumn Sixteen"" tour, which finds the 33-year-old working out new material. Mande is a versatile comic, often sharing his observations on life and pop culture through an absurdist filter. He's also called out corporations for ill-advised promotional tweets on Sept. 11, and he constantly trolls Newt Gingrich on Twitter. [Nov. 17: After a freakout, Hiss Golden Messenger's M.C. Taylor finds balance] Nov. 17: Troye Sivan EagleBank Arena, 4500 Patriot Circle, Fairfax; Thu., 7:30 p.m., $29.50-$39.50. South African-born, Australian-based singer, actor and YouTube personality Troye Sivan is -- clearly -- a man of many talents. But the 21-year-old seems to be making music his focus of late, ever since he released his debut album, ""Blue Neighbourhood,"" late last year. Filled with emphatic EDM-pop anthems (and electro-enhanced ballads), Sivan's debut is very now, which may explain why his single ""Youth"" has been streamed more than 215 million times on Spotify.    Nov. 17: Zadie Smith, 'Swing Time' Sixth and I Historic Synagogue, 600 I St. NW; Thu., 7 p.m., $30 (includes book). On the surface, award-winning British author Zadie Smith's new novel ""Swing Time"" is about two girls who dream of becoming dancers. But there's a deeper story -- one that examines friendship, race, fame, class and more. Smith will discuss (and sign copies of) the book Thursday with Michele Norris, curator of The Race Card Project and a former NPR host. Sixth and I Historic Synagogue, 600 I St. NW; Thu., 7 p.m., $30 (includes book). [Nov. 18: The National Portrait Gallery mounts its first show dedicated to video art with 'Bill Viola: The Moving Portrait'] Nov. 18-22: 'Broadway Tomorrow' Kennedy Center, 2700 F St. NW; Fri.-Tue., 6 p.m., free. For five days, the Kennedy Center is using the Millennium Stage to showcase some of Broadway's up-and-coming stars. The series will feature a variety of free performances from the likes of Zack Zadek, Sean Hartley and, as a duo, Ashleigh Rubenach and Stephen Ross Madsen. Nov. 18: Laura Jane Grace, 'Tranny' Politics and Prose, 5015 Connecticut Ave. NW; Fri., 7 p.m., free. Against Me! singer Laura Jane Grace, who came out as a transgender woman in 2012, uses her new memoir, ""Tranny,"" to tell a vivid account of her early struggles with identity and addiction, and the effect these internal conflicts had on her work and her relationships. Grace will discuss her life -- and her activism as an outspoken advocate for human rights -- and sign copies of the book in D.C. on Friday. [Nov. 19: My Morning Jacket's Jim James got political on his new album. Thanks to Trump, he's only getting started.] Nov. 18-23: 'Clue' AFI Silver, 8633 Colesville Road; Fri.-Wed., various times, $13. So ... how are you feeling about this year's Thanksgiving conversation around the dinner table? Need some silliness? A little time to laugh and forget? Well, DONE. The AFI Silver is showing ""Clue,"" that ridiculous 1985 board-game-based movie that proved once and for all that Madeline Kahn is the greatest comedic actress of all time. (The other people in it are good, too.) If things get heated over the holiday, just use her ""flames ... flames on the side of my face"" as your mantra and you'll make it through.    [Nov. 20: Want to feel optimistic about America? Go see this Stuart Davis show at the National Gallery of Art] Nov. 18: National Press Club Book Fair and Authors' Night National Press Club, 529 14th St.; Fri., 5:30-8:30 p.m., $10. Signed books make great holiday gifts, and the National Press Club Book Fair is the perfect place to stock up on practically every genre. Nearly 100 authors will be in attendance, talking to fans and signing books. One book worth seeking out: ""Seoul Man: A Memoir of Cars, Culture, Crisis, and Unexpected Hilarity Inside a Korean Corporate Titan,"" by Frank Ahrens, a former Washington Post reporter who experienced every possible kind of culture clash when he got married and moved to Korea to work in Hyundai's public relations department. [Nov. 20 & 22: Guitarist Neal Casal jams in two different bands this week in D.C.] Nov. 20: Brandy Fillmore, 8656 Colesville Road, Silver Spring; Sun., 7 p.m., $49.50.). Singer-actress Brandy, of ""The Boy Is Mine"" and ""Moesha"" fame, has turned her attention back toward music, despite not having released an album since 2012's ""Two Eleven."" She's now working on new music -- earlier this year, she released the single ""Beggin & Pleadin"" on her own Slayana record label. The track manages to look backward and forward at the same time, with a sample of John Lee Hooker's blues song ""Boom Boom"" melding with a modern trap beat.   "
6	https://www.washingtonpost.com/politics/the-latest-kasich-bush-romney-congratulate-trump/2016/11/13/d0c2a75e-a9bb-11e6-8f19-21a1c65d2043_story.html	The Latest: Giuliani says Trump kids could run ‘blind trust’	"   Former New York mayor Rudy Giuliani speaks during the opening day of the Republican National Convention in Cleveland, Monday, July 18. (J. Scott Applewhite/AP)  Donald Trump adviser Rudy Giuliani said ""there's no perfect way"" for the president-elect to deal with his billions in business assets, but on Sunday he encouraged Trump to put his money in a blind trust ""for the good of the country."" No matter what Trump does, Giuliani said, ""there will be a wall"" between Trump's decisions as president and his financial interests. Trump says he's worth $8 billion, although Forbes magazine says the amount is closer to $3.7 billion. His business empire is made up of more than 500 companies around the globe, including more than 250 bearing his name, according to ABC News. Critics say that makes him susceptible to conflicts of interest.   [Kellyanne Conway: It's up to Clinton, Obama to calm anti-Trump protesters]   ""For the good of the country, and the fact you don't want a question coming up every time there's a decision made, he should basically take himself out of it and just be a passive participant in the sense that he has no decision-making, no involvement,"" Giuliani said on ABC News's ""This Week."" ""And those decisions get made separate from him, which is the way it's done for most cabinet offices."" On the campaign trail, Trump said he would turn over his business interests to his children if elected. But Jake Tapper grilled Giuliani on CNN's ""State of the Union,"" saying that wasn't enough separation, especially because Trump's children were still advising him on political matters. ""It's kind of unrealistic to say that you're going to take the business away,"" Giuliani responded. ""You'll have to fashion something that is very comfortable, very fair. ... Even if he turns it over to an independent trustee, there's no perfect way to do this.""   [Gov. Andrew Cuomo: New York a 'refuge' for minorities, immigrants]   Giuliani said Trump's wealth may be the biggest deterrent to any conflicts of interest. ""This man didn't want to run for president to try to get rich. He's rich already,"" the former New York mayor said. On Sunday, Giuliani also touched on Trump's immigration plan. In December, after the San Bernardino, Calif., terrorist attacks, Trump called for ""a total and complete shutdown of Muslims entering the United States until our country's representatives can figure out what is going on."" But Giuliani said Trump's stance had softened during the campaign. For most countries, Giuliani said, ""it wouldn't be a ban, it would be extreme vetting."" He said Muslims would be allowed into the United States if their home countries let immigration officials thoroughly examine the migrants. Giuliani told Tapper that there are six countries -- Pakistan, Egypt, Syria, Iraq, Afghanistan and Yemen -- with regard to which ""we have to be very careful."" Giuliani said that with Pakistan and Egypt ""we could probably do some pretty good vetting. Yemen is a lot more volatile."" Syrian refugees would face the toughest hurdles, Giuliani said, because they are difficult to vet and could be terrorist operatives. ""The problem with the Syrian refugees is not just that you can't vet them . . . The problem is also that [Islamic State leader Abu Bakr al-Baghdadi] has said that he's going to put terrorist operatives among the refugees,"" Giuliani said. ""We would be foolish to allow these people to come into the United States. We are being warned that he is going to send people here to attack us.""   [President-elect Donald Trump is about to learn the nation's 'deep secrets']   Giuliani is the vice chairman of Trump's transition team. His name has been floated as a possible candidate for attorney general. He said an independent counsel should be appointed if the president-elect decides to prosecute Hillary Clinton -- a promise Trump had made during the campaign. Read more: Amid a world of problems, Trump's policy prescriptions remain opaque Trump loyalists, inner circle poised to claim top government roles Giuliani says he has 'no expectation' for Trump administration"
7	https://www.washingtonpost.com/world/europe/bulgarian-prime-minister-boiko-borisov-says-he-will-resign-after-accepting-that-his-party-lost-presidential-election/2016/11/13/29e15ed6-a9d8-11e6-8f19-21a1c65d2043_story.html	Bulgarian Prime Minister Boiko Borisov says he will resign after accepting that his party lost presidential election	 SOFIA, Bulgaria -- Bulgarian Prime Minister Boiko Borisov says he will resign after accepting that his party lost presidential election. Copyright 2016 The Associated Press. All rights reserved. This material may not be published, broadcast, rewritten or redistributed. 
8	https://www.washingtonpost.com/national/told-you-so-some-professors-correctly-predicted-trump-win/2016/11/13/c7c712a2-a9cf-11e6-8f19-21a1c65d2043_story.html	Told you so: Some professors correctly predicted Trump win	" MINEOLA, N.Y. -- Donald Trump is not the only one who can say, ""I told you so."" A few college professors stood up to a tidal wave of prevailing thought to separately predict for months that the New York billionaire and reality TV star would pull off one of the biggest shockers in American political history. A political scientist at New York's Stony Brook University based his prediction on a formula using primary results and his ""pendulum of change"" theory. A Yale professor tied his pick to economic factors. And a history professor at American University relied on a formula he developed in the 1980s.  ""I had a lot of people saying, 'This isn't going to work. You're going to fall on your face.' I got emails berating me for being an idiot and irresponsible,"" says Helmut Norpoth, a longtime political science professor at Stony Brook. Norpoth has successfully predicted every presidential winner since developing the formula for the 1996 presidential race. He also used his formula to review every presidential election since 1912, and found the indicators would have accurately predicted the outcome every time except 1960. He acknowledged he harbored some private doubts as this year's contentious campaign raged on, he never wavered publicly, even doubling down on the pick after Trump's explosive ""Access Hollywood"" video came out.  ""I put up a good face,"" he says. ""But deep down I got a little uneasy, I can't deny that."" Norpoth says his model is based, in part, on the idea that candidates who excel in primaries tend to do better in the general election. He says Trump's victory and Clinton's defeat at the hands of Sen. Bernie Sanders in the New Hampshire primary was a key indicator for him of the Republican's strength. He also factored in that Barack Obama had held the White House for two terms and estimated the pendulum could swing Republican. The only time in the past 30 years that either party won three straight presidential elections was in 1988, when Republican George H.W. Bush defeated Democrat Michael Dukakis. Also successfully predicting a Republican victory was Yale University professor Ray Fair. He used economic factors -- GDP growth and inflation -- and not the vagaries of either candidate's personality in his prognostication. American University professor Alan Lichtman said he uses 13 factors to assess the performance of the party in power to determine whether it will keep the White House. He examined presidential elections from 1860 to 1980 to establish the factors to develop his study. He said the factors this year narrowly showed a Republican would prevail. Lichtman's success comes with an asterisk. He has accurately calculated the winner of the popular vote in every election since 1984, but Al Gore actually lost in the electoral college in 2000, as it appears has happened to Clinton this year.  ""I feel vindicated in a sense, but I had issued a qualification because in Donald Trump you had a history-smashing candidate,"" Lichtman says. ___ Follow Eltman on Twitter at @feltman41 Copyright 2016 The Associated Press. All rights reserved. This material may not be published, broadcast, rewritten or redistributed. "
9	https://www.washingtonpost.com/opinions/the-task-ahead-for-todays-conservatives/2016/11/11/93ef9448-a83c-11e6-8fc0-7be8f848c492_story.html	The task ahead for today’s conservatives	" The Republican Party resembles the man who told his psychiatrist, ""I have an identity problem, and so do I."" The party's leader is at best indifferent to, and often is hostile to, much of the party's recent catechism: limited government, the rule of law, a restrained executive, fiscal probity, entitlement reforms, free trade, the general efficiency and equity of markets allocating wealth and opportunity, and -- this matters especially -- the importance of decorousness in political discourse.  Americans standing on scorched earth that is still smoldering need a respite from furiousness. Andrew Jackson was, until last Tuesday, the only person elected president who was defined by his anger. He seems to have been constantly angry after 1780, when at age 13 he carried messages for the patriots fighting the British at the Battle of Hanging Rock in South Carolina. He was taken prisoner, and a British officer ordered him to clean the officer's boots. When Jackson refused, the officer swung his sword, gashing Jackson's head and fingers.  Today, many Americans seem to relish being furious. An indignation industry has battened on the Republican Party, feeding this addiction. This industry is inimical to conservatism's health.  A veteran baseball coach once said baseball is not a game you can play with your teeth clenched. The sport of the long season requires emotional equipoise, a continuous combination of concentration and relaxation. As does democratic politics, which is an unending exercise in patient persuasion.  Furthermore, in politics, style and substance are braided. Many things, and all the most important ones, cannot be effectively advocated at the top of the advocates' lungs. Try to shout a persuasive argument for caring about the separation of powers, or why the judiciary should be actively engaged in countering the excesses of the majoritarian branches.  Critics will respond: Most voters do not give a tinker's damn about such matters. This is true, which is precisely why persuasion is necessary to temper the public's instinctive aversion to the patience that politics requires -- the public's proclivity for disparaging institutional impediments to immediate gratification. Only conservatives will undertake such persuasion.  Indeed, making difficult constitutional arguments is central to conservatism's raison d'etre. This is particularly urgent now that conservatism is identified with the president-elect, a conservative-of-convenience who expresses his adopted convictions as though he recently purchased a Rosetta Stone program for quick fluency in speaking conservatism.  People who have been conservative since before 2015 should, in considering how to relate to the president-elect, ask themselves some questions, such as: What are we saying if we say we are against free trade? Protectionism is comprehensive government intervention in economic life. It supplants commercial calculations with political considerations. Using tariffs, which are taxes imposed at the border, government imposes its judgment of what Americans should be permitted to purchase, in what quantities and at what prices. If conservatism can embrace such statism, can it distinguish itself from progressivism -- the doctrine that government experts are wiser than markets in determining individuals' choices and directing the efficient use of labor and capital?  Progressives think -- or did until last Tuesday -- as Woodrow Wilson did about the delights of unconstrained presidential power. In 1887, Professor Wilson of Bryn Mawr College regretted that America had excessively ""studied the art of curbing executive power to the constant neglect of the art of perfecting executive methods."" It exasperated him that America ""has been more concerned to render government just and moderate than to make it facile, well-ordered and effective."" Progressives may regret Donald Trump's executive methods if he emulates Barack Obama's ""just try to stop me"" approach to presidential enforcement (or non-enforcement) and regulatory (or deregulatory) actions. Before the election, Trump's more thoughtful supporters conceded his comprehensive unfamiliarity with governance but insisted that he would be sufficiently wise to surround himself with seasoned people and sufficiently humble to heed them. He could make these suppositions more plausible by nominating Kelly Ayotte to be attorney general.  A former attorney general of New Hampshire, Sen. Ayotte distanced herself from Trump during her unsuccessful reelection campaign this autumn. But the Justice Department has been politically tainted by, among other things, its lassitude regarding the IRS's abuses against conservative advocacy groups. It needs a steely but amiable leader, not someone with a recent record of hysterical partisanship (e.g., Rudy Giuliani). With such Cabinet choices, President-elect Donald Trump can begin to present a persona more measured and less bellicose than that of candidate Trump.   Read more from George F. Will's archive or follow him on Facebook.    Read more on this topic:   Eugene Robinson: Rudy Giuliani is 2016's Mr. Deplorable   Elise Viebeck: Got ideas for a Trump cabinet? You're in luck.   Philip Bump: Here is what President Trump's Cabinet will look like   Ana Swanson: Donald Trump's first Cabinet pick is just as controversial as he is, and a lot richer   Garrison Keillor: Trump voters will not like what happens next  "
