	Link	Title	Text
0	https://www.washingtonpost.com/national/the-latest-governor-offers-reward-in-north-carolina-fires/2016/11/17/70b1dc14-ad16-11e6-8f19-21a1c65d2043_story.html	The Latest: Governor offers reward in North Carolina fires	 TIGER, Ga. -- The Latest on wildfires burning in the Southeast (all times local): 5:30 p.m. North Carolina Gov. Pat McCrory says the state is offering a reward of up to $10,000 for information leading to the arrest and conviction of those responsible for setting wildfires in the western part of the state. McCrory announced the reward during a briefing in Bat Cave, North Carolina, one of the towns evacuated because of threat of wildfires. McCrory also said dry conditions are causing the wildfires to spread, so people across the region need to continue taking steps to prevent wildfires. The governor said he was also concerned about air quality in western and central North Carolina. Smoke from the wildfires drifted eastward, specifically leaving a haze over the city of Charlotte. Also of concern is the weekend weather forecast, which calls for winds that could gust up to 50 mph. ___ 3 a.m. Thick smoke has settled over a wide area of the southeastern U.S., where wildfires are burning through decades of leaf litter, and people are breathing in tiny bits of the southern Appalachian forests with every gulp of air. It's a constant reminder of the dozens of wildfires threatening small mountain communities in Rabun County, Georgia, where people feel like they're under duress. Tim Free, a lifelong resident, breaks down with emotion as he describes how elderly neighbors are struggling with relentless smoke so thick it blocks the sun. Scott Cates, the pastor of Liberty Baptist church, says many fear the fires will consume their homes. Copyright 2016 The Associated Press. All rights reserved. This material may not be published, broadcast, rewritten or redistributed. 
1	https://www.washingtonpost.com/politics/whitehouse/in-trumps-transition-the-jockeying-for-jobs-goes-public/2016/11/17/6ee3514a-ad0e-11e6-8f19-21a1c65d2043_story.html	In Trump’s transition, the jockeying for jobs goes public	" WASHINGTON -- Want a top job in Washington? Saying less is usually the way to get more. But contenders -- and wannabe contenders -- for spots in President-elect Donald Trump's administration are upending that tradition. They're touting their qualifications in public appearances and chatting openly about their interactions with Trump's team. They're handicapping their rivals. Some of those who appear to be under the most serious consideration are conspicuously strolling by the pack of journalists gathered in the Trump Tower lobby on their way to meetings with the president-elect and his team. Former New York Mayor Rudy Giuliani set the tone. After declaring that he wouldn't serve as attorney general, Giuliani was asked whether there were better choices for secretary of state than some of names being bandied about.  ""Maybe me,"" Giuliani said with a grin. Shortly after, a senior Trump official confirmed Giuliani was indeed under consideration to become the nation's top diplomat. So, too, is Tennessee Sen. Bob Corker -- at least according to the senator.  ""I know my name is in the mix,"" Corker said, adding that he nevertheless expected the State Department post would go to someone more deeply involved with the Republican's presidential campaign. In some ways, the more free-flowing discussion is a refreshing shift from the usual Washington parlor game, where job candidates publicly dismiss their chances with faux modesty, then use emissaries to ensure their name stays in the conversation. The current approach is also a reflection of the man whom the job hopefuls are trying to impress. Trump held what amounted to a public audition process when he was picking his running mate, inviting top contenders to appear with him at rallies and speak to his enthusiastic crowds. That approach had echoes of Trump's reality television show, ""The Apprentice,"" where contestants competed for a job in one of the host's businesses. But for much of the past week, Trump has uncharacteristically stayed out of the public fray as lawmakers, business leaders and others jockey for jobs in his administration. He's made only a handful of public comments since winning the election and has largely avoided speculating on who could end up in the White House and Cabinet agencies.  ""I am the only one who knows who the finalists are!"" Trump wrote on Twitter, which has served as his main form of communication this week. Kellyanne Conway, who managed Trump's campaign, suggested the president-elect finds the public wrangling counterproductive.  ""These conversations are always best in private, particularly when you're forming a Cabinet and a senior staff,"" Conway said Thursday on MSNBC. ""Which is why I don't say too much about myself."" Moments earlier, Conway had confirmed that Trump offered her a job.  ""Mr. Trump asked me immediately if I would serve with him, come to the White House with him,"" she said. It's unclear what job Conway was offered or whether she plans to accept. Others have been more specific about how they hope to serve the newly elected president. Scott Brown, the former Massachusetts senator, volunteered himself to run the Department of Veterans Affairs. He told New England Cable News that if Trump offered him the VA post, ""I'd do that in a second."" And if the Veterans Affairs job isn't an option?  ""Then housing, I'm very passionate about housing,"" Brown said. ""I'd be honored to work at HUD."" Kansas Rep. Tim Huelskamp has floated himself as a possible agriculture secretary. He told reporters Wednesday that someone ""close"" to Trump's transition team had reached out to discuss the post. Some potential Cabinet secretaries have preferred to go the more traditional route, bashfully brushing aside questions about the future. Alabama Sen. Jeff Sessions, a loyal Trump ally who has been discussed for multiple posts, wouldn't bite Thursday when he appeared before reporters. In this one instance, however, Trump himself decided to stoke the speculation. His transition team released a statement Thursday that appeared to tee up Sessions to be nominated for attorney general.  ""While nothing has been finalized and he is still talking with others as he forms his cabinet, the president-elect has been unbelievably impressed with Sen. Sessions and his phenomenal record as Alabama's attorney general and U.S. attorney,"" the statement read. ___ Associated Press writers Mary Clare Jalonick and Steve Peoples contributed to this report. ___ Follow Julie Pace at http://twitter.com/jpaceDC Copyright 2016 The Associated Press. All rights reserved. This material may not be published, broadcast, rewritten or redistributed. "
2	https://www.washingtonpost.com/world/europe/police-doing-investigation-checking-cars-at-dutch-airport/2016/11/17/d374cc6a-acc3-11e6-8f19-21a1c65d2043_story.html	Police detain suspect after threat to Dutch airport	" THE HAGUE, Netherlands -- Dutch police detained a 45-year-old homeless migrant Thursday on suspicion of involvement in a threat that sparked heightened security at a regional airport. Armed military police spent hours checking cars and carrying out investigations at Rotterdam The Hague Airport after an anonymous tip Thursday morning warned of a possible threat. Late on Thursday, police said in a statement that they had detained a suspect in Rotterdam, saying he had previously made false reports to police. His name was not released. The threat prompted military police to take up positions around the airport, checking some cars as they approached the terminal. Flights to and from the airport were not affected by the alert. Police said ""extra visible and invisible security measures"" put in place during the day and into the night were ""revised"" after the arrest, but gave no further details. Copyright 2016 The Associated Press. All rights reserved. This material may not be published, broadcast, rewritten or redistributed. "
3	https://www.washingtonpost.com/news/grade-point/wp/2016/11/17/its-a-lonely-place-a-conservative-ivy-league-professor-counters-faculty-calls-for-trump-to-denounce-attack/	‘It’s a lonely place': A conservative Ivy League professor counters faculty anger	"   The University of Pennsylvania campus in Philadelphia. (iStock)  Carrie Kovarik, a doctor and associate professor of dermatology, dermatopathology and infectious diseases at the University of Pennsylvania, was saddened when colleagues on the faculty urged her to sign on to a letter addressed to President-elect Donald Trump. (You can read that letter, signed by more than 460 professors at Penn, here.)  Their letter, written immediately after the election and a racist incident on campus in which black freshmen were targeted with group messages full of slurs and references to lynching, called on Trump to denounce that incident. Kovarik was horrified by the racist messages -- some of which were sent to the daughter of a close friend of hers -- but she didn't agree with the tone of the letter.    [Black University of Pennsylvania added to racist social media account with 'daily lynching' calendar]   ""It is a tone of hate, division and segregation of people within our country -- and it is time to come together and stop the judgments of each other,"" she said. ""It is time to listen to each other."" She wrote a letter in response.  -- Susan Svrluga I was invited to attend a dinner with a dozen other accomplished professors from across the school. I heard one story after another about rooms set aside for our students grieving the election results, special sessions held the day after the election to support troubled faculty and students, as well as the feeling of those in the room of ""how this could happen."" After my decision to vote Republican in this election, I was faced with incredible judgment and ridicule from colleagues in academia. After initially expressing my opinion, I became tired of arguing --  being labeled with misplaced stereotypes only based on who I would be voting for --  and being judged regardless of the issues that mattered to me. No one seemed to be interested if anyone had a different opinion --  they just assumed everyone had the same opinion because of where we were and what we did. The feeling of political exclusion worsened as heinous acts on our campus against African American students (some of whom I know and respect) took place. Faculty openly expressed in large meetings their disgust for anyone who voted for Trump, while directing their anger my way. I understood their fears and frustrations; however, they never gave me a chance to explain my views. Many of the views shared by my colleagues, including embracing diversity on campus and access to health care, are exceptionally important to me; however, these are not the only opinions that need to be realized in this great country. America is great because we have people from all walks of life --  with different needs --  and many of us in this academic institution are not familiar with those needs.   [Man investigated for racist messages had been accepted to the University of Pennsylvania]   This somewhat protected academic mind-set is often reflected on our students and trainees. We are here to teach them all viewpoints --  not to teach them only ours. We are an institution of higher learning, where free thinking and debate should be taking place. Somewhere along the line we have lost that freedom. In medicine, I do my best to explain all sides of health policy and what can work for each patient and situation. As a clinician who primarily works with patients with human immunodeficiency virus, sexually transmitted diseases, and those with complicated social issues, I encourage each trainee to leave all assumptions at the door and learn about the patient as an individual. This is certainly where I have been able to make the biggest impact with individual patients, as they know that I respect them no matter where they have come from in life and they learn to trust me. Maybe this is how we should relate to each other no matter what the situation? As a physician that has worked over a decade to improve access to care for those in need and provide quality care, this election was very important to me. I saw it as an opportunity in many facets of health care that long needed change. I have seen that many Americans have benefited from the Affordable Care Act, but I have also witnessed the struggling inner-city working poor who cannot meet their high deductibles and are functionally uninsured. I have diagnosed potentially fatal conditions, including melanoma, in patients who are struggling to work and cannot afford health insurance. There are voices that cry out in rural America frustrated by incredible gaps in specialty care, including many community hospitals that lack needed emergency psychiatric and stroke services. Doctors are burning out and quitting practice due to intense government regulations and reporting requirements, which are also taking face time away from our patients. Putting insurance in the hands of people in this country is a small part of the equation that leads to increasing access to care. Once they have access, the bottleneck to care is moved down the line --  we don't have more doctors, specialists or hospitals --  so we need to plan for innovative solutions that will help to provide them care. Bringing quality-integrated telemedicine solutions to underserved communities, decreasing the regulatory burden on doctors to give them more time with patients, and working with other industries to allow for affordable drug prices are just a few pieces of the puzzle that can come together for a greater working solution. Right now, this is not happening to a significant degree --  so when my counterparts look at me with disdain, I say, ""Why not give change a chance?"" I would encourage decision-makers to start to think outside the box, because the box we are in is getting too crowded. I would look to individuals to start communicating and learning about each other --  leave your assumptions at the door --  and you may be surprised that we have more in common than you think."
4	https://www.washingtonpost.com/news/grade-point/wp/2016/11/17/dear-president-elect-faculty-at-upenn-ask-trump-to-condemn-racist-attack-at-his-alma-mater/	Dear president-elect: Faculty at UPenn ask Trump to condemn racist attack at his alma mater	"   President-elect Donald Trump (Photo by Jessica Kourkounis/Getty Images)  In the days following the presidential election, after some black freshmen at the University of Pennsylvania were shocked to find racist messages on their phones, some professors at the Ivy League school wrote a joint letter expressing their opinion to President-elect Donald Trump. They called on him to condemn the attack at his alma mater.   The letter has now been signed by more than 450 faculty members.  (And one professor wrote a letter countering this view, which can be read here.)  -- Susan Svrluga Dear Mr. President-Elect, We are writing you from the University of Pennsylvania, your alma mater. As you have probably heard a group of Black students in our 2020 class were assaulted on Friday by text messages, photos, and threats via a GroupMe chat to which they were added without their permission. As you have probably also heard, the attackers evoked your name numerous times in their onslaught, calling themselves ""Daddy Trump.""   [Black University of Pennsylvania freshmen added to racist social media group with 'daily lynching' calendar]   In their heinous chat, these attackers scheduled an event called ""lynching"" for the day of the GroupMe attack and also sent images documenting a lynching that took place in the U.S. In resurrecting our country's long history of brutally murdering black people and invoking our national legacy of white supremacy, the attackers followed a disturbing pattern that we, as a country, saw play itself out in the long weeks of the presidential campaign and in the harmful alliances that you built in your path to the election. We remember from that recent past, as the Southern Poverty Law Center has documented, that you named far-right extremists as advisers to your campaign; that in your campaign rallies and from your Twitter feed, you repeatedly circulated and amplified racism, sexism, anti-Semitism; that you gave press credentials to a white supremacist radio host; and that you refused to denounce the neo-Nazi David Duke's endorsement of your campaign for many months. Additionally, you encouraged violence and hate repeatedly in campaign stops all across the country and assumed a permissive attitude toward identity-based intimidation and aggression. It appears that these students were racially profiled and targeted for this vicious attack by individuals outside of our own institution. As the FBI, the Philadelphia Police Department, and the University of Pennsylvania administrators continue to investigate the origins of this hateful crime against our students, the president of the university, the governor of Pennsylvania, the mayor of Philadelphia, and numerous student, staff, alumni, and faculty have publicly condemned these attacks.   [Man investigated for racist messages had been accepted to the University of Pennsylvania]   You, Mr. President-Elect, Penn alum '68, have been noticeably silent. As your path demonstrates, Penn students are poised to be leaders in all aspects of social, technological, economic, and political life. The students who were viciously profiled and attacked are at the beginning of their college education. They and their families work hard and sacrifice much to provide this opportunity for them. They, like all Penn students, deserve the chance to learn in an environment that recognizes and values their ideas, their work and their contribution to our country. What happened Friday irrevocably violated the safety and security of the students who were singled out and attacked. It also violated the safety and security of countless students on campus who are subject to the larger climate of identity-based fear and intimidation that your campaign specifically engendered and that, in the wake of your election, has grown ten-fold. Friday's attack is one of several post-election incidents that have occurred on our campus and we are not alone in this experience. Students across the country are reporting verbal and physical assaults. It was reported over the weekend that a black student at nearby Villanova University was knocked to the ground by three white men who charged at her yelling your name. As members of the faculty of the University of Pennsylvania, we denounce the actions of those who viciously attacked our black first-year students via social media on Friday. This particular attack was focused on black students, but we are deeply concerned that other students are and will be subjected to similar assaults, both verbal and physical, given the dramatic increase in hateful speech and prejudice exhibited during the presidential campaign. We commit ourselves to supporting the many University of Pennsylvania students, staff, and faculty who are targeted because of ethnicity, religion, sexuality, gender, gender expression, disability, or because of their status as undocumented immigrants. We condemn the racist, xenophobic, sexist speech and behavior that you so consistently drew upon and also inspired during your campaign for President. We implore you to immediately and publicly denounce Friday's attack on our students."
