	Link	Title	Text
0	https://www.washingtonpost.com/national/video-shows-arizona-cop-punch-woman-officer-put-on-leave/2016/11/17/8d95aea6-ad42-11e6-8f19-21a1c65d2043_story.html	Woman denies assaulting Arizona cop before he punched her	" FLAGSTAFF, Ariz. -- A woman punched by an Arizona police officer in an incident captured on video has denied a claim by the Flagstaff officer that she kicked and kneed him in the groin before he threw the punch. The Arizona Daily Sun (https://goo.gl/JYfKVa ) reported that Marissa Morris said she did not assault Officer Jeff Bonar, who was placed on administrative after the incident Wednesday incident while police internal affairs and criminal investigations are conducted.  ""After he hit me, I was blown away,"" Morris told the newspaper. ""I couldn't believe it. I didn't know why it was happening to me, why he would do such a thing to me. I did nothing wrong to deserve that."" The incident occurred as the 30-year-old Morris and her boyfriend were being evicted. She was arrested on suspicion of aggravated assault and of resisting arrest. Police have said Bonar knew of arrest warrants for Morris in previous DUI cases but that police determined after Wednesday's incident that those warrants were no longer active.  ""I did exactly what I was supposed to do to take care of my warrants previously,"" Morris said. ""I couldn't believe it."" Morris is heard on the video telling Bonar that there were no active warrants for her arrest. In his police report, Bonar said Morris started running, so he grabbed her to prevent her from escaping. Danny Paredes, the brother-in-law of Morris' boyfriend, took the video and shared it on Facebook. Morris was released from custody Thursday after making an initial court appearance. A police department spokesman, Sgt. Cory Runge, said Bonar was equipped with a body camera but did not have it activated when he made contact with Morris or when he punched her. He did activate his camera after Morris had been placed in handcuffs, Runge said.  ""Officer Bonar's failure to activate the camera prior to the incident will also be addressed during the internal affairs investigation into his actions,"" Runge said in a statement. A neighbor who saw the scuffle said she Morris should have let the officer arrest her to avoid the altercation.  ""Dragging your feet and flinging your arms -- that's what I saw,"" Loretta Lee told KPNX-TV (https://goo.gl/DQfySQ . "" She added that it took three officers ""to get her to the car. Now if that's not resisting arrest, I don't know what is."" Copyright 2016 The Associated Press. All rights reserved. This material may not be published, broadcast, rewritten or redistributed. "
1	https://www.washingtonpost.com/blogs/right-turn/wp/2016/11/18/pences-mission-deliver-four-messages-to-trump/	Pence’s mission: Deliver four messages to Trump	"   Vice President-elect Mike Pence speaks to supporters at President-elect Donald Trump's election night event at the New York Hilton Midtown on Nov. 9. (Mark Wilson/Getty Images)  Vice President-elect Mike Pence may be the most important member of the incoming administration, if only because is one of the few people in President-elect Donald Trump's inner circle who has any idea what he is doing. The Wall Street Journal reports: ""It is clear that he is going to be a very important conduit for members of the House,"" Rep. Kevin Cramer (R., N.D.), one of Mr. Trump's earliest congressional supporters, said after the meeting with Mr. Pence. ""His affection for the institution, his relationship with the speaker and many in the room was probably the core of much of his message today."" ... Mr. Pence's high-profile role leading the transition team is a signal to lawmakers ""that he will be a player in this administration and not simply take on some ceremonial role where he's really outside the decision-making circle,"" said Rep. Mike Coffman (R., Colo.), who had vowed to stand up to Mr. Trump during the campaign. Mr. Pence told lawmakers to ""buckle up,"" Mr. Coffman said. Pence's most important role may be as a guide and early warning alarm for the new president. Trump has little ""feel"" for government or appreciation for how difficult it is to get others to do what you want. He has a combative relationship with the media, a vindictive personality and a shocking lack of knowledge about the world and public policy. Put that together and you have a president essentially flying blind. Given all that, what should Pence be telling his boss? First, the concern about Trump's businesses and conflicts of interest is not simply liberal chatter. The problem is real, and Pence should point Trump to the voice of the GOP business establishment, the Wall Street Journal editorial board, which recommends Trump liquidate his company: Mr. Trump could put the cash proceeds in a true blind trust. The Trump children can keep the assets in their name, and he can transfer more to them as long as he pays a hefty gift tax. Finally, Mr. Trump should stipulate that he and his children will have no communication about family business matters. The alternatives are fraught, perhaps even for the Trump Organization's bottom line: Thanks to a Clinton Administration precedent, Presidents can face litigation in private matters--so the company will become a supermagnet for lawsuits. Rudy Giuliani lamented on television that divestment would put the Trump children ""out of work,"" but reorganizing the company may be better for business than unending scrutiny from the press. Progressive groups will soon be out of power and they are already shouting that the Trump family wants to profit from the Presidency. The political damage to a new Administration could be extensive. If Mr. Trump doesn't liquidate, he will be accused of a pecuniary motive any time he takes a policy position. For example, the House and Senate are eager to consider tax reform--and one sticking point will be the treatment of real estate, which will be of great interest to the Trump family business. Ditto for repealing the Dodd-Frank financial law, interest rates and so much more. Trump does not want to do this, but it is up to Pence to warn the president that this, more than any other issue, could alienate his base and throw his presidency into a tailspin. Second, Pence should implore Trump to hold down the number of appointees who are inflammatory, scandal-plagued campaign cronies. Stephen K. Bannon and retired Lt. Gen. Michael T. Flynn have used up his quota. What Trump needs are low-key, competent and widely respected figures -- such as Pence! -- to actually do the work and calm domestic and foreign allies. Trump would be wise to pick a foreign policy heavyweight (e.g. Mitt Romney, John Bolton, Sen. Bob Corker, retired Gen. David Petraeus) for State and a respected figure (e.g. former Sen. James M. Talent) to head up the Pentagon, someone who can reassure the generals Trump has insulted (and balance out the intemperate Flynn). Third, Pence needs to get the president-elect -- with a crane if that's what it takes -- out of Trump Tower and into Washington, D.C., where his new job is. Staying in his business office conveys skittishness (Trump has to be in his own bed each night?) and highlights the conflict of interest between his business interests and the presidency. Remaining holed up in his golden tower begins at some point to look weird, downright nutty, in fact. Fourth, Pence should tell Trump and his minions to stop acting like Hispanics, Muslims, civil libertarians and others he demeaned have no reason to be worried. Of course they do. Trump can take ownership of his campaign comments, convey he is now serious about governance and pledge to protect all Americans' Constitutional rights (not only the Second Amendment but the First, Fifth, 14th, etc.). His campaign manager Kellyanne Conway and the rest of his staff should never tell critics not to peacefully protest or vent their discontent. For goodness' sake, Trump now is the president-elect of the United States, not a thuggish real estate operator; his staff should act like it."
2	https://www.washingtonpost.com/world/national-security/trumps-cia-pick-is-seen-as-both-a-fierce-partisan-and-serious-student-of-national-security-issues/2016/11/18/5b089f0e-ad9a-11e6-8b45-f8e493f06fcd_story.html	Trump’s CIA pick is seen as both a fierce partisan and serious student of national security issues	" President-elect Donald Trump's pick to lead the CIA is a Kansas congressman who is widely respected for his intelligence but also seen as a fierce partisan on polarizing issues including the deaths of U.S. personnel in Benghazi, the leaks of Edward Snowden and the email controversy that engulfed Hillary Clinton. Rep. Mike Pompeo (R-Kan.) has used his perch on the House Intelligence Committee to attack major pillars of President Obama's foreign policy agenda, including the nuclear deal with Iran. Just hours before his name surfaced as Trump's CIA nominee, Pompeo tweeted that he looked forward to ""rolling back this disastrous deal with the world's largest state sponsor of terrorism.""  [Iran nuclear deal could collapse under Trump]  In closed-door briefings on Capitol Hill, Pompeo has been an intense critic of a covert CIA program to train and arm moderate rebel forces in Syria, according to U.S. officials who said that dismantling the program -- or at least subjecting it to a major re-evaluation -- would likely be at the top of his agenda if he is confirmed. Pompeo, 52, has no meaningful experience in espionage issues beyond his relatively brief stint as a member of the House Intelligence Committee. But he has earned a reputation as a serious student of national security issues who finished first in his class at the U.S. Military Academy at West Point, served as a cavalry officer in the Army and earned a law degree from Harvard.      Here are the people whose names have been floated for Trump's Cabinet View Graphic     Here are the people whose names have been floated for Trump's Cabinet  Current and former U.S. intelligence officials said that Pompeo is not widely known among the CIA rank and file but that his nomination was greeted at least initially as a reassuring development at a spy agency that has been treated largely with disdain by Trump. Rep. Adam B. Schiff (D-Calif.), who has sparred with Pompeo on Benghazi and other issues, gave the selection tempered praise in a statement released Friday.  ""Mike is very bright and hard-working and will devote himself to helping the agency develop the best possible intelligence for policymakers,"" Schiff said. ""While we have had our share of strong differences -- principally on the politicization of the tragedy in Benghazi -- I know that he is someone who is willing to listen and engage, both key qualities in a CIA Director."" Pompeo's congressional background raised early comparisons to that of Porter Goss, who was plucked from the House Intelligence Committee by then-President George W. Bush to lead the CIA and was forced to resign two years later after a turbulent tenure during which one of his principal executives was convicted of corruption charges. Pompeo's ties to the arch-conservative tea party movement and scant background on intelligence issues were also cited as a cause for concern among some CIA veterans. ""The tea party owns the drones now,"" one official said, referring to the agency's involvement in lethal drone strikes against terrorist groups in Pakistan, Yemen and elsewhere. But former senior CIA officials expressed guarded optimism that Pompeo's ideological bent can be tempered by the analytic approach he has brought to difficult security subjects.   Rep. Mike Pompeo (R-Kan.), who has been nominated to lead the CIA by Donald Trump, speaks on Capitol Hill in October 2015. (Jacquelyn Martin/AP)  ""I'm heartened by the choice,"" said former CIA director Michael V. Hayden, who has been a staunch critic of Trump on security matters. ""I would recommend that when he goes to Langley he get out of the car by himself and embrace the workforce,"" Hayden said, alluding to the rocky tenure of previous directors who arrived with entourages and agendas that put them at odds with the agency's powerful and entrenched directorate of spies. In some ways, Pompeo is already part of the intelligence inner circle in Washington. He attended a dinner this week with CIA Director John Brennan at the home of former Republican congressman Mike Rogers, who had previously been seen as a leading candidate for the CIA job under Trump. The gathering included cast and producers of the CIA-themed show ""Homeland,"" according to a person familiar with the event. Brennan has led a major bureaucratic overhaul of the agency over the past year, a reorganization designed to replicate the structure of the agency's Counterterrorism Center. Pompeo would face decisions on whether to preserve those changes. Pompeo emerged as a surprise pick for Trump. His name had not surfaced in the flurry of postelection rumors that had largely focused on other potential nominees, including Rogers, who was ousted from the Trump transition team this week, and Rep. Devin Nunes (R-Calif.), the current chairman of the House Intelligence Committee who reportedly turned down a chance at the CIA job. Pompeo reportedly has close ties to the Koch family, Kansas billionaires who have devoted a considerable part of their wealth to advancing a deeply conservative agenda and driving Democrats out of office. Articles in Kansas papers indicate that Pompeo built much of his wealth with investment funds from Koch industries and that his campaigns for Congress have been backed by Koch money. In just five years in Congress, he has built a political following by staking extreme positions in polarizing debates. He has called for Snowden to face the death penalty and for Clinton to be barred from receiving classified information.  Pompeo was one of the more outspoken Republican members of the House Select Committee on Benghazi, saying that the Obama administration was guilty of a scandal ""worse than Watergate."" When the committee concluded its final report in July, Pompeo and a fellow member, Rep. Jim Jordan (R-Ohio), released a 48-page annex charging ""failure at the most senior levels of government"" and calling for additional information on what Pompeo said was the administration's intentional misrepresentation and concealment of facts. During hearings, his questions to administration witnesses were often among the most accusatory. In October 2015, when Clinton testified for the second time, Pompeo grilled her on her relationship with slain U.S. Ambassador J. Christopher Stevens. He asked a series of rapid-fire questions about why Stevens did not have her personal telephone number, did not know her personal home address and had never ""stopped by your house."" Separately, in remarks that drew sharp criticism from U.S. Muslim organizations, Pompeo said that Muslim leaders who fail to denounce acts of terrorism done in the name of Islam were ""potentially complicit"" in the attacks.  Pompeo led congressional attacks on the nuclear accord Obama reached with Iran last year, accusing the administration of hiding ""secret side deals"" from the public, allegations rejected by the White House. At the same time, it is not clear whether Pompeo will be in agreement with the most extreme positions taken by his new bosses, Trump and his designated national security adviser, Michael T. Flynn.  Trump has called for the CIA to resume the use of waterboarding and other interrogation measures widely condemned as torture. Trump has derided the quality of the intelligence from the nation's spy community, publicly belittling a multiagency conclusion that Russia used cyberespionage methods to interfere in the U.S. election. Pompeo is not known to have publicly backed those positions and in some cases has articulated views that would seem at odds with those of the Trump team. In a speech delivered in Kansas last year after returning from a trip to the Middle East, Pompeo cautioned against equating all Muslims with terrorism, saying that a ""line needs to be drawn between those who are on the side of extremism and those who are fighting against them.""  Karen DeYoung contributed to this report.   Read more:   Intelligence community is already feeling a sense of dread about Trump   Trump defends pace of transition work as process remains opaque    "
3	https://www.washingtonpost.com/national/police-son-of-rep-john-conyers-found-safe-in-houston/2016/11/18/b952c10e-ad7f-11e6-8f19-21a1c65d2043_story.html	Police: Son of Rep. John Conyers found safe in Houston	" HOUSTON -- Longtime U.S. Rep. John Conyers' youngest son, who was reported missing this week, was found safe early Friday in Houston, police said. Carl Conyers, a 21-year-old student at the University of Houston, was found unharmed at his apartment complex in the city early Friday by university police, Houston police spokesman Kese Smith said. Carl Conyers was interviewed by Houston police investigators and is with family, Smith said. The circumstances of his disappearance are under investigation. He had been the subject of a search since Tuesday, when he was last seen by his roommate.  ""Rep. Conyers has been in touch with his family and is happy his son is safe and uninjured,"" Shadawn Reddick-Smith, a spokeswoman for John Conyers, said in a statement. Carl Conyers' girlfriend, Daisha Lewis, told WWJ-AM in Detroit she was supposed to meet him on campus Wednesday, but he never showed. When she and friends checked his apartment they found some clothes and other items missing. John Conyers is a Detroit Democrat who was elected to Congress in 1964 and is its longest-serving member. Copyright 2016 The Associated Press. All rights reserved. This material may not be published, broadcast, rewritten or redistributed. "
4	https://www.washingtonpost.com/news/worldviews/wp/2016/11/18/60-percent-of-russians-think-internet-censorship-is-necessary-poll-finds/	60 percent of Russians think Internet censorship is necessary, poll finds	"   A user of Russia's leading social network Internet site VKontakte, holds an iPhone in Red Square in Moscow. (Pavel Golovkin/Associated Press)  Sixty percent of Russians believe that Internet censorship -- in particular, the banning of certain websites and material -- is necessary, according to a new poll. Just 25 percent opposed the idea; the rest of the respondents didn't know or declined to answer. The poll was conducted by the Levada Center, an independent polling firm, which asked Russians questions about trust in media and censorship between Oct. 21 to 24. On the subject of political censorship, 32 percent of Russians said that denying access to certain websites would infringe upon the rights and freedoms of activists, while 44 percent said it did not and 24 percent could not answer. More broadly, Russians seem to be generally skeptical about the Internet, Levada found, with 51 percent believing the Internet could not replace newspapers, radio and television -- roughly the same figure as when the question was last asked in 2006. And while 56 percent of respondents said that they fully or mostly trusted the news they saw on Russian television channels, only 37 percent said the same about news they saw on the Internet. In total, 35 percent of Russians thought the media was deceiving them frequently, while 49 percent said they felt that way only rarely. The role of the Internet in modern media has become a matter of global debate in recent months, with some in the U.S. suggesting that online outlets that purposely publish fake news had an effect on the outcome of the recent presidential elections. However, in countries such as Russia, where most mainstream news networks are strongly aligned with the government, opposition groups have been able to organize and spread criticism of the government through online media. Russian President Vladimir Putin has said the country does not have the legal authority to ban websites. Though some smaller websites have been blocked at some points, experts doubted Russia had the capability to implement more widespread online censorship. There have been a number of recent signs that the country may be rethinking its approach, however. In April, Konstantin Malofeev, a wealthy businessman with links to the Kremlin who runs the pro-censorship lobbying group Safe Internet League, traveled to China to meet with the architects of that country's notorious ""great firewall."" And this week the country moved to block the professional networking site LinkedIn as it did not house data about its Russian users within the country, a charge that could also be levied at other major international social networks like Twitter and Facebook. Polling by Levada and other organizations in Russia has long shown widespread support for Internet censorship. According to a study conducted in May 2014 by the Russian Public Opinion Research Center (VTsIOM), 59 percent of Russians believed that websites that showed gay pornographic content should be censored by the government, while 46 percent said social networks that allowed people to organize anti-government protests should be censored and 45 percent said the videos by the anti-government art group Pussy Riot should be banned. More on WorldViews Russia moves to block professional networking site LinkedIn"
5	https://www.washingtonpost.com/world/europe/spain-pm-seeking-opposition-support-for-leaner-budget/2016/11/12/29459aa8-a8db-11e6-ba46-53db57f0e351_story.html	Spain PM seeking opposition support for leaner budget	" MADRID -- Spanish Prime Minister Mariano Rajoy says his government has started talks with opposition parties on drafting a budget to meet the European Union's deficit target. Rajoy's minority administration needs support from other parties to pass laws. Rajoy tells Spanish media that his government is speaking ""most intensely with those parties that are more likely to give us their support."" He says his focus is ""passing a limit on spending and stability goals."" Spain's 2017 budget must include some 5.5 billion euros ($6 billion) in cuts or tax hikes to meet a deficit target agreed with EU authorities. Last week, Rajoy was sworn in for a second term at the head of his conservative government after winning a confidence vote to end 10 months of political deadlock following two inconclusive elections. Copyright 2016 The Associated Press. All rights reserved. This material may not be published, broadcast, rewritten or redistributed. "
