	Link	Title	Text
4	https://www.washingtonpost.com/news/monkey-cage/wp/2016/11/11/trump-got-more-votes-from-people-of-color-than-romney-did-heres-the-data/	Trump got more votes from people of color than Romney did. Here’s the data.	"   Supporters cheer for President-elect Donald Trump at his 2016 U.S. presidential election-night event at the New York Hilton Midtown on Nov. 8. (Shawn Thew/European Pressphoto Agency)  Just as journalism is the first draft of history, exit polls let us take some first stabs at understanding public opinion. On the matter of politics and race, Donald Trump's victory will provide plenty of fodder for opinion columns, in-depth survey analyses, fieldwork and historical studies. Given the various studies already conducted, factors such as racial resentment and immigration conservatism will likely play important roles in explaining white voting behavior, in addition to factors such as economic anxiety and distrust of political elites. Our understanding of race and presidential voting, however, also needs to look comparatively across groups. Looking at the exit poll data from the 2016 election, and comparing them over time, the story on race and presidential voting gets a bit more complicated.   [Why the gender gap doomed Hillary Clinton]   One caveat about the national exit polls: They are designed to broadly represent the American electorate. Their sample design and lack of Asian language support may not be accurate in estimating the absolute support of subgroups in a given election. But the comparisons across years should give us a decent sense of how those groups move from year to year. It's also important to note that polling firms Latino Decisions and Asian American Decisions found much higher support for Clinton among Latinos and Asian American voters in a survey fielded in the week prior to Election Day. As I've noted before, it's possible that differential turnout on Election Day among Democrats and Republicans might account for part of this discrepancy.   [In record numbers, Latinos voted overwhelmingly against Trump. We did the research.]   There are different benchmarks one can use to see how Trump performed compared with prior Republican nominees. Comparing yesterday's results with 2012, as this Washington Post feature does, shows that Trump actually performed slightly worse among white voters than Mitt Romney did. He did, however, perform better than Romney among blacks, Latinos and Asian Americans, making it more difficult to claim that racial resentment was the dominant factor explaining Trump's support nationally.   [5 key lessons from Donald Trump's surprising victory]   The 2012 election was not an open one, however, since Obama was running for reelection. When we compare Republican nominee performances in prior open elections, we see that Trump made important gains among black voters as well as whites. The figure below presents net Republican support, meaning voter support for the Republican nominee minus voter support for the Democratic nominee. The GOP advantage among white voters was 9 points higher in 2016 than in 2008, which may be due as much to whites' reluctance to vote for Obama in 2008 as to their enthusiasm for Trump in 2016.       At the same time, Trump performed better with black voters than McCain did in 2008, and on par with Bush's performance in 2000. Trump performed as well as McCain did with Latino voters in 2008, and did only somewhat worse than Bush in 2000 -- which is surprising given the way that Trump launched his campaign with incendiary remarks about Mexican rapists, kicked out a prominent Mexican American journalist from a news conference, and questioned the fairness of Hispanic judges. Finally, among Asian Americans, Trump performed significantly worse than Bush did in 2000, and marginally worse than McCain did in 2008.   [What a President Trump means for foreign policy]   How do we explain these time trends? Why were many Latino voters apparently willing to overlook Trump's string of disrespectful remarks, including ones that House Speaker Paul D. Ryan characterized as ""the textbook definition"" of racism? Asking this very question might cast doubt on the exit poll findings about Latinos. But we should also remember that Clinton also failed to win the majority of white women, despite Trump's many negative remarks, ranging from Megyn Kelly to the Access Hollywood tape to various assault allegations, all of which got wide news coverage. Absent final turnout numbers, it is still too early to assess whether these shifting vote patterns are the result of differential turnout among Clinton and Trump supporters or the result of genuine voter conversion. It's possible that a sizable chunk of Latino Clinton supporters, in addition to white women, African Americans, and Asian Americans, did not show up on Election Day. It's also possible that a significant portion of these voters were willing to overlook Trump's incendiary remarks and vote for him based on other factors, like the need to shake up ""politics as usual."" Time will tell how well the national exit polls reflect the vote choices of women, Latinos, African Americans, and Asian Americans. Still, comparisons of the national exit polls over time reveal some important, and potentially unsettling, questions about what we presume to be true about voting among America's racial minorities. Did Hillary Clinton have an even tougher road with African Americans than Al Gore did in 2000, or did she benefit from multiple campaign appearances by Barack and Michelle Obama? Is immigration still a litmus test for Latino voters? And can we expect Asian Americans to shift back toward the Republican Party in future elections, or is their party identification hardening and making them more immune to big shifts in candidate choice?   [Trump's victory has enormous consequences for the Supreme Court]   This week's exit polls, in light of prior elections, raise these important questions about race and public opinion -- not just about whites, but also about blacks, Latinos and Asian Americans. And it will be up to a new generation of research -- done not just through surveys, but also through case studies and community fieldwork -- to help us better understand what happened this week, and what it will mean for the future of U.S. politics. Karthick Ramakrishnan is professor of public policy and political science at the University of California, Riverside, and author, most recently, of ""Framing Immigrants: News Coverage, Public Opinion and Policy."" Find him on Twitter @karthickr."
5	https://www.washingtonpost.com/world/middle_east/british-royal-trip-comes-as-bahrain-unrest-far-from-over/2016/11/10/e420602c-a770-11e6-ba46-53db57f0e351_story.html	British royal trip comes as Bahrain unrest far from over	" DIRAZ, Bahrain -- In the small town of Diraz, just a few miles from where Prince Charles met with Bahrain's royals, there is graffiti demanding the death of the Gulf island's monarch, armored vehicles with chicken wire on their windows and a tense calm that could be shattered at any time. The police have laid siege to the town for months, a sign of the lingering standoff between Bahrain's Shiite majority and its Sunni monarchy more than five years after Arab Spring protests were crushed. The ongoing crackdown has seen some activists imprisoned, others exiled, and a major Shiite opposition group dismantled. But there was no sign of the unrest as Prince Charles and his wife Camilla took in the sights as part of a three-nation tour of the Gulf. The Prince of Wales inaugurated a new naval base on Thursday, the first permanent British military presence since its withdrawal from Bahrain in 1971. The royal visit and the military base suggest Britain, which has long had influence with Bahrain's own monarchy, may not be pressing it on human rights. Tensions continue to grow amid the crackdown, with some worried a larger crisis could loom in Bahrain, which is home to the U.S. Navy's 5th Fleet.  ""You will reach the level where people realize they have nothing left to lose,"" one local activist told The Associated Press. Bahrain, a small island off the coast of the Arabian Peninsula, has long drawn revelers to bars across the causeway from dry Saudi Arabia. Its history as a port town for pearl divers and shippers has drawn an eclectic mix of Sunnis, Shiites, Iraqi Jews, Christian missionaries and Hindus. The 2011 Arab Spring protests were backed by the Shiite majority and others, and were aimed at demanding more political freedoms from the ruling Al Khalifa family. The government put down the demonstrations with help from Saudi and Emirati troops, and later pledged to reform. While low-level unrest persisted for years, things remained largely peaceful until April, when Bahrain's military announced it was ""ready to deal firmly and with determination with these sedition groups and their heads"" after a gasoline bomb killed a police officer. Since then, authorities suspended the country's largest Shiite opposition group, Al-Wefaq, and doubled a prison sentence for its secretary-general, Sheikh Ali Salman. Famed activist Nabeel Rajab was imprisoned and now awaits sentencing on a charge of spreading ""false news."" Zainab al-Khawaja, the daughter of well-known activist Abdulhadi al-Khawaja, who himself is serving a life sentence over his role in the 2011 protests, was forced into exile. The standoff in Diraz began in June, when supporters of Shiite cleric Sheikh Isa Qassim surrounded his home after the government revoked his citizenship. Police now control entry to the town and film incoming local drivers, while Western expatriates blissfully jog past armored personnel carriers. Graffiti on nearby side streets demands ""death"" for King Hamad bin Isa Al Khalifa, while others show crude drawings of Pearl Square, the epicenter of the 2011 protests, which was later demolished by the government. Internet access cuts off nightly here, an outage researchers blame on government interference. Bahrain has blamed its unrest partly on Shiite power Iran, though a government-sponsored investigation said there wasn't a ""discernable link"" between the 2011 demonstrations and Tehran based on the information the government gave them. Posters throughout Bahraini highways show heavily armed SWAT teams from a Gulf-wide police exercise on the island, part of recent military maneuvers designed as a deterrent to Iran following last year's nuclear deal. Low oil prices have hurt the local economy, and forced Saudi Arabia to scale back its international aid. Two activists who spoke Wednesday to the AP on condition of anonymity for fear of facing criminal charges said Bahrain's rulers were inflaming sectarian tension through their crackdown.  ""They are betting on the silence of the West because of the supply of the facilities,"" one activist said, referring to the British and American bases. ""They are compromising other things for this."" In a statement to the AP, Bahrain's government said ""no individual in Bahrain will, or can be, prosecuted for his or her political views due to the freedom of expression protections explicitly stated in the constitution,"" despite the cases to the contrary. The British Foreign Office, while declining to address Prince Charles' private conversations, said United Kingdom officials have ""frank discussions with the government of Bahrain about human rights concerns both in public and in private.""  ""We believe that it is not good enough to merely criticize other countries from the sidelines,"" the statement to the AP said. ""Only by working with Bahrain are we able to bring about the changes we would like to see in the country."" However, even the day after the royals arrived, activists said prosecutors brought in several people for questioning likely ahead of filing criminal charges against them. Activists also offered a list of over 20 people recently put on a travel ban list, while independent news gathering grows more difficult. On Thursday, Prince Charles traveled to the British Navy's new Mina Salman Support Facility, which the British Defense Ministry estimates will cost the U.K. at least 6.4 million pounds ($7.9 million), with Bahrain covering the rest. Prince Charles and Bahraini Crown Prince Salman bin Hamad bin Isa Al Khalifa both wore military uniforms as they visited the site, still largely under construction. The two royals later boarded the HMS Middleton docked at the base, both smiling. Afterward, the crown prince drove himself away in a luxury SUV as Charles spoke to the sailors. ___ Follow Jon Gambrell on Twitter at www.twitter.com/jongambrellap . His work can be found at http://bigstory.ap.org/content/jon-gambrell . Copyright 2016 The Associated Press. All rights reserved. This material may not be published, broadcast, rewritten or redistributed. "
6	https://www.washingtonpost.com/7a527bc0-a686-11e6-ba46-53db57f0e351_story.html	Europe’s far-right exults in Trump’s election	"  BRUSSELS -- Europe's far-right leaders on Wednesday heralded Donald Trump's victory as a sign that they were on the verge of a historic sweep through Western nations to upend the post-Cold War globalized world order. From Viennese cafes to hard-luck coastal French towns to the ex-Communist flatlands of eastern Germany, anti-immigrant Europeans with views similar to Trump's said they could no longer be ignored by a political and media elite that unites conventional wisdom on both sides of the aisle. They exulted in their power to win their nations' highest offices in a marathon of elections that starts next month with the Austrian presidency and circles across some of Washington's most important partners. The new order has already begun, in a wave of congratulatory messages from European leaders who had little choice but to meekly declare readiness to work with the new American leader. France, Germany, the Netherlands and Italy all face major ballot-box choices in the coming months -- and top politicians are now contending with pressure at home and from the world's biggest superpower. If Europe's mainstream leaders cooperate with an anti-immigrant, anti-trade President Trump, they will have little choice but to cooperate with far-right politicians at home, politicians and analysts said.  [Trump's victory promises to reshape U.S. political landscape]  ""He reclaimed democracy for the American people,"" said Geert Wilders, leader of the Dutch far-right Party for Freedom, which is topping opinion polls ahead of March elections. ""It can indeed be an enormous incentive in Europe and the Netherlands to see that if people start moving in a certain direction, it can be done,"" Wilders said in an interview.   ""They have rejected the status quo,"" said Marine Le Pen, leader of France's far-right National Front, vowing to repeat Donald Trump's feat in the upcoming French elections. (Martin Bureau/AFP/Getty Images)  Now, he said, national leaders across Europe will have to contend with Trump's ideas -- and that means they will also have to engage with European far-right parties that share the same skepticism toward open borders for people and trade.  ""They have to take us seriously,"" he said. ""Politics will never be the same again after yesterday. I'm sure about that. It's a kind of new era that we entered."" The cheers began early Wednesday, when French presidential candidate Marine Le Pen was among the first world politicians to congratulate Trump on Twitter, just as he started to pull away in the battleground states.  ""They have rejected the status quo,"" Le Pen, leader of the far-right National Front, said later in the day, vowing to repeat the feat in France. ""What happened last night was not the end of the world, it was the end of a world."" Le Pen far outpolls President Francois Hollande ahead of springtime elections, and though it remains unclear whether she can pull off an outright victory, fewer people are ruling it out after the Trump upset. Le Pen has already surged after Islamic State attacks in France, which were largely perpetrated by French and Belgian citizens whose families had immigrated from North Africa.  [World gasps in disbelief after Trump's win]  ""If ISIS throws three bombs at Paris between the first and the second round of the elections, then it's Le Pen. They're not stupid,"" said Ulrike Guerot, director of the Department for European Policy and the Study of Democracy at Austria's Danube University Krems. ""You could be really cynical and say the only people who are really united right now in Europe are these people."" That view is shared by many of the far-right leaders themselves. ""This election result gives courage to Germany and Europe, because Trump has the maps for a political turnaround in his hand,"" said the leader of the anti-immigrant Alternative for Germany party, Frauke Petry, who has been climbing in opinion polls ahead of national elections next year. Euroskeptic leaders said they would study Trump's freewheeling campaign and seek to replicate it in their own nations. Nigel Farage, a leader of the successful campaign to lead Britain out of the European Union, hit the campaign trail with Trump and plans to fly to the United States on Thursday. And Dutch politicians say they were inspired by Trump's improvised election effort.  ""He has such a small campaign staff, so he relied very heavily on the ground on people in cities, organizing things. That kind of civic spirit is something we'd love to take to our campaign. That's something I'm trying to copy,"" said Thierry Baudet, a Dutch Euroskeptic leader who was one of the organizers of a successful April referendum in which Dutch voters rejected an E.U. trade agreement with Ukraine.   [What America's choice of Trump really means]  Austria may be the next country poised to elect a nationalist leader who has many positions on immigration and trade that are similar to Trump's. The anti-immigrant Freedom Party is poised to seize the Austrian presidency Dec. 4 -- and it just sent a delegation to the United States to study the Trump campaign, one official said. But in a hint at some limits on Trump's effect on European politics, the far-right Austrian presidential candidate, Norbert Hofer, took a careful line on the U.S. president-elect on Wednesday, offering him congratulations but little more. Analysts said that domestic anti-Americanism dictated the careful line. ""The overall narrative that we have to stick it to the elites, that the country was usurped by the elite and we need to return it to the people, also works in Austria,"" said Reinhard Heinisch, head of the political science department at the University of Salzburg. But ""the Freedom Party has to form a coalition, and to form a coalition it has to play well with others,"" he said. No matter the local considerations, for many Euroskeptic leaders the Trump victory was a delightful glimpse into future electoral possibilities. ""When it rains in the United States of America, you feel the drops here in Europe,"" said Filip Dewinter, a leader of Belgium's far-right Flemish Interest party, which has campaigned on an anti-immigration platform. ""It will be very tough for the political elite in Europe.""  James McAuley in Paris, Annabell Van den Berghe in Brussels and Stephanie Kirchner in Berlin contributed to this report.  Read more         Today's coverage from Post correspondents around the world   Like Washington Post World on Facebook and stay updated on foreign news  "
7	https://www.washingtonpost.com/local/virginia-politics/political-salon-in-a-sedan-uber-driver-gets-earful-from-voters-he-ferries-to-the-polls/2016/11/08/6a2b5fc4-a612-11e6-8042-f4d111c862d1_story.html	Political salon in a sedan: Uber driver gets earful from voters he takes to the polls	" Aaron Butler did not fully, or even partially, consider the political dimensions of his decision to become an Uber driver in May.  An Upper Marlboro resident who owns a stake in home-healthcare business in Louisiana, he started moonlighting for the ride-share company one day a week because his accountant told him it would allow him write off maintenance costs for his 2011 Chrysler. But on Tuesday, as Butler ventured inside the Beltway to ply his trade, he found his silver sedan transformed into a wheeled political salon. By noon, he said, he had already taken 10 passengers to polling stations across the District. Most were on their way to vote -- and they were talkative about the contest between Democrat Hillary Clinton and Republican Donald Trump. ""People have been more than vocal about it,"" Butler said.  In his clientele, he believed he had observed a microcosm of political opinion -- representing, at least, a left-leaning swath of the District and Maryland. ""I have seen the Trump supporters, but primarily Clinton supporters,"" he said. ""I've even had people who say they're going to write in a candidate."" He added: ""It has been close. I haven't taken a poll."" What are voters saying? Butler filled in a reporter mid-day Tuesday on a trip through Southeast Washington. ""As far as Trump goes, a lot of people who are supporting him are interested in how he can change the state of the government,"" Butler said. As he talked, he was only slightly ruffled by the insistent honks of a white sedan with New York plates, which careened around him on the entrance to Interstate 295. ""I don't know where I was supposed to go,"" Butler remarked to the receding vehicle, before resuming his observations on the electorate. Clinton's supporters, he said, seemed united in their belief ""that she was qualified for the job, that she has better temperament to lead as far as foreign policy goes."" ""A couple people said they were sick of hearing about the emails,"" he added. Some of the views expressed inside Butler's Chrysler don't differ much from what has been heard for months on cable TV. But Butler also heard some distinctive political rationales. One passenger, he said, was angry with Republicans in Congress over the 2013 shutdown of the federal government, which was precipitated by a dispute with the Obama administration over the Affordable Care Act. As a result, he said, the woman told him she planned to vote for Trump as a change agent.  ""She's thinking that Trump is going to come in and all these older senators are going to go away in some magical way,"" he said. His eyes, reflected in the rearview mirror, conveyed skepticism. Will Butler reveal his own choice for president? A 46-year-old registered Democrat who is African American, Butler said Trump's arguments did not leave him unswayed. He liked what the GOP nominee had to say about keeping businesses in America and shaking up the country's political class.  The Manhattan real-estate magnate's assorted tax dodges weren't of particular concern to Butler, who after all took up Uber in hope of a tax write-off. ""He obviously took advantage of some things,"" Butler said. ""If Americans are honest, we all take deductions. We all take advantage of some things."" In the end, he said, he voted for Clinton because he doesn't trust Trump to keep his cool while running the country. He knows the value of that quality himself as a semi-professional navigator of Beltway traffic. ""It just wasn't the temperament of a leader that I can see sitting across from another leader of a foreign country and being respected,"" he said. Butler pulled up at Hendley Elementary School, where voting was underway. Behind him, cars were honking again. Men and women thronged the sidewalks on their way to the polls. After dropping off his passenger, he eased his sedan off along streets sprinkled with golden leaves.  Another ride had been requested, this one from a polling place. Butler had more work to do. "
