	Link	Title	Text
0	https://www.washingtonpost.com/national/8-arrests-as-rival-protesters-clash-near-texas-state-capitol/2016/11/19/66b52630-aebf-11e6-8f19-21a1c65d2043_story.html	8 arrests as rival protest groups clash near Texas Capitol	" AUSTIN, Texas -- Eight people were arrested on Saturday when a small group of protesters calling themselves White Lives Matter were confronted by counter-demonstrators supporting Black Lives Matter at the Texas State Capitol near where Gov. Greg Abbott had earlier dedicated a monument recognizing the contribution of African-Americans to the state. Texas Department of Public Safety spokesman Sgt. Victor Taylor said four of the arrests were for assault, two for evading arrest, one for disorderly conduct and one for ""interference with public duty."" Two of those arrested were on Capitol grounds and the others on adjacent streets.  ""Some protesters assaulted other protesters,"" Taylor said. ""We don't know for sure which side they were on. A lot of them were co-mingled."" Austin police and state troopers dressed in riot gear and some mounted on horseback had tried to keep the two groups separated. Taylor said the confrontation did not affect the unveiling of the monument, which was in a different part of the grounds. A state helicopter circled overhead. About two dozen individuals with the White Lives Matter group, some of whom were armed, demonstrated against what they called the unequal application of hate crimes laws, which they said are applied in a way that favors minorities. The group said it was a coincidence that its protest was held at about the same time as the ceremony for the monument. White Lives Matter member and protest organizer Ken Reed said into a bullhorn that his group was concerned with ""white people's preservation.""  ""You all are anti-white and anti-American,"" he told the counter-protesters, according to the Austin American-Statesman. The White Lives Matter group was shouted down by several hundred counter-protesters, who held up signs that said ""Stand Against Hate"" and ""Black Lives Matter."" One of them, Marie Catrett, said she came to stand up for the rights of minorities.  ""I think they are full of hatred,"" Catrett said about the White Lives Matter group. ""They don't represent our community or our values."" During the unveiling ceremony, Abbott told a crowd in attendance that the monument honors African-Americans who helped grow Texas.  ""The fact is African Americans have shaped this land that we are on today since long before it was even named the state of Texas. They fought for their own freedom. They fought for the freedom of Texas and the freedom of the United States of America,"" Abbott said. The monument is located on the Capitol's south lawn, close to other monuments that honor Confederate soldiers for their service during the Civil War. The new monument features the African-American experience in Texas, from exploration in the 1500s to slavery and emancipation to achievement in arts and science. It will be the 21st monument on the Capitol grounds and the second memorial dedicated to a specific ethnic group. Texas installed the Tejano Monument to Mexican-American history in 2012. Copyright 2016 The Associated Press. All rights reserved. This material may not be published, broadcast, rewritten or redistributed. "
1	https://www.washingtonpost.com/politics/senior-official-trump-has-offered-retired-lt-gen-michael-flynn-job-as-national-security-adviser/2016/11/17/ca841690-ad24-11e6-8f19-21a1c65d2043_story.html	Senior official: Trump has offered retired Lt. Gen. Michael Flynn job as national security adviser	 WASHINGTON -- Senior official: Trump has offered retired Lt. Gen. Michael Flynn job as national security adviser. Copyright 2016 The Associated Press. All rights reserved. This material may not be published, broadcast, rewritten or redistributed. 
2	https://www.washingtonpost.com/business/divided-america-easy-retirement-only-for-a-privileged-few/2016/11/17/39130fd0-acda-11e6-8f19-21a1c65d2043_story.html	DIVIDED AMERICA: Easy retirement? Only for a privileged few	" NEW YORK -- The American dream of a blissful retirement, free of financial worries, is dying. Most U.S. households are heading for a worse lifestyle in retirement than they had while they were working, because they simply aren't saving enough, experts say. Thirty-five percent of households in their prime earning years or later have nothing saved in a retirement account and no access to a traditional pension, according to an AP analysis of savings data from the Federal Reserve. Among households that do have some savings, the typical amount is $73,200. That's about 15 months of the median household's income. ___ EDITOR'S NOTE -- This is part of Divided America, AP's ongoing exploration of the economic, social and political divisions in American society. ___ One group doesn't have to worry as much: the richest 10 percent of households. They typically have more than $413,000 in a retirement account, according to the analysis of the Fed's latest data, which is from 2013. The rest of us look a lot more like Nancy Harvey, a 54-year-old child-care center owner in Oakland, California, who has less than $2,000 saved. Her plan, as of now, is to continue with real-estate classes in hopes that it can provide a second job.  ""I have to work and pray and hope my health continues to remain good so that I can continue to work,"" she says. ""I still have a mortgage and all the insurance that goes along with that, and I have to pay payroll for my employees, which is really important to me. I can honestly say I'm frightened about the future."" Harvey isn't alone, as the gap widens between the few households who don't have to worry about a comfortable retirement and everyone else. The anxiety even stretches across political affiliations. Nearly equivalent percentages of Democrats and Republicans say they're not managing very well in retirement planning, a recent survey from Lincoln Financial found. The looming crisis is the result of a system that's increasingly put workers in charge of saving for and managing their own retirement. Because the U.S. households at the top have reaped most of the income gains over the last decade -- and because they have disproportionately more access to retirement plans to begin with -- experts say the gap in retirement savings is only growing wider. They're expecting to see more elderly Americans working longer, moving in with their kids and tapping assistance programs.  ""Only the privileged have access to a secure retirement,"" says Teresa Ghilarducci, a labor economist at the New School for Social Research. THE INCOME DIVIDE It's easier to save when you're making more money, and the vast majority of the income gains have gone to the top in recent years. The top 10 percent of U.S. households made more than $162,180 last year, up 6 percent from a decade earlier after adjusting for inflation. For middle-income Americans, incomes have barely stayed ahead of inflation. Lower-income households are making less than a decade ago. The benefit of making more money goes beyond having more to save. Higher-income households also get a bigger after-tax benefit from putting money into a 401(k) or another tax-advantaged account. With traditional pensions increasingly becoming extinct, it's grown even more important for Americans to save. Meanwhile, Social Security -- the last line of defense for many retirement plans -- is at risk of having enough money to pay only 79 percent of benefits, starting in 2034. ACCESS TO PLANS The death of the traditional pension means the burden is on us to save, and that's why access to 401(k) and other retirement plans is so important. Most lower-income households will save when they have access to a retirement plan. The problem is that most don't get the opportunity. Eighty percent of high-income working households have access to a 401(k) or similar defined-contribution plan, according to the U.S. Government Accountability Office. For low-income working households, it's just 35 percent. The low retirement balances mean the majority of households -- 52 percent -- are at risk of having to cut their spending by more than 10 percent after entering retirement, according to the Center for Retirement Research at Boston College.  ""For an upper-middle class person, not being able to maintain their standard of living means fewer trips,"" says Alicia Munnell, the center's director. ""But for lower-income people, it can really mean depriving themselves."" POSSIBLE SOLUTIONS To help close the gap, states are trying their own measures. California recently passed a law requiring employers to automatically enroll their workers in a state-run program and deduct money from each paycheck. Experts prefer a broader fix from the federal government but call the state programs an encouraging step. In the meantime, many workers are simply working longer. David Tucker is 74 and still waking at 1:15 each morning to get to his job as a skycap at Reagan National Airport outside Washington, D.C. He says he may consider retiring next year or cutting down to a few days per week. And what would he look forward to in retirement?  ""I would like to feel what it's like to wake up and not go to work,"" he says. ""For a while, that's all I would like to do. I wouldn't worry about anything else."" ___ AP Data Journalist Angeliki Kastanis and AP Business Writers Joseph Pisani and Sarah Skidmore Sell contributed to this report. Copyright 2016 The Associated Press. All rights reserved. This material may not be published, broadcast, rewritten or redistributed. "
3	https://www.washingtonpost.com/politics/whitehouse/the-latest-trump-to-bar-officials-from-lobbying-for-5-years/2016/11/16/42114a2c-ac6a-11e6-8f19-21a1c65d2043_story.html	The Latest: Trump transition contacts with key departments	" WASHINGTON -- The Latest on Donald Trump's transition to the presidency (all times EST): 6:02 pm Defense, justice and foreign policy officials say that the Trump transition team has contacted their departments, and that meetings and briefings are being set up. State Department spokesman John Kirby said in a statement that the department is in contact with Trump's representatives, and that officials ""look forward to supporting their work and preparations in keeping with the president's priority of ensuring a smooth transition."" Defense Department press secretary Peter Cook official said Pentagon leaders received a phone call Wednesday afternoon and they expect to begin briefings on Friday. Eric Rosenbach, chief of staff to Defense Secretary Ash Carter, is heading the department's transition process. The Justice Department also issued a statement that it had been contacted and would begin briefing transition team members. ___ 4:30 p.m. President-elect Donald Trump's transition team has finally finished key paperwork clearing the way for the White House to start sharing information. Coordination was on hold until Trump's team submitted documents, including a list of transition team members who will coordinate with specific federal agencies, plus certification that they meet a code of conduct barring conflicts of interest. White House spokeswoman Brandi Hoffine says the minimum paperwork was finished Thursday. That means agencies can start giving briefings and written materials to Trump's team. But Trump's team still hasn't submitted names for some agencies. The White House isn't saying which agencies are missing. Hoffine says the White House expects Trump's team will submit names for a ""wider range of agencies."" She says the White House will process those ""on a rolling basis."" ___ 4:26 p.m. Israel's Ambassador to the United States is calling President-Elect Donald Trump a ""friend of Israel"" and says the country looks forward to working with everyone in his administration. Ron Dermer told reporters gathered in Trump Tower in New York City on Thursday that Trump and Vice President-elect Mike Pence were both strong allies. Dermer said Israel looks forward to working with the administration, ""including Steve Bannon, in making the US-Israel alliance stronger than ever."" Trump has named Bannon, a far-right publishing executive, as his top White House Strategist. Bannon led the Breitbart website, considered by many to be the alt-right's platform that has been widely condemned as racist, sexist and anti-Semitic. ___ 3:27 p.m. Mitt Romney will meet this weekend with Donald Trump. That's according to a source involved with the incoming Republican president's transition, who described it as a ""healing meeting."" The source requested anonymity because the event has not been officially announced. Romney was the 2012 presidential nominee and was an outspoken critic of Trump throughout the election. He slammed the New York businessman as a ""phony"" and a ""fraud."" Trump repeatedly referred to Romney as a ""loser."" But the two began mending fences after Trump's victory. Romney called to congratulate Trump.  ""Mitt Romney called to congratulate me on the win,"" Trump wrote on Twitter. ""Very nice!"" --By Julie Bykowicz ___ 3:15 Vice President-elect Mike Pence says he's confident Donald Trump's administration can find common ground with Democrats. Pence spoke briefly with reporters after a private meeting with incoming Senate Democratic leader Chuck Schumer of New York. He also met with House Democratic Leader Nancy Pelosi of California during a busy day in Washington. Pence says he's looking ""forward to finding ways that we can find common ground and move the country forward."" He adds: ""I'm very grateful for the open door, and I look forward to carrying the presided-elect's agenda to all of the members of the Senate and all the members of the House after January 20th."" ___ 3:07 p.m. House Democratic Leader Nancy Pelosi says Vice President-elect Mike Pence will be a ""valued player"" on Capitol Hill. Pence met with Pelosi and other House leaders Thursday. The former Indiana congressman says they discussed areas where they could work together, and that he and president-elect Donald Trump are ""working briskly"" on the transition. Pelosi says Pence will be valued in Congress because he ""knows the territory."" She says they talked about infrastructure and child care. She says Democrats will try to find common ground where they can, and stand their ground when they can. A spokesman says Pelosi also has ""deep concerns"" about the appointment of conservative publisher Steve Bannon as a top White House adviser. __ 2:40 p.m. America's future First Lady Melania Trump ""paused her studies"" to pursue a modeling career in Milan and Paris. That's according to her new biography on President-elect Donald Trump's transition website, GreatAgain.gov. The biography states that Melania Trump ""would pursue a degree at the University of Ljubljana in Slovenia, but paused her studies to advance her modeling career in Milan and Paris."" It's a modified version of an older biography posted on her personal website, which stated that the would-be First Lady began jet-setting between modeling gigs ""after obtaining a degree in design and architecture at University in Slovenia."" That version was later removed from the website. The Trump transition team did not immediately respond to a request for comment ___ 2:15 p.m. Vice President-elect Mike Pence has taken time while on a break between Capitol Hill meetings to offer a personal welcome to some tourists. Pence was walking through Statuary Hall when he stopped and unlatched the red velvet rope forming a barricade that separated him from some tour groups.  ""Welcome,"" Pence told a mother and her son -- visiting from Brazil. ""So nice to have you all here. Next up was a Massachusetts woman, Christine Slavin, and her service dog, Earle. Pence knelt down on one knee to speak with her eye to eye in her wheelchair.  ""So nice to meet you,"" he told her. Enjoy your day at the Capitol."" Slavin says it's great to meet a future leader, but she says she probably wouldn't have recognized Pence if other people hadn't mentioned his name. ___ 1:50 p.m. President-elect Donald Trump has wrapped up a meeting with former Secretary of State Henry Kissinger in Trump Tower. Trump's transition team says the incoming president and Kissinger discussed China, Russia, Iran and the European Union. It comes ahead of Trump's meeting with Japanese Prime Minister Shinzo Abe, his first in-person meeting with a foreign leader since his election. Kissinger was Secretary of State under Republican presidents Richard Nixon and Gerald Ford. ___ 1:40 p.m. New York City charter school leader Eva Moskowitz is out of the running to be education secretary for President-elect Donald Trump. Moskowitz said Thursday she's taken herself out of the running. She heads New York's largest charter school network and met with Trump this week at Trump Tower. She says she hopes to work with Trump on school choice and suggests there are ""positive signs"" the president-elect will govern differently than he campaigned. But she adds that she voted for Hillary Clinton, and in a letter to parents, warns that many of her students are overwhelmingly black and Latino and would feel that ""they are the target of the hatred that drove Trump's campaign."" ___ 10:47 a.m. Vice President-elect Mike Pence says he's confident the all-Republican government can ""rebuild our military, revive our economy and, in a word, make America great again."" That's what the Indiana governor said as he left a closed-door meeting with House Republicans. Pence was making the rounds of meetings on Capitol Hill on Thursday, sitting down with Republican and Democratic leaders. Pence spent more than a decade in Congress. He said it was humbling to be back among his colleagues. He sought to reassure Republicans that the Donald Trump transition wasn't in disarray. ___ 10:44 a.m. Vice President-elect Mike Pence has a simple message for House Republicans about the incoming administration and next year: ""Buckle up."" That's the word from lawmakers who attended Thursday's closed-door meeting with the Indiana governor. Congressman Daniel Webster of Florida said Pence told Republicans the next year won't be the slow process they're used to. With an all-Republican government led by Donald Trump, the GOP intends to dismantle much of President Barack Obama's record, from his health care law to environmental rules to cuts in domestic programs. Congressman Mark Meadows of North Carolina says the message was the administration will be aggressive and will require an all-hands-on-deck approach. Pence also asked lawmakers to pray for Trump and his family. ___ 10:10 a.m. Vermont Sen. Bernie Sanders is calling on Donald Trump to apologize for some of his rhetoric during the presidential campaign. He's also asking Trump to cut ties with campaign CEO Steve Bannon. The president-elect has named Bannon as a top White House adviser, sparking outcry from Democrats who say the conservative media CEO peddles conspiracy theories and white supremacy. Sanders says his office received ""many, many"" calls from people wanting Trump to ditch Bannon. But he also says there may be opportunities to work together on curbing high drug prices, renegotiating trade deals, curbing the influence of Wall Street and other ideas that will ""improve life for working people."" Sanders says Democrats will hold Trump accountable for his campaign promises. He's speaking to reporters in Washington. ___ This story has been corrected to reflect that Bannon was appointed, not nominated. ___ 8:50 a.m. Sen. Ted Cruz is being coy about any role he might have been asked to play in the incoming Trump administration. Cruz tells Fox News Channel's ""Fox and Friends"" that he and the billionaire businessman who was his bitter campaign rival had ""a far-reaching conversation"" at Trump Tower. But when asked pointedly if the position of attorney general or any other administration post had been discussed, Cruz replied that ""the heart of what we talked about"" were solutions for the problems facing the country.  ""I'm eager to work with the new president in whatever capacity I can have the greatest impact defending the principles that I was elected to defend,"" said the Texas Republican. Cruz fiercely challenged Trump for the Republican presidential nomination and relations between the pair were strained for months. Trump repeatedly referred to him as ""Lyin' Ted."" ___ 8:05 a.m. President-elect Donald Trump's campaign manager Kellyanne Conway says she expects that initial announcements of Cabinet choices could come ""either before or after Thanksgiving"" and says ""it's Donald Trump and Donald Trump alone who makes the ultimate decisions."" Conway also says in a nationally broadcast interview she believes her boss is prepared for the weight of the presidency.  ""I actually love seeing how engaged he is in the transition,"" Conway told MSNBC's ""Morning Joe"" program Thursday.  ""He's there sitting at his desk, he's on the phone,"" and talking to advisers, she said. ""He's ready."" Conway said the pace of Trump's transition work is on a par with the timetables of recent presidents-elect. Copyright 2016 The Associated Press. All rights reserved. This material may not be published, broadcast, rewritten or redistributed. "
4	https://www.washingtonpost.com/news/get-there/wp/2016/11/17/treasury-announces-7-billion-for-program-that-supports-low-income-areas/	Treasury announces $7 billion for program that supports low-income areas	"   The Treasury Department announced a new round of funding for a program that encourages investments for businesses in low-income communities. (J. David Ake/AP)  The Treasury Department announced a new round of tax credits meant to encourage community development in low-income neighborhoods. The Treasury's Community Development Financial Institutions Fund said Thursday it will deliver $7 billion in tax credits to 120 organizations across the country. Those groups, spread out across 36 states, the District and Puerto Rico, will use the funds to boost investments to businesses and nonprofits in their communities. ""By attracting private business and development to distressed communities, this tax credit spurs economic growth,"" said Treasury Secretary Jack Lew in a statement. In past years, the tax credits have been used to encourage investments that may help improve organizations in struggling communities, such as grocery stores, theaters and schools. For instance, Lew spoke Thursday in Anacostia at Educare DC, a preschool that received low-cost financing through the program in 2009. The school, which educates children from low-income families, used the loan to pay for construction of the building -- a 32,100-square-foot facility with a courtyard, sleek wooden panels and glass walls. On a tour of the school, Lew waved at toddlers playing with building blocks. One little girl in a Hello Kitty sweater offered him a slice of imaginary pizza. ""We created a new learning community for families that wouldn't have had it otherwise,"" said Pyper Davis, executive director of Educare DC. The treasury secretary also met with representatives from some of the organizations that will be receiving tax credits. They talked about how they plan to use the money to help support affordable housing, vocational training programs, charter schools and health centers. ""So many of the communities we work in haven't fully recovered yet from the economic downturn,"" said Annie Donovan, director of the CDFI Fund, which runs the tax credit program. One woman asked him for advice on how to maintain support for the tax credit program among a changing political climate. Lew, who was appointed by President Obama in 2013, will be replaced after President-elect Donald Trump takes office in January. Lew pointed out that the Community Development Financial Institutions Fund began as a joint effort from both political parties. Still, the organizers of the tax credit program won't have to worry about the political environment in Washington for a couple of years at least. As part of the latest renewal, funding for the New Markets Tax Credits was secured through 2019."
