	Link	Title	Text
5	https://www.washingtonpost.com/news/business/wp/2016/11/17/airbnb-bookings-in-d-c-are-nearing-an-all-time-high-for-trumps-inauguration/	Airbnb bookings in D.C. are nearing an all-time high for Trump’s inauguration	"   The home-rental site Airbnb is expecting 10,000 Washington-area guests during January's presidential election. Here, a listing for a 1-bedroom condo in Penn Quarter. (Screengrab from Airbnb.com)  As the country braces for Donald Trump's presidency, Lyudmila Tregubova is preparing in her own way: By readying the two bedrooms in her Capitol Hill home for overnight guests during January's inauguration. She's charging $615 for one bedroom, which has already been booked, and $550 for the other. Tregubova, meanwhile, will relocate to a couch on the living room. ""With inauguration, you post a room -- and all of a sudden it's booked,"" said Tregubova, 57, who began renting out her house during President Obama's first inauguration in 2009. ""The demand is big."" As thousands make plans to descend on Washington for Trump's Jan. 20 inauguration -- as well as the next day's Million Woman March protest -- local Airbnb bookings are nearing all-time highs, company spokesman Crystal Davis says. More than 10,000 people are expected to book Airbnb rentals in the Washington area for inauguration day -- a 600 percent increase from 2013 during President Obama's second inauguration, according to company projections. ""This is, without a doubt, the busiest event for us,"" said Karl Scarlett, owner of Great Dwellings, a District-based company that helps homeowners manage Airbnb rentals. ""January in D.C. is usually brutal for this industry. But when there's an inauguration, people are literally booking in the $1,000-a-night range.""   [One of the most lavish hotel inauguration packages includes a private chef for your dog]   A recent search on Airbnb's website turned up listings commanding as much as $10,000 per night for a two-bedroom condo at the Newseum. With taxes and fees, the total for a three-night stay was $36,532. A ""bright hip spot in Columbia Heights"" that generally rents for $90 a night, was listed for a nightly rate of $1,333. With taxes and fees, that would set you back $4,882 for a three-night stay. Looking for a bit more space? A ""luxury rowhouse"" in Logan Circle promises two bedrooms for nearly $2,700 a night. Lara Hawketts, owner of Home Sweet City, which manages local Airbnb rentals, says inauguration weekend prices are, on average, four times higher than the usual going-rate. The company is also requiring a seven-day minimum for inauguration bookings. ""This is the likely the most people will ever pay,"" she said. During Cherry Blossom season, for example, prices are marked up about 50 percent. ""It's been interesting to see the rise in demand.""   [Want to put your apartment on Airbnb? Here's what you need to know first.]   Right after the election, she says, things weren't looking so great. Following Trump's win last week, Hawkett says she received a wave of phone calls -- all cancellations -- from Hillary Clinton supporters. A number of area hotels told The Washington Post they had similar experiences. ""We had a bunch of bookings pre-election -- and literally the day after the results came in, they all cancelled,"" she said. ""But now it's creeping back up."" Tregubova says she's prepared for whatever January's festivities may bring. After all, she says, in 2009, she had 16 guests staying under her roof. ""Everything was booked, so people were saying, 'Please, please, we'll sleep on the floor,'"" she said, adding that she ended up renting out her parlor to a family of four who brought their own air mattress. She has since downsized, from a 5-bedroom house to a 2-bedroom, and says she's learned a thing or two about playing host to inaugural revelers. ""It's simple,"" she said. ""I never talk about politics with my guests -- even if they ask me to."" Read more: D.C. hotels were expecting an inaugural booking frenzy. Instead they've got vacancies. Airbnb says it plans to take action to crack down on racial discrimination on its site As regulatory attacks mount, Airbnb goes on a charm offensive Why Trump didn't host his election night party at his own hotel"
6	https://www.washingtonpost.com/blogs/plum-line/wp/2016/11/17/why-the-filibuster-may-survive-after-all-and-limit-the-damage-congressional-republicans-can-do/	Why the filibuster may survive after all — and limit the damage congressional Republicans can do	"   (Bill O'Leary/The Washington Post)  When the new Congress is sworn in and Donald Trump takes office in January, Republicans have a long list of legislative actions they want to take. Repeal the Affordable Care Act. Privatize (excuse me, ""reform and strengthen"") Medicare. Slash Medicaid. Cut taxes for the wealthy and corporations. Undo environmental protections. Make it harder for unions to organize. Repeal the Dodd-Frank law to unburden Wall Street from meddlesome oversight. Defund Planned Parenthood. Build a border wall.  It's a veritable smorgasbord, and after eight years of a Democratic presidency, they are positively famished. But there's one thing standing in their way: the filibuster. With only a 51-seat majority in the Senate (52 seats if, as expected, the Republican candidate wins a runoff election in Louisiana), they're nowhere near the 60-vote supermajority they'd need to overcome Democratic filibusters. So now they have to answer a question: Will they kill the filibuster once and for all?  For some time now -- starting many months ago when contemplating the possibility of full Republican control of government -- I've been arguing that they will. With all those tantalizing laws just waiting to be passed, and with an angry base ready to revolt if they don't do what they promised, it will be just too tempting. Yes, they might come to regret it the next time there's a Democratic president and a Democratic Senate, which could happen four years from now. But the first time Democrats filibuster an important GOP priority -- especially ACA repeal, which Republicans turned into a symbolic vessel for all their hatred of President Obama and all their supposed ideological commitments -- talk radio and Fox News will explode with rage and a demand to nuke the filibuster once and for all. The pressure will simply be too hard to resist. But I may have been wrong. The narrowness of the Republican majority means that Democrats would need only a couple of Republicans to vote with them to deny the GOP the 51 votes it needs to institute a change in Senate rules. And now at least four Republican senators have gone on record saying that the filibuster should stay. Lindsey Graham said emphatically that ending the filibuster would be ""a horrible, terrible idea."" Orrin Hatch was even more categorical. ""Are you kidding?"" he responded when asked by the Huffington Post's Michael McAuliff whether it should be eliminated. ""I'm one of the biggest advocates for the filibuster. It's the only way to protect the minority, and we've been in the minority a lot more than we've been in the majority."" And NBC's Benjy Sarlin reports that Jeff Flake and Jim Inhofe both told him the filibuster should stay. There are a few reasons Senate Republicans might want to keep it. First, senators are very, very protective of their privileges, the many ways the institution gives each member extraordinary powers to slow things down and even grind them to a halt. A Senate that runs on simple majority rule would be almost like the House, a prospect senators of both parties find utterly horrifying.  Second, Mitch McConnell may find it handy to allow some pieces of Republican legislation to die in the Senate, particularly ones that threaten to produce the kind of political backlash that would threaten his majority and President Trump's reelection. The House is likely to produce a torrent of far-right bills, and McConnell can allow the more dangerous ones to be filibustered, then put the blame on Democrats when angry conservatives bellow. The trouble is that it's not up to him which bills Democrats choose to filibuster and which they don't. And if they follow the precedent McConnell established during the Obama years, they'll just filibuster everything. That was McConnell's innovation: While the filibuster was once a technique that members of the minority used only rarely (and it once required actual talking, ""Mr. Smith Goes to Washington""-style), McConnell made it the default for any legislation more consequential than the renaming of a post office or a measure declaring August to be Jock Itch Awareness Month.   Presuming Democrats go that route, it wouldn't mean there'd be nothing congressional Republicans could do, because they can use the ""reconciliation"" process -- in which filibusters are not allowed -- for some things, particularly changes to taxing and spending. But they'll quickly find reconciliation's limits to be painfully constricting, and pressure will begin to build. That's when the Republican senators now standing behind the filibuster might begin to waver. You could easily imagine a scenario where Democrats filibuster the first few big Republican bills, and then things suddenly look very different. Those Republicans might say that when they supported the filibuster, it was on the assumption that Democrats would use it responsibly, but now that they've seen the full extent of the Democrats' villainous obstructionism, they must regretfully support the end of this formerly noble instrument of democracy that those dastardly Democrats twisted into a tool to subvert the people's will. It's too early to know exactly what will happen, particularly since we don't know how the impulsive, vindictive buffoon in the Oval Office is going to inject himself into this process. But Republicans will learn that even when you control all three branches of government, things can still get complicated."
7	https://www.washingtonpost.com/world/europe/the-latest-obama-meets-us-ambassador-for-lunch-in-germany/2016/11/17/62e90ad0-acb7-11e6-8f19-21a1c65d2043_story.html	The Latest: Obama ‘cautiously optimistic’ about Trump	" BERLIN -- The Latest on President Barack Obama's last official overseas trip (All times local): 6:45 p.m. President Barack Obama says he's ""cautiously optimistic"" about his successor, President-elect Donald Trump. Obama says there's something about the solemn responsibilities of the office that forces one to focus and demands seriousness. The president says ""if you're not serious about the job, then you probably won't be there very long because it will expose problems."" The president says he told Trump when they met that the passions generated during the campaign may not work in unifying the country now, and Trump seemed to understand that. But Obama suggests Trump's ability to unify the public will tested by how he uses his rhetoric now and the appointments he makes for his administration. ___ 6:20 p.m. President Barack Obama says he won't advise people protesting Donald Trump's election victory to keep silent. His message instead: Voting and organizing matter. Obama says he has continually told young people not to take the nation's systems of government and way of life for granted. He says democracy is hard work and noted some 43 percent of eligible voters didn't vote. Obama also says that the foundations of a health democracy mean people have to be engaged, not just in an election or when an issue pops up for a few weeks. ___ 6:10 p.m. President Barack Obama says he hopes President-elect Donald Trump will ""stand up to Russia"" when it deviates from U.S. values and international norms. Obama says on issues such as the Ukraine and Syria, the U.S. has very significant differences with Russia. He says it's important to find areas of cooperation with Russia when values align, but he also hopes the new president will be firm with Russia when they don't. Obama says he's doesn't expect Trump to follow the Obama' administration blueprint or approach, but also hopes he won't simply walk away from the administration's efforts. The president also says Trump's commitment to NATO is important. ___ 5:55 p.m. German Chancellor Angela Merkel says her country is prepared to increase its military commitments as demanded by allies such as the United States. Germany has long been criticized by the alliance for not meeting its obligation to commit at least 2 percent of its GDP to defense spending. And President-elect Donald Trump pressed NATO allies during his election campaign to pay their share, and suggested the U.S. might back away from the alliance if they don't. Merkel says: ""We got the message and have started to react."" She was speaking at a press conference with President Barack Obama in Berlin on Thursday. Germany spent about 1.2 percent of its gross domestic product on defense last year. ___ 5:50 p.m. President Barack Obama says it's important that global trade agreements continue when concerns are running high about globalization and its effects on some people. Obama is holding a news conference in Berlin with German Chancellor Angela Merkel. Obama is alluding to skepticism in the U.S. about free trade agreements that was on display in the recent election of Donald Trump. Obama says the last several decades have shown that markets, trade and commerce can create prosperity in all countries. The president also says the European Union remains one of the world's great achievements. He says those achievements should be nurtured and cultivated, not taken for granted. ___ 5:45 p.m. German Chancellor Angela Merkel says the world can't revert to a time before globalization. She says her country will continue to pursue free trade deals with the United States. Negotiations over a trans-Atlantic trade pact failed to conclude before the end of President Barack Obama's second term, effectively putting the project on ice for years to come. Merkel told a news conference with Obama in Berlin on Thursday that she is ""quite sure we will return to it one day."" She says she hopes to ""work closely with the new president"" when Donald Trump takes office next year. Trump's skepticism about free trade agreements underpinned his campaign. ___ 5:15 p.m. The United States urged Russia a week before Election Day to stop interfering in the election through cyberattacks. That's according to a senior Obama administration official who requested anonymity to discuss private diplomatic conversations. The official says the U.S. contacted Moscow about malicious cyber activity that was originating in Russia and targeting U.S. elections systems. The complaint was registered through a secure ""hotline"" between the Nuclear Risk Reduction Centers in both the U.S. and Russia. The U.S. has previously accused Russia publicly of coordinating hacks of the Democratic National Committee and other U.S. institutions in the run-up to last week's presidential election. --By Josh Lederman ___ 4 p.m. President Barack Obama is sitting down with German Chancellor Angela Merkel for formal meetings in Berlin as part of Obama's sixth and final visit to the nation. The two leaders sat down on opposite sides of a long table along with top foreign policy aides. Obama was accompanied by his national security adviser, Susan Rice. Obama and Merkel made no comments to reporters as they started the meeting. They'll take questions together at a news conference later Thursday afternoon. ___ 3:40 p.m. German news magazine Der Spiegel says U.S. President Barack Obama has praised German Chancellor Angela Merkel as someone ""who is willing to fight for her values."" Obama told Spiegel and German public Television ARD in a joint interview Thursday that he's glad Merkel is around and that ""the Germans should appreciate her."" Obama also warned not to underestimate the consequences of globalization. The president told the two media organizations that, ""If the global economy does not respond to the people who feel left behind; if inequality continues to grow, we will witness that the divisions in the industrial countries will broaden."" Der Spiegel and ARD released excerpts of the talk with Obama ahead of the screening of the entire interview on Thursday night. ___ 1:50 p.m. White House press secretary Josh Earnest says the Obama administration has ""put a lot of diplomatic capital on the table"" to resolve the protracted civil war in Syria and acknowledges it ""hasn't worked,"" but says military force is no solution. Interviewed on MSNBC's ""Morning Joe"" show Thursday from Berlin where he's accompanying Obama on a visit to Germany, Earnest was asked about the continuing loss of life, including children, in the Syrian city of Aleppo.  ""What is true is that the tactics that have been used by the Assad regime and the Russians are frankly disgraceful,"" Earnest said, accusing them of seeking to target ""innocent civilians"" and saying it was an ""outrage.""  ""The question really is"" what the United States and the international community can do to end the violence, Earnest said, adding that Secretary of State John Kerry ""has been working doggedly"" to bring relief for the suffering. ___ 12:05 p.m. President Barack Obama is opening his first full day in Berlin by having lunch with U.S. Ambassador John Emerson. The White House says they're having a private lunch at the U.S. Embassy in Berlin. Obama also spent part of his morning taping a joint interview with the Der Spiegel newspaper and German public TV station ARD. Obama plans to meet later Thursday with German Chancellor Angela Merkel and hold a joint news conference with her. ___ 9:08 p.m. President Barack Obama is stressing a message of solidarity on his final visit to Germany -- a top trade partner, key NATO ally and home to thousands of American troops, as well as a nation critical to solving Europe's migrant crisis and debt woes. Obama arrived Wednesday night in Berlin from Greece, making his sixth and final visit as president to Germany, where he has been popular since even before he was elected. His eight years in office have helped erase much of the anti-American sentiment that had grown during the administration of George W. Bush over the Iraq war and other policies. German Chancellor Angela Merkel, who worked well with Bush before Obama's election, dined with Obama Wednesday night at his hotel and was to hold talks with him Thursday afternoon. Copyright 2016 The Associated Press. All rights reserved. This material may not be published, broadcast, rewritten or redistributed. "
8	https://www.washingtonpost.com/national/federal-appeals-court-blocks-release-of-wisconsin-inmate-featured-in-the-netflix-series-making-a-murderer/2016/11/17/af267d3c-acef-11e6-8f19-21a1c65d2043_story.html	Federal appeals court blocks release of Wisconsin inmate featured in the Netflix series ‘Making a Murderer’	 MADISON, Wis. -- Federal appeals court blocks release of Wisconsin inmate featured in the Netflix series 'Making a Murderer' Copyright 2016 The Associated Press. All rights reserved. This material may not be published, broadcast, rewritten or redistributed. 
9	https://www.washingtonpost.com/local/pulitzer-prize-winning-photographer-dies-at-79/2016/11/07/0c1e12e0-a52d-11e6-ba46-53db57f0e351_story.html	Pulitzer Prize-winning photographer dies at 79	" WASHINGTON -- Joe Marquette, a Pulitzer Prize-winning photographer who covered Olympics, Super Bowls and the White House during a five-decade career, has died at his home in Tulsa, Oklahoma, after a series of lengthy illnesses. He was 79. Marquette was a large man with an outsized personality and someone fellow photographers sometimes referred to as ""Condor,"" the White House News Photographers Association said in announcing his death. Marquette spent a decade with The Associated Press and also worked for several other news organizations, including UPI, Reuters and the Philadelphia Inquirer. In 1999, along with a team of other AP photographers, he won a Pulitzer in the category of feature photography for coverage of the impeachment of President Bill Clinton. Marquette's career gave him a front seat to some of the most important events of the 20th and 21st centuries. He initially covered sports but eventually moved to politics. Space launches, the Olympics and Super Bowl games were among his specialties. His 1984 Super Bowl picture of John Riggins scoring the winning touchdown for the Washington Redskins became a popular poster that hung in offices and restaurants all over the Washington area. His photo of Britain's Sebastian Coe winning the gold medal in the 1,500-meter race at the Moscow Olympic Games won first place in sports in the World Press Photo contest. Ron Edmonds, a retired Associated Press photographer who knew Marquette for almost 40 years as a colleague and as a competitor, described him as extremely well liked by his peers because he was ""60 percent comedian in dealing with everyday life, but on top of that, he was one of the best photojournalists in the business."" Edmonds said that before the age of cell phones and laptop computers, a large portion of a wire photographer's job was just finding a way to transmit an image quickly. He said Marquette would plan way ahead on a story and arrange to use phone lines in people's homes if need be, allowing him to send his photos while competitors were still scrambling.  ""Joe was probably one of the best at getting pictures out of some of the worst places you can imagine,"" Edmonds said. Copyright 2016 The Associated Press. All rights reserved. This material may not be published, broadcast, rewritten or redistributed. "
