	Link	Title	Text
0	https://www.washingtonpost.com/world/middle_east/activists-intense-bombing-of-syrias-aleppo-kill-6/2016/11/19/f720fbaa-ae50-11e6-8f19-21a1c65d2043_story.html	Activists: Intense bombing of Syria’s Aleppo kills 20	" BEIRUT -- Government bombardment of besieged rebel-held neighborhoods in Aleppo killed at least 20 people Saturday, the worst since airstrikes resumed earlier this week, said Syrian opposition activists, as the U.S. called for an end to the bombings. Saturday was the fifth day of renewed assaults by Syrian warplanes on eastern Aleppo districts, a rebel-held enclave of 275,000 people. The onslaught began Tuesday, when Syria's ally Russia announced its own offensive on the northern rebel-controlled Idlib province and Homs province in central Syria. The bombing on Saturday came after a day of airstrikes that hit four hospitals in east Aleppo. A statement issued late Friday by the opposition's Aleppo Health Directorate said that all hospitals in east Aleppo are out of service because of the bombing over the past days.  ""The intentional destruction of infrastructure for survival has made the besieged steadfast people, including children, elderly and men and women, without medical facilities to treat them,"" the statement said. The Britain-based Syrian Observatory for Human Rights said not all hospitals in east Aleppo neighborhoods are out of service but people are finding difficulties reaching them because of the intensity of the shelling. The White House meanwhile demanded an immediate halt to Syrian strikes on eastern Aleppo. White House National Security Adviser Susan Rice said the U.S. is tracking reports about health conditions. Speaking in Peru, Rice said the U.S. condemns the ""horrific attacks"" against hospitals and aid workers ""in the strongest possible terms"". Rice added there was ""no excuse"" for the attacks. The White House is putting the onus on Russia to lower the violence and help humanitarian aid get to besieged Syrians. It says President Barack Obama joins other leaders in Europe, and those gathering for an Asia economic summit in Peru over the weekend, in demanding a halt to bombings. Opposition activists said Saturday's death toll has been the worst since the aerial campaign resumed on Tuesday. Residents said hundreds of artillery shells and dozens of airstrikes have hit the city, increasing the misery of its residents who have been suffering from lack of food and medicine because of the siege imposed by government forces and their allies in July.  ""Aleppo is being wiped out in front of the eyes of the world,"" medical official Mohammed Abu Rajab said in an audio message to The Associated Press from inside the city. ""It's not only hospitals that are out of service. All liberated areas in Aleppo are out of service.""  ""Entire buildings have been completely destroyed,"" Abu Rajab said. The Observatory said Syrian government warplanes and artillery struck more than 20 neighborhoods in east Aleppo killing 27 people and wounding many others. The Aleppo Media Council, an activist collective, said 20 people, including children, were killed in Saturday's violence in the country's largest city and former commercial center. Pro-government media, meanwhile, reported rebel shelling on government-held parts of the city, saying they killed two and wounded others. The latest deaths raise to more than 130 the number of people killed in northern Syria since Tuesday. The U.N. said in a statement released in Damascus that it ""is extremely saddened and appalled by the recent escalation in fighting"" in several parts of Syria, calling on all sides to cease indiscriminate attacks on civilians and civilian infrastructures. It said the U.N stands ready to assist people in east Aleppo ""as soon as access is granted by all parties."" It said it has shared with all parties to the conflict in Aleppo and concerned member states a detailed humanitarian plan to provide urgently needed assistance to the inhabitants of east Aleppo, and conduct medical evacuations for the ill and injured"" confirmed both Syria Humanitarian Coordinator Ali Al-Za'tari and the Regional Humanitarian Coordinator for the Syria Crisis Kevin Kennedy.  ""It is imperative all parties agree to the plan and allow us to secure immediate, safe and unimpeded access to provide relief to those most in need in east Aleppo, but equally in all other parts of Syria,"" they said. Meanwhile, an aircraft believed to be American killed late Friday a senior official with al-Qaida's affiliate in Syria known as Fatah al-Sham Front northwest of the country along with two other people, according to the Observatory and jihadi websites. A militant website and jihadis said the man was Egyptian citizen Abu Abdullah al-Muhajer, an Afghanistan fighting veteran who has been recently working closely with Fatah al-Sham Front's leader Abu Mohammed al-Golani. Al-Muhajer, whose real name was Abdul-Rahman Ali, joined the early jihad and then subsequent infighting in Afghanistan, according to the website, which provided a profile. It said he went on to Pakistan to study for a post-graduate degree in Sharia law and fled again to Afghanistan after being sought by Pakistani police. He worked as a preacher there and was close to the late al-Qaida leader Osama bin Laden and his successor Ayman al-Zawahri. After the U.S. invasion of Afghanistan, he fled to Iran and spent several years in prison before he was released. The Observatory confirmed that an Egyptian commander with the al-Qaida affiliate was killed along with two people when their vehicle was struck with a missile fired from an aircraft. The U.S. has killed several top al-Qaida officials in Syria since the start of 2015. Last month, a drone attack killed top Egyptian al-Qaida veteran Ahmed Salama Mabrouk. ___ Associated Press writer Maamoun Youssef in Cairo contributed to this report. Copyright 2016 The Associated Press. All rights reserved. This material may not be published, broadcast, rewritten or redistributed. "
1	https://www.washingtonpost.com/world/afghans-are-rooting-for-zalmay-khalilzad-a-former-us-envoy-to-end-up-in-trump-administration/2016/11/18/61731f16-adb0-11e6-8f19-21a1c65d2043_story.html	Afghans are rooting for Zalmay Khalilzad to end up in Trump administration 	"  KABUL -- Almost every morning, the front page of the Afghanistan Times features a long excerpt from Zalmay Khalilzad's memoir, ""The Envoy,"" accompanied by a prominent photo of the Afghan-born former U.S. ambassador to Afghanistan, Iraq and the United Nations.   Many passages are dramatic accounts of his role in Afghan policy as a U.S. official after the fall of the Taliban in 2001. One describes him challenging then-Defense Secretary Donald H. Rumsfeld, who advised him to ""take your hand off the bicycle seat"" and let Afghans figure things out on their own. In exasperation, Khalilzad says he replied, ""Mr. Secretary, there is no bicycle!"" No one in the Afghan capital needs to be reminded of the ambitious swath that the Afghan native, now 65, cut through the nation's politics when he arrived here as Washington's envoy in 2003. Khalilzad had strong ideas about how to build a new civilian government after the fall of the Taliban regime -- and the forceful personality to help push them through.  [Afghan security worries envoy]  His two-year tenure was controversial, in part because he became openly enmeshed in the maneuvering that led to Hamid Karzai becoming president, and also because he urged Karzai to welcome a rogue's gallery of anti-Taliban warlords into the fold -- a legacy that challenges Afghanistan's political stability to this day. In the process, he became known as the American ""viceroy."" Today, though, Khalilzad -- who has been mentioned as a possible candidate for secretary of state, or more likely a lower-profile adviser on foreign policy in the Trump administration -- seems to many Afghans like a potential lifeline to an unpredictable new government in Washington, following years of reliable U.S. economic and military aid to his impoverished and war-wracked country. ""He has a deep attachment to the U.S. and Afghanistan, and he is someone who can bring balance and success to U.S. policy in this part of the world,"" said Abdul Hamid Mobarez, a writer and former information official under Karzai. He said Khalilzad had ""played a major role in the new postwar order in Afghanistan,"" a difficult process that he said included ""some faults"" in the empowerment of former strongmen. But like several other Afghan experts and former officials, Mobarez said he hoped Khalilzad could help tilt U.S. policy away from Pakistan, a U.S. anti-terrorism partner next door that many Afghans view as the source of their country's insurgent problem. Such an approach, he said, would ""lead to stability in Afghanistan and be beneficial for America."" Mohammed Daud Kalakani, a legislator from Kabul, said Afghans ""would generally hail"" Khalilzad's appointment to a foreign policy role in Washington, calling him ""a person with initiative, knowledge and vast understanding of the region's issues"" as well as having a close familiarity with all Afghan factions. He, too, suggested approvingly that Khalilzad would be a strong critic of Pakistan for ""giving shelter and arms to terrorists."" Some experts here suggested that this might be wishful thinking, given that U.S. policymakers have to balance complex regional relationships and that Pakistan is an important if not always reliable ally in U.S. anti-terrorism efforts. They also noted that Afghanistan played almost no part in the U.S. election campaign and is unlikely to be high on the new administration's agenda.  But Ahmed Rashid, a Pakistani expert on Afghanistan and the Taliban, said he expected that Trump would be attuned to international concerns about Pakistan because of its support for the Taliban. In a recent interview, he said Trump ""will be quite tough on Pakistan, perhaps tougher than the Obama administration."" The United States still has about 10,000 troops here, and many Afghans are worried that the Trump administration will pull them out, robbing the country's defense forces of valuable support and training as they take over the fight against the Taliban. If Khalilzad were in a position to do so, they assume he would argue in favor of keeping a military presence here.  [Latest Afghan attack raises perplexing questions on security]  During his campaign, however, Trump did say he would probably keep the troops here, calling Afghanistan ""the one place we should have gone in the Middle East,"" because it is ""right next to Pakistan, which has nuclear weapons."" In an interview with Fox News in the spring, he added: ""I think you have to stay and do the best you can. Not that it's ever going to be great, but I don't think we have much of a choice."" Afghan President Ashraf Ghani, whose administration has been close to the Obama administration, warmly congratulated Trump on his victory, saying that the U.S. government is an ""essential and important strategic partner"" and that he hopes for ""close cooperation with the new president."" While Khalilzad's views might fit in with the new administration's, he is considered a long shot at best to become the top U.S. diplomat. Although he was one of the few senior figures in the foreign policy establishment to endorse Donald Trump and has held numerous positions in past Republican administrations, he also has been criticized as a lone operator who ""freelanced"" or skirted official limits as a diplomat. He also reportedly considered running for president of Afghanistan in 2009 and 2014. Khalilzad is also a Sunni Muslim immigrant, a category of people that Trump has said he would consider barring from the United States or subjecting to special vetting. In addition, some foreign-policy aides to Trump have warned that the executive branch is riddled with Muslim extremist sympathizers. Some of Khalilzad's fiercest critics have been fellow Republicans, including Rep. Dana Rohrabacher (R-Calif.), who accused him of meddling in Afghan politics, shaping the new constitution and promoting Karzai. In a 2012 open letter to Khalilzad, Rohrabacher charged that he and U.N. officials had ""aggressively interfered"" in Afghan affairs to ensure that Karzai came to power. But some Afghans recall that time differently, saying Khalilzad's activism made a positive contribution to a tense and unsettled situation. One is Mirza Yarmand, a former deputy minister who worked with Khalilzad in Kabul. He described the former envoy as ""an intellectual, sage person"" who would be an ""ideal"" top U.S. diplomat. ""His involvement was not interference,"" Yarmand said. ""It was a kind of cooperation and contribution to the new Afghanistan.""  Read more   Today's coverage from Post correspondents around the world   Like Washington Post World on Facebook and stay updated on foreign news  "
2	https://www.washingtonpost.com/news/early-lead/wp/2016/11/19/knicks-derrick-rose-plans-to-keep-his-chicago-trump-tower-condo-for-now/	Knicks’ Derrick Rose plans to keep his Chicago Trump Tower condo — for now	"   Rose paid $2.8 million for his three-bedroom condo in Chicago's Trump International Hotel and Tower in 2012. (Michael Reaves/Getty Images)  New York Knicks star Derrick Rose isn't about to let politics or peer pressure bend him into making any rash real estate decisions. On Friday, the former Bulls guard said he plans to keep his condo in Chicago's Trump International Hotel and Tower, despite growing criticism of president-elect Donald Trump among NBA teams and personalities.   [Multiple NBA teams are reportedly avoiding Trump hotels on road trips]   ""I stay out of the political world,"" Rose told the New York Post. ""His beliefs are his beliefs."" Rose said he ""gets"" the controversy surrounding Trump, ""as far as (some people) not wanting to associate themselves with that name."" ""But my situation is a little bit different,"" he continued. ""I bought my place well before he became (a presidential) candidate. And I felt like nobody could tell me to sell my property."" Rose paid $2.8 million for his three bedroom, four-bath, 3,102-square-foot condo on the 84th floor of the Trump building in downtown Chicago just before he signed a $95 million contract extension with the Bulls in 2012, according to county records obtained by Chicago Business. ""It's definitely an unbelievable feeling just being up there,"" Rose said (via Chicago Business) shortly after the purchase. ""The view is nice and I don't take it for granted. It's a blessing.""   [Jury clears NBA star Derrick Rose and two friends in rape case]   Rose's ""blessing,"" however, had not appreciated the way he hoped by this summer when he got traded to the Knicks. While he originally wanted to sell the property, Rose told the New York Post that a soft real estate market changed his mind. ""The market isn't good,"" he said, not specifying whether he was referring to a general or Trump-specific slump. ""I don't know if a lot of people want to be part of it."" But ""who knows,"" the 28-year-old added. ""In a year or two, it may triple the price. I'm not selling it (now) because I don't want to feel I'm being forced to. It's an investment."" Rose's decision to sit on his Trump property comes in the wake of at least three NBA teams reportedly avoiding Trump hotels this season. Among those teams are the Milwaukee Bucks, Memphis Grizzlies and the Dallas Mavericks, which are owned by longtime Trump critic Mark Cuban. He told the Associated Press this week the decision for the Mavericks to avoid Trump hotels ""was made months ago."" Memphis coach David Fizdale, meanwhile, denied the Grizzlies' decision to avoid Trump properties had anything to do with the election. ""We didn't stay in Trump hotels when I was in Miami either,"" Fizdale, who coached the Heat from 2008 through last season, told the AP. ""So when I came here I wanted to stay in places I was familiar with. It had nothing to do with (the president elect)."" The Bucks, meanwhile, have not commented on the decision to avoid Trump hotels, which was first reported by ESPN's Marc Stein and Zach Lowe.   ['The message was loud and clear': In NBA and NFL, a struggle to accept Trump's election]   In contrast, several NBA personalities have come out strongly against the election of Trump, which they view as hazardous to the country. Among those critics are Pistons Coach Stan Van Gundy, Warriors Coach Steve Kerr and Spurs Coach Gregg Popovich, who offered some of the most scathing remarks. ""I'm just sick to my stomach,"" he said. ""Not basically because the Republicans won or anything, but the disgusting tenor and tone and all of the comments that have been xenophobic, homophobic, racist, misogynistic. ... My final conclusion is, my big fear is -- we are Rome."""
3	https://www.washingtonpost.com/news/monkey-cage/wp/2016/11/18/nancy-pelosi-will-probably-beat-tim-ryan-but-that-doesnt-mean-her-job-is-secure/	Nancy Pelosi will probably beat Tim Ryan. But that doesn’t mean her job is secure.	   House Minority Leader Nancy Pelosi (Jim Lo Scalzo/European Pressphoto Agency)  Ohio Rep. Tim Ryan announced yesterday that he would challenge Nancy Pelosi as House minority leader. This was not entirely surprising: Many had speculated that Ryan would run after elections to the party's top leadership posts were unexpectedly delayed. But does Ryan have a chance at winning? History suggests that his odds of success are low. Contested elections against incumbent party leaders are seldom successful. Of the 23 that have taken place since 1960, only six succeeded. (Five were in the GOP, which has historically been more prone to revolt.) No top House party leader has been ousted in a contested election in over five decades.   [Rep. Tim Ryan launches long-shot challenge to Pelosi as Democrats struggle with postelection strategy]   The high failure rate of these revolts makes intuitive sense. Incumbent leaders tend to have strong ties to their colleagues, cultivated over many years through personal favors and party service. Furthermore, there is always the danger of retaliation: Even though ballots in leadership elections are secret, vengeful incumbents are usually quite skilled at figuring out who has voted against them. And Pelosi is reputed to lead with a strong hand. Another way of estimating Ryan's chances is to look at factors that predict vote choice in leadership elections. Our research has identified several key factors, including whether members are from the same state as a candidate and whether they have served on the same committees as the candidates, as well as the candidates' gender, ideology and campaign contributions to colleagues. These factors suggest that Ryan is at a distinct disadvantage. Ryan does serve on two major committees (Appropriations and Budget) with 26 other returning Democrats, a potentially rich reservoir of votes for the Ohioan. But nearly half of those Democrats are women, a key base of support for Pelosi, and Pelosi still has important ties to Appropriations, a committee on which she served prior to joining leadership. In addition, Pelosi can probably count of the votes of most, if not all, of the 37 Democrats from California, while Ryan is one of only four Democratic lawmakers who represent Ohio. Ideologically, Ryan is slightly more centrist than Pelosi (as measured by alpha-NOMINATE scores), which puts him at a disadvantage in the liberal-leaning caucus. In the last Congress, 97 Democrats were further to the left of Pelosi -- and presumably more willing to support her over Ryan -- while only 70 Democrats were further to Ryan's right. Finally, Pelosi has been a far more generous contributor than Ryan. The most recent data from the Center for Responsive Politics show that, in the 2015-16 election cycle, Pelosi's leadership PAC gave over $200,000 to 26 returning Democrats.  By contrast, Ryan's leadership PAC gave less than $5,000 to four Democrats who will serve in the 115th Congress. Although Pelosi is the prohibitive favorite, her victory is not guaranteed. Ryan may benefit from other factors.  For instance, we have found that seniority sometimes influences vote choice in leadership elections, and more junior Democrats (of which there are a growing number) may prefer Ryan over Pelosi. In addition, legislators who only narrowly won reelection may also be more inclined to support a change in party leadership, given the unexpectedly poor electoral performance of Democrats. Such was the case when Gerald Ford toppled Republican leader Charlie Halleck after the GOP's disappointing showing in the 1964 elections. More importantly, even if Pelosi wins, Ryan's challenge could portend bigger problems for Pelosi and her fellow leaders in the future. Contested leadership elections can both reveal and widen cracks in support for the incumbent leader. For instance, in 1969 nearly a quarter of House Democrats voted for Morris Udall in his failed challenge against incumbent speaker John McCormack. A weakened McCormack announced his retirement from Congress a year later. In short, if Ryan fails to defeat Pelosi but still wins a sizable number of votes, it could be an omen that the minority leader's days in leadership are numbered. Matthew Green is an associate professor of politics at Catholic University.  Douglas Harris is a professor of political science at the Loyola University Maryland.  They are writing a book about party leadership elections in the U.S. House of Representatives.
4	https://www.washingtonpost.com/news/dc-sports-bog/wp/2016/11/18/chris-cooley-sort-of-nailed-his-presidential-election-prediction/	Chris Cooley sort of nailed his presidential election prediction	"   Donald Trump marks a win that one sports-radio host saw coming. (Chip Somodevilla/Getty Images)  I'm often accused of running way too many items about both Chris Cooley and politics. This is an accurate complaint. Anyhow, here's another item featuring both Chris Cooley and politics. Sorry, this is just too good. As America's pundit class continues to grapple with its faulty assumption that Hillary Clinton would win the presidential election, here's one pundit who doesn't have to grapple with anything: former Redskins tight end and current ESPN 980 host Chris Cooley. On the day before the election -- when Clinton remained a heavy betting favorite and most political experts saw a favorable path toward an Electoral College triumph -- Cooley made an out-of-left-field prediction on his morning radio show: that Trump would win comfortably.   [How covering the Redskins name debate prepared me for Donald Trump's win]   ""I think a lot of the blue states are going to be way more competitive [than predicted], and my you heard it here first on the election is that this is a landslide,"" he said. ""This isn't even going to be that close."" Come again? ""It's not necessarily because I'm addressing my political agenda, because I'm not,"" Cooley said. ""I'm not a party guy. I'm a non-partisan independent, I'm-gonna-vote-at-the-last-minute type of guy. But my thought in talking to lots of people, spending lots of time listening to radio [is that Trump] will win in a massive landslide."" I'm not sure whether Trump's win counts as a massive landslide, although the Electoral College margin isn't narrow. And Cooley's argument may not have been perfect: He maintained that the final polls would overstate Clinton's support because of so-called shy Trump voters being embarrassed to say who they supported. In fact, the final national polls seem to have been fairly accurate, although the state polls in places such as Wisconsin and Michigan were not.   [Reminder: Metro won't run late after the Redskins' 'Sunday Night Football' game]   Still, Cooley said the election would ""come down to Pennsylavania, North Carolina, Ohio, Florida ... states that could really swing this thing, that Democrats have won the last few years."" He said that Michigan ""is a toss-up state, 50-50."" He predicted that Virginia would be closer than people thought. And he again argued ""that it isn't even close, because I think the vast majority of the middle class in America will probably vote for Donald Trump; they just won't say they're going to."" Not saying it was a perfect prediction, and not saying Cooley should leave his day job. Just saying, you could find plenty of less accurate predictions about this election."
