	Link	Title	Text
5	https://www.washingtonpost.com/news/post-nation/wp/2016/11/16/anti-trump-demonstrators-say-nationwide-protests-are-just-a-taste-of-things-to-come/	Anti-Trump demonstrators say nationwide protests are ‘just a taste of things to come’	"      Nationwide protests have gripped many cities for days following the presidential election as thousands march against Donald Trump's victory. Trump tweeted to condemn ""professional protesters, incited by the media."" (Jenny Starrs/The Washington Post)   They're angry. They're afraid. They're upset that Donald Trump is going to be their next president. But many of the protesters who took to the streets in cities across the country over the past week didn't cast a ballot for the candidate who could have beaten him. Instead of voting for Hillary Clinton, the Democratic nominee, dozens of protesters in cities from Philadelphia to Portland, Ore., said in interviews this week that they had cast ballots for Green Party candidate Jill Stein, wrote in Sen. Bernie Sanders or, in some cases, failed to vote at all. The NBC affiliate in Portland found that of more than 100 protesters arrested there last week, more than half did not vote in the state. (Clinton still won Oregon, along with most of the other states where the biggest protests have erupted.) So rather than protesting Clinton's loss, people have cited more varied reasons for joining the protests. In addition to voicing opposition to Trump, they say they are expressing anger with the entire political system and their desire to force dramatic change on a host of social and economic fronts. ""The protesting Trump has to do with the emotion that we're all feeling,"" said Ashley Ember, 27, who said she wrote Sanders on her ballot in Philadelphia. If Clinton had won, Ember said, she would have protested that, too.    Protesters in Washington on Tuesday. (Pete Marovich/Bloomberg)  A roiling movement across the country Since Election Day, thousands of people have taken to the streets nationwide. Demonstrations surged in the days after Trump's election, though they seem now to be ebbing. Police say the demonstrations have been largely peaceful, though there have been outbursts of violence in Portland, Oakland and Indianapolis. The protesters have earned the ire of Trump and his surrogates, who have insulted them on television and social media, calling them paid professionals ""incited by the media,"" jobless ""crybabies,"" people with mental disorders and ""goons."" But a week after Trump's unexpected victory, protests that appeared at first as a denunciation of the president-elect have largely given way to more diffuse expressions of frustration among America's left.   ['It's now or never': How anti-Trump protests spread across the U.S.]   A new group calling itself Portland's Resistance published 22 demands ranging from ""clean air and water"" and ""safe streets"" to halting the construction of a local Nestle factory. In Philadelphia, a group called the Socialist Alternative convened more than 100 people for a Monday night meeting on the perils of capitalism and climate change. And in Atlanta and several other cities, anti-Trump marches shifted gears this week into protests focused on the Dakota Access oil pipeline. ""People are there for all different reasons --[there are] signs saying, 'Not my president,' but also 'Viva La Raza,' 'Black Lives Matter,' hella queer folks,"" said Debbie Southorn, a Chicago activist who joined an anti-Trump protest on a whim and wouldn't say who she voted for. ""It's really encouraging,"" said Southorn, 27. ""Like, Whoa, we all see each other right now. We see our different struggles are linked up and connected.""   [D.C. students walk out of class to protest Trump]   Most of the protesters interviewed were in their 20s and appeared to gravitate toward far left politics. In Portland, roughly half of those arrested were 25 or younger. Here are some of their stories: Gary Thomas, 24, Philadelphia Gary Thomas recently lost his job as a janitor in Philadelphia. On Election Day, he said he cast his vote for Stein, though the Green Party candidate was polling in the single digits and was given little chance of victory. Thomas, who is gay and African American, said he could not bring himself to vote for Clinton. ""She didn't represent me as a person,"" he said. ""She didn't connect with me. Bernie Sanders did. I felt like he was speaking from his heart, and for the first time, I felt connected to politics."" The day after Trump's victory, Thomas took to the streets with a sign reading, ""F-- Trump."" And on Monday night, he listened as Philadelphia area socialists talked about the need for a vibrant American third party, and an upcoming march to demand a higher minimum wage.      Anti-Trump demonstrations in Philadelphia mark a third night of protest across the country against the president-elect. (Reuters)   Lamon Reccord, 17, Chicago Lamon Reccord was too young to vote in this year's election, but that didn't stop him from protesting. Reccord, who is black and grew up on Chicago's South Side, has been involved in voter registration drives and political activism since he was in middle school. If he could have voted, he said he probably would have chosen Stein, who he said he's ""more sold on."" But Reccord said he would still rather see Clinton in office than Trump, a man who, Reccord said, ""promotes racism."" Last Friday, Reccord rallied his friends on Facebook, calling on them to meet outside Chicago's Trump Tower. He did the same on Monday. ""The end goal is to get Donald Trump out of office. To make sure he officially doesn't become the president of the United States of America,"" Reccord said. ""We do not need a president who promotes racism, who inappropriately touches women. And trying to send 3 million illegal immigrants back home, I also consider racist."" Reccord said he expects Trump to push forward with the radical policy shifts he promised on the campaign trail. ""Trump unleashing more racism will impact me as an activist and an organizer, but it is only going to make me more motivated to fight,"" he said.    A demonstration in Atlanta on Friday. (David Goldman/AP)  Dianne Mathowetz, 70, Atlanta Dianne Mathowetz, a retired autoworker in Atlanta, also voted for Stein. She joined an anti-Trump protest in New York last week, but felt more energized at a demonstration Monday back home in Atlanta, where about 50 people had gathered to protest the Dakota Access pipeline, a cause that Mathowetz is passionate about. ""I think the Trump election and [Native American-led protests against the pipeline at] Standing Rock has just galvanized people who are in different kinds of very important issues to come together,"" she said. The crowd beside her included organizers for higher wages, Palestine solidarity activists, immigration reform advocates, antiwar activists and protesters of the death penalty.   ['Not my president': Thousands protest Trump in rallies across the U.S.]   Mitchell Davis, 28, Dallas Mitchell Davis, a collections agent for Wells Fargo, was among the many protesters who said they did vote for Clinton. Davis said he generally identifies as a Republican but that he voted for Clinton because he strongly opposes Trump. Speaking at a protest Monday, Davis said he viewed the demonstrations as part of a larger nationwide response to a historically unpopular new leader. He could imagine a ""tipping point,"" he said, in which the protests might lead to Trump's impeachment or resignation. Davis said he is already making plans to travel to D.C. to protest on Inauguration Day.    The protests in Portland, which police say turned into a riot last week. (Cole Howard/Reuters)  Rick Hofsheier, 43, Portland Rick Hofsheier, an independent voter, also cast a ballot for Clinton, though he said he wished that Sanders had been on the ballot instead. The stay-at-home dad was among 71 people arrested during protests in Portland Saturday night; laughing, Hofsheier said he thinks he was arrested because he got too close to the riot police. Hofsheier had only been at the protest for about half an hour, he said, taking time out from his child care duties. His participation was important, he said, because he believes the nation must send a message to Trump that there's ""a good deal of America who doesn't support [his] racist, misogynist [statements]."" ""There's just a vast group of people that not only oppose it, but vehemently oppose it,"" Hofsheier said, adding that he, too plans to protest on Inauguration Day.   [Kellyanne Conway: It's up to Clinton, Obama to calm anti-Trump protesters]   James Mattox, 27, Portland James Mattox was also arrested in Portland last week. He said he cast his vote for Stein, and would have been equally angry if Clinton won. ""No matter who won, I was going to do something,"" said Mattox, a community college student with a dyed red Mohawk. ""I've been out protesting all summer about many different things, honestly."" Mattox said he did not believe the protests would somehow prevent Trump from taking office. ""But I think it's important for people to voice their opinions about him being president because he's said some really terrible things and people are afraid.""      Police in Portland, Ore., said that protests against President-elect Donald Trump had turned into ""a riot,"" on Nov. 10, with some smashing windows and lighting fires in the streets. (Jenny Starrs/The Washington Post)   Madrid St. Angelo, 51, Chicago Madrid St. Angelo was among a different group of protesters, people who said they headed out simply to be with others who shared their despair. ""I could stay home and become depressed and feel hopeless,"" said St. Angelo, an actor and HIV activist who lives in Chicago's Humboldt Park neighborhood. Instead, he attended multiple protest events over the weekend. ""I honestly don't know what else to do other than be a voice and a presence and look for ways to get involved.""   Trump Protest in Miami, FL was peaceful, aside from someone on a balcony throwing glass bottles at the protesters and hitting a little girl. pic.twitter.com/xiZYIqGaeB -- Hunter Wright (@hunterinmiami) November 13, 2016   Susan Ranft, 57, Chicago Susan Ranft, a high school Spanish teacher in suburban Chicago, said her protest wasn't about trying to ""overthrow the government."" ""I understand he is our president,"" Ranft said. ""I am trying to show people there are some really valid concerns. We have to stay on top of him because there is nothing reining him in now."" Ranft said only two things could compel her to stop protesting. First, she said, she wants to see Trump rescind his appointment of former Breitbart News chief Stephen K. Bannon, who called his site the voice of the alt-right, to a top White House position. The other thing? If Trump ""accepted climate change as reality.""   Group now hearing back toward downtown weaving through cops. pic.twitter.com/iQBvPb3FZ0 -- James Queally (@JamesQueallyLAT) November 12, 2016   What comes next Even as the larger protests appeared to fizzle Wednesday, activists said they would be back in force on Inauguration Day in January. Already, some groups have begun planning marches and rallies in Washington, along with calls to occupy the Mall. ""We want the government to know that they can no longer ignore us,"" said Thomas, the demonstrator in Philadelphia. Under a Trump presidency, he said, ""this is just a taste of things to come."" Julie Tate in Washington, Leah Sottile in Portland, Mark Guarino and Kari Lydersen in Chicago, Camille Pendley in Atlanta, Bobby Allyn in Philadelphia and Joe Tone in Dallas contributed to this report. Correction: An earlier version of this story misspelled Debbie Southorn's name. The story has been corrected.  Further reading: Demonstrators square off against opponents and police as Anti-Trump protests spread"
6	https://www.washingtonpost.com/news/the-fix/wp/2015/12/08/meet-frank-gaffney-the-anti-muslim-gadfly-who-produced-donald-trumps-anti-muslim-poll/	Meet Frank Gaffney, the anti-Muslim gadfly reportedly advising Donald Trump’s transition team	"   Frank Gaffney. (Center for Security Policy)  The Wall Street Journal reported Tuesday that amid the Trump transition team shuffle, Frank Gaffney had been brought in to help advise on security issues. (On Wednesday, the Trump team denied Gaffney was advising the transition, but would not confirm or deny whether he'd spoken with Trump this week.) Last year, we took a closer look at the former Reagan official's controversial career:  In June 2009, shortly after President Obama wrapped up his visits to Saudi Arabia and Egypt, the Washington Times ran an opinion piece suggesting that the newly inaugurated president might be the first to be a Muslim. It starts slowly, saying that Obama might be the ""first Muslim president"" in the same sense that Bill Clinton was once dubbed the ""first black president"" -- which is to say that he's not Muslim, he's just sympathetic to the community. But a few paragraphs later, that conceit evaporates. ""With Mr. Obama's unbelievably ballyhooed address in Cairo Thursday to what he calls 'the Muslim world',"" columnist Frank Gaffney wrote, ""there is mounting evidence that the president not only identifies with Muslims, but actually may still be one himself."" That evidence? Obama referred to the ""Holy Koran."" He said he knew about Islam. And he used the phrase ""peace be upon them"" when mentioning Moses, Jesus and Muhammad. Obama, Gaffney wrote, was engaged in ""the most consequential bait-and-switch since Adolf Hitler duped Neville Chamberlain over Czechoslovakia at Munich.""    This was not the beginning of Gaffney's push to raise questions about the role of Muslims in the United States, but it marked a new phase for him and his organization, the Center for Security Policy. The group hit a new high this week, when its highly questionable survey from June became the centerpiece of Donald Trump's proposal this week to ban any Muslims from entering the country. CNN's Chris Cuomo, confronting Trump about the proposal on Tuesday, told Trump that CNN ""wouldn't even put that poll on the air. It's a hack organization with a guy who was dismissed from the conservative circles for conspiracy theories. You know that."" (Trump disagreed.) Gaffney wasn't always an anti-Muslim conspiracist and gadfly. After years of service in Washington, including staffing senators from both sides of the aisle, he went to work for Ronald Reagan's Defense Department. During Reagan's second term, Gaffney was named acting assistant secretary of defense after his boss, Richard Perle, stepped down. Gaffney didn't get the job, though, and when Frank Carlucci became secretary in November 1987, Gaffney was ""forced out,"" as The Washington Post reported at the time. ""By midnight Friday,"" Sidney Blumenthal (of all people) wrote for the paper, ""Gaffney's belongings were boxed and he was gone. On the spot, Gaffney called a press conference to express his 'worries' about the Reagan administration's eagerness for an arms control agreement."" Out of government service, he founded the Center for Security Policy as a think tank on foreign policy issues. It provided Gaffney with a prominent platform to weigh in on political topics. Within the past decade, though, he has made headlines mostly for questionable and outrageous comments such as his suggestion about Obama. During the 2008 election, Gaffney wrote about the ""jihadist vote"" in another Washington Times piece, suggesting that a large number of Muslims were backing Obama's candidacy financially and with votes. Oh, and that Obama wasn't born in America. (He reiterated that argument before the 2012 election.)    Once Obama was in office, Gaffney was one of the main drivers of the idea that there was a deep-rooted Muslim infiltration of the government and that Muslims wanted to create an alternative system of law in the United States. Gaffney opposed the ""Ground Zero mosque,"" a proposed Muslim center that was to be built near Ground Zero in Manhattan. After he opposed a Muslim community center in Tennessee, the largest paper in that state included Gaffney in a report linking anti-Muslim rhetoric to big paychecks. His insistence that a group called the Muslim Brotherhood had worked its way into the American political sphere (including in the person of top Hillary Clinton aide Huma Abedin) eventually meant accusing prominent conservative Grover Norquist of ties to Islamic infiltrators. Gaffney wrote an entire book -- published by the Center for Security Policy -- accusing Norquist of links to that group and others, which in 2011 ended up getting Gaffney banned from the high-profile annual Conservative Political Action Conference. In another famous incident, Gaffney suggested in 2010 that a logo for a missile defense group incorporated the Obama campaign logo and an Islamic crescent. It didn't. The Daily Beast credited Gaffney in 2012 with driving the state and federal push for anti-sharia laws. When New Jersey Gov. Chris Christie defended his appointment of a Muslim to the state judiciary against charges that the governor was abetting the implementation of sharia, Gaffney suggested on a radio show that Christie might be turning a blind eye to treason.   Learn about #MB covert plan to impose #Sharia here in the US. http://t.co/c7qyLpVc4J @securefreedom #CounterJihad pic.twitter.com/7R8wwLDLAg -- Frank Gaffney (@frankgaffney) September 22, 2015   The conspiracies aren't all Obama-centric. On MSNBC's ""Hardball"" in March 2009, Gaffney argued that Saddam Hussein was behind the Oklahoma City bombing. Earlier this year, Gaffney hosted a white supremacist on his radio show to discuss Muslim immigration and later said he didn't know about his guest's full views. (He did, however, welcome Jared Taylor as ""the author of six books, including 'White Identity.'"") The Southern Poverty Law Center, which tracks hate speech, has labeled Gaffney an ""extremist."" On Monday, we evaluated the poll that Gaffney's Center for Security Policy had put together, assessing the attitudes of American Muslims toward sharia law and violence toward the United States. The poll itself has serious methodological problems, but the organization and the man who created and paid for that poll should inspire some skepticism of the results, as well.      Republican presidential candidate Donald Trump wants to stop all Muslims from coming into the United States. Here's what he has said about Muslims since 2011. (Sarah Parnass/The Washington Post)   "
7	https://www.washingtonpost.com/national/gop-governors-gather-amid-push-for-disruptive-change/2016/11/15/715fe4b4-ab39-11e6-8f19-21a1c65d2043_story.html	GOP governors gather amid push for ‘disruptive change’	" ORLANDO, Fla. -- The country's Republican governors are meeting in battleground Florida with what many of them see as an opportunity for ""disruptive"" changes to wrest power from Washington and rework health care following the election of Donald Trump. Wisconsin's Scott Walker, the incoming chairman of the Republican Governors Association, said Tuesday on MSNBC that Trump elevates ""the possibilities in terms of what we can do to take power out of Washington and send it back to the states"" and more importantly ""back to the people."" Trump perhaps owes no governor more than Walker, a onetime rival of the GOP presidential nominee who ended up endorsing the billionaire. Walker's state had been thought to be a Democratic firewall, but for the first time since 1984, Wisconsin voted for a Republican president and helped Trump win the White House. Walker said the federal government's focus should be on ""fixing and maintaining our existing infrastructure"" not ""grandiose"" high speed rail lines, for example. According to the Pew Research Center poll after the election, people agree that fixing the nation's roads, bridges and other infrastructure should be a postelection priority. The survey of Clinton and Trump voters also believe drug addiction is another big problem. Florida Gov. Rick Scott called on his fellow Republicans to help Trump bring ""disruptive change"" to Washington. For Scott, that means a complete repeal of President Barack Obama's health care overhaul, a point echoed by Vice President-elect Mike Pence, who met privately with many of the GOP governors on Monday evening. Scott has been vague about what should be done about the 20 million Americans who got health insurance through the overhaul. During an interview Tuesday, he also did not offer opinions on what should happen in states that expanded Medicaid coverage as part of the overhaul, saying each state would have to make that decision on their own. Scott backed Trump after he won the Florida primary in March and eventually headed up a super PAC that ran ads praising Trump and criticizing Clinton. He said that Trump's victory will give him a ""partner"" who can help on everything from health care to paying for repairs to the aging dike that holds up Lake Okeechobee.  ""I'm very optimistic,"" Scott said. ""I think he's going to be good for Florida and for the country."" Scott said he has already talked to Trump three times since the election. While Scott was a firm backer of Trump before the election, other governors expected to attend this week's conference had differing opinions over Trump. New Mexico Gov. Susana Martinez, the nation's only Latina governor, refused to endorse Trump but did congratulate him after he won. ___ AP writer Laurie Kellman contributed to this report. Copyright 2016 The Associated Press. All rights reserved. This material may not be published, broadcast, rewritten or redistributed. "
8	https://www.washingtonpost.com/local/dc-politics/dc-council-debates-downsizing-stand-along-inaugural-parade-route/2016/11/15/9c09966e-ab5d-11e6-977a-1030f822fc35_story.html	D.C. Council debates downsizing stand along inaugural parade route	" Some members of the D.C. Council are trying to curtail the city's traditional spending on the presidential inauguration this January, when Republican Donald Trump will assume office in a city that voted overwhelmingly against him. A proposal first floated by council member Elissa Silverman (I-At Large) would eliminate or drastically reduce the District's funding for a stand built on the steps of the John A. Wilson Building on Pennsylvania Avenue NW to view the inaugural parade. Silverman said her suggestion to scale back the city's inauguration spending was at least partially motivated by nonpartisan concern over wasteful spending. In 2013, the glass-enclosed stand was carpeted, heated and included flat-screen televisions. About 2,000 people -- including elected officials, their staffs and constituents -- used the stand during the course of the day, and it cost about $342,000. But Silverman said she also wanted to trigger a discussion among the District's elected officials about their stance toward the upset presidential victor who will soon be their neighbor on Pennsylvania Avenue. ""President-elect Trump has stated positions that are hostile to our residents,"" Silverman said at a breakfast meeting of the D.C. Council on Tuesday, expressing specific concern about Trump's vows to shrink the federal regulatory agencies that employ many in the District. ""We are a unique jurisdiction. What he does in terms of the federal government will impact us."" The stand would be a small expense when considered against the $18.2 million the District spent for President Obama's second inaugural parade, including the cost of security and additional stands for the media and the inauguration ceremony. Roughly half of that money was ultimately reimbursed by the federal government, according to city budget officials. However, the move could stir ill will with Trump, who has at times been acutely sensitive to snubs by the political class against which he railed throughout his campaign. Silverman said she was still coming to terms with the result of the election, which many predicted would be won by Democratic nominee Hillary Clinton.  ""I still think this is like an episode of 'Dallas.' Bobby's going to come out of the shower,"" Silverman said. (Bobby Ewing, a character in the popular 1980s soap opera ""Dallas,"" reappeared in the shower on the series a year after the show's writers killed him off. His death was explained as a dream of his ex-wife's.) Silverman's proposal was met with mixed reaction from other council members, some of whom said it would send the wrong signal to depart from past practices. ""I think that it's very important that we as the government of the nation's capital put our best foot forward on Inauguration Day,"" council member Brandon T. Todd (D-Ward 4) said. ""Donald Trump has won. The people have spoken."" ""We would not have the conversation if the Democratic nominee won,"" said Todd, a Clinton supporter.  Council member Charles Allen (D-Ward 6) said that he would like to reduce the costs to taxpayers of the stand outside city hall but that it was important to separate the action from politics. ""It's not in the city's interest to just kind of give the middle finger to the president-elect,"" Allen said. ""My objection is to spending almost a half-million dollars on a viewing stand that's torn down after one day."" "
