	Link	Title	Text
0	https://www.washingtonpost.com/business/early-sign-ups-for-health-care-law-are-steady-but-no-surge/2016/11/16/e7909986-ac0f-11e6-8f19-21a1c65d2043_story.html	Early sign-ups for health care law are steady, but no surge	" WASHINGTON -- A little more than 1 million people renewed health coverage or signed up for the first time through HealthCare.gov around the start of open enrollment, which coincided with a GOP election sweep likely to scramble President Barack Obama's signature law. The figures released Wednesday by the Obama administration represent steady sign-ups but no enrollment surge so far. Still, officials said they have seen an outpouring from consumers wanting to make sure the government knows how important the endangered program has become in their lives.  ""Health insurance is linked to independence and economic freedom,"" said Andy Slavitt, head of the Centers for Medicare and Medicaid Services, which runs the nation's major coverage programs. Overall, the new number is fairly comparable to early sign-ups last year, but the share of new customers is down. They accounted for 24 percent of the total so far this year, compared with 34 percent in the first two weeks of last year's open enrollment season. Nearly 1.1 million people had enrolled last year by about the same time. The 2017 early sign-up figures are for Nov. 1-12, while the closest numbers from last year cover a full two weeks, which may explain some of the shortfall. The administration said 53,000 more customers signed up in the first 12 days this year than in the same period last year. Still, several other statistics were also down, including call center volume, the number of HealthCare.gov users, and consumers window-shopping on the website. Slavitt said the numbers are line with his expectations, and he noted that outreach to consumers didn't start until after Election Day. The White House is hoping that robust numbers will translate into a strong closing argument for keeping many of the law's essential parts. Even before the election that put Republicans in charge, the health care law was facing stiff headwinds in 2017. The remaining uninsured are harder to reach and persuade. Premiums for a standard plan are going up an average of 25 percent in the 39 states served by HealthCare.gov, and insurer exits have left about one-third of U.S. counties with only one carrier. President-elect Donald Trump and the Republican-led Congress are pledging to repeal and replace the 2010 Affordable Care Act, although it has reduced the nation's uninsured rate to a historic low of about 9 percent. It's shaping up as the most volatile open enrollment season since HealthCare.gov went live in 2013 and the computer system didn't work. Health and Human Services Secretary Sylvia Burwell has set a goal of signing up 13.8 million people through the federal HealthCare.gov and state-run insurance markets, which offer taxpayer-subsidized private coverage to people without access to health care through their jobs. That would be an increase of about 1 million from the last open enrollment, so attracting new people is crucial. Even though premiums are going up significantly, administration officials say most people will be cushioned from the impact because they receive subsidies designed to rise as their insurance costs increase. But an estimated 5 million to 9 million people who buy individual policies outside the law's markets face the full brunt of increases. During the campaign, Trump said the health overhaul was a ""disaster,"" but now he is signaling that he doesn't want to take away coverage from the millions of people who have benefited. Independent studies estimated that Trump's campaign plan would have caused 18 million to 20 million people to lose health insurance. Republicans in Congress are puzzling over how to follow through on their promise to repeal the health care law while at the same time maintaining popular provisions, including protections for people with medical problems and allowing young adults to stay on parental coverage until age 26. Stripping away coverage could trigger a political backlash. Open enrollment season for 2017 ends Jan. 31, but consumers who want their coverage to take effect at the start of the year have to act by Dec. 15. That's traditionally the biggest day for HealthCare.gov. Copyright 2016 The Associated Press. All rights reserved. This material may not be published, broadcast, rewritten or redistributed. "
1	https://www.washingtonpost.com/lifestyle/style/to-understand-the-trump-presidency-we-must-decipher-ivanka/2016/11/16/55f047ce-ab60-11e6-8b45-f8e493f06fcd_story.html	To understand the Trump presidency, we must decipher Ivanka	"       President-elect Donald Trump's oldest daughter, Ivanka, was often by his side on the campaign trail and could play an influential role in his administration. Here's what you might not already know about her. (Sarah Parnass/The Washington Post)    We might as well start with Ivanka, as we plumb the present and future of Trumpism, the Trump Cabinet, the Trump family, the Trump brand. Because -- Ivanka. The most personable, palatable, fashionable, Trump-lite member of the future first family. The most inscrutable, yet most weirdly relatable. Some people think she'll be the real first lady, with her telegenic personality and her copacetic pet causes, and her lifestyle website, already dedicated to being a gracious host and professional woman.  Last week, her father formally named her to his transition team; early this week, rumors swirled -- which Donald Trump later denied -- that the president-elect had requested top-secret security clearance for Ivanka and her brothers. On Monday evening, CNN's Dana Bash went on air and read out loud an incredulous text message from a friend: ""What clandestine operation is Ivanka going to run?""  All the operations, Dana. We can't shake the feeling that Ivanka is the key to this all.  What is going on here? is a question everyone is asking about everything happening at every moment in Washington right now, and possibly until the end of time. On Tuesday, major news outlets reported that the transition team was a mess; on Wednesday, Donald Trump tweeted that the transition ""is going so smoothly,"" and we are reduced to scouring Ivanka Trump's Instagram feed to figure out the future of the country. Here is a video of Ivanka's daughter singing a song about pineapples, posted at the same time that a former national security official warned the world to ""stay away"" from the ""arrogant, screaming"" transition team.  Here is Ivanka, 35, in a Snapchat-filtered floral headdress. Here is a current article on her pastel, aspirational lifestyle website, headlined ""5 tips for mixing work and family."" (Family dinner agenda: appoint new attorney general; secretary of state?)  Ivanka sat for a ""60 Minutes"" interview with the rest of her family this week and folded her hands primly across her lap, one wrist bedecked with a heavy gold bracelet. ""I'm going to be a daughter,"" she said firmly when Lesley Stahl asked whether she would be seeking a job in the Trump administration.     ""60 Minutes"" correspondent Lesley Stahl, left, interviews President-elect Donald Trump and his family at his home: wife Melania, daughter Ivanka, seated right, daughter Tiffany, seated second row from left, and sons Donald Jr. and Eric. (Chris Albert/AP)   The next morning, a sales representative from her jewelry line sent out a notice to journalists that the aforementioned gold bangle was Ivanka's ""favorite."" It could be purchased for $10,800 through the Ivanka Trump Fine Jewelry website. Daughter-slash-businesswoman? Businesswoman-slash-presidential adviser?  What does it all mean, Ivanka? Journalists debated whether the bracelet event was an outright conflict of interest or a slightly murky but also savvy move. The mystery of Ivanka is that she always does seem to be running some kind of clandestine mission -- blowing some kind of dog whistle or bleating some kind of Morse code, or becoming the attractive vessel into which both parties poured their own hopes and dreams. ""Like many of my fellow millennials, I do not consider myself categorically Republican or Democrat,"" she said while introducing her father at the Republican National Convention in July. ""More than party affiliation, I vote based on what I believe is right, for my family and for my country.      Republican presidential nominee Donald Trump's daughter Ivanka said her father is a ""fighter"" will fight for America. (The Washington Post)    Could Ivanka be reasoned with? wondered the commenters who viewed her father as too unpredictable and were seeking reassurance. Was Ivanka the one secretly running the whole show?  When there are no answers, it's easier to ask questions and adapt wild conspiracy theories as the answers.  ""Are Ivanka and Jared Kushner concocting a House of Cards-style game of their own?"" Vanity Fair asked this week, in an article about the hypothetical machinations of Ivanka and her husband. They were, the essay argued, ""positioned to become the de facto first couple."" Ivanka was the one who stayed focused. She was the one who had a politician's poise, and she held her highest cards close to her vest.    President-elect Donald Trump and his daughter. Ivanka seems like the steeliest of the Trump clan, the kind of person who might bring a stiletto to a knife fight. (Carlo Allegri/Reuters)   What do we make of her? What is her endgame, when she insists that she is not a political person, while advocating for politically divisive causes, like equal wages for women and paid maternity leave? When, while working on the transition team for the highest office in the land, she is simultaneously posting videos online of her with her officemates, goofing around, doing the mannequin challenge? Ivanka: is the fairest of them all, but she also seems like the steeliest, the kind of person who might bring a stiletto to a knife fight. Ivanka: poised to fight for child-care reform, amid her own online pregnancy photos that revealed she was one of those women who looked as though she tucked a soccer ball down her size 2 dress and emerged nine months later with a baby.  Ivanka: in those other photos where -- and we realize that cameras are always catching things at weird angles and odd moments -- but those photos where the president-elect always seems to be patting around his daughter's butt. ""She does have a very nice figure,"" Trump once said of his daughter. ""I've said that if Ivanka weren't my daughter, perhaps, I would be dating her."" Oh, Ivanka. Oh God, Ivanka. Speak to us. We are listening. This entire election has been about large portions of the electorate puzzling over whether their candidate really intended to do the things he said he was going to do, trying to read the election's burned entrails for the future of the country. The country needs someone who is an expert in shadowy operations, who can report back from the inside what is really going on.  The country needs Ivanka. We've got to figure out Ivanka.            1 of 38       Full Screen Autoplay  Close                                                                                                   Skip Ad   x           Ivanka Trump: A life in the spotlight      View Photos   Ivanka Trump has become an anchor of the Trump brand, often offering a noncontroversial counterpoint to the polarizing presence of her father, Donald. Here's a look at her early life of privilege and transformation into a businesswoman.    Caption   Ivanka Trump has become an anchor of the Trump brand, often offering a noncontroversial counterpoint to the polarizing presence of her father, Donald. Here's a look at her early life of privilege and transformation into a businesswoman.   July 16, 2014 Ivanka Trump poses for a portrait in Trump Tower in Manhattan. Yana Paskova/For The Washington Post  Buy Photo          Wait 1 second to continue.   .wp-volt-gal-preroll-video{width:100%;height:100%}         "
2	https://www.washingtonpost.com/world/europe/obama-to-tour-ancient-greek-acropolis/2016/11/16/f687a1d6-abcf-11e6-8f19-21a1c65d2043_story.html	Obama urges nations not to give in to isolationist impulses	" ATHENS, Greece -- Standing in democracy's birthplace, President Barack Obama on Wednesday issued a parting plea to world leaders not to let the fear of globalization tugging at Europe and the U.S. pull them away from their core democratic values. He argued it wasn't too late for a course correction. On his last foreign trip as president, Obama has repeatedly tried to draw lessons from Donald Trump's victory in the U.S. presidential election, hoping it can serve as wake-up call in the U.S. and abroad. Conceding that many feel left behind by globalization, Obama said there was an understandable impulse toward isolationism and that if people feel their futures are at risk, ""they'll push back.""  ""People have to know that they're being heard,"" Obama said in a speech to the Greek people in Athens. But, he added, ""We can't look backward for answers. We have to look forward."" While fewer people in the U.S. are looking to Obama for direction now that his successor has been chosen and his agenda largely rebuked, Obama has retained significant clout abroad. His message Wednesday appeared aimed at other world leaders facing pressures of nationalist movements and economic anxiety, exemplified by Britain's recent vote to leave the European Union. From Greece, Obama took a short flight to Germany, which has emerged as one of the strongest voices for preserving a unified, inclusive Europe. Yet even German Chancellor Angela Merkel faces her own threat from a nationalist right-wing movement, fueled in part by anger over her generous policy toward resettling Syrian migrants pouring into Europe.  ""We cannot sever the connections that have enabled so much progress,"" Obama said. Obama's argument centered on the notion that economic inequality, while a growing problem, can be addressed without a full rejection of globalization. Rather, he said it demanded a ""course correction.""  ""In the years and decades ahead, our countries have to make sure that the benefits of an integrated global economy are more broadly shared by more people and that the negative impacts are squarely addressed."" Obama argued nations must strengthen alliances and expressed his confidence that the U.S. would remain loyal to NATO despite Trump's suggestions to the contrary during the 2016 presidential campaign. He elicited nervous chuckles as he acknowledged that he and the president-elect ""could not be more different."" But in a message of reassurance, Obama argued that democracy is bigger than any one person.  ""As long as we retain our faith in democracy, as long as we retain our faith in the people, as long as we don't waver from those central principles that ensure a lively, open debate, then our future will be ok,"" Obama said. And to listeners at home fearful about Trump, he offered a path out of the wilderness, albeit a long and winding one.  ""Any action by a president, or any result of an election, or any legislation that is proven flawed can be corrected through the process of democracy,"" Obama said. Though Obama's trip to Greece was planned before the election results were known, the White House hoped the setting would form a powerful reminder of the basic tenets of democracy: fair elections, a free press and tolerance for ethnic, religious and sexual minorities. Before his speech, Obama climbed up the Acropolis, the ancient citadel that serves as a monument to free thought and artistic expression. He strolled through the Propylaea, the complex's monumental gateway, and gazed up at the famed Parthenon temple dating to the 5th century B.C. The entire site was closed to the public for Obama's visit, which has played out amid stringent security measures. Demonstrations were banned in parts of Athens, and road and subway stations were shut down for the first official visit of a sitting U.S. president since Bill Clinton came in 1999. Obama said concepts like minority rights and equality under the law ""grew out of this rocky soil"" in a democratic project not yet complete. He said inequality, on more vivid display due to widespread technology, now posed one of the biggest threats to democratic nations, their stability and prosperity. Even in Greece, there were parallels to the deep divisions now on display in America. Greek Prime Minister Alexis Tsipras won elections last year on what critics say was a populist platform, though one on the left of the spectrum. He pushed his formerly small party to the forefront by telling Greeks weary from six years of financial crisis that he would reject austerity measures imposed in return for bailouts. But after the near-collapse of negotiations with Greece's creditors, Tsipras performed a political about-face: He signed up to a new bailout and more austerity to prevent his country being forced out of the euro. Greece's government hoped Obama would help persuade some of Greece's more reluctant creditors to grant debt relief -- a message they hoped he'd stress in Berlin -- and also pressure other European countries to share more of the burden of the migrant crisis. Appearing receptive to Greece's woes, Obama repeated his belief that debt relief should be granted. ___ Associated Press writer Elena Becatoros contributed to this report. __ Follow Josh Lederman on Twitter at http://twitter.com/joshledermanAP and Elena Becatoros on https://twitter.com/ElenaBec Copyright 2016 The Associated Press. All rights reserved. This material may not be published, broadcast, rewritten or redistributed. "
3	https://www.washingtonpost.com/lifestyle/style/carolyn-hax-stressed-mother-is-taxing-her-friendships/2016/11/13/2cb62cbe-a833-11e6-8fc0-7be8f848c492_story.html	Carolyn Hax: Stressed mother is taxing her friendships	" Carolyn Hax is on leave. This column originally ran Jan. 11, 2012.  Dear Carolyn: What is the best way to end a friendship -- to back away slowly and quietly, or to be upfront about why you are unhappy? My close friend has become the Patron Saint of Stressed Mothers over the last two years. All of the friends in our group have pitched in to help her adjust to this new lifestyle by babysitting, bringing over meals, listening patiently to all of HER problems, and politely tolerating her constant berating of her husband and mother for the slightest child-rearing offense. Before she was Stressed Mom, she was very fun, although she always had to be the center of attention, also politely tolerated because we all love her husband so much. Now her rudeness is extending to friends, with comments such as, ""Well, now you know what MY life is like,"" after seven hours of babysitting for her. Or better yet, you bring over meals and she complains that you did something wrong or she had to turn on her oven. We all realize that part of this is related to the hormonal adjustment and just being plain tired, but she recently stopped working, and we hoped things would improve. They have not. Is it time for an intervention, or should we move slowly away and then explain when she finally realizes we've had enough? Ready to Bail on a Friendship  Ready to Bail on a Friendship: Seven hours? My former new-mother self just fainted. My current incarnation is finding it hard to believe there isn't one truth-teller in your entire group. ""Actually, the thing to say to a person who just watched your child gratis for seven hours is, 'Thank you, O madly merciful one.' "" ""If there's a problem with my dinners, say so, because I'll gladly stop feeding you."" ""Perhaps you don't realize how you sound, but you are being really tough on your husband/mom lately."" ""I'm concerned about how negative you sound. Have you talked to your doctor about your mood changes since the baby?"" These are plenty solicitous and completely clear -- steel wrapped in flannel. You're still her friend (for now), so try using this formula to tell her kindly whenever she crosses a line; then wait a reasonable interval to see whether she gets this overdue message. ""Reasonable"" is in the eye of the beholder, but don't expect her to have an epiphany with the first limit you set, and if she hasn't had one by the 17th, then consider that you're patient to excess. Even if you cave on everything else, please call her on the way she treats her husband; what you describe is verbal and possibly emotional abuse, and ""politely tolerating"" is not a valid response. If she responds by tearing into you, then remember you went into this prepared to end the friendship, and calmly explain to her exactly what you think of her attitude. And if she doesn't confront you but persists in taking you for granted, then just stop offering yourself up for her use. You're the only one of your put-upon friend group signing this letter, but all of you owe it to yourselves, and to Momzerella, to stop being her coach mice. How will she ever figure out the world doesn't revolve around her when your actions tell her it does?  Write to Carolyn Hax at tellme@washpost.com. Get her column delivered to your inbox each morning at bit.ly/haxmail. "
