	Link	Title	Text
0	https://www.washingtonpost.com/national/judge-asked-to-change-mind-on-closed-dylann-roof-hearing/2016/11/17/becb7ede-aca1-11e6-8f19-21a1c65d2043_story.html	Judge doesn’t change mind on closed Dylann Roof hearing	" CHARLESTON, S.C. -- Families of nine black worshippers killed in a Charleston church got a chance Thursday to air concerns about the case to a federal judge, who reaffirmed his decision to keep defendant Dylann Roof's competency hearing next week closed to the public. Some relatives talked about how the trial delays hurt them. Others say it will be hard to deal with the proceedings in December as Christmas neared. They all asked for Monday's competency hearing to be open.  ""I really want you to consider what kind of a signal you are sending to the community,"" said Alana Jackson, granddaughter of Daniel Simmons Sr. U.S. District Judge Richard Gergel said he understood their concerns. But after also hearing from lawyers hired by The Associated Press and other media outlets, he said his mind hadn't changed. The hearing will include extensive statements made by Roof that might not be allowed at his death penalty trial. But they could find their way to jurors and taint their view of the defendant just days before jury selection is set to begin, Gergel said.  ""None of us are served by not doing this the right way and then having to do the trial all over again,"" the judge said. Only prosecutors, defense attorneys, the judge and court staff will be inside the courtroom Monday for Roof's competency hearing. Gergel promised to issue his ruling on whether Roof, 22, understands the hate crime, obstruction of religion and other charges against him and can help his attorneys in his defense over the long Thanksgiving weekend. That way, if Roof is found competent, jury selection can begin Nov. 28. And if Roof is not competent, he will immediately be sent for treatment at a mental hospital at a federal prison until he regains competency. Roof's lawyers questioned his competency earlier this month on the eve of jury selection. They have carefully ensured their reasons for wondering about his mental state have not become public, and Gergel has issued several redacted motions and rulings. Prosecutors have filed court papers saying Roof appears competent to them because he has shown proper behavior toward court personnel and been attentive at other hearings. They wanted the competency hearing open. Having the hearing open could help the defense because it could help people understand what drove the defendant to commit such a terrible act, creating sympathy, said Carl Muller, a lawyer hired by several media outlets. But Gergel said he had another, quite modern reason to close the hearing. One question posed to potential jurors on a survey asked where they got their news. Gergel said he expected about 15 percent of them to say social media. Instead, it was closer to 70 percent, making it much harder to avoid seeing coverage from the case.  ""I have said to them, 'Let's try to avoid the newspaper of TV,'"" the judge said. ""But what if it pops up on their iPhone?"" Gergel insisted he isn't trying to hide anything. Along with a written ruling, the judge said he also will release a redacted transcript of the hearing.  ""As much as we can disclose, as soon as we can disclose,"" Gergel promised. ___ Follow Jeffrey Collins on Twitter at http://twitter.com/JSCollinsAP. His work can be found at http://bigstory.ap.org/content/jeffrey-collins Copyright 2016 The Associated Press. All rights reserved. This material may not be published, broadcast, rewritten or redistributed. "
1	https://www.washingtonpost.com/world/obama-merkel-issue-joint-rebuttal-to-the-coming-era-of-donald-trump/2016/11/17/3dfbb632-ac1c-11e6-8f19-21a1c65d2043_story.html	After Trump win, Obama warns against taking democracy ‘for granted’	"  BERLIN -- President Obama and German Chancellor Angela Merkel on Thursday issued a joint defense of strong American leadership in global security, free trade and combating global warming while cautioning against cozying up to Russia, in what appeared to serve as a message to President-elect Donald Trump. Eight years after his massive rally in Berlin turned Obama into a global phenomenon, he wrapped up his final official visit to Europe on Thursday with a plaintive warning to Western democracies at a time of rising populism. Do not, he said, ""take for granted our system of government and our way of life."" He conceded things left undone -- saying it would be ""naive"" to envision a breakthrough in Syria's raging civil war before he relinquishes the White House. But, speaking to reporters beside a woman described as his closest European ally, Obama said he remained ""optimistic"" about Trump's presidency, despite having sharply criticized him during the long, bitter election campaign. Yet Obama also drew a stark picture of a world without even-handed U.S. leadership -- a world in which a divided United States would lose its way and disengage. The United States is ""the voice that insists on rules and norms governing international affairs, the voice that helps to steer the world away from war wherever possible; that's our voice more often than not,"" Obama said. ""And we're not always successful, but if that voice is absent or divided, we will live in a meaner, harsher and more troubled world.""      During a speech in Athens Nov. 16., President Obama spoke about the importance of the democratic process, even ""when you don't get the results you want."" (The Washington Post)    [Obama bids bittersweet farewell to closest partner on world stage]  Asked to weigh in on U.S. protesters turning out in cities across the nation, he said, ""I would not advise people who feel strongly or who are concerned about some of the issues that have been raised during the course of the campaign, I wouldn't advise them to be silent."" In a sign of their close ties, Obama met both Wednesday and Thursday with Merkel, a centrist leader whom observers see as heir apparent to his legacy as the leading global advocate of liberal democracy. On Friday, the pair are set to convene with a broader group of leaders, including the heads of France, Britain, Italy and Spain at a time when the continent is unsettled by the U.S. transition of power. One of the thorniest issues: Trump's overtures toward a newly belligerent Russia. Obama challenged Trump to ""stand up to Russia"" at the right times. ""My hope is he does not simply take a realpolitik approach and suggest if we just cut some deals with Russia, even if it hurts people or violates international norms or leaves smaller countries vulnerable or creates long-term problems in countries like Syria, that we just do what is convenient at the time,"" he said. Obama said he was heartened by Trump's recent recognition of the importance of the North Atlantic Treaty Organization. Merkel, for her part, said she recognized that Germany could contribute more toward security -- an apparent response to Trump's calls for allies to shoulder more of their own defense. Yet ahead of their encounter with the media, the pair also delivered what appeared to be a joint rebuttal to Trump's most populist foreign policy pledges. They never mentioned Trump by name, but called in a joint op-ed article published in the German weekly WirtschaftsWoche for more transatlantic cooperation on a range of issues including free trade, security, climate change and fighting inequity and intolerance.         1 of 10       Full Screen Autoplay  Close                                           Skip Ad   x           Here's what president-elect Donald Trump has been doing after the election      View Photos   He has been holding interviews and meeting with Congress and the president as he prepares to transition into the White House.    Caption   He has been holding interviews and meeting with Congress and the president as he prepares to transition into the White House.  Nov. 18, 2016 A motorcade vehicle transporting President-elect Donald Trump arrives at Trump National Golf Club in Bedminster, N.J. Jabin Botsford/The Washington Post  Buy Photo          Wait 1 second to continue.   .wp-volt-gal-preroll-video{width:100%;height:100%}        Merkel's Germany may have a big bridge to build to meet Trump halfway. On the campaign trail, Trump derided her open-door policy on refugees, saying it was ""ruining"" Germany. Foreign Minister Frank-Walter Steinmeier -- poised to win the German presidency next year -- has described Trump as a ""hate preacher."" And while global leaders appear to be rushing to congratulate Trump, Merkel, considered the European Union's most influential leader, is taking a cooler approach.  [Merkel congratulates/warns Trump]  She reiterated her belief Thursday that the U.S. relationship was the cornerstone of Germany's strategic future. But as she did in an earlier note to Trump, she cautioned that cooperation should be based on ""a common platform of democracy, freedom, advocacy for human rights all over the world and championing the open and liberal world order."" Obama and Merkel said Thursday that globalization and rapid advances in technology have left voters behind in both their nations, but they argued that there is no going back to ""pre-globalization"" times. They condemned the march of populism on both sides of the Atlantic, with Merkel defining it as ""people looking for simple or negative answers."" Obama also took aim at the spread of false news, a subject of increasing scrutiny in the United States and overseas.  ""There's so much active misinformation,"" Obama said, adding, ""It's packaged very well and it looks the same when you see it on a Facebook page or you turn on your television."" For Obama, Merkel is something of a political soul mate. No other world leader so closely matches Obama's ideology of tireless diplomacy with an emphasis on human rights, tolerance and equality. Sharing similar temperaments, Merkel and Obama forged a friendship that helped broker several major agreements -- including a deal to curb Iran's nuclear program and sanctions against Russia for its annexation of Crimea and intervention in eastern Ukraine. Merkel has not yet said whether she will seek reelection in national elections next year, but the RND newspaper network, citing unnamed party sources, reported Thursday that she would announce her decision Sunday. Some of her close allies have suggested she will run.   [Donald Trump's stunning flip-flop on Angela Merkel]  Describing their ties as a ""friendship,"" Obama joked that if he were German, he ""might vote"" for Merkel, whom he flatteringly described as ""tough."" When he suggested he might come back as a private citizen to attend Oktoberfest, Merkel replied, deadpan, ""Well, we have freedom of movement."" It is perhaps fitting that Obama bids farewell to Europe in Germany, the nation where his outdoor rally as a candidate in 2008 inspired millions. Although he has had ups and downs with the public here, Germans appeared to turn nostalgic during his last trip. ""Looking back, it now slowly sinks in that we fared very well with Obama,"" the Leipziger Volkszeitung newspaper said in an editorial Thursday. ""Yes, he got the Nobel Peace Prize far too early. He didn't shut Guantanamo. He couldn't pacify Syria. But still this president had an important impact on the relationship with Europe. . . . He actually practiced the 'common leadership' that his predecessors only spoke about in abstract terms.""   Nakamura reported from Washington. Stephanie Kirchner in Berlin contributed to this report.  Read more   How Obama and Merkel formed a special bond   Obama to bid farewell to closest partner on world stage   Merkel seen as key to Obama's success at G-7   Today's coverage from Post correspondents around the world   Like Washington Post World on Facebook and stay updated on foreign news  "
2	https://www.washingtonpost.com/national/higher-education/us-jews-grapple-with-election-year-eruption-of-anti-semitism/2016/11/17/81876b4e-acfd-11e6-8f19-21a1c65d2043_story.html	US Jews grapple with election-year eruption of anti-Semitism	" NEW YORK -- American Jews gathered Thursday to wrestle with how they should confront an election-year surge in anti-Semitism, a level of bias not seen in the U.S. for decades. At a national meeting of the Anti-Defamation League, the Jewish civil rights group, about 1,000 people listened to talks expressing shock at the hatred expressed during the presidential campaign and questioned what they thought was a high-level of acceptance by other Americans.  ""I'm struggling right now in this American moment,"" said Yehuda Kurtzer, president of the Shalom Hartman Institute of North America, an education and research organization, in his talk at the event. ""I wonder whether I have been -- and I think the answer is probably yes -- a little bit naive."" During this past year, anti-Semitic imagery proliferated on social media, Jewish journalists were targeted and longstanding anti-Jewish conspiracy theories got a fresh airing. Much of the bias originated with the alt-right, or alternative right, a loose group espousing a provocative and reactionary strain of conservatism. It's often associated with far right efforts to preserve ""white identity,"" oppose multiculturalism and defend ""Western values."" In addition to the online intimidation, reports of anti-Semitic vandalism and other attacks have risen. Last week, the day after the election, a Philadelphia storefront was sprayed with a swastika and the words ""Sieg Heil 2106,"" which means ""Hail Victory,"" a common Nazi chant, and the word ""Trump,"" with a swastika replacing the ""T."" These developments have stunned U.S. Jewish leaders, who in recent years had been more focused on anti-Semitism in Europe and on addressing complaints of anti-Jewish bias on college campuses amid the debate over the boycott, divestment and sanctions movement against Israeli policies toward the Palestinians. In a sign of the depth of American Jewish anxiety about anti-Semitism, ADL officials said donations to their organization increased 50-fold in the days immediately after the election and a large majority of the money came from first-time donors. Every one of their regional offices reported an uptick in calls from people wanting to donate or volunteer, the ADL said.  ""We must not be silent, we must raise our voices, we must act, and to act we must understand what we are up against,"" said Jonathan Greenblatt, chief executive officer of ADL, opening the meeting in Manhattan. As the presidential race intensified, Jews started seeing their names bracketed with a series of parentheses in harassing tweets, signaling that the person had been identified as a Jew. The image became known as the Jewish cowbell and its source was traced to neo-Nazis and white nationalists. The ADL investigated the harassment and found more than 800 journalists had suffered anti-Semitic attacks on Twitter during the election, mostly from anonymous Twitter accounts, although some belonged to white supremacists. In a common example of the reporters' experiences, Jane Eisner, editor-in-chief of the Forward, an influential Jewish newspaper that extensively covered the election, said she received an email the morning after the second presidential debate with an image of a Nazi solder pointing a gun at her head, which was Photoshopped onto a concentration camp uniform. Donald Trump's campaign came under scrutiny since much of the harassment came from accounts tied to his supporters. Trump drew direct criticism last July when he tweeted an image of Hillary Clinton's face with a six-pointed star, a pile of hundred dollar bills and the words ""most corrupt candidate ever."" The star was in the shape of the Jewish Star of David and was widely condemned as anti-Semitic. Trump's campaign said it was a sheriff's badge. Last month, Trump gave a speech in West Palm Beach, Florida, in which he accused Clinton of holding secret meetings with bankers in a conspiracy to undermine U.S. sovereignty. The ADL said that whether intentional or not, Trump had reflected a classic anti-Semitic theme of Jewish control of banks. The president-elect's daughter Ivanka, and her husband, Jared Kushner, who is now one of his top advisers, are Orthodox Jews. Kushner has defended Trump against allegations of bias. The issue erupted anew when Trump announced far-right publishing executive Stephen Bannon as his top White House Strategist. Bannon led the Breitbart website, considered by many to be the alt-right's platform that has been widely condemned as racist, sexist and anti-Semitic. Trump campaign manager Kellyanne Conway called the accusations against Bannon ""very unfair."" Some Jewish groups have defended Bannon, including the hawkish Zionist Organization of America. Bernie Marcus, a founder of The Home Depot Inc. and board member of the Republican Jewish Coalition, said in a statement that Bannon was ""a passionate Zionist and supporter of Israel."" Marcus called the condemnations of Bannon an attempt to undermine the incoming administration. Seventy-one percent of Jews voted for Hillary Clinton, according to exit polls. Greenblatt worked in the Obama administration. Still, Jonathan Sarna, a Brandeis University professor and historian of American Judaism, said it would be wrong to attribute the criticisms of Trump appointments or his supporters to partisanship. ""I don't know anybody who is looking at this in a serious way who says nothing has changed,"" in regard to the level of anti-Semitism, Sarna said.  ""American Jews assumed that anti-Semitism had largely been overcome,"" he said. ""And then all of a sudden, unexpectedly, anti-Semitism of a virulent kind came roaring back."" Copyright 2016 The Associated Press. All rights reserved. This material may not be published, broadcast, rewritten or redistributed. "
3	https://www.washingtonpost.com/business/the-latest-judge-appointed-for-possible-pipeline-hearing/2016/11/17/e4c2de8c-acf3-11e6-8f19-21a1c65d2043_story.html	The Latest: Protesters march in Bismarck a 4th straight day	" BISMARCK, N.D. -- The Latest on the Dakota Access pipeline (all times local): 2:45 p.m. Opponents of the Dakota Access oil pipeline protested in North Dakota's capital for a fourth straight day. A couple of hundred protesters marched around downtown Bismarck on Thursday, prompting police to temporarily shut down a couple of streets. Police spokesman Sgt. Mark Buschena (boo-SHEE'-nuh) says eight people were arrested, including a man who allegedly resisted arrest, spit at officers and yanked on an officer's gun holster. Six others were arrested on criminal trespass charges, and another was arrested on a California warrant. Protesters have targeted numerous sites in Bismarck and neighboring Mandan since Monday, including the state Capitol and the state-owned Bank of North Dakota. About 500 people have been arrested since August in protests against the $3.8 billion pipeline that's to carry North Dakota oil to Illinois. ___ 12:25 p.m. An administrative law judge has been appointed to oversee a potential hearing on whether the company building the $3.8 billion Dakota Access oil pipeline violated orders from North Dakota regulators. The state Public Service Commission last week proposed a fine of at least $15,000 against a subsidiary of Texas-based Energy Transfer Partners. The PSC says the company in October failed to get approval to continue with pipeline work after diverting construction around tribal artifacts found along the pipeline route. The State Historic Preservation Office concurred with the company's plan, and ETP has said it didn't do anything wrong. It can agree to a fine or request a hearing to fight one. State Office of Administrative Hearings Director Timothy Dawson says any hearing likely wouldn't be until mid-December. ___ 12:15 p.m. A North Dakota legislative committee has voted to forego formal events at the state Capitol due to security reasons involving the Dakota Access pipeline protests, including a biennial tribal address. Thursday's 10-3 vote means the Legislature will not allow presentations from the state's chief justice and Native American tribal leaders when lawmakers reconvene in January. The measure exempts the governor's State of the State address. Republican House Majority Leader Al Carlson says ongoing protests of the Dakota Access pipeline have ""significantly strained"" the state Highway Patrol, which provides security at the state Capitol. Democrats on the North Dakota Legislative Committee opposed the motion. Rolla Rep. Marvin Nelson says scrubbing the traditional tribal address is not going to ""help further relations"" those who oppose the four-state, $3.8 billion pipeline. Copyright 2016 The Associated Press. All rights reserved. This material may not be published, broadcast, rewritten or redistributed. "
4	https://www.washingtonpost.com/national/prosecution-rests-case-in-black-motorists-shooting-death/2016/11/16/8091f814-ac5b-11e6-8f19-21a1c65d2043_story.html	Witness: Officer, black man struggled before shooting	" CHARLESTON, S.C. -- Former South Carolina patrolman Michael Slager wrestled with Walter Scott on the ground and was entangled in Taser wires before shooting Scott as he fled a traffic stop, a defense witness testified Thursday. Slager, who is white, is charged with murder in the shooting death of the 50-year-old Scott, a black motorist who was unarmed when he ran from the officer in April 2015. Scott was shot five times in the back in a shooting captured on cellphone video that was shared on the internet and stunned the nation. Forensics video analyst Grant Fredericks testified that he used computers to enhance the video to stabilize it and make it clearer. Although the video shown to the jury was shaky and blurry in spots, Fredericks said it shows Scott on his side with his arm around Slager's upper body. He said Slager's left hand can be seen holding Scott's wrist and there are Taser wires tangled around Slager before the shooting. The defense contends the two men wrestled and Scott got control of the officer's stun gun before the shooting. Fredericks combined cellphone video, dashcam video and audio and police radio audio to create a timeline of the shooting. A prosecution witness on Wednesday made a similar presentation that also included aerial footage of the incident scene recorded by a drone. Fredericks testified the prosecution video was misleading because the software used over-processed the video and that some video frames were stretched, making it appear Scott was farther away from Slager than he was at the time of the shooting. Fredericks was not allowed to testify about what he thought Slager and Scott said to each other during the incident. Slager can be clearly heard on enhanced audio shouting ""Taser! Taser! Taser!"" before firing his stun gun at Scott. Other voices were not so clear. With the jury out of the courtroom, a defense attorney handed a transcription to Circuit Judge Clifton Newman who read it and said the defense interpretation of the audio included Scott cursing at the police and Slager saying ""let go of my Taser or I'm going to have to shoot you."" But Newman ruled the evidence was hearsay because a defense audio expert, not Fredericks himself, has determined what the men may have been saying. Eleven white jurors and one black juror are hearing the case. Newman, who is black, on Thursday appointed the black juror as jury foreman. The trial resumes Monday. Court adjourned early Thursday, and there is no court Friday because the judge has a scheduling conflict. Copyright 2016 The Associated Press. All rights reserved. This material may not be published, broadcast, rewritten or redistributed. "
5	https://www.washingtonpost.com/world/europe/court-rejects-us-soldiers-request-for-asylum-in-germany/2016/11/17/e6ced2c6-acc6-11e6-8f19-21a1c65d2043_story.html	Court rejects US soldier’s request for asylum in Germany	" BERLIN -- A Munich court on Thursday rejected a U.S. soldier's asylum application in Germany, arguing that he hasn't exhausted all avenues to leave the military. Army Spc. Andre Shepherd deserted from his military base in southern Germany in 2007, claiming he wanted to avoid returning to Iraq where he feared being involved in war crimes. The 39-year-old, who has permanent residency in Germany because he is married to a German woman, took his case to court after German authorities rejected the asylum bid. The Munich administrative court noted in its ruling that the Apache helicopter mechanic had repeatedly re-enlisted with the U.S. military. Shepherd's lawyer plans to appeal the verdict, Germany's dpa news agency reported. In a statement sent to The Associated Press, the U.S. Army in Europe said it was aware of the case but wasn't seeking to participate in the legal proceedings.  ""We do not, as a general policy, proactively pursue deserters,"" the statement said. ""However, should Shepherd be returned to U.S. Army custody, his case would be handled as would every other deserter returned to U.S. custody, in accordance with applicable laws and regulations and on its own merit."" Copyright 2016 The Associated Press. All rights reserved. This material may not be published, broadcast, rewritten or redistributed. "
