	Link	Title	Text
4	https://www.washingtonpost.com/blogs/plum-line/wp/2016/11/11/world-leaders-are-scrambling-to-save-the-planet-from-trump-literally/	World leaders are scrambling to save the planet from Trump. Literally.	"   (AFP photo/Saul Loeb)  THE MORNING PLUM: There is a great deal to fear about Donald Trump's presidency, but perhaps highest on the list of all is his vow to pull the United States out of the global climate accord and to scrap President Obama's efforts to limit carbon emissions here through executive action. As David Roberts explains, the election of Trump signals that the U.S. will not play a leadership role in global efforts to continue reducing carbon emissions towards a long-term goal that might plausibly avert widespread human suffering and dislocation, making such a fate more likely. That's the big picture. But the short-term granular picture is important, too. How much can Trump really do right away to realize his pledges to scrap our participation in the Paris accord and to scuttle Obama's Clean Power Plan, which is designed to reduce our own carbon emissions? A lot, unfortunately. Coral Davenport of the New York Times has a good piece explaining the nuts and bolts on both fronts. Her conclusion, delivered with deft understatement, is this: ""Pessimism appears to be warranted."" Indeed it does:  Mr. Trump cannot legally block other countries from fulfilling their Paris agreement commitments, nor can he quickly or unilaterally erase Mr. Obama's climate rules. But he can, as president, choose not to carry out the Paris plan in the United States. And he could so substantially slow or weaken the enforcement of Mr. Obama's rules that they would have little impact on reducing emissions in the United States, at least during Mr. Trump's term. That could doom the Paris agreement's goal of reducing carbon dioxide emissions enough to stave off an atmospheric warming of at least 3.6 degrees Fahrenheit, the point at which, many scientists say, the planet will be locked into an irreversible future of extreme and dangerous warming. Without the full participation of the United States, the world's second-largest greenhouse gas polluter, after China, that goal is probably unattainable, even if every other country follows through on its pledges.  Key to our abilities to meet our Paris commitments is the Clean Power Plan, which is one of the most important and consequential aspects of Obama's legacy. It employs Environmental Protection Agency rules under the Clean Air Act to direct the states to hit targets for reductions in greenhouse gas emissions from existing power plans, with the goal of reducing our overall emissions by 32 percent from 2005 levels by the year 2030.      Donald Trump will enter the White House with an environmental policy agenda opposed to that of the Obama administration and many other nations that have pledged support to the Paris climate agreement. The Washington Post's Chris Mooney breaks down what a Donald Trump presidency will mean when it comes to climate change. (Daron Taylor/The Washington Post)   Even if Trump were not able to scuttle implementation of the Clean Power Plan, it is being challenged in court by two dozen states and industry groups, and it is likely to go to the Supreme Court soon. Once Republicans confirm a fifth conservative justice to the Court -- Trump will pick one that Republicans and conservatives want, bank on it -- that will likely make the plan's legal survival less likely. Which underscores yet another way in which the consequences of Senate Republicans' refusal to act on Obama's replacement for Antonin Scalia could be dire indeed. Meanwhile, whatever happens before the court, Trump can use executive means to slow implementation of the E.P.A. rule in various ways. Now, it is possible that Trump will surprise us and ultimately decide against pulling us out of the Paris accord. As Bloomberg reports, some world leaders believe that there's still a chance he will not go through with it, because it could create massive international diplomatic complications and render the United States an outlier amid the global trend towards acceptance of a need to tackle global warming. As the world's second largest greenhouse gas emitter, that would make us a rather gigantic outlier. Regardless, representatives from many nations are currently gathered in Morocco for a conference, where they are trying to figure out how to lock in commitments to the accord. The potentially disastrous implications of Trump's victory for the deal is a big topic of discussion there. In a sense, then, from their perspective, world leaders are literally scrambling to save the planet from Donald Trump, before it is too late. It is often objected that the Paris accord is unlikely to be sufficient to the long term global warming challenge in any case. That is a legitimate worry. But the whole idea behind it is to set in motion a cycle in which countries -- prompted by each other's actions -- continue to build on their own progress in a kind of mutually reinforcing cycle. What's more, if we press ahead now, it holds out at least the chance of putting us on a path to much more renewal energy use and more private sector innovation that could make a real difference over the long term. True, we don't know for certain if the Paris accord will be sufficient if we do remain a part of it. But if the U.S. were to stay committed to it, at least we'd be able to find out if it will be. Now we likely will not do that -- and may even end up being an active force in preventing it from succeeding. If there is one place where we should hope to be pleasantly surprised by Trump, it's here. *********************************************************** * TRUMP'S TEAM ALREADY STOCKED WITH D.C. INSIDERS: ""Outsider"" candidate Trump promised to ""drain the swamp"" in Washington. But CNN's Tal Kopan reports:  Trump's transition team is staffed with long-time Washington experts and lobbyists from K Street, think tanks and political offices...he has so far fully embraced lobbyists within his transition, and all signs point to a heavy influence from longtime Washington Republican circles on his transition. And with Trump mostly skipping detailed policy proposals during his campaign, they can have a powerful impact on his agenda. Shocking, isn't it? This is yet another sign that Trump very well govern much as a conventional Republican president would -- tax cuts, deregulation -- and not as a scourge of the elites. * DEMS BLAST CLINTON'S FAILURE WITH BLUE COLLAR WHITES: The recriminations are underway, and Politico reports that some Democrats believe Clinton lost because of her ""limited outreach"" to working class whites, something Bill Clinton pushed harder for: In general, Bill Clinton's viewpoint of fighting for the working class white voters was often dismissed with a hand wave by senior members of the team as a personal vendetta to win back the voters who elected him, from a talented but aging politician who simply refused to accept the new Democratic map. At a meeting ahead of the convention...senior strategist Joel Benenson told the former president bluntly that the voters from West Virginia were never coming back to his party. This portends a bruising argument among Democrats over how to get these voters back -- with more economic populism, or by sanding down the party's cultural appeals to the new Democratic coalition. * SENATOR MERKLEY ALLEGES 'STOLEN' COURT SEAT: On MSNBC's Chris Hayes show last night, Senator Jeff Merkley made the provocative charge that Republicans had ""stolen"" the current court vacancy by refusing to act on it for much of this year. He said: ""The seat that is sitting empty is being stolen...there's no legitimacy to a Supreme Court justice in a seat that's been stolen from one administration and handed to another...this is going to corrupt our political system in a way never envisioned or intended by our Constitution for a generation to come.  And so, we need to be talking about it."" Once the post-election niceties are over, we may be entering into a kind of Total War period. * McCONNELL MIGHT NOT BE ABLE TO SCRAP FILIBUSTER: The New York Times reports that Mitch McConnell won't say whether he'll end the filibuster for legislation or Supreme Court nominees. And:  It is not clear that Mr. McConnell, even if he wanted to, could round up enough votes from his own party to curtail the Senate filibuster, since some veteran Republican senators such as Susan Collins of Maine would probably be opposed. However, if Senate Democrats were able to frustrate the unified Republican government through the filibuster, the forces behind Mr. Trump's election and agenda...would be likely to push Mr. McConnell and his colleagues to get rid of it.  If Democrats exercise even a fraction of the obstruction that Republicans did during the Obama years, the roar from the right to kill it will be deafening. * TRUMP IS LIKELY TO REVOKE PROTECTIONS FOR DREAMers: This is a good catch by Bloomberg's Sahil Kapur:  The immigration section of Trump's presidential transition website reaffirms his plans to ""cancel unconstitutional executive orders"" -- which his advisers have said includes President Barack Obama's 2012 program that has protected from deportation 750,000 young people brought to the U.S. illegally.  As I noted yesterday, revoking protections and work permits from DREAMers is going to be a very big story, and very revealing of the true nature of the coming Trump presidency. * TRUMP WIN COULD USHER IN MORE VOTER SUPPRESSION: A disconcerting point from Paul Krugman about the long-term damage Trump's victory might bring:  The political damage will extend far into the future, too. The odds are that some terrible people will become Supreme Court justices. States will feel empowered to engage in even more voter suppression than they did this year. At worst, we could see a slightly covert form of Jim Crow become the norm all across America.  Needless to say, there won't be any Congressional effort to fix the gutted Voting Rights Act. Ironically, Trump's victory may mean our elections will grow more ""rigged,"" not less. "
5	https://www.washingtonpost.com/world/europe/german-fm-to-raise-arrests-of-opposition-lawmakers-in-turkey/2016/11/11/e4b62da4-a816-11e6-ba46-53db57f0e351_story.html	German FM to raise arrests of opposition lawmakers in Turkey	" BERLIN -- Officials say Germany's foreign minister will discuss the imprisonment of Turkish opposition figures during a trip to Ankara next week. Foreign Minister Frank-Walter Steinmeier is scheduled to fly to Turkey late Monday. The trip takes place immediately after a meeting of the European Union's top diplomats where the situation in Turkey will be discussed. Steinmeier's spokesman Martin Schafer says the German foreign minister plans to meet Tuesday with Turkish government officials, opposition parties and members of civil society. Schafer told reporters in Berlin on Friday that the exact agenda is still being determined, ""but you can assume he'll be carrying the topic of the incarcerated HDP deputies in his briefcase."" Several lawmakers from Turkey's Peoples' Democratic Party, known as HDP, were arrested on terrorism-related charges last week. Copyright 2016 The Associated Press. All rights reserved. This material may not be published, broadcast, rewritten or redistributed. "
6	https://www.washingtonpost.com/posteverything/wp/2016/11/11/its-going-to-be-a-rough-transition/	It’s going to be a rough transition	"   President Obama and President-elect Donald Trump talk to members of the media during a meeting in the Oval Office of the White House on Nov. 10. (Jabin Botsford/The Washington Post)  Tuesday's election results shocked the political professionals, the country, and the world. As its true implications become clear, many people who thought they would be doing one thing for the next four years are now confronted with a stark and different future. These kind of cognitive adjustments are difficult for even the most levelheaded of individuals. Readers should offer up a moment of empathy for those who will have to process this news the quickest. I am referring, of course, to Donald Trump and his transition team. While many commentators are lambasting the Clinton campaign for not reading the political moment better, the postmortems show that Trump's team was only marginally less surprised by the outcome. Bloomberg's Joshua Green and Sasha Issenberg report that, ""Even on the eve of the election Trump's models predicted only a 30 percent likelihood of victory."" Politico's Nancy Cook and Andrew Restuccia note a similar mind-set: Many members of the 100-plus Trump transition team were surprised by the election results. Many privately expected the Republican to get lambasted at the polls. ""There was definitely some shock,"" one team member told POLITICO, adding, ""Let's just put it this way, I owe a lot of people around here lunches and beers."" And the Daily Beast's Kimberly Dozier and Shane Harris offer up this nugget: Team Trump didn't expect to win until the campaign's internal polling a month before the election signaled a possible victory. That's when senior Trump officials went into overdrive, trying to build a bench of experienced national security candidates with top secret clearances willing to work for a Trump presidency -- and they met resistance across the landscape of experienced GOP national security professionals. Trump's team did not expect to win. A collection of outsiders largely inexperienced about government must now prepare to take over one of the world's largest bureaucracies. Oh, and they're doing it shorthanded. Trump's campaign policy shop died a slow death back in August. His transition team was understaffed. None of this changes the fact that on Jan. 20, Trump will be sworn in as president.   [Trump's huge transition will start with his tight inner circle]   This isn't just a problem with hiring people to run the government. It is also a problem with Trump's own mind-set. On Thursday, he came to Washington to meet with President Obama and the GOP leadership in Congress. Consider the following photos:     Is it me or does Trump's face here scream, ""Oh dear God I'm actually going to be in charge and do stuff""? pic.twitter.com/syH0jdyzTD -- Daniel W. Drezner (@dandrezner) November 10, 2016   CNN's description of this meeting suggests that it's beginning to dawn on Trump that he's actually going to be the commander in chief: The meeting, and Trump's stern demeanor, also underscored how the heavy burden of the presidency begins to settle on the shoulders of a President-elect. In Trump's case, that process will be especially challenging giving that he will be the first president elected with not political, diplomatic or military executive experience. And here Trump and soon-to-be first lady Melania Trump look super-thrilled to chat with House Speaker Paul D. Ryan.   The Trumps meet with Speaker Ryan, along with VP-elect Pence pic.twitter.com/wZm5O7BV7e -- Robert Costa (@costareports) November 10, 2016   Yes, it's unfair to judge what people are thinking from just a few still photos. But the reportage also makes it clear that Trump and his coterie have not quite processed what is happening. Which means there are going to be a lot more bumps in the road for the next three months. Indeed, the Associated Press reports that Trump's transition team already contravened standard operating procedures for a president-elect: Donald Trump is keeping Americans in the dark about his earliest conversations and decisions as president-elect, bucking a long-standing practice intended to ensure the public has a watchful eye on its new leader. Trump on Thursday refused to allow journalists to travel with him to Washington for his historic first meetings with President Barack Obama and congressional leaders. The Republican's top advisers rebuffed news organizations' requests for a small ""pool"" of journalists to trail him as he attended the meetings. The decision was part of an opaque pattern in Trump's moves since his victory Tuesday. He was entirely out of sight on Wednesday. His aides said he was huddled with advisers at his offices in New York. His team has not put out a daily schedule, or offered any detailed updates on how he has spent his time. They have not acknowledged phone calls or other contact with world leaders. And then there's Trump's Twitter feed:   Just had a very open and successful presidential election. Now professional protesters, incited by the media, are protesting. Very unfair! -- Donald J. Trump (@realDonaldTrump) November 11, 2016   When a man who was elected president with the second-largest number of votes complains that protests are somehow ""unfair,"" it suggests that maybe he's not thinking about how to be the president of all Americans. By definition, transition means change. Trump and his staff will likely move down the learning curve. To Trump or his staff's credit, his follow-up tweet this morning about the protests was more conciliatory. Trump spokeswoman Hope Hicks put out a statement promising a traditional press pool ""in the near future,"" which hopefully means before Jan. 20. A Trump administration will eventually staff up, even in foreign policy. But let's be blunt: Trump's quixotic management style was always going to clash with the rigors of the White House. The fact that he's already scrambling means this transition is going to be the opposite of orderly. The Americans who voted for Donald Trump wanted to see a disruption of the status quo in Washington. We are all about to get a firsthand look at what that actually means."
7	https://www.washingtonpost.com/local/just-4-percent-of-dc-residents-voted-for-trump-how-will-the-city-welcome-him/2016/11/09/7982fefc-a688-11e6-8042-f4d111c862d1_story.html	President Trump, don’t count on a visit from the welcome wagon	" In a city where 76 percent of registered voters are Democrats, where the majority of residents are people of color and where Donald Trump has been publicly dissed by local leaders, the idea that he will become the District's newest resident was coolly received Wednesday. ""I don't like it at all,"" said Karen Samuel, a 38-year-old home health aide, who said she was still in a state of disbelief. ""I saw the commercial of him making fun of that disabled reporter. That's horrible. I don't think it's going to work here."" Katie McDonnell and her husband are considering renting out their D.C. home to live abroad near family members in Ireland. It's not just that the couple wants to flee their country because they disagree with Trump's politics.  [Full results from Washington, D.C.]  ""I'm afraid it will change the city, just because of the Trump supporters who may come here, and who he will hire and bring,"" said McDonnell, a 41-year-old teacher who has lived in the District for 15 years. ""I am a little worried.""         1 of 23       Full Screen Autoplay  Close                                                                     Skip Ad   x           What Election Day looks like in the D.C. area      View Photos   Washington Post photographers capture the region's residents as they cast their votes.    Caption   Washington Post photographers capture the region's residents as they cast their votes.   Nov. 8, 2016 Tessie October, 40, holds her daughter Charlise Bruce while casting her vote at Temple Emanuel in Kensington, Md. Sarah L. Voisin/The Washington Post  Buy Photo          Wait 1 second to continue.   .wp-volt-gal-preroll-video{width:100%;height:100%}        Trump pulled off an impressive upset Tuesday night to clinch the presidency, but in the nation's capital the Republican got 11,000 votes, or 4 percent, his lowest share in any state. By comparison, Clinton got more than 260,000 votes. Trump will have the prickly task of running the country from the very place that wanted him there the least. ""He doesn't even care. It's going to be bad, period,"" said Kim Jones, a 44-year-old cook at D.C. Public Schools, adding that she expects Trump to be no better for the District than he will be for the rest of the country. The city's political establishment has made its animus toward Trump clear. When he formally celebrated the opening last month of his $212 million luxury hotel on Pennsylvania Avenue NW, local leaders -- including Mayor Muriel E, Bowser (D) and Del. Eleanor Holmes Norton (D) were nowhere in sight. Those who came, such as Latino union workers, were there to stage a protest.  [Two weeks out, Trump takes commercial break from campaign to again tout D.C. hotel]  In 2015, Bowser called Trump's more incendiary remarks ""idiotic"" but said that she still wanted his hotel in the city and the tax revenue it would bring. But Bowser turned on him in October after Trump incorrectly stated in a presidential debate that ""killings have risen by 50 percent"" in the nation's capital. Shaking my head at Donald Trump, ""who comes to DC for profit on the 1 hand, badmouths it on the other,"" Bowser tweeted in response.     Protesters demonstrated at the White House and in front of Trump International Hotel on Nov. 9 as they tried to come to grips with the election of President-elect Donald Trump. (WUSA 9)   Norton said that the hotel opening was essentially just a political event, and it would have been inappropriate for her to attend.      At a news conference on Nov. 9, Democratic D.C. Mayor Muriel E. Bowser said that some relationships need to be repaired in order for President-elect Donald Trump to win the support of D.C. residents. About 93 percent of D.C. voters chose another candidate over Trump. (YouTube/D.C. Government)   But she said Wednesday morning that she has had successful relationships with Republican presidents in the past, and D.C. residents should view his presidency with an open mind -- even if they have felt insulted by his past comments about women, Muslims, Latinos and African Americans. ""This is old hat for me,"" she said. ""I've always had to separate the Republican president's ideological views with his obligation to help the people of the District of Columbia. I have no reason he will be hostile to the District."" The president and the people who live near him share a unique relationship. The president and Congress hold considerable clout over how the mayor and D.C. Council spend tax dollars and use the powers granted to them by Congress under home rule. Bowser vowed to try to work with Trump, during an interview on WAMU-FM on Wednesday morning. ""Our job here is to run our city, and we are running our city in a very effective way,"" Bowser said. ""We are attracting residents and businesses, and we expect from a President Trump what we would have quite frankly from a President Clinton -- to support the things that are important to D.C. residents."" A change in administrations always means change in the local population, as people move in and out of the city. But the transition from the Obama presidency to Trump's could be more stark than usual. observers say. Obama brought a youthful energy to the city, attracting young and diverse staffers. Obama's presidency also overlapped with the massive D.C. population boom and, subsequently, with the explosion of the city's restaurant, entertainment and luxury-condo scene. Over the past eight years, Washington seems to have shaken off its reputation as a staid, suited-up town and transformed into something of a hip city.  [Obama made D.C. look cool. Will Clinton or Trump make it boring again?]  The result of Tuesday's election was especially disappointing for the city's political leaders because Clinton had made it clear during her campaign that she would back statehood for the District, while Trump said, ""I think statehood is a tough thing for D.C.,"" and, ""I don't see statehood for D.C."" ""There had been great hope that the new President and the new Congress would be the friendliest to the District that we've seen in decades,"" D.C. Council Chairman Phil Mendelson (D) wrote in an email. ""The challenge is on us to work with the next administration to ensure that Congress recognizes the importance of Home Rule and finds ways to be supportive, not oppositional, of our local Government."" "
