	Link	Title	Text
0	https://www.washingtonpost.com/news/wonk/wp/2016/11/18/trumps-pick-for-attorney-general-good-people-dont-smoke-marijuana/	Trump’s pick for attorney general: ‘Good people don’t smoke marijuana’	"      In a Senate drug hearing in April 2016, Sessions said that 'we need grown-ups in charge in Washington to say marijuana is not the kind of thing that ought to be legalized, it ought not to be minimized, that it's in fact a very real danger.' (U.S. Senate Drug Caucus)   President-elect Donald Trump plans to nominate Sen. Jeff Sessions (R-Ala.) to be attorney general of the United States, The Washington Post and other news outlets reported Friday. Sessions is a vocal opponent of marijuana legalization whose elevation to attorney general could deal a blow to state-level marijuana legalization efforts across the country. At a Senate drug hearing in April, Sessions said that ""we need grown-ups in charge in Washington to say marijuana is not the kind of thing that ought to be legalized, it ought not to be minimized, that it's in fact a very real danger."" He voiced concern over statistics showing more drivers were testing positive for THC, the active component in marijuana, in certain states.   [Senators held a hearing to remind you that 'good people don't smoke marijuana' (yes, really)]   Sessions further argued that a lack of leadership from President Obama had been one of the drivers of the trend toward marijuana legalization in recent years. ""I think one of [Obama's] great failures, it's obvious to me, is his lax treatment in comments on marijuana,"" Sessions said at the hearing. ""It reverses 20 years almost of hostility to drugs that began really when Nancy Reagan started 'Just Say No.' "" He added that lawmakers and leaders in government needed to foster ""knowledge that this drug is dangerous, you cannot play with it, it is not funny, it's not something to laugh about . . . and to send that message with clarity that good people don't smoke marijuana."" Opponents of legalization say the Sessions nomination could be a game-changer in legalization debates around the country. Sessions ""is by far the single most outspoken opponent of marijuana legalization in the U.S. Senate,"" Kevin Sabet, of the anti-legalization group Smart Approaches to Marijuana, said in an email. ""If I were betting on the prospects for marijuana legalization, I'd be shorting.""   [What the future of marijuana legalization could look like under President Trump]   Advocates for legalization are, conversely, sounding the alarm. ""Jeff Sessions is a drug war dinosaur, which is the last thing the nation needs now,"" Ethan Nadelmann, of the Drug Policy Alliance, said in a statement. ""Those who counted on Donald Trump's reassurance that marijuana reforms 'should be a state issue' will be sorely disappointed."" Sessions's anti-pot positions have been consistent throughout his career. As far back as 1986, he joked that he thought the Ku Klux Klan ""was okay until I found out they smoked pot,"" according to the New York Times.      The 2016 election has proved to be the biggest victory for marijuana reform since 2012, with voters in California, Massachusetts, Nevada and Maine approving recreational marijuana initiatives. (Daron Taylor/The Washington Post)   At the Senate hearing in April, Sessions spoke approvingly of the ""progress"" made on drug use, starting with the harsh anti-drug policies of the 1980s. ""I can't tell you how concerning it is for me emotionally and personally to see the possibility that we would reverse the progress that we've made and let it slip away from us,"" he said. ""Lives will be impacted, families will be broken up, children will be damaged."" He added, ""I believe the Department of Justice needs to be clearer"" on marijuana legalization. Whether an Attorney General Sessions would bring such clarity to the office is an open question at this point. President-elect Trump has said that he believes marijuana legalization should be an issue left to the states. Under Obama, the Justice Department explicitly adopted a hands-off approach to marijuana enforcement in states that have legalized the drug, allowing those laws to proceed without interference provided that a number of enforcement priorities, including keeping pot out of the hands of minors, were met. The announcement of that stance in 2013 played a key role in allowing Colorado and Washington to move forward with their marijuana markets. ""A lot of people forget that [recreational marijuana markets in] Colorado and Washington were pretty much on hold until the governors there received guidance from the Department of Justice,"" John Hudak, a senior fellow at the Brookings Institution, said this month. Even simply reversing that guidance could have a chilling effect in states like Maine and Massachusetts that recently approved legalization. Without a tacit green light from the federal government, governors in those states may be hesitant to move forward with legalization policies that remain at odds with federal laws on the books for more than 40 years. ""I'm still hopeful the new administration will realize that any crackdown against broadly popular laws in a growing number of states would create huge political problems they don't need and will use lots of political capital they'd be better off spending on issues the new president cares a lot more about,"" said Tom Angell of the pro-legalization group Marijuana Majority. Angell pointed out that recent polls show roughly 60 percent of Americans approve of legalization and that strong majorities of voters across all parties say the federal government should not interfere with state-level marijuana laws. Asked about the senator's approach to marijuana issues as attorney general, Sessions's office responded that it had no information at this moment. This post has been updated. More from Wonkblog: Arizona's governor asked voters to fact-check whether pot is safer than alcohol. So we did. Police arrest more people for marijuana use than for all violent crimes -- combined Stoned drivers are a lot safer than drunk ones, new federal data show"
1	https://www.washingtonpost.com/news/wonk/wp/2016/11/18/the-dark-chapter-of-americas-history-a-trump-backer-just-called-precedent-for-registering-muslims/	The dark chapter of America’s history a Trump backer just called ‘precedent’ for registering Muslims	"   (Russell Lee, 1942, Library of Congress)  On Wednesday, a prominent supporter of President-elect Donald Trump drew criticism after calling the internment of Japanese Americans during World War II a ""precedent"" for establishing a registry for immigrants from Muslim countries, a policy that has recently been discussed by other advisers to the president-elect. ""We did it during World War II with the Japanese,"" said Carl Higbie, a former spokesman for the Great America political action committee, on Fox News. When pushed on that point, Higbie said he wasn't proposing going back to the days of internment camps. ""But I'm just saying there is precedent for it,"" he added. Higbie has since said his comment was not in reference to internment camps, but was about registering immigrants. Trump has previously said he would require Muslims to register in a database, though a spokesman said this week that Trump would not seek ""any registry or system that tracks individuals based on their religion."" The spokesman added that Trump would announce other policies to vet foreign visitors from ""high terrorism"" countries. If the internment of Japanese Americans during World War II creates some kind of precedent for the treatment of Muslims in the United States today, it's worth remembering exactly what that history looks like. That's something a stunning series of historical photographs from the Library of Congress, now housed at a Yale University site, makes easy to do. After the Japanese bombing of Pearl Harbor on Dec. 7, 1941, a sense of paranoia spread about the loyalty of people of Japanese ancestry living in the United States. By February 1942, that suspicion culminated in President Franklin D. Roosevelt's signing of an executive order that led to the incarceration of many Japanese Americans for the duration of the war. More than 100,000 people of Japanese ancestry, most of them U.S. citizens, were forced into internment camps during the war. Those with ancestors from Korea and Taiwan, which were Japanese colonies, were also interned, as well as some with German and Italian heritage. As they were shipped off to the camps, many Japanese Americans lost their businesses, livelihoods and savings. Because many were only allowed to take what they could carry to the camps, business owners were forced to shutter their shops and sell off their stock for cents on the dollar. In the 1942 photograph below, the departing owners of a shop in Los Angeles' Little Tokyo left a message saying, ""God be with you till we meet again."" Families also rushed to sell their homes, furniture and other belongings.    (Russell Lee, April 1942, Los Angeles. Library of Congress)  At the time, many Japanese Americans in the West worked as farmers, such as the onion farmer below. Before evacuation, they were forced to sell their unharvested crops and equipment at steep losses, often to the material benefit of white farmers in their area.    (Russell Lee, April 1942, Los Angeles. Library of Congress)  Under the watch of the U.S. military, Japanese Americans boarded trains that would take them to internment camps. In the following photographs, people wait for trains that would take them from Los Angeles to the Owens Valley camp, more than 200 miles to the north.    (Russell Lee, April 1942, Los Angeles. Library of Congress)     (Russell Lee, April 1942, Los Angeles. Library of Congress)    [The untold stories of Japanese war brides]      (Russell Lee, April 1942, Los Angeles. Library of Congress.)     (Russell Lee, April 1942, Los Angeles. Library of Congress)  In the photograph below, Japanese Americans arrive by car at a ""reception center"" in Santa Anita, Calif., a former racetrack that was surrounded by barbed wire.    (Russell Lee, April 1942, Los Angeles. Library of Congress)  Conditions in the camps were harsh. Most were located in desolate places, such as deserts or swamps. Some were set up on old racetracks and fairgrounds, others on Native American reservations. Their occupants lived in flimsy, cramped and hastily erected shelters, often without plumbing, electricity or privacy. Food was limited, and there were outbreaks of dysentery. Some who tried to leave their camps were shot. In the camp below, in Nyssa, Ore., Japanese Americans lived in tents without electricity. As photographer Russell Lee wrote in the photograph's original caption, the occupants were accustomed to better living conditions.    (Russell Lee, July 1942, Nyssa, Malheur County, Ore. Library of Congress)     (Russell Lee, July 1942, Nyssa, Malheur County, Ore. Library of Congress)  The photograph below shows a family in their tent home in the Nyssa camp. As Lee wrote in the original caption: ""One of the sons of this family is in the U.S. Army. Two of the sons were studying engineering at an American university before the evacuation and are now greatly worried about possibilities of continuing their education.""    (Russell Lee, July 1942, Nyssa, Malheur County, Ore. Library of Congress)  Lee also documented people in the Nyssa camp enjoying the few entertainments that they had -- playing a gramophone record in the shared ""recreation tent,"" playing baseball, swimming, or reading and writing letters.    (Russell Lee, July 1942, Nyssa, Malheur County, Ore. Library of Congress)     (Russell Lee, July 1942, Nyssa, Malheur County, Ore. Library of Congress)     (Russell Lee, July 1942, Rupert, Minidoka County, Idaho. Library of Congress)     (Russell Lee, July 1942, Rupert, Minidoka County, Idaho. Library of Congress)  But time in the camps was spent laboring in the fields. As young men around the country went to war, local farms turned to incarcerated Japanese Americans as a valuable source of labor. Here are Japanese Americans sowing the fields in the Tule Lake Relocation Center in Newell, Calif., in 1942:    (Unknown, 1942, Siskiyou, Calif., Library of Congress)  Here are other farmworkers in a camp in Twin Falls County, Idaho:    (Russell Lee, July 1942, Twin Falls, Idaho. Library of Congress)  Internment ended by 1946, but the suffering of many Japanese Americans did not. Many left the camps almost penniless, set back a generation or more in terms of wealth, and returned to their communities to confront violence and racism. It wasn't until the 1970s that a U.S. president, Gerald Ford, would denounce internment. In 1980, the U.S. government issued a report saying the policy was caused by ""race prejudice, war hysteria and a failure of political leadership."" The U.S. government ultimately paid out more than $1.6 billion in reparations to those who were interned. You might also like: What America's immigrants looked like when they arrived on Ellis Island Stunning photos show what America looked like during the Great Depression These powerful photos of people living with debt will make you feel not alone Stunning photos show why S. Korea is the plastic surgery capital of the world"
2	https://www.washingtonpost.com/world/africa/organizers-of-anti-government-protest-beaten-in-zimbabwe/2016/11/18/15b4992a-adaf-11e6-8f19-21a1c65d2043_story.html	Organizers of anti-government protest beaten in Zimbabwe	 HARARE, Zimbabwe -- Diplomats say opposition activists were abducted and beaten before a demonstration against the cash-strapped government's plans to introduce a new currency. The demonstration planned against the introduction of bond notes failed to take off Friday, after the violence against the organizers. The European Union delegation in Harare said in a statement Friday that social activists were brutalized before the anti-government demonstration. The EU statement expressed concern at the recent growth of human rights violations in Zimbabwe. Local media reported that six people were beaten and two cars were burned Thursday night in what was seen as a warning against going ahead with the protests. President Robert Mugabe's government, in power since independence from Britain in 1980, is facing an economic crisis that has caused massive cash shortages. Copyright 2016 The Associated Press. All rights reserved. This material may not be published, broadcast, rewritten or redistributed. 
3	https://www.washingtonpost.com/news/morning-mix/wp/2016/11/16/a-great-purge-twitter-suspends-richard-spencer-other-prominent-alt-right-accounts/	‘A great purge?’: Twitter suspends Richard Spencer, other prominent alt-right accounts	"      Twitter has added conservative writer Milos Yiannopoulos to its growing list of permanently banned accounts in the midst of high profile instances of harassment. (Jenny Starrs/The Washington Post)   Ever since alt-right provocateur Milo Yiannopoulos sent actress Leslie Jones a string of tweets insulting the comedian's race and intelligence, Twitter has made banning abusive accounts a priority. At the time, the company offered a statement, which read in part: . . . our rules prohibit inciting or engaging in the targeted abuse or harassment of others . . . we've seen an uptick in the number of accounts violating these policies and have taken enforcement actions against these accounts, ranging from warnings that also require the deletion of Tweets violating our policies to permanent suspension. We know many people believe we have not done enough to curb this type of behavior on Twitter. We agree. We are continuing to invest heavily in improving our tools and enforcement systems to better allow us to identify and take faster action on abuse as it's happening and prevent repeat offenders Recently Twitter suspended more accounts associated with the alt-right, which the Southern Poverty Law Center describes as ""a set of far-right ideologies, groups and individuals whose core belief is that 'white identity' is under attack by multicultural forces using 'political correctness' and 'social justice' to undermine white people and 'their' civilization."" Included among them was the verified account of Richard Spencer, whom The Washington Post described as a leader of the alt-right and ""one of the most media-savvy thinkers in the movement."" Twitter also suspended the account of the Virginia-based National Policy Institute, an alt-right white nationalist think tank of which Spencer is the president, and that of Radix Journal, a magazine run by Spencer. Paul Town, Pax Dickinson, Ricky Vaughn and John Rivers also had their accounts suspended. In response, Spencer posted a video to YouTube in which he said, ""I am alive physically, but digitally speaking, there has been execution squads across the alt-right.""    ""It's corporate Stalinism, in the sense that there is a great purge going on, and they're purging people on the basis of their views,"" Spencer said. He said these suspensions are unlike Yiannopoulos's. ""I supported people like Milo when they were banned from Twitter, but Milo was engaging in something that could be called 'harassment,'"" Spencer said of the man who used the platform to call Jones ""barely literate,"" ""fat and ugly, ugly, ugly, fat"" and ""a hot black dude."" Added Spencer, ""Again, I totally think he should have stayed."" Spencer, though, drew a sharp distinction between the way Yiannopoulos used the platform and the way he did. ""I and a number of other people who just got banned were not even trolling,"" he said. ""I was using Twitter just like I always used Twitter: to give people some updates and maybe comment on a news story here and there.""   [What's the alt-right? A primer]   Instead, Spencer said he thinks this was a ""coordinated effort to just wipe out alt-right Twitter"" in response to arguments that social media helped elect Donald Trump.          1 of 10       Full Screen Autoplay  Close                                           Skip Ad   x           Here's what president-elect Donald Trump has been doing after the election      View Photos   He has been holding interviews and meeting with Congress and the president as he prepares to transition into the White House.    Caption   He has been holding interviews and meeting with Congress and the president as he prepares to transition into the White House.  Nov. 18, 2016 A motorcade vehicle transporting President-elect Donald Trump arrives at Trump National Golf Club in Bedminster, N.J. Jabin Botsford/The Washington Post  Buy Photo          Wait 1 second to continue.   .wp-volt-gal-preroll-video{width:100%;height:100%}        ""Twitter and probably Facebook too . . . I think they are deeply triggered by Trump's election,"" Spencer said. ""I think they're triggered by this narrative that social media helped elect Trump and they think that they have to do something about it. Well, the fact is social media did help elect Trump."" Heidi Beirich, spokeswoman for the Southern Poverty Law Center, told the USA Today that the organization had previously asked Twitter to remove more than 100 accounts of white supremacists but said on Monday (before the suspensions), ""They have done nothing."" Spencer compared the account suspensions to the Night of Long Knives, also known as Operation Hummingbird, in which Hitler ordered ""a bloody purge of his own political party, assassinating hundreds of Nazis whom he believed had the potential to become political enemies in the future,"" according to History.com. The video's title is ""The Knight of Long Knives,"" a play on the operation's name. Many on Twitter expressed confusion and outrage concerning Spencer's suspension. ""Richard Spencer advocates for my people, doesn't hate anyone, is a gentleman, and a friend, and Twitter suspended him,"" one user tweeted. "" Pax Dickinson and Richard Spencer have been banned from Twitter. The left knows social media helped Trump and is cracking down,"" tweeted another.  This was Richard Spencer's final tweet. Can someone explain how this violates Twitter policy? @davidfrum @jack @help pic.twitter.com/tt63UdpRNH -- Bunker  Smith (@bunkerwsmith) November 16, 2016  Spencer said that this could be seen as a victory for the alt-right movement. ""This is a clear sign that we have power,"" he said. ""Even if it's in our own little small way . . . we have power, and we're changing the world."" Twitter did not respond to a request for comment from USA Today, stating, ""We don't comment on individual accounts, for privacy and security reasons."" Finally, Spencer mentioned that he might transition to GAB, a social media platform used by many who identify with the alt-right. It prides itself on free speech. On its landing page, the platform includes a quote from writer and poet Charles Bukowski, ""Censorship is the tool of those who have the need to hide actualities from themselves and from others."" More from Morning Mix 'I'm going to kill the President Elect': A now former CEO explains (and regrets) a Facebook post Behind the scenes of the original Star Wars, Carrie Fisher and Harrison Ford were doing exactly what you guessed, says Fisher We live in crazy times: Neo-Nazis have declared New Balance the 'Official Shoes of White People'"
