	Link	Title	Text
6	https://www.washingtonpost.com/national/health-science/michigan-may-require-lead-screening-of-all-young-children/2016/11/17/3101f038-acd3-11e6-8f19-21a1c65d2043_story.html	Michigan may require lead screening of all young children	" LANSING, Mich. -- Michigan, where a man-made water crisis is roiling one of its biggest cities, will consider requiring all infants and toddlers to be tested for lead poisoning as part of an initiative to eradicate children's exposure to the neurotoxin statewide. The recommendation is among many unveiled Thursday by a state board that Gov. Rick Snyder tasked with proposing a strategy to protect children from all sources of lead poisoning. The emergency in Flint stems from old lead pipes contaminating the water after the city was switched in 2014 from Detroit's water system to improperly treated Flint River water while under state financial management. But lead poisoning is more frequently linked to paint and dust in older housing and soil. The toxin was banned from paint in 1978. The Child Lead Poisoning Elimination Board's report calls for the screening of all children for lead by the time they turn 1 and again between ages 2 and 3. Such testing is currently only required for low-income kids in the Medicaid or Women, Infants, and Children (WIC) programs. Under the federal health care law, lead screening for children at risk of exposure is considered a preventive service for which insurers cannot apply copays, deductibles or coinsurance. The report also recommends requiring that a lead inspection and risk assessment be done when any house built before 1978 is sold or transferred, unless lead in the home has already been fully addressed. If lead hazards were found, abatement would be required at the point of sale or transfer. In newer homes, the dust, soil and water would have to be tested. The owner would be required to disclose the information to a future buyer or renter. Lt. Brian Calley, who chairs the board, said ""great strides"" were made when lead was removed from paint and gasoline decades ago but that since then lead-prevention efforts ""kind of fell off the radar."" The current focus is on responding when kids have elevated levels of lead in their blood.  ""That's just not good enough on its own,"" Calley said Thursday. ""Preventing the poisoning from happening in the first place ... is where we want to shift the focus."" The report says blood-lead screening rates are ""very low"" and cites inadequate federal and state funding, which has led to a depleted local public health infrastructure that is unable to fully apply current laws and regulations. Calley, who said it will take ""a generation"" to implement the proposals, pointed to the U.S. government's ""huge"" approval this week of a waiver so Michigan can spend $119 million in predominantly federal money over five years to remove lead hazards from the homes of low-income residents in Flint and other communities. The Snyder administration also plans to propose lead-prevention funding in the next state budget. According to the report, identified cases of child lead poisoning have declined significantly in Michigan. In 1998, 44 percent of children under age 6 who were tested had elevated blood-lead levels. It was 3.4 percent in 2015, or nearly 4,800 children of about 141,000 tested. But Calley cautioned that only universal screening of young children and full reporting of results to a surveillance system for data analysis will help pinpoint the actual prevalence of lead exposure. About 38 percent of all Michigan 1- and 2-year-olds were tested last year. It was not immediately known how many states require universal screening. Massachusetts has such a requirement, and Maryland last year announced a plan calling for all children there to be tested at ages 1 and 2. The 12-member board includes top officials in the Snyder administration and outside experts such as Dr. Mona Hanna-Attisha, who helped expose Flint's crisis more than a year ago after state officials initially dismissed her findings. She said universal lead screening of children was done in the past, but that ""the world of medicine and public health thought we took care of lead"" only to learn since that there is no safe level.  ""We need to know where our children are that are being exposed so that we can identify target areas and then go back to that primary prevention work,"" Hanna-Attisha said. Also Thursday, state attorneys asked a federal judge in Detroit to halt his order that bottled water be delivered to lead-tainted homes in Flint unless residents opt out or officials verify that a filter has been properly installed. They said the injunction issued last week ""far exceeds"" what is necessary to ensure that residents have safe drinking water, and the state is likely to succeed on appeal. Henry Henderson, Midwest director for the Natural Resources Defense Council, one of the plaintiffs in the lawsuit, said trying to delay the order ""is an obvious insult to the people of Flint, whose tap water has been contaminated with lead for more than two years."" ___ Online: Child Lead Poisoning Eliminate Board report: http://bit.ly/2g2esFU ___ Follow David Eggert on Twitter at http://twitter.com/DavidEggert00 His work can be found at http://bigstory.ap.org/author/david-eggert Copyright 2016 The Associated Press. All rights reserved. This material may not be published, broadcast, rewritten or redistributed. "
7	https://www.washingtonpost.com/business/arkansas-high-court-bars-union-from-protesting-at-wal-mart/2016/11/17/b966f8b6-acdc-11e6-8f19-21a1c65d2043_story.html	Arkansas high court bars union from protesting at Wal-Mart	" LITTLE ROCK, Ark. -- A labor union was kept barred from protesting or demonstrating at Wal-Mart's stores and offices in Arkansas after the state's highest court on Thursday scaled back a judge's order prohibiting the group from entering the retail giant's property for anything other than shopping. The Arkansas Supreme Court upheld a Benton County judge's trespassing order against the United Food and Commercial Workers International Union, but modified the injunction to cover only activities such as picketing, demonstrations and flash mobs against the Bentonville-based company.  ""We agree with the union that the circuit court's injunction and declaration encompassing all non-shopping activity or conduct is simply too broad,"" the court said in its ruling. The union and its affiliate group, the Organization United for Respect at Wal-Mart, had argued that the National Labor Relations Board, not the Benton County judge, should have jurisdiction over the matter. Justices disagreed and noted that appellate courts in several other states have rejected that argument.  ""We are pleased at the Arkansas Supreme Court's decision to narrow the overbroad order,"" Randy Parraz, campaign director for the union's Making Change at Wal-Mart campaign, said in a statement. ""Make no mistake, Making Change at Walmart will continue to fight for a better life for the millions of hard-working Walmart employees in every state across this country whose economic struggles have been long forgotten or ignored by Walmart and so many others."" Wal-Mart sued the union over the demonstrations, which it said has included flash mobs where demonstrators have banged on pots and pans and marched and chanted through its stores. Other activities have included rallies and picketing at its stores and offices, the company said. The retail giant has filed similar suits against the union in Florida and Texas in recent years.  ""We appreciate the court protecting property rights and upholding our right to seek enforcement of the trespass laws against unions in these situations,"" Wal-Mart spokesman Kory Lundberg said in an email. ""As the court's opinion notes, other states have agreed with this approach."" The union had argued that the company's trespassing complaint in Arkansas was nearly identical to one it had also filed with the national board. An attorney for Wal-Mart told the court last month that trespassing was a state issue and was properly before the state judge. In a separate opinion, Justice Josephine Linker Hart wrote that she agreed that the original trespassing order was too broad but believed justices should have sent the case back to the lower court rather than rewrite it themselves.  ""Further, picketing, patrolling, parading, demonstrations, hand-billing and solicitation are all protected activities under the right circumstances,"" she wrote. ""It behooves this court to return this case to the circuit court where an order that clearly does not run afoul of the National Labor Relations Act can be crafted with the assistance of the litigants."" ___ Follow Andrew DeMillo on Twitter at www.twitter.com/ademillo Copyright 2016 The Associated Press. All rights reserved. This material may not be published, broadcast, rewritten or redistributed. "
8	https://www.washingtonpost.com/news/monkey-cage/wp/2016/11/11/in-record-numbers-latinos-voted-overwhelmingly-against-trump-we-did-the-research/	In record numbers, Latinos voted overwhelmingly against Trump. We did the research.	"   Donald Trump rides an escalator to an event to announce his candidacy at Trump Tower on June 16, 2015, in New York. (Christopher Gregory/Getty Images)  What can we learn about the 2016 election from the Latino Decisions Election Eve Poll (about which more below)? Two things stand out. On Nov. 8, Latino turnout was up significantly compared with 2012. And Latinos gave a substantial share of their votes -- we estimate 79 percent -- to Secretary of State Hillary Clinton.   [Five key lessons from Donald Trump's surprising victory]   That's what we know from our poll, combined with some of our pre-election surveys. The national exit surveys' deeply flawed methodology distorts the Latino vote. Even the exits, however, find that the Latino electorate gave a supermajority of its vote to Clinton. Figuring in the increase in Latino voters, Donald Trump received only 18 percent of the Latino vote, the lowest level on record for any presidential candidate. Here's how we did our research Exit polls get results from a small, nonrepresentative sample of a handful of precincts. By contrast, the Latino Decisions election eve poll includes a random statewide sample of all Latino voters across each state. The survey was available in English or Spanish from point of first contact. Random sampling is the single-most important feature of accurate polling; bilingual polling is critical in the Latino community. Further, our data are then weighted to match the census for the correct geographic dispersion, age, education and gender of Latino voters.   [What a President Trump means for foreign policy]   Our Election Eve Poll included a minimum of 400 completed interviews of Latino voters in each of 11 states, a minimum of 800 in the heavily Latino Florida, another 400 across the remaining 38 states, for a total of 5600 interviews. All the interviews were dispersed geographically in keeping with the distribution of the Latino population. As a result, they are more reliable than exit interviews, which are necessarily clustered in a few specific precincts. For all these reasons, our results differ significantly from those of exit polls and, from a social science perspective, are more accurate and reliable. We are calling on the exit polls to reveal the exact methodology and demographics of their Latino sample so that those can be compared. More Latinos voted than ever before Our LD Turnout Predict tool estimates that 13.1 million to 14.7 million Latinos cast ballots in the 2016 election. That's a significant increase from the 11.2 million Latino votes cast in 2012.   [How the gender gap doomed Hillary Clinton]   Latinos turned out in high numbers, and they turned out early, outpacing early voting numbers from 2012 in essentially all key battleground states. That includes Florida, where their early vote numbers increased by nearly 90 percent from 2012. We saw similar growth in every heavily Latino county in Texas. For instance, in the strongly 90 percent Latino counties in the Rio Grande Valley, turnout increased 4 to 10 percent over 2012. Similarly, in heavily Latino precincts across Florida's Miami and Osceola counties, voter participation increased from 6 to 16 points. In New Mexico, precincts in Las Cruces that are 99 percent Latino showed consistent increases in voter turnout in 2016 over 2012. The ""real world"" election result data from across the country corroborates what we have been seeing all year in our polling data: Latinos were more enthusiastic about voting in 2016. When we look at the numbers from our Election Eve Poll, for example, we found that an all-time high of 53 percent of Latino voters nationwide voted early either by mail/absentee ballot (24 percent) or through an early voting location (29 percent), corroborating the early vote numbers reported before Election Day. In the final NALEO/Telemundo tracking poll, 76 percent said voting in 2016 was more important than any other election in their lives. They voted because they feared a President Trump Our polling throughout the election season indicated that the high levels of Latino enthusiasm about voting were driven largely by fear of a Trump victory, which we have called ""Trump Bump."" Trump's anti-Mexican and anti-immigrant comments throughout the campaign season appeared to energize the Latino electorate. Our Election Eve Poll finds that 55 percent of Latino voters stated that Trump was ""hostile"" toward Latinos or Hispanics and 29 percent said he ""did not care too much"" about Latinos. In 2012, only 18 percent viewed Romney as ""hostile"" while 56 percent said he ""did not care"" about Latinos.   [How Trump's election will affect U.S.-Russian relations]   In a poll we conducted immediately after the Republican National Convention, more than 80 percent of Latinos said the themes of the convention were anti-Latino and offensive -- 80 percent! Further, we found that 20 percent of 2016's Latino voters were exercising the franchise for the first time. That was true for more than a third of North Carolina's Latino voters. Latinos voted overwhelmingly for Clinton Nationally, Clinton received a record-high 79 percent to 18 percent for Trump, with 3 percent voting for one of the third-party candidates. This 61 percent gap is the largest we have recorded at Latino Decisions, outpacing the 2012 Obama advantage over Romney, at 75 to 23 percent. That varied by state. Latino support was at 88 percent in New York, and well above 80 percent across every state except for Florida. In Florida, influenced by the more conservative Cuban vote, Clinton won 67 percent and Trump 31 percent -- which still gave her a large increase over Obama, who won Florida Latinos 58 to 40 percent.   [When the White House changes hands, it's a dangerous time for foreign policy]   In heavily Latino counties, that preference was even more pronounced. For instance, Starr County, Tex., is 96 percent Latino; there, Trump won just 19 percent of all votes cast. In Florida's Miami-Dade County, the heavily Cuban precinct 419 -- which had cast only 28 percent votes for Obama -- jumped to 49 percent for Clinton, a 21 point increase. In the heavily Puerto Rican precinct 210 in Kissimee, Fla., Clinton defeated Trump 80 percent to 17 percent. In New Mexico's Las Cruces, precinct 80 cast only 9 percent of its votes for Trump. And in Milwaukee District 12, precinct 233, which is 77 percent Latino, the vote was 88 percent for Clinton to 9 percent for Trump. There are literally thousands of similar results across majority-Latino precincts in the country. The national exit polls apparently did not conduct any interviews in these Latino enclaves. Results have been consistent for months Our findings over the past several months have been highly consistent. Clinton was running far ahead of Trump with Latino voters throughout the election, with little fluctuation. Latino voters made up their minds early. When asked when they decided which presidential candidate they would vote for, 78 percent said they did so over the summer or earlier. Trump's immigration policy pronouncements began when he came down the escalator to announce his campaign and called Mexicans rapists and criminals. Latino voters took note from day one. Gabriel R. Sanchez is a professor of political science at the University of New Mexico and principal at Latino Decisions.  Matt A. Barreto is a professor of Chicano studies and political science at UCLA and co-founder of Latino Decisions."
9	https://www.washingtonpost.com/news/volokh-conspiracy/wp/2016/11/07/why-i-cant-join-the-condemnation-of-trumps-allegedly-anti-semitic-ad/	Why I can’t join the condemnation of Trump’s allegedly anti-Semitic ad	"   Republican presidential nominee Donald Trump speaks during a campaign rally in October in Portsmouth, N.H. (Evan Vucci/Associated Press)  I can't think of any good reason Donald Trump hasn't denounced the overt anti-Semitism of some of his fervent supporters, or the online bullying and threatening of Jewish critics. Nevertheless, there seems scant evidence that Trump is personally anti-Semitic, and some to the contrary. Many fervent anti-Semites seem to adore Trump, but he hasn't returned the favor. Not everyone agrees, however, that the Trump campaign isn't intentionally stoking anti-Semitism. The Post's Dana Milbank, reflecting widespread criticism in progressive circles, writes: On Friday, [Trump] released a closing ad for his campaign repeating offending lines from that speech, this time illustrated with images of prominent Jews: financier George Soros (accompanying the words ""those who control the levers of power""), Fed Chair Janet Yellen (with the words ""global special interests"") and Goldman Sachs CEO Lloyd Blankfein (following the ""global power structure"" quote). The ad shows Hillary Clinton and says she partners ""with these people who don't have your good in mind."" I watched the ad when I first heard of the controversy, and while I can't logically rule out the possibility that someone intentionally chose to obliquely satisfy their anti-Semitic urges by including Yellen et al. in the ad, I found it hard to credit Milbank's claim that the ad shows that ""anti-Semitism is no longer an undertone of Trump's campaign. It's the melody."" Indeed, I doubt I would have noticed any potential anti-Semitic implications of the ad at all, had I not been alerted to them. First, and in contrast to almost every article I've read about the ad, suggesting that Jews were somehow featured, the Jews in the ad only appear for a total of about four seconds in a two-minute ad. Second, only Yellen and Soros are identified by name. I doubt 1 in 20 voters even knows who Yellen is, much less her ethnic background. Moreover, neither has a recognizably Jewish name -- if you were going for the anti-Semitic vote, why not use Clinton supporters far more well-known and identifiably Jewish, such as Steven Spielberg, Joe Lieberman, or even Sarah Silverman? I didn't know Yellen is Jewish. Third, Lloyd Blankfein is pictured, but not identified by name. How many voters would recognize Blankfein? I didn't. And how many of those know he's Jewish? Again, I didn't.    One Facebook friend suggested that the ad wasn't meant to appeal to the run-of-the-mill anti-Semite who doesn't know Yellen from a hole in the head, but to the hardcore white-supremacist types who keep track of important Jews and would even recognize Blankfein. But why waste your campaign's money with appeals to a group that likely numbers in the tens of thousands when there are literally millions of undecided voters still at large? Even more puzzling, why would you attack Jewish bankers to appeal to the best-informed segment of white supremacist extremists the same weekend you float the name of a Jewish banker, Steven Mnuchin, formerly of Blankfein's Goldman Sachs, as a possible Treasury secretary? Are the white supremacists supposed to be smart enough recognize Blankfein as a Jew, but not smart enough to know Mnuchin is a Jewish name, or to Google him? Of course, you might instead focus on this campaign ad, the focus of which is attacking Wall Street in general and the obviously Jewish-sounding Goldman Sachs in particular for ""rigging"" American politics.    Oops! That's a Bernie Sanders ad. Nor was this an anomaly, as Sanders's attacks on ""a handful of people on Wall Street [who] have extraordinary power over the economic and political life of our country"" were a mainstay of his campaign. While I disagree with the accusation in both instances, I can see the case that both Sanders's and Trump's ads played to varying degrees to latent anti-Semitic sentiment. I can't, however, understand how any political commentator, or ""defense"" organization such as the ADL, could call out Trump's alleged anti-Semitic ad after having been completely silent about Sanders's consistent attacks on Wall Street, Goldman Sachs and, in fact, Blankfein in particular. And yet if anyone influential who is now criticizing Trump also criticized Sanders for similar sins, I haven't been able to find it. Which makes one suspect that one's priors about Trump and Sanders are playing more of a role here than the objective content of their ads. As readers know, I despise Donald Trump. His campaign has often appealed to the worst instincts of the electorate. I hate to even write this post, lest it be seen as supportive of Trump. But judging by my Facebook feed, wildly exaggerated/double-standard criticism of Trump tempts a lot of reluctant conservatives to vote for Trump, as it reminds them of the unfairness all non-progressive politicians face from the establishment. So I think it's worth noting that there is no contradiction between being a NeverTrumper, and finding certain specific criticisms of Trump, including the one at issue here, to be exaggerated at best. DISCLOSURE: I'm voting for Gary Johnson.  "
