	Link	Title	Text
0	http://reuters.com/article/us-usa-election-westvirginia-idUSKBN12Y0Z9	Looking past vote, U.S. coal country sees millennials as key to revival	"


By Valerie Volcovici
| HUNTINGTON, WV

HUNTINGTON, WV When Carissa Sellards talks to her West Virginia University friends about post-graduation plans, one dilemma keeps coming up - whether to stay in their home state or strike out for more promising opportunities elsewhere.If recent history holds, over half of them will either not find work or leave the state, contributing to a brain drain of young talent that is pushing the state to try to reinvent its economy and break with a coal industry in long-term decline. ""Companies don't come here to invest because they only associate us with coal,"" said Sellards, a 20-year-old sophomore who addressed the state legislature when she was in high school about the lack of opportunities for young people in a post-coal economy.The often stark choices faced by Sellards and other young, educated West Virginians underline the challenges awaiting Democratic candidate Hillary Clinton here and in other ""Rust Belt"" states if she wins the Nov. 8 election, as most polls suggest she will.West Virginia is expected to vote decisively for Republican Donald Trump, who has gained in recent polls and promises to revive the coal industry and put miners back to work by easing environmental restrictions and renegotiating trade deals to America's advantage. It is a message that has resonated with millions of older voters in other Rust Belt states facing declines in manufacturing jobs and feeling threatened by foreign competition.    But it largely rings hollow for college-educated millennials like Sellards, who are seeking jobs in the service economy or technology sector.By contrast, Clinton alienated swathes of West Virginia voters by saying earlier this year that ""we're going to put a lot of coal miners and coal companies out of business"" in transitioning to cleaner energy. Coal industry backers have long accused President Barack Obama of waging a ""war on coal"" by imposing tougher environmental standards.Clinton later apologized for her comment, and has proposed a $30 billion plan to help revitalize coal communities. The plan promises to secure health benefits for former coal workers, invest in new infrastructure such as broadband access, and repurpose old mines and power plant sites.Clinton energy adviser Trevor Houser has said her challenge will be to help coal and other Rust Belt communities deal with economic realities rather than ""false promises"" of restoring dying industries.Beneath the nostalgic coal rhetoric, West Virginia officials and grassroots groups have quietly started to focus on reversing the flight of college-educated millennials to help drive an economic revival. Of the 124,358 students who graduated from public higher education in West Virginia in the last decade, 58,730 were working in the state in 2014, a work participation rate of 47.2 percent, according to a report released by West Virginia University's Bureau of Business and Economic Research on Monday. The state had the 11th biggest net outflow of college degree holders from 2007-2014, according to the most recent U.S. census. One barrier to keeping graduates in state is a business start-up rate that is the lowest in the country at 5.1 percent in 2014, the most recent year of available data.
A Reuters analysis of national data shows a strong connection between migration patterns of college graduates and local start-up rates: Among the 25 states with start-up rates below the 2014 median of 6.8 percent, 19 saw a net outflow of college grads between 2007 and 2014.The debate over West Virginia's economic future comes as its coal production this year hit its lowest level since the 1970s. West Virginia's energy sector, which includes coal, natural gas production and utilities, account for 17 percent of the state's GDP but only 4 percent of employment. Coal industry employment plunged 53 percent between the fourth quarter of 2011 and the second quarter of 2016, down from nearly 26,000 to just over 12,000. The government is the state's biggest employer, accounting for 20 percent of jobs, with healthcare a fast-growing sector at 17 percent. In 2014, West Virginia's real GDP grew 0.7 percent from the previous year compared to the national average of 2.2 percent. The state is one of a few whose population shrank over the past two years, according to the latest national census. By median age it is the second-oldest U.S. state, four years above the national average.    At the West Virginia University Institute of Technology's new campus in Beckley, which opened in August, close to some of the state's coal counties, officials hope to turn the struggling city into an innovation hub.
In addition to offering courses in burgeoning fields like computer science, sustainable tourism and health care, WVU Tech hosts the Launch Lab, a small business incubator that helps budding entrepreneurs bring ideas to fruition.Joe Carlucci, a small business coach and director of the LaunchLab, said West Virginia is at the start of a long process of reinvention after decades of mourning coal.""They are prepared to plant that seed and not see the shade of that tree,"" he said. ""They are seeing that we have to change our own story."" 
FEDERAL SUPPORT
Although Clinton would struggle to regain popularity in Rust Belt states if elected, these regions would have an incentive to work with her administration to tap into federal grants.West Virginia Republican Congressman Evan Jenkins, a member of the House appropriations committee who represents the state's southern coal-producing regions, said the state cannot turn down assistance to diversify its economy.
""I want to continue fueling grant-making opportunities to unleash the entrepreneurial spirit and energy of the state's millennials,"" he told Reuters at a ceremony in August in which federal grants were awarded.But unleashing that spirit will require a significant investment in infrastructure, specifically broadband access, something that local lawmakers ignored when coal was still performing well eight years ago, said Chris Walters, a 30-year old Republican state senator.  Walters is focused on getting legislation passed to expand broadband access throughout the mountainous state, which ranks near the bottom of the list of broadband connectivity, just ahead of Guam and Puerto Rico.""If we don't give connectivity to our residents, we aren't giving them the opportunity to succeed in the global economy,"" said Walters.In state capital Charleston, NGO Generation West Virginia has helped pass legislation to attract young entrepreneurs seeking low-cost alternatives to places like Denver or San Francisco, including a bill to waive business start-up fees to people under 30 and another to allow crowd-funding to help seed new businesses.Entrepreneurship also extends to industries like agriculture, which state officials see as an opportunity in the state's rural coal counties.An entrepreneurship program called the Coalfield Development Corporation won a $2 million grant this year to help train young people from coal counties to run businesses, offering them college classes, life skills and paid apprenticeships.Ben Gilmer, the 34-year-old director of the corporation's agriculture entrepreneurship program Refresh Appalachia, said part of Clinton's challenge in coal country will be to sell the vision of a future that is unfamiliar.Small programs like his can offer concrete examples and help ease the transition, he said.""Politicians take advantage of people's fear of what comes next,"" Gilmer said. ""But five years from now, we will have examples and that will speak louder than any rhetoric that's out there.""  (Reporting By Valerie Volcovici; additional reporting by Howard Schneider; editing by Stuart Grudgings)"
1	http://reuters.com/article/us-usa-election-rustbelt-idUSKBN12Y0ZN	In America's 'Rust Belt,' more voters trust Clinton on trade: Reuters/Ipsos poll	"


By Ginger Gibson
| WASHINGTON

WASHINGTON Republican presidential nominee Donald Trump's promise to restore American jobs by renegotiating international trade deals appears to be failing him in states most affected by outsourcing, according to a Reuters/Ipsos poll.Voters in Michigan, Ohio and Pennsylvania - three competitive states in the Nov. 8 election that form the bulk of a region dubbed the Rust Belt for its swaths of shuttered factories - favor Trump's Democratic rival, Hillary Clinton, on the issue of trade, according to the polling, with some respondents citing how international trade can bring down prices.The results underscore the uphill battle the New York businessman faces on Election Day, when he needs to sweep a broad array of battleground states to win the White House.""Trump has made a strong effort to portray Clinton as favorable to trade policies that he has labeled 'a disaster' for the United States,"" said Thomas Nelson, a political science professor at Ohio State University.        In the automaking state of Michigan, which has voted reliably for Democratic candidates in recent presidential elections but which Trump has fought hard to win, some 40 percent of likely voters believed Clinton would be better equipped to address trade, compared with 36 percent for Trump.In Ohio, known for its aerospace, steel and rubber industries, 45 percent said Clinton would be better on trade, compared with 38 percent for Trump. In Pennsylvania, long a steel and heavy manufacturing center, 45 percent favored Clinton on trade, compared with 38 percent for Trump, according to the polling, conducted in mid-October.Clinton is leading Trump in all three states among likely voters, with advantages of 4 points in Michigan, 3 points in Ohio and 6 points in Pennsylvania, according to the Reuters/Ipsos polling. But other polls show the race tightening in those states. RealClearPolitics, which averages data from most major polls, shows Clinton leading Trump by 6.6 points in Michigan and 5.1 points in Pennsylvania, and Trump leading Clinton by 2.7 points in Ohio.
Officials for Trump's campaign did not respond to a request for comment.'WHAT JOBS ARE YOU BRINGING BACK?'
Poll respondents reached by Reuters who favored Clinton on trade mainly gave two reasons - first, that international trade deals can help people by lowering prices for goods; and second, they doubt Trump can deliver on his promise to restore the U.S. manufacturing sector.""We all like to have inexpensive items,"" Ronald Lane, 56, of Canonsburg, Pennsylvania, who plans to vote for a third-party candidate next week as a protest against both Trump and Clinton.
""I think it's important to save American jobs which have already gone overseas, but I don't believe there is much that can be done to bring them back,"" he said.Christina Ledesma, of Grand Rapids, Michigan, a Clinton supporter, said she also disagreed with Trump that the economy would suffer a lasting negative effect from trade deals.""Our unemployment rate is lower than it's been since 2008. What jobs are you bringing back?"" she said.Michigan's unemployment rate was 4.6 percent in September, below the national average of 5 percent. Ohio's was at 4.8 percent and Pennsylvania's at 5.7 percent.
Trump has called the North American Free Trade Agreement with Canada and Mexico one of the worst deals ever struck and blames it for manufacturing jobs being moved to Mexico.He also opposes the Trans-Pacific Partnership, which would open markets in East Asia. Trump argues that the deal, which must be ratified by Congress, would motivate more U.S. companies to move their production overseas. Last week while campaigning, he called outsourcing ""the greatest job theft in the history of the world"". ""The jobs theft will end ... the day I start the presidency. It's going to be America first again,"" he said.Clinton has offered a more tempered approach, saying she would seek to re-evaluate NAFTA if elected and that there were problems with some aspects of the TPP.The Reuters/Ipsos poll was conducted online in English from Oct. 6 to Oct. 17 in Michigan and Pennsylvania, and from Oct. 6 to Oct. 12 in Ohio. It included 1,370 likely voters in Michigan, 1,467 in Pennsylvania, and 1,200 in Ohio. All three state polls had a credibility interval, a measure of accuracy, of 3 percentage points.     (Reporting by Ginger Gibson; Additional reporting by Alana Wise and Chris Kahn; Editing by Richard Valdmanis and Peter Cooney)"
2	http://reuters.com/article/us-usa-election-idUSKBN12X211	Trump, Clinton blast each other on character; Clinton rises in poll	"


By Amanda Becker and Emily Stephenson
| PENSACOLA, Fla./ LAS VEGAS

PENSACOLA, Fla./ LAS VEGAS Democrat Hillary Clinton and Republican Donald Trump attacked one another's character as they pushed their closing arguments six days before the U.S. presidential election, while the latest Reuters/Ipsos poll showed Clinton's lead over Trump rising back to the margin she held last week.Many national polls have shown Clinton's lead over Trump narrowing since the re-emergence Friday of a controversy over her use of a private email while secretary of state.But the latest Reuters/Ipsos daily tracking poll released on Wednesday showed Clinton's lead over Trump rising back up to 6 percentage points, the same advantage she held before the FBI announcement related to her email practices. Signs of a tightening race have rattled financial markets as investors started to factor in the possibility that the New York businessman might pull off a victory on Nov. 8.World stocks, the dollar and oil fell on Wednesday, while safe-haven assets such as gold and the Swiss franc rose. Clinton has been regarded as the candidate who would maintain the status quo, an important factor to financial markets, which generally do not like uncertainty.Campaigning in Pensacola, Florida, Trump predicted he would win, telling supporters at the outdoor rally, ""It's feeling like it already, isn't it?""We've got to be nice and cool, nice and cool. Alright, stay on point, Donald, stay on point. No sidetracks, Donald, nice and easy,"" said Trump, whose campaign has at times been damaged by controversial unscripted remarks.Trump argued that Clinton was unqualified to lead the country, calling her ""totally unhinged.""Speaking to supporters in Las Vegas, Clinton blamed Trump for pitting Americans against one another, citing his rhetoric on groups like Muslims and Mexican-Americans. Trump, she said, is ""out of his depth,"" and she called his proposals on foreign policy issues ""incredibly dangerous.""
""He doesn't have a clue,"" Clinton said. Investor anxiety has deepened in recent days over a possible Trump victory given uncertainty about his stance on issues including foreign policy, trade relations and immigrants.Trump, who has never previously run for elected office, has run an unorthodox campaign, with policy proposals including reviewing trade pacts such as the North American Free Trade Agreement and imposing a temporary ban on Muslims seeking to enter the country.Currency traders have sold the dollar this week in part because they suspect Trump would prefer a weaker dollar given his protectionist stance on international trade, and in part because the uncertainty surrounding a Trump win might lead to a more dovish stance from the Federal Reserve in the months ahead, instead of the interest rate hike that many expect by year-end. A rise in U.S. interest rates would make the dollar, and dollar-denominated assets, more attractive to investors.A Reuters equity market poll last month showed a majority of forecasters predicted that U.S. stocks would perform better under a Clinton presidency than a Trump administration.
An average of polls compiled by the RealClearPolitics website showed Clinton just 1.7 percent ahead of Trump nationally on Wednesday, with 47 percent support to his 45.3 percent.ELECTORAL MATH
Clinton's position is stronger than national polls imply given that the race is decided by the Electoral College system of tallying wins on a state-by-state basis. Winning the presidency requires a majority of 270 electoral votes, and Democrats have a built-in advantage with large states such as California and New York traditionally voting Democratic. Clinton looked likely to win at least 226 electoral votes, meaning she would need to pick up votes in ""toss-up"" states such as Florida, North Carolina, Virginia, Ohio, Iowa, Arizona, Colorado and Nevada, according to estimates by RealClearPolitics on Wednesday afternoon.
Trump, on the other hand, has a steeper path to climb, looking likely to win 180 electoral votes, meaning he needs more votes from the battleground states, the website showed.Both candidates are focusing their final campaign efforts on those crucial states.Trump and Clinton have campaigned intensively in recent weeks in Florida, which yields a rich haul of 29 electoral votes. A RealClearPolitics average of polls in the state puts Trump 0.7 point ahead of Clinton. In North Carolina on Wednesday, Clinton deployed President Barack Obama to make the case that Trump posed a unique threat to the future of the country. ""The fate of the republic rests on your shoulders,"" Obama told supporters in Chapel Hill, calling Trump temperamentally unfit to lead the nation.Trump's campaign announced plans to run three ads during Wednesday night's Game Seven of the World Series, held in Cleveland, Ohio's second biggest city. The ads focus on the renewed controversy surrounding Clinton's email server.In an ad titled ""Corruption,"" an announcer says: ""Hillary cut deals for donors. Now the FBI has launched a new investigation. After decades of lies and scandal, her corruption is closing in."" (Additional reporting by Doina Chiacu and Steve Holland in Washington, Jamie McGeever in London, Saqib Iqbal Ahmed in New York; Writing by Frances Kerry and Alana Wise; Editing by Alistair Bell and Leslie Adler)"
3	http://reuters.com/article/us-usa-china-trade-semiconductors-idUSKBN12Y0EG	U.S. Commerce chief warns against China semiconductor investment binge	"


By David Lawder
| WASHINGTON

WASHINGTON Massive government investment in China's semiconductor industry risks distorting the global market for integrated circuits, leading to damaging overcapacity and stifling innovation, U.S. Commerce Secretary Penny Pritzker has warned.     The comments come at a time of growing trade tension between the Asian giant and the United States over accusations of dumping, industrial overcapacity and a souring business climate for foreign firms doing business in China. Republican presidential candidate Donald Trump has threatened to levy punitive tariffs of 45 percent on imports of Chinese goods if he is elected.In a speech on Wednesday, Pritzker sharply criticized a $150-billion plan by the Chinese government to expand the share of Chinese-made integrated circuits in the domestic market to 70 percent by 2025, from 9 percent now.""Let me state the obvious: this unprecedented state-driven interference would distort the market and undermine the innovation ecosystem,"" Pritzker said at the Center for Strategic Studies think-tank in Washington. That level of investment would be equivalent to half of worldwide semiconductor sales last year and result in market distortions similar to those plaguing the steel, aluminum and green technology industries, Pritzker added.      ""The world has seen the effects of this type of targeted, government-led interference before,"" she said.
""The result has been overcapacity in the global marketplace that has artificially reduced prices, cost jobs in both the United States and around the world, and caused significant damage to those industries globally,"" Pritzker said. It was ""imperative we take steps to prevent a similar situation from developing in the semiconductor industry,"" she added. Such steps include a Commerce Department study of the global semiconductor supply chain now underway, besides engaging with China, and other governments, to persuade them to avoid policies that distort markets or spur technology transfers.""The U.S. government will make clear to China's leaders at every opportunity that we will not accept a $150-billion industrial policy designed to appropriate this industry,"" Pritzker added.
Chinese Foreign Ministry spokeswoman Hua Chunying said that China advocates for all countries to provide a fair and transparent investment environment.""We hope everyone can rationally view relevant trade and investment cooperation and work together to create a positive atmosphere,"" she told reporters at a regular briefing when asked about Pritzker's remarks.China's Ministry of Commerce did respond immediately to a request for comment. 
Earlier on Thursday, 12 U.S. senators urged that Zhongweng International's $2.3-billion purchase of Cleveland, Ohio-based Aleris Corp. be rejected by a national security review panel.""In addition, we are seeing new attempts by China to acquire companies and technology based on their government's interests - not commercial objectives. And we have witnessed attempts to restrict access to China's domestic market,"" Pritzker said.The technology industry depends on a global supply chain, open and fair trade and innovation, she said, warning against government behavior that disrupts the system and distorts markets.""China's effort to move up the value chain should be the result of healthy competition and free and fair trade, not state-directed investments aimed at distorting global markets,"" Pritzker said.""In addition, no government should require technology transfer, joint-venture, or localization as a quid pro quo for market access.""  (Reporting by David Lawder; Additional reporting by Michael Martina in Beijing; Editing by Clarence Fernandez and Simon Cameron-Moore)"
4	http://reuters.com/article/us-usa-china-aluminum-idUSKBN12Y03I	Twelve U.S. senators urge security rejection of China aluminum M&A deal	"


By David Lawder
| WASHINGTON

WASHINGTON Twelve U.S. senators urged on Wednesday that a national security review panel reject Chinese aluminum giant Zhongwang International Group Ltd's proposed $2.3 billion purchase of U.S. aluminum products maker Aleris Corp.The senators asked Treasury Secretary Jack Lew in a letter to launch a review of the deal by the Committee on Foreign Investments in the United States and ""ultimately reject it"" on grounds that it would damage the U.S. defense industrial base. ""Zhongwang's purchase of Aleris would directly undermine our national security, including by jeopardizing the U.S. manufacturing base for sensitive technologies in an industry already devastated by the effects of China's market distorting policies, and creating serious risk that sensitive technologies and knowhow will be transferred to China, further imperiling U.S. defense interests,"" the senators wrote.The deal, announced just over two months ago, would give one of the world's largest makers of extruded aluminum products access to U.S. technology and customers, which include Boeing Co and U.S. and European automakers that are increasingly turning to aluminum.It comes as another Zhongwang subsidiary is embroiled in a dispute over U.S. import duties amid broader trade tensions between the U.S. aluminum industry and China.
The U.S. Commerce Department is currently investigating China Zhongwang Holdings Ltd over allegations that it has been evading U.S. import duties on extruded products by shipping them through third countries.The letter to Lew was signed by Republican Rob Portman of Ohio, where Aleris is based, and Democrats Ron Wyden, Charles Schumer, Bob Casey, Joe Manchin, Kirsten Gillibrand, Joe Donnelly, Debbie Stabenow, Jeff Merkley, Amy Klobuchar, Tammy Baldwin and Al Franken.They said the review committee needed to be cautious about the potential for sensitive research data to be transferred to China, including data with military applications such as advanced modeling techniques, high-strength alloys and the design of light armor material.
""Despite the national security importance of our nation's aluminum sector, the industry continues to be decimated by China's market distorting policies that contribute to vast overcapacity,"" the senators wrote.""China's overcapacity in aluminum has directly contributed to severe reductions in U.S. domestic production as smelters unable to compete have been forced to close. Each such closure further imperils our nation's ability to ensure a reliable supply of strategic materials in times of crisis,"" they wrote.A Treasury spokeswoman declined to comment on the letter, adding that information filed with CFIUS by law cannot be disclosed to the public and that Treasury does not comment on specific CFIUS cases.
Aleris said in a statement reacting to the letter that the company's U.S. facilities produce no defense-related products, and the technology for aluminum plate used in some defense products was widely used in the industry.""Our facilities in the U.S. produce aluminum for car and truck exteriors, gutters and roofing material,"" Aleris said. "" Less than one percent of our sales go into defense applications, and none of those goods are produced in the U.S.""A Zhongwang spokeswoman said in a statement that the CFIUS filing for the transaction is voluntary and that the company and its U.S. subsidiary have no connection with the Chinese government. She added that the transaction will bring in additional resources and capital to Aleris and there will be no changes to management, employees or business strategies. (Additional reporting by Josephine Mason in Beijing; Editing by Leslie Adler and Muralikumar Anantharaman)"
