	Unnamed: 0	Link	Title	Text	Terms	Topics
5	5	http://reuters.com/article/us-usa-election-idUSKCN1242A2	Clinton hits Trump over comments on women ahead of vice presidential debate	"


By Amanda Becker
| HAVERFORD, Pa.

HAVERFORD, Pa. Democrat Hillary Clinton slammed Republican Donald Trump on Tuesday for making disparaging comments about women's physical appearance, accusing Trump of taking the issue of female body image ""to a new level of difficulty and meanness.""Hours before vice presidential candidates Tim Kaine and Mike Pence face off in Virginia in their sole debate, Clinton urged women at an event in the Philadelphia suburbs billed as a ""family town hall"" to stand up to online bullying about how they look.""It's shocking when women are called names and judged solely on the basis of physical attributes,"" the Democratic presidential nominee said in response to a 15-year-old girl's question about the problem of body image and the ""damage Donald Trump does"" when he talks about how women look.""My opponent insulted Miss Universe,"" Clinton said, resurrecting her Republican rival's comments last week about former beauty queen Alicia Machado's weight gain after she won the Miss Universe contest in 1996.""I mean, how do you get more acclaimed than that? But it wasn't good enough,"" Clinton said. ""We can't take any of this seriously anymore. We need to laugh at it. We need to refute it.""Clinton, the first woman to be nominated for the presidency by a major U.S. party, has rushed to capitalize on Trump's public feud with Machado, whom he once called ""Miss Piggy"" because of her weight gain, and make inroads with women voters five weeks before the Nov. 8 election.Clinton's and Trump's running mates, Democrat Kaine, a U.S. senator, and Republican Pence, governor of Indiana, will meet in a debate in Farmville, Virginia, starting at 9 p.m. on Tuesday (0100 GMT on Wednesday.) The debate will provide voters their first extended chance to evaluate the No. 2's in the White House race and is the only showdown between the vice presidential candidates. Trump and Clinton will meet in their second debate on Sunday.Pence could find himself frequently on the defensive about Trump, a New York businessman who has been dealing with a torrent of bad news in the past week.
That includes a New York Times report that Trump took an almost $1 billion loss in 1995 that may have allowed him to avoid paying federal income taxes for up to 18 years. While Democrats have slammed him over the report, Trump, who made much of his business acumen on the campaign trail, has said he ""brilliantly used"" U.S. tax rules to his advantage to limit his tax bills.Clinton disagreed, telling reporters on Tuesday it showed ""unequivocally"" that Trump was a failure at business for losing $1 billion to begin with.A Reuters/Ipsos opinion poll released on Tuesday said 67 percent of Americans believed it was ""selfish"" for a presidential candidate to pay no taxes, although 46 percent thought a candidate who paid no taxes was ""smart.""'HARMFUL COMMENTS'

Clinton also criticized Trump for appearing to suggest on Monday that veterans suffering from post-traumatic stress were not strong enough to handle the stress of war. Trump and his campaign said his words were taken out of context.""When people come back from war and combat, and they see things that maybe a lot of folks in this room have seen many times over - and you're strong and you can handle it - but a lot of people can't handle it,"" Trump told a veterans group on Monday.Clinton said troops deserved a commander in chief who understood their sacrifice.""Donald Trump's comments are not just ignorant, they are harmful because they give voice to the stigma that has led generations of veterans to hide their struggles instead of getting lifesaving help,"" she said.
On the campaign trail on Tuesday, Trump met with about a dozen energy executives in Denver, querying them mainly about their concerns about regulations he said had ""gotten out of control.""John Harpole, chief executive of Mercator Energy, said he did not understand why the Obama administration's response to the shale boom and Clinton's energy positions had not come up during the first presidential debate last week.Others told Trump they faced more immediate concerns with state-level regulators. Scott Stewart of Gilbert-Stewart Operating said his company had largely moved operations to Kansas because of stiff rules in Colorado.Trump also reveled in comments on Monday by Clinton's husband, former President Bill Clinton, who said small-business people and people who make too much to get federal subsidies to help with insurance payments were ""getting killed"" by the federal healthcare law known as Obamacare.Trump has promised to repeal Obamacare, while Hillary Clinton has praised it but said she would work to improve aspects of it.""I bet he went through hell last night, can you imagine?"" Trump said of Bill Clinton during a rally in Prescott, Arizona. ""He went through hell, but honestly there have been many nights when he has gone through hell with Hillary.""Clinton has led Trump in national opinion polls in recent months. On Tuesday, an average of polls aggregated by RealClearPolitics website showed her with 48.1 percent of support compared with Trump's 44.3 percent. (Writing by John Whitesides; Additional reporting by Emily Stephenson in Colorado and Chris Kahn in New York; Editing by Frances Kerry and Peter Cooney)"	['Kaine', 'Clinton', 'Trump', 'Pence', 'Stewart', 'Obama']	['healthcare']
6	6	http://reuters.com/article/us-usa-election-illinois-idUSKCN12502O	Same-day voter registration temporarily reinstated in Illinois	"

An Illinois law allowing voters in highly populated areas to register to vote at polling places on election day was reinstated on Tuesday by a federal court, pending an appeal of a ruling declaring the statute unfair to people in smaller communities.The state is seeking to overturn a ruling by U.S. District Court Judge Samuel Der-Yeghiayan, which found that the law discriminates against voters in less-populated counties.The law, passed in late 2014 by the Democratic-led legislature and signed into law in early 2015 by former Democratic Governor Pat Quinn, allowed election day voter registration for the first time, including at polling places.But the section of the law regarding polling place registration pertained only to counties with populations of 100,000 or more.
The conservative Liberty Justice Center, of Chicago, filed a lawsuit in August, saying the law was discriminatory. Der-Yeghiayan agreed, writing that the law provided an advantage to urban voters over their rural counterparts. The state of Illinois appealed the ruling last month, and in their order issued Tuesday, a three-judge panel of the U.S. Court of Appeals for the Seventh Circuit granted the state's request to stay the order until the appeal was adjudicated, court records show.
U.S. voters will go to the polls to choose a president, Congressional representatives and other officials on Nov. 8. On Tuesday, the appellate court ordered attorneys on both sides to say by Thursday whether they would like the appeals process to be sped up due to the proximity of the election.
 (Reporting by Sharon Bernstein; Editing by Lisa Shumaker)"	[]	[]
7	7	http://reuters.com/article/us-usa-tax-inversions-idUSKCN1242FN	Proposed U.S. anti-inversion rules enter final review	"


By David Morgan
| WASHINGTON

WASHINGTON U.S. regulations, proposed by the Treasury to crack down on companies that try to reduce taxes by rebasing abroad, have begun a White House review and could be finalized shortly, officials said on Tuesday.The regulations, which would make it difficult for U.S. business operations to avoid taxation while shifting profits overseas through a practice called ""earnings stripping,"" were received by the White House Office of Management and Budget (OMB) last week. The agency has up to 90 days to decide whether the rules should be finalized or returned to Treasury for further consideration.""We are satisfied we have addressed stakeholder feedback and are close to issuing final earnings stripping regulations,"" a Treasury spokesperson said.
The Obama administration has faced widespread criticism from the business community over its regulatory assault on tax inversions, which are tax-driven mergers in which a U.S. company acquires a smaller, foreign business in a low-tax country and shifts its headquarters there, if only on paper, to avoid higher U.S. taxes.   Business and industry groups have threatened lawsuits and called for the new rules to be withdrawn or heavily revised because of what critics say is the potential for unintended harm to business. Members of Congress have also accused the administration of overstepping its legal authority.
Earnings stripping occurs when an inverted company eludes U.S. taxes on its domestic operation by shifting profits overseas in the form of tax-deductible interest payments to its foreign parent. The new rules would change certain interest payments into equity dividends, which are not tax deductible in the United States. 
The regulations were proposed in April, along with a temporary rule to prevent serial inversion deals by foreign companies. That rule, which is already the target of a lawsuit, has not yet been forwarded to OMB. (Reporting by David Morgan; Editing by Cynthia Osterman)"	['Obama']	[]
8	8	http://reuters.com/article/us-usa-election-poll-idUSKCN1242FH	Trump calls tax avoidance 'smart,' most Americans call it 'unpatriotic': poll	"


By Chris Kahn
| NEW YORK

NEW YORK Republican presidential nominee Donald Trump says paying no income tax would make him ""smart."" While nearly half of Americans agree with him, more people think it is ""selfish,"" and ""unpatriotic,"" according to a Reuters/Ipsos opinion poll released on Tuesday. Some 67 percent of Americans said it is ""selfish"" for a presidential candidate to pay no taxes, while 61 percent said it is ""unpatriotic,"" according to the poll, which allowed respondents to pick more than one adjective to describe paying no taxes.At the same time, the results showed some respect for a candidate who can figure out how to reduce their tax bill. Some 46 percent of Americans, including 35 percent of Democrats and 62 percent of Republicans, thought a presidential candidate who pays no taxes is ""smart.""Trump's taxes have become a big campaign issue after the New York Times released a portion of his 1995 tax returns last week and estimated that Trump likely paid no taxes for a number of years. The celebrity real estate developer, who is the first presidential candidate in decades to refuse to release his full tax returns, didn't deny the report. He later said that he had ""brilliantly used"" U.S. tax rules to his advantage. During the first presidential debate with his rival Democrat Hillary Clinton last month, Trump responded to Clinton's allegation that he paid no federal taxes by saying that would make him ""smart."" 
""What is he trying to say: that those of us who pay taxes aren't intelligent?"" said poll respondent Yonna McNerney, 41, of Denver. ""I started working at the age of 16, and I've always paid taxes,"" she said. ""Not paying taxes, I don't think that's acceptable.""McNerney, a mother of three who works at a telecommunications company, remains uncommitted in the race and said Trump's comments about taxes haven't changed her mind one way or the other.April St. Aoro, 46, who works for a manufacturing firm near St. Cloud, Minnesota, was more understanding of Trump's point of view, though she also remains undecided in the race.
""I think all of us are trying to pay as little taxes as possible,"" St. Aoro said.Respondents were slightly less critical when asked to describe a private citizen paying no taxes.Some 64 percent agreed it was ""selfish,"" while just over half agreed it was ""unpatriotic."" Some 50 percent, including 37 percent of Democrats and 67 percent of Republicans, agreed that it was ""smart.""
The Reuters/Ipsos poll was conducted online in English in all 50 states. Respondents were asked what they thought of ""a private citizen who has found a way to pay no income taxes,"" and given the choice to agree or disagree to the words ""smart,"" ""selfish,"" and ""unpatriotic."" They were then asked the same set of questions about a presidential candidate.The Sept. 28-Oct. 3 poll was part of a larger national tracking poll that tracks public opinion every day. It included 1,948 American adults, including 893 Democrats and 635 Republicans. It has a credibility interval, a measure of accuracy, of 3 percentage points for the entire sample, 4 percentage points for Democrats only and 5 percentage points for Republicans. (Editing by Richard Valdmanis and Ross Colvin)"	['Clinton', 'Trump', 'Ross']	[]
9	9	http://reuters.com/article/us-usa-election-trump-taxes-idUSKCN1232E3	Trump says he 'brilliantly' used U.S. tax laws	"


By Emily Stephenson
| PUEBLO, Colo.

PUEBLO, Colo. Republican presidential nominee Donald Trump said on Monday he ""brilliantly used"" U.S. tax rules to his advantage in trying to limit the amount he paid in taxes, arguing it helped him survive a difficult period in the real estate market.""I was able to use the tax laws of this country and my business acumen to dig out of the real estate mess ... when few others were able to do what I did,"" Trump told a crowd in Pueblo, Colorado.It was Trump's first extended comments since a New York Times report said he had claimed a $916 million loss on his 1995 tax returns, which experts said might have allowed him to avoid paying federal income taxes for 18 years. Hillary Clinton, the Democratic nominee for the Nov. 8 election, has seized on the report, arguing the tax records undercut Trump's business acumen. ""What kind of genius loses a billion dollars in a single year? This is Trump to a T, he's taken corporate excess and made a business out of it,"" Clinton told a rally in Toledo, Ohio, on Monday.
Clinton has repeatedly called on Trump to release his full returns, as presidential candidates have done in the past. Trump was dismissive of the Times' story in his Pueblo remarks, saying the media was ""obsessed with an alleged tax filing from the 1990s.""
The Trump campaign has not said, however, that the Times' story was inaccurate. Instead, his supporters, including former New York Mayor Rudy Giuliani and New Jersey Governor Chris Christie have contended that Trump's aggressive use of provisions under U.S. law to minimize his tax liability was evidence of his ""genius"" as a businessman and real estate investor.Trump picked up on that theme on Monday. ""I have brilliantly used those laws,"" he told the crowd in Pueblo.The flap over Trump's taxes comes during what has been a difficult stretch for the candidate, who faced criticism for his performance in the Sept. 26 debate against Clinton and his subsequent public spat with former Miss Universe Alicia Machado.
A Reuters/Ipsos online poll last week showed a majority of Americans felt Clinton won the debate, the first of three scheduled between the candidates..On Monday, the state of New York ordered Trump's charity, the Trump Foundation, to suspend raising money amid a probe into its activities. (Additional reporting by Amanda Becker; Editing by Peter Cooney)"	['Clinton', 'Trump', 'Christie']	[]
