	Link	Title	Text
8	http://reuters.com/article/us-illinois-budget-idUSKCN0Y32VQ	Illinois lawmakers approve $700 million to pay social services in part	"

CHICAGO A bill to send $700 million to cash-starved social services providers breezed through the Illinois Legislature on Thursday, as the state once again turned to stopgap funding measures in lieu of a budget.The measure passed the House 111-0 and the Senate 56-0. There was no immediate comment from Governor Bruce Rauner's office on whether he will sign it into law. A memo from his budget office expressed concerns that language in the bill could actually prevent funding for some programs.Democratic State Representative Greg Harris said the money would be taken from state funds outside of Illinois' general revenue fund to cover 46 percent of what the state has failed to pay service providers due to the ongoing impasse over the fiscal 2016 budget.""This is a $700 million piece of legislation that would help the neediest at the time they need help the most,"" he said.Despite the stalemate between the Republican governor and Democrats who control the legislature, about 90 percent of Illinois government is being funded through continuing appropriations, the enactment of a K-12 school bill, and court-ordered spending.
But some parts of the government were left out in the cold. Earlier this month, dozens of unpaid social service providers sued Illinois, seeking more than $100 million. Andrea Durbin, chairman of the Pay Now Illinois coalition that filed the lawsuit, said that if enacted, the bill would not end the litigation.""It could provide a downpayment of the money we are owed, but it's not a comprehensive solution for the Pay Now Illinois plaintiffs,"" she said.
In April, the legislature passed and Rauner signed a $600 million stopgap funding bill for state universities, community colleges, and student tuition grants that covered only 34 percent of the $1.7 billion that had been earmarked for higher education spending in the fiscal year that began on July 1.Illinois is the only U.S. state without a complete fiscal 2016 budget. Rauner earlier on Thursday acknowledged that some lawmakers are working on a budget framework. That framework involves higher taxes, spending cuts, and borrowing, according to local media reports. 
""I'm cheering for bipartisan General Assembly members to come up with some solutions,"" the governor told reporters. (Reporting by Karen Pierog; Editing by Matthew Lewis)"
9	http://reuters.com/article/us-nuclear-disarmament-douglas-idUSKCN0Y32PY	Michael Douglas urges Obama to think of his legacy at Hiroshima	"


By Tom Miles
| GENEVA

GENEVA Hollywood actor Michael Douglas, a U.N. ""messenger for peace"", wants President Barack Obama to issue a strong message against nuclear weapons when he visits Hiroshima in Japan later this month.Douglas told reporters at the United Nations in Geneva, where nuclear negotiations have been stuck for 20 years, that the nuclear danger was greater than during the Cold War,  largely due to a ""huge escalation"" in U.S.-Russia tensions and increasing recklessness in their close-quarter contacts.""There's this kind of crazy tension between U.S. and Russia. We have our issues but I don't quite see that all of this posturing is helping anybody,"" he said.""The number of weapons that are on trigger alert is frightening. So the time for somebody to possibly make a mistake and correct it is very very short.""
Douglas said he ""found religion"" in the anti-nuclear cause after the Three Mile Island nuclear accident in 1979, within days of the opening of his film The China Syndrome, which dealt with an emergency at a nuclear plant.  Standing beside Joseph Cirincione, president of Ploughshares Fund, a global security organization, Douglas recalled Obama's 2009 speech in Prague, where the president promised concrete steps to wards a nuclear-free world.""I think we could say he's been a disappointment because there's not been follow through, and I do hope now for his legacy as he begins to leave office, that he's going to have something strong to say at Hiroshima.""
Cirincione said Obama had made good early progress on nuclear non-proliferation, but had made only modest cuts in arsenals and was leaving $1 trillion in new nuclear contracts in the pipeline for his successor.""Every single weapon in the nuclear arsenal is now due for replacement or an upgrade. It's a looming disaster,"" he said.
Douglas, 71, said he was also a friend of Donald Trump, but he was not confident the United States would make any advances in nuclear disarmament if Trump won the presidency. ""I guess one of his strengths, or weaknesses depending how you look at it, is his unpredictability,"" he said. (Reporting by Tom Miles; Editing by Dominic Evans)"
