	Link	Title	Text
5	http://reuters.com/article/us-usa-election-mississippi-idUSKBN12X1Y2	Mississippi church burned, vandalized with 'Vote Trump'	"


By Therese Apel
| JACKSON, Miss.

JACKSON, Miss. A historic black church in Mississippi was burned and spray-painted with ""Vote Trump"" and authorities said on Wednesday it was arson and being probed as a hate crime committed one week before the U.S. presidential election.Greenville Fire Chief Ruben Brown Sr. told a news conference on Wednesday afternoon that investigators had determined the fire at Hopewell Missionary Baptist Church was ""intentionally set.""""Samples and evidence have been collected from inside the church and are being analyzed to determine the accelerant or ignition source,"" Brown said.Earlier in the day he said no one was injured in the Tuesday evening blaze, but the church was extensively damaged. ""We're investigating this as a hate crime,"" Greenville Police Chief Delando Wilson told a news conference early on Wednesday. ""We feel that the quote on the church is intimidating.""It tries to push your beliefs on someone else, and this is a predominantly black church and no one has a right to try to influence the way someone votes in this election.""
Wilson told the Wall Street Journal that police on Wednesday evening were interviewing a ""person of interest"" in connection with the fire but the individual had not been charged.Wilson did not immediately return a call or email. Black churches in the U.S. South have long been a base of support for the Democratic Party. During the U.S. civil rights movement of the 1950s and 1960s, southern black churches were often targets for arson and bombings by white supremacists.
""The FBI Jackson Division is aware of the situation in Greenville, and we are working with our local, state and federal law enforcement partners to determine if any civil rights crimes were committed,"" the agency said in a statement.""This act is a direct assault of people's right to freely worship,"" Greenville Mayor Errick Simmons said in a statement. The town of some 33,000 people is about 100 miles (160 kms) northwest of Jackson.
""The act that happened left our hearts broken,"" Pastor Carolyn Hudson told the news conference, noting that the church has a 111-year history.The Mississippi Republican Party declined to comment. In October, the Orange County Republican Party's office in Hillsborough, North Carolina, was set on fire and a graffiti message left nearby said ""leave town or else.""No arrests have been made in that incident, which Indiana Governor Mike Pence, the Republican vice presidential candidate, called ""political terrorism.""  (Additional reporting by Alex Dobuzinskis in Los Angeles, Writing by Jon Herskovitz; Editing by Alistair Bell and Toni Reinhold)"
6	http://reuters.com/article/us-usa-election-militia-idUSKBN12X11R	U.S. militia girds for trouble as presidential election nears	"


By Justin Mitchell and Andy Sullivan
| JACKSON, Ga.

JACKSON, Ga. Down a Georgia country road, camouflaged members of the Three Percent Security Force have mobilized for rifle practice, hand-to-hand combat training -- and an impromptu campaign rally for Republican presidential candidate Donald Trump.""How many people are voting for Trump? Ooh-rah!"" asks Chris Hill, a paralegal who goes by the code name ""Bloodagent.""""Ooh-rah!"" shout a dozen militia members in response, as morning sunlight sifted through the trees last weekend.As the most divisive presidential election in recent memory nears its conclusion, some armed militia groups are preparing for the possibility of a stolen election on Nov. 8 and civil unrest in the days following a victory by Democrat Hillary Clinton.They say they won't fire the first shot, but they're not planning to leave their guns at home, either.Trump's populist campaign has energized militia members like Hill, who admire the Republican mogul's promise to deport illegal immigrants, stop Muslims from entering the country and build a wall along the Mexico border. Trump has repeatedly warned that the election may be ""rigged,"" and has said he may not respect the results if he does not win. At least one paramilitary group, the Oath Keepers, has called on members to monitor voting sites for signs of fraud.
Armed paramilitary groups first gained prominence in the early 1990s, fueled by confrontations in Ruby Ridge, Idaho and Waco, Texas, culminating in a militia sympathizer's 1995 bombing of a federal office building in Oklahoma City that killed 168 people.Their numbers dwindled following that attack but have spiked in recent years, driven by fears that President Barack Obama will threaten gun ownership and erode the power of local government. The Southern Poverty Law Center, which tracks extremist groups, estimates there were 276 active militias last year, up from 42 in 2008.In recent years, armed groups have confronted federal authorities in a series of land-use disputes in the western United States. Federal officials fear more clashes could come after seven militants were acquitted on conspiracy charges for occupying a federal wildlife refuge in Oregon.
Many fear Clinton would push the county further to the left.""This is the last chance to save America from ruin,"" Hill said. ""I'm surprised I was able to survive or suffer through eight years of Obama without literally going insane, but Hillary is going to be more of the same."" EXTREMIST GROUPS EMBOLDENED
The Oath Keepers, a prominent anti-government force that sent gun-toting members to the 2014 race riots in Ferguson, Missouri, called on members last week to monitor voting sites on election day for any signs of fraud.
An hour south of Atlanta, the Three Percent Security Force started the day around the campfire, taking turns shooting automatic pistols and rifles at a makeshift target range. They whooped with approval when blasts from one member's high-powered rifle knocked down a tree.The group operates independently, but is affiliated with a national armed movement that calls for members to defend individual rights in the face of what they see as an overreaching federal government. The movement draws its name from the notion that no more than 3 percent of the American population fought in the Revolutionary War against Britain.Amid the war games, Hill weighed plans for a possible armed march on Washington if Clinton wins.He said he doesn't want his members leading the way, but they will defend the protesters if need be. His group will not hesitate to act if a President Clinton tries to disarm gun owners, he said.
""I will be there to render assistance to my fellow countrymen, and prevent them from being disarmed, and I will fight and I will kill and I may die in the process,"" said Hill, who founded the militia several years ago.Trump's candidacy has emboldened extremist groups to speak more openly about challenging the rule of law, said Ryan Lenz, a researcher at the Southern Poverty Law Center.""Prior to this campaign season, these ideas were relegated to sort of the political fringe of the American political landscape,"" he said. ""Now these ideas are legitimized.""Over the past week, some prominent Trump supporters have hinted at violence.    ""If Trump loses, I'm grabbing my musket,"" former Illinois Representative Joe Walsh wrote on Twitter last week. Conservative commentator Wayne Root fantasized about Clinton's death while speaking at a Trump rally in Las Vegas on Sunday.Back in Georgia, the Three Percent Security Force wrapped up rifle practice in the midday sun. They then headed further into the trees to tackle an obstacle course with loaded pistols at their sides, ready for whatever may come.""We've building up for this, just like the Marines,"" he said. ""We are going to really train harder and try to increase our operational capabilities in the event that this is the day that we hoped would never come."" (Editing by Stuart Grudgings)"
7	http://reuters.com/article/us-usa-election-weiner-idUSKBN12Y006	Anthony Weiner checks into sex addiction rehab clinic: Daily Mail	"

Disgraced former U.S. Representative Anthony Weiner has checked into a rehab facility that treats sex addiction, the DailyMail.com reported on Wednesday.The online version of the British newspaper said electronic devices are banned at the facility, which separates men from women and treats a range of addictions related to cyber sex, exhibitionism and anonymous sex and other acts. The facility was not named in the report.Reuters could not independently verify the report. Weiner could not be reached for comment.Federal prosecutors and New York police announced last month they were investigating Weiner following a separate report by the DailyMail.com that he engaged in sexually explicit cellphone and online messages with a 15-year-old girl from North Carolina.Weiner, 52, did not respond at the time to Reuters' requests for comment on the texting report but told the Associated Press last month that he had ""likely been the subject of a hoax.""
An investigation into those messages also triggered a new FBI probe of Democratic presidential candidate Hillary Clinton's emails, as some of her emails were found on a device related to the Weiner investigation, sources close to the matter said.Once a popular congressman, Weiner resigned in 2011 after saying he had accidentally sent a lewd picture over Twitter. Two years later, his campaign for New York City mayor was derailed after explicit photos he had sent under the pseudonym ""Carlos Danger"" to a young woman in Indiana surfaced.
Weiner's wife, Huma Abedin, one of Clinton's top aides, said in August she was separating from her husband after yet another scandal.Abedin's announcement followed a New York Post report that Weiner had recently sent photos of his boxer-brief-clad genitals - one while he was in bed with their toddler son - via Twitter to another woman.
An attorney for Abedin could not be reached on Wednesday to comment on the DailyMail.com report. (Reporting by Curtis Skinner in San Francisco; Editing by Bill Rigby)"
8	http://reuters.com/article/us-usa-election-poll-idUSKBN12X2P6	Clinton leads Trump by 6 points, same as before FBI announcement: Reuters/Ipsos	"


By Chris Kahn
| NEW YORK

NEW YORK Hillary Clinton led Republican Donald Trump by 6 percentage points among likely voters, according to a Reuters/Ipsos daily tracking poll released on Wednesday, the same advantage the Democratic presidential nominee held before an FBI announcement that reignited the controversy about her email practices.The Oct. 28-Nov. 1 opinion poll was conducted almost entirely after FBI Director James Comey notified Congress last Friday his agency would examine newly discovered emails that might pertain to Clinton's use of a private email server while she was secretary of state.Comey said he did not know whether the emails were significant and released no information other than that they existed. His announcement drew outrage from Democrats who voiced concern it would unfairly influence voters so close to next week's election. Trump and other Republicans seized on the news to revive questions about Clinton's credibility.
Among 1,772 people who have either voted already or were identified as likely voters in the Nov. 8 election, 45 percent said they supported Clinton, while 39 percent said they backed Trump. On Thursday, the day before Comey's announcement, Clinton led Trump by 43 percent to 37 percent.In a four-way poll that included alternative party candidates, Clinton led Trump by 8 percentage points among likely voters. Forty-five percent supported Clinton, while 37 percent backed Trump. Five percent supported Libertarian candidate Gary Johnson and 2 percent backed Jill Stein of the Green Party.
Other national polls have shown Clinton's lead shrinking over the past week. RealClearPolitics, which averages most major opinion polls, showed Clinton's lead had narrowed to 1.7 points on Wednesday from 4.6 points last Friday.
The Reuters/Ipsos poll was conducted online in English in all 50 states. It had a credibility interval, a measure of accuracy, of 3 percentage points. (Editing by Peter Cooney)"
9	http://reuters.com/article/us-usa-election-golf-idUSKBN12X2M2	Wedge issue: Texas golf range offers Clinton and Trump targets	"

LONGVIEW, Texas Looking for a way to help relieve stress in a heated political season, a Texas golf course owner has given patrons the chance to whack their balls at large posters of the leading presidential candidates affixed to hay bales.In the Republican-stronghold of Longview, where Alpine Target Golf Center is located about 120 miles east of Dallas, Democrat Hillary Clinton has been the overwhelming target for patrons' golf balls.""Hillary Clinton is taking it a lot on the chin,"" owner Mike Williams said on Wednesday of the promotion that started about a week ago.
The Trump poster has suffered little damage, Williams said, noting ""he is still in great shape.""

 (Reporting by Todd Yates; Editing by Andrew Hay)"
