	Unnamed: 0	Link	Title	Text	Terms	Topics
7	7	http://reuters.com/article/us-usa-election-muslims-idUSKCN0ZY2C1	For Islamophobia, take two of these and call a Muslim in the morning	"


By Daniel Trotta
| CLEVELAND

CLEVELAND The normally straight-laced Council on American-Islamic Relations tried humor to win over Republicans at their national convention on Monday, handing out packets of a satirical medicine called ""Islamophobin,"" a treatment for Islamophobia.Islamophobin, which is really just chewing gum in a clever package, promises to treat ""blind intolerance, unthinking bigotry, irrational fear of Muslims, (and) U.S. presidential election year scapegoating.""On the first day of the Republican convention to nominate Donald Trump for the Nov. 8 election, CAIR leaders urged the party not to push Muslims voters away.Trump has proposed a temporary ban on Muslims entering the United States. He opposes letting in refugees from the Syrian war, suggesting some may be militants posing as the downtrodden. He has made claims, unsupported to date, that thousands of Muslims in New Jersey openly cheered the Sept. 11, 2001, attacks.In an interview broadcast Monday on CNN, Trump's wife Melania, due to speak at the convention later in the day, said of her husband: ""He's not racist, he's not anti-immigrant,"" and added, ""He wants to keep America safe.""CAIR Executive Director Nihad Awad urged Republicans instead to court Muslims voters, saying they could be crucial in swing states that decide presidential elections.
""Too often over the course of this campaign, Republican presidential candidates have pandered to these inner-core Islamophobic leaders and their supporters with proposals like patrolling so-called Muslim neighborhoods, surveilling and shutting down mosques, and openly questioning whether a Muslim can serve as president,"" Awad said.As a prescription, Awad offered Islamophobin, a concept borrowed from Muslims in Sweden who created a similar product. CAIR sells a package of 12 sugar-free pieces for $1.99 on amazon.com. The package says: ""Take two and call a Muslim in the morning.""
But it comes with a warning.""Those who already believe in religious diversity, tolerance and mutual understanding should not use this product,"" the package says. ""Stop taking this product if you begin to develop warm feelings toward Muslims, immigrants or refugees.""
Nearby at a separate event, Christian demonstrators tried to eclipse a speech by Rose Hamid, a Muslim woman who was ejected from a Trump rally in South Carolina in January for her silent protest, by standing up wearing her head scarf and a T-shirt reading, ""Salam, I come in peace.""As Hamid spoke in favor of a peaceful coexistence at a platform in Public Square set aside for scheduled speeches, the small group behind her hoisted signs such as one saying, ""Muhammad is a liar, false-prophet, child-raping pervert.""When they tried to drown out Hamid with a bullhorn, she turned around to see them for the first time and remarked, ""Oh, they're lovely."" Police then removed them from the scene for demonstrating without a permit. (Reporting by Daniel Trotta; Editing by Howard Goller)"	['Trump']	[]
8	8	http://reuters.com/article/us-usa-election-banks-idUSKCN0ZY2OX	Republican 2016 platform calls for reinstating 1933 banking law	"


By Emily Stephenson
| CLEVELAND

CLEVELAND The U.S. Republican Party on Monday approved a new policy platform that calls for reinstating the 1933 Glass-Steagall law requiring the separation of commercial and investment banking, an addition White House hopeful Donald Trump's campaign said it backed.Trump, who will formally accept the Republican presidential nomination in Cleveland this week, has vowed to dismantle most of the Dodd-Frank Wall Street reform law that was passed under President Barack Obama following the 2007-2009 financial crisis.The language in the Republican platform offered further details on Trump's regulatory policies.Trump, who has sought to cast himself as a populist, has accused presumptive Democratic presidential nominee Hillary Clinton of being too close to Wall Street. Her husband, former President Bill Clinton, signed the legislation that repealed Glass-Steagall in 1999.
""The Obama-Clinton years have passed legislation that has been favorable to the big banks, which is why you see all the Wall Street money going to her,"" Paul Manafort, Trump's campaign manager, told reporters on Monday. ""They know she's their champion, and they are supporting her fully.""Some U.S. lawmakers in both parties support a modern Glass-Steagall to keep banks from becoming ""too big to fail,"" or so big their collapse would destabilize the financial system. The Democratic Party's 2016 platform, which has not been approved, calls for an updated version. Republicans universally despise Dodd-Frank, which their platform calls ""Democrats' legislative Godzilla."" But senior congressional Republicans back other alternatives.
""Glass-Steagall is dumb politics and dumb economics,"" said Tony Fratto, who worked in the administration of Republican President George W. Bush. ""Returning to Glass-Steagall would be destructive and unworkable.""Clinton has said she would break up banks based on risk, not size, and frequently focuses on the risks posed by non-bank institutions.
Manafort listed the Glass-Steagall language among platform points he said ""reflect the issues that Mr. Trump has raised during the course of the campaign,"" including building a wall at the border with Mexico and calling for tougher trade deals.The platform also calls for control of national parks and other lands to be handed over to states, an effort by the party's conservative wing that got national attention during a 2014 standoff involving a Nevada cattle rancher. (Reporting by Emily Stephenson; Editing by Toni Reinhold and Jonathan Oatis)"	['Paul', 'Clinton', 'Trump', 'Obama']	[]
9	9	http://reuters.com/article/us-usa-election-clinton-idUSKCN0ZY25R	Presidential candidate Clinton promises to prosecute police killers	"

NEW YORK Hillary Clinton promised on Monday to bring the ""full weight of the law"" against people who kill police officers if she becomes the next U.S. president after two recent episodes of gunmen slaying police officers in Dallas and Baton Rouge.Clinton, the presumptive Democratic candidate ahead of a Nov. 8 election, made the promise in a speech in Cincinnati at the annual convention of the civil rights group the National Association for the Advancement of Colored People.""Anyone who kills a police officer and anyone who helps must be held accountable,"" Clinton said. ""As president, I will bring the full weight of the law to bear to make sure those who kill police officers are brought to justice."" 
The penalties for killing a police officer are rightly more severe than those for killing a civilian because police are symbols of the rule of law, she said.Clinton's remarks come among heighten tensions between police forces and many black and Latino Americans, who have been rallying in protests across the country against a spate of police killings of black men, often unarmed, during encounters.
A black former soldier killed five police officers during one such protest in Dallas, Texas, on July 7. On Sunday, another black former U.S. Marine sergeant killed three police officers in Baton Rouge, Louisiana. 
 (Reporting by Jonathan Allen; Editing by Chizu Nomiyama and Alan Crosby)"	['Clinton']	[]
