	Link	Title	Text
0	http://reuters.com/article/us-usa-congress-brown-idUSKCN0ZO25F	U.S. Representative Brown charged with fraud: Justice Department	"

WASHINGTON U.S. Representative Corrine Brown, a Democrat from Florida, and her chief of staff were indicted on Friday for their roles in a scheme involving a fraudulent education charity, the U.S. Justice Department said.The department said Brown and Elias Simmons were charged in a 24-count indictment with participating in a conspiracy to commit mail and wire fraud, theft of government property, filing false tax returns and other crimes.


 (Reporting by Timothy Ahmann; Editing by Bill Trott)"
1	http://reuters.com/article/us-louisiana-police-idUSKCN0ZM0BL	Justice Department opens criminal probe into black Louisiana man's death	"


By Edward Krudy
| BATON ROUGE, La.

BATON ROUGE, La. The U.S. Justice Department has opened a criminal investigation into the fatal police shooting of a black man in Louisiana's capital, the state's governor said on Thursday, as two deadly encounters between law enforcement and black men triggered protests in the United States.The probe comes as community leaders in Baton Rouge urged authorities to conduct a full-scale criminal probe of two white police officers over the slaying of Alton Sterling, 37, on Tuesday. ""I want you to know that a criminal investigation is under way. It is being led by the U.S. Department of Justice,"" Louisiana Governor Jon Bel Edwards told hundreds of people at Living Faith Cathedral in Baton Rouge on Thursday evening. ""We are going to come out of this tragedy stronger and more united than ever,"" he added.Sterling was pinned to the ground and fatally shot in the chest outside a convenience store after the officers responded to what police said was a call about a black man reported to have made threats with a gun.The Justice Department said on Wednesday it would conduct a civil rights investigation into Sterling's death. The city's mayor and police chief welcomed the move, but community leaders said they worried the probe would be too limited and urged authorities to consider all possible federal and state criminal charges against officers Blane Salamoni and Howie Lake.""We don't want this to be a narrow investigation,"" Edgar Cage, a spokesman for the community organization Together Baton Rouge, said at a church earlier on Thursday. ""We plan to use this tragic event as a tool, a stimulant to change the culture.""President Barack Obama said in a statement he had full confidence in the Justice Department's ability to conduct a ""thoughtful, thorough and fair inquiry"" into Sterling's death.
Citing an unnamed law enforcement official, CNN reported on Thursday that a homeless man placed the 911 call after seeking money from Sterling, who was selling CDs outside the store.The 300-pound (135-kg) Sterling showed the man his gun and said to leave him alone, the official told CNN. Reuters could not independently confirm that account with Baton Rouge police, who did not respond to a request for comment.Sterling, a father of five, had several criminal convictions since the mid-1990s for battery, resisting arrest, burglary and other crimes. He was a registered sex offender after spending nearly four years in prison on a charge he had sex with a 14-year-old girl when he was 20.
COMMUNITY-POLICE CHASM
Sterling's death was the first of two fatal police shootings of black men in two days. Philando Castile was shot and killed by a police officer during a traffic stop on Wednesday near Minneapolis.The shootings and videos showing their bloody aftermath have sparked protests, including an overnight rally in Baton Rouge that drew about 300 people who stood in a peaceful vigil near the Triple S Food Mart where Sterling was killed.Obama said that ""all Americans should be deeply troubled"" by the two deaths, which he said were indicative of wider problems in the U.S. criminal justice system.At the Baton Rouge church on Thursday, Edwards said there would be a new focus on training and retraining in the police department, and stressed the need to introduce people to the police at an early age. 
His words appeared to address concerns voiced by many community leaders in recent days about a chasm between the black community and the police. Video recorded by a bystander's cellphone showed an officer confronting Sterling and ordering him to the ground. The two officers then tackled him to the pavement, with one pulling a gun from his holster and pointing it at Sterling's chest.One officer shot Sterling five times at close range, and the other took something from his pants pocket as he was dying, another video recorded by Abdullah Muflahi, owner of the store where Sterling was killed in the parking lot, showed.Police said Sterling was armed. Muflahi said in an interview that police took a gun out of Sterling's pocket after shooting him.Officers Lake and Salamoni have been put on administrative leave, police said. In Lake's three years and Salamoni's four years on the force, both have been cleared by the police department after prior complaints against them regarding use of force, the Advocate newspaper reported, citing records.The deaths of Sterling and Castile were the latest in a string of incidents in recent years involving police treatment of black men and boys in cities including Baltimore, Chicago, New York and Cleveland. (Additional reporting by Brendan O'Brien and Bryn Stole; Writing by Colleen Jenkins; Editing by Cynthia Osterman and Peter Cooney)"
2	http://reuters.com/article/us-usa-police-obama-shootings-idUSKCN0ZO01S	Obama says more must be done to address U.S. police shootings	"


By Ayesha Rascoe
| WARSAW, Poland

WARSAW, Poland President Barack Obama on Friday made an impassioned plea for the nation to do more to address the combative relationship between local police forces and the black and Hispanic communities they serve, after the shootings of two black men by police in Minnesota and Louisiana in two days.""When incidents like this occur, there's a big chunk of our fellow citizenry that feels as if because of the color of their skin they are not being treated the same,"" Obama said shortly after landing early Friday morning in Warsaw, Poland, for a NATO summit.""And that should trouble all of us. This is not just a black issue. It's not just a Hispanic issue. This is an American issue that we should all care about,"" he said.The deaths of Philando Castile at a traffic stop in Falcon Heights, Minnesota, and Alton Sterling outside a convenience store in Baton Rouge, Louisiana, were the latest in a string of shootings that have led to calls for a revamp in the way police interact with the black community.
Citing statistics that show that blacks are more likely to be killed by police officers and receive harsher sentences than their white counterparts, Obama said it is ""incumbent on all of us to say we can do better than this.""A White House task force on better policing tactics issued recommendations last year on how to improve community relations with law enforcement.Obama encouraged local police forces to adopt the practices outlined by the task force, saying that less distrust of police would help to keep officers safe and lead to less deadly shootings by authorities.
Critics of the push to reform local police tactics have charged that Obama has not shown enough concern about police officers who are shot in the line of duty.Obama repeatedly stressed that he believes that most police officers do their jobs without bias and that addressing complaints about police brutality would not undermine law enforcement.
""When people say black lives matter, that doesn't mean blue lives don't matter. It just means that all lives matter, but right now the big concern is the fact that data shows black folks are more vulnerable to these kinds of attacks,"" he said.Earlier on Thursday, Obama issued a Facebook post urging the nation to address the ""appearance or reality of racial bias"" in policing. (Reporting by Ayesha Rascoe; Editing by Leslie Adler)"
3	http://reuters.com/article/us-usa-food-gmo-vote-idUSKCN0ZO08N	U.S. GMO food labeling bill passes Senate	"


By Chris Prentice

The U.S. Senate on Thursday approved legislation that would for the first time require food to carry labels listing genetically-modified ingredients, which labeling supporters say could create loopholes for some U.S. crops.The Senate voted 63-30 for the bill that would display GMO contents with words, pictures or a bar code that can be scanned with smartphones. The U.S. Agriculture Department (USDA) would decide which ingredients would be considered genetically modified.The measure now goes to the House of Representatives, where it is expected to pass.Drawing praise from farmers, the bill sponsored by Republican Senator Pat Roberts of Kansas and Democrat Senator Debbie Stabenow of Michigan is the latest attempt to introduce a national standard that would override state laws, including Vermont's that some say is more stringent, and comes amid growing calls from consumers for greater transparency.""This bipartisan bill ensures that consumers and families throughout the United States will have access, for the first time ever, to information about their food through a mandatory, nationwide label for food products with GMOs,"" Stabenow said in a statement.A nationwide standard is favored by the food industry, which says state-by-state differences could inflate costs for labeling and distribution. But mandatory GMO labeling of any kind would still be seen as a loss for Big Food, which has spent millions lobbying against it.Farmers lobbied against the Vermont law, worrying that labeling stigmatizes GMO crops and could hurt demand for food containing those ingredients, but have applauded this law.    Critics like Senator Bernie Sanders, an independent from Vermont, say the bill's vague language and allowance for electronic labels for scanning could limit its scope and create confusion.
""When parents go to the store and purchase food, they have the right to know what is in the food their kids are going to be eating,"" Sanders said on the floor of the Senate ahead of the vote.He said at a news conference this week that major food manufacturers have already begun labeling products with GMO ingredients to meet the new law in his home state.Another opponent of the bill, Democratic Senator Jeff Merkley of Oregon, said it would institute weak federal requirements making it virtually impossible for consumers to access information about GMOs.
LOOPHOLES
Food ingredients like beet sugar and soybean oil, which can be derived from genetically-engineered crops but contain next to no genetic material by the time they are processed, may not fall under the law's definition of a bioengineered food, critics say.GMO corn may also be excluded thanks to ambiguous language, some said.The U.S. Food and Drug Administration (FDA) raised concerns about the involvement of the USDA in a list of worries sent in a June 27 memo to the Senate Agriculture Committee.
In a letter to Stabenow last week, the USDA's general counsel tried to quell those worries, saying it would include commercially-grown GMO corn, soybeans, sugar and canola crops.The vast majority of corn, soybeans and sugar crops in the United States are produced from genetically-engineered seeds. The domestic sugar market has been strained by rising demand for non-GMO ingredients like cane sugar.The United States is the world's largest market for foods made with genetically altered ingredients. Many popular processed foods are made with soybeans, corn and other biotech crops whose genetic traits have been manipulated, often to make them resistant to insects and pesticides.""It's fair to say that it's not the ideal bill, but it is certainly the bill that can pass, which is the most important right now,"" said American Soybean Association's (ASA) director of policy communications Patrick Delaney.The association was part of the Coalition for Safe and Affordable Food, which lobbied for what labeling supporters termed the Deny Americans the Right to Know, or DARK Act, that would have made labeling voluntary. It was blocked by the Senate in March. (Reporting by Chris Prentice in New York; Additional reporting by Karl Plume in Chicago, Lisa Baertlein in Los Angeles and Kouichi Shirayanagi and Eric Beech in Washington; Editing by Marguerita Choy and Ed Davies)"
4	http://reuters.com/article/us-usa-election-clinton-probe-idUSKCN0ZN2Q6	State Department to conduct internal probe of Clinton email case	"

WASHINGTON The U.S. State Department said on Thursday it will conduct an internal review of whether Democratic presidential candidate Hillary Clinton and her aides mishandled classified information, after the Justice Department declined to bring criminal charges.The State Department said in April it had suspended plans for an internal review at the request of the Federal Bureau of Investigation, which conducted a yearlong probe of Clinton's use of private email servers while she was secretary of state.""Given the Department of Justice has now made its announcement, the State Department intends to conduct its internal review,"" State Department spokesman John Kirby said in a statement.""I cannot provide specific information about the Department's review, including what information we are evaluating. We will aim to be as expeditious as possible, but we will not put artificial deadlines on the process,"" he said.
On Wednesday, U.S. Attorney General Loretta Lynch said she would accept the recommendations of the FBI not to bring criminal charges against Clinton, the presumptive Democratic presidential nominee for the Nov. 8 election.
FBI Director James Comey said on Tuesday Clinton had been ""extremely careless"" in the handling of classified information, and Republicans have criticized the decision not to prosecute.Comey told a congressional hearing on Thursday that FBI employees who mishandled classified material in the way Clinton did as secretary of state could be subject to dismissal or loss of security clearance.
 (Reporting by Arshad Mohammed; Writing by Eric Beech; Editing by Mohammad Zargham)"
5	http://reuters.com/article/us-nato-summit-obama-brexit-idUSKCN0ZO0HB	Obama says confident Britain will have orderly Brexit transition: FT	"

LONDON U.S. President Barack Obama said he was confident that Britain and the European Union would be able to agree an orderly transition to a new relationship after last month's Brexit vote.""As difficult as it will be, I am confident that the UK and the EU will be able to agree on an orderly transition to a new relationship,"" Obama said in an article for the Financial Times, calling upon NATO to stand united against global challenges.""The special relationship between the US and the UK will endure. I have no doubt that the UK will remain one of Nato's most capable members.""
Obama urged NATO to unite following Britain's June 23 vote to leave the EU and stressed that the alliance between the United States and its closest ally in Europe would endure Brexit.

 (Reporting by Alistair Smout; editing by Guy Faulconbridge)"
6	http://reuters.com/article/us-usa-food-gmo-idUSKCN0ZN279	U.S. GMO food labeling bill passes Senate	"


By Chris Prentice

The U.S. Senate on Thursday approved legislation that would for the first time require food to carry labels listing genetically-modified ingredients, which labeling supporters say could create loopholes for some U.S. crops.The Senate voted 63-30 for the bill that would display GMO contents with words, pictures or a bar code that can be scanned with smartphones. The U.S. Agriculture Department (USDA) would decide which ingredients would be considered genetically modified.The measure now goes to the House of Representatives, where it is expected to pass.Drawing praise from farmers, the bill sponsored by Republican Senator Pat Roberts of Kansas and Democrat Senator Debbie Stabenow of Michigan is the latest attempt to introduce a national standard that would override state laws, including Vermont's that some say is more stringent, and comes amid growing calls from consumers for greater transparency.""This bipartisan bill ensures that consumers and families throughout the United States will have access, for the first time ever, to information about their food through a mandatory, nationwide label for food products with GMOs,"" Stabenow said in a statement.A nationwide standard is favored by the food industry, which says state-by-state differences could inflate costs for labeling and distribution. But mandatory GMO labeling of any kind would still be seen as a loss for Big Food, which has spent millions lobbying against it.Farmers lobbied against the Vermont law, worrying that labeling stigmatizes GMO crops and could hurt demand for food containing those ingredients, but have applauded this law.    Critics like Senator Bernie Sanders, an independent from Vermont, say the bill's vague language and allowance for electronic labels for scanning could limit its scope and create confusion.
""When parents go to the store and purchase food, they have the right to know what is in the food their kids are going to be eating,"" Sanders said on the floor of the Senate ahead of the vote.He said at a news conference this week that major food manufacturers have already begun labeling products with GMO ingredients to meet the new law in his home state.Another opponent of the bill, Democratic Senator Jeff Merkley of Oregon, said it would institute weak federal requirements making it virtually impossible for consumers to access information about GMOs.
LOOPHOLES
Food ingredients like beet sugar and soybean oil, which can be derived from genetically-engineered crops but contain next to no genetic material by the time they are processed, may not fall under the law's definition of a bioengineered food, critics say.GMO corn may also be excluded thanks to ambiguous language, some said.The U.S. Food and Drug Administration (FDA) raised concerns about the involvement of the USDA in a list of worries sent in a June 27 memo to the Senate Agriculture Committee.
In a letter to Stabenow last week, the USDA's general counsel tried to quell those worries, saying it would include commercially-grown GMO corn, soybeans, sugar and canola crops.The vast majority of corn, soybeans and sugar crops in the United States are produced from genetically-engineered seeds. The domestic sugar market has been strained by rising demand for non-GMO ingredients like cane sugar.The United States is the world's largest market for foods made with genetically altered ingredients. Many popular processed foods are made with soybeans, corn and other biotech crops whose genetic traits have been manipulated, often to make them resistant to insects and pesticides.""It's fair to say that it's not the ideal bill, but it is certainly the bill that can pass, which is the most important right now,"" said American Soybean Association's (ASA) director of policy communications Patrick Delaney.The association was part of the Coalition for Safe and Affordable Food, which lobbied for what labeling supporters termed the Deny Americans the Right to Know, or DARK Act, that would have made labeling voluntary. It was blocked by the Senate in March. (Reporting by Chris Prentice in New York; Additional reporting by Karl Plume in Chicago, Lisa Baertlein in Los Angeles and Kouichi Shirayanagi and Eric Beech in Washington; Editing by Marguerita Choy and Ed Davies)"
7	http://reuters.com/article/us-usa-election-idUSKCN0ZN0XW	FBI chief says his staff would face discipline for handling emails the way Clinton did	"


By Julia Edwards and David Alexander
| WASHINGTON

WASHINGTON FBI Director James Comey told U.S. lawmakers on Thursday that FBI employees who mishandled classified material in the way Hillary Clinton did as secretary of state could be subject to dismissal or loss of security clearance.  Comey addressed the issue at a House of Representatives committee hearing that lasted nearly five hours after House Speaker Paul Ryan said in a letter to Director of National Intelligence James Clapper that Clinton should be denied classified briefings during her campaign for the presidency.Comey, who said on Tuesday he would not recommend that the presumptive Democratic presidential nominee face criminal charges, was asked at the hearing if Clinton should face administrative punishment for the way she handled her email. ""I don't think that's for me to recommend,"" he said.Comey did say his employees in the Federal Bureau of Investigation would face discipline for the same behavior.""They might get fired, they might lose their clearance, it might get suspended for 30 days,"" Comey said. ""There would be some discipline.""Presidential candidates normally get access to classified information once they are formally nominated. As director of the FBI, Comey does not have the authority to revoke Clinton's security privileges.A group of Republican senators on Thursday asked the State Department to immediately suspend clearances for Clinton and several current and former aides based on the agency's findings. The State Department said on Thursday it would conduct an internal review of Clinton's handling of the emails now that the FBI investigation was over. The department said in April it had suspended plans for a review at the FBI's request.""I cannot provide specific information about the Department's review, including what information we are evaluating. We will aim to be as expeditious as possible, but we will not put artificial deadlines on the process,"" State Department spokesman John Kirby said in a statement.A Clinton spokesman on Thursday criticized the congressional hearing for its ""partisan motivations,"" and expressed confidence that Comey's testimony had shut down any lingering ""conspiracy theories"" on the matter. 
""Director Comey's testimony clearly knocked down a number of false Republican talking points and reconciled apparent contradictions between his previous remarks and Hillary Clinton's public statements,"" spokesman Brian Fallon said in a statement. The issue of Clinton's use of private email servers has cast a cloud over her campaign for the Nov. 8 presidential election, raising questions among voters about her trustworthiness and judgment and giving her Republican presidential rival, Donald Trump, an avenue of attack. 'APOLITICAL, PROFESSIONAL' INVESTIGATION 
Comey's testimony marked the first time he took questions publicly since his announcement the FBI was not recommending charges against Clinton. U.S. Attorney General Loretta Lynch accepted the FBI recommendation and was to appear at another hearing next Tuesday. Comey had disappointed some Republicans by only rebuking Clinton, not recommending charges against her, for what he called her ""extremely careless"" handling of classified information while using private email servers. 
Under persistent questioning at the hearing of the House Oversight Committee, Comey said Clinton did not break the law.""The question I always look at is, is there evidence that would establish beyond a reasonable doubt that somebody engaged in conduct that violated a criminal statute. And my judgment here is there is not,"" Comey said.   Comey also said Clinton knew her email server at her home in Chappaqua, New York, was not authorized to receive classified information.But Clinton may not have had sufficiently sophisticated understanding to know the emails that passed through her personal server were classified, Comey said. Only three of the FBI-reviewed emails were explicitly marked as classified and those were marked with a ""C"" in the body of the email, not in the header, he said.Comey said his FBI team conducted its investigation of Clinton ""in an apolitical and professional way"" and he had no reason to believe she had lied to the FBI. Clinton had said publicly she never sent or received any classified information.
'IF YOUR NAME ISN'T CLINTON'
""I think there is a legitimate concern that there is a double standard, if your name isn't Clinton or you are not part of the powerful elite that Lady Justice will act differently,"" U.S. Representative Jason Chaffetz, chairman of the House Oversight Committee, said to Comey at the beginning of the hearing.A Democratic member of the committee, Representative Elijah Cummings of Maryland, defended Comey's actions by saying: ""I firmly believe your decision was based on conviction, not convenience.""Comey, a Republican who was appointed by Democratic President Barack Obama and also served in the administration of former Republican President George W. Bush, has built a reputation as a straight shooter who does not bend to pressure from either party.He has differed sharply with the Obama administration, including over the case of General David Petraeus, who pleaded guilty after he knowingly shared classified information with his biographer and lover. Comey recommended Petraeus be charged with a felony, but then-Attorney General Eric Holder downgraded the charge to a misdemeanor.The hearing took place as Trump met with Republican lawmakers on Capitol Hill to get them behind his candidacy, discussing a variety of issues, including his campaign style.""I'm going to make you proud,"" Trump told House Republicans, according to a participant, Representative Bill Flores. (Additional reporting by Susan Cornwell, Alana Wise, Julia Harte and Arshad Mohammed; Writing by Steve Holland and Julia Edwards; Editing by Bill Trott and Peter Cooney)"
