	Unnamed: 0	Link	Title	Text	Terms	Topics
0	0	http://reuters.com/article/us-usa-congress-supremecourt-idUSKBN1310ZV	Georgia senators will consider Clinton high court nominees: report	"


By Valerie Volcovici
| WASHINGTON

WASHINGTON Georgia's two Republican senators broke with members of their party, saying they would consider Supreme Court nominees put forward by Democratic candidate Hillary Clinton if she wins the presidency, the Atlanta Journal-Constitution reported on Sunday.The comments from U.S. Senator Johnny Isakson, who is up for re-election on Tuesday, and U.S. Senator David Perdue came after Republican Senators John McCain and Ted Cruz suggested they might block any of Clinton's potential nominees.""You don't shirk your responsibility when you're an elected official. You sanctify your responsibility, and that's what I'll do. I'll consider who she nominates at the time she does and make a decision that's right for the people of Georgia,"" Isakson told the Atlanta newspaper.
A spokeswoman for Perdue, a member of the Senate Judiciary Committee, told the AJC: ""He wants to ensure we have a Supreme Court justice who will uphold the Constitution, and he will examine each nominee independently based on their merits.""The death of conservative Justice Antonin Scalia in February has left the nine-member high court short one justice and evenly split between liberals and conservatives.
In March, President Barack Obama nominated Merrick Garland, a federal appeals court judge, to replace Scalia, but the Republican-led Senate has refused to consider the nomination, saying the next president should make the pick.The Senate's inaction on Garland, a centrist, has made the Supreme Court a potent issue in the election. After many years of leaning conservative, the court could tilt to the left for the first time in decades if Clinton wins the election.
Isakson said he expects the Senate will confirm Garland before January in the event of a Clinton victory. Some Republicans fear Clinton would nominate a more liberal justice, swinging the ideological balance of the court even further to the left. (Additional reporting by David Morgan; Editing by Paul Simao)"	['Clinton', 'Isakson', 'McCain', 'Cruz', 'Perdue', 'Paul', 'Obama']	[]
1	1	http://reuters.com/article/us-usa-election-idUSKBN1300M5	Security hustles Trump from stage after protester displays sign	"


By Emily Stephenson and Amanda Becker
| RENO, Nevada/PHILADELPHIA

RENO, Nevada/PHILADELPHIA Republican Donald Trump was rushed off stage by security agents  at a rally in Reno, Nevada, on Saturday night after a false alarm as someone in the crowd shouted ""gun"" during scuffles with a man who held up a ""Republicans against Trump"" sign.The incident occurred as Trump and Democratic rival  Hillary Clinton crisscrossed the United States a late push to win over undecided voters and make sure supporters turn out enthusiastically on Election Day.Two security agents seized Trump by the shoulders and hustled him backstage as police officers swarmed over a man in the front of the crowd and held him down and searched him before escorting him away with his hands behind his back.Trump, seemingly unruffled, returned to the stage and continued his speech after a short time, saying ""Nobody said it was going to be easy for us"" and adding ""We will never be stopped.""After being released, the man who was apprehended told CBS News Reno affiliate KTVN-2 that he was a Republican supporter who attended the rally to express his opposition to Trump.""I came here with this sign expecting boos ... But it was just a sign,"" Austyn Crites said. Crites said when he took it out, the crowd began to attack him, choking and beating him before ""someone yelled about a gun.""After being held for a few hours' questioning and security  and background checks, Crites said he was released, and that the police ""did their job.""Crites said he wanted to contrast President Barack Obama's reaction to a protestor during a rally a few days ago, in which he urged the crowd to respect the protester, with Trump's, saying he wanted ""people to understand"" the difference.""I have  nothing against Trump supporters,"" Crites told the station. ""We are all registered Republicans and support many of the same candidates for local offices. I have serious concern against Trump,"" he added.The Secret Service confirmed that the incident erupted when an unidentified individual in front of the stage shouted ""gun.""""Secret Service agents and Reno Police Officers immediately apprehended the subject. Upon a thorough search of the subject and the surrounding area, no weapon was found,"" the Secret Service said in a statement.The incident began when Trump noticed what he considered a heckler. Seconds later people near the stage began pointing at someone in the crowd near the front, and agents took Trump away.In a statement, Trump thanked the Secret Service, Reno and Nevada law enforcement for ""their fast and professional response.""
Meantime, in Philadelphia, pop singer Katy Perry performed at a Clinton rally, the latest in a string of celebrity appearances aimed at getting out the vote among millennials.""When your kids and grandkids ask you what you did in 2016, when it was all on the line, I want you be able to say you voted for a better, stronger, America,"" Clinton said.  Opinion polls show Clinton still holds advantages in states that could be critical in deciding the election. But her lead has narrowed after a revelation a week ago that the Federal Bureau of Investigation was looking into a new trove of emails as part of its probe into her handling of classified information while she was secretary of state.A McClatchy-Marist opinion poll released on Saturday of  voters nationwide showed Clinton leading by 1 percentage point compared to 6 percentage points in September.A Reuters/Ipsos tracking poll on Saturday showed Clinton ahead by 4 percentage points nationally compared to 5 points on Friday, while an ABC News-Washington Post tracking poll had Clinton ahead by 48 to 43 percent.COMPETING FOR FLORIDA VOTES
Both candidates spent time in Florida, considered one of the most hotly contested states. The 2000 presidential election was decided in Florida after a dispute over votes and recounting of ballots went to the U.S. Supreme Court, which ruled in favor of Republican George W. Bush over Democrat Al Gore.
The Real Clear Politics average of Florida opinion polls found Clinton with a lead of about 1 percentage point - indicating the race there is a virtual tie.Trump spoke at a rally on Saturday morning in Tampa, Florida, where he continued to criticize Clinton for supporting the Affordable Care Act, also known as Obamacare, in the wake of an announcement that premiums are going to rise next year.""It's not going to matter because if we win I'm throwing it out anyway,"" Trump said.Shortly before Clinton took the stage in Pembroke Pines, Florida, rain poured down. People in the crowd waiting for Clinton at the outdoor rally remained in place, taking out umbrellas and fashioning garbage bags into head coverings.""I'm thrilled to be here and boy is this a hardy group, rain or shine you are ready,"" Clinton said, her voice cracking with hoarseness.She cut her speech short as she became soaked in rain, saying, ""I don't think I need to tell you all of the wrong things about Donald Trump.""At the JFK library in Hialeah, Florida, people lined up outside for early voting. Nearby, supporters of both candidates waved signs and shouted slogans, urging passing drivers to honk their horns.
""We want someone to come in and clean house,"" said Cuban-American Ariel Martinez, 42, a Trump supporter.Early voting began in September and the data firm Catalist estimates more than 30 million ballots have been cast in 38 states. There are an estimated 225.8 million eligible U.S. voters. Saturday was the final day for early voting in many Florida counties.CHANGES IN PLANS
Trump and Clinton campaigns adjusted travel schedules for the next two days to states where they saw opportunity.Trump told the crowd in Tampa that there would be a campaign event in Minnesota this weekend, although one had not previously been scheduled. Minnesota has not voted for a Republican since 1984. His campaign confirmed a rally scheduled for Wisconsin on Sunday has been canceled.Clinton started the day by stopping by the West Miami Community Center, a Cuban American neighborhood, with telenovela star Jencarlos Canela, a Miami native of Cuban descent.She then visited her campaign's office in Little Haiti where there is a large concentration of Haitian-American residents. Clinton was joined by Sybrina Fulton, the mother of Trayvon Martin, the unarmed black teenager who was shot dead in 2012 by a Sanford, Florida neighborhood watchman, George Zimmerman.While Trump prefers large-scale rallies, Clinton has filled her campaign schedule with targeted appearances meant to court voters in specific demographics. Cuban voters have historically favored Republicans, but younger generations have shifted toward Democratic Party candidates.In what was seen as an effort to defend typically Democratic turf, Clinton on Monday will campaign in Grand Rapids, Michigan, before returning to Pennsylvania for a rally in Philadelphia with President Barack Obama and first lady Michelle Obama, and former President Bill Clinton.Trump is to make stops on Sunday in Iowa, Minnesota, Michigan, Pennsylvania and Virginia to try to steal away some states that have gone Democratic in recent presidential elections. (Story corrects dateline to remove ""N.C."".) (Reporting by Emily Stephenson, Amanda Becker, and Luciana Lopez; Writing by Steve Holland and Chris Michaud; editing by Grant McCool, Mary Milliken and Simon Cameron-Moore)"	['Perry', 'Clinton', 'Trump', 'Obama']	[]
2	2	http://reuters.com/article/us-usa-election-latinos-idUSKBN1310YU	Jump in Florida, Nevada early voting could reap Latino gains for Clinton	"


By Luciana Lopez
| MIAMI

MIAMI The man answering a volunteer's knock on the door in the Kendall section of Miami-Dade County on Saturday was emphatic: Not only would he vote but ""esperamos que la presidenta gane"" - Spanish for ""we hope Madam President wins.""Volunteers across Florida made a last-minute push to get voters to the polls this weekend with early voting ending on Sunday ahead of Election Day on Tuesday, pitting Republican Donald Trump against Democrat Hillary Clinton, or ""la presidenta,"" as the man at the door called her.Latino voters like the man in Kendall and elsewhere could have an outsized influence in Tuesday's election. Early voting data may portend a jump in the number of Hispanic voters this year, especially in the key swing states of Nevada and Florida, and Clinton would likely be the biggest beneficiary.Clinton has polled much stronger among Latino voters nationwide: a Washington Post/Univision poll released last week gave her 67 percent of the Hispanic vote to Trump's 19 percent. Trump has fared poorly with America's largest minority voting group, having repeatedly angered Hispanics with disparaging comments about their communities. A recent poll conducted by the firms The Tarrance Group and Bendixen and Amandi found that Hispanic registered voters in Florida favor Clinton 60 percent to 30 percent. In Nevada the gap was even wider - 72 percent for Clinton and 19 percent for Trump.In Florida, the Clinton campaign estimates early Latino voting is up 139 percent, or more than twice as much, compared to 2012, according to a field report dated Wednesday.Democratic strategist Steve Schale, a Florida expert, estimated that 170,000 more Hispanics had voted early or by mail as of Wednesday than had voted early or by mail in the entire 2012 election, according to a post on his blog.""And keep in mind, because Hispanic is a self-identifying marker, studies have found that the real Hispanic vote is larger than the registration. So while Hispanics might make up 14.2 percent of the voters who have voted so far, in reality, the number is larger,"" he wrote.Despite the surge in early voting, there is no certainty about which candidate people chose for president. There is also no guarantee that the higher Latino turnout rate will continue on Election Day and that they and other minority voters will make enough of a difference to swing Florida and other states. Trump kicked off his maverick campaign last year by describing Mexican immigrants as rapists and criminals, and made a tough stance on immigration a signature part of his vision for America. He called for a wall to be built on the border and said an American-born federal judge could not do his job because of his Mexican heritage.
That rhetoric might be hurting him in an increasingly diverse Florida, where many election watchers believe Trump must win to have a chance to secure the minimum 270 votes in the Electoral College needed to claim the White House. Daniel Smith, a political science professor at the University of Florida who also does voting research, said Democrats have a strong lead among Hispanics who have voted early in Florida. ""From my perspective this is Hispanics in Florida reacting viscerally to Donald Trump,"" said Smith. ""His scorched earth campaign against immigrants and especially Hispanics is coming home to roost in Florida.""DEMOCRATIC EDGE IN KEY COUNTY

The state of Nevada does not note race or ethnicity on its voter registration but other data there suggest Latinos also are turning out in force.For one thing, Clark County has seen a surge in early voting. Between in-person and absentee voting, registered Democrats have now returned over 72,000 more ballots than registered Republicans there. Those figures do not indicate which candidate voters picked, only the party with which the voters are registered.Friday alone saw 57,172 votes in person in Clark County. Photos making the rounds on social media showed especially long lines at a Cardenas market voting site, which stayed open late to accommodate the surge of voters.Clark County, which includes Las Vegas, has a large Latino population - 30.6 percent, compared to 28.1 percent for Nevada as a whole, according to the U.S. Census.Even more Republican votes elsewhere in the state are so far not enough to counterbalance that Democratic lead in Clark County. Overall, the Democrats have cast around 46,000 more ballots in Nevada than Republicans.
That's not an accident, said Artie Blanco, the Nevada state coordinator for the progressive group For Our Future. Her organization and others banded together in a major get-out-the-vote push, especially among voters of color, and the coalition's data suggest that the effort paid off.Twenty-two percent of Democrats who voted on Friday had a conversation with someone from that progressive coalition at some point after Oct. 15, Blanco said. Among Latino voters on the last three voting days, the coalition had conversations with 14 percent of them after Oct. 15, according to the group's data.Trump on Saturday took a jab at the early voting turnout in Nevada.""They didn't get the kind of vote that they needed to stop us on Tuesday,"" Trump said in Reno. ""Tuesday is our day in this state.""He said Reno and northern Nevada could ""carry us all the way to Washington."" But Blanco said the votes were instead the result of major work to bring out voters, especially people of color and that progressive organizations were not done yet.""We have all these voters that we need to now go back and say, 'You've got one day,'"" she said of those who had not yet cast ballots. (Writing and reporting by Luciana Lopez; Additional reporting by Emily Stephenson; Editing by Bill Trott and Mary Milliken)"	['Trott', 'Clinton', 'Trump', 'Clark']	[]
3	3	http://reuters.com/article/us-usa-election-fbi-idUSKBN131112	FBI tells Congress it has not changed conclusion on Clinton emails	"

WASHINGTON FBI Director James Comey told Congress on Sunday a recent review of newly discovered emails did not change the agency's conclusion reached in July that no charges were warranted in the case of Hillary Clinton's use of a private email server.U.S. Republican Representative Jason Chaffetz said in a tweet that Comey had informed him of the conclusion. Comey's letter to Congress informing it of the newly discovered emails had thrown Clinton's presidential race against Republican Donald Trump into turmoil.


 (Reporting by Alana Wise and John Whitesides; Editing by Paul Simao)"	['Chaffetz', 'Paul', 'Trump']	[]
4	4	http://reuters.com/article/us-usa-election-intimidation-idUSKBN1310ZF	U.S. appeals court removes new voter-intimidation rules in Ohio	"


By Andy Sullivan
| WASHINGTON

WASHINGTON Republican presidential candidate Donald Trump won a legal battle on Sunday when a U.S. appeals court in Ohio removed new restrictions on partisan poll watchers that Democrats had sought to prevent Election Day voter intimidation.The rules overturned by the Sixth Circuit Court of Appeals would have imposed greater penalties on people who harass voters during Tuesday's election.Voter intimidation already is prohibited under U.S. law but Democrats have pushed for greater restrictions in Ohio and five other battleground states, citing concerns that Trump's heated rhetoric might inspire Election Day chaos.On the campaign trail, Trump has warned the election may be rigged and has called on supporters to keep an eye on voting activity for possible signs of fraud in large cities. Numerous studies have found that U.S. voter fraud is exceedingly rare. 
On Friday U.S. District Court Judge James Gwin imposed new restrictions on those who monitor voting activity, saying they may not interrogate voters within 100 feet of a polling place, block them from entering, or photograph them as they come and go. Those found to violate the rules could be held in contempt of court.The Trump campaign had argued that those restrictions were not justified, given that there had been no reported instances of voter harassment in the state so far. 
""In the end, plaintiff's case rested on rhetoric, not evidence,"" Trump attorney Chad Readler wrote in a court filing on Saturday.The appeals court sided with Trump, lifting the new rules two days before Election Day. The ruling came before Democrats had a chance to respond to Readler's motion and the party said it may appeal.
""We are stunned that a court would rule without even allowing one of the parties to file a memo explaining their case, but that is exactly what the Sixth Circuit has done in this decision. We are exploring our options to reverse this unfortunate ruling,"" Ohio Democratic Party spokeswoman Kirstin Alvanitakis said.The Trump campaign did not immediately respond to a request for comment. (Reporting by Andy Sullivan; Editing by Bill Trott)"	['Sullivan', 'Trump']	[]
5	5	http://reuters.com/article/us-usa-election-registration-idUSKBN1310KJ	Social media helps U.S. millennial voters register, turnout worries linger	"


By Amy Tennery and Melissa Fares
| NEW YORK

NEW YORK As the youngest members of the millennial generation became old enough to vote in this year's U.S. presidential election, states and social media platforms poured efforts into online registration, hoping to attract these tech savvy voters who now rival Baby Boomers as the country's largest demographic.With Election Day just two days away, political experts are skeptical that a record number of millennials who signed up to vote will actually result in the 18-34 year-old age group turning out at the polls in proportion to their relative size of the U.S. population.Millennials make up approximately 31 percent of U.S. citizens eligible to vote, according to the Pew Research Center, on par for the first time with Baby Boomers, who are typically aged 52-70 years old. There are an estimated 225.8 million eligible U.S. voters.  Millennials have so far, however, turned out in much lower numbers in elections than Baby Boomers. In 2008, a record year for millennial turnout, just 50 per cent of those eligible to vote did so, the National Census Bureau said. That compared with turnout rates of 69 per cent for Baby Boomers and 61 percent for people aged 36 to 51, also known as Generation X.This year, a number of efforts on social media by states and non-profits aimed to change that, including Facebook reminders on users' accounts, Twitter hashtag campaigns, celebrities creating Snapchat and an Instagram post urging people to vote.According to a survey of state electoral officials and voter non-profits around the United States, these social media campaigns have paid off, at least when it came to getting young voters registered. A survey of 2,000 millennials conducted by social media platform Yik Yak, which is known for its popularity among college students and teens, showed that 62 percent registered to vote for the first time this year and, of those, 9 percent registered online following a social media prompt.In California, roughly 31 per cent of all registered voters are now aged 18-35. A Facebook reminder on May 16 coincided with 143,255 people registering or updating their registrations online that day in the state, compared to an average of 23,166 per day that month, said California Secretary of State spokesman Sam Mahood. Other states reported similar spikes.
In Oregon, more than 420,000 people registered to vote online in 2016, up from 2012 when 163,545 used the online system. Digital voter enrollments in Washington jumped by roughly 135,000 in 2016, compared to 2012. From January through mid-October this year, 381,318 people used the online system in Indiana, nearly three times as many as in 2012. ""Let's face it - that's where [younger voters] are; they're on social media,"" said Denise Merrill, the secretary of state for Connecticut, which used social media campaigns, including a dedicated hashtag and Facebook's banner ads, to drive registrations. ""Whatever we're doing, we're having pretty dramatic results.""'HUGE POTENTIAL'
Like a lot of experts, Donald Green, a professor of political science at Columbia University, is skeptical that an increase in young voter registration will correspond with millennials unseating the Baby Boomers as the most active voting bloc.
Green conceded that there was ""change afoot,"" but said he thought it would far more gradual. By his estimate, it would be  25 years before millennials overtake Baby Boomers, or what he dubbed ""generational replacement.""""In presidential elections the translation of new registration to votes is more like one half or one third,"" he said.Michael Cornfield, an associate professor of political management at George Washington University, agreed that registering someone to vote does not guarantee they'll show up on Election Day.""It's up to the campaigns to do the last bit, which is to say make sure the right millennials in the right battleground states are being targeted,"" said Cornfield.
Some political experts said that, in general, millennials tend to vote more for Democratic Party candidates than Republicans.Laura Wray-Lake, an assistant professor at the University of California-Los Angeles, said the increase in millennial registration could be a boon for Democrats if they could harness some of the social media techniques used to register voters to get them to the polls. With many political experts expecting overall voter turnout to be lower this year, millennial voters in swing states are a bloc that Democratic candidate Hillary Clinton could hope to turn out. Clinton leads Republican candidate Donald Trump by 27 percentage points among likely voters ages 18-34, according to a Reuters/Ipsos poll.""Young people have huge potential for political impact"" Wray-Lake said. ""I think eventually these millennials will be deciding the future of the country.""For a graphic on Online voter registration, click tmsnrt.rs/2fjdh4j (Reporting By Amy Tennery; editing by Grant McCool)"	['Clinton', 'Trump']	[]
6	6	http://reuters.com/article/us-usa-election-poll-nbc-idUSKBN1310QC	NBC-Wall Street Journal poll has Clinton leading Trump by four points	"

WASHINGTON Democratic presidential candidate Hillary Clinton holds a four-point lead over Republican Donald Trump in the final NBC-Wall Street Journal poll released on Sunday.The NBC-Wall Street Journal poll showed Clinton leading Trump by 44 percent to 40 percent. Libertarian Gary Johnson was at 6 percent and Green Party Candidate Jill Stein had 2 percent.Clinton's lead shrank from 11 points over Trump the last time the poll was conducted in mid-October, before the FBI said it was reviewing new emails in its investigation of the former secretary of state.
The poll also showed Clinton with a 12 percentage point lead over Trump - 51 percent to 39 percent - among people who have said they have voted early.

 (Reporting By Valerie Volcovici; Editing by Bill Trott)"	['Clinton', 'Trump']	[]
7	7	http://reuters.com/article/us-usa-election-pence-idUSKBN1310QY	Pence: Both sides would accept clear outcome to U.S. election	"

WASHINGTON Republican vice presidential candidate Mike Pence on Sunday pledged Donald Trump's campaign would accept a ""clear outcome"" to the U.S. presidential election but said both campaigns reserved legal options if there was a disputed result.""The campaign has made it very clear that a clear outcome, obviously, both sides will accept. But I think both campaigns have also been very clear that in the event of disputed results, they reserve all rights and remedies,"" Pence said in an interview on ""Fox News Sunday.""


 (Reporting By Caren Bohan; Editing by Bill Trott)"	['Pence']	[]
