	Link	Title	Text
8	http://reuters.com/article/us-usa-election-trump-idUSKCN0ZN22C	Trump stars and spars with Republican lawmakers	"


By Susan Cornwell and Emily Stephenson
| WASHINGTON

WASHINGTON Donald Trump endured some blunt exchanges when he met Republican members of Congress on Thursday but several lawmakers, including past critics, emerged with encouraging words about their presumptive White House nominee.Republican aides cited good attendance from both houses of Congress at the two closed-door meetings, even though some lawmakers made a point of staying away, citing previous commitments.The New York businessman-turned-politician has sought in speeches and meetings in recent weeks to unite the party behind his unorthodox candidacy and to reassure Republican leaders about his conservative credentials.In a Miami speech on Friday, Trump will say the economic policies of Democrats like President Barack Obama and Hillary Clinton, the party's presumptive nominee, have harmed minorities, said Steve Moore, a Trump economic policy adviser.  Trump drew 41 of 54 Republican senators to the U.S. Senate meeting where he called out three senators who had been critical of his candidacy, according to Republican aides familiar with the meeting.Trump campaign manager Paul Manafort said the meetings with lawmakers were positive and productive, adding characterizations of discord ""attributed to unnamed sources, are wholly inaccurate.""  Trump also met privately with Senator Ted Cruz, his former rival for the Republican nomination. They did not discuss an endorsement but Cruz did accept Trump's invitation to speak at the Republican National Convention in Cleveland the week of July 18, Cruz spokeswoman Catherine Frazier said.'I'M GOING TO MAKE YOU PROUD'
At the first session on Thursday, with members of the House of Representatives, Trump shared a hug with House Speaker Paul Ryan, a Republican who has often criticized Trump even while endorsing him, lawmakers said.They joked a bit about some of their past exchanges during an hour-long session, and Trump took questions.
""I'm going to make you proud,"" Representative Bill Flores quoted Trump as saying.Trump won grassroots support during months of state-by-state nominating contests for the Nov. 8 election with a pledge to ban Muslims temporarily from entering the United States and to build a wall on the U.S. border with Mexico. He regularly annoys party leaders with inflammatory remarks.Flores, a Texan who heads the Republican Study Committee, the largest conservative grouping in Congress, had criticized Trump, including for having questioned a U.S. judge's motives because of his Mexican ethnicity. Flores had said he wanted to see ""more vision and less trash talk"" from the presumptive nominee.After Thursday's session, Flores said he felt better about Trump. ""Based on what I have heard today, I've got the confidence that you are going to see a lot more in terms of visionary messaging,"" Flores said.""Today was extremely positive,"" said New York Republican Peter King, another representative who has criticized Trump. ""There was not one negative moment.""
But not everyone was won over. ""I need to be persuaded,"" said Representative Charlie Dent, a moderate Republican from Pennsylvania who said he would not support either Trump or  Clinton.TENSIONS IN SENATE MEETING
Trump's session with Republican senators sounded more turbulent.The Washington Post reported details of a combative exchange between Trump and Senator Jeff Flake, an Arizona Republican who has expressed concern that Trump's comments on immigration will cause Hispanic voters in the state to reject him.When Flake stood up and introduced himself, Trump told him, ""You've been very critical of me,"" the Post said.
""Yes, I'm the other senator from Arizona -- the one who didn't get captured -- and I want to talk to you about statements like that,"" Flake responded, referring to Trump's past dismissal of Senator John McCain's record as a prisoner during the Vietnam war.The senator urged Trump to stop attacking Mexicans; Trump predicted that Flake would lose his re-election, at which point Flake informed Trump that Flake was not up for re-election this year.Flake's spokesman Jason Samuels said the Post account was accurate.Trump also turned to Senator Ben Sasse of Nebraska, who has refused to endorse him, and ""said something along the lines of 'Surely you don't want Clinton,'"" one Republican aide said of the session.Trump said he would win also in Illinois, the home state of a third Republican critic, Senator Mark Kirk, who is in a tight re-election race and recently withdrew his endorsement of Trump.""He's wrong,"" Kirk told reporters several hours later.""I think Trump is going to get a vote like Alan Keyes got, which is about 28 percent,"" Kirk said, referring to the Republican who ran unsuccessfully for senator against Obama in Illinois in 2004.  Trump's Twitter posting as he left Washington showed no sign of discord. ""Very interesting day! These are people who love our country!"" he tweeted. (Reporting by Susan Cornwell; Additional reporting by Kouichi Shirayanagi; Editing by Howard Goller)"
9	http://reuters.com/article/us-health-zika-congress-idUSKCN0ZN1PU	U.S. Democrats pressure Republicans for bipartisan Zika funding	"


By David Morgan
| WASHINGTON

WASHINGTON The White House and congressional Democrats pressured Republicans on Thursday for bipartisan Zika-funding legislation, saying the public health battle against the mosquito-borne virus is being undercut by efforts to ram through a bill with less funding.But there was no sign that Republicans would abandon their $1.1 billion measure, raising the chance that Congress will leave the growing health crisis unattended until September. In a conference call, the director of the Centers for Disease Control and Prevention said the lack of funding has made it difficult for the health agency to ramp up mosquito-control and diagnostic testing and pursue new research.President Barack Obama asked the Republican-controlled Congress in February for $1.9 billion in emergency funding to fight Zika. But as lawmakers prepare to leave for a seven-week recess on July 15, Senate Democrats who defeated the Republican measure last week predict it will only fail again.""We are at the 11th hour and 59th minute before Congress is gone all summer,"" said Democratic Senator Bill Nelson of Florida, which is among a number of southern U.S. states likely to be hard-hit by the Zika virus.U.S. health officials say Zika infections in pregnant women can cause microcephaly, a birth defect marked by small head size that can lead to severe developmental problems in babies. Over the past few days, Obama has urged Senate Republican leader Mitch McConnell and Senate Democrats to adopt a bipartisan approach. On Thursday, Democrats called on McConnell and House of Representatives Speaker Paul Ryan to revive a bipartisan measure that passed the Senate in May.
McConnell has said he would stick with the current legislation, which was agreed by House and Senate negotiators and has already passed the House. A senior Senate Republican aide dismissed the call for change as ""cover"" for Democratic efforts to block the Republican measure. A Ryan spokeswoman said: ""We hope Senate Democrats do the right thing and end their filibuster.""Even some Democratic aides expressed skepticism that McConnell or Ryan would change course.       The CDC is monitoring 320 pregnant U.S. women with laboratory evidence of Zika infection. In Puerto Rico, where Zika has been rampant for months, as many as 50 pregnant women are infected every day, CDC Director Thomas Frieden said.
Altogether, there are more than 1,130 Zika cases in the United States, the CDC said. All contracted the virus outside the United States, in a lab or through unprotected sex. Frieden said the CDC has spent most of the $222 million it has received for Zika in the United States on state and municipal efforts, funding, staffing and equipment.""It's frankly difficult to navigate with so many unknowns,"" Frieden said. ""That's why we haven't been able to do things like begin ramping up centers of excellence to improve the performance of diagnostic tests, of mosquito control and to begin some of the really in-depth studies.""
Additional funding would also aid vaccine research and help community health centers in areas with the highest Zika transmission rates. The Republican measure failed in the Senate on June 28 when Democrats objected to Republican provisions, including one to prevent Planned Parenthood from receiving funds to combat what can be sexually transmitted infection.The legislation would also take money from battling the Ebola virus and from funds set aside to implement the Obamacare health insurance program in U.S. territories.""They'll force yet another failed vote on this cynical legislation and then pack their bags for the longest Senate vacation since 1954,"" Senate Democratic leader Harry Reid said.The World Health Organization has said there is strong scientific consensus that Zika can also cause Guillain-Barre, a rare neurological syndrome that causes temporary paralysis in adults. The connection between Zika and microcephaly first came to light last fall in Brazil, which has now confirmed more than 1,600 cases of microcephaly that it considers to be related to Zika infections in the mothers. (Reporting by David Morgan; Editing by James Dalgleish, Bernard Orr)"
