	Link	Title	Text
7	http://reuters.com/article/us-usa-election-debate-ratings-idUSKCN12K1P8	Final Trump-Clinton debate draws nearly 72 million viewers, third largest ever	"


By Jill Serjeant

An estimated 71.6 million people watched the final debate between White House contenders Hillary Clinton and Donald Trump on TV on Wednesday, below the audience for their first encounter but the third-largest total ever recorded.  The data supplied by the Nielsen ratings agency on Thursday covered people who watched Wednesday night's debate on the four main U.S. broadcast networks plus nine cable and public television channels.The first Clinton-Trump face-off in September attracted a total TV audience of 84 million, the largest in the history of U.S. presidential debates.Last week's second debate, which was broadcast opposite popular ""Sunday Night Football,"" was seen by 66.5 million.
Wednesday's audience ranked as the third-highest for a U.S.  presidential debate since Nielsen started collecting TV viewership figures for the encounters in 1976. A 1980 debate between Democratic President Jimmy Carter and Republican challenger Ronald Reagan drew 80.6 million viewers.Nielsen data reflects only those who watched the debate on TV at home and did not include millions more who watched online, through social media or in bars and restaurants.
The third debate ahead of the Nov. 8 election was marked by Trump's refusal to commit to accepting the outcome of the election if the Republican candidate loses to his Democratic rival, challenging a cornerstone of American democracy.The presidential election debate, held in Las Vegas, was moderated for the first time by a journalist from Fox News, Chris Wallace. It gave Fox News cable channel  the lead in number of viewers for the debate at 11.2 million, followed by broadcasters ABC and NBC with more than 10 million viewers each.
Second and third presidential debates have generally attracted smaller TV audiences because many voters have already made up their minds after a presidential campaign lasting more than a year. (Reporting by Jill Serjeant in New York; additional reporting by Lisa Richwine in Los Angeles; editing by Frances Kerry and Jonathan Oatis)"
8	http://reuters.com/article/us-usa-obamacare-idUSKCN12K0A9	Obama says his departure may fix what ails Obamacare	"


By Roberta Rampton
| MIAMI

MIAMI President Barack Obama said on Thursday that his departure from office in January might be what it takes to begin to heal the political scars over Obamacare and allow for needed fixes to his signature healthcare law.The 2010 Affordable Care Act tipped off a long and bitter political and legal battle between the White House and Republicans in the U.S. Congress who said the 2010 law creates unwarranted government intervention in personal healthcare and private industry.Republicans have been quick to highlight a recent barrage of negative headlines about rising health insurance premiums and shrinking doctor networks for people participating in subsidized insurance plans offered under the law.Obama acknowledged the law is not working perfectly, but said the problems could be fixed by legislation, encouraging lawmakers to create a government-run health insurance option to help U.S. states where there is little or no competition among private insurers.""Maybe now that I'm leaving office, maybe Republicans can stop with the 60-something repeal votes they've taken and stop pretending that they have a serious alternative ... and just work with the next president to smooth out the kinks,"" he said in a speech at Miami Dade College.""They can even change the name of the law to Reagancare, or Paul Ryan care,"" Obama said, evoking the name of the Republican speaker of the House of Representatives. ""I don't care. I just want it to work.""But Ryan, in a written response, said he would continue to seek to repeal and replace the law. ""At this point, one thing is clear: this law can't be fixed,"" Ryan said.Obama was later slated to headline a rally in Florida, a battleground election state, for Hillary Clinton, the Democratic candidate in the Nov. 8 presidential election. Clinton has said she would add a public option and expand tax incentives for healthcare costs. Republican nominee Donald Trump has pledged to repeal and replace the law.
The government forecasts 13.8 million people will sign up for Obamacare plans in 2017, up 1.1 million from 2016.There are 10.7 million uninsured people who are eligible for the exchanges but have not enrolled, and about 40 percent of those are young, Health and Human Services Secretary Sylvia Burwell said on Wednesday.Obama said that nationwide, not enough young and healthy people have signed up to provide a revenue stream that offsets the costs of covering members with serious illnesses.As a result, several big insurers, including UnitedHealth Group Inc (UNH.N), Aetna Inc (AET.N) and Humana Inc (HUM.N), are pulling out of the online marketplaces selling the subsidized plans, citing bigger-than-expected financial losses.
Monthly premium prices have climbed, which further discourages some people from signing up.""Next year will tell whether those are growing pains, or they are more serious issues,"" Drew Altman, chief executive of the Kaiser Family Foundation, said in an interview.Analysis conducted by the nonpartisan foundation suggests at least 16 million people need to enroll before the online Obamacare insurance marketplaces stabilize.Obama said expanding insurance coverage for millions of people and reforming the healthcare system was a key reason he ran for office. He said he gets letters from Americans every day thanking him for the difference it has made in their lives.
The law cut the number of uninsured Americans from 49 million in 2010 to 29 million in 2015.Much of the decline is due to the law's provision allowing states to expand Medicaid health coverage for the poor.The law also prohibited insurance companies from denying coverage to Americans for existing medical problems, and allowed parents to keep children insured on their health plans until age 26.Some health policy experts on both the political left and right say Congress may be more receptive to bipartisan efforts to fix the Affordable Care Act after Obama leaves office. Some Republican governors who refused to expand Medicaid may also be more willing to do so after the election - a change that would expand coverage for about 4 million people.""I think the piece of Obamacare that people don't like is Obama,"" Kathleen Sebelius, Obama's former Health and Human Services secretary, who oversaw the program's launch, said in an interview. ""This has become a very personal battle about this president, which is I think really unfortunate."" (Additional reporting by Timothy Gardner and Ayesha Rascoe in Washington and Caroline Humer in New York; Editing by Bernadette Baum and Leslie Adler)"
9	http://reuters.com/article/us-virginia-election-idUSKCN12K289	U.S. judge orders Virginia to extend voter registration through Friday	"


By Scott Malone

A federal judge on Thursday ordered Virginia to reopen its voter registration window and allow residents to continue to sign up through midnight Friday, after its online registration portal was unavailable to many users earlier this week.U.S. District Judge Claude Hilton's order came in response to a lawsuit filed on Tuesday by the activist New Virginia Education Fund, which complained that the state's online voter registration portal had worked erratically in the days leading up to the state's initial Monday deadline to register.The lawsuit argued that the problems risked illegally denying thousands of people the right to vote in the Nov. 8 election.Virginia Governor Terry McAuliffe this year restored the right to vote to thousands of ex-felons, a move seen as potentially tipping what had been a traditional Republican stronghold in Democrats' favor.
""I am pleased that the court has agreed with the request to extend Virginia's voter registration period after unprecedented web traffic prevented many people from completing their registrations online before the original deadline,"" McAuliffe, a Democrat, said in a statement on Thursday. ""The Commonwealth will fully comply with the court's order and extend our registration process online, in person and through the mail.""
State law gives the power to extend voting registration to the legislature, so McAuliffe had been unable to act until the judge's ruling, noted Carl Tobias, a law professor at the University of Richmond School of Law. The Republican-controlled legislature had declined to take any action following the flurry of complaints on Monday.""The real question is if this leaves enough time to get the word out to people who had been blocked from registering and may not know that the issue has been resolved,"" Tobias added.
Shortly after the judge's decision was handed down in an Alexandria courtroom, the state's Department of Elections updated its Web site to show the new deadline.Representatives of the New Virginia fund did not immediately respond to requests for comment.Recent polls show Democratic presidential candidate Hillary Clinton leading Republican New York real estate developer Donald Trump in the state.The decision comes the week after a judge in North Carolina gave residents in counties hard hit by Hurricane Matthew additional time to register to vote. Similar steps were also taken in parts of Georgia, South Carolina and Florida following the storm."
