	Unnamed: 0	Link	Text	Title	Terms	Topics
12	12	http://www.slate.com/articles/news_and_politics/politics/2012/05/the_john_edwards_trial_why_it_was_so_dull_.html	"The grade-A dynamite evidence in the John Edwards trial, Exhibit 128, was a letter from the reclusive heiress Rachel ""Bunny"" Mellon, dated April 21, 2007, and addressed to Edwards' body man/consigliere/sycophant Andrew Young. Mellon was incensed at a Politico scoop about her candidate billing a pricey haircut to his campaign. ""It inspired me,"" she wrote. ""From now on, all hair cuts etc. that are necessary and important parts of his campaign ... Please send the bills to me c/o Alex Farger in N. York. It is a way to help our friends without government restrictions. Bang. This, according to government prosecutor David Harbach, proved that Mellon was intending to dodge campaign finance laws. The letter was the gorilla glue in the government's June 2011 indictment of Edwards. If Edwards goes down--the jury started deliberating today--this will be why. Mellon, according to the government, was the enabler of a massive conspiracy. But figuring this out didn't take a lot of digging by prosecutors. Mellon's letter appeared in Young's February 2010 cash-grab memoir, The Politician. Young described a letter ""written in delicate script on pale blue stationary,"" and explained what it promised. Mellon eventually cut six checks with phony memo lines (""antique chair"") to pay for the lifestyle of Edwards's pregnant mistress, Rielle Hunter. The most surprising fact about the John Edwards' trial is how unsurprising it was. In two years and three months, over the entire discovery period, the government's prosecutors found nothing better than this letter. The government evidence is clickable at this link (PDF). It's heavy on innuendo and heavier on embarrassment. It's awfully light on examples of clear-cut campaign finance abuse. The trove of recorded calls from John Edwards reveal that he was secretive= --""Elizabeth will probably be here in about 15 minutes, so the sooner you get this the better""--but not that he was directing his own conspiracy. What the government needed to prove was that Edwards broke the law with a plot to ""falsify, conceal, and cover up by trick, scheme, and material device"" the money used to cover up his affair. That money was passed along by two people: Bunny Mellon and Edwards campaign-finance chairman Fred Baron. Both of them approached the task with cheek. ""Old Chinese saying,"" wrote Baron (PDF) in one note to Young. ""Use cash, not cards!"" This, too, was in the Young memoir. The ""most heart rending moment of the trial,"" according to ABC News, came when a former Edwards ally testified about the candidate and his late wife having it out on ""an airport tarmac,"" Elizabeth Edwards tearing off her blouse to shame the scoundrel. Hearing the story in court caused their daughter, Cate Edwards, to tear up and bolt out. But the story was well known to readers of The Politician: It was on page 142. The prosecutors had great material. But they had nothing new to prove that Edwards violated campaign-finance law by letting Bunny Mellon and Fred Baron bail out Hunter. To do so, Edwards needed to take unregulated, secret money ""provided for the purpose of influencing the presidential election."" Did the $900,000 of Mellon/Baron cash qualify? The best evidence came from Young. In his memoir, Young dates the cash-for-Rielle plan back to a mini-crisis in 2007, when Elizabeth Edwards got too curious about an expense someone had made in New York when her husband was on the West Coast. Young shelled out for Hunter's expenses. Edwards ""promised I would be repaid when a wealthy benefactor was recruited to cover these costs or when Mrs. Edwards died."" Months later, the wealthy benefactors were found. Pure sleaze, but did it represent a campaign-finance law abuse? Edwards told his aide that he would paper over the Hunter expenses with the help of dupes. The key dupe, Mellon, offered the money for ""necessary and important parts"" of the campaign, as they related to Edwards himself--expenses like his haircuts, a part of his livelihood that was billed to the campaign only by accident. Young and Edwards took her for a ride, but as Richard L. Hasen pointed out when the trial began, the FEC precedent that does the most for the prosecution claims that friendly cash isn't a ""contribution"" if ""gifts of a personal nature... had been customarily received prior to candidacy."" Mellon had opened her checkbook for Edwards's causes before he made the 2008 bid. Edwards subsequently used her to cover up his personal life. Still, the prosecution may have done enough. According to the jury instructions from Judge Catherine Eagles, ""The government does not have to prove that the sole or only purpose of the money was to influence the election. ... People rarely act with a single purpose in mind."" The jurors' job is to determine whether the money was provided ""for the purpose of influencing an election."" The Mellon letter expressly says that she's thinking about ""the campaign."" Bang. You can see why Edwards's defense team rested without letting their client speak for himself. The prosecution merely needed to remind jurors of the many colorful ways in which the Man Who Might Have Been Vice President disgraced himself. He duped Mellon liked he duped everybody else. You don't need a new story to send him to jail."	"Why the John Edwards Trial Was So Surprisingly Dull
"	['Hunter']	[]
13	13	http://www.slate.com/articles/news_and_politics/politics/2012/05/survey_bias_how_can_we_trust_opinion_polls_when_so_few_people_respond_.html	"When you get a call on your cellphone from an unfamiliar number, do you answer it? If the person on the other end of the line immediately tries to assure you they're not trying to sell you anything, do you believe them? If they tell you they're conducting a public opinion survey that will only take a few minutes of your time, do you go ahead and start sharing your views on religion, gay marriage, the economy, and the upcoming election? If you answered ""yes"" to all those questions, congratulations! You're among the 9 percent of Americans whose opinions stand in for those of the nation as a whole in public opinion surveys. The nonprofit Pew Research Center is one of the least biased, most reliable polling organizations in the country. When they tell you that only one-half of Americans believe Mormons are Christians, one in five U.S. adults still doesn't use the Internet, and that a majority of Americans now support gay-marriage rights, you'd like to think you can trust them. Recently, though, Pew decided to turn the spotlight on the reliability of its own research. What it found was alarming: Fewer than one in 10 Americans contacted for a typical Pew survey bothers to respond. That's down from a response rate of 36 percent just 15 years ago. Why should we care? Two of the top stories in the presidential campaign at the moment are Mitt Romney's ""woman problem"" and Barack Obama's move to support gay marriage. But do women really dislike Romney? And was Obama boldly taking an unpopular stand, or capitalizing on a shift in public attitudes? A new CBS/New York Times poll has raised eyebrows (and the Obama Administration's ire) by suggesting that Romney actually leads among women--and that most people still oppose gay marriage. If such polls aren't reaching a representative subset of the populace, it's hard to know what to believe. (Disclosure: Slate has teamed up with SurveyMonkey for a series of monthly political surveys. These surveys are different from Pew's polls in that they're intended to provide a snapshot of the electorate, not a scientific reading of the nation's preferences.) This isn't just a Pew problem. Response rates to telephone surveys--which since the late 1980s have been the standard for polls attempting to reach representative samples of Americans--have been sliding ever since people started ditching their landlines. For many possible reasons--including mobile phones' prominent caller ID displays and the ""vibrate"" option--far fewer people these days pick up when a stranger calls at 8 p.m. on a weeknight. Those who do answer their cellphones are often teens too young to be eligible for the polls. And when they do pick up, they're less likely to hand the phone off to an adult in the household. Survey outfits' initial response to the cord-cutting trend in the early 2000s was to ignore it. But the response rates of even those who still have landlines have also dropped off of late. And besides, it soon became clear that calling only landlines created serious problems with their data. Landline surveys, for example, reach more Republicans than Democrats. Given that polls are often judged on their resemblance to actual election results, such findings gave organizations plenty of incentive to bring cellphones into the mix, despite the added hassle and expense. The best pollsters now carefully weight their calls between landline and mobile phones to match their prevalence in the population as a whole. (Though there's no public cellphone directory, wireless providers make their lists of active numbers available to polling organizations.) But that hasn't fully solved the survey nonresponsiveness problem. To understand why, consider the difference between these two statements: 1) One in five U.S. adults doesn't use the Internet. 2) Of the 9 percent of U.S. adults who respond to telephone opinion surveys, one in five doesn't use the Internet. The second sounds less definitive, right? But how much less definitive? We don't know. And that's the root of the problem. A lower response rate, on its own, doesn't necessarily imply flawed results. In a widely cited 2006 paper, University of Michigan professor Robert Groves--now director of the U.S. Census Bureau--explained how efforts to increase response rates can actually lead to less reliable data. Groves cited a 1998 study in which exit pollsters offered some voters a free pen if they participated. That increased the response rate, but for some reason, Democrats were more enticed by the pens than Republicans, skewing the results. How can we tell if Pew's low response rate affects its findings in a given survey? We need to know whether the 91 percent who decline to respond differ in their attitudes from the 9 percent who participate. Pew's new meta-survey attempted to find out. It did this by comparing the results of one of its own telephone surveys to the findings in benchmark U.S. government surveys, which have response rates of 75 percent. Some of the discoveries were comforting. It seems that Republicans and Democrats are equally disinclined to take Pew's calls, diminishing the risk of misgauging a presidential race. And Pew's respondents are registered to vote at about the same rate as the wider population. But there are some striking differences. Of the people who respond to Pew surveys, 55 percent said they had volunteered for an organization in the past year--more than twice the percentage among respondents to the government's surveys. Fifty-eight percent said they had talked with their neighbors in the past week, compared to 41 percent of those reached by the government. And Pew respondents were more than three times as likely to have contacted a public official in the past year. Those results make some intuitive sense. Survey respondents tend to be people who are more inclined to share their time with people they don't know well. Still, Pew was wise to ask these questions: It now knows to look out for these biases in future survey results. (The government, for its part, must be careful to account for the fact that its respondents are disproportionately U.S. citizens, presumably because noncitizens aren't eager to talk to government officials about their immigration status.) There were also some oddities in Pew's results, however. Its respondents are somewhat more likely to be smokers, more likely to be on food stamps, and--perhaps surprisingly--more likely to be Internet users. Groves, the census director, tells me that telephone surveys also tend to reach fewer urbanites and fewer people who live alone. The differences aren't huge, but they're enough to make anyone wonder: Just what other attributes might differentiate survey respondents from the average American? On most issues that Pew studies, we may never know, because there aren't government benchmarks for, say, the number of people who would consider voting for a Muslim congressional candidate. ""Nonresponse bias,"" as this is called, is just one of the many types of bias that can skew poll results. There's the famous (and controversial) ""Bradley Effect,"" in which white respondents overstate their willingness to vote for a black candidate when they're on the phone with another person, because they don't want to seem racist. Polls conducted by snail mail may overrepresent the elderly. (That's called ""coverage bias."") And there are all the ways in which the framing of a question can affect people's answers. A classic example: People are much less likely to favor cuts to U.S. foreign aid spending if told ahead of time that it makes up just 1 percent of the federal budget. (The average voter believes it's more like 25 percent.) To be clear, all of these are distinct from your run-of-the-mill sampling error--the small degree of inaccuracy inherent in any poll administered to only a portion of a population. Sampling error, in contrast to nonresponse bias, is easily estimated (and typically reported along with results). For what it's worth, surveys today are probably more reliable on the whole than they were 30 years ago. Back then, most reputable polls were conducted door-to-door, because landline phones weren't yet prevalent enough to provide a representative sample. Perhaps, then, the 1990s and early 2000s--when the best public-opinion surveys served as incredibly reliable proxies for the views of the populace--were a short-lived golden age in American public-opinion research. The ability to reach almost every U.S. household might have been a historical anomaly, a fortuitous side effect of a particular set of technological circumstances. Can polling ever get back to that level of reliability? Perhaps. Michael Dimock, associate research director for the Pew Research Center on People and the Press, admits that technological flux is always a problem for pollsters, but believes they find ways to adjust eventually. Meta-studies like Pew's are a good first step. And Robert Groves, the census director, tells me improvements in Internet-based data mining are already helping to fill in some of the gaps in traditional sample surveys. A phone survey focusing on the number of people who want to sell or buy houses, for instance, can now be complemented by data from Realtor.com. ""The big story is that how we measure humans is undergoing fantastic changes,"" Groves says. ""We're in the middle of the revolution."" Will that revolution be the death of pollsters? Survey says: too close to call."	Only Weirdos Respond to Opinion Surveys. Can We Still Trust Them?	['Romney', 'Obama']	['gay']
14	14	http://www.slate.com/articles/news_and_politics/politics/2012/05/joe_ricketts_jeremiah_wright_obama_ad_campaign_proposal_exposes_the_right_s_rage_.html	"Mitt Romney wants to make the 2012 election a referendum on the economy. Facing an electorate that likes Barack Obama personally, Romney has said again and again that Obama is a nice guy who just doesn't know how to create jobs. The last thing Romney needs is a rogue, richly funded right-wing campaign to change the subject from Obama's job performance to his character, particularly a rerun of the 2008 attack on Obama's ties to the Rev. Jeremiah Wright. But that's what Romney will get, if Republican donors and operatives can't control their rage. The latest sign of trouble is a proposal for a $10 million ad campaign, commissioned by TD Ameritrade founder Joe Ricketts and drafted by advisers to John McCain's 2008 presidential candidacy. The plan proposes to fund television, newspaper, and outdoor ads, starting with an already scripted five-minute video. The script and proposal, leaked to the New York Times--and subsequently renounced by Ricketts after the ensuing uproar--are politically insane. But they offer an instructive psychiatric portrait of the rage in Romney's party. Too many conservatives are too angry to think straight. The ad campaign proposal begins with a problem for Republicans: Voters ""still aren't ready to hate this president."" The word ready makes clear that this is where the plan's authors eventually want to go. The dilemma with regard to voters and Obama, they write, is ""how to inflame their questions on his character and competency, while allowing themselves to still somewhat 'like' the man."" The plan's stated challenge is an emotional tension in the electorate. But the tone conveys an emotional tension among the authors: how to express their contempt for Obama in a way that doesn't alienate the public. Revulsion oozes from every frame of the video script, though the authors try to pin the hatred on Obama. ""Week after week, year after year, he heard the hatred,"" the script says of Obama's attendance at Wright's sermons. It says Obama ""attacked and inflamed,"" leaving us a world ""wracked with hate-filled passions."" At one point, the script depicts Obama pushing a gurney (symbolizing Obamacare) past a family whose ""eyes follow him with disgust."" Why must we hate Obama? Because he hates America. The insertion of Obama's middle name in the title of the video script booklet--""The Defeat of Barack Hussein Obama""--signals the message. Beside a picture of Obama with Wright, the script alleges, ""There's simply a fundamental difference between his view of America and ours."" It adds: ""He was taught for years that America WAS the problem, so how could he ever believe that America could be the solution?"" Beneath the hatred, humiliation boils. ""Our plan,"" the authors write, is to show how Obama and his left-wing mentors ""brought our country to its knees."" Accompanied by images of Obama bowing to foreign heads of state, the script asks: ""How can our president stand up for America when he's bowing, begging, kneeling and apologizing for America?"" Later, it repeats that Obama ""compulsively bowed and apologized to foreign leaders."" Even on the economy, the script says Obama ""brought us to our knees."" A caption placeholder calls for an image of a struggling American ""literally on his knees in shame."" Hilary Rosen's recent crack about Ann Romney reminded Democrats that it's nearly always a bad idea to target the candidate's wife. But authors of the proposed anti-Obama video can't resist strafing the First Lady. Their frame introducing Wright calls him ""the pastor who married Barack Obama to Michelle."" They can't even restrain their language. After showing Wright's ""God DAMN America"" quote--twice--the script retorts that Obama ""promised change. But it damn sure wasn't the change we expected."" Nor can the authors suppress their urge to refight the last election. Obama has been president for three and a half years. Throughout his term, the economy has sucked. His whole reelection strategy is to ignore that disappointment, rewind history, and rerun the 2008 campaign. This video would help him do that. It dwells less on his presidency than on our folly in electing him. ""How did we overlook that?"" the script asks, recalling Obama's ties to Wright. ""Should we have known? Should we have known? Perhaps there is no more important question."" And again: ""Should we have known when we learned his mentor blamed America for the 9/11 attacks ... right after the planes hit?"" The draft concludes with white text on a black screen: ""Seldom in life do we have a second chance to make the right decision."" The authors seem angry not just at Obama, but at voters. They want to focus attention not on 2011, but on 2001. They're angry at McCain, too. They blast him for refusing to use Wright against Obama in 2008. They call McCain ""a crusty old politician who often seemed confused."" Freed from his good judgment, they look forward to fulfilling their urges: ""Our plan is to do exactly what John McCain would not let us do."" They won't get their wish just yet. Some insider, recognizing the insanity of the proposal to Ricketts--and apparently alarmed that it might soon be implemented--leaked it to the Times. Outrage erupted, and Ricketts scrapped it. But this fight isn't over. The people behind this proposal or named in it include McCain's media adviser, McCain's Internet strategist, and Jon Huntsman's pollster. Such people, and others like them, can make things happen, particularly with the aid of sympathetic freelance financiers. Ricketts is a major conservative donor. His son is a member of the Republican National Committee. As the proposal points out, Ricketts has felt for some time that Republicans should have used Wright more aggressively against Obama in 2008. For now, the Times leak has put a lid on the right's rage. But the pot is still boiling. Look out."	The New Attack on Obama and Jeremiah Wright Exposes the Right's Rage	['Ricketts', 'Obama', 'Romney', 'McCain']	[]
