	Unnamed: 0	Link	Text	Title	Terms	Topics
20	20	http://www.slate.com/articles/news_and_politics/politics/2012/06/obama_s_gaffe_will_keep_the_mitt_romney_from_taking_any_risks_.html	"On June 8, 2012, President Obama declared ""The private sector is doing just fine""--and the Chaos Muppets were released. Every Republican official and piece of the GOP firmament issued a press release saying this proved the president was out of touch. Senate Majority Leader Mitch McConnell asked if the president was living on another planet, Speaker John Boehner and Eric Cantor held a special press conference, Chris Christie was undone, and of course Mitt Romney had a say. GOP Archers for Less Regulation may have even sent out a Tweet. The political fallout was predictable in a campaign where each side rolls out emergency fainting couches and commits synchronized jaw-dropping at the latest perceived outrage. Barack Obama is never allowed to say the economy is ""doing just fine,"" just as sure as Mitt Romney is never allowed to say he's ""not concerned about the very poor."" Democrats clobbered Romney for his remark back in February. Now it was time for Republicans to make the president suffer. Some were even paying Obama back for his attacks on John McCain in the last campaign for a similar remark about the economy's fundamentals. (The RNC video making use of Obama's remark is almost identical to the 2008 Obama ad about McCain.). Will this election be a choice between Barack Obama and Mitt Romney or a referendum on Barack Obama's handing of the economy? President Obama would like it to be a choice, but he is stuck with the reality that it's likely to be a referendum. That is how he found himself in the position of saying what he did about the private sector--which is not without basis in fact.  He wanted to explain the current economic slowdown, where private sector employment has been improving while the public sector has been contracting, so that he could blame Republicans for not supporting his solutions. He also explained that if the economy gets worse it's Europe's fault. For Mitt Romney, the president's remarks no doubt seemed like a gift, but they also presented him with a choice over how to approach this election. In the wake of the Scott Walker victory in Wisconsin, conservatives from Charles Krauthammer to Bill Kristol to Walker himself have called on Romney to make the campaign about more than Obama's economic record. They would like him to make his campaign an affirmative case for conservative policies. Obama's Great Private Sector Is Fine Declaration of June 2012 is likely to hurt their argument and encourage Romney to continue along his cautious path. Why would Mitt Romney change course when the president is making these kinds of self-inflicted wounds? Political gifts like this will keep rolling in as the president tries to wriggle out of catching blame for the economy. Why say anything provocative that might take the focus away from the president? Also, the president's ""gaffe"" points out something Romney knows well: The modern campaign news cycle doesn't allow candidates to say complex or risky things. Bold policies--even boldy conservative policies--have to be explained; and explaining requires a sympathetic audience willing to at least consider the meaning of adjoining sentences, not merely judge you for what you say in a single sentence. The point of such a campaign, Romney's supporters rebut, is not simply to win the election but to have an election that is worth winning--to build a mandate for conservative government without which you'll never be able to govern as a conservative. Scott Walker, in addition to calling for more boldness from Romney, said a key lesson that he learned was that he needed to educate voters before going forward with big solutions. ""My problem was I was so eager to fix it I didn't talk about it. I just fixed it,"" Walker told Jonathan Karl of ABC News. ""We have learned from this. We are going to both talk about, get people engaged, work on solutions together and then fix it."" This, you may remember, is almost the exact sentiment that got Newt Gingrich into trouble when he claimed that Paul Ryan's Medicare proposal was ""right-wing social engineering."" Gingrich's point was that radical change requires educating and convincing voters. If Mitt Romney decides to stay on the cautious path--giving speeches about free enterprise and keeping the focus on President Obama--it may win him the election. Then he'll just have to figure out what to do with a country that has not been prepared for the kind of sweeping changes he plans to make. If he doesn't win, this will be the moment conservatives will remember. Romney will be the candidate who talked forcefully about creating an environment where businesses can take risks again--and never took one himself."	"Why Obama Can't Say the Economy Is ""Just Fine"""	['Romney', 'Christie', 'McConnell', 'McCain', 'Paul', 'Obama']	[]
21	21	http://www.slate.com/articles/news_and_politics/politics/2012/06/will_mitt_romney_embrace_the_bold_conservatism_of_paul_ryan_and_scott_walker_.html	"Republican anti-tax activist Grover Norquist sees a Wisconsin business opportunity for Mitt Romney now that Governor Scott Walker has survived. Walker built a network of campaign offices across the state. Romney should mount a friendly takeover. ""The smart move for the Romney campaign would be to take over those same staff and don't let them shut down,"" says Norquist. ""In Wisconsin they have the best turnout operation in history. They've been exercising all year. They're excited and they're cheerful."" Can Mitt Romney compete in the battleground state of Wisconsin? The political calculus is complicated. Republicans may have built a state-of-the-art machine for identifying and persuading voters, and they've had chances to repeatedly test it, but no Republican presidential candidate has won in Wisconsin since 1984. Walker's campaign offices might work for Romney, but his voters won't necessarily transfer in the general election. Exit polls on Tuesday showed Obama beating Romney by 11 points (though the margin may be as much as half as big once absentee ballots are factored in). From an ideological perspective, though, Romney should rush to Wisconsin and plant the flag. It is the home of two GOP superstars--Scott Walker and House Budget Chairman Paul Ryan--known for their boldness and perseverance. Romney says that he will be just as bold. If he ran loud and proud in Wisconsin it would send a message that he's going to govern in the same audaciously conservative mold as the state's favorite young guns. It would also be totally out of character for a candidate as risk-averse as Romney. When you think of Romney, the expression ""loud and proud"" doesn't come to mind. Wisconsin isn't just any other battleground state, and Walker's victory wasn't just a victory for a person but for a GOP political philosophy of courageous conservatism. As Virginia Gov. Bob McDonnell wrote on Twitter: ""Tonight, Wisconsin voters rewarded political courage."" Gov. Bobby Jindal of Louisiana also chimed in immediately about Walker's victory: ""good policy is great politics."" Wisconsin's marquee politicians embody the key criteria required for heroism in Republican ranks these days: taking a bold stand and sticking to it no matter how strong the opposition. Chris Christie has a reputation for toughness in New Jersey, but Walker has faced the full force of organized labor and liberal outrage. Ryan has been the centerpiece of President Obama's attacks on Congressional Republicans more than arguably any other Republican in Washington. ""Reince [Priebus] talks about candidates who are true to their word and campaign on issues and govern as they campaigned,"" says RNC political director Rick Wiley, quoting his party chairman--who also happens to be from Wisconsin. ""Scott Walker and Paul Ryan are poster children for that."" Romney agrees with Walker and Ryan on the substance. The Wisconsin test is whether he will act like them. Will he try to finesse Republican ideas past voters with vague proclamations or campaign on them as Walker and Ryan have? This is also a test of the conservative agenda. If Romney chooses to run in the manner of Walker and Ryan, can he survive? Rush Limbaugh reports (!) that in private, Romney said he will be so bold it might make him a one-term president. But so far his campaign hasn't acted that valiantly. Mitch Daniels, the governor of Indiana who preaches a version of the Wisconsin doctrine, has argued that Romney needs to be clearer about what he's going to do if for no other reason than to build a mandate for his eventual actions. Daniels is pointing to the difference between winning an election based on being anti-Obama and winning an election based on ideas. Romney was timid about the Walker recall out of political necessity. (He didn't say a word after the GOP primary in April.) Just like President Obama, Romney didn't want to meddle in a local fight and risk having the outcome over which he has little control be seen as a vote about him. Neither campaign has advertised in the state. Now that Walker has won, will Romney embrace him? Bill Kristol argues that he should rush in for the belly-hug. Kristol writes that the campaign should ""associate Mitt Romney with Governor Walker's success--and the successes of other governors--in making the case for a national agenda of conservative reform of a bloated and bankrupt welfare state."" Indeed, immediately after the Walker victory, Romney called the new GOP hero and issued a tough-talking (for him) statement: ""Governor Walker has shown that citizens and taxpayers can fight back--and prevail--against the runaway government costs imposed by labor bosses. Tonight voters said 'no' to the tired, liberal ideas of yesterday, and 'yes' to fiscal responsibility and a new direction. I look forward to working with Governor Walker to help build a better, brighter future for all Americans."" Romney has already embraced the other Wisconsin GOP hero, Paul Ryan, and Ryan approved of Romney's Medicare reform proposal during the primaries. Romney campaigned with Ryan during his Wisconsin battle against Rick Santorum, and Tuesday Ryan held an event in North Carolina for Romney. This might have been a vice presidential try-out or it might just have been a way to use a party superstar to raise some dollars. But if the moral of the Wisconsin Republican story is that politicians who run with gusto on conservative ideas can win the day, then Romney needs to pick it up a notch. His embrace of the specifics of Ryan's plan has been spotty at best. When one of his advisers was asked about it this past Sunday, he said that Romney supported Ryan but had his own plan. True enough, but Romney's own plan is not nearly as robust and detailed as Ryan's blueprint. It is the expectation among Republicans like Norquist and in Congress that Romney's job as president will be to simply sign the Ryan budget. If that's true, and the Wisconsin lesson is that boldness pays off, then Romney should promise to sign it on his first day in office. That would be extraordinary, because the political risk calculation is more complicated than the hero storyline suggests. Walker's race was brutal and required a massive resource advantage. Ryan's budget plan, while not the liability Democrats initially predicted, is credited with helping Democrats win a Republican seat in New York's 26th district. No matter how exhilarating the Wisconsin narrative may be, Romney also knows details kill. And it's clear that President Obama is ready to pounce. He and Vice President Biden have been trying for months to wrap Romney in the Ryan plan. The sweet spot for Romney is to associate himself with the Ryan plan in general but never get pinned down on the specifics. In 2010, House Speaker John Boehner did not include the full Ryan plan in his pitch to voters called ""Pledge to America,"" because he knew that specificity would give Democrats something to attack. Ryan knows this, too. That's why Ryan talks about closing tax loopholes but doesn't pick which ones. (There are lists.) When Romney was overheard by reporters at a fundraiser mentioning a few of the puny tax loopholes he'd think about snipping, his campaign said he was merely repeating some ideas he'd heard. Romney is still making his transition from primary to general election candidate. The boldest thing he has done so far as Obama's opponent is visit an inner-city Philadelphia school. There he met with some resistance to his conservative ideas. Will he run on a bold set of ideas of the kind championed by the Wisconsin duo now that he is not trying to court GOP voters alone? It remains to be seen. If he does, he'll know the best state in which to make his stand."	Will Romney Embrace Wisconsin's Bold GOP Ideas?	['Rush', 'Paul', 'Romney', 'Christie', 'Obama']	['guns']
22	22	http://www.slate.com/articles/news_and_politics/politics/2012/06/the_economic_news_is_dire_for_obama_re_election_campaign_but_there_are_three_small_bright_spots_.html	"Imagine if every time--booooo--you opened your--boo--mouth--boooo--someone heckled you? That's what President Obama's top adviser David Axelrod faced at a Boston press conference this week. Mitt Romney staffers drove from their headquarters across town to shout him down. Something like this has been happening to the president this election. When he tries to explain why he should be re-elected, the economy opens its mouth and drowns him out. On Friday, the Bureau of Labor Statistics announced that only 69,000 jobs had been created in May, well shy of the roughly 140,000 required to sustain minimum economic health. The numbers for previous months were also revised downward, and the unemployment rate ticked up to 8.2 percent. Booooooooooo. If people lock in their feelings about the economy six months before an election, as so many political strategists say, then the president is in bad shape. We're five months away from Election Day. In some states like Ohio and Florida voting starts four months from now. Though there are some positive signs in the economy--consumer confidence was up last month, so was consumer spending, construction was up, and manufacturing continues to rise--there is no evidence that anything is going to happen that will be dramatic enough to break people out of their funk in which they think the country is heading in the wrong direction and they don't approve of the job the president has done handling economic issues. Since these latest warning signs come after a period of optimism, even if the economy does improve, voters might fear that the clouds will come back again. This is not all the president's woes, not by a longshot. The crisis over the euro is getting worse. American political types are paying attention to the recall election in Wisconsin next week, but the more salient one might be the June 17 election in Greece, which could set off another global economic panic. The European Central Bank president, distraught at trying to get 17 countries to act in concert, is sounding the alarm. A failure in Europe would further depress the U.S. economy by shrinking the customer base for American goods, spooking the stock market, and weakening U.S. banks tied to the global market. President Obama can't do much about the economy at this stage, a fact that only heightens people's frustration with his stewardship. (It must drive him nuts given how much control he has over drones and cyber war in Iran.) But the president and his team have been working to change the subject from a conversation about whether people are better off (which is a question all about his performance) into a question about whether they will be better off (which makes it a contest with Romney). When you have to change the question before you do the convincing, you're usually in a tough spot. You have to convince voters of two things instead of just one. Walter Mondale tried this ""are-to-will"" trick in 1984 against Ronald Reagan, and it didn't work. If Obama can change the question (big if), then he'll need to disqualify Romney as an economic steward of the future. The Obama campaign has been at this on two fronts, attacking Romney's time as CEO of Bain and his tenure as governor (that's what Axelrod was doing as he was getting booed in Boston). The first front took a friendly fire hit on Thursday night. Bill Clinton on CNN said Romney had a ""sterling"" business career.  ""I don't think we ought to get in a position where we say this is bad work,"" he said of Romney's tenure at Bain. ""This is good work."" Clinton went on to say that Romney's good work involved people losing their jobs and didn't necessarily prepare him for the presidency, but by implying that the Obama critique was wrong, the former Clinton at the very least muddied things. If Obama is going to disqualify Romney, he needs people to hear ""layoffs"" when they hear the word ""Bain,"" not hear the word ""sterling."" If you are an Obama supporter, you may be glum at this point. But all is not lost. There are at least three points Obama advisers would like you to cling to:"	Obama and the Jobs Report: The Unemployment Data is Dire for His Re-Election Campaign	['Clinton', 'Romney', 'Obama']	[]
23	23	http://www.slate.com/articles/news_and_politics/politics/2012/05/mitt_romney_winning_the_republican_presidential_nomination_was_always_the_conventional_wisdom_.html	"Yesterday Mitt Romney crossed the magic threshold of 1,144--the number of delegates he needs to win the GOP nomination. You didn't think you needed a yawn, but there ... I've given you a chance to open wide. This is a news-free event--we've known Romney has had it locked up for weeks--but there was a time when this was not considered such an eventuality. Not long ago, who would win the Republican nomination was a hotly contested question, an object of intense speculation, theorizing, and sharp retorts. But then everything fell into place. Let's take a moment to examine the pace of political change. We are entering a fallow political period. The Olympics are coming. Voters are tending to their summer plans. When they're not on vacation, they're outside, away from the stun of endless political ads and vacuous cable debate. Still, fevered political analysis and coverage will continue. (I will be making ample contributions.) Some stories will be incredibly important, some will be notable, and some will be frivolous. To offer some perspective, let's look ahead and behind. It has been 51 days since Rick Santorum dropped out of the race, rendering Romney's milestone in the Texas primary a nonstory. Fifty-one days before that event was Feb. 19. The story that dominated at the time was Romney's desperate fight for his political life. He had to beat a surging Rick Santorum in his home state of Michigan. Ohio looked to be up for grabs, and Romney, once heralded as a disciplined candidate with a well-oiled machine behind him, appeared plagued by missteps. (Remember Ford Field?) Newt Gingrich was plotting to convince delegates that he could pull off an upset in Tampa. (Gingrich was peddling the idea that he had a special relationship with the South.) Yesterday, Gingrich met with Romney in Las Vegas. The former speaker who railed against Romney for dishing ""pious baloney"" is now comparing Romney to Eisenhower. Oh, and let's not forget: brokered convention! Sure, some of these storylines were overblown by the press, hyped by Romney's opponents. But a lot of the near-death drama was deeply felt within the Romney campaign. Also, much of what happened that wasn't important to the outcome was still notable--it showed us what Romney was willing to do in a fight (rely on Donald Trump to make last-minute robocalls in Michigan, for example). The prolonged Republican primary season brought to the fore a challenge Romney still struggles with today: how to appeal to core Republican voters while expanding his lead beyond the older white voters that make up the party's base. The Republican primary was a lot like a Bond film: The outcome was predictable, but you could still have fun watching it happen. The truth of the GOP contest was that despite all the twists and turns, the conventional wisdom was always right: Romney had the organization, experience, and money to pull it off. (The Democratic primary in 2008, by contrast, did not end as the early conventional wisdom predicted.) Now we come to the general election, where a weak incumbent is dependent on an uncertain economic recovery to win the votes of an anxious and skeptical public over a challenger who is not well liked. That is the 2012 presidential contest in a sentence. The conventional wisdom now is that the election is going to be really close and centered around how people feel about the economy. Obama has a better organization and an electoral map with more routes to victory. Romney has the big benefit of a weak economy and an electorate unhappy with Obama's handling of the issue. Fifty-one days from now it will be July 25, still a month before the party conventions, and all of this will still be true. There may be occasional squalls--Contraception! Same sex marriage!--but the contours of this year's election story will be the same. If you're inclined to pay more attention to your backyard barbeque or the little league games, go ahead. During this period, what's dramatic today (Romney up by six in Florida!) is likely to change tomorrow (Obama up by four in Florida!). It's likely that most of the important and meaningful events of the summer will have as little chance of changing the conventional wisdom as many of those leading up to this once-important moment that passed yesterday without much fanfare."	Why the Media Hyped the Republican Primary for the Right Reasons	['Romney', 'Trump', 'Obama']	[]
