	Unnamed: 0	Link	Text	Title	Terms	Topics
21	21	http://www.slate.com/articles/news_and_politics/politics/2014/07/barack_obama_doesn_t_want_a_border_photo_op_the_president_conditioned_the.html	"The consensus has formed: President Obama should have visited the border to take a firsthand look at the influx of Central American migrants. Democratic Reps. Luis Gutierrez, Beto O'Rourke, and Henry Cuellar said so over the past week. Democratic political celebrity Wendy Davis, who is running to be governor of Texas, said so, too. Washington Post Editorial Page Editor Fred Hiatt includes the blunder in his list of sins that calls for a reshuffling of the top staffers in his administration. President Obama is already criticized for being too slow to act, aloof, and out of sync with the public. He inhabits a political office, but sniffs at the theatrical requirements required. ""This isn't theater,"" he said. ""This is a problem. I'm not interested in photo ops, I'm interested in solving a problem."" This episode seems like just another confirming piece of data in a long-term trend. But that's not right. President Obama will happily engage in a photo op. Here he is at the Key Bridge. Here he sends an unsubtle message to the Russians from a meeting with the Polish president. Here he shoots pool. Yum, barbecue! Tuesday he sat in a simulator car. He pushes his staff to seek out photo ops across the country and he's asked his Cabinet to travel this summer to engage in their own. The issue is not his unwillingness to engage in this particular form of presidential art. He's making a choice: when a photo-op isn't to his advantage, he elevates avoiding it to a high-minded ideal. The problem for the president, like all presidents, is that he thinks he has a say in the argument over whether a photo op is meaningful or not. He doesn't. Part of the fix he's in is of his own making. The blunt formula that equates presidential authority with a presidential visit to the scene of a crisis is one that he exploits when it suits him. So in this case, when the president makes the sensible case that his authority should be deployed to other facets of the problem than the border itself, it's no surprise people don't listen. The bully pulpit is undergoing a radical transformation. Technological changes have made it harder for a president to capture the public conversation. The high level of partisanship--in politics and the media--means that even if a presidential message does get through, it'll have a pretty thick coating of spin and counterspin before people have a chance to swallow it. President Obama understands this much, and he has tried to refashion the lines of communication. That's what the president's visits to The View and late-night TV shows are about. That's why the Baltimore Ravens were enlisted to help sell health care reform. In this world, a picture of the president has enormous power. It can be tweeted and Instagrammed to send a message better than any speech he might deliver. As a second-term president, Obama is more reliant on the photo op than ever because it's harder for him to get noticed and covered. So the president traveled to Denver last week to meet with people who had written him letters, to send the message that he is focused on the middle class. It was a purely symbolic gesture, an act of total and complete theater. So no wonder people hear there is a crisis at the border and want to see him there. He's conditioned them to think that when something is serious, he pays it a visit. If you release pictures of the president in the Situation Room showing he's on the case in one instance (when maybe you're trying to milk the drama of the moment), then people are going to expect a Situation Room photograph from the night of the Benghazi attack or from the first night of unrest in Ukraine. A president can't suddenly get virginal about the theatricality of photo ops when it doesn't suit him. It rightfully makes us suspicious of him when he does. But does it make any policy sense to go to the border? There can be good policy reasons for a showy presidential visit. It quickens action. No one leans on his shovel when the president calls. Also, it can send a message of fellow-feeling to those who are suffering, as it did with all of the post-hurricane visits President George W. Bush made, and with the one he didn't make immediately after Katrina. There's also a case that a president learns something from an emergency visit, but it's not a strong case. A president must be able to act without seeing something firsthand, particularly when moving a president outside of the White House compound is such a production. It's a crucial job skill, so it's silly to think he's not acting if he's working from home. Perhaps a visit to the home countries these children are leaving would have been interesting. It seems to have been effective for a Republican congressional delegation that just returned from there. But none of the lawmakers who have visited the border has returned with any potent revelations. They have mostly used the trip as a stage to assert their pre-existing views. Sen. Obama was certainly familiar with this stunt. He did it with a visit to Iraq during his first presidential campaign. It's an effective communications tool, but it's not an information-gathering tool. In this case, President Obama probably wants to avoid the type of feel-good message that photo ops are intended to convey. Indeed, that kind of message would likely backfire. ""You have the president surrounded by little 7-year-olds, and it's an emotional picture,"" says Diana Negroponte, a public policy scholar and Latin America expert at the Woodrow Wilson International Center for Scholars. ""It says to Mama and Papa, 'We have this wonderful president. He will take care of them.' "" Instead, says Negroponte, the president should be sending the opposite message to the parents in their home country: The children will return. If that ultimately is the message the president does send by approving a faster deportation process, it's easier for him to do so if he hasn't had to look these young people in the eye in a big public photo op. A veteran Democratic strategist explains that looking hard-hearted in that way has a clear political downside: It will upset a part of the president's base and damage the Democratic Party's advantage over Republicans on the question of which party is more empathetic toward Latinos in an election year when the deck is already stacked against the party. A visit to the border also has other political downsides White House aides were considering when they decided not to send Obama there last week when he was in Texas. It risks validating the separate Republican argument about the primacy of border security that has been a part of the larger immigration debate. The White House and Democrats argue that this current crisis is not a result of a porous border, but other factors, including violence in the countries these children are fleeing. The fastest plausible way to send a message back to these home countries, say members of both parties, is if buses start returning with migrants who have not been allowed into the United States. That will happen faster if Congress amends the 2008 law that treats children from Central America differently than migrants from Mexico. Republican Sen. John Cornyn and Democratic Rep. Henry Cuellar of Texas have introduced legislation shortening the length of detention hearings. It would send immigration judges to border cities with the hopes of quickening the process for determining whether minors had a legal claim to stay in the United States. Presidential visits are effective when they quicken action, but they also raise the expectation of action. A presidential visit to the border with no quick fix to announce runs the risk of increasing the impression the president is helpless in a crisis. If action from Congress, whether in the Cornyn-Cuellar legislation or of some other shape, is needed, then a more effective presidential photo op than a visit to the border would be a visit to Congress. Another alternative photo op would be a picture of the president on the phone with the president of Mexico. ""The president needs to call the Mexican president and say, 'Neighbor, we need your help,' "" says Negroponte. "" 'The passage of this many children needs your help to stop it.' "" Negroponte argues that the crisis--which includes the deaths of children who did not make it to the border--could not be happening without the complicity of Mexican authorities. President Obama has suggested that he might have preferred a photo op of a White House signing ceremony for comprehensive immigration reform, which Republicans in the House have refused to address. Perhaps, but that's too cute. The president knows that comprehensive immigration reform is not going to be born out of this crisis in time to address the crisis. If anything, Republicans who have been counseling a go-slow approach now have more momentum. The surge of cases at the border helps them make the case that well-intentioned laws have unintended consequences. The president is trying to deflect the political damage of the current crisis back on Republicans by reminding voters of their weakness. If he's going to play that game, then Republicans might as well play the photo-op game."	Obama Conditioned Us to Expect Photo Ops. He Can't Change Our Expectations When It Suits Him.	['Cornyn', 'Cuellar', 'Obama']	[]
22	22	http://www.slate.com/articles/podcasts/gabfest/2014/07/house_of_cards_scandal_and_veep_two_tv_writers_explain_hollywood_s_recent.html?wpsrc=sp_all_native_index	In this week's Political Gabfest bonus segment, David Plotz asks two Hollywood writers to explain the apparent increase in TV shows about Washington. His conversation with Peter Blake and Eli Attie begins here, or around the 53:10 mark below. For info on how to subscribe to the Slate Plus podcast feed, go here.	Why Is Hollywood Making More Political Television? A Political Gabfest Bonus Segment.	[]	[]
23	23	http://www.slate.com/articles/news_and_politics/politics/2014/07/chicago_july_4_shooting_spree_the_police_department_undercounts_murder_and.html	"Over the Fourth of July holiday weekend in Chicago, 82 people were shot in an 84-hour window, according to the Chicago Tribune. Fourteen were dead by Monday morning, including two boys, aged 14 and 16, who were killed by police in separate incidents when they allegedly refused to drop their guns. Things were so chaotic Sunday night that officers responding to the spasm of violence reportedly kept interrupting one another on their radios to report still newer bursts of gunfire. The string of shootings garnered national media attention and prompted Mayor Rahm Emanuel to plead with residents on Monday to put down their guns. ""Wherever you are, wherever you live, the gun violence that was part of this weekend is totally unacceptable,"" Emanuel told a gathering of concerned citizens on the city's South Side, where many of the shootings took place. The outbreak of violence stood in stark contrast to the message coming from Chicago City Hall in April, when Emanuel and his police superintendent, Garry McCarthy, trumpeted police statistics that showed the city had seen its lowest number of murders for the first three months of a year in more than a half-century. That announcement followed January's much-hyped news that 2013's homicide total was 415--still a lot of people killed, but 88 fewer than the previous year and the lowest total since 1965. Emanuel, up for re-election early next year, has highlighted the city's progress in curbing violence in what was the nation's murder capital in 2012. How do we reconcile these two seemingly contradictory narratives? On the one hand, the stats suggest that violent crime is falling in Chicago; on the other, the Windy City remains riddled by gang-related violence. The Fourth's bloody toll wasn't even unusual. Just last year, more than 70 people were shot, 13 of whom were killed, during the same four-day stretch. Things were slightly better in 2012, with at least 8 people killed. All told, if you tally the homicides in Chicago over the Thursday-to-Sunday window closest to July 4, this year's long weekend was the eighth since 2002 to see double-digit murders, according to the city's own statistics. The sad reality is that by the time July 4, 2015, rolls around, we will have largely forgotten this past weekend's violence. We've already done so for last year's Independence Day. The fact that this past holiday weekend was only marginally worse than last year's was a detail largely missing from much of the coverage this week. Even the Tribune, which provided by far the most detailed coverage of the shootings in real time, failed to mention the comparison in its online report on Monday and made only a passing, vague reference to it in its otherwise-comprehensive front-page follow-up the next day. Likewise, few reports bothered to mention a similar string of shootings less than three months ago that left 9 dead and 36 others injured over Easter weekend. The media might have a short memory when it comes to Chicago violence, but the city's Police Department appears to go to great lengths to willfully forget. Chicago magazine published a two-part investigation this year that detailed how the department appeared to be using pretty much every trick in the CompStat book to artificially deflate the city's homicide and violent crime numbers. The reporters, David Bernstein and Noah Isackson, were able to identify 10 people ""who were beaten, burned, suffocated, or shot to death in 2013 and whose cases were reclassified as death investigations, downgraded to more minor crimes, or even closed as noncriminal incidents--all for illogical or, at best, unclear reasons."" Given more time and better access, the article implies, the two reporters could have found plenty more examples of what would be considered murders by everyone but the police. The magazine's investigation likewise documented that the police used similar tricks to depress the city's larger violent crime rate. McCarthy has brushed off those allegations as ""absolute nonsense,"" but Chicago magazine isn't alone in making them. A recent audit from the city's inspector general that focused on assault-related incidents found that police were counting crimes with multiple victims as a single offense, an accounting trick that led to an underreporting of victims by 24 percent in the sample studied. That means a shooting that left a half-dozen people injured--as several did this past weekend--might register in the police books as a single shooting incident. Put another way, recent history suggests that there's a realistic chance that by this time next year, the dead and injured from this past July Fourth won't be fully counted in Chicago's official crime statistics. Even if a portion of the recent drop in crime numbers is due to a statistical sleight of hand, most observers agree that violent crime is indeed falling in Chicago, as it is in most major cities. But the overall numbers obscure the fact that Chicago is a city of neighborhoods, and much of the violence has been sequestered in poor, predominantly black areas of the city where gang violence goes largely unnoticed unless it comes in bunches, as it did this past weekend. After crunching the homicide numbers for 2000 through 2010, Yale University sociologist Andrew Papachristos found that the murder rate was about 3.1 per 100,000 residents living in the Northwest side's Jefferson Park. Less than 10 miles away in West Garfield Park, the rate was more than 20 times that, a staggering 64 per 100,000, or roughly in line with the casualty rate for civilians in Iraq at the height of the last war. When people describe parts of Chicago as urban war zones, it is not hyperbole. Seven aldermen on the City Council have called for an investigation into how the Police Department keeps its books, and an ACLU lawsuit against the city on behalf of a West Side community group claiming that the city doesn't deploy police equitably across neighborhoods continues to wind its way through court. Meanwhile, the violence continues. On Tuesday, the day after Emanuel spoke on the South Side, two more people died from gunshot wounds suffered over the weekend, and at least 11 more people were shot, including a 23-year-old riding his bike and a 17-year-old boy who was walking through a park with a group of friends. The teen was set to start college orientation on Thursday. Both died at the respective scenes."	Chicago's Bloody July Fourth Weekend: Who Is Counting the Dead?	['McCarthy']	['guns']
24	24	http://www.slate.com/articles/news_and_politics/politics/2014/07/congress_and_border_control_immigrant_kids_can_t_spur_politicians_to_action.html	"Do you remember the angle on immigration reform everyone used to agree on? Easy: It was ""the children."" Until the middle of June, the least controversial legalization proposal (not quite a bill) in Congress was citizenship for children brought illegally to the United States by their parents. Even some Republicans who'd opposed the Dream Act, which would have enabled this, had ""evolved"" with the years. ""It is time to provide an opportunity for legal residence and citizenship for those who were brought to this country as children and who know no other home,"" said House Majority Leader Eric Cantor at the conservative American Enterprise Institute. ""Put yourself in their shoes,"" said President Obama in 2012. ""They are Americans in their hearts, in their minds, in every single way but one: on paper."" The president said that when announcing Deferred Action for Childhood Arrivals, which only lifted the threat of deportation for people under 31 and residing in the United States since before 2007. This proved to be fantastic politics, bolstering his re-election--which inspired a panic among ""reform conservatives,"" which is one reason that the Senate passed the Border Security, Economic Opportunity, and Immigration Modernization Act last year. Think of the children! We can't deport the children! Perhaps this wasn't the right way to think of the problem. Cantor lost his primary, thanks in part to his immigration waffling. It was around that time--perfect news-cycle synchronicity--that the surge of illegal child immigration across the Mexican border was elevated from local news story to national crisis. It's estimated that 57,000 unaccompanied children have crossed the border since October. These days they're not eliciting much sympathy at all. Protesters are blocking buses full of kids leaving detention centers from entering a border station. Reformers and restrictionists have retreated into their silos. The pundit class has found a silo of its own, weather-beaten but sturdy, where it can ask the key question: Is this Obama's Katrina? Some say yes; others disagree. You'd hardly notice that Congress is sitting on an immigration bill that would have funded a ""border surge,"" doubling the size of the border fence from 350 to 700 miles and more than doubling the presence of border agents--18,500 to 38,500. That's not saying the bill would have prevented this crisis, which has a lot to do with a (previously) uncontroversial 2008 law that offered humanitarian protections to young border-crossers from Central America. That was a for-the-children measure, too, aimed at sex traffickers and slavers, and there's no appetite for it anymore. No, the argument restrictionists are making, with confidence, is that Obama's loose touch sparked the crisis. It's a ""crisis of his own making,"" according to Texas Sen. Ted Cruz, because the president had been ""promising amnesty"" and ignoring the border. ""We either have an incredibly inept administration,"" said Texas Gov. Rick Perry this week, ""or they're in on this somehow or another."" The theory is that the administration is not above stoking a crisis and that it's actually played games like this before, as when it allowed loose guns to be ""walked"" into Mexico for the eventual purpose of scaring Americans into backing gun control. (This was and is the National Rifle Association's theory.) And the theorizing has been pretty one-sided; Republican reformers say that the eruption of a border crisis makes a liar out of the Obama Department of Homeland Security. ""It hurts,"" said Sen. John McCain to reporters on Tuesday, ""because we have not taken the measures necessary to have a secure border--although the issue here is not a secure border. The children are just showing up. We need more National Guard or whatever it is. We need a change in policy. The message has to go: 'If you cross the border illegally, you will be returned immediately.' "" McCain was reacting to the administration's announcement that it would seek $3.7 billion in emergency funds to beef up border security and speed up deportations. (As long as we're talking Katrina, that crisis led to a $51.8 billion recovery bill.) On the Hill, this was greeted with a synchronized shrug. ""People don't believe that the laws are being enforced,"" explained Florida Sen. Marco Rubio, one of the authors of the Senate's 2013 reform bill. ""They never believed it beforehand. They have good reason not to believe it now."" The way Rubio talked to reporters, you could be forgiven for thinking that ""comprehensive reform,"" the great hope of 2013, was alive. ""I think that the only way you're ever going to get the votes in Washington to move forward on immigration is through a three-step process,"" starting with enforcement, said Rubio.  Did that mean passing the supplemental $3.7 billion? Not as it stood: ""Let's not just throw money at it. Let's put in place the sorts of technological things and increased manpower similar to the bill we passed in the Senate."" Did this mean Rubio's immigration bill? No, it could mean a smaller bill, dealing with security and nothing else. ""If they pass it out of the House,"" said Rubio, ""I think we can potentially pass it out of the Senate, unless the Democrats decide to object to it, because it doesn't have legalization and all the other things associated with it."" In a small way, the overwhelming Capitol Hill cynicism about how to respond to the border crisis is healthy. Panicking after a crisis and passing whatever's on the shelf gave us the Patriot Act. Panicking about sex trafficking--why, that's part of what caused this crisis in the first place. It's just striking that the story of children fleeing horror, and getting stuck on the wrong side of the border, has hardened the positions every member of Congress had before the crisis. Every member of Congress, but not everyone in politics. This week, on his radio show/Web TV network, Glenn Beck announced plans to bring trailers full of water, teddy bears, and soccer balls to the border. ""I've never taken a position more deadly to my career than this,"" he said. ""Anyone, left or right, seeking political gain at the expense of these desperate, vulnerable, poor, and suffering people are reprehensible."" But it was the left that truly worried Beck. He needed to act, he said, because the border crisis could turn into a battle. He'd opposed Cliven Bundy's standoff when it threatened to become a casus belli for a crackdown, for Obama's ""fundamental transformation"" of America. ""Do we rise up so the top can come down and the inside out, and they have their fundamental transformation?"" Beck asked his viewers. ""And they have the heart, the heart of America?"" He couldn't risk that. Think of the children."	57,000 Stranded Immigrant Children Aren't Enough to Get Congress to Do Anything	['Obama', 'Rubio', 'Perry', 'Hill', 'McCain']	['guns']
25	25	http://www.slate.com/articles/news_and_politics/politics/2014/07/colorado_republican_bob_beauprez_47_percent_gaffe_conservatives_think_the.html	"Colorado Republican gubernatorial nominee Bob Beauprez was, we've just learned, a real pioneer. He is under fire for ""47 percent"" remarks he gave in a 2010 speech to the Denver Rotary Club--years before Mitt Romney was taped saying essentially the same thing. In the video, which surfaced on Wednesday, Beauprez condemned Americans who don't pay federal income tax as lazy dependents and pawns in a scheme of big government control. Here is the Denver Post with more:"	Video Shows Colorado Republican Pioneered the 47 Percent Slur	['Romney']	[]
