	Unnamed: 0	Link	Text	Title	Terms	Topics
6	6	http://www.slate.com/articles/news_and_politics/politics/2012/06/bill_clinton_helping_obama_he_keeps_making_political_blunders_while_speaking_for_the_campaign_.html	"Bill Clinton is the great St. Bernard of politics, bounding around the political landscape, rescuing and providing aid while simultaneously knocking over the table lamp. At the moment, he is hosting the annual meeting of the Clinton Global Initiative, which this year is taking a serious look at America's economic problems. He is also in the thick of the 2012 campaign, raising money for President Obama. The trouble is no one is better at articulating the case for Obama's re-election--while at the same time occasionally undercutting Obama's chances. Recently he has been on the wrong end of at least three different statements he has had to clarify--defending Bain Capital, testifying to Mitt Romney's ""sterling"" business career, suggesting the country was still in a recession, and suggesting he favored extending the Bush-era tax cuts. Clinton is doing such good work for Mitt Romney that he now appears in the Republican nominee's press releases. Even Sarah Palin praised Clinton last night, in an effort to make President Obama look way out of the mainstream. What is up with Bill Clinton? Everyone has a theory, which is part of the problem with Bill Clinton. He compels theories from people about his hidden machinations, even when there aren't any. So, let's consider a series of theories based on a round of conversations with Clinton watchers, former staffers, and allies: A storyteller in a Twitter world. Bill Clinton is at his best when he is telling a tale or reasoning something out with you. ""I could give a pretty good one,"" he once said to an Ames, Iowa audience about loping political speeches, ""'cause I came out of a tradition of storytellers where we listened and learned how to tell stories."" That doesn't really fit in the 140 character world of Twitter. The news cycle has sped up even faster since he was president. So has the phony outrage and games of gotcha. His talent for framing what the election is about is less valued and gets less play than the moments when he is off message. He's actually not off message. If you look at Clinton's so-called gaffes, they're not off message in any reasonable sense. When he said that Romney had a ""sterling"" business career, it was right up against a sentence that said he would not be a good president. When he said the Bush-era tax cuts should be ""extended,"" he was talking about a temporary extension to work out a deal with Republicans. Twice in the interview he said he did not support a permanent extension. The comment about the recession was simply an act of misspeaking. He has forgotten how to talk like a politician (because he doesn't have to). Bill Clinton speaks in paragraphs. He spends a lot of his time in long conversations with interesting people talking about global issues. That can deaden your political communications skills which--when sharp--allow you say nothing interesting about even the smallest issues. In order to navigate a world in which your every word is spliced, you must say nothing that can be taken out of context, which is to say, very little at all. The former leader of the free world isn't going to simply read talking points cooked up by the Obama campaign in Chicago, anyway. One strong dissenting voice among my interviews argued that while Clinton did have trouble adapting to the new world during the 2008 campaign, he's long since adapted. He thinks he is the smartest one in the room. Clinton thinks that the Bain attacks on Romney are inefficient and not smart. They also risk hurting major Democratic Party donors. In that CNN interview last week, he also clearly was sending a bigger message about how he thinks this election should be fought: on ideas about the future. That was a memo to the Obama team. It may have been an act of ego, but it was an act of ego to help Obama. This contradicts the theory of those who think that Clinton has been trying to undermine Obama for one reason or another. Occam's bushy beard. Occam's Razor says that the simplest answer is usually the right one. But in the political world people often believe the opposite is true. Practitioners and pundits (at the dinner table and in the green room) often search for the most baroque explanations to explain utterly common things. In medicine, this is known as Hickam's Dictum. So, when Clinton is simply running his mouth, it is interpreted to be subtle positioning to set up his wife's presidential run, or an attempt to undermine Obama's legacy so that Obama won't get elected to a second term and diminish the record of the last two-term Democratic president. He loves politics. As Taylor Branch wrote in The Clinton Tapes, ""[Clinton] never begrudged survival and ambition in politicians, whether friend or foe. Indeed, he reveled in calculations from opposing points of view."" For someone who loves politics this much, Clinton doesn't mind playing a few angles, for whatever purpose, so it's understandable to think every deviation he makes must be a clever stratagem. But when he's making a tactical move, says one who knows him, it's a little more obvious. He works his way to his point in a methodical way. That's not what people have seen in his supposed gaffes. He is angling for his wife. Bill Clinton was his wife's chief surrogate in 2008. He says the decision is up to her, but everyone assumes that he really wants her to make another run for president. So could he be sabotaging Obama to help his wife? That would require enough subtlety not to get caught, but would still need to be bracing enough to do Obama some damage. Even Clinton can't pull that off. But it's true, say those who know him, that Clinton is loyal to those who have helped him and his wife. That would explain his defense of Bain and it would also explain his warm comments about Donald Trump. No single theory explains Clinton. He contains multitudes. Which portion of which theory makes up the complete picture requires you to come up with your own alchemy. As for the Obama campaign, which must handle these little eruptions now and again, the best thing to do is to prepare for the occasional breakage of a family heirloom, because they're never really going to be able to control the St. Bernard."	Has Bill Clinton Lost His Touch?	['Romney', 'Clinton', 'Trump', 'Obama']	[]
7	7	http://www.slate.com/articles/news_and_politics/politics/2012/06/gail_collins_on_the_might_of_texas_in_american_politics_.html	"This is an excerpt from As Texas Goes ...: How the Lone Star State Hijacked the American Agenda, by Gail Collins. My fascination with Texas began rather suddenly. It was the spring of 2009--you will remember, that was the season when the political right was failing to adjust to the idea of a President Obama. And there was Gov. Rick Perry at a Tea Party rally in Austin, publicly toying with the idea that his state might consider seceding. It was quite a moment. Perry was standing behind a podium with a ""Don't Mess With Texas"" banner, wearing jeans, his trademark boots, and looking pretty damned ticked off. ""Texas has yet to learn submission to any oppression, come from what source it may,"" he said, quoting the state's great founding father, Sam Houston. When Houston made that remark, he was definitely attempting to break away from the country to which Texas was then attached. ""We didn't like oppression then, we don't like oppression now!"" Perry roared to the cheering crowd, some of whom were waving ""Secede!"" signs. It did sure sound like an Alamo kind of crisis. Their backs were to the wall! And, important point: This was just a rally about the stimulus package. It was perhaps the first time the rest of the country had taken notice of the fact that 21st-century Texans did not necessarily consider the idea of breaking away to become a separate nation as, um, nuts. We non-Texans were somewhat taken aback. How long had this been going on? Was it something we said? ""We've got a great union,"" Perry assured reporters after the rally ended. ""There's absolutely no reason to dissolve it. But if Washington continues to thumb their noses at the American people, you know, who knows what might come of that?"" Does this sound like a serious commitment to you? Try to imagine a husband telling his wife that he saw absolutely no reason to get a divorce--but if she continued to fail to live up to expectations, who knows what might come of that? You had to pay attention. Not necessarily to Perry himself, who of course went on to become one of the worst candidates for president in all of American history. But the rally, with its combination of egomania (We're the best!) and paranoia (Don't mess with Texas!), was a near-perfect reflection of the Tea Party's war cry in national politics. That's not an accident. The more I looked at Texas, which seemed to be having an anti-Obama rally every time a cow mooed, the more important it seemed. Without anyone much noting it, Texas had taken a starring role in the 21st-century national political discussion. For one thing, it had the hottest economy--which the rest of us were told we'd better emulate unless we wanted all the local employers to pack up and move to Plano. The reason Perry imagined he could be president was the way Texas had created job growth by hewing to the low-tax-low-regulation ethic that the political right believes should be the model for the entire country. (The model had certain flaws, such as the assumption that every state could scrimp on higher education and just build a large professional class by importing people who went to college in other states.) Then a friend sent me a headline from a Texas news report: ""Man Allegedly Beat Woman with Frozen Armadillo."" I was totally hooked. So I started thinking a lot about Texas. Looking back over the last quarter century or so, I was stunned by how much of the national agenda it had produced, for good or ill. Texas banking laws set the stage for the savings and loan crisis in the 1980s. The 2008 economic meltdown was the product of a financial deregulation that was the work of many hands, but most particularly the paws of Texas Sen. Phil Gramm. Our energy policy is the way it is in large part because Texas politicians and Texas special interests like it that way. (If the polar ice caps melt, it's not going to be Utah's fault.) Schools from Portland, Ore., to Portland, Maine, have been remade, reorganized, and sometimes totally upended under a federal law based on Texas education reform. For several generations, our kids have been reading textbooks written with an eye to Texas sensibilities. Texas presidents have led the country into every land war the United States has been involved in since Vietnam. Texas runs everything. Why, then, is it so cranky? Is it because of its long string of well-funded but terrible presidential contenders? True, being the home state of Rick Perry, the ""oops"" candidate, had to be embarrassing. On the other hand, thanks to the Bushes, there's been a Texan president or vice president for 20 of the last 32 years, so the lack of White House access hardly seems like an appropriate subject for sulking. Is it the weather? The state of Washington has terrible weather, and you don't see people there threatening to secede. The crankiness is actually a source of Texas's political power. The state has a remarkable ability to be two contradictory things at once. It's a fast-growing, increasingly urban place whose citizens have nevertheless managed to maintain the conviction that they're living in the wide open spaces. And its politicians are skilled at bragging about the wonderful Texas economy and lifestyle while wailing and rending their garments over their helplessness in the hands of the federal Death Star in Washington. You need that sense of victimhood because it creates energy and unity. You can't build a Tea Party on good news. Another reason the Texas influence on the United States is outsized is that the place is just so damned big. The country has other hugely influential large states, like California and New York, but they're not on an upswing. California has more people, but it's hit a bad patch and it's struggling. New York is the media capital and it has Wall Street, but its population is flat. Texas just keeps growing, by leaps and bounds. (Think jackrabbit. It's a good metaphor. A really, really large jackrabbit.) The huge Texas population--up 4.3 million in a decade--has an enormous impact on the country all by itself. We've got a super-big state with a young citizenry and a very high birth rate. You have to figure that by 2050, the entire United States will have a distinctly Texas cast. The state's ability to rear, educate, and prepare all the little Texans to take their place in the national economy is going to be an excellent predictor of how well the whole country will be faring down the line. Spoiler alert: The odds of success would be better if Texas had more control of the teenage birth rate. Did you ever hear about the time Rick Perry defended abstinence-only sex education by saying that he knew from his own personal experience that abstinence worked? We're not used to thinking of Texas as a driving force in American affairs, but there you are. Even when Democrats held the White House in recent decades, Texans seemed to be holding the reins--reins that were being used mainly to hog-tie the chief executive. Bill Clinton had to deal with two Texans--House majority leader Dick Armey and whip Tom DeLay--whose lasting contribution to American history was mainly the thwarting of the Clinton agenda, particularly health care reform. Barack Obama has been hamstrung by the power of the Tea Party Republicans, whose first big coming-out parties were organized by Armey and whose ideology sprang, as much as from any place coherent, from the thinking of Texas congressman Ron Paul. You'd imagine a place with a motto like ""Don't Mess with Texas"" would be a small, scrappy state. But Texas is a huge, scrappy state. What could be more unnerving? And really, there's never a dull moment. Take the frozen armadillo situation. I couldn't resist looking into it, and at one point in my research I ran into an officer of wildlife enforcement who assured me that it was illegal to sell a live armadillo in Texas. ""Dead armadillos you can sell parts of them,"" he added. ""Make a curio of a little armadillo on his back drinking a bottle of beer."" How could you not want to know more about a state like that, particularly when it appears to have been setting the entire national agenda for decades, while continually howling about how the federal government is pushing it around? And the people are great. I can attest that I had a wonderful time with everyone I met while I was wandering around, trying to figure out how Texas inspired a national education law which the politicians in Texas now denounce on an almost hourly basis, or why a state that would get more economic benefit than anybody from the health care reform law is so determined to repeal the health care reform law. Anyhow, that's how I became obsessed with Texas. To paraphrase the old saw about elections and Maine, it really does seem as if these days, as Texas goes, so goes the nation. Whether we like it or not. Reprinted from As Texas Goes ...: How the Lone Star State Hijacked the American Agenda by Gail Collins. Copyright (c) 2012 by Gail Collins. With the permission of the Liveright Publishing Corporation, a division of W.W. Norton & Company."	Gail Collins on the Mighty Texas	['Paul', 'Perry', 'Clinton', 'Obama']	[]
8	8	http://www.slate.com/articles/news_and_politics/politics/2012/05/republicans_are_trying_to_stamp_out_voting_fraud_that_does_not_exist_.html	"When Americans go to the polls this November, they better have some ID. If they don't, millions of them won't be casting a ballot. Over the past two years, Republican legislators from Texas to Florida to Wisconsin and beyond have enacted new restrictions making it significantly more difficult for citizens to exercise their right to vote. These laws, which could disenfranchise more voters than at any time since the 1960s, exist because of one widely held conservative belief: that our elections are plagued with fraud. National Republican chairman Reince Priebus echoed this view on MSNBC recently when discussing the new Wisconsin law that requires citizens to produce photo ID at the polls or be shown the door. He argued that the state's election system was ""absolutely riddled with voter fraud."" Priebus may be correct, but only if his standard for ""riddled"" is 0.0002 percent. A nonpartisan study on voter fraud in Wisconsin after the 2004 election found just seven ineligible votes--all of which were cast by ex-felons who were ineligible to vote despite being released from prison--out of 3 million ballots cast. Yet the notion that voter fraud is rampant appears to have become a core belief among conservatives. Since the 2010 election, dozens of anti-voting measures have been enacted, from requiring photo identification to cutting early voting periods to mandating that citizens present a birth certificate or passport in order to register. If you challenge conservatives with just how rare voter fraud is in the United States, you usually get one of three responses: It's easy to do, it's hard to catch, and they've heard of it happening. Let's take these arguments one at a time. First, conservatives often note that even if widespread fraud hasn't occurred, the ease with which voters could misrepresent themselves at the polls warrants stringent preventive measures. Sting artist James O'Keefe has released a number of videos in which people show up at the polls with hidden cameras claiming to be someone they're not. The fact that most poll workers trust these individuals and hand over a ballot proves, in O'Keefe's estimation, that we need voter ID laws so people can't misrepresent themselves. This view ignores an important point: Regardless of how ""easy"" it may be to trick an unsuspecting poll worker, it rarely happens. And there is a simple explanation why: Voter fraud is a felony that carries a federal sentence of five years in prison and a $10,000 fine. If I show up at the polls and pretend to be Michael McDonald, at best, I gain a single vote for my preferred candidate; at worst, I get sent to prison until 2017. Stealing an entire election one vote a time (and risking significant penalties for doing it) defies common sense. So does the logic that we must prevent any crime that's ""easy"" to do. It's really easy to dump a bucket of water on a policeman's head. In reality, it doesn't happen because people don't want to go to jail. Yet by O'Keefe's logic, the best way to prevent it would be to ban buckets. Second, many conservatives contend that the reason studies show so little voter fraud is because it's really hard to catch. It's also hard to catch murderers, but that doesn't mean we start locking up everyone in order to prevent people from killing one another. Americans have long subscribed to the notion of innocent until proven guilty; that, as Benjamin Franklin said, ""it is better 100 guilty persons escape than that one innocent person suffer."" Without proof, or even credible evidence that widespread voter fraud exists, saying that it's difficult to detect is not enough reason to justify stripping the right to vote from millions. Finally, those who suspect rampant fraud sometimes admit they are just relying on their gut; it simply feels like it exists. Of course, we've all heard the stories of dead voters in Chicago or suitcases of absentee ballots in the Deep South. Conservatives capitalize on these familiar chestnuts to make the case for restrictive new measures, often parading these old stories as modern facts. For example, South Carolina Attorney General Alan Wilson went on Fox News earlier this year to declare that ""we know for a fact there are deceased people whose identities are being used in elections in South Carolina."" Conservative outlets parroted the story endlessly, yet after a state investigation turned up zero evidence of fraud, they have gone silent. In truth, concerns about voter fraud usually stem from other conservative fears. The right believes that undocumented immigrants are menacing our country; therefore, they must also be trying to vote illegally. The poor, who liberals want to assist with food and health care, are being driven from poll to poll to ensure Democrats stay in office. If you're impoverished, the thinking goes, you must lack the moral fortitude that prevents the wealthier among us from voting more than once. Some Republicans admit they have seen no evidence of fraud. Last year, Pennsylvania State Sen. Charles McIlhinney conceded as much. Yet in his mind, the mere prospect that it could exist outweighed the possibility that 700,000 citizens may lose their vote in November because of the state's new voter ID law, which passed two months ago. Proponents of tough new voting restrictions often argue that voter fraud cancels out honest votes, effectively disenfranchising you and me. The irony is that by trying to stamp out a fraud menace that doesn't exist, millions of honest voters will be turned away from the polls. If widespread voter fraud existed, we should confront it. In the meantime, we shouldn't make policy out of tall tales and paranoid fears."	Why GOP Plans To Fight Voter Fraud Are Based on Pure Paranoia	[]	[]
