	Unnamed: 0	Link	Text	Title	Terms	Topics
0	0	http://www.slate.com/articles/news_and_politics/politics/2014/07/christians_united_for_israel_the_most_insanely_pro_israel_conference_of.html	"July 20 was the 13th day of Israel's Operation Protective Edge, and the deadliest. On the morning of July 21, as they trickled into the annual Christians United for Israel conference, the mostly American supporters of the Jewish state walked past muted TVs blaring the latest damage reports from this-or-that foreign correspondent. More than 100 Palestinians died in one day; more than 445 Palestinians since the operation started. The supporters of CUFI moved up the convention center escalators and took their seats for a plenary session. Onstage were the first guests, all recognizable from Fox News--Weekly Standard editor-in-chief Bill Kristol, onetime CIA director James Woolsey, and the Council on Foreign Relations fellow Elliott Abrams, a presidentially pardoned veteran of foreign policy disasters on two continents. Sitting right next to them was John Hagee, the burly Christian Zionist pastor who founded CUFI in 2006 He leaned into a microphone, passionately explaining why supporters of Israel should not be tricked by casualty reports. ""Since July 8, more than 1,000 rockets have been launched into Israel by Hamas from Gaza,"" said Hagee, who speaks with a captivating rumble that could make a brunch order sound like a lost gospel. ""Two-thirds of Israel's population has had to run to bomb shelters, having 90 seconds to save their lives."" The objective of Hamas, said Hagee, ""is to win the media war with dead civilians. We've come to Washington to ask our government to stop demanding for Israel to show restraint."" More than 4,800 evangelicals and Jews broke into applause. Some raised their arms and turned up their palms; a shofar-maker from New Jersey blew on one of his horns. ""If a foreign power had launched 1,000 rockets into America, we would be pulling the gates of the White House down,"" said Hagee. ""Let Israel finish the job. Let every rocket be dismantled. Let every tunnel be destroyed."" Hagee had set the theme: This year's CUFI conference, followed by its members' lobbying trips to Congress, would pressure the Obama administration not to broker an early cease-fire in Israel. The people of Israel would not suffer so that ""John Kerry could win his Nobel Peace prize."" (Hagee made that joke again at an evening, music-and-dancing stuffed CUFI celebration, which started with a taped message from Israeli Prime Minister Benjamin Netanyahu.) American evangelicals needed to imagine themselves as Israelis, praise the ""miracle"" of the Iron Dome missile defense system, and understand that the Jews had a biblical mandate to the entire Holy Land. ""I'll bless those that bless you and I'll curse those that curse you,"" said Hagee, quoting from the book of Genesis. ""That's God's foreign policy statement, and it has not changed."" CUFI claims to be the world's largest coalition of pro-Israel evangelicals. Nobody disputes that; critics actually prefer to promote Hagee as the face of the movement. In 2007, after CUFI started to gain momentum, Hagee published a book laying out how the apocalypse would happen--the Antichrist, if you were wondering, would be ""the head of the European Union""--and in 2008 John McCain's presidential campaign was cowed into denouncing him. Progressive journalist Max Blumenthal reported on the 2007 Christians for United Israel conference and asked the faithful if they were looking forward to the rapture. After getting a few yeses--and after asking Hagee pointed questions about Scripture--Blumenthal was sent to the exits, and CUFI got more gingerly and careful in its approach to the media. How careful? The reporters who showed up--many from conservative or pro-Israel media--were guided through a metal detector to a filing center, away from the main conference. At the appropriate times, we were guided from the first floor hideaway to the third-floor ballroom where the plenary sessions were being held. When the sessions ended, we were given time to wrap up, then politely guided back downstairs. But during breaks it was easy to chat with attendees, to walk through a CUFI exhibit on how it was fighting the Boycott, Divestment, and Sanctions movement on campuses--and to notice that Hagee's books were on sale next to CUFI T-shirts. In Hagee's latest, Four Blood Moons, he advances the theory that a series of lunar events that started on April 2014 means that ""in these next two years, we're going to see something dramatic happen in the Middle East involving Israel that will change the course of history in the Middle East and impact the whole world."" Hagee keeps saying this stuff; CUFI keeps separating itself from the rapture-ready bestsellers. On Monday I asked David Brog, the Jewish executive director of CUFI, whether Four Blood Moons was informing any of Hagee's or the activists' thinking about the crisis in Israel or Russia. ""Absolutely not,"" said Brog. ""Outside observers don't give evangelicals credit for being able to hold two different ideas in their heads. There's often confusion, when it comes to evangelical support for Israel, because evangelicals, like a lot of Jews, believe that we may be living in a messianic time. Of course, in the Jewish case, no one ever says--'Ah, that's why you support Israel, you think you're going to bring the messiah.' It's black letter Christian theology that the date of the second coming was set eons ago."" Brog had obviously answered countless versions of the question, usually from more hostile inquisitors; in the response I got, he insisted that CUFI's members, like many evangelicals, ""have a profound sense of guilt in the Christian Era, and how the Holocaust happened and Christians didn't do anything about it."" That was backed up by the speeches, and by the hallway conversations. Israel was one war away from destroying Hamas--unless John Kerry stopped it. Iran was one missile away from a second Holocaust--unless the Obama administration acted. On Monday night, Hagee gave a special award to Republican super PAC donor Sheldon Adelson and his wife, Miriam, who turned and thanked the mostly Christian audience for backing Israel. ""If you had been there during the Holocaust, you would have stood up and fought for the Jewish people,"" said Miriam Adelson. ""And maybe the Holocaust wouldn't have happened."" ""I've never had a greater warm feeling than being honored by Pastor Hagee,"" said a beaming Sheldon Adelson. But the honors were mutual. Speaker after speaker gave the evangelicals ammunition for the next time someone criticized the Gaza operation, or shamed Israel over the body count. ""Here's a message for America: Don't ever turn your back on Israel, because God will turn his back on us,"" said South Carolina Sen. Lindsey Graham. ""More Germans died in World War II than American soldiers. That didn't make the Germans right."" Texas Sen. Ted Cruz, who debuted at the conference in 2013 and got its loudest ovation this year, walked the crowd through all the Obama administration betrayals. Remember, how Kerry had warned that Israel could become an apartheid state--a ""slander and a lie."" Remember how Kerry had acknowledged the BDS movement and angered Israel's leaders. The Obama administration was naive; CUFI wasn't. ""It is Hamas who is putting women and children on top of the rockets,"" said Cruz, ""because they value the missiles and rockets more than they value their own civilians."" The politicians were limited in what they could say. They had been to Israel--Graham credited a trip he took with the Adelsons for ""changing my life."" But they were not Israelis. Over two boisterous days, the only speaker who brought the crowd to silence was Sgt. Benjamin Anthony, an Israel Defense Forces veteran whose organization Our Soldiers Speak sent him to campuses and other hot zones to describe the reality in Israel. ""There is an entire generation being raised in southern Israel, barely any of whom do not suffer from PTSD due to the rocket fire,"" said Anthony. ""The entire Zionist experiment rests in no small part on what it is we do during this campaign."" What the IDF needed was a total victory. ""Rocket factories can be destroyed,"" said Anthony. ""Weapon factories can be destroyed. Terrorists can be eliminated. Tunnels can be dug out."" But it could only happen if America resisted the temptation to criticize Israel or to stop the operation. ""Hamas started this war,"" said Anthony. ""The soldiers of Israel must smash their skulls and break their spines."" When he said that, a standing-room crowd of pastors and activists and politicians rose to its feet, waving the twin flags of the countries God loved."	Inside the Most Insanely Pro-Israel Meeting You Could Ever Attend	['Blumenthal', 'Israel', 'Obama']	['god']
1	1	http://www.slate.com/articles/news_and_politics/politics/2014/07/elizabeth_warren_and_netroots_nation_movement_to_elect_the_massachusetts.html	"DETROIT--Every time she's asked, Sen. Elizabeth Warren gives the same frustrated answer. No. Nope. She is not running for president. She has literally rolled her eyes at the question. She's offered to ""add an exclamation point."" She's even signed a letter calling on Hillary Clinton, who leads polls of Democrats by up to 50 points, to run for president. And yet there they were on Friday morning, the people who wanted Warren to reconsider. Days before this year's Netroots Nation conference, the annual gathering of the online left, an Obama campaign veteran launched a draft campaign called Ready for Warren. (The name is a wink at the pro-Clinton PAC Ready for Hillary, which claims to have 2.5 million supporters in its database.) The new group printed ""Warren for President"" signs and plastered ""Warren for President"" stickers on free skimmer hats. As activists entered the Cobo Center, which resembles a pile of faded Rubik's Cubes that have tumbled from a closet, volunteers handed out the goods. There was even a folk song soundtrack, by Jessie Murphy: Americans want our next president to be a woman
 Hey babe, here's lookin' at you, Senator Elizabeth Warren
 The planet is warming and the power is shifting
We will need a leader who won't stand for all the Wall Street bullshit, the lobbyist grifting The reluctant hero never stood a chance. When her applause lines hit, up went the signs. ""The game is rigged,"" said Warren toward the end of her remarks. ""We can whine about it, we can whimper about it, or we can fight back. I'm ready to fight back. Are you ready to fight back on this?"" Up went the signs, up went the chant: ""Run, Liz, Run."" ""Si'down,"" Warren chuckled. ""Si'down."" But the story was already being told. The signs made it into write-ups by Politico, Huffington Post, McClatchy, and a Washington Post story about how ""cracks are beginning to emerge"" in the Clinton restoration's coalition. The evidence for a left-wing challenge to Clinton that could defeat her is thin to nonexistent. Defeating Clinton wasn't even a theme at Netroots Nation, where in 2007 both Sens. Barack Obama and John Edwards clearly outpaced her in support. Anyone who could force Clinton to the left--on Wall Street, on bank reform, on student loans, on inequality--was worth talking about. Not far from where Warren was speaking, a D.C. activist named Edrie Irvine was sporting a Bernie Sanders for President 2016 shirt, and getting into conversations that assumed the Vermont senator could never win. ""I love my Bernie,"" said Irvine. ""I want him to run not because I expect that he would ever win, but because he would force the conversation in a direction it might not otherwise go."" That's just it. Progressives want to change the party, which means more than choosing a president. (Several Netroots panels featured activists who had moved the Obama administration when it was acting too slowly on issues like immigration.) The institutions that created the online left were birthed by no-chance campaigns. MoveOn was founded in 1998 by Silicon Valley liberals who wanted Congress to stop short of impeaching Bill Clinton. ""Censure,"" it said, ""and move on."" Howard Dean's 2004 campaign brought in a young generation of activists and techies, spawning some of the data and campaign companies that would elect Barack Obama. Yet MoveOn lost its first fight. The Dean campaign lost every major primary. The lesson activists took away: Try something. The media, at least, is going to cover a primary threat more than it covers a sui generis student loan bill. Thus the Warren ""presidential campaign,"" a masterful branding and messaging exercise. In September 2013, the New York Times wrote an attention-getting profile of Warren's appeal to progressives, proven by the growing crowds for organizers wise enough to book her. ""Bumper stickers and T-shirts surfacing in liberal enclaves proclaim, 'I'm from the Elizabeth Warren Wing of the Democratic Party.' "" Jonathan Martin reported that those stickers were mass-produced by the Progressive Change Campaign Committee, which was founded in 2009 by Adam Green (a veteran of MoveOn and Democratic campaigns) and Stephanie Taylor (a veteran of the SEIU, AFL-CIO, and yes, MoveOn). In its early years, the PCCC confounded Democrats, losing a run of primaries and buying ads to pressure red state Senate Democrats who were slow-walking the Affordable Care Act. The Warren brand--earned after the group signed up activists and donors for her nascent Senate bid--is self-evidently a way to move the conversation, whether or not anyone challenges Clinton. ""We're going to make sure that every Democrat who runs for president is forced to say whether they agree with Elizabeth Warren on key issues,"" Green told the Boston Globe last year, ""like expanding Social Security benefits and more Wall Street reform."" Green repeated that point at the Netroots conference, though he hardly needed to. Rep. Dan Kildee, a freshman Democrat from one of the new safe Michigan districts, said it was ""clear"" that any 2016 candidate had to cop from Warren. ""The basic premise, that we need to restore some balance in the equation between corporate interests and consumers--that's what she's done for a long time,"" he said, recalling how he'd cited her when he worked at a think tank. ""More people should embrace it. It cuts across partisan lines. "" But he wasn't calling for a primary. The point was getting the next candidate to move where the Netroots crowd wanted her to move. ""Hillary Clinton is going to say these things,"" said former Rep. Brad Miller, a North Carolina Democrat who left his seat after a 2011 gerrymander. ""Whoever our Democratic nominee is will run as an economic populist. When the pollsters and consultants come back with the numbers, they'll tell her: Holy crap, you may not have been a populist before, but you are one now! The problem will be credibility, and whether it's believable coming from someone who has close ties to the financial sector."" At the conference, for most attendees, Clinton was credible enough. A Ready for Hillary organizer pointed out that some of the people who applauded when they saw Warren at a nearby hotel were sporting Hillary gear. There was no mass boycott of the main Friday night party, sponsored by Ready for Hillary, held at a downtown music venue called St. Andrews, with the PAC's bus parked right outside. As guests arrived, they ran into a table loaded with PAC stickers (""I'm ready for Hillary"") and the room-filling pop of KGB, a Motown cover band. Activists born in the 1980s; music from the 1960s. Not the ideal metaphor for a Clinton campaign, but it got a PCCC leader tweeting that after ""one more margarita"" even he, too, would be ready for the Clintons. I didn't find a true Clinton critic, actually, until the next night's after-party. It was hosted by the Alliance for American Manufacturing. (In a Saturday speech, the labor group's president, Scott Paul, had told activists to nominate ""a woman who not only says the right thing but does the right thing."") At the party, I ran into the last guy who challenged Clinton from the left and lost. Jonathan Tasini, a writer and activist who ran against Clinton in the 2006 New York U.S. Senate race, was at least willing to muse about one of the progressive branding campaigns turning into an actual primary. ""Warren would have the best chance,"" he said. ""Whenever [Hillary] opens her mouth, there's enough people who say: 'I just don't believe her.' "" But how many Democrats? In 2006, Tasini asked progressives to hold Clinton accountable for backing the Iraq War. She won the primary with 83 percent of the vote. And on this particular Saturday night, the Clinton agita was not too serious. On the way out of the party, Scott Paul spotted me and corrected the record on his quote--the one absolutely everyone interpreted as a call for Warren to run. ""I saw the tweet about that,"" he said. ""I wasn't talking about Warren!"""	Why the Movement to Elect Elizabeth Warren Is Make Believe	['Sanders', 'Paul', 'Obama', 'Clinton', 'Warren']	[]
2	2	http://www.slate.com/articles/news_and_politics/politics/2014/07/west_s_wildfires_are_getting_worse_government_polices_are_encouraging_developers.html	"A wildfire that began last week in central Washington has already destroyed an estimated 150 homes. At last count, it was threatening more than 500 other structures as firefighters continue to struggle to contain a blaze that has covered more than 300 square miles. A separate wildfire in southern Oregon destroyed 17 homes and 16 other structures, and forced the evacuation of more than 100 people last week. A third blaze currently raging in Idaho, one of about 20 sparked across the Boise National Forest by a lightning storm, has forced the evacuation of at least 60 homes. None of these wildfires are particularly unique. Home-threatening blazes have become something of an annual ritual for many towns out West, one increasingly untethered to the calendar. In the past four decades, the length of the wildfire season has increased by more than two months. The average wildfire, meanwhile, now burns roughly twice as long and consumes twice as many acres than it did a decade ago. Since 2010, the number of structures destroyed by the fires has tripled, and firefighter fatalities have soared by a factor of four, according to the nonprofit research group Headwaters Economics. The Obama administration estimates it will spend $2.4 billion this year battling the blazes, nearly triple what was spent in an average year two decades ago. And the current spending levels are fast proving insufficient: This month the president sent Congress an emergency request for $615 million to help cover the government's wildfire-fighting bill. Already bad, things are only going to get worse. The Environmental Protection Agency estimates that wildfire activity could double in much of the Western half of the nation by 2050 as climate change leads to hotter and drier conditions across the country. While Congress has repeatedly shown no interest in combating (or, in some cases, even acknowledging) climate change, Western lawmakers on both sides of the aisle are finding it difficult to ignore the fires themselves. A bipartisan group of senators is currently rallying around a relatively straightforward proposal to help route more federal cash to both fighting the wildfires and preventing them. The proposal, championed by Oregon Democrat Sen. Ron Wyden and Idaho Republican Sen. Mike Crapo, would make catastrophic wildfires eligible for assistance from a special federal disaster relief fund currently used to pay for recovery efforts from hurricanes and earthquakes. That tweak, supporters say, would allow the U.S. Forest Service and the Interior Department to stop rerouting cash from other crucial programs, including needed fire-prevention work such as removing dead vegetation and undergrowth that can act as tinder. A separate Republican proposal, backed by Sen. John McCain and others, meanwhile, would explicitly require the federal government to focus on thinning the underbrush in federal forests. But while lawmakers might be looking at a bigger picture, they still aren't looking as broadly as they should, wildfire experts warn. ""It's basically an account shuffle, one that does nothing to really address the magnitude of the problem,"" says Ray Rasker, the executive director of Headwaters Economics, which held a private brainstorming session for 20 policy experts earlier this year to talk about the rising risks and costs of wildfires. The most pressing issue, Rasker's group concluded, is the slew of government policies currently in place that subtly encourage developers to build in wildfire-prone areas in the first place. Local governments are the ones deciding whether to develop the land, but it's the federal and state governments that have to open their wallets when disaster strikes. As a result, local officials have little incentive to stop a high-risk development when they stand to reap the property tax rewards without bearing the full risks. ""The consequences of those development decisions aren't being felt by the people who are making them,"" says Rasker. If federal lawmakers took steps to shift the financial burden to local governments, the thinking goes, they'd be less likely to give carte blanche to developers. Lawmakers looking to offer carrots in addition to the stick, for instance, could tie the amount that each locality had to pay to how much effort it put into preventive measures in the first place. Impose tighter building codes in high-risk areas? Foot less of the federal firefighting bill if a wildfire does break out. Fail to take preventive action? Be prepared to pay on the back end. Lawmakers looking to take more direct action, meanwhile, could limit the mortgage interest deduction for any home in a particularly vulnerable region. Intended or not, the status quo has resulted in a building boom in fire-prone areas. According to the International Code Council, 60 percent of new homes built in the United States between 1990 and 2008 were built on what is known as the ""wildland urban interface""--basically private forested land in close proximity to public forested land, the type of landscape that's particularly vulnerable to wildfires. Such policies wouldn't mean an end to building on those lands, Rasker says--it would just mean that communities would be enticed to make more deliberate and safer decisions on exactly where and how to build. That might not stop many wildfires from starting, but it would mean fewer homes in harm's way when a wildfire does jump from public forest to private land. That, in turn, would mean more time, money, and options for firefighters trying to contain the massive blazes. But if Congress continues to fail to see the homes through the trees, the opposite will hold true: The government will be stuck paying more money to fight stronger fires that threaten more houses. ""This is a trend,"" Rasker says, ""that's going to get significantly worse if things don't change."""	The West's Wildfires Will Likely Get Worse Before They Get Better	['Obama', 'Wyden', 'McCain']	[]
