	Link	Text	Title
13	http://www.slate.com/articles/news_and_politics/politics/2016/06/donald_trump_s_brexit_response_reveals_his_solipsism.html	"See also: Donald Trump Celebrates How Great Brexit Will Be for His Golf Business The catastrophic events in the United Kingdom on Thursday have sent markets southward, buoyed the hopes of right-wing nationalists from the Netherlands to Russia, and led to the understandable fear that a similar ""reaction"" could repeat itself on our shores in November. But if American voters are going to do a version of what British (and Northern Irish) voters just did--put aside their good sense and self-interest, in this case by voting for Donald Trump--it will be despite Trump's continued campaign of self-sabotage and idiocy. For the second time in a month, Trump has greeted a genuine tragedy or crisis with aggrandizement and know-nothingness. He could still win, but it will be in spite of himself: His inability to be anything other than Donald Trump may just save the country from his reign. Just last week we were all furiously speculating on what the deadliest mass shooting in modern American history--by someone who had pledged allegiance to ISIS--would do for Trump's poll numbers. Republicans generally benefit after terrorist attacks, and Trump himself had staked out anti-ISIS ground early in his campaign. We soon got our answer: Trump was as incapable of using the Orlando tragedy to his political advantage as he is of staying on message during one of his many attempted ""pivots"" to respectability. After tweeting self-congratulations and seeming less presidential than even a skeptic thought imaginable, Trump gave a mean-spirited and much-reviled speech. He appeared unprepared for the moment and unseemly in his glee at what he saw as his clairvoyance. The polls didn't budge. The first hints from Scotland, where Trump is ridiculously staying for a couple days not to prove his foreign policy chops but to look in on a golf property, seem to offer more of the same. What would seem like a perfectly Trumpian move by the voters of the United Kingdom--the Brexit campaign was in large part a reaction to immigration; the next prime minister is likely to be Boris Johnson, a slightly sinister and slightly absurd Trump-lite figure; nationalism has reasserted its appeal--was instead another occasion for Trump to act childish. After landing in Scotland, he proceeded to tweet out congratulations to the place for its vote. Of course, Scotland had just voted to remain in the European Union, to little avail. When asked about Johnson, he replied, ""Who is Boris? I don't know him."" It was Trump at his most Trumpian: international relations as mindless solipsism. But even worse than the boneheaded statements was the spectacle of a politician unthinkingly cheering as markets were tanking and amid general panic. Trump is simply not able to separate his own interest from the country's or for that matter the world's. While this may be true of many politicians, they at least hide it better. It's early yet in the depressing British-EU crisis, and Trump could very well find a way to capitalize on it. But his early statements and behavior suggest that instead he will just be himself. It may be the only thing that protects us from eight years of nothing but him. Read more of Slate's Brexit coverage."	Trump's Absurd Response to Brexit: World-Historical Solipsism on a Global Stage
14	http://www.slate.com/articles/news_and_politics/politics/2016/06/facebook_live_and_periscope_really_won_that_sit_in.html	Democratic members of Congress just finished their sit-in on the House floor. As Jamelle Bouie noted early this morning, the sit-in was unprecedented--and perhaps transformative--for many reasons: the ideological uniformity with which Democrats have rallied around gun control; their willingness to disrupt normal House business; and the form of the protest itself, which feels like a tactic from a bygone era. But there's another way in which the sit-in marks a political watershed: It unfolded via live-stream on social media. Typically, footage from the floor of the House of Representatives is aired on C-SPAN. But when Speaker Paul Ryan declared the House in recess in response to the sit-in, C-SPAN's feed cut out. That's when Facebook Live, a live video-streaming service launched in August and revamped in April by the social media giant, and Twitter's year-old live-streaming app Periscope, became essential. After C-SPAN stopped broadcasting, Democrats quickly went on the offensive, decrying the move as majority-party obstructionism. Here's Massachusetts Sen. Elizabeth Warren, who joined the sit-in Wednesday, on Twitter: But as the Washington Post reported late Wednesday, the drying up of C-SPAN's feed was less a matter of partisan politics than of procedure. House Republicans, who were presiding over the floor when Lewis began his sit-in at 11:25 a.m., had no choice but to call a recess after the demonstration interrupted scheduled House business. Per rules laid down in January 2015, when members of the 114th Congress first took their seats, that meant C-SPAN's coverage went with it. A clearly frustrated C-SPAN staffer clarified this point in a pinned tweet that sat atop the network's Twitter feed as the sit-in rolled on: Democrats quickly found a way around that. In a first-of-its-kind maneuver, C-SPAN began airing the Periscope live-stream feed of California Rep. Scott Peters and the Facebook Live feed from Texas Rep. Beto O'Rourke. Here's some of that footage: Peters: O'Rourke: After a brief interlude--during which Ryan reopened the session in an ultimately futile bid to restore order--brought C-SPAN's cameras back to life, legislators continued to use social media to broadcast the proceedings to an audience wider than the infamously soporific network's. A Facebook spokesman told me that, over the course of the sit-in, 19 House members used Facebook Live and garnered a combined viewership of 3 million Facebook users.  Facebook and Twitter must be thrilled. (Several of the more prolific live-streaming legislators even got personalized shoutouts from Facebook CEO Mark Zuckerberg Thursday afternoon.) The demonstration provided ideal conditions for illustrating the power of live-streaming to politicians--the capacity to get around traditional media and broadcast a message directly to the people. The sit-in may have ended. Democrats' current fever over gun control may break. But don't expect the live-streams to go dark anytime soon.	Live-Streaming Was the Real Winner of the Democrats' Gun Control Sit-In
15	http://www.slate.com/articles/news_and_politics/politics/2016/07/a_veteran_candidate_briefer_from_the_cia_on_trump_and_classified_information.html	"After his official nomination, Donald Trump, like all major party candidates, will be granted access to classified information in national security briefings delivered by the intelligence community. In a May episode of the Slate Trumpcast, Jacob Weisberg interviewed John McLaughlin, a former acting director and deputy director of the CIA, about these briefings. To listen to that podcast, click the player below: A lightly edited transcript of that conversation follows. Jacob Weisberg: So you have given a security briefing to presidential candidates in the past. What happens in those briefings? John McLaughlin: Well, each one is a separate and unique situation, and the way it works is determined primarily through a discussion between the White House and the candidate or the candidate's advisers. So some candidates want to be briefed once, and that's it, for a short period of time. Others like periodic updates, and they work that out with the White House. And in terms of what happens, a briefer shows up and the briefer has a series of issues that he or she is going to take the candidate through, typically the ones that are in the headlines. Today, you can imagine it might be Syria, Iran, North Korea, Russia, China--things that a candidate who aspires to be president probably ought to know about in terms of what's available privately as well as publicly And then it really depends on the candidate. Sometimes the candidate will sit and listen. Sometimes a candidate will interrupt frequently and really take the conversation where he or she wants to go. That more frequently is the case, in my experience. And sometimes they will have an adviser with them. That has to be worked out with the White House as well. And that's the basic drill. Weisberg: I think I read you briefed George W. Bush before he was president and also John Kerry before he was not president. Is that right? McLaughlin: Correct, correct. [Laughs.] Those two, and also John Edwards. Occasionally a vice presidential candidate or the team will request that both presidential and vice presidential candidates be briefed. That's the only occasion that I was personally involved in that I remember that being the case, when it was Kerry and Edwards. Weisberg: So how classified is the information you get into in those briefings? Is it comparable to the level of briefing a president gets when in office, or is it something short of that? McLaughlin: Well, it's very close. In my experience, this kind of varies from administration to administration in terms of how much freedom the briefer has to go deep. The briefer is going to have to be somewhat improvisational. You have some guidelines, but inevitably the candidate takes you to the things that are of interest to that person. Typically, the rule I always had in my mind was the candidate can be briefed on just about everything except things that are not widely shared within the national security team itself in the government. So take, as an example, the operation that was mounted in 2011 to take down Bin Laden. If there had been a candidate briefing, say, two or three months before that operation, it almost certainly would not have been discussed because there were many people in senior levels of government who didn't know about it. It was that tightly held. But beyond those things, I had freedom from the administration to go where I thought the candidate needed to go to understand an issue. Weisberg: Now does the presidential candidate need or get a security clearance before receiving classified information? McLaughlin: Not to my knowledge. Conceivably something went on behind the scenes that I wasn't aware of, but to my knowledge the assumption is that if they've gotten that far there's no point in clearing them because they're cleared by election, essentially, as are most congressmen and senators. Weisberg: So you may see what I'm driving at, John, but what if you were in a position as a briefer briefing someone who wouldn't pass a security clearance, who you might feel is just fundamentally not trustworthy? McLaughlin: Again, I can't stress the degree to which, in the end, the briefer has to use personal judgment because of the fluid, dynamic nature of these discussions. Who am I to judge, sitting there, that this person would or would not pass a clearance? You may have concerns about someone based on their public persona. You know, people have asked me, for example, what about Trump? He seems to blurt things out. He seems himself very improvisational. If you stop and think about it, any presidential candidate is in the competition of their lives. They will never be in a more competitive, higher-stakes competition. So the temptation to somehow take what you're giving them and bend it to political purposes has to be there in every case. At some level, you have to count on them as patriotic Americans to do the right thing. Weisberg: But let me give you a hypothetical. I mean, it sounds like if there was information about a threat of an impending terrorist attack, that would be the kind of thing, absent information about sources and so on, that could be in the briefing. Boy, it's easy for me to imagine Trump using that in a political context and hard for me to imagine him keeping it confidential. McLaughlin: Well, try and imagine it, I guess would be my advice to you. I think the more interesting thing with Mr. Trump would be just how he absorbs discordant information because in an intelligence briefing you're almost certain to hear things that are at odds with your preconceptions, and you've got to deal with that. Politics exists in a very different world than intelligence. In politics, people take whatever facts they possess, or what they judge to be facts, and they stack them up and rearrange them and come up with a conclusion that favors their point of view and then the other side takes the very same set of facts and stacks them up and rearranges them to come out with their point of view. I think we call that spin, don't we? Weisberg: [Laughs.] Yes. McLaughlin: There is no spin in intelligence. There can't be. By definition, anyone who is doing intelligence right is going to just lay it out there. Sometimes you're going to hear something that doesn't accord with what you thought was the case or perhaps even what you were saying publicly is the case. Weisberg: So you are watching the candidate, or the president elect, to see how they absorb information, how they respond to information that maybe conflicts with what they thought, and figuring out for the future, potentially, how to get through to them, how to communicate with them. McLaughlin: Yes, and they're telling you. It's a conversation. In my experience it's always been a conversation. Let's take a hypothetical. I think Mr. Trump has called for backing away from Korea and Japan. We could back away from them as allies or be less involved as allies if they didn't pay more for their defense. Well, an intelligence briefer, at that point, might just work into the briefing the fact that Japan has been paying $2 billion for stationing our troops on their territory under a four-year agreement that comes up, I think, for renewal in 2016. And so the question would be, 'Is that enough?' I don't know if Mr. Trump knows that, that they've been paying $2 billion. I can see circumstances, and this is true of any candidate, but it might be a little truer in Mr. Trump's case, where what you're saying rubs up against, in an unpleasant way, stuff that he believes or has said. Weisberg: Mr. Trump has also suggested policies that violate America law, or international law, such as torture. Would you be in a position, as a briefer, whether he asked about it or not, to say, ""Mr. Trump, we heard you say that, but you can't do that as president."" McLaughlin: Again, you wouldn't go in with an agenda of things that you're going to tell him, along the lines of, ""Dear Mr. Candidate, here are all the things you've said that are wrong."" You wouldn't start that way. You would just start with your briefing. Now if that issue arose, probably in the context of a question from him, about how many captures is the government doing and how you are treating the captives, you would explain that in terms of treating detainees these days the U.S. government is bound by the Army Field Manual and by executive order and I believe by laws now that determined the techniques you could use. And then it would be up to him to say, ""Well, what about this?"" And you would just in a very matter of fact way say, ""Well, that is not permitted anymore under current law."" Weisberg: ""And when I get in we are going to change all that."" McLaughlin: You know, I've had candidates say things like that to me: ""When I become president""--I won't name candidates, but I've had candidates say to me, ""Well, when I become president we're going to change that."" You don't debate them at that point. That's not your job. Weisberg: You suggested that the president has a fair amount of discretion about what might be included in such a briefing, I realize it would be unprecedented, but could the president or the national security adviser say, ""In this case, we're not going to give a classified briefing to the nominee of a major party."" McLaughlin: That would be unprecedented and technically, technically, that could happen because ultimately the president in the executive branch owns this information and is responsible for its classification and its declassification. So technically that could happen. It's hard for me to imagine that happening, frankly. Weisberg: And in terms of what is probable, who do you think would be the likely person or agency representative to do this briefing, now that you're retired? McLaughlin: Well, in my day, it used to almost always be led by a CIA officer. I had taken, on a number of occasions, someone from other agencies. I took once to Kerry briefings the deputy director of the FBI because I felt that discussion of potential for domestic terror attacks was important. These days I think the decision on who does the briefing is not in the CIA director's hands. It's in the hands of the director of national intelligence, who would be Jim Clapper. Basically, you want someone who is going to be knowledgeable and able to handle themselves in that situation. Read more Slate coverage of the 2016 campaign."	Trump Will Soon Get Classified National Security Briefings. Can We Trust Him?
16	http://www.slate.com/articles/news_and_politics/politics/2016/07/donald_trump_is_headed_for_a_historic_loss_with_some_whites.html	"If, on the night of Nov. 8, we're all watching Donald Trump give his victory speech, it will be because he will have pulled together a broad coalition of white people to propel him to the presidency. With abysmal numbers among blacks, Hispanics, and other minority groups, white voters are the only path Trump has to the White House. He'll have to win all of them--white men, white women, white youth, the white working class--and he'll have to win them by substantial margins. In theory, this should be fertile ground for the real estate mogul. Trump has unprecedented pull with working-class whites, especially men. If he can match past Republican performance with college-educated whites and hold his increased share among their counterparts with high school diplomas, he'll have a smooth path to victory. In reality, this would be almost impossible--an electoral Kobayashi Maru. The reason is that Trump's problems go beyond nonwhites. The ostensible candidate for white America has a white-voter problem too. At this point in the 2012 election, according to the Pew Research Center, Mitt Romney held a 13 point lead among all white voters. He led Barack Obama by 21 points among white men, and by 6 points among white women. Among whites age 18 to 49, he led by 7 points; among whites older than 50, he led by 17 points. At election's end, Romney had won 59 percent of white voters, on par with the highest modern total since Ronald Reagan's 1984 landslide against Walter Mondale. Romney's success with whites--while higher than usual--was on trend. Since 1968, Republicans had won the lion's share of white voters. Even when they lost the presidency in previous elections--in 1976, in 1992, in 1996--the GOP has always won a majority (or plurality) of whites. If the distribution of voters had been static in more recent elections, Republicans would still control the field in presidential elections, even as Democrats won the large majority of nonwhites. But whites are a declining share of the electorate, which has offset this Republican advantage. It's still valuable, but not as much. If George W. Bush's Hispanic outreach efforts had worked--or rather, if the GOP hadn't squandered those efforts--the party would be in a strong national position today. So we know that Trump has ruined the Republican Party's tenuous ties to nonwhite communities, and Hispanic Americans in particular. Less remarked on is the extent to which he's moving white voters--or at least a meaningful segment of them--into the Democratic column. For the first time in modern elections, a majority of college-educated whites are backing the Democratic candidate for president. According to Pew's June survey--a comprehensive look at the electorate--Clinton holds a 12 point advantage among whites with a college degree, 52 percent to 40 percent. If you break that into men and women, she trails among the former--losing college-educated white men by 7 points--but holds a 31 point advantage with the latter, swamping Trump, 62 percent to 31 percent. ""Realignments"" in American politics are overstated--or at least, not as sudden as they might seem--but if this result holds to November, it may herald a new stage in presidential politics, or at least the composition of the Democratic Party. There has always been a gender gap, with Democrats winning women far more than men. But this was a function of age and race as much as anything else; disaggregate the numbers, and white women were a solid vote for the GOP. Trump, with his erratic behavior and misogynist rhetoric, has changed that. Now, a relative disadvantage with women has become an absolute one. According to Pew, Republicans are losing married women by 12 points (another unprecedented change), unmarried women by 37 points, and white women--a former redoubt--by 10 points. Trump wins white women without college degrees, but it's a slight 3 point margin. Depending on the shape of the election from now to November, he could lose them too. It's this shift among white women that's driving the inversion of white support within the Democratic Party. Twenty years ago--when a different Clinton was running for re-election--the Democratic Party was struggling to regain its advantage with working-class whites, who had formed the popular base of the party's white support overall. But 2008, 2012--and now 2016--has changed that. Increasingly, Democrats are drawing their white support from college-educated Americans in the prosperous suburbs of states like Colorado, North Carolina, Pennsylvania, and Virginia, just as Republicans are deepening their hold on working-class whites nationwide. For the immediate future, this means that Trump is in a bad place. If winning downscale white voters means losing their higher-income counterparts, then he's simply substituting one demographic for another, in a way that leaves him further behind. But more interesting than this short-term electoral calculation are the long-term implications for American politics. A Republican Party that loses its absolute hold on white women is one where Trump-style politics--his blend of aggressive resentment and economic nationalism--continues to hold sway among the base. And a big-tent Democratic Party of college-educated whites and working-class nonwhites is one that might continue its streak of national wins and regional defeats. That is, if it can survive the inevitable class tensions that come with trying to keep a big tent from falling into itself. Read more Slate coverage of the 2016 campaign."	Donald Trump Is Headed for a Historic Loss with a Crucial Group of White Voters
