	Unnamed: 0	Link	Text	Title	Terms	Topics
0	0	http://www.slate.com/articles/news_and_politics/politics/2012/06/obamacare_repeal_romney_can_do_it_.html	"Read the rest of Slate's coverage on the Supreme Court upholding the Affordable Care Act. The Supreme Court's decision to let the core elements of the Patient Protection and Affordable Care Act stand kicks the fate of the Obama administration's signature initiative where it properly belongs--into the domain of politics--where a Romney administration would still have ample opportunity to dismantle the main elements of the law. One thing President Romney probably couldn't do, however, would be the politically expedient step of simply repealing the legally controversial and politically unpopular fine levied on people who decline to purchase health insurance. Both Romney (who embraced a mandate as governor of Massachusetts) and Obama (who opportunistically opposed a mandate when running against Hillary Clinton) understand the basic issue here. Requiring insurance companies to accept all customers and charge the same price regardless of their state of health (""guaranteed issue"" and ""community rating"" in wonk-speak) are popular but unworkable ideas. If people can buy insurance only after they get sick, then there isn't enough money coming into the system to cover the bills of the people who are sick. That's why even the Obama administration told the Supreme Court that if they struck down the mandate, the guaranteed issue and community rating provisions should go as well. The court did have the option of being devious, and simply kicking the dilemma of what to do with a mandateless market back to the White House. But a future Romney administration would have to internalize the consequences of stripping the mandate and thus would be unlikely to try to isolate it. This is where Democrats may come to rue the day that they decided to delay implementation of the main parts of their signature initiative all the way until 2014. The upside of delaying implementation was that it superficially made the cost of the bill inside the 10-year scoring window used by the Congressional Budget Office look smaller than it otherwise would. The downside is that they made it much simpler for Republicans to take some unpopular actions in 2013 than might have been the case. Once the insurance exchanges created by the law are in place, repealing the guaranteed issue and community rating provisions would mean throwing millions of sick people off their insurance plans. That would create a large and concentrated constituency of people who'd be informed by their doctors and their insurers about possible legislative changes. And it turns out that the provisions a Romney administration would need to repeal to gut the law are wildly popular. According to a Reuters poll earlier this week, 78 percent of self-identified Republicans favor ""banning insurance companies from denying coverage for pre-existing conditions"" and 86 percent of them support ""banning insurance companies from canceling policies because a person becomes ill."" In other words, once the basic framework of the law is in place, it'll be all but impossible to kill. That's probably why no country that's instituted a universal health insurance program has ever rolled it back--even strong conservatives like Margaret Thatcher in the United Kingdom or the current right-wing government in Canada leave existing programs in place. The problem for Democrats is that if Romney takes office in 2013, none of this stuff will have actually happened yet. Repealing the law in its abstract form is a bit politically risky for Republicans but not nearly as risky as it will become in the future. Already in 2011, House Republicans were thrilled to vote for a ""Repeal the Job-Killing Health Care Law Act,"" even though it was obvious that the president was never going to sign it. If in January 2013 Republicans control all three branches of government, there's no reason to think they'll grow more timid. In a statement immediately following the Supreme Court's decision, Romney promised to ""act to repeal Obamacare"" on his ""first day if elected president of the United States"" and if Congress puts a bill to that effect on his desk, he'll do it. Still, though Republicans seem likely to win control of the Senate in any scenario where Romney becomes president, it's exceedingly unlikely that they'd score the 60 votes needed to overcome a filibuster. Technically speaking, since repealing the bill would increase the budget deficit, it should be ineligible for the budget reconciliation process that Democrats used to pass the bill in the first place with only 59 votes. In reality, this is unlikely to make a difference to a determined GOP. Back in 2001 and 2003, Republicans were able to find gimmicks to pass giant tax cuts under reconciliation orders, and in this case conservatives sincerely believe that the CBO is mistaken and repeal would reduce the deficit. Scrapping the law, in other words, should be a pretty easy lift for Republicans--if they win the election. But if they lose, as provisions of the law roll out during Obama's second term, they're likely to find that it's very difficult to take popular benefits away from people who already have them. By declining to do Republican politicians' work for them, in other words, John Roberts just made 2012 a very consequential election."	Romney's Promised To Scrap ObamaCare--and If He Wins He Can Do it	['Roberts', 'Romney', 'Obama']	[]
1	1	http://www.slate.com/articles/news_and_politics/politics/2012/06/the_slate_surveymonkey_political_survey_does_mitt_romney_s_business_experience_matter_to_american_voters_.html	"The Slate/SurveyMonkey political survey returns with this month's snapshot of the opinions of more than 1,000 registered voters across the country. (Information on respondents is available here. More information about SurveyMonkey Audience is here.) Our last installment revealed that, while Obama trounced Romney in likeability, his personal charm didn't necessarily translate into high marks for governing. This time, we wanted to get a sense of whether feelings about the POTUS had changed--do we still trust him to baby-sit our kids--and also to examine the reception of one of Romney's big talking points: that his business experience will make him a successful president. We started off by asking, again, ""If your car was broken down on the side of the road, which presidential candidate would you want to stop and help you change the tire?"" Obama is still considered more likeable than Romney. In fact, the likeability gulf between Obama and Romney widened even a little more this month: More than 47  percent of respondents (up from 45 percent) would rather see the current president approaching in his Ford, while only 21 percent (down from 23.9 percent) would prefer a Romney motorcade. And the same trend was true when we again asked which candidate people would choose to hire as a baby-sitter. More than 48 percent of those surveyed opted for Obama, compared to May's 46 percent, and 21.1 percent picked Romney, a dip of 0.7 percent from last month. Of course, Miss Congeniality doesn't always win the beauty pageant: A top-notch personality can only take you so far. We wondered if respondents thought Romney would have done any better with the reins of power than Obama did in 2009. Opinion was divided: More than 23 percent believed the governor would have performed ""about the same,"" compared to the 22.8 percent that felt he would have handled the position ""much worse."" Just over 21 percent speculated that Romney might have acquitted himself ""somewhat better"" than Obama as president--but, on the other hand, 17.3 percent imagined he would have done ""somewhat worse."" And 15.5 percent, the smallest group, envisioned Romney steering the ship of state ""much better"" than the incumbent in 2009. In other words, no consensus was reached. Still, Obama's charisma is clearly a campaign asset, especially if POTUS succeeds in framing 2012's contest as a face-off between him and Romney, rather than a referendum on the economy. We wondered whether the former governor's business expertise--a selling point he hammers away at on the campaign trail--offers him any advantage. ""In your opinion, would electing leaders with business experience be helpful in fixing our country's current economic problems or not?"" we asked. A sizeable 30.7 percent of survey takers thought that business acumen would prove ""somewhat helpful"" to a U.S. president trying to revive the economy. And 38.4 percent said they considered such a background ""very"" or ""extremely"" beneficial. Only 15.3 percent of respondents were skeptical that business smarts spelled presidential aptitude, at least in the abstract. When the question specifically mentioned Romney, though, the numbers became slightly less favorable. (Still, the erstwhile Bain boss should take heart: His record is likely to give him at least a small boost). We asked, ""Will Mitt Romney's business experience make him a better president, a worse president, or neither a better nor a worse president?"" Fewer than 20 percent of respondents found Romney a poorer choice for his time in the private sector. And while the largest plurality, 36.4 percent, held that his past at Bain would not affect his governing ability, a combined 43.8 percent of those surveyed viewed Romney's corporate record as a positive. The upshot? The former governor can make electoral inroads by mining his business history, just as Obama can count on his personal magnetism to rake in ballots. But who would the survey takers vote for if the election were held today? When we posed that query, the POTUS gathered 45.1 percent of respondents' votes, compared to 35.5 percent for Romney. Obama drifted upward from 44.7 percent last month, while his opponent slipped slightly, from 38.3 percent. But preference for one candidate doesn't necessarily spell high hopes. Curious about how many people believed that the election results would affect their day-to-day existence, we asked: ""In general, do you think your life will get better, get worse, or stay the same if Barack Obama is re-elected?"" And then we flipped the question to probe attitudes about a Romney White House: What did survey takers think would happen to them if Mitt took the helm? The results suggested voters aren't overly optimistic, no matter who wins. When it came to the possibility of four more years of Obama, the most sizable group, 28.7 percent, expected nothing much to change. A cautious 25.6 percent supposed life would get ""somewhat better"" (only 7.8 percent anticipated things turning ""a great deal better""), and a combined 37.9 percent thought life would get worse. Meanwhile, 26.1 percent of survey takers contended that a Romney presidency would shift things in a ""somewhat better"" direction, trailed closely by the 24 percent that suspected life would proceed as usual. Just over 42 percent overall gloomed that they would suffer either ""somewhat"" or ""a great deal"" with Romney in office. Only 7.9 percent thought their lives would improve significantly with the former governor. So even as they cast hypothetical ballots for Obama or Romney, survey takers seem to be withholding their vote of confidence in the American political system."	The Slate/SurveyMonkey Political Survey: Do Americans Want a CEO in Charge?	['Romney', 'Obama']	[]
2	2	http://www.slate.com/articles/news_and_politics/politics/2012/06/mitt_romney_is_working_hard_to_avoid_offering_any_specifics_about_his_policies_.html	"Mitt Romney has a problem with specifics. Since Scott Walker's victory in Wisconsin, a growing number of Republicans have been calling for something more from him. His recent responses on questions from tax reform to immigration have been thin or nonexistent. When reporters tried to get an answer about the candidate's reaction to the Supreme Court's ruling on Arizona's immigration law, his spokesperson was so evasive, my colleagues might want to plant a mulberry bush in the press section to make the next round of the game more lively. Usually you have to win the White House before you can be that skilled at ducking and weaving. But wait. A Romney campaign aide told Politico's Jonathan Martin, when he wrote about this topic, that they have offered an ""unprecedented"" level of specificity. How can these two things both be true? To understand the disconnect, think of an ad for a prescription drug in a magazine. On one page there is an uplifting, well-lit picture of a healthy woman walking through a sunlit glen on the way to success. On the following two pages is all the fine print and possible side effects. Romney is specific about the glen and the breeze--tax cuts; more jobs for everyone; innovation; no more waste, fraud, and abuse--but is not so specific about the two pages of complexity and possible consequence. Is Romney offering an ""unprecedented"" level of specificity? This is an exciting claim, but it is contradicted by history. Next to me is my worn copy of Renewing America's Purpose, the 450-page volume of George W. Bush's policy addresses and proposals from 1999-2000. By this time in the 2000 campaign, Bush had unveiled a lot more policy than Romney has, including a plan to offer workers the ability to invest some of their Social Security money in private accounts. ""Mr. Bush is dominating the policy debate,"" the Economist wrote 12 years ago this month. ""[He] has seized on the opportunities to appear both bipartisan and statesmanlike."" It's also hard for the Romney campaign to boast about specificity when the candidate is doing the opposite. He's talked about why he won't give details because specificity was used against him in his Senate race and how his programs can't be evaluated by any experts because he hasn't provided details. How then can the Romney campaign claim to be so specific? The same way politicians like to believe that a response is the same as an answer. In background material offered by the campaign to show where Romney has been specific, many of the items were not so much Romney proposals but criticisms of President Obama. (This is also true of Romney's 160-page briefing book [pdf] titled Believe in America, which should have the subtitle Because Obama Doesn't.) A host of statements were generalities--a quotation from Nassim Nicholas Taleb's The Black Swan outlining mistakes that caused Wall Street's collapse, and calls for ""dynamic regulations."" In the section on financial system reform, Romney's adviser Glenn Hubbard is quoted from a Wall Street Journal article, saying that Romney would replace ""the new system for dismantling failing financial companies that was created as part of the 2010 Dodd-Frank financial overhaul law with a new system, which [Hubbard] declined to specify."" The Romney campaign is specific about some things. Romney will enact a 5-percent cut of nonsecurity spending on Day One of his presidency. He'll privatize Amtrak and reduce subsidies for NEA and the Corporation for Public Broadcasting--all of which is very specific but not highly consequential policy. He will repeal the Affordable Care Act, which is very specific. But he refuses to get specific about what will replace it. He's more specific about Medicare--seniors would be provided with a specified amount of money to purchase benefits, and private plans could compete--but details about how benefits would keep up with health costs are vague. When CBS's Bob Schieffer asked Tim Pawlenty, who launched his presidential campaign on the idea of telling hard truths, where Romney was being specific, the former Minnesota governor mentioned tax reform. Naming an issue area is not being specific. Adviser Eric Fehrnstrom offered Romney's plan for reducing the corporate tax rate as an example of specificity. Saying you're going to reduce corporate tax rates is the easy part; naming the loopholes to do so is harder. The word ""loopholes"" appears only twice in the 160-page Romney policy document: ""Meanwhile, loopholes favor those with the best lobbyists. If we close loopholes and lower the tax rate, the American people and corporations will win."" (#winning). When Gov. Romney was asked just what loopholes he would close to lower corporate and individual taxes, he said he'll work with Congress on that when he's elected. One of the funniest things Nancy Pelosi ever said was that Congress had to pass the Affordable Care Act to know what was in it. Romney makes a variant of that claim here: To know what he will do, we must elect him. The Romney campaign responds that the president has not been specific, either. This is true. The best example was Obama's refusal to back the specifics of the Simpson-Bowles commission. (It was a commission he commissioned which makes this a sin of commission.) But just because President Obama's posture is slouchy doesn't erase the fact that Romney is in the fetal position. Implicit in the Romney campaign's criticism of President Obama's specificity is a standard of how detailed one should be. But the Romney campaign would not like that standard to be applied to its candidate. Obama may not achieve the Platonic ideal of specificity, but he's well ahead of Mitt Romney. On loopholes, for example, President Obama has proposed a host he would remove (found on pages 202-05 of this Treasury Department explanation of the administration's revenue proposals). The largest one (explained on pages 73-74) would close loopholes (""tax expenditures"") for the wealthy by reducing (but not eliminating) the value of itemized deductions. Obama's framework for reducing corporate tax rates can be found here. Presidents are always more specific than their challengers because they have to actually put things on paper. In fact, it is President Obama's specificity that Mitt Romney is actually running against, in the form of the Affordable Care Act, the Dodd-Frank Wall Street reform, the Recovery Act, and the auto bail-out. Obama can't both lack a plan for dealing with Medicare costs and be attacked for hatching the Independent Payment Advisory Board that is supposed to hold down Medicare costs. There's more than enough in all of that for voters to evaluate the president's priorities, his manner, and his effectiveness on those policies. For a challenger without a recent governing past or a rich history, specificity is one way to evaluate him as a possible president. So is Mitt Romney trying to get away with something? At the moment, yes, but there's plenty of time left in the campaign for him to get specific. Imagine if Gov. Romney picked Paul Ryan as his running mate. He'd go from policy avoidance to basing his entire campaign on one of the most detailed campaign documents ever: the Ryan budget. The political debate would be filled with plumes of charts and graphs. The big important debate we should be having about the role of government in American life would finally start. The speeches would probably get no shorter and the policy books would not shrink, but we might actually find something useful in them. "	Why Mitt Romney Won't Get Specific--About Anything	['Pelosi', 'Paul', 'Black', 'Romney', 'Obama']	[]
