	Unnamed: 0	Link	Title	Text	Terms	Topics
12	12	http://www.breitbart.com/2016-presidential-race/2016/10/15/hillary-clinton-incredibly-painful-run-donald-trump/	Hillary Clinton: It’s ‘Incredibly Painful’ to Run Against Donald Trump	"Hillary Clinton complains that it's difficult to run against Donald Trump, berating him for running a negative campaign despite polls showing that she is ahead.SIGN UP FOR OUR NEWSLETTER""It's heartbreaking really,"" she said, speaking to supporters in Seattle, Washington on Friday night.""This election is incredibly painful,"" she said. ""I take absolutely no satisfaction in what is happening on the other side with my opponent. I am not at all happy about that, because it hurts my country, it hurts our democracy.""She urged voters to not get discouraged or ""unplug"" from the negative election, despite Trump's ""scorched earth"" tactics.""It isn't easy running against someone who is so negative, so divisive, so dark and dangerous,"" she said.But Clinton had a litany of negative attacks for Trump calling him unfit for the presidency.Clinton accused Trump of mistreating women, minorities, disabled people, illegal immigrants, prisoners of war, Native Americans, Muslims, and even President Obama by stoking birther rumors.""This is who Donald Trump really is ... America is better than this,"" she said.Clinton is on the West Coast for a series of fundraisers as she prepares for the third and final presidential debate on Wednesday. Her schedule remains empty for the remaining five days prior to the debate.While in California, she appeared on the Ellen show to warn viewers that the election wasn't over, urging them to vote.""Obviously there is a lot that's coming out, which is distressing on many levels,"" Clinton said. ""But I don't want anybody to think this election's over, because it's been so unpredictable up until now that I'm not taking anything for granted.""SIGN UP"	['Clinton', 'Trump', 'Obama']	[]
13	13	http://www.breitbart.com/big-government/2016/10/15/postal-service-not-delivering-on-pension-promises/	Postal Service Not Delivering on Pension Promises	"We're going on six years since the U.S. Postal Service has made any payments on the prefunding of retirement benefits required of it under the last round of reform legislation.SIGN UP FOR OUR NEWSLETTERBut rather than mandate it to catch up on its payments, Congress has hatched a plan to further shift costs for retirees' health care to the general fund.Since 1970, when Congress passed the Postal Reorganization Act, the Postal Service has operated as a quasi-government agency. Revenues are supposed to cover costs, and political interference on where post offices and other facilities are located is supposed to be removed from the process.The Postal Service has monopoly power over delivery of first-class mail and access to Americans' mailboxes, slots, etc. It uses these advantages and the tremendous delivery network and cost advantages of its unique ""monopoly-plus"" status - no property taxes, no vehicle taxes, income taxes payable only to itself, etc. - to compete with shipping and other businesses in what it calls its competitive lines.As a quasi-independent entity, the Postal Service provides its own benefits for employees and retirees. Since these benefits are promised and taxpayers are the backstop for it if the Postal Service cannot meet its obligations, it's only fair the Postal Service be required to prefund benefits.But the Postal Service has not paid a dime into the fund for six years and is now tens of billions of dollars behind. And now it wants Congress to give permission for it to skip out on this obligation altogether. It would do this by herding its retirees into Medicare, which is not expected to be solvent beyond 2029 already.A recent report from the Government Accountability Office found those covered only by Medicare averaged costing the system $8,100 per year on medical care. Those with Medicare and Medigap cost the system $15,600, and those with Medicare and employer wraparound coverage cost $14,400.And in a new paper from The Heritage Foundation, health care expert Walton Francis explained why this would be a problem.If retirees want to keep their doctors, insurance and choice through the Federal Employees Health Benefit Program, they would have to enroll in Medicare Part B under the House legislation. This will mean an extra premium for people on fixed incomes for insurance they don't need and, if they live overseas, can't use at all. They would get some relief early on from the usual $1,460 per year payment, but premiums would ramp up and total more than $15,000 over 10 years.The legislation would increase healthcare payments for some retired workers, which is why the National Association of Retired Federal Employees opposes the legislation.If the 93,000 postal annuitants are forced into Part B, Francis said, this would increase Medicare spending by about $130 million now and $1.5 billion over a 10-year period - again, for something the Postal Service gets for free that its competitors have to pay for. And who would make up this difference? Taxpayers and other federal retirees who would see their costs go up.Postal employees account for a fifth of all federal employees and a fourth of current annuitants. Almost all retirees are enrolled in Medicare Part A hospital benefits, which, when doctors and drugs are counted, amounts to a $4,500 annual subsidy from Medicare to FEHBP plans.As of now, retirees would not have to pay the 10 percent-per-year penalty for waiting beyond age 65 to enroll. They would be ""deemed"" to have enrolled so they would not lose their FEHBP coverage, but the Social Security Administration, Department of Health and Human Services or Office of Personnel Management would have to locate them and somehow sign them up for Part B.This proposal would move postal workers into their own risk pool and out of the pool for all federal employees and annuitants. This is about a $700 million-per-year mistake, Francis wrote, because postal employees' average costs per family are $1,700 a year higher than those of non-postal families because they are older and get sick more.Francis suggests instead of moving postal retirees into Medicare, Congress should fix FEHBP. First, he says, quit subsidizing the purchase of the most expensive plans by ending cost-sharing of premiums and removing the pre-tax premium subsidy. Move toward a defined-contribution formula by, among other things, changing payment formulas, and address the way risk is absorbed.More importantly, he said, the onus should be on fixing FEHBP, not requiring postal retirees to purchase additional insurance they do not need.In other words, it's up to the Postal Service to get out of businesses it doesn't know how to run and to quit paying for its business mistakes by foisting retiree health costs on taxpayers and other annuitants.And no amount of reform legislation this year is going to change that.SIGN UP"	[]	['healthcare']
14	14	http://www.breitbart.com/national-security/2016/10/15/tony-abbott-says-trump-policies-reasonable-enough-defends-supporters-deplorables-charge/	Former Aussie PM Tony Abbott Says Trump Policies ‘Reasonable Enough’	"The 2016 U.S. presidential election is such a big show that people on the other side of the world are trying to get into the act.SIGN UP FOR OUR NEWSLETTERAfter lawmakers in the New South Wales Parliament introduced a resolution labeling Donald Trump a ""revolting slug,"" former Prime Minister Tony Abbott slammed them for wasting the Parliament's time, and stood up for both Trump and his supporters.The motion declaring agreement with ""those who have described Trump as 'a revolting slug' unfit for public office"" passed without objection, or a formal vote, on Thursday evening.The Sydney Morning Herald reports that lawmakers diligently researched whether ""revolting slug"" was considered acceptable parliamentary language, having previously run into trouble on that score by labeling various individuals a ""villain,"" ""blackguard,"" and ""smart arse."" (Actually, the villain was also the blackguard.)Apparently it is acceptable to call someone a revolting slug if they're not a member of Parliament, although it's unclear from the Sydney Morning Herald's coverage if Rosie O'Donnell's variation, ""orange slug,"" would pass muster.None of it passed muster with Tony Abbott. He did say that Trump's 2011 videotaped comments were ""absolutely disgusting,"" and the tapes were ""gross beyond belief"" and ""completely indefensible,"" but the NSW motion was an ""exercise in moral vanity.""""Posturing of any sort is something which is not really fitting for a parliament,"" he added.""The point that I want to make is that the vast majority of Trump supporters are not deplorables, they really aren't. They are decent people who want to see change inside their country and that's fair enough,"" Abbott continued, referring to Hillary Clinton's dismissal of half of Donald Trump's supporters as a ""basket of deplorables.""He added that ""many of the Trump positions are reasonable enough,"" which sounds a bit like when Barack Obama told Hillary Clinton she was ""likable enough,"" and those two seem to be getting along well enough these days, so Abbott's comments ought to be good enough to keep him on Trump's sunny side.Abbott also declared himself an ""admirer"" of America, and stressed the international community's need for a ""great and strong"" United States, because it is ""the one country in the world with the strength and goodwill to be a relatively acceptable arbiter of all the problems the world faces.""The Sydney Morning Herald said Abbott's defense of Trump ""will be interpreted by his colleagues as another attempt to reach out to far-right voters who abandoned the Liberal party at the last election following the installation of the moderate Malcolm Turnbull as prime minister, and a further sign he is jockeying to be returned to the leadership.""Strangely, the SMH didn't say anything about the NSW lawmakers using their condemnation of Trump as a stunt to reach out to left-wing voters, even though the author of the motion, Jeremy Buckingham, is noted for such previous stunts as setting a river on fire to highlight environmental issues. Thankfully, he didn't try filling the parliamentary chamber with slugs to make his point about Trump.SIGN UP"	['Abbott', 'Clinton', 'Trump', 'Obama']	[]
15	15	http://www.breitbart.com/2016-presidential-race/2016/10/15/wikileaks-clinton-foundation-employees-gave-organization-poor-grade-effectiveness-according-internal-report/	WikiLeaks: Clinton Foundation Employees Gave Organization Poor Grade for Effectiveness	"In a 2011 internal review of the Clinton Foundation,  the organization's own employees gave it poor marks for effectiveness,  rating it at a dismal 4 or lower on a scale of 10.SIGN UP FOR OUR NEWSLETTERThe revelation from WikiLeaks' dump of John Podesta's emails,  comes from an internal review done of the charity by Simpson and Thacher,  which raised huge questions about conflicts of interests at the organization.Clinton Foundation employees rated the foundation's work in the AIDS/HIV area a 7-8  on the same scale, but the report highlights serious concerns about corruption, conflicts of interest and self-dealing. The report notes:The report paints the picture of an organization where ""there is no clear 'command and control' structure.""Simpson and Thacher suggests correcting the troubling problems by setting the ""tone at the top"" including Bill Clinton.SIGN UP"	['Clinton', 'Simpson']	[]
16	16	http://www.breitbart.com/sports/2016/10/15/vegas-gambles-raiders-legislature-passes-1-2-billion-stadium-bill/	Vegas Gambles on Raiders: Nevada Legislature Antes Up $750 Million for Stadium	"The Nevada legislature approved a $1.17 billion bill to fund a football stadium and improvements to the Las Vegas Convention Center on Friday.SIGN UP FOR OUR NEWSLETTERThe $750 million in public money allocated to the stadium represents the largest subsidy received in such a deal in the history of the National Football League. The Indianapolis Colts held the previous record by wresting more than $600 million from taxpayers for Lucas Oil Stadium. U.S. Bank Stadium in Minneapolis, which opened earlier this year, received around $500 million from state and local government.The corporate subsidies assuredly mean both higher taxes for Nevadans and the loss of the Raiders for Oakland. The Senate approved the bill 16-5 earlier this week, the assembly passed it 28-13 on Friday, and the Senate then unanimously approved the assembly's amendments immediately thereafter. Republican Governor Brian Sandoval looks to sign the bill next week, most likely Monday, in a ceremony including Raiders owner Mark Davis.""I would like to thank Governor Sandoval, the Southern Nevada Tourism Infrastructure Committee, and the members of the Nevada Legislature on this historic day,"" Davis proclaimed in a release. ""All parties have worked extremely hard to develop and approve this tremendous stadium project that will serve as a proud new home for the entire Raider Nation.""With the Golden State Warriors off to San Francisco in three years, the Raiders soon moving to Las Vegas, and the Seals gone from Oakland for 40 years, a four-team town for a brief period in the 1970s becomes a one-team town in a few years. MLB Commissioner Rob Manfred confirmed plans to keep the A's in Oakland but the team needs a new stadium to replace its dated venue.In both Nevada houses, the budget-busting bill received majority support from both parties. But a greater percentage of Republicans voted for passage.The Republican governor praised the assembly for supporting the massive expenditure.""This is the beginning of the next chapter of southern Nevada's continued dominance in tourism, conventions and hospitality and presents an exciting opportunity for UNLV,"" Governor Sandoval gushed. ""I'm proud of the work that has been done to create these possibilities for Nevada's future and the next phase of our state's evolution.""SIGN UP"	['Sandoval', 'Lucas']	[]
17	17	http://www.breitbart.com/2016-presidential-race/2016/10/14/womens-groups-treat-bill-clinton-donald-trump-differently/	Women’s Groups Treat Bill Clinton and Donald Trump Differently	"SIGN UP FOR OUR NEWSLETTERANITA KUMAR AND LESLEY CLARK write at McClatchy DC:WASHINGTON-Groups that advocate for women's rights are lashing out at Donald Trump for allegations of groping women and bragging about sexual assaults.But some of those same groups did not think former President Bill Clinton's allegations of sexual misconduct nearly two decades ago were disqualifying in the same way.At least three women - Juanita Broaddrick, Paula Jones and Kathleen Willey - accused Clinton of unwanted sexual advances. Another five, including White House intern Monica Lewinsky, said they had had consensual affairs with him. Clinton was impeached on charges of lying about the Lewinsky affair before a grand jury and of obstruction of justice, but was acquitted and served his full presidential term.Women's groups largely stayed supportive.""Feminists have, all along, muffled, disguised, excused and denied the worst aspects of the president's behavior with women,"" said a lengthy Vanity Fair article from 1998.""Feminism sort of died in that period,"" New York Times columnist Maureen Dowd told Yahoo recently. ""Because the feminists had to come along with Bill Clinton's retrogressive behavior with women in order to protect the progressive policies for women that Bill Clinton had as president.""Clinton's female supporters stood by him, especially as he denied allegations of misconduct, as has Trump. Later, after Clinton admitted to some of the allegations of consensual sex, they did criticize him but still supported him.They were called hypocrites at the time, particularly when they were among the first to blast conservative Supreme Court Justice Clarence Thomas and former Sen. Bob Packwood, R-Ore., for allegations of sexual misconduct.WASHINGTON-Groups that advocate for women's rights are lashing out at Donald Trump for allegations of groping women and bragging about sexual assaults.But some of those same groups did not think former President Bill Clinton's allegations of sexual misconduct nearly two decades ago were disqualifying in the same way.At least three women - Juanita Broaddrick, Paula Jones and Kathleen Willey - accused Clinton of unwanted sexual advances. Another five, including White House intern Monica Lewinsky, said they had had consensual affairs with him. Clinton was impeached on charges of lying about the Lewinsky affair before a grand jury and of obstruction of justice, but was acquitted and served his full presidential term.Women's groups largely stayed supportive.
""Feminists have, all along, muffled, disguised, excused and denied the worst aspects of the president's behavior with women,"" said a lengthy Vanity Fair article from 1998.
""Feminism sort of died in that period,"" New York Times columnist Maureen Dowd told Yahoo recently. ""Because the feminists had to come along with Bill Clinton's retrogressive behavior with women in order to protect the progressive policies for women that Bill Clinton had as president.""
Clinton's female supporters stood by him, especially as he denied allegations of misconduct, as has Trump. Later, after Clinton admitted to some of the allegations of consensual sex, they did criticize him but still supported him.
They were called hypocrites at the time, particularly when they were among the first to blast conservative Supreme Court Justice Clarence Thomas and former Sen. Bob Packwood, R-Ore., for allegations of sexual misconduct.
var _ndnq = _ndnq || []; _ndnq.push([""embed""]);You can read the rest of the story here.

SIGN UPWASHINGTON-"	['Jones', 'Clinton', 'Trump']	[]
18	18	http://www.breitbart.com/2016-presidential-race/2016/10/14/nuclear-option-bush-vs-clinton-redux-2016/	Nuclear Option: It Was Always Going to Be Bush Vs. Clinton 2016	"SIGN UP FOR OUR NEWSLETTERIt was always going to be this way: Bush vs. Clinton 2016.From the very start, the media tried to rig this election to be a showdown between the Republican Party's polite and uptight Bush clan and the Democratic Party's shameless and self-serving Clinton mafia.Only the Bush they had in mind -- Jeb! -- did not have the stamina to keep up with the exclamation point his campaign deployed to put a little pep in his step. The poor little punctuation mark hung like a sad, shriveled carrot, dangling there beyond the end of his name in hopes of spurring him toward dynastic destiny.Some eight wild months after Jeb! finally surrendered and began a long nap, in swoops Billy Bush to rescue the dynasty by slaying the family's greatest threat: a Republican NOT named Bush.The Bush family motto has always been if not a Bush, then how about a Clinton? We've all heard how, on long, overnight plane trips together, Bubba gives Poppy the bed.Oh, dear.But, back to the tape. Listening to Mr. Bush enthusiastically encourage Mr. Trump's vulgar and absurd approach to picking up women, it is clear that Mr. Bush needs no help from an exclamation point. He is so excited in the recording that he is practically panting as he trots alongside Mr. Trump as the billionaire lover dazzles with all his fantastical boasting.But let's be honest, in the locker room, there are talkers and there are doers. These are the words of a talker.After playing the tape over and over and over, the media then sits up and screams, ""Put the kids to bed!"" Finally, they can caution parents to keep their children away from Donald Trump.But have they forgotten what our children have already been exposed to in the great modern American political debate?In September 1998, The Washington Post reported:""A few hours before President Clinton began his videotaped grand jury testimony Aug. 17, the FBI laboratory informed Starr's office that the president was the source of the DNA taken from Monica S. Lewinsky's navy blue dress 'to a reasonable degree of scientific certainty.'""""Daddy, what is a DNA sample?"" the child asks. ""And how did it get onto her blue dress? What is an intern?""Or about this gem from 1997:""Mommy, what does 'distinguishing characteristic' mean? And how do you get Peyronie's disease? What's an affidavit?""Seriously, people, you have dragged America's children through far worse.The question I still have is how is it possible that Mr. Bush and Mr. Trump could have been recorded saying such things and, for 11 years, NBC News took no action whatsoever against its reporter? Does NBC News, owner of the Access Hollywood program, condone such behavior and comments from their ""on air talent""?And when they finally decided to take action, did company officials actually discuss ways of releasing the tape of Mr. Trump's comments while covering up for Mr. Bush?And how long exactly did the company sit on the tape before dropping the bombshell ""October surprise"" just weeks before the election?We won't hold our breath waiting for answers to these questions.But it all reminds us that it is beyond high time that we grab the Republican Party by the Bush and grab theDemocratic Party by the Clinton and toss them all out into the gutter where they belong.* Charles Hurt can be reached at charleshurt@live.com; follow him on Twitter via @charleshurt.SIGN UP"	['Clinton', 'Trump', 'Hurt']	[]
