	Link	Title	Text
21	http://www.breitbart.com/radio/2016/11/12/first-winning-female-presidential-campaign-manager-kellyanne-conway-trump-hired-me-because-of-my-talents-and-my-skills/	First Winning Female Presidential Campaign Manager Kellyanne Conway: ‘Trump Hired Me Because of My Talents and My Skills’	"Winning campaign manager for President-elect Donald J. Trump Kellyanne Conway emphasized on Breitbart News Saturday on SiriusXM Patriot Radio Channel 125 that not only did Trump hire her based on her merits, not her gender, but that he was the one who elevated her to the high position in his campaign.SIGN UP FOR OUR NEWSLETTERBreitbart News Saturday radio co-host Sonnie Johnson asked Conway: In Conway's capacity as the first woman to run a successful presidential campaign, ""Did you steal Hillary Clinton's hammer?"" Democratic Party presidential nominee Clinton was the first female nominee of a major party and would have been the first female president of the United States had she not lost the election.Johnson thanked Conway for allowing her to tell her daughter the morning after the election that Clinton would never be her president. She then told Conway that her daughter then asked if could she meet Kellyanne Conway now.Conway responded graciously, saying that she thinks about people like Johnson's daughter and her own daughters and her son when she thinks about what this election means. ""It honestly means this is an election of the people, for the people, and by the people and I feel, ya know, people will stop me in the street and they'll say: You all, meaning Mr. Trump and the campaign, but Mr. Trump of course, saved the Supreme Court, saved America, gave us a nice restart button, and that's for the people. For me it's especially for future generations.""Conway continued:So I am told that, I know Hillary Clinton failed to break the glass ceiling, but that I did in being the first female presidential campaign manager that was successful. There were three democratic campaign managers who were female before me, but their candidates lost. So I do, I'm not a big gender person. I know Mr. Trump hired me because of my talents and my skills and not because -- he put a team together that was amazing -- and not because of my gender, but at the same time I do feel a special responsibility. And you know what, I do feel like kickin' up my heels a little because I worked in a Republican Party infrastructure that doesn't always elevate female consultants to the top and that there's not always an opportunity.But I want everybody to remember, Sonnie, that it was Donald J. Trump who elevated a woman to the highest position in his campaign, much like he has done in the Trump Corporation for a number of decades, and it is he who gave women responsibilities and it is he, by the way, who did the same among female voters as did Mitt Romney and John McCain for all this talk. I mean the first female President, it did not attract a critical mass of women. I always said, knew and said publicly, probably on Breitbart radio, that she would need about 60 percent of the female vote to win, and she got nowhere near there because she had this reverse gender gap with men.But I'm excited, I want all the little girls out there to know that the lessons are very simple. Be kind your entire life because all the kindness I showed to other people came back to me manifold in this campaign. And secondly and most importantly, if you work hard and you get your shot one day, you too will shine. You have to believe in yourself, don't listen to the critics, don't listen to the naysayers. You know who you are. You're beautiful, you're smart, you can do it, and that's my message to all those little girls out there.In August Trump elevated Conway from senior adviser to campaign manager after just a few weeks with the campaign. TIME reported that within a few weeks, Conway had made key changes in the campaign and that she was ""breaking through in ways her predecessors could not.""Follow Michelle Moons on Twitter @MichelleDiana So I am told that, I know Hillary Clinton failed to break the glass ceiling, but that I did in being the first female presidential campaign manager that was successful. There were three democratic campaign managers who were female before me, but their candidates lost. So I do, I'm not a big gender person. I know Mr. Trump hired me because of my talents and my skills and not because -- he put a team together that was amazing -- and not because of my gender, but at the same time I do feel a special responsibility. And you know what, I do feel like kickin' up my heels a little because I worked in a Republican Party infrastructure that doesn't always elevate female consultants to the top and that there's not always an opportunity.
But I want everybody to remember, Sonnie, that it was Donald J. Trump who elevated a woman to the highest position in his campaign, much like he has done in the Trump Corporation for a number of decades, and it is he who gave women responsibilities and it is he, by the way, who did the same among female voters as did Mitt Romney and John McCain for all this talk. I mean the first female President, it did not attract a critical mass of women. I always said, knew and said publicly, probably on Breitbart radio, that she would need about 60 percent of the female vote to win, and she got nowhere near there because she had this reverse gender gap with men.
var _ndnq = _ndnq || []; _ndnq.push([""embed""]);But I'm excited, I want all the little girls out there to know that the lessons are very simple. Be kind your entire life because all the kindness I showed to other people came back to me manifold in this campaign. And secondly and most importantly, if you work hard and you get your shot one day, you too will shine. You have to believe in yourself, don't listen to the critics, don't listen to the naysayers. You know who you are. You're beautiful, you're smart, you can do it, and that's my message to all those little girls out there.SIGN UP"
22	http://www.breitbart.com/2016-presidential-race/2016/11/12/exclusive-accurate-brexit-trump-pollster-polling-industry-crossroads-beltway-bubble-painful-truth/	EXCLUSIVE–Accurate Brexit, Trump Pollster: Polling Industry at a ‘Crossroads’ Between the ‘Beltway Bubble’ and the ‘Painful Truth’	"The Democracy Institute's Dr. Patrick Basham -- who correctly predicted Brexit and the U.S. presidential election -- described the polling industry as being at a crossroads after Donald Trump came out on top of Hillary Clinton, which conflicted with many polls that had forecast a Clinton victory.SIGN UP FOR OUR NEWSLETTER""The polling industry is at a crossroads. It can continue down the 'beltway bubble' path of a too-cosy relationship with respective media sponsors, too often unable to see the electoral forest for the data-driven trees. Or, it can venture along the 'painful truth' path, admitting that any good poll is a blend of science and art,"" Basham explained during an exclusive interview with Breitbart News.He continued:The former is necessary, but insufficient, in today's world of anti-polling cynicism, privacy concerns, very low response rates, and 'shy' conservative respondents. Polling artists are necessary, for they inject some realism, some balance, into the raw number-crunching. If pollsters candidly revealed more about the inherent limitations of their craft, it would restore some of the public's faith in the inherent utility of their profession.Basham, who referred to himself as a free market guy and who previously worked at the Cato Institute, credited voter turnout as to why he was able to predict both the Brexit and Trump victories accurately through his polling.""Both Brexit and the American election were always going to be about turnout. It was as important -- if not more important -- to know who was going to show up, than to know exactly how they were going to vote,"" he stated.He went on to explain that voters who supported leaving the European Union (E.U.) and Trump voters were both more enthusiastic and determined to show up and vote than the opposition.""We knew that the turnout model that many of the media pollsters were using was going to overestimate the vote to remain,"" he added, noting the enthusiasm from voters wanting to leave the E.U.""There was a shy Brexit voter just like there was a shy Trump voter,"" Basham also explained, noting that both people who supported leaving the E.U. and people that supported Trump would identify as undecided instead of disclosing their preference to a pollster.Basham explained about Brexit, noting it was similar to how people didn't want to identify as a Trump voter during the U.S. presidential election:What we tried really hard to do, and I think we were successful, was to ask people a lot of questions about their attitudes to all kinds of things in order to figure out how likely they were if they were telling us they were undecided, were they really undecided, or were they reluctant to tell us they wanted to vote to leave. We used the same methodology in terms of the way that we asked all these other questions, what we were looking at the U.S. election, and we reached the same conclusion that there were a lot of shy reluctant Trump voters. They were telling pollsters that they were undecided.He said the ""shy"" Trump voter, who would identify as undecided to pollsters, accounted for anywhere from two to four percent nationally.Basham's analysis is exactly how Trump campaign pollster Adam Geller explained the campaign's success to Fox News's Fox & Friends on Saturday morning.""We had a smart team of people who are really diving into the data. You can't just look at the top lines,"" Geller explained about how the Trump campaign analyzed the polls, adding that it is important to figure out ""who is most likely to show up.""""What the top lines don't tell you is how are undecideds going to break. One of the most important lessons we can all learn from this is we have to go beyond the top line numbers,"" Geller declared, adding that with polling, there will always be undecided voters, but figuring out exactly how the undecided voters will break can provide a more accurate prediction of the election outcome.Basham said that with both Brexit voters and Trump voters, there was a general frustration with politics as normal and that is what drove those voters to the polls. He also applauded the International Business Daily (IBD/TIPP) tracking poll and the USC Dornsife/Los Angeles Times ""Daybreak"" poll, which both consistently showed Trump with a lead over Clinton.""The IBD/TIPP poll -- [with] who the media sponsor is -- that poll was never designed to lead or create a narrative,"" Basham explained, alleging that other media polls may have been ""designed to lead the coverage.""""The LA Times ... that poll is an academic poll. It's the USC people who do it,"" he noted, referring to it as an experiment and pointing out that it also factored in enthusiasm and intensity of voters.Basham said that other polls got it wrong for one of two reasons: either they never adjusted the expected Democratic turnout to be lower than President Obama's numbers, or the media sponsors may have influenced the pollsters.Most pollsters, according to Basham, ""began their polling overestimating what the Democratic turnout would be, assuming that Hillary could replicate the Obama coalition...but they never learned from what was going on,"" with the enthusiasm from Trump supporters.Basham added that although most pollsters are smart, ""Anyone with any sense and exposure to just an average voter would know that this year was going to be different.""The former is necessary, but insufficient, in today's world of anti-polling cynicism, privacy concerns, very low response rates, and 'shy' conservative respondents. Polling artists are necessary, for they inject some realism, some balance, into the raw number-crunching. If pollsters candidly revealed more about the inherent limitations of their craft, it would restore some of the public's faith in the inherent utility of their profession.What we tried really hard to do, and I think we were successful, was to ask people a lot of questions about their attitudes to all kinds of things in order to figure out how likely they were if they were telling us they were undecided, were they really undecided, or were they reluctant to tell us they wanted to vote to leave. We used the same methodology in terms of the way that we asked all these other questions, what we were looking at the U.S. election, and we reached the same conclusion that there were a lot of shy reluctant Trump voters. They were telling pollsters that they were undecided.SIGN UP"
23	http://www.breitbart.com/big-government/2016/11/12/pope-francis-dont-judge-trump-worry-refugees-immigrants/	Pope Francis: I Don’t Judge Trump, but I Worry About ‘Refugees and Immigrants’	"Asked what he thinks of Donald Trump, Pope Francis said that he refrains from passing judgment on politicians but wants to ""understand the suffering that their approach causes the poor and excluded.""SIGN UP FOR OUR NEWSLETTERIn an exclusive interview this week with the leftwing Italian journalist Eugenio Scalfari, Pope Francis stated that his greatest concern is the treatment of refugees and immigrants.""I do not pass judgment on people and politicians. I simply want to understand the suffering that their approach causes the poor and excluded,"" he said when asked point blank for his opinion on the new President-elect.Pushed further regarding his specific worries, the Pope replied, ""The question of refugees and immigrants. Only a small proportion of them are Christians, but this does not change the situation as far as we are concerned, or their suffering and distress.""The Pope recognized that much of the pushback against massive immigration comes from the lower and middle classes, who are afraid of too many jobs going to immigrants and the effects on the national economy.""Unfortunately,"" he said, often, welcoming immigration policies ""are opposed by populations that are afraid of losing jobs and of lower wages. Money is against the poor as well as against immigrants and refugees, but there are also poor people in rich countries who fear the arrival of their fellows from poor countries.""""It is a vicious circle and it must be broken,"" Francis continued. ""We must break down the walls that divide us: we must try to increase prosperity and make it more widespread, but to achieve this we need to break down walls and build bridges that allow us to reduce inequality and increase freedom and rights.""""More rights and greater freedom,"" he said.Writing in the Italian daily La Repubblica, Scalfari took advantage of his interview with the Pope to launch his own diatribe against Donald Trump, calling his election a ""disaster"" for Europe.""Trump's victory is catastrophic for us Europeans and Italians,"" he wrote. ""Trump is the white angel, fighting the establishment of the United States, against all the immigrants and their families.""Scalfari said that Trump's triumph ""reinforces all the movements in Europe that are opposed to the elites and governing classes in their countries,"" naming the Five Star Movement, Le Pen in France, Italy's Northern League and the ""parties behind Brexit.""""Trump has no charisma and no political competence,"" Scalfari said. ""The leadership gave him the voters, whereas Obama was the one to win over the Americans and the whole Western world. The difference is total.""Follow Thomas D. Williams on Twitter  Follow @tdwilliamsromeSIGN UP"
24	http://www.breitbart.com/big-government/2016/11/12/politico-trumps-chief-staff-pick-says-presidency/	Politico: What Trump’s Chief of Staff Pick Says About His Presidency	"SIGN UP FOR OUR NEWSLETTERAlex Isenstadt and Blake Hounshell write at Politico that President Elect Donald J. Trump's decision on who will be his Chief of Staff--Priebus, Bannon, or other--may define the direction of his administration. So what do the two most prominent names floated as Donald Trump's chief of staff say about him?The Republican establishment's choice is abundantly clear: Reince Priebus, who withstood a lot of heat and mockery during the election but proved both his loyalty to Trump and his organizational acumen, with the Republican National Committee essentially handling Trump's ground game.It was Priebus who Trump recognized during his victory speech early Wednesday morning, hauling the RNC chairman up to the podium and hailing him as an ""amazing guy"" and a ""superstar"" comparable to Triple Crown winner Secretariat. And it was Priebus who served as a bridge to mainstream Republicans, vouching for Trump in public and urging him to soften his rough edges in private.[...]But picking Priebus could provoke a revolt among Trump's fervent supporters on the right, who thought they were voting for a president who wanted to ""drain the swamp"" of Washington -- not stack his administration with the very people he vowed to overthrow. As Trump's longtime confidant, Roger Stone, tweeted on Saturday: ""The selection of @reince for COS in a @realDonaldTrump WH would cause a rebellion in Trump's base. #RyansBoy.""Choosing Stephen Bannon, the blowtorch boss of Breitbart News, would signal something else altogether.Bannon stayed out of the limelight after being named CEO of Trump's campaign in August, following the resignation of Paul Manafort. He was a steadying presence for Trump on the campaign trail, helping the GOP nominee sharpen his message.Under Bannon's guidance, Breitbart became a ferocious critic of Ryan's tenure, casting him as a ""saboteur"" in favor of amnesty for undocumented immigrants and describing him as ""universally despised"" by conservatives. One article published under Bannon's co-byline, headlined ""Paul Ryan Betrays America: $1.1 Trillion, 2,000-Plus Page Omnibus Bill Funds 'Fundamental Transformation of America',"" portrays the speaker as a sellout secretly working to boost Obama's policies -- complete with a photograph of a bearded Ryan posing with a grinning president.You can read the rest of the story here.So what do the two most prominent names floated as Donald Trump's chief of staff say about him?
The Republican establishment's choice is abundantly clear: Reince Priebus, who withstood a lot of heat and mockery during the election but proved both his loyalty to Trump and his organizational acumen, with the Republican National Committee essentially handling Trump's ground game.
It was Priebus who Trump recognized during his victory speech early Wednesday morning, hauling the RNC chairman up to the podium and hailing him as an ""amazing guy"" and a ""superstar"" comparable to Triple Crown winner Secretariat. And it was Priebus who served as a bridge to mainstream Republicans, vouching for Trump in public and urging him to soften his rough edges in private.
[...]
But picking Priebus could provoke a revolt among Trump's fervent supporters on the right, who thought they were voting for a president who wanted to ""drain the swamp"" of Washington -- not stack his administration with the very people he vowed to overthrow. As Trump's longtime confidant, Roger Stone, tweeted on Saturday: ""The selection of @reince for COS in a @realDonaldTrump WH would cause a rebellion in Trump's base. #RyansBoy.""
var _ndnq = _ndnq || []; _ndnq.push([""embed""]);Choosing Stephen Bannon, the blowtorch boss of Breitbart News, would signal something else altogether.
Bannon stayed out of the limelight after being named CEO of Trump's campaign in August, following the resignation of Paul Manafort. He was a steadying presence for Trump on the campaign trail, helping the GOP nominee sharpen his message.
Under Bannon's guidance, Breitbart became a ferocious critic of Ryan's tenure, casting him as a ""saboteur"" in favor of amnesty for undocumented immigrants and describing him as ""universally despised"" by conservatives. One article published under Bannon's co-byline, headlined ""Paul Ryan Betrays America: $1.1 Trillion, 2,000-Plus Page Omnibus Bill Funds 'Fundamental Transformation of America',"" portrays the speaker as a sellout secretly working to boost Obama's policies -- complete with a photograph of a bearded Ryan posing with a grinning president.SIGN UPAlex Isenstadt and Blake Hounshell write at Politico that President Elect Donald J. Trump's decision on who will be his Chief of Staff--Priebus, Bannon, or other--may define the direction of his administration. "
25	http://www.breitbart.com/2016-presidential-race/2016/11/12/phyllis-schlaflys-eagle-forum-president-paul-ryan-rejected-time-drain-swamp-failed-leaders-ryan/	Phyllis Schlafly’s Eagle Forum President: Paul Ryan Was ‘Rejected’ on Election Day; Time to ‘Drain the Swamp of Failed Leaders like Ryan’	"""It is time to drain the swamp of failed leaders like [House Speaker Paul] Ryan,"" says Ed Martin, the late Phyllis Schlafly's hand-chosen successor and president of her Eagle Forum Education and Legal Defense Fund.SIGN UP FOR OUR NEWSLETTERRepublican lawmakers are set to hold leadership elections this coming Tuesday, November 15.The conservative Eagle Forum president is urging conservative lawmakers not to elect Ryan, whose open borders trade and immigration agenda stands in direct opposition to the vision of President-elect Donald J. Trump and the ""mandate"" given to him by the American people who propelled him to victory.""Now is the time to move forward on the Trump agenda, not back to the failed Ryan policies,"" Martin told Breitbart News. ""On Tuesday, November 8, the American voters showed conclusively that Paul Ryan is not the leader for this moment in our history.  The message is clear: Ryan's judgment was rejected!""Martin explained that ""the voters' clear message is that Ryan is wrong for the American people and the Republican Party in at least two ways: First, his policy agenda, which included amnesty for illegals, as well as open borders, free trade deals, and a plan to cut Americans' hard-earned benefits, was soundly rejected. Second, his political judgment in failing to support Donald Trump was ill-advised.""""Paul Ryan should yield to a new Republican leader whose policy positions and political judgment are in line with the Trump Republican Party,"" Martin added. ""There are plenty of Republican members ready to lead, including stalwarts, especially in the Freedom Caucus.Trump's win on election night represented Phyllis Schlafly's final victory. The late conservative icon and grassroots warrior led the conservative grassroots into battle for more than half a century.Schlafly was one of Trump's earliest and most influential backers in the conservative movement. In August, Schlafly called for the American people to ""get rid"" of Ryan.""Get rid of him! We don't want anybody who believes in open borders,"" Schlafly told Breitbart.Schlafly said that Ryan repeatedly demonstrated that he is ""not really for America"" and is ""not for American citizens."" She further explained that if Speaker Ryan could not get in line with the majority of the American electorate on immigration, he ""should resign.""""I don't think we should accept him as Speaker,"" Schlafly said. ""We need a new leader in Congress who will represent the issues that Donald Trump ran on because they were the winning issues.""""I think one of the reasons Trump was nominated was because he wants to put America first and defend the interests of the United States,"" Schlafly said. ""Obviously, Paul Ryan is not an 'America first' guy.""Schlafly also indicated at the time that if the GOP were to follow Ryan down the path of supporting the donor class's corporate agenda, it would have meant the death of the Republican Party.Indeed, it was Ryan's failed 2012 campaign with Mitt Romney that led Republican leaders and consultants to issue the GOP ""autopsy report.""The ""autopsy,"" commissioned and championed by Reince Priebus, took as one of its conclusions that to win elections, Republicans must embrace an immigration agenda that would import future voters who tend to overwhelmingly support Democrat policies. ""The Priebus manifesto,"" as Schlafly called it, argued against opposing amnesty efforts and appealing to the Republican electorate's ""core constituency.""""We must embrace and champion comprehensive immigration reform. If we do not, our Party's appeal will continue to shrink to its core constituencies only,"" Priebus' commissioned report stated.Schlafly told Breitbart News in August that she was hopeful about the future of the GOP because Trump will lead the Republican Party in a different direction than Ryan-one that is in line with the wishes of ""real Republicans,"" rather than the desires of Republican donors.""He's got the traditional values of real Republicans,"" Schlafly said. ""I don't think the GOP is going to die. I think Trump is going to revive it.""""If [Paul Ryan] can't get in line with majority of the electorate on the biggest issue [immigration], he should resign, and we should get someone who fulfills the wishes and the hopes of the majority who just nominated Trump,"" Schlafly said. ""It doesn't sound like he [Ryan] is loyal to the Republican Party. We need someone who is going to be a spokesman for the Republican Party and its nominee. And if Ryan doesn't fill that bill, we should get another one.""It is unclear whether conservative lawmakers in the House Freedom Caucus, led by Congressman Jim Jordan, will elect Paul Ryan as House Speaker, given that Ryan stands opposed to nine of ten GOP voters on the critical issues of trade and immigration.SIGN UP"
