	Unnamed: 0	Link	Title	Text	Terms	Topics
19	19	http://www.breitbart.com/big-government/2016/10/14/transgender-advocates-destroy-common-sense/	Transgender Advocates ‘Aim to Destroy’ Common Sense, Says Analysis	"The progressive left is demanding that ordinary Americans describe some men as ""she"" and some women as ""he,"" supposedly just to help a few people who say they are transgender, says a new analysis published by The Witherspoon Institute.SIGN UP FOR OUR NEWSLETTERBut this political battle isn't merely about pronouns, bathrooms or a few confused teenagers, says Anthony Esolen, a professor of English at Providence College in Providence, Rhode Island.The fight is really about pressuring Americans to fracture their proven science, their shared sense of reality, their common culture, and ultimately their own civic power to govern themselves and their families, he writes.Now, sex is the first thing we notice about someone, and the last thing we forget. It's easy to see why this should be so. It cannot possibly be to any living thing's advantage to be confused about male and female. As it is, sex is far more strongly marked upon the human body than it is upon the bodies of dogs or cats or horses or many of the species of birds. A man's face is not like a woman's face. A woman's voice is not like a man's voice, even when the woman is Greer Garson and the man is Frankie Valli. A man's shoulders do not look like a woman's shoulders, and a woman's hips do not look like a man's hips. Men and women differ down to their very hair, as anyone can perceive who looks at a woman's smooth chin or a man's bald pate.Ordinary and healthy people love that it is so, and on those exceedingly rare occasions when you cannot determine someone's sex from a glance or from one moment on the telephone--and some people will go through their entire lives without a single such experience--we feel that it is strange and disconcerting, just as we would feel if we were in the presence of someone who was born without arms. We are not talking about a mere statistical norm here, but about what is paradigmatically human.To pretend, therefore, that we do not know what we immediately and urgently perceive is to do violence at once to human nature, language, the possibility of a shared life, and the intellect's capacity to apprehend reality. If I cannot say, ""There is a man walking down the street,"" then it is hard to see how I can make any reliable judgment about anything at all that bears on human existence. If I cannot say, ""Joey is going to grow up to be a fine man someday,"" then what in life is left to talk about? Everything else is less certain than sex. We may disagree about whether President Eisenhower was a good leader of men, a loyal husband and father, or a pious Christian; but if we cannot agree that President Eisenhower was a man, then speech itself is but sound and fury, signifying nothing....[When a transgender activist] says that she wants all people to feel ""safe"" and comfortable, regardless of their sexual identity. That is not true. What she wants is that ordinary people should feel uncomfortable. She wants to rob them of their ordinary perceptions. She sows the field of conversation with mines, glad if ordinary people learn to tiptoe around them, but much gladder still when they fail and blow themselves up, because that provides her with the opportunity for more ""education,"" which means a more aggressive campaign against our common grasp of objective reality and our ability to communicate with ease what we see...Ordinary people get many things wrong, but they are not motivated by hatred of reality. They are too ordinary for that: too happily bound to the order of things. They see boys playing baseball in a field, and it cheers them up. They see girls chatting on the porch as they paint pictures, and it cheers them up. They like reality. They like boys and girls, men and women. They can imagine wanting to tear down a building because it is useless or ugly or dangerous. They cannot imagine wanting to tear down a building because it is beautiful. They cannot imagine anyone else wanting to do such a thing, either.I am here to tell all such admirably ordinary people: broaden your imaginations. Do not dismiss the pronominal wars as nonsense. Do not assume that the warriors are merely daft. Do not mistake the pale horse and its rider for snowflakes or mittens or bunnies or anything else that is soft and inoffensive and trivial. The pale horse and its rider aim to destroy.The transgender-speak demand for gender-bending pronouns is already being imposed in K-12 schools, even in bathrooms and during science classes, by President Barack Obama's army of eager progressives. Unsurprisingly, that aggression is fueling an emotional pushback in K-12 schools, shops and universities, and in North Carolina's gubernatorial race.Read the complete article here. This link offers another article about transgender advocacy.To read Breitbart's articles about the transgender ideology, visit here.Now, sex is the first thing we notice about someone, and the last thing we forget. It's easy to see why this should be so. It cannot possibly be to any living thing's advantage to be confused about male and female. As it is, sex is far more strongly marked upon the human body than it is upon the bodies of dogs or cats or horses or many of the species of birds. A man's face is not like a woman's face. A woman's voice is not like a man's voice, even when the woman is Greer Garson and the man is Frankie Valli. A man's shoulders do not look like a woman's shoulders, and a woman's hips do not look like a man's hips. Men and women differ down to their very hair, as anyone can perceive who looks at a woman's smooth chin or a man's bald pate.
Ordinary and healthy people love that it is so, and on those exceedingly rare occasions when you cannot determine someone's sex from a glance or from one moment on the telephone--and some people will go through their entire lives without a single such experience--we feel that it is strange and disconcerting, just as we would feel if we were in the presence of someone who was born without arms. We are not talking about a mere statistical norm here, but about what is paradigmatically human.
To pretend, therefore, that we do not know what we immediately and urgently perceive is to do violence at once to human nature, language, the possibility of a shared life, and the intellect's capacity to apprehend reality. If I cannot say, ""There is a man walking down the street,"" then it is hard to see how I can make any reliable judgment about anything at all that bears on human existence. If I cannot say, ""Joey is going to grow up to be a fine man someday,"" then what in life is left to talk about? Everything else is less certain than sex. We may disagree about whether President Eisenhower was a good leader of men, a loyal husband and father, or a pious Christian; but if we cannot agree that President Eisenhower was a man, then speech itself is but sound and fury, signifying nothing....
[When a transgender activist] says that she wants all people to feel ""safe"" and comfortable, regardless of their sexual identity. That is not true. What she wants is that ordinary people should feel uncomfortable. She wants to rob them of their ordinary perceptions. She sows the field of conversation with mines, glad if ordinary people learn to tiptoe around them, but much gladder still when they fail and blow themselves up, because that provides her with the opportunity for more ""education,"" which means a more aggressive campaign against our common grasp of objective reality and our ability to communicate with ease what we see...
var _ndnq = _ndnq || []; _ndnq.push([""embed""]);Ordinary people get many things wrong, but they are not motivated by hatred of reality. They are too ordinary for that: too happily bound to the order of things. They see boys playing baseball in a field, and it cheers them up. They see girls chatting on the porch as they paint pictures, and it cheers them up. They like reality. They like boys and girls, men and women. They can imagine wanting to tear down a building because it is useless or ugly or dangerous. They cannot imagine wanting to tear down a building because it is beautiful. They cannot imagine anyone else wanting to do such a thing, either.
I am here to tell all such admirably ordinary people: broaden your imaginations. Do not dismiss the pronominal wars as nonsense. Do not assume that the warriors are merely daft. Do not mistake the pale horse and its rider for snowflakes or mittens or bunnies or anything else that is soft and inoffensive and trivial. The pale horse and its rider aim to destroy.SIGN UP"	[]	[]
20	20	http://www.breitbart.com/2016-presidential-race/2016/10/14/hillary-campaign-we-will-make-the-election-a-supreme-court-war-over-obamacare/	Hillary Campaign: We Will Make the Election a Supreme Court War Over Obamacare	"WASHINGTON, D.C. -- Hillary Clinton's campaign made it perfectly clear that this entire election is a big battle over the Supreme Court and Obamacare, according to the Wikileaks' dump of John Podesta's emails.SIGN UP FOR OUR NEWSLETTERHillary Clinton friend and informal adviser Neera Tanden wrote to campaign colleagues about ""King v. Burwell,"" the big case about whether or not Obamacare is constitutional, which progressives were concerned about.The Hillary Clinton campaign took its cue from Tanden, the president of the left-wing Center for American Progress. Here's part of an email that Tanden sent to top Clinton campaign officials and former State Department officials:oops!I mentioned this to John some time back, but think it's a bit more current now.  It is most likely that this decision has already been made by the Court, but on the off chance that history is repeating itself, then it's possible they are still deciding (last time, seems like Roberts went from striking the mandate to supporting it in the weeks before). As Jennifer will remember, it was pretty critical that the President threw the gauntlet down last time on the Court, warning them in the first case that it would politicize the role of the Court for them to rule against the ACA. As a close reader of the case, I honestly believe that was vital to scaring Roberts off. In this case, I'm not arguing that Hillary spend a lot of time attacking the Court. I do think it would be very helpful to all of our interest in a decision affirming the law, for Roberts and perhaps Kennedy to see negative political consequences to ruling against the government. Therefore, I think it would be helpful to have a story of how progressives and Hillary would make the Supreme Court an election issue (which would be a ready argument for liberals) if the Court rules against the government. It's not that you wish that happens. But that would be the necessary consequence of a negative decision...the Court itself would become a hugely important political issue. At CAP Action, we can get that story started. But kinda rests on you guys to make it stick. What do you think? If you want to proceed, we should move soon. Let me know thoughts. And I'm happy to discuss.Neera""I'm into it but defer to Jen on this one,"" said Jake Sullivan, the apparent subordinate of Jen Palmieri.""And to clarify, the candidate wouldn't have to do anything. I think we could move the story with just a nod from the campaign on the strategy,"" Tanden said.""Adding Brian Fallon and Christina,"" Palmieri said. ""She has already been making this an issue. Not sure how in depth you are suggesting but seems like this should be manageable.""""I will talk to our team. But my thought is you guys could even just affirm on background or something. I haven't seen what she's said so maybe we have enough to work with on that,"" Tanden said.""Neera, I can give folks the nod if you want to direct whoever you guys pitch to me,"" said Brian Fallon, swooping in to save the day.""Great will report back later today or tomorrow,"" Nanden said.Jen Palmieri has infamously struggled with her ability to control the campaign's messaging. Breitbart News reported:At November's Democratic debate in Des Moines, Clinton said that taking Wall Street cash after 9/11 was ""a way to rebuke the terrorists"" because Wall Street, located in Clinton's adoptive state of New York, was targeted by Osama bin Laden.In the Spin Room after that debate, Clinton surrogate Rep. Sheila Jackson-Lee continued to use the 9/11 talking point as Clinton communications director Jen Palmieri tried to stop it.""I'm glad you brought this up. She did not use it as a justification for Wall Street donations,"" Palmieri told Breitbart News, denying that the campaign has a 9/11 talking point.""Sounds like maybe I need to,"" Palmieri said when asked if she would try to rein in surrogates like Jackson-Lee who were using the talking point. ""I wasn't aware of that.""oops!
I mentioned this to John some time back, but think it's a bit more current now.  It is most likely that this decision has already been made by the Court, but on the off chance that history is repeating itself, then it's possible they are still deciding (last time, seems like Roberts went from striking the mandate to supporting it in the weeks before). As Jennifer will remember, it was pretty critical that the President threw the gauntlet down last time on the Court, warning them in the first case that it would politicize the role of the Court for them to rule against the ACA. As a close reader of the case, I honestly believe that was vital to scaring Roberts off. In this case, I'm not arguing that Hillary spend a lot of time attacking the Court. I do think it would be very helpful to all of our interest in a decision affirming the law, for Roberts and perhaps Kennedy to see negative political consequences to ruling against the government. Therefore, I think it would be helpful to have a story of how progressives and Hillary would make the Supreme Court an election issue (which would be a ready argument for liberals) if the Court rules against the government. It's not that you wish that happens. But that would be the necessary consequence of a negative decision...the Court itself would become a hugely important political issue. At CAP Action, we can get that story started. But kinda rests on you guys to make it stick. What do you think? If you want to proceed, we should move soon. Let me know thoughts. And I'm happy to discuss.
NeeraAt November's Democratic debate in Des Moines, Clinton said that taking Wall Street cash after 9/11 was ""a way to rebuke the terrorists"" because Wall Street, located in Clinton's adoptive state of New York, was targeted by Osama bin Laden.
In the Spin Room after that debate, Clinton surrogate Rep. Sheila Jackson-Lee continued to use the 9/11 talking point as Clinton communications director Jen Palmieri tried to stop it.
""I'm glad you brought this up. She did not use it as a justification for Wall Street donations,"" Palmieri told Breitbart News, denying that the campaign has a 9/11 talking point.
""Sounds like maybe I need to,"" Palmieri said when asked if she would try to rein in surrogates like Jackson-Lee who were using the talking point. ""I wasn't aware of that.""SIGN UP"	['Roberts', 'Clinton', 'Kennedy']	[]
21	21	http://www.breitbart.com/2016-presidential-race/2016/10/14/hill-clinton-campaign-fears-trumps-scorched-earth-strategy/	The Hill: Clinton Campaign Fears Trump’s  ‘Scorched Earth’ Strategy	"SIGN UP FOR OUR NEWSLETTERAmie Parnes writes at The Hill:The scorched-earth playbook employed by Donald Trump's presidential campaign is stirring alarm among allies of Hillary Clinton, with some fearing the negativity will depress turnout on Election Day.Some Clinton supporters say they're concerned that voters are nearly fed up with the constant accusations and name-calling that has defined the campaign.""Of course there's reason to worry, both about the 'turn off' effect or the impact if polling continues to show her leading by a wide margin,"" one longtime Clinton adviser acknowledged on Thursday. ""That, too, could lead some to stay home.""The hostile atmosphere in the race has been worsening by the day.In the past 48 hours, several women have come forward to accuse Trump of sexual misconduct following reports of a tape in which the Republican nominee talks about grabbing women by the genitals. Protestors have been interrupting Clinton to accuse her husband of rape, after Trump brought women who have accused former President Bill Clinton of sexual misconduct to the second debate.Trump is increasingly warning of a ""conspiracy"" that he says is being waged against him by the Republican Party, corporate interests and the mainstream media. And amid the chaos, there's been a slow drip of emails from WikiLeaks that appear to detail the inner workings of the Hillary Clinton campaign.You can read the rest of the story here.The scorched-earth playbook employed by Donald Trump's presidential campaign is stirring alarm among allies of Hillary Clinton, with some fearing the negativity will depress turnout on Election Day.
Some Clinton supporters say they're concerned that voters are nearly fed up with the constant accusations and name-calling that has defined the campaign.
""Of course there's reason to worry, both about the 'turn off' effect or the impact if polling continues to show her leading by a wide margin,"" one longtime Clinton adviser acknowledged on Thursday. ""That, too, could lead some to stay home.""
The hostile atmosphere in the race has been worsening by the day.
In the past 48 hours, several women have come forward to accuse Trump of sexual misconduct following reports of a tape in which the Republican nominee talks about grabbing women by the genitals. Protestors have been interrupting Clinton to accuse her husband of rape, after Trump brought women who have accused former President Bill Clinton of sexual misconduct to the second debate.
Trump is increasingly warning of a ""conspiracy"" that he says is being waged against him by the Republican Party, corporate interests and the mainstream media. And amid the chaos, there's been a slow drip of emails from WikiLeaks that appear to detail the inner workings of the Hillary Clinton campaign.SIGN UPDonald TrumpHillary ClintonBill Clinton"	['Clinton', 'Trump']	[]
22	22	http://www.breitbart.com/2016-presidential-race/2016/10/14/trump-takes-apart-faulty-teleprompters-on-stage-at-north-carolina-rally/	Donald Trump Dismantles Faulty Teleprompters at North Carolina Rally	"GOP nominee Donald Trump took apart malfunctioning teleprompters at a rally in Charlotte, N.C., and turned the scene into a demonstration of his promised ability to make government less costly.SIGN UP FOR OUR NEWSLETTER""Many people in this room are making less money than 20 years ago, 18 years ago, 25 years ago, in real wages,"" he told the cheering crowd. ""They're working harder--so am I, so I don't feel so guilty about that,"" he joked. ""This is good work, because we're getting to a position where we can win North Carolina, and we're leading in Ohio ... And we're doing great in Florida, doing great. We are doing so great in Florida.""""By the way, these teleprompters haven't been working for the last 20 minutes,"" he said. ""And I actually like my speech better without teleprompters. And this way, what I like about it--wait a minute, let me see how this..."" he trailed off and appeared to pull one off its stand.""You know what? I like it better without the teleprompter,"" he said. ""And I notice, every time I look up, they're trying, it's straining, it's straining,"" he said. ""Hey! Get this thing out of here, will you? Get it out. I like it much better without the teleprompter.""""You know, it's very funny. I went through 17 professional politicians, top people, and I went without any teleprompters,"" he continued. ""Then, all of a sudden. they said: 'Well, now you are running in the election, you need teleprompters,' And I like teleprompters, they are fine, but it's sort of cooler without it. Right?"" he said as his supporters cheered.""And it's a little strange with this glass,"" he said, gesturing towards the teleprompters. ""I watch Hillary and she's got the biggest pieces of glass. They're painted black on the other side because you see better. And she always just reads off the teleprompter. And it's short, and then she goes home and goes to sleep.""She's not, she's not going to campaign anymore until after [the debate], because she's 'prepping for the debate.' Now, the last time she prepped for a week also, let's face it, I have to say, I really beat her easily. That was an easy one.""Trump then walked to the other side of the stage and unscrewed the glass top of the remaining teleprompter. He smiled at the crowd, walked back to the podium, and held the glass up to his face before setting it on the ground.""So here's the story--here's the way government works, Trump said. ""So the telemprompter is a bummer. It doesn't work. That means the company doing the telepromompter is in the back. That means they didn't do a good job. So I won't pay them. I won't pay them.""""And tomorrow, I'll have a story in the newspaper: 'Donald Trump did not pay a contractor who put up the teleprompters,'"" he said in a mocking, pompous voice. ""Well, why should I? They don't work! And they'll make me [out] like a bad guy, like I'm a bad person, right?""""But when you have a bum contractor--now here's the thing. You have a bad contractor, don't pay or cut the price. If you have a good contractor, get that money out fast. But the country should do the same thing.""SIGN UP"	['Trump']	[]
