	Link	Title	Text
0	http://www.breitbart.com/big-government/2016/11/11/harry-reids-disgraceful-exit-national-stage-white-nationalists-vladimir-putin-isis-celebrating-donald-trumps-victory/	Harry Reid Counters Call For Unity: ‘Trump Has Emboldened The Forces of Hate and Bigotry’	"In a statement addressing the ""election of Donald Trump,"" retiring Senate Minority Leader Harry Reid (D-NV) calls on President-elect Trump to ""roll back the tide of hate he unleashed.""SIGN UP FOR OUR NEWSLETTER""I have personally been on the ballot in Nevada for 26 elections and I have never seen anything like the reaction to the election completed last Tuesday,"" Reid begins. ""The election of Donald Trump has emboldened the forces of hate and bigotry in America."" Reid's comments come as anti-Trump riots have broken out across the nation and as other leading Democrats including President Obama and former Secretary of State Hillary Clinton have called for unity.Reid claims that white nationalists, Vladimir Putin, and ISIS are celebrating Trump's win while many Americans are afraid.White nationalists, Vladimir Putin and ISIS are celebrating Donald Trump's victory, while innocent, law-abiding Americans are wracked with fear - especially African Americans, Hispanic Americans, Muslim Americans, LGBT Americans and Asian Americans. Watching white nationalists celebrate while innocent Americans cry tears of fear does not feel like America.In the statement Reid lists segments of America that are ""fearful"" after Donald Trump's victory on Tuesday.I have heard more stories in the past 48 hours of Americans living in fear of their own government and their fellow Americans than I can remember hearing in five decades in politics. Hispanic Americans who fear their families will be torn apart, African Americans being heckled on the street, Muslim Americans afraid to wear a headscarf, gay and lesbian couples having slurs hurled at them and feeling afraid to walk down the street holding hands. American children waking up in the middle of the night crying, terrified that Trump will take their parents away. Young girls unable to understand why a man who brags about sexually assaulting women has been elected president.Reid finishes by setting his criteria for ""healing"" the divided nation by calling Donald Trump a ""sexual predator"" who ""fueled his campaign with bigotry and hate.""If Trump wants to roll back the tide of hate he unleashed, he has a tremendous amount of work to do and he must begin immediately.Reid is serving out his final months before retiring from his role as Senate Minority Leader and as Senator from Nevada in January.Dustin Stockton is a political reporter for Breitbart News, a community liaison for Gun Owners of America, and a political strategist. Follow him on Twitter @DustinStockton or Facebook.White nationalists, Vladimir Putin and ISIS are celebrating Donald Trump's victory, while innocent, law-abiding Americans are wracked with fear - especially African Americans, Hispanic Americans, Muslim Americans, LGBT Americans and Asian Americans. Watching white nationalists celebrate while innocent Americans cry tears of fear does not feel like America.I have heard more stories in the past 48 hours of Americans living in fear of their own government and their fellow Americans than I can remember hearing in five decades in politics. Hispanic Americans who fear their families will be torn apart, African Americans being heckled on the street, Muslim Americans afraid to wear a headscarf, gay and lesbian couples having slurs hurled at them and feeling afraid to walk down the street holding hands. American children waking up in the middle of the night crying, terrified that Trump will take their parents away. Young girls unable to understand why a man who brags about sexually assaulting women has been elected president.If Trump wants to roll back the tide of hate he unleashed, he has a tremendous amount of work to do and he must begin immediately.SIGN UP"
1	http://www.breitbart.com/big-government/2016/11/11/clinton-aide-huma-abedin-openly-weeping-streets-new-york/	Clinton Top Aide Huma Abedin Seen Openly Weeping on Streets of New York	After repeated body blows to her life over the last several months, Hillary Clinton's top aide, Huma Abedin, was seen openly weeping as she walked alone on the streets of Brooklyn in the days after Election Day.SIGN UP FOR OUR NEWSLETTERPhotos of Clinton's top aide were taken as she walked to the Clinton campaign office on Friday, three days after Secretary of State Clinton lost her second bid to become President of the United States, according to the Daily Mail.The images reveal Abedin with a sad countenance, a quivering lip, and at one point, she was seen pushing back her sunglasses, seemingly to wipe tears away.It would be no wonder with the vicious, but ultimately losing, campaign she helped lead. In a campaign marred by constant revelations of criminal activity by the candidate, repeated federal investigations, and a tough loss, Abedin herself also experienced constant personal crisis.At the end of October, news broke that Huma's husband, disgraced former New York Congressman Anthony Weiner, came under scrutiny for yet another illicit sexual relationship. But this time, Weiner, with whom Abedin has a child, was accused of sexually exploiting a minor. It was not long before authorities announced that charges would be filed against the former congressman.Then, just prior to the election, it was revealed that the FBI had found an additional cache of upwards to 650,000 new Hillary Clinton emails on the various electronic devices owned jointly by Abedin and Weiner. The discovery caused the FBI to re-open the investigation into Clinton's illicit emails only 11 days before Election Day, casting new light on Abedin and her role in the scandal.Worse for the long-time political aide, a dark cloud is still hanging over her life not only with the FBI investigation into her husband's sexual misconduct, but the ongoing investigation into her own actions connected with Clinton's illicit secret email server used during her tenure as Obama's secretary of state.By many accounts, Abedin lied to the FBI during a previous investigation into Clinton's violation of America's national security laws.Follow Warner Todd Huston on Twitter @warnerthuston or email the author at igcolonel@hotmail.com.SIGN UP
2	http://www.breitbart.com/big-government/2016/11/11/op-ed-dear-liberals-no-not-everyone-riots-election-losses-just/	OP-ED: Dear Liberals: Not Everyone Riots After Political Setbacks, Just You	"Dear liberals who are trying to dismiss the Clinton riots as an understandable expression of universal human nature: No, it's not universal. It's just you. There is no equivalent urge to large-scale political violence on the Right.SIGN UP FOR OUR NEWSLETTERLet's get the nomenclature out of the way right up front: they're not ""Trump riots."" They're Clinton/Obama riots. Hillary Clinton and Barack Obama could shut a great deal of the violence down by speaking out against it, with passion and without qualifications. Neither of them has done so, as of Friday.The media could help by demanding Clinton and Obama speak up, but aren't. They could punish both of them for indulging the rioters by staging Special Reports with dramatic music - America Under Siege, Day 3 - and hounding every Democrat official who passes before their cameras. You know damn well they would do both of those things, if these were Trump supporters misbehaving - or even peaceably demonstrating - after a Clinton victory.You also know there would be no significant effort to understand the rioters and their ""grievances"" if they were people of the Right. Celebrities would not be playing along by sharing their own feelings of frustrated rage. Major media outlets would not be pretending the riots were merely ""protests"" or ""demonstrations"" until the local police pointed at the burning wreckage and told them to knock it off.No, in that mirror universe where Hillary Clinton won the 2016 election, there would be absolutely zero tolerance for anyone who refused to instantly and completely accept the legitimacy of her election. Everything Donald Trump ever said about ""rigged elections"" and voter fraud would be playing on an endless loop. Those injured or vandalized by violent street theater would become national celebrities.But we know none of that would actually happen in the mirror universe, because the American Right doesn't hold violent demonstrations, much less outright riots. We know what right-wing demonstrations look like in modern America: Tea Party rallies that clean up their own garbage, haunted by a few creepy Democrat activists trying to stage false-flag incidents of violence or racism. The media has been resolutely ignoring titanic March for Life rallies in Washington D.C. for decades. They get away with it because the pro-lifers are resolutely well-behaved.Left-wingers own political violence for a number of reasons. One of the big ones is that left-wing media excuses it, and indulges Democratic political leaders who excuse it. The odious Senator Harry Reid (D-NV), for example, is currently trying to pin the riots on Trump, ""a sexual predator who lost the popular vote and fueled his campaign with bigotry and hate,"" while arguing that the fears of hyperventilating liberals is ""entirely rational, because Donald Trump has talked openly about doing terrible things to them.""This would not be tolerated for one single second by the media class if a Republican said it to excuse riots against the election of President Hillary Clinton. Reid would be chased off the national stage by a horde of shrieking reporters. And since he's the retiring former Majority Leader of the Senate, his entire party would be forced to renounce him in a series of Sunday-show Inquisitions.Another reason is that liberals seek total personal and spiritual fulfillment in politics. It is, for all intents and purposes, their religion. They think political positions are the only meaningful measure of personal character. Who cares if you drowned a girl in your car, and spent your life perpetrating one documented instance of degrading lechery after another, if you were good on ""women's issues?"" So what if you abused an intern for sex and assaulted a few women, if you did your bit to keep the abortion mills churning?  No big deal if you cruise out of office with Americans shedding blood on battlefields across the Middle East, as long as you came into office really hating that unilateralist warmongering cowboy Bush!The unseemly emotional meltdowns so many liberals are proudly posting online after the election - may of them using their own children as props - testify to how deeply liberals confuse personal identity with political posturing. They also believe in passion as a political force, which is one reason they work so hard to strip their political opponents of passionate arguments. Everything people who aren't liberals get excited about is pre-emptively nuked as racism, sexism, homophobia, xenophobia, nationalism, populism... you know the devil words.The Left is lashing out today because it just can't understand how Trump could win when they hate him SO much. They think the intensity of their opposition should give them some kind of election do-over.The Left has taken steps to render its followers childlike, and children only have two modes of expression: begging and screaming. Once upon a time, we thought universities were supposed to produce adults, but now they produce children - weaponized children accustomed to getting their way with campus protests. Tom Knighton at PJ Media chronicled some of the worst idiocies of the week: A Yale professor allowed students to skip their midterm exams to deal with election grief. The University of Kansas trotted out therapy dogs. Cornell held a cry-in. The University of Michigan gave the students Play-Doh and coloring books to work out their Trump grief.These children emerge into the adult world thinking speech codes, trigger words, and safe spaces still count for something. In other words, they think collectivist power is what matters, not individual achievement and responsibility.These aren't spontaneous riots. The Left has machinery in place to produce street theater. Money changed hands to organize these post-election freak-outs. Teachers are indulging, sanctioning, or even leading protests, complete with profane chants. Only the Left can abuse public education this way, because they've owned it for decades. The Right has no equivalent system for churning out instant protest marches, especially involving other people's children. The violent rioters are emboldened by the narrative of coast-to-coast unrest; they see themselves as the tip of the spear.One last thing to remember about left-wing political violence: the audience for such theater is primarily left-wing too. The people who finance and organize these ugly demonstrations don't necessarily think they can intimidate normal Americans into satisfying their desires. The most horrendous demonstrations are held in cities ruled by Democrats for generations, after all. Those watching from afar are mostly grinding their teeth and thinking their decision to vote for the law-and-order guy in 2016 looks pretty good right now.No, the intended audience is the Left and its organs: the mainstream media and the administrative state. These demonstrations are meant to build liberal unity, and give the organizers leverage with Democrat-dominated civic institutions. The targets of intimidation are center-left people wavering in their devotion to the Democrat Party. The masterminds behind the riots of the last few days are keenly aware that Donald Trump flipped blue states, and did very well with solidly Democratic constituencies. A little fire and broken glass might help those folks remember who they're supposed to vote for next time.Sure, there would have been some very upset people out there if Clinton had won, particularly if they thought vote fraud was involved. Some of them would have said very harsh things. But cities paralyzed by violent demonstrations, and mobs confronting riot police? For a good long while now, ""liberals,"" that's all been you. In fairly rapid succession, we had Occupy Wall Street, Black Lives Matter, and now this. Maybe it's time for you to think about why your ideology is so prone to violence.SIGN UP"
3	http://www.breitbart.com/2016-presidential-race/2016/11/11/arizonas-missing-election-results-prove-early-mail-voting-bad-idea/	Arizona’s Missing Election Results Prove Early and Mail-in Voting a Bad Idea	"While it's clear that Donald Trump will be the 45th president of the United States, it wasn't clear until Thursday that he carried Arizona. A quarter of Arizona's vote has not been counted a full day after the election because of mail-in voting, a fraud-prone practice that disserves the nation and should end.SIGN UP FOR OUR NEWSLETTERIt's not uncommon after Election Day to have a state or two where the result is not announced for three or so days after the polls close. Out of 50 states, a couple might be within a percentage point or even a fraction of a point, requiring a detailed count of lagging absentee ballots (often from military voters overseas where it can take longer to arrive and be counted), sometimes resulting in recounts or court challenges. (Think Bush v. Gore in 2000.)But as of Wednesday night, why had Arizona not been called? Donald Trump was leading Hillary Clinton by 4.3 percent--49.6 to 45.3. Multiple states with closer margins were called for either Trump or Clinton on election night.Arizona has not, because 24 hours after the polls had closed, fully 25 percent of the vote--one quarter of all votes cast in the Grand Canyon State--had not yet been counted.That's due to mail-in voting. Roughly half of the votes cast in Arizona--1.7 million--were filled out at home and mailed in before Election Day. Arizona was finally called for President-elect Trump on Thursday, but had the margin been closer, we might not have known until the weekend.The principal newspaper in Phoenix--the liberal-leaning Arizona Republic--lamented that since the election is over, knowing who carried Arizona this late in the game is just ""academic.""The process of mail-in voting is wrought with potential for fraud and abuse. No election worker actually witnesses a voter filling out their ballot; they arrive at election collection centers as over a million faceless envelopes, with signatures and other fake-able ""verification"" measures.Mail-in voting is also fraught with potential for voter intimidation. Groups can acquire lists of people who receive mail-in ballots. Until Arizona passed a law this year, anyone--including shady leftist groups--could send a team of three or four workers to ""help"" you vote, and then collect those ballots themselves. Nothing keeps them from standing over a voter in the living room while the ballot is filled out, or (if a person is not intimidated by the observers' presence and votes for a conservative Republican despite the pressure), after the ballot is ""collected,"" it could end up in the dumpster instead of the county's election office.The U.S. Court of Appeals for the Ninth Circuit held that this law is unconstitutional (over eloquent dissents by conservative judges), in a case that is still ongoing and faces an uncertain fate before the current Supreme Court.Another problem with mail-in voting is that it's often done as early voting. In Arizona, there's Election Month, not Election Day. Ballots go out and citizens can often vote before they've seen two of the three presidential debates, and also before the vice presidential debate.Campaigns are conversation with the candidates, during which time the nominees make their case to the voters, debate each other, respond to criticism, and investigators--including from the media, when they bother to do their job--uncover a lifetime of foibles and missteps (of which everyone has some).All this is laid before the voters, who have time to process the information, talk with each other, ask tough follow-up questions, and weigh the answers. At the end of that conversation and vetting, an informed electorate can choose the most powerful person in the world, as well as over 8,000 other elected offices at various levels of government.Except in states like Arizona, where fully one-third of early votes are cast by mail within 96 hours of those ballots showing up in mailboxes in early October. People are voting when this examination process is nowhere near complete.Think of all that was learned about both President-elect Trump and Secretary Clinton during that last month. Think also of the news developments, like the horrific premium increases in Obamacare. Voters have a right to know all that and contemplate what these revelations mean before choosing who will lead them.This is the ""rigged system"" the president-elect denounced during the campaign. The right to cast a vote is accompanied by a right not to have your lawful ballot canceled out or diluted by an illegal, fraudulent, or corrupted ballot.While there must always be absentee procedures for people who are not able to vote on Election Day, that should be the exception, not the rule. And the law should start the process as late as possible so that voters can learn through as much of the campaign as possible before casting their ballot.Along with laws requiring voter ID and proof of citizenship (because foreigners can get drivers licenses in every state, and even illegal aliens can get them in some states), these measures can provide much-needed reforms to ensure that every citizen's lawful vote is cast and counted.Fundamental election law reform is needed to safeguard the integrity of the ballot box and ensure an informed electorate. President Trump will have an opportunity to decide if he wants to tackle that issue to clean up future elections.Ken Klukowski is senior legal editor for Breitbart News. Follow him on Twitter @kenklukowski.SIGN UP"
4	http://www.breitbart.com/2016-presidential-race/2016/11/11/vice-president-elect-mike-pence-leads-transition-team/	Vice President-elect Mike Pence Leading Trump Administration Transition Team	"Vice President-elect Mike Pence is heading up President-elect Donald Trump's transition team, assembling a new administration after Trump's victory earlier this week.SIGN UP FOR OUR NEWSLETTERNew Jersey Gov. Chris Christie had been in charge of Trump's transition, but Pence is taking over and will be advised by members of Congress.Pence will serve as Chairman of the Presidential Transition Team, according to a press release on Friday. It adds:Dr. Ben Carson, New Jersey Governor Chris Christie, Former Speaker of the U.S. House of Representatives Newt Gingrich, Lieutenant General Michael Flynn, USA (Ret.), Former New York City Mayor Rudy Giuliani and U.S. Senator Jeff Sessions will join the team's Executive Committee as Vice Chairs.According to the press release, the following individuals will serve as leaders on the Presidential Transition Team Executive Committee:Congressman Lou Barletta
Congresswoman Marsha Blackburn
Florida Attorney General Pam Bondi
Congressman Chris Collins
Jared Kushner
Congressman Tom Marino
Rebekah Mercer
Steven Mnuchin
Congressman Devin Nunes
Anthony Scaramucci
Peter Thiel
Donald Trump Jr.
Eric Trump
Ivanka Trump
RNC Chairman Reince Priebus
Trump Campaign CEO Stephen K. Bannon""Together this outstanding group of advisors, led by Vice President-elect Mike Pence, will build on the initial work done under the leadership of New Jersey Gov. Chris Christie to help prepare a transformative government ready to lead from day one,"" stated President-elect Donald Trump, adding:The mission of our team will be clear: put together the most highly qualified group of successful leaders who will be able to implement our change agenda in Washington. Together, we will begin the urgent task of rebuilding this nation - specifically jobs, security and opportunity. This team is going to get to work immediately to Make America Great Again.Rick Dearborn will serve as the team's executive director. Dearborn previously served as Sen. Jeff Sessions (R-AL) chief of staff.Others joining Dearborn on the team are:Kellyanne Conway, Senior Advisor
David Bossie, Deputy Executive Director
Stephen Miller, National Policy Director
Jason Miller, Communications Director
Hope Hicks, National Press Secretary
Dan Scavino, Director of Social Media
Don McGahn, General Counsel
Katie Walsh, Senior AdvisorPence will continue to have his top senior advisers, Nick Ayers, Josh Pitcock, and Marc Short, work with him on this process.""President-elect Trump will bring about fundamental change in Washington, and these are the right people to make that happen,"" stated Vice President-elect Pence. ""This team of experienced leaders will form the building blocks of our Presidential Transition Team staff leadership roster, and will work with elected officials and tireless volunteers to prepare our government for the transfer of power on January 20th.""Dr. Ben Carson, New Jersey Governor Chris Christie, Former Speaker of the U.S. House of Representatives Newt Gingrich, Lieutenant General Michael Flynn, USA (Ret.), Former New York City Mayor Rudy Giuliani and U.S. Senator Jeff Sessions will join the team's Executive Committee as Vice Chairs.Congressman Lou Barletta
Congresswoman Marsha Blackburn
Florida Attorney General Pam Bondi
Congressman Chris Collins
Jared Kushner
Congressman Tom Marino
Rebekah Mercer
Steven Mnuchin
Congressman Devin Nunes
Anthony Scaramucci
Peter Thiel
Donald Trump Jr.
Eric Trump
Ivanka Trump
RNC Chairman Reince Priebus
Trump Campaign CEO Stephen K. BannonThe mission of our team will be clear: put together the most highly qualified group of successful leaders who will be able to implement our change agenda in Washington. Together, we will begin the urgent task of rebuilding this nation - specifically jobs, security and opportunity. This team is going to get to work immediately to Make America Great Again.Kellyanne Conway, Senior Advisor
David Bossie, Deputy Executive Director
Stephen Miller, National Policy Director
Jason Miller, Communications Director
Hope Hicks, National Press Secretary
Dan Scavino, Director of Social Media
Don McGahn, General Counsel
Katie Walsh, Senior AdvisorSIGN UP"
5	http://www.breitbart.com/2016-presidential-race/2016/11/11/report-trump-personally-calls-slain-nypd-officers-widow-offering-condolences/	Report: Trump Personally Calls Slain NYPD Officer’s Widow Offering Condolences	"President-elect Donald Trump offered condolences to the family of slain NYPD Sgt. Paul Tuozzolo on Thursday, speaking to the officer's widow.SIGN UP FOR OUR NEWSLETTER""I'm very sorry I cannot be there with you today. My thoughts and prayers are with you and your family during this difficult time,"" Trump said to Tuozzolo's wife, according to the New York Post. On Thursday, thousands of officers honored Tuozzolo at his funeral.""I want to express my condolences from me and my family,"" Trump reportedly stated.Tuozzolo had two children. He was shot and killed by a ex-con Manuel Rosales last week after responding to a break-in.""Thousands of cops gathered on Long Island on Thursday for Tuozzolo's funeral,"" reports the New York Post.SIGN UP"
