	Link	Title	Text
0	http://www.breitbart.com/2016-presidential-race/2016/11/13/kellyanne-conway-obama-clinton-calm-anti-trump-protesters/	Kellyanne Conway: Obama, Clinton Should Calm Down Anti-Trump Protesters	"Kellyanne Conway, President-elect Donald Trump's campaign manager, called upon President Barack Obama, Hillary Clinton, and other Democratic leaders to calm down their supporters who are protesting Trump and encourage a peaceful transition of power.SIGN UP FOR OUR NEWSLETTER""He is going to be a president that listens and takes the counsel of many different people, including those from the other side of the aisle,"" Conway told Chuck Todd on NBC's Meet the Press on Sunday. ""It's time really for President Obama and Secretary Clinton to say to these protesters, 'This man is our president.'""Clinton has already done so, urging her supporters to give him ""an open mind and a chance to lead.""""Donald Trump is going to be our president, we owe him an open mind and a chance to lead,"" Clinton admitted to her close aides and supporters.President Obama has said that he will work with President-elect Trump to make sure there is a smooth transition of power so that Trump's presidency is successful.Conway said to Chris Wallace on Fox News Sunday that paid, professional protesters were behind most of the anti-Trump protests across the country.When Wallace asked Conway what Trump would do to reach out to those scared to be under his presidency, Conway responded that Trump's victory speech was ""off to a great start"" in unifying the country.SIGN UP"
1	http://www.breitbart.com/big-government/2016/11/13/connecticut-police-arrest-two-men-brutally-assaulting-man-trump-sign/	Connecticut: Police Arrest Two for Brutally Assaulting Trump Supporter	"Police in Meriden, Connecticut arrested two men on Saturday, charging them with attacking a middle-aged man who was displaying a pro-Donald Trump sign in public.SIGN UP FOR OUR NEWSLETTERFrom WTNH.com:At noon on Saturday, a Meriden Lieutenant was parked on Hanover Street where he saw a man standing on the traffic island at Hanover and Colony Streets waving a Donald Trump sign and an American flag.Police say a silver car stopped at the island, two men got out and began punching and kicking the man, knocking him into the street. The Lieutenant intervened and arrested the two men. The victim told police that the two men gave him the finger, he responded ""same to you"" and then the assault started.The two men were identified as 32-year-old Wilson Echevarria and 36-year-old Anthony Hobdy, both of Meriden. Police say Hobdy had 54 bags of heroin packaged for sale on him at the time of the arrest and was wanted on four separate warrants.Read the rest of the story and watch the video report here.SIGN UP"
2	http://www.breitbart.com/2016-presidential-race/2016/11/13/michael-savage-warns-donald-trump-rinse-reince-priebus/	Michael Savage Warns Donald Trump: ‘Rinse’ Reince; He’s ‘Everything the Voters Rejected’	"President-elect Donald Trump should not select Republican National Committee Chairman Reince Priebus as his Chief of Staff, says Michael Savage, the national talk radio host and author of the new book Scorched Earth: Restoring the Country After Obama.SIGN UP FOR OUR NEWSLETTERPriebus is ""the enemy within,"" Savage warns.""He's the RNC! Everything the voters rejected,"" Savage tells Breitbart News. ""He will steer Trump away from every policy we sent him to D.C. to change. He is the enemy within. He is [Paul] Ryan, [Mitch] McConnell, and the Old Guard. They do not want change. 'Out with the old, in with the new.'""A close Ryan ally, Priebus was responsible for the GOP ""autopsy"" following the Romney-Ryan loss of 2012. One of its conclusions held that, to win elections, Republicans must embrace an immigration agenda that would import future voters who tend to overwhelmingly support Democrat policies. The Priebus manifesto argued against opposing amnesty and appealing to the Republican electorate's ""core constituency.""""We must embrace and champion comprehensive immigration reform. If we do not, our Party's appeal will continue to shrink to its core constituencies only,"" the Priebus report stated.By contrast, for years Savage has argued that Republican candidates should run campaigns on ""borders, language, and culture.""""I call him 'Rinse,'"" Savage said of Priebus, adding that's ""what Trump should do with his advice.""Savage's talk radio show, which is one of the most listened-to talk radio programs in the country, reaches an audience over 20 million listeners and is syndicated by over some 400 stations nationwide. This week, Savage will be inducted into the Radio Hall of Fame in the category of Spoken Word On-Air Personality.SIGN UP"
3	http://www.breitbart.com/big-government/2016/11/13/paul-ryan-no-deportations/	Paul Ryan: No Deportations	"Removing illegal immigrants will not be a ""focus"" of a Trump administration, says Republican House Speaker Paul Ryan, a longstanding supporter of open borders and cheap labor.SIGN UP FOR OUR NEWSLETTERLess than a week after President-elect Donald J. Trump's historic upset, Speaker Ryan is now telling voters that he will not enact a central part of Trump's ""mandate"" given to him by the American people: namely, Trump's repeated pledge to enforce U.S. immigration law and to allow Immigration and Customs Enforcement (ICE) to do its job by removing people in the country illegally.""We are not planning on erecting a deportation force. Donald Trump's not planning on that,"" Ryan told CNN's Jake Tapper on State of the Union.""I think we should put people's minds at ease: That is not what our focus is. That is not what we're focused on. We're focused on securing the border. We think that's first and foremost, before we get into any other immigration issue, we've got to know who's coming and going into the country- we've got to secure the border,"" Ryan said.Yet, as Vice President-elect Mike Pence explained during the Vice Presidential debate the nation already has a ""deportation force"".""We have a deportation force. It is called Immigrations and Customs Enforcement,"" Pence said, and ""for the first time in their history, their union endorsed Donald Trump to be the next President of the United States.""Indeed, the ICE union backed Trump, in part, because he pledged that he would allow ICE to do its job and enforce U.S. immigration law.""We are going to triple the number of ICE deportation officers,"" Trump said during his Arizona immigration speech. ""Within ICE, I am going to create a new special Deportation Task Force, focused on identifying and removing quickly the most dangerous criminal illegal immigrants in America who have evaded justice.""Interestingly, while the National ICE Council endorsed Trump for President, the council's president has had strong words for Speaker Ryan in the past.""[A]s House Speaker, you have not spoken out about any of the issues confronting our officers or the threat to public safety presented by the lawless immigration policies of the Obama Administration... your office has not reached out to us in any way,"" the President of the ICE Council wrote in an August letter to Ryan.""Foreign nationals flood across the border because they have been led to believe that if they make it here, they can stay. I am sorry to say that your rhetoric could be adding to that perception,"" the ICE president wrote to Ryan. ""While specific members of Congress have been vocal in standing up for our officers and fighting to defend law and order, we have not felt that same support from the Speaker's office.""""ICE officers have... been disturbed to hear some of the recent comments made by the Republican House Speaker,"" the ICE Council President added. ""Your 2015 spending bill funded sanctuary cities, the resettlement of illegal alien border crossers, the release of criminal aliens and executive amnesty--policies which jeopardize the safety and security of the American people.""While reports have documented that the border surge is currently the worst it's ever been, the ICE Council president said that as House Speaker, Ryan has pushed policies that would only ""exacerbate the situation"":In the nine months that you have served as House Speaker, I am not aware of you holding a single press conference devoted exclusively to addressing this national crisis. Indeed, we were disheartened to learn that instead, the House Speaker intends to push and fund policies, which we believe would only exacerbate the situation.In the letter, the National ICE Council demanded a meeting with Speaker Ryan. Yet Ryan never responded and never met with the council's president.By contrast, Donald Trump reached out and met with the nation's ICE officers to discuss how to keep America safe.""It was extremely clear that this guy is on law enforcement's side,"" said the nation's ICE Council president said after the meeting in August.  ""[Trump] made no bones about it--he wants the rule of law followed in our country, and he wants to make America safe... He made clear he's on the side of law and order, and is on the side of the American public.""Similarly, when grieving mothers, who were forced to bury their loved ones as a result of illegal alien crime, tried to meet with Ryan, the Speaker of the House literally fled from them.Ryan ""doesn't care [about our families] one bit,"" said Laura Wilkerson, whose 18-year-old son was tied up, beaten, strangled, set on fire, and tortured to death by his illegal alien classmate.By contrast, Trump met with these families and said, ""of all my travels in this country, nothing has affected me more deeply than the time I have spent with the mothers and fathers who have lost their children to violence spilling across our border.""These mothers and fathers have said that Donald Trump was the first presidential candidate to ever make them ""feel heard"".""Paul Ryan is personally responsible for the deaths, maimings, and sexual assaults of thousands of innocent Americans and lawful residents,"" the grieving angel moms wrote in August.""Paul Ryan has never shown one millionth the passion in defense of our families as he has spent advocating for policies that would result in the deaths of more Americans... [He] has the blood of so many on his hands--blacks, whites, Asians, Hispanics, immigrants, and children of immigrants... If Ryan's considerable powers had been marshaled, in any serious degree, towards advocating for our families, demanding change for our families, or insisting upon justice for our families, then so many more families just like us would have been saved. For all of these reasons and more, we deem Ryan disqualified from serving in Congress or any other position of public office that is supposed to represent the American people.""Throughout the campaign, Ryan repeatedly made statements that seemed designed to undermine Trump's candidacy. Now that Trump has won, Ryan's comments seem to underscore conservatives' concerns that Ryan as House Speaker will not only refuse to help Trump enact the mandate given to him by the American people, but he will also work to actively undermine that mandate- for instance, by not making enforcing U.S. immigration law a ""focus"" of a Trump administration.As Ed Martin, Phyllis Schlafly's hand-picked successor and president of her Eagle Forum Education and Legal Defense Fund, told Breitbart News:On Tuesday, November 8, the American voters showed conclusively that Paul Ryan is not the leader for this moment in our history.  The message is clear: Ryan's judgment was rejected! [...] Now is the time to move forward on the Trump agenda, not back to the failed Ryan policies. [...] Paul Ryan should yield to a new Republican leader whose policy positions and political judgment are in line with the Trump Republican Party.It is unclear whether members of the House Freedom Caucus and conservative lawmakers--including Jim Jordan, Mark Meadows, Jeff Duncan, Jim Bridenstine, Mo Brooks, Brian Babin, Steve King, Matt Salmon, Alex Mooney, Gary Palmer, Barry Loudermilk, John Fleming and others--who voted for Ryan last year will vote to elect him again as House Speaker.According to Pew polling data, Paul Ryan's expansionist agenda on immigration stands opposed to more than 9 in 10 GOP voters.Republican lawmakers are set to hold leadership elections this coming Tuesday, November 15.In the nine months that you have served as House Speaker, I am not aware of you holding a single press conference devoted exclusively to addressing this national crisis. Indeed, we were disheartened to learn that instead, the House Speaker intends to push and fund policies, which we believe would only exacerbate the situation.""Paul Ryan has never shown one millionth the passion in defense of our families as he has spent advocating for policies that would result in the deaths of more Americans... [He] has the blood of so many on his hands--blacks, whites, Asians, Hispanics, immigrants, and children of immigrants... If Ryan's considerable powers had been marshaled, in any serious degree, towards advocating for our families, demanding change for our families, or insisting upon justice for our families, then so many more families just like us would have been saved. For all of these reasons and more, we deem Ryan disqualified from serving in Congress or any other position of public office that is supposed to represent the American people.""On Tuesday, November 8, the American voters showed conclusively that Paul Ryan is not the leader for this moment in our history.  The message is clear: Ryan's judgment was rejected! [...] Now is the time to move forward on the Trump agenda, not back to the failed Ryan policies. [...] Paul Ryan should yield to a new Republican leader whose policy positions and political judgment are in line with the Trump Republican Party.SIGN UP"
4	http://www.breitbart.com/big-government/2016/11/13/portland-authorities-night-five-of-violent-leftist-protests-20-arrested-news-crew-attacked/	Portland Authorities – Night Five of Violent Leftist Protests: 20 Arrested, News Crew Attacked	"PORTLAND, OREGON-Police arrested more than 20 people in the fifth consecutive day of rioting and clashes with police by mobs of leftist protesters who say they are furious about the election of Donald J. Trump as the 45th President of the United States.SIGN UP FOR OUR NEWSLETTERThe revolutionaries hurled bricks and rocks at police and fought with a news crews in the latest street battle during an hours-long standoff that began shortly before 7 p.m. local time. Police were surrounded and taunted by hundreds of protesters shouting ""Fuck Donald Trump"" and chanting leftist slogans such as ""the people united will never be divided.""The rioters came even after Portland Police and Mayor Charlie Hales pleaded for calm at a press conference Saturday afternoon and protest organizers announced that they had no events planned for that evening.At the Saturday's presser-the second in as many days-Mayor Hales said ""I'm really heartsick that our local small businesses who had no culpability in what happened in this election, far from it, have been harmed by people that just wanted to exploit the protest to raise hell.""Hales' and other local authorities' statements that ""peaceful protests"" are being marred by a few fringe players stands in stark contrast to the protest organizers' refusal to rule out the use of a 'diversity of tactics,"" a term that leftist protesters use to describe a spectrum of action from peaceful protests to outright violence.Exclusive footage from Breitbart News shows an example of a fight over a ""diversity of tactics"" maneuver as one masked anarchist attempts to block a street using a police barricade during Saturday night's fracas near Pioneer Square. Two other protesters attempt to stop him from barricading the street and are promptly told by yet another protester that they have no right to interfere.When anarchists fight.#portland #notmypresident #live pic.twitter.com/dSUWgyrbot-- Lee Stranahan (@stranahan) November 13, 2016As local TV Station KOIN reported on the comments of Portland Police Chief Mike Marshman, the Chief doesn't appear to recognize that many leftists view battling the police as a valid form of protest:""I don't think they're out there to protest. I think they're out there to battle the police,"" Marshman said. ""We're taking rocks and bottles and flares.""Law enforcement officers from other agencies in the metro area have been called in to help Portland Police. Marshman said they have limited resources at PPB and the long days take their toll on officers.""They were confronted with real provocation and they met it with appropriate force,"" Hales said. ""Yes they had to use distraction devices, yes they had to use tear gas -- those were the right things to do when they were having rocks and bottles thrown at them.""Protesters appear to be making a barricade with these fences. Watch live: https://t.co/8G8V71pDqo#PortlandProtest pic.twitter.com/eNhB0pc1rD-- KATU News (@KATUNews) November 13, 2016Tension continues to rise as a #Trump supporter argues with #notmypresident protesters #Portland pic.twitter.com/pvN9bYw1zw-- Cole Howard (@RedheadNomad) November 13, 2016Portland #notmypresident protest. Saturday. pic.twitter.com/5qii0OOnZR-- Leah Sottile (@Leah_Sottile) November 13, 2016I wasn't gonna mention it, but at the outset of the Pioneer Square march masked protesters warned me not to film them. #PortlandProtest-- Mike Bivins (@itsmikebivins) November 13, 2016Riot police literally marched away and protesters followed. Situation escalating. #PortlandProtest pic.twitter.com/XWzX4VHvif-- Mike Bivins (@itsmikebivins) November 13, 2016Police move on to 4th and Jefferson, drop flash bangs. #LiveOnK2 pic.twitter.com/i83dzTjHIc-- Ric Peavyhouse (@RPeavyhouse) November 13, 2016Police just cleared about 100 people out of Southwest Broadway with compression grenades and tear gas. pic.twitter.com/ht07q8Npuk-- Aaron Mesh (@AaronMesh) November 13, 2016Another pleasant evening in Portland. 19 arrests as of midnight & it sounds like the fun's only getting started #MAGA #Trump #notmypresident pic.twitter.com/UpdJ8SAOFV-- Red Cleaver (@RedCleaver) November 13, 2016One of the more interesting outfits seen on an arrestee tonight. #pikachu pic.twitter.com/U58m1LQhif-- Portland Police (@PortlandPolice) November 13, 2016Earlier Saturday, police also announced the arrest of two suspects for attempted murder after a man was shot on the Morrison Bridge during Friday night's protest in a crime authorities say is gang related.Post-election protests continued in other cities such as Los Angeles, New York and Indianapolis.This is a developing story...Follow Breitbart News investigative reporter and Citizen Journalism School founder Lee Stranahan on Twitter at @Stranahan.When anarchists fight.#portland #notmypresident #live pic.twitter.com/dSUWgyrbot
-- Lee Stranahan (@stranahan) November 13, 2016var _ndnq = _ndnq || []; _ndnq.push([""embed""]);""I don't think they're out there to protest. I think they're out there to battle the police,"" Marshman said. ""We're taking rocks and bottles and flares.""
Law enforcement officers from other agencies in the metro area have been called in to help Portland Police. Marshman said they have limited resources at PPB and the long days take their toll on officers.
""They were confronted with real provocation and they met it with appropriate force,"" Hales said. ""Yes they had to use distraction devices, yes they had to use tear gas -- those were the right things to do when they were having rocks and bottles thrown at them.""Protesters appear to be making a barricade with these fences. Watch live: https://t.co/8G8V71pDqo#PortlandProtest pic.twitter.com/eNhB0pc1rD
-- KATU News (@KATUNews) November 13, 2016Tension continues to rise as a #Trump supporter argues with #notmypresident protesters #Portland pic.twitter.com/pvN9bYw1zw
-- Cole Howard (@RedheadNomad) November 13, 2016Portland #notmypresident protest. Saturday. pic.twitter.com/5qii0OOnZR
-- Leah Sottile (@Leah_Sottile) November 13, 2016I wasn't gonna mention it, but at the outset of the Pioneer Square march masked protesters warned me not to film them. #PortlandProtest
-- Mike Bivins (@itsmikebivins) November 13, 2016Riot police literally marched away and protesters followed. Situation escalating. #PortlandProtest pic.twitter.com/XWzX4VHvif
-- Mike Bivins (@itsmikebivins) November 13, 2016Police move on to 4th and Jefferson, drop flash bangs. #LiveOnK2 pic.twitter.com/i83dzTjHIc
-- Ric Peavyhouse (@RPeavyhouse) November 13, 2016Police just cleared about 100 people out of Southwest Broadway with compression grenades and tear gas. pic.twitter.com/ht07q8Npuk
-- Aaron Mesh (@AaronMesh) November 13, 2016Another pleasant evening in Portland. 19 arrests as of midnight & it sounds like the fun's only getting started #MAGA #Trump #notmypresident pic.twitter.com/UpdJ8SAOFV
-- Red Cleaver (@RedCleaver) November 13, 2016One of the more interesting outfits seen on an arrestee tonight. #pikachu pic.twitter.com/U58m1LQhif
-- Portland Police (@PortlandPolice) November 13, 2016SIGN UPHales' and other local authorities' statements that ""peaceful protests"" are being marred by a few fringe players stands in stark contrast to the protest organizers' refusal to rule out the use of a 'diversity of tactics,"" a term that leftist protesters use to describe a spectrum of action from peaceful protests to outright violence."
