	Unnamed: 0	Link	Title	Text	Terms	Topics
8	8	http://www.breitbart.com/2016-presidential-race/2016/10/15/republican-party-leaders-plot-purge-civil-war/	Republican Party Leaders Plot Purge, Civil War	"Just when you think Republican Party leaders can't possibly get more cynical, more hypocritical or more suicidal, they surprise you.SIGN UP FOR OUR NEWSLETTEROver the past week, a few dozen prominent Republicans, led by 2008 Republican presidential nominee John McCain and joined by Utah's Senator Mike Lee and Colorado's Cory Gardner, dropped their support for Donald Trump and called on Republican voters to vote for other, ""down ticket"" candidates but not Trump.The New York Times on October 9 published a list of ""160 Republican Leaders who do not support Trump,"" and newspapers everywhere trumpeted the newest addition to the list.That chorus was joined briefly by House Speaker Paul Ryan, who said he would vote for Trump but would not campaign for him or with him. Ryan also advised the entire Republican congressional delegation to do the same.This betrayal of the party's presidential nominee by top echelons of party leadership can only be called overt sabotage. Whether successful or not in denying Trump a victory on November 8, it undoubtedly is the opening shot in a civil war that will erupt full scale on November 9.The attempted take down of Trump was explained as an effort to ""salvage the dignity of the party"" in the aftermath of the public release of a recording of lewd remarks about some women made by Trump in 2005. When asked if the recording revealed anything about Donald Trump they did not know before, they had no answer. It is clear that the party leaders who have jumped ship are using the 2005 video recording as the excuse to do something they had been contemplating since Trump won the party nomination in July.No one citing the recording as an excuse for opposing Trump can say Trump's lewd remarks are more offensive than the known sexual conduct of former President Bill Clinton -- and many other White House occupants. Lewd and crude language is not exactly unknown in the halls of the West Wing, the Rayburn Building, RNC headquarters -- or Fox television sound stages.Are the American people turning against Donald Trump because of remarks he made in private eleven years ago? No. Might they turn against him if every Republican senator and congressman attacked him for those remarks? Yes, quite possibly. In that case, what would be the cause of the defeat, Trump's remarks or the party establishment's treason?The answer lies in looking at the facts, not Glenn Beck's self-indulgent rants. The latest Rasmussen poll shows that 69 percent of voters think Trump's attitude and remarks about women are either no worse or the same as Bill Clinton's, and only 23 percent think they are worse. That is a 3-to-1 margin saying it is not an important issue for the large majority of voters.So, if moral Puritanism is not a credible explanation for he organized insurrection against the party's presidential nominee, what is the explanation? Why this open declaration of war on the millions of voters who selected Trump as the party's candidate? The actions of Paul Ryan, McCain and the other party bigwigs only make sense if it is a signal of a planned purge of Trump supporters by the US Chamber of Commerce globalists.The hypocrisy of the Republican establishment's attempted take down of the Trump campaign is astonishing even by 2016 standards. After insisting that candidate Trump take the pledge to support the eventual nominee, many refused to accept the verdict of the presidential nomination process. It took months for Senator Cruz to endorse Trump, and Ohio's Gov. Kasich is still silent.The other element of hypocrisy is the fear of a Trump victory.After arguing for a full year that Trump couldn't possibly win and would lead the party to a catastrophic defeat, many of the same Republican leaders saw Trump steadily gaining ground on Hillary Clinton and decided a Trump victory would be even more catastrophic than a defeat. Immigration enforcement, an America First foreign policy, and sensible international trade treaties must not be allowed to prevail over globalist ambitions of the party establishment. Trump had to be stopped.That is why the sabotage did not occur earlier. Trump is only a mortal danger to the establishment if he has a chance of winning. As long as he was losing badly in the polls, the saboteurs could remain silent. But after mid-September when polls started showing Trump in a virtual tie with Clinton and gaining ground in all the ""battleground states,"" the knives were out. Why do you think the 2005 video was released when it was, when the liberal media certainly had it for months?It is beyond question that the Republican establishment fears a Trump victory more than a Trump defeat. They are more comfortable with Hillary Clinton in the White House than Trump. Only people who have been living on another planet for the last 18 months believe that Washington insiders are opposed to Trump because of his crude language or alleged chauvinistic attitudes toward women.So the Republican civil war is under way. Whether Trump wins or loses, the party establishment will use every weapon in its arsenal to purge the party not only of Trump's policy ideas but Trump's followers as well.On November 9, the order of the day will be -- business-as-usual. The party establishment and its allies in the Chamber of Commerce and the media will be working overtime to guarantee there will be no recognition or acknowledgement of the patriotic rebellion against the ""go along to get along"" mentality of Republican lawmakers that fueled first the Tea party revolt in 2009-2010 and then the Trump bandwagon.What the Republican establishment does not understand or will not accept is that Donald Trump is only the symptom, not the cause, of the grassroots rebellion against establishment thinking. Donald Trump gave voice to those concerns, those very justified concerns, about our nation's direction and our nation's very survival.Donald Trump the man and Trump the candidate has flaws and warts and weaknesses that were understandably exploited by opponents. But win or lose on November 8, the grassroots rebellion that fueled the Trump campaign will continue.That rebellion is now an open civil war within the Republican party, and that is a shame. But at least it is a war over real issues, real concerns, and real worries over the safety and survival of our nation. And that, my friends, will always be a war worth fighting.SIGN UP"	['Clinton', 'Trump', 'McCain', 'Cruz', 'Kasich', 'Paul']	[]
9	9	http://www.breitbart.com/jerusalem/2016/10/15/palestinian-official-discussing-un-action-obama-administration/	EXCLUSIVE – Palestinian Official: We’re Discussing UN Action With Obama Administration	"JAFFA, Israel - The Palestinian Authority has deepened its contacts with the U.S. in order to test the possibility that President Barack Obama may propose a UN Security Council decision regarding the Israeli-Palestinian conflict, a senior Palestinian official told Breitbart Jerusalem.SIGN UP FOR OUR NEWSLETTERThe source said that the diplomatic initiative was taken after Israel decided to build 98 new housing units in the West Bank, which drew unusually sharp condemnation from the U.S.The Palestinians decided to pressure the Americans once again to propose a political process that would be adopted by the Security Council and require Israel to enter into negotiations with a clear timetable.This is not the first time that the Palestinians have tried to convince the Obama administration to support such a move. Two months ago, the Palestinians tried to sway Obama to begin the process immediately after the presidential elections in November, but their attempts have yet to yield any results.""At a moment when Israel's plan for new construction has seriously disappointed the government, which warned that Israel is doing everything to harm American interests in the region, we hope that the U.S. will lead this process,"" said the source. ""The European Union and Russia will support it along with other countries. This is a rare window of opportunity in which the entire international community can be recruited to a process that will aim at putting an end to the Israeli occupation.""According to the source, as part of the intensified contacts in the last few days, the Palestinians attempted to determine whether the U.S. might adopt the so-called French peace initiative or attempt to create a consensus in favor of a new process that would be a mix between the Arab and French efforts.""We are doing all we can, together with our friends in the government and with our partners in the EU, to convince the U.S. to begin this process,"" said the source. ""Our feeling is that the U.S. has warmed up a lot to this proposal, especially after the military aid package with Israel, but we can't say with certainty that the president will contribute to the process.""SIGN UP"	['Israel', 'Obama']	[]
10	10	http://www.breitbart.com/big-government/2016/10/15/two-suspected-isis-recruits-traveling-mexico-busted-texas/	Two Suspected ISIS Recruits Traveling to Mexico Busted in Texas	"Two Wisconsin men have been arrested in San Angelo, Texas, on charges of providing material support to ISIS. The men were traveling to Mexico and allegedly had plans to travel on to Iraq or Syria.SIGN UP FOR OUR NEWSLETTERJason Michael Ludke, 35, of Milwaukee, Wisconsin, and Yosvany Padilla-Conde, 30, an illegal alien who has been living in Wisconsin, were arrested on October 5 by Tom Green County Sheriff David Jones and a team of federal agents, according to Joe Hyde, president of San Angelo Live.Sheriff Jones told Hyde he had received a warning from the FBI and the Joint Terrorism Task Force (JTTF) that the two suspected ISIS recruits could be heading through his county in route to Mexico. After surveilling the two men for a short time, deputies, Texas Department of Public Safety troopers, and FBI agents conducted a traffic stop and the two men were taken into custody.Sheriff Green stated Ludke was detained on an outstanding warrant from Wisconsin. His traveling companion, Padilla-Conde, having been identified asn an illegal alien, was held on immigration charges.Information provided by the Department of Justice's Eastern District of Wisconsin stated the two men were traveling to Mexico after having pledged their allegiance to ISIS. Their ultimate goal was to travel to Iraq or Syria and join up with the terrorist organization.Ludke's activities were discovered by the FBI when he contacted an undercover agent on Facebook. He sent the agent a friend request. The agent was assigned to monitor social media and search for ISIS recruiting activities. Shortly after the initial contact, the agent began instant messaging conversations with the suspect and learned of his plans. He told the agent he ""wants to make ""hijra"" (or migration) away from ""darul kufr"" (Land of the Infidel)"" Hyde reported.Ludke, going by the Muslim names Muhammad Nassir, Muhammad Abdun Naasir Al-Hannafi, and Abuz Sayyaf, told an undercover agent he had ""pledged his allegiance to the leader of ISIL (ISIS) (the purported ""Caliph""), Al-Baghdadi,"" according to the criminal complaint obtained by San Angelo Live. He reportedly pledged his love of Muslims and hatred towards infidels ""for Allah's sake.""He later sent the undercover FBI agent a video of himself pledging allegiance to the ISIS leader, Al-Baghdadi.Thinking the agent was an ISIS recruiter in the Middle East, Ludke told him he was making plans to come ""there."" He admitted to having a criminal history and said he would have to travel via Mexico where he would be able to purchase travel documents.According to court records obtained by Breitbart Texas from the Eastern District of Wisconsin, Ludke was convicted in 2010 on charges of threatening to kill a federal judge. He sent a series of threatening letters to the court of Federal District Court Judge William Griesbach in the Eastern District of Wisconsin. The fourth letter, for which he pleaded guilty, states:Allow me to willfully leave to Istanbul, Turkey or 1will have no choice but to hunt you down and kill you and your staff! If you do not have me immediately transferred out of this facility or released, I will be contacting my brothers of the islamic al-shabab and there will be blood on your hands and your kuffar government due to random acts of violence in response to your unresponsiveness.Imagine federal courthouses filled with infidel americans being victim to liquefied forms of Semtex bonded to a paper much with nitrous pellets from fertilizer surrounded by C-4 with ball bearings for added destruction! ....this is not an idle threat U.S. Judge Griesbachl"" ""If you do not pay heed to my call and bargain, bear witness that I will do everything in my power to kill you Judge Griesbach and your kuffar regime!Ludke was introduced to Padilla-Conde by the FBI. At that time Padilla-Conde was going by the name AbuZaid Haddaf.The duo remained in contact with the undercover agent as they traveled from Wisconsin to Texas. They continued to discuss their plans to travel and join up with ISIS.Padilla-Conde had previously told the undercover agent he was having difficulties earning a living by working cash jobs and that they  were about to be evicted from their apartment. He told the agent he asked for, and received, permission to camp out in the parking lots of area mosques as they were traveling south, Hyde reported.He later admitted he was not really interested in joining ISIS and was using Ludke to make his way back to Mexico. He told officials he planned to dump Ludke once they crossed the border into Mexico.The duo was headed to El Paso when they were arrested in San Angelo. Padilla-Conde's brother-in-law had advised him that would be an easy place to cross back into Mexico.Sheriff Jones told San Angelo Live the arrest was all in a day's work. He expressed his gratitude to the FBI and the JTTF for their coordination with his agency. He said he was happy they were stopped before becoming a threat to the U.S. and American citizens.""Terrorism remains the FBI's top priority in keeping Americans safe,"" FBI Special Agent in Charge Justin Tolomeo said in a written statement obtained by Breitbart Texas. ""The arrest of these two individuals from Wisconsin, underscores how the real threat of terrorism can occur anywhere, at anytime. I would like to commend the efforts of the JTTF which includes a wide range of our law enforcement partners who work tirelessly for the safety of our citizens. We encourage all citizens to remain vigilant in reporting suspicious activity to law enforcement.""Assistant U.S. Attorney for the Eastern District of Wisconsin said the pair was being charged for providing material support to a foreign terrorist organization. If they are convicted, each face up to 20 years in prison and could be fined up to $250,000.Bob Price serves as associate editor and senior political news contributor for Breitbart Texas. He is a founding member of the Breitbart Texas team. Follow him on Twitter @BobPriceBBTX. Allow me to willfully leave to Istanbul, Turkey or 1will have no choice but to hunt you down and kill you and your staff! If you do not have me immediately transferred out of this facility or released, I will be contacting my brothers of the islamic al-shabab and there will be blood on your hands and your kuffar government due to random acts of violence in response to your unresponsiveness.
Imagine federal courthouses filled with infidel americans being victim to liquefied forms of Semtex bonded to a paper much with nitrous pellets from fertilizer surrounded by C-4 with ball bearings for added destruction! ....this is not an idle threat U.S. Judge Griesbachl"" ""If you do not pay heed to my call and bargain, bear witness that I will do everything in my power to kill you Judge Griesbach and your kuffar regime!SIGN UP"	['Jones']	[]
11	11	http://www.breitbart.com/2016-presidential-race/2016/10/15/trump-media-clinton-campaign-want-to-stop-our-movement-with-blizzard-of-sexual-assault-accusations/	Donald Trump: Media, Clinton Campaign ‘Want to Stop Our Movement’ With Sexual Assault Accusations	"Republican presidential nominee Donald Trump is targeting what he calls Hillary Clinton's ""corrupt criminal syndicate.""SIGN UP FOR OUR NEWSLETTER""'I am a victim of one of the great political smear campaigns in our country,"" Trump told a crowd of supporters in Charlotte. ""They are coming after me to try and destroy what is considered by even them (points to the media section) the greatest movement in the history of our country. There's never been anything been anything like this.""As the crowd cheered, Trump added:Bill O'Reilly and others have said it's the single biggest political phenomena in his lifetime, and others have said the same thing. The political establishment is trying to stop us, because they know we are a threat to their totally corrupt control. It's true.No one is more corrupt than crooked Hillary Clinton. Nobody. In fact, she's the most corrupt person to ever seek the presidency of the United States of America. And her specialty, if you look over the years, has been character assassination, and really, personally, just going after people. That's her specialty. She's been doing it her whole career.The only force strong enough to smash Clinton's corrupt criminal syndicate is you, the American voter.""After many, many years, even decades, without complaint, the media and the Clinton campaign have brought forward false allegations less than a month before the most important election in modern times,"" he said. The crowd booed. ""These allegations are one hundred percent false, as everybody--I think you know. I think you get it.""""They're made up. They never happened. When have you met tens of thousands of people as I have?--and I've met thousands and thousands and thousands of people--know them, know them well. It's not hard to find a small handful of people willing to make false smears for personal fame,"" he said. ""Who knows, maybe for financial reasons. Political purposes. Or, for the simple reason they want to stop our movement. They want to stop our campaign. Very simple.""These claims defy reason, logic, common sense. They're made without supporting witnesses. No witnesses. Twenty-eight years ago. Ten years ago, 14 years ago, 12 years ago. Not me. Believe me, not me, not me. You would be very impressed, actually, with my life in so many regards, including that regard. Not a single shred of evidence. Eyewitnesses have already debunked the wild and ludicrous allegations of a magazine article that appeared, and I'll tell you what, it was just incredible. It was People magazine, and the article appeared, and a statement was made. But if it's true, they would have put it in the article. They would have had to put it into the article. But they didn't do that. And they didn't do that for a simple reason: Because it never happened, twelve years ago. Never complained, never talked to the bosses.""All of a sudden, two nights ago, we get a call, and the call is from People magazine,"" he continued. ""They didn't even want a quote. I think maybe what we should do is boycott that issue of People magazine.""So that's the way it is. I just want to tell you folks, it is a campaign that's amazing, and I'm not going to be talking about it much because we're talking about other things, and we have to talk about other things. But if affects five percent, or two percent, or ten percent, or--it's all false stuff. It's all a concerted effort. And I think it's the only way they're going to stop us. The only way. And I don't think that's going to happen.At that point, the crowd booed as demonstrators were escorted out of the rally.""That's the only way we get the cameras to turn!"" Trump said as newsmen panned the rally, looking for the protesters.On Thursday, Trump targeted the leftist press in a blistering speech for rolling out women who sought to accuse him of inappropriate touching less than a month before election day.This election will determine whether we are a free nation or whether we have only the illusion of democracy, but are in fact controlled by a small handful of global special interests rigging the system, and our system is rigged. This is reality, you know it, they know it, I know it, and pretty much the whole world knows it. The establishment and their media enablers will control over this nation through means that are very well known. Anyone who challenges their control is deemed a sexist, a racist, a xenophobe, and morally deformed,"" Trump said in West Palm Beach, Florida. ""They will attack you, they will slander you, they will seek to destroy your career and your family, they will seek to destroy everything about you, including your reputation. They will lie, lie, lie, and then again they will do worse than that, they will do whatever is necessary. The Clintons are criminals, remember that. They're criminals.Bill O'Reilly and others have said it's the single biggest political phenomena in his lifetime, and others have said the same thing. The political establishment is trying to stop us, because they know we are a threat to their totally corrupt control. It's true.
No one is more corrupt than crooked Hillary Clinton. Nobody. In fact, she's the most corrupt person to ever seek the presidency of the United States of America. And her specialty, if you look over the years, has been character assassination, and really, personally, just going after people. That's her specialty. She's been doing it her whole career.
The only force strong enough to smash Clinton's corrupt criminal syndicate is you, the American voter.These claims defy reason, logic, common sense. They're made without supporting witnesses. No witnesses. Twenty-eight years ago. Ten years ago, 14 years ago, 12 years ago. Not me. Believe me, not me, not me. You would be very impressed, actually, with my life in so many regards, including that regard. Not a single shred of evidence. Eyewitnesses have already debunked the wild and ludicrous allegations of a magazine article that appeared, and I'll tell you what, it was just incredible. It was People magazine, and the article appeared, and a statement was made. But if it's true, they would have put it in the article. They would have had to put it into the article. But they didn't do that. And they didn't do that for a simple reason: Because it never happened, twelve years ago. Never complained, never talked to the bosses.So that's the way it is. I just want to tell you folks, it is a campaign that's amazing, and I'm not going to be talking about it much because we're talking about other things, and we have to talk about other things. But if affects five percent, or two percent, or ten percent, or--it's all false stuff. It's all a concerted effort. And I think it's the only way they're going to stop us. The only way. And I don't think that's going to happen.This election will determine whether we are a free nation or whether we have only the illusion of democracy, but are in fact controlled by a small handful of global special interests rigging the system, and our system is rigged. This is reality, you know it, they know it, I know it, and pretty much the whole world knows it. The establishment and their media enablers will control over this nation through means that are very well known. Anyone who challenges their control is deemed a sexist, a racist, a xenophobe, and morally deformed,"" Trump said in West Palm Beach, Florida. ""They will attack you, they will slander you, they will seek to destroy your career and your family, they will seek to destroy everything about you, including your reputation. They will lie, lie, lie, and then again they will do worse than that, they will do whatever is necessary. The Clintons are criminals, remember that. They're criminals.SIGN UP"	['Clinton', 'Trump']	[]
