	Unnamed: 0	Link	Title	Text	Terms	Topics
0	0	http://www.breitbart.com/2016-presidential-race/2016/10/15/jill-stein-clinton-foundation-donors-in-corporate-media-prop-up-hillary-campaign/	Jill Stein: Clinton Foundation Donors in Corporate Media ‘Prop Up’ Hillary Campaign	"Green Party presidential nominee Jill Stein skewered ""corporate media"" for their willingness to ""prop up Hillary [Clinton] and smear her opponents."" Stein explained that the reason they do so is ""because they're huge donors to her foundation.""SIGN UP FOR OUR NEWSLETTERStein put members of corporate media, who have failed to cover her own ""people-powered campaign,"" on notice, declaring, ""Your silence to our voices speaks volumes.""""Why does the corporate media prop up Hillary and smear her opponents? Because they're huge donors to her foundation,"" Stein wrote on Twitter, linking to a Politico report titled, ""Clinton Foundation Donors Include Dozens of Media Organizations, Individuals"".""90% of the US media is controlled by 6 corporations. The 2-party system has made them rich; no surprise they prop it up #FollowTheMoney,"" Stein tweeted.Who is the #debate media blackout really hurting? The people! Onward we march to #BreakTheBlackout! pic.twitter.com/YIzZZHxE8n-- Dr. Jill Stein (@DrJillStein) October 15, 2016The Politico report highlighted by Stein documents the ""media industry's ties to the Clinton Foundation"" including the ties of ""Carlos Slim, the Mexican magnate and largest shareholder of The New York Times Company"":NBC Universal, News Corporation, Turner Broadcasting and Thomson Reuters are among more than a dozen media organizations that have made charitable contributions to the Clinton Foundation in recent years, the foundation's records show. The donations, which range from the low-thousands to the millions, provide a picture of the media industry's ties to the Clinton Foundation at a time when one of its most notable personalities, George Stephanopoulos, is under scrutiny for not disclosing his own $75,000 contribution when reporting on the foundation. The list also includes mass media groups like Comcast, Time Warner and Viacom, as well a few notable individuals, including Carlos Slim, the Mexican telecom magnate and largest shareholder of The New York Times Company, and James Murdoch, the chief operating officer of 21st Century Fox. Both Slim and Murdoch have given between $1 million to $5 million, respectively.Stein has repeatedly attacked ""corporate media"" for not covering her campaign-a campaign, which, she says, presents voters with a clear alternative to Washington's corporatist ""uniparty.""Indeed, while third party Libertarian nominee Gary Johnson has received quite a bit of media attention throughout this election, Stein says that she has experienced a virtual media ""blackout."" Stein has suggested that the reason for the media blackout is that, unlike Johnson, she is an effective messenger against Washington's ""uniparty.""""Despite a near-blackout by corporate media we are reaching millions of Americans who are ready to build a new major party,"" Stein wrote.Help us #BreakTheBlackout from corporate media - go to https://t.co/XKgRNM7Pa9 and sign up to join our team! #GreenTownHall-- Dr. Jill Stein (@DrJillStein) October 12, 2016 Who is the #debate media blackout really hurting? The people! Onward we march to #BreakTheBlackout! pic.twitter.com/YIzZZHxE8n
-- Dr. Jill Stein (@DrJillStein) October 15, 2016NBC Universal, News Corporation, Turner Broadcasting and Thomson Reuters are among more than a dozen media organizations that have made charitable contributions to the Clinton Foundation in recent years, the foundation's records show. The donations, which range from the low-thousands to the millions, provide a picture of the media industry's ties to the Clinton Foundation at a time when one of its most notable personalities, George Stephanopoulos, is under scrutiny for not disclosing his own $75,000 contribution when reporting on the foundation. The list also includes mass media groups like Comcast, Time Warner and Viacom, as well a few notable individuals, including Carlos Slim, the Mexican telecom magnate and largest shareholder of The New York Times Company, and James Murdoch, the chief operating officer of 21st Century Fox. Both Slim and Murdoch have given between $1 million to $5 million, respectively.Help us #BreakTheBlackout from corporate media - go to https://t.co/XKgRNM7Pa9 and sign up to join our team! #GreenTownHall
-- Dr. Jill Stein (@DrJillStein) October 12, 2016SIGN UP"	['Turner', 'Clinton', 'Warner']	[]
1	1	http://www.breitbart.com/texas/2016/10/15/boston-cops-still-critical-multiple-surgeries-gunshot-wounds/	Boston Cops Still ‘Critical’ After Multiple Surgeries for Gunshot Wounds	"The two Boston police officers who were shot while responding to a domestic disturbance call on Wednesday faced a second round of surgery on Friday. One officer faced additional surgery on Saturday morning. Police say the two officers are recovering but are still in critical condition.SIGN UP FOR OUR NEWSLETTERBoston Police Officers Richard Cintolo, a 27-year police veteran, and Matt Morris, a 12-year veteran responded to a domestic disturbance call on Wednesday night. Police officials say that Kirk Figueroa, 33, was reported to be threatening his roommate with a knife, Breitbart Texas reported on Wednesday.When the officers arrived and entered the home, Figueroa reportedly appeared with a tactical shotgun and wearing body armor. He opened fire, striking one officer in the leg and the other in the upper body. Other officers responded quickly and dragged the two wounded officers to a safe place were life-saving first aid could be applied. Other officers returned fire, striking and killing Figueroa.The officers were transported to the hospital, but officials credited the quick action of a fellow officer who stuck his finger in the leg wound of Officer Morris, pinching off the severed femoral artery. Another officer applied a tourniquet allowing Morris to be safely transported. Both officers underwent surgery on Wednesday but were listed in ""extremely critical"" condition at that time.Following a second round of surgery on Friday, police told the Associated Press (AP) the officers were recovering but were still in critical condition.Boston police officials tweeted that Morris underwent additional surgery on Saturday morning. The surgery was completed and Morris is listed in critical but stable condition.Both officers remain in critical but stable condition at this time. The BPD appreciates the continued support - your prayers are being heard pic.twitter.com/Zed7zISs3V-- Boston Police Dept. (@bostonpolice) October 15, 2016The AP reported that Officer Morris received the state's highest award for bravery, the Hanna Medal of Honor, for his actions in 2006 when he and his partner talked down a masked gunman who was firing on a crowded bus. The two officers were able to peacefully take the man into custody and save those on the bus.The Boston Herald reported that Officer Cintolo has been described as ""the guy you want to be pulled over by.""""If there was a bird on the ground, he'd stop the cruiser and push the bird to the side of the road,"" Mike Anderson, the service manager of Nu-Tread Tire & Auto Service Center in Eastie's Orient Heights neighborhood told the local newspaper., Anderson said Cintolo would frequently stop by his East Boston home.Cintolo is a second generation Boston police officer. His father, Michael Cintolo, retired from the department a few years ago.
East Boston candle light vigil for Officers Cintolo&Morris. Held at the Madonna Monument. God Bless everyone for your support of the BPD pic.twitter.com/ye9FUDISPI-- Chief William Gross (@DeputyGross) October 15, 2016
The department expressed its gratitude to the public for their support and asked for continued prayers for the officers' recovery.Bob Price serves as associate editor and senior political news contributor for Breitbart Texas. He is a founding member of the Breitbart Texas team. Follow him on Twitter @BobPriceBBTX.
Both officers remain in critical but stable condition at this time. The BPD appreciates the continued support - your prayers are being heard pic.twitter.com/Zed7zISs3V
-- Boston Police Dept. (@bostonpolice) October 15, 2016
East Boston candle light vigil for Officers Cintolo&Morris. Held at the Madonna Monument. God Bless everyone for your support of the BPD pic.twitter.com/ye9FUDISPI
-- Chief William Gross (@DeputyGross) October 15, 2016
SIGN UP"	['Kirk', 'Hanna']	['god']
2	2	http://www.breitbart.com/texas/2016/10/15/texas-ag-fires-off-brief-in-waller-courthouse-gun-carry-lawsuit/	Texas AG Fires Off Brief in Waller Courthouse Gun Carry Lawsuit	"The Texas Attorney General has fired off a brief in the litigation over the right to bear arms in the Waller County Courthouse complex. AG Ken Paxton urges that ""Both the law and sound public policy against the chilling of protected speech demand dismissal of Waller County's claim. He also urges that the Waller County court is without jurisdiction to determine the issue.SIGN UP FOR OUR NEWSLETTERBreitbart Texas has been following the controversy and the protests by Second Amendment advocates over the right for concealed handgun license holders to have guns in a government building. The Waller County, Texas complex houses courtrooms and judicial chambers and court staff offices as well as the County Clerk Office and other county offices.Officials for Waller County urge that the courthouse is legally off-limits to licensed gun holders. They say allowing citizens to carry inside the courthouse in violation of state law is dangerous because it subjects witnesses and litigants, judges, lawyers, prosecutors, peace officers and others, ""to an unnecessary and unjustifiable risk."" District Attorney Elton Mathis told Breitbart Texas, ""The commissioners court is adamant that guns will not come in the courthouse."" The District Attorney said his clients, the officials in the county, do not believe that the Texas Legislature has intended the ""sweeping interpretation"" that the Second Amendment advocates are giving it.Waller County filed a lawsuit against San Jacinto County resident Terry Holcomb Sr., founder of Texas Carry. Holcomb sent the County a notice complaining that county officials were in violation of Texas law by excluding licensed to carry (LTC) holders, as reported by Breitbart Texas.D.A. Mathis says the new law that allows LTC holders to carry in government buildings and around courthouses needs to be legally interpreted in the court system. The County sued Holcomb in order to have the rights and duties under Texas law legally declared by a judge. ""All Texans should welcome this resolution,"" he said. Waller County's lawsuit states that the issue is whether signs posted at courthouses violate section 411.209 of the Government Code. Section 46.03(a) of the Texas Penal Code prohibits an individual from entering a courthouse carrying a prohibited weapon or firearm. The petition states that a related question is whether this Penal Code section ""prohibits an individual from carrying firearms and other weapons throughout the entire building in which a court or court office is located or only in an actual courtroom or court office.""Section 411.209 prohibits state agencies and political subdivisions from wrongfully excluding handgun license holders from property owned or leased by the government. The law prohibits a governmental entity from providing notice by a communication described in Texas Penal Code SS 30.06, or by any sign expressly referring to that law or to a concealed handgun license, that a license holder carrying a handgun is prohibited from entering or remaining on a premises or other place owned or leased by the governmental entity unless the license holder is prohibited from carrying a handgun on the premises or other place by Texas Penal Code SSSS 46.03 or 46.035.Texas Attorney General Ken Paxton writes in his amicus curiae brief (Latin for ""friend of the court""), ""Allowing this suit-in which the County has sued a citizen based on lawful exercise of his right to grieve-to proceed is an affront to the constitutional rights afforded by The Texas Constitution and will not resolve the County's liability under SS 411.209. The Court should dismiss the County's claim for lack of jurisdiction.""Breitbart Texas was in Waller County when gun rights advocates descended on Waller County in August to support their fellow Second Amendment advocate after he was sued by the County. During the open carry protest, they went to the Waller County Clerk's Office to file their own complaints against the County. A video of them bringing their complaints to the County Clerk is included in the article.Right before the protest, Texas Attorney General (AG) Ken Paxton sent Waller County officials a notice that they were in violation of the law. The AG gave county officials 15 days to cure the violation and put it on notice that the Office of the Attorney General (OAG) may file suit and seek $1,000 - $1,500 for the first violation, and not less than $10,000 - $10,500 for any second and subsequent violation. Each continuing day constitutes a separate violation under Texas law. As reported by Breitbart Texas, the AG filed a lawsuit on August 29th in Travis County, Texas. Austin, the State Capital, is in Travis County.The Attorney General argues in his brief that the Travis County district court in which the AG has filed suit ""is where Waller County's liability, or exemption therefrom, will be determined.""Holcomb told Breitbart Texas after the AG filed the amicus brief, ""We are very pleased that Attorney General Ken Paxton has taken such a strong stand against this bully of a County Judge. It's obvious he is used to simply running over people. This is a blatant violation of our very basic right to redress our grievances with the government.""The Texas Carry founder said he will litigate all the way to the U.S. Supreme Court if necessary. He argues that if they do not do so, it could encourage ""anti-gun officials"" who want to silence the voices of gun owners defending their Second Amendment rights.Lana Shadwick is a contributing writer and legal analyst for Breitbart Texas. She has served as a prosecutor and associate judge in Texas. Follow her on Twitter @LanaShadwick2.Texas Office of Attorney General Amicus Brief Waller County Gun Rights LitigationSIGN UP"	[]	['guns']
3	3	http://www.breitbart.com/texas/2016/10/15/five-of-the-top-10-fastest-growing-u-s-cities-are-in-texas/	Five of Top 10 Fastest Growing U.S. Cities Are in Texas	New projections from the American City Business Journals (ACBJ) ranked five Texas metropolitan areas among the fastest growing Top 10 U.S. cities. By 2040, they expect to see explosive population growth.SIGN UP FOR OUR NEWSLETTERACBJ, the parent company of the Dallas Business Journal, generated these statistics for 933 metro and micropolitan regions based on data from the U.S. Census Bureau and the University of Virginia's Weldon Cooper Center for Public Service.Of those Texas cities on the Top 10 list of America's fastest growing metros, Austin came in first place. ACBJ foresees the Austin-Round Rock area to nearly double its population from two million to four million in the next 24 years. This reflects a 98.5 percent increase in residents. Although Austin is poised to become the fastest growing U.S. city, it is not the largest. Following Austin on the list were Houston-The Woodlands-Sugar Land (5), San Antonio-New Braunfels (6), Dallas-Fort Worth-Arlington (7), and McAllen-Edinburg-Mission (10).Two of the Top 10 fastest growing cities in the country were in Florida -- Cape Coral-Fort Meyers (2) and Orlando-Kissimmee-Sanford (4). Raleigh, NC (3), Charleston-North Charleston, SC (8), and Denver-Aurora-Lakewood, CO (9) also made the list.Within Texas, Houston just may overtake Dallas as the state's largest metropolis in 2040. Currently, 7.1 million people reside in Dallas-Fort Worth-Arlington (DFW). The Dallas Business Journal reported DFW could swell to 10.9 million people, a 53.5 percent population increase. However, the Houston-The Woodlands-Sugar Land population should balloon to 11.1 million, up 66.7 percent from its current 6.6 million.In March, the U.S. Census Bureau released figures tracking the Texas population boom fueled by nearly half a million people relocating to the Lone Star State over the one year period of July 2014 to July 2015. That is more than any other state in the nation. Statistical growth patterns in that report, lead by Houston-The Woodlands-Sugar Land and closely followed by DFW, mirror ACBJ's projections.According to ACBJ, smaller Texas cities like McAllen-Edinburg-Mission may see its population jump 51.3 percent by 2040. The area's roughly 842,000 population could soar to 1.275 million. El Paso should experience a 17.5 percent uptick from 839,000 to 985,476 residents. Midland could have a 75 percent growth spurt, jumping from today's 167,000 residents to nearly 300,000. Odessa is poised for 67.4 percent growth. Its population will grow from around 159,400 to 266,860.Nationally, ACBJ expects New York City to remain the most populated large metro area in 2040, even though Los Angeles grows at a faster pace. The Big Apple will have 22.5 million city dwellers while Tinseltown, in second place, may only reach 15 million. Houston and Dallas will take the third and fourth spots, respectively. Chicago, with 9.7 million residents today, will likely drop to fifth place. ACBJ also anticipates Philadelphia, currently seventh, will sink to 11th place by 2040. Phoenix, and California's San Francisco-Oakland and Riverside-San Bernardino will surpass Boston, now in 10th place and expected to drop to 13th.Demographers called Myrtle Beach, SC, the hottest growth prospect in smaller cities with 500,000-999,999 residents in 2040. They estimate the city will expand by over 85 percent to a population of 800,000.Earlier in October, WalletHub named DFW suburb Frisco the nation's fastest growing mid-size U.S. city with 154,407 residents. The upscale sprawling urban community is home to the Dallas Cowboys corporate headquarters and state-of-the-art practice facility called the Star, an estimated $1.5 billion venue on a 91-acre compound that boasts two outdoor practice fields, underground parking, plans for an Omni hotel hotel, retail, and a Baylor, Scott & White sports therapy research center. It opened in late August. California companies like Jamba Juice and Toyota transplanted their headquarters to Frisco. The Japanese automaker's massive 100-acre campus expects to be operational mid-2017. In May, Breitbart Texas reported Frisco was one of five Texas midsize cities to rank on the nation's fastest growing between 2014-15.Last year, Breitbart Texas reported on a study released by the Office of the State Demographer. It predicted if migration patterns continued on the same pace as in 2000 to 2010, Texas would see explosive population growth - up to 54.4 million people, based on immigration and migration patterns as people continue to pour in from other U.S. states.Follow Merrill Hope, a member of the original Breitbart Texas team, on Twitter.SIGN UP	['Cooper']	[]
4	4	http://www.breitbart.com/2016-presidential-race/2016/10/15/trump-proposes-drug-testing-clinton-debate-dont-know-whats-going/	Trump Proposes Drug Testing Clinton before Debate: ‘I Don’t Know What’s Going on with Her’	"Donald Trump suggested that he and Hillary Clinton should take a drug test before the next debate during a campaign rally in Portsmouth, New Hampshire on Saturday afternoon.SIGN UP FOR OUR NEWSLETTER""We should take a drug test prior,"" the Republican nominee stated. ""I'm willing to do it.""PORTSMOUTH --Trump on Clinton: ""We should take a drug test before the debate because I don't know what's going on with her.""-- Kevin Cirilli (@kevcirilli) October 15, 2016""At the beginning of her last debate, she was all pumped up,"" Trump alleged, but then at the end of the debate ""she could barely reach her car.""Trump adds, ""I think she is getting pumped up, you understand ... she is getting pumped up for Wednesday""-- Chris Snyder (@ChrisSnyderFox) October 15, 2016Trump's campaign rally in New Hampshire is his first of two rallies on Saturday. He is also holding a campaign rally in Maine later Saturday afternoon.First stop today - Trump takes the stage in Portsmouth, New Hampshire pic.twitter.com/K1i5Za3T5J-- Chris Snyder (@ChrisSnyderFox) October 15, 2016PORTSMOUTH --
Trump on Clinton: ""We should take a drug test before the debate because I don't know what's going on with her.""
-- Kevin Cirilli (@kevcirilli) October 15, 2016Trump adds, ""I think she is getting pumped up, you understand ... she is getting pumped up for Wednesday""
-- Chris Snyder (@ChrisSnyderFox) October 15, 2016var _ndnq = _ndnq || []; _ndnq.push([""embed""]);First stop today - Trump takes the stage in Portsmouth, New Hampshire pic.twitter.com/K1i5Za3T5J
-- Chris Snyder (@ChrisSnyderFox) October 15, 2016SIGN UP"	['Snyder', 'Clinton', 'Trump']	[]
5	5	http://www.breitbart.com/2016-presidential-race/2016/10/15/trump-addresses-drug-use-overdose-new-hampshire-solve-crisis/	Trump Addresses Drug Use and Overdose in New Hampshire: ‘We Have to Solve this Crisis’	"Donald Trump promised to stop the drug overdose crisis in the United States during a campaign rally in New Hampshire on Saturday.SIGN UP FOR OUR NEWSLETTER""If I win, if I get elected president, I'm going to solve that problem,"" Trump promised his supporters gathered in Portsmouth, New Hampshire on Saturday, saying he learned about the significant drug problem during his GOP primary campaign in New Hampshire. ""We're going to take care of it.""New Hampshire has consistently been one of the states with the highest rate of deaths caused by drug overdose.According to the CDC:In 2014, the five states with the highest rates of death due to drug overdose were West Virginia, New Mexico, New Hampshire, Kentucky and Ohio. States with statistically significant increases in the rate from 2013 to 2014 included Alabama, Georgia, Illinois, Indiana, Maine, Maryland, Massachusetts, Michigan, New Hampshire, New Mexico, North Dakota, Ohio, Pennsylvania and Virginia.""We have to solve this crisis,"" the Republican nominee added, saying the first step is to stop the flow of illegal drugs into the United States.Trump said he will aggressively prosecute traffickers of illegal drugs and also curve government policies and bureaucracy that slow addicts from receiving timely help. ""We have to move it along.""In 2014, the five states with the highest rates of death due to drug overdose were West Virginia, New Mexico, New Hampshire, Kentucky and Ohio. States with statistically significant increases in the rate from 2013 to 2014 included Alabama, Georgia, Illinois, Indiana, Maine, Maryland, Massachusetts, Michigan, New Hampshire, New Mexico, North Dakota, Ohio, Pennsylvania and Virginia.SIGN UP"	['Trump']	[]
