	Link	Title	Text
12	http://www.breitbart.com/california/2016/11/13/bernie-sanders-state-party-challenges/	Bernie Sanders Fans Mount State Party Challenges	"Supporters of Sen. Bernie Sanders (I-VT) are declaring that they were right to back him in the primary over former Secretary of State Hillary Clinton, whom party elders said was more ""electable.""SIGN UP FOR OUR NEWSLETTERThe aging Vermont socialist mounted a stronger-than-expected challenge nationwide, winning dramatic upsets, packing rallies, and fighting the Democratic primary down to the wire. Now, fans who still ""Feel the Bern"" are complaining anew -- and mounting challenges to seize control of state parties.Politico reports:Supporters of Bernie Sanders' failed presidential bid are seizing on Democratic disarray at the national level to launch a wave of challenges to Democratic Party leaders in the states.The goal is to replace party officials in states where Sanders defeated Hillary Clinton during the acrimonious Democratic primary with more progressive leadership.Sanders supporters are particularly aggrieved that the Democratic National Committee (DNC) colluded with Clinton to block him. Releases of internal DNC emails by Wikileaks in July showed that DNC officials had coordinated with the Clinton campaign. Then-DNC chair Debbie Wasserman Schultz resigned, but her successor, former CNN contributor Donna Brazile, was later shown by Wikileaks to have leaked debate questions to Clinton in advance of primary debates against Sanders.Hundreds of Sanders supporters walked out of the Democratic National Convention in Philadelphia in July in a protest dubbed ""#Demexit,"" after what they described as suppression by party officials, including seating non-Sanders delegates in their sections of the Wells Fargo arena, and turning off lights above vociferous delegations such as Washington and Oregon.Now, Sanders fans are circulating articles on social media arguing that Sanders would have beaten Trump. Left-wing journalist Glenn Greenwald -- who is partly responsible for the dramatic Edward Snowden leaks about the National Security Agency -- told Democracy Now: ""Bernie Sanders was a much more popular and a much stronger candidate than Hillary Clinton against every single Republican opponent, including Donald Trump. He was running many points ahead of Clinton on every poll, in terms of who he might run against versus her, in terms of approval rating, in terms of popularity.""Greenwald pointed out that many of the grievances that motivated voters in the Upper Midwest to back Trump were also issues that Sanders had highlighted in his own campaign.Writing in the Washington Post (and reprinted in the San Francisco Chronicle), Fredrik de Boer argues that Sanders was more popular than Clinton and that he could have run a more authentic campaign against Trump: ""Sanders was uniquely positioned to reach voters with a different sensibility. In contrast to the millionaire polish of the Clinton camp, Sanders has a somewhat shambolic, grandfatherly presence that conveys an unpretentious and approachable character.""Joel B. Pollak is Senior Editor-at-Large at Breitbart News. His new book, See No Evil: 19 Hard Truths the Left Can't Handle, is available from Regnery through Amazon. Follow him on Twitter at @joelpollak.Supporters of Bernie Sanders' failed presidential bid are seizing on Democratic disarray at the national level to launch a wave of challenges to Democratic Party leaders in the states.
The goal is to replace party officials in states where Sanders defeated Hillary Clinton during the acrimonious Democratic primary with more progressive leadership.SIGN UP"
13	http://www.breitbart.com/big-government/2016/11/13/anti-trump-youre-going-write-graffiti-learn-spell/	If You’re Going to Write Anti-Trump Graffiti, Learn to Spell	"Anti-Trump graffiti reading ""Fucc Trump"" was spotted on Friday on Sepulveda Boulevard in Los Angeles. It was only one of dozens of incidents of vandalism sweeping the nation in the wake of President-elect Donald Trump's victory last Tuesday.SIGN UP FOR OUR NEWSLETTERThe particular vandal responsible for the graffiti above, however, seems to have had no idea how to spell one of the most common expletives in the English language. (Perhaps he, or she, ran out of K's scrawling ""KKK"" on other walls, elsewhere.)Anti-Trump protests continued on Saturday evening in Los Angeles and other cities. The Associated Press reports: ""The protests -- held in big cities such as Los Angeles, New York and Chicago as well as smaller ones, such as Worcester, Massachusetts, and Iowa City, Iowa -- were largely peaceful Saturday, although two police officers were slightly injured during protests in Indianapolis.""After a protest in downtown L.A. that drew 8,000 people on Saturday afternoon, smaller groups of hundreds of demonstrators marched through the city at night. The Los Angeles Times reports: ""Some were seen being detained downtown on suspicion of vandalism, including one seen spray painting ""my body, my choice"" in the 3rd Street tunnel.""In San Luis Obispo, California, several pro-Trump protesters staged a counter-demonstration -- ""much to some marchers' dismay,"" according to the San Luis Obispo Tribune.""A group of about five people held Trump campaign signs and waved an American flag, marching near the other protesters,"" the Tribune added.Protests have continued throughout the country as Democrats and left-wing activists have rejected the results of last Tuesday's election.In some cases, ordinary thugs appear to be using the political outrage as cover for their independent, violent behavior.Joel B. Pollak is Senior Editor-at-Large at Breitbart News. His new book, See No Evil: 19 Hard Truths the Left Can't Handle, is available from Regnery through Amazon. Follow him on Twitter at @joelpollak.SIGN UP"
14	http://www.breitbart.com/big-government/2016/11/13/wave-fake-hate-crimes-sweeps-anti-trump-imaginations/	Wave of Fake ‘Hate Crimes’ Sweeps anti-Trump Social Media	"Fake reports of ""hate crimes"" committed by fans of President-elect Donald Trump are sweeping the nation. Meanwhile, real crimes continue to be committed by anti-Trump rioters in dozens of cities across America.SIGN UP FOR OUR NEWSLETTEROne fake ""hate crime"" involved a Muslim woman at the University of Louisiana at Lafayette who claimed that she had her hijab torn off by two white males. Lafayette police now report that she ""admitted that she fabricated the story.""Other incidents are being reported as ""crimes"" that are not crimes at all. CNN published a list of ""hate crimes"" on Saturday that includes an incident where a group of middle school students chanted ""Build the wall!"" in a cafeteria.That is not a ""crime""; it is juvenile behavior by boorish 12- and 13-year-olds.Another ""crime"" on CNN's list comes from a university where ""somebody chalked the words 'Trump,' 'Build wall' and '[Expletive deleted] your safe space' in front of the library.That's right: they used actual chalk.Other than that, there's not much. Elizabeth Nolan Brown of Reason.com has posted a more extensive list of cases where police were unable to verify the allegations being made, including an alleged attack on a gay man in Santa Monica, California.Rep. Jared Huffman (D-CA) documented three men showing up at a Veterans Day parade with Confederate flags. Provocative? Deliberately. Offensive? Yes, to most. Hate crime? No.And yet Huffman blamed Donald Trump: ""We need to prepare for more of this because the Trump campaign has legitimized and given public space to some shadowy groups that used to hide from public view.""(For the record, Trump supported efforts to remove the Confederate flag from the South Carolina state capitol.)Meanwhile, thousands of people flood city centers in Los Angeles, Portland, New York and elsewhere, in some cases setting fires, smashing windows and vandalizing anything they can.Night after night, the protests have continued, organized by radical left-wing organizations such as MoveOn.org and ANSWER, in rejection of the results of a democratic election.And some of the rhetoric of the protests has been bigoted, and violent. One sign at a Los Angeles protest Saturday read: ""This Machine Kills Fascists.""Some of the protests have resulted in violent attacks on police, and dozens of arrests.And there have been real hate crimes against Trump supporters, including a videotaped beating of a white man who was targeted because he was accused of voting for Trump.The wave of anti-Trump crimes -- ""hate crimes"" and otherwise -- committed by anti-Trump thugs overwhelms, by several orders of magnitude, whatever crimes are being attributed to Trump supporters.The narrative about a wave of ""hate crimes"" inspired by Trump is a deliberate fabrication, meant to tarnish the President-elect. It is a continuation of false accusations, during the campaign, that Trump represented the second coming of Hitler.It is an attempt to organize a new opposition, based on lies, and the deliberate sowing of mistrust at a time when Americans have been called -- by both presidential candidates -- to come together.Joel B. Pollak is Senior Editor-at-Large at Breitbart News. His new book, See No Evil: 19 Hard Truths the Left Can't Handle, is available from Regnery through Amazon. Follow him on Twitter at @joelpollak.SIGN UP"
15	http://www.breitbart.com/jerusalem/2016/11/13/palestinian-leadership-tensions-flare-amid-arafat-death-anniversary/	Palestinian Leadership Tensions Flare Amid Arafat Death Anniversary	"(REUTERS) - Days after the 12th anniversary of the death of Yasser Arafat, Palestinian leaders descended into new recriminations over who may have been involved in the demise of the former president.SIGN UP FOR OUR NEWSLETTERComing two weeks before a meeting that is expected to overhaul the leadership of Fatah, the party of Arafat and President Mahmoud Abbas, the accusations underscore a growing animosity that threatens the movement's stability.Speaking at a memorial on Thursday in the West Bank city of Ramallah, Abbas said he knew who was behind Arafat's death and that an investigating panel would soon reveal its findings.""The result will come out in the nearest time possible and you will be surprised to know who did it,"" Abbas said. Although he stopped short of naming suspects, Abbas's comments were widely seen as referring to his main political rival - Mohammad Dahlan, a former Fatah security chief.Dahlan, a fierce Abbas critic who lives in self-imposed exile in the United Arab Emirates, took to Facebook on Saturday to point the finger at Abbas.""He (Abbas) is not qualified to make accusations and he personally is in the circle of accusation and the sole beneficiary of Abu Ammar disappearance,"" Dahlan wrote, referring to Arafat by his nickname.Abbas's office could not be reached for comment.Officials within Fatah are growing increasingly impatient with Abbas's leadership and rival groups have been emerging ahead of a party congress, the first since 2009, set to take place this month.Dahlan, 55, retains influence within Fatah's revolutionary council and central committee - the equivalent of Fatah's parliament.Abbas, 81, is expected at the party congress to push for the election of a new central committee and revolutionary council that would be free of Dahlan loyalists.Saudi Arabia, Egypt and other Arab states have been pressuring Abbas to resolve divisions in Fatah and with the rival Hamas movement. Neighboring states and diplomats fear the festering divisions could lead to conflict.Arafat, who signed the 1993 Oslo interim peace accord with Israel but led a deadly uprising after subsequent talks broke down in 2000, died in 2004 aged 75 in a French hospital four weeks after falling ill.The official cause of death was a massive stroke, but French doctors were unable at the time to determine the origin of the illness and no autopsy was carried out. Palestinian leaders have blamed Israel. Israel denies involvement.A French investigation was opened in 2012 at the request of Arafat's widow, and his remains were exhumed for tests that were examined separately by French, Russian and Swiss experts.The Swiss reported their results were consistent with but not proof of poisoning by reactive polonium. The French concluded he did not die of poisoning and Russian experts were reported to have found no traces of polonium in his body.The investigation was closed in 2015.SIGN UP"
16	http://www.breitbart.com/jerusalem/2016/11/13/israel-participated-nato-exercise-first-time-six-years/	Israel Participated in NATO Exercise for First Time in Six Years	The Jerusalem Post reports: PODGORICA, Montenegro - For the first time in more than six years, Israel was allowed to participate in a NATO exercise this week.SIGN UP FOR OUR NEWSLETTERIsrael was a full participant in the wide-scale drill held in Montenegro to evaluate the readiness and capabilities of NATO to face natural disasters.On October 16, 20 Serbians including former ranking police officers were arrested in Montenegro. It was the day the tiny Balkan state situated on the shores of the Adriatic Sea held its important parliamentarian election. The suspects were accused of an attempted coup d'etat and planning the assassination of Prime Minister Milo Djukanovic.The investigation is still under way, but leaks to the local media suggest that Russia was behind the plot, designed to sabotage the election and stop the Djukanovic government from, in 2017, bringing Montenegro into the North Atlantic Treaty Organization as its 29th member state.This week's exercises were part of its accession preparation, and Montenegro was selected for the exercise because of a series of floods the country has suffered from in the past.Read more here.SIGN UP
17	http://www.breitbart.com/jerusalem/2016/11/13/kissinger-iran-domination-attempts-biggest-threat-mideast/	Kissinger: Iran Domination Attempts Biggest Threat to Mideast	"The Algemeiner reports: The biggest challenge facing the Middle East is the ""potential domination of the region by an Iran that is both imperial and jihadist,"" former US Secretary of State Henry Kissinger said at a New York City gathering on Thursday.SIGN UP FOR OUR NEWSLETTER""[America must] make it clear that we are opposed to a further territorial expansion of Iran and what we are asking of the Iranians is to act like a nation, and not like crusaders,"" Kissinger stated in remarks made at the America-Israel Friendship League's 2016 Partners for Democracy Awards Dinner, where the 93-year-old statesman was the guest of honor. ""What we have to see to is that Iran does not achieve such a dominant position that the whole region explodes.""Referring to the results of Tuesday's presidential election, Kissinger described Republican Donald Trump's poll-defying victory over Democrat Hillary Clinton a ""revolution against conventional wisdom.""Looking ahead to the future of the Joint Comprehensive Plan of Action (JCPOA) after Trump takes office in January, Kissinger said a scrapping of the agreement would benefit Iran more than the US.""I would not have made [the agreement], but we will not get a great deal out of ending it now,"" Kissinger noted.Read more here.SIGN UP"
18	http://www.breitbart.com/jerusalem/2016/11/13/trump-aides-caution-obama-lame-duck-palestinian-state-push/	Trump Aides Caution Obama Against Lame Duck Palestinian State Push	"Politico reports: Before Donald Trump won the presidency, Democratic foreign policy circles hummed with talk that an outgoing President Barack Obama could take a last stab at peace talks between the Israelis and the Palestinians. There also was a strong expectation that Obama would push hard for Congress to approve the Trans-Pacific Partnership trade deal.SIGN UP FOR OUR NEWSLETTERBut now that they're on the verge of power, Trump aides say Obama shouldn't even think about taking such steps.""On big, transformative issues where President Obama and President-elect Trump are not in alignment, I don't think it's in keeping with the spirit of the transition ... to try to push through agenda items that are contrary to the president-elect's positions,"" a Trump national security adviser told POLITICO on Thursday. ""It's not going to be just counterproductive, but it will also send mixed messages.""Presidential transitions are often fraught, messy affairs, especially when White House control is switching from one political party to another. (Some Clinton administration officials, famously, took the ""w"" off their keyboards as the Bush team was coming aboard.)Outgoing presidents try to lock down their policies however they can, whether through executive orders, regulations or legislation. Incoming administrations try to lay the groundwork for what they want to do without declaring open war on the people they are replacing.Read more here.SIGN UP"
19	http://www.breitbart.com/jerusalem/2016/11/13/state-department-refuses-say-whether-iran-violated-nuclear-deal/	State Department Refuses to Say Whether Iran Violated Nuclear Deal	"The Algemeiner reports: Despite a finding published by the UN's atomic energy agency this week that Iran has -- for the second time -- stockpiled more heavy water than permitted under the terms of the nuclear agreement it reached with six world powers last year, the US State Department is declining to acknowledge this as a violation of the deal.SIGN UP FOR OUR NEWSLETTERAt a press briefing on Wednesday, State Department spokesman Mark Toner excused Iran, saying it had ""made no effort to...hide what it was doing from the IAEA.""Pressed about the issue again on Thursday, Toner told reporters, ""I'm not going to use the V word (violation) necessarily in this case, but we and our partners are going to continue to hold Iran accountable. And because of the JCPOA (Joint Comprehensive Plan of Action), we do have a system in place that we can hold Iran accountable.""Toner went on to say, ""If you look at the wording within the JCPOA, it actually says that Iran's needs, consistent with the parameters...are estimated to be 130 metric tons. That's not a hard, certain figure. That said, it is a ceiling that we look at and certainly the IAEA looks at. But to say because it's, I think, one-tenth of a metric ton over that limit -- to say that's an outright violation of the JCPOA and would somehow put that agreement in doubt, I think -- I don't want to necessarily say that.""Read more here.SIGN UP"
20	http://www.breitbart.com/big-government/2016/11/13/armed-american-radios-mark-walters-on-whatever-it-takes-immigration-still-the-greatest-threat-to-gun-rights/	Armed American Radio’s Mark Walters on ‘Whatever It Takes’: Immigration Still the Greatest Threat to Gun Rights	"The host of Armed American Radio joined Curt Schilling on Friday's Whatever It Takes and the two hosts talked about how the politics of gun rights and immigration will change in the Age of Trump.SIGN UP FOR OUR NEWSLETTER""Immigration, legal and illegal, poses-still poses-the greatest threat to our right to bear arms,"" said Mark Walters, whose program Armed American Radio airs Sunday nights on more than 150 stations, and his program The Daily Defense Hour airs weekdays on many of the same stations.
Call into the show: (877) 240-1776Walters said every poll shows that better than 85 percent of immigrants are opposed to gun rights, and even if some of them are sympathetic to gun rights, they vote overwhelmingly for the Democrats.""Ask yourself why the Democrats want to open up our borders-it is to cement Democrat control,"" he said.Fortunately, Donald J. Trump won the election, not Democrat Hillary R. Clinton, Walters said.""Our Second Amendment was at stake, not because of any person or their beliefs, but because of the party they put in power,"" he said.""This is a jihad for them,"" he said. ""This is a long-term strategy, a long-term goal-and that is to eventually wipe out gun ownership in the United States of America-and dare I say it: They failed miserably on Tuesday and we won.""Walters said,""Now we are in a position to end this phony debate over gun control, so we never have to hear those words uttered again-and if Trump follows through with his policies, with our assistance, we're in a position to do that, Curt, finally.""Join Curt Schilling on Whatever It Takes, broadcast online weekdays from 9 a.m. to 11 a.m. at Breitbart.com.SIGN UP"
