	Unnamed: 0	Link	Title	Text	Terms	Topics
4	4	http://www.breitbart.com/obama/2016/10/12/tom-fitton-judicial-watch-targeted-obama-administration/	Tom Fitton: Judicial Watch Targeted by Obama Administration	"Three years ago, we reported on videos produced by the General Services Administration (GSA) that show senior GSA officials and staff participating in costumed playacting and parodies.SIGN UP FOR OUR NEWSLETTERHere's a flavor: The Rocky Jog - With the Rocky movie theme blaring in the background, senior GSA officials lead employees on an extended jog through the corridors of the GSA's New York office and the streets of Manhattan. The jog is initiated by Ben Kochanski, deputy regional commissioner, GSA Public Buildings Service, whose 2012 salary was $141,066. Kochanski is then joined by Joanna Rosato, regional commissioner of GSA Public Buildings Service, whose 2012 salary was $164,500. Many additional GSA employees then join these two senior officials.Remember: The GSA touts itself as an ""innovation engine"" that helps the government cut costs.It now appears that the GSA did not like our meddling in their fun.The Washington Times recently highlighted a report by the GSA's inspector general concerning the GSA's attempt to strip away our status as a member of the media and to force us to pay exorbitant fees for records:The GSA botched several high-profile open records requests, delaying them for months while political appointees got involved, Inspector General Carol F. Ochoa said. The findings were released while the administration was facing charges of slow-walking open records requests for Hillary Clinton's emails, as well as other requests.In the case of Judicial Watch, the order to strip it of media status came from political operatives with long ties to Democratic causes -- and even from the White House.The inspector general said the decision came at the behest of Gregory Mecher, a former Democratic campaign fundraiser who at the time was liaison to the White House. He is married to Jen Psaki, a longtime spokeswoman with the Obama administration and its election campaigns.Ms. Ochoa said stripping Judicial Watch of media status violated several agency policies and things got worse when the GSA denied an appeal by the group.The IG report was finalized last year but only released the week before last! It was all politically motivated. Surprised?Making matters even worse, it appears that political revenge was behind the GSA/Obama White House attack on Judicial Watch.We obtained those videos three years ago, thanks to a June 15, 2012, Freedom of Information Act (FOIA) request seeking videos produced by GSA's Northeast Region (known as Region 2) from 2011 through June 2012. Because the agency failed to timely respond to our FOIA request, we filed a lawsuit on May 23, 2013 (Judicial Watch v. U.S. General Services Administration (No. 1:13-cv-00755)).And we won. The court even forced the GSA to reimburse us for expenses.As I told The Washington Times, the GSA's response is outrageous, but not surprising. Welcome to our world. This is what we put up with all the time from the agencies. And we have to ask why White House liaisons are involved in our FOIA request. Judicial Watch apparently is on the Obama administration's enemies' list.The OIG report notes it took nearly a year for the GSA to provide the videos to us, despite the average FOIA response time being about 60 days. On top of that, GSA political operatives snooped around our Internet website and then took away our media status, even though, as it says in the report, ""GSA had granted Judicial Watch press status in the past, most recently for a FOIA request made less than two weeks before.""Judicial Watch was alerted to the existence of these videos by its client Linda Shenwick, a whistleblower in GSA who objected to frivolous expenditures in the GSA's Region 2, the office that produced the videos. Unbelievably, GSA had a policy of encouraging and rewarding employees who produced and performed in the controversial videos. In further retaliation, Ms. Shenwick has since been demoted and effectively removed from her duties.Obviously, the Obama administration did not let the rule of law get in the way of abusing its office to target whistleblowers and Judicial Watch. Just as obvious is the fact that transparent lawlessness in the Clinton-era State Department is but one example of the Obama administration's war against the American people's right to know.The GSA botched several high-profile open records requests, delaying them for months while political appointees got involved, Inspector General Carol F. Ochoa said. The findings were released while the administration was facing charges of slow-walking open records requests for Hillary Clinton's emails, as well as other requests.
In the case of Judicial Watch, the order to strip it of media status came from political operatives with long ties to Democratic causes -- and even from the White House.
var _ndnq = _ndnq || []; _ndnq.push([""embed""]);The inspector general said the decision came at the behest of Gregory Mecher, a former Democratic campaign fundraiser who at the time was liaison to the White House. He is married to Jen Psaki, a longtime spokeswoman with the Obama administration and its election campaigns.
Ms. Ochoa said stripping Judicial Watch of media status violated several agency policies and things got worse when the GSA denied an appeal by the group.SIGN UP"	['Obama']	[]
5	5	http://www.breitbart.com/2016-presidential-race/2016/10/12/trump-campaign-deeply-disturbing-hillary-clinton-may-revealed-classified-information-paid-speech/	Trump Campaign: ‘Deeply Disturbing’ Hillary Clinton May Have Revealed Classified Information in a Paid Speech	"Donald Trump's campaign is responding to a report that Hillary Clinton may have revealed classified information about Osama bin Laden during one of her paid speeches.SIGN UP FOR OUR NEWSLETTERWikiLeaks revealed the allegation.""The revelation that Hillary Clinton may have revealed classified information about the Bin Laden raid in a private, paid speech is deeply disturbing,"" stated Trump's senior communications adviser Jason Miller.He continued: ""Coupled with Clinton keeping classified information on an easily hacked secret server with a subsequent cover-up, shows Clinton has such a disregard for classified information that one has to wonder if she would even be able to receive a security clearance should she be elected president.""Miller was responding to a recent report in The New York Post suggesting that Clinton potentially disclosed classified details relating to bin Laden's raid.""I was in the small group that recommended to the president that he go after bin Laden,"" Clinton stated in a speech to a Toronto organization in 2013, adding:The amount of work that was required to get a strong-enough basis of information on which to plan took more than a decade . . . and then all of a sudden putting this matrix together and saying, 'This guy used to protect bin Laden -- he has just made a phone call. He said this in the phone call. We need to figure out where he is. Then we need to follow him.""'And that is how we found this compound in Abbottabad [Pakistan]' -- where a team of Navy SEALs took out bin Laden in May 2011,"" The New York Post's report notes. ""WikiLeaks asked in a tweet if Clinton's comments revealed too much about the bin Laden hunt by mentioning the phone calls.""""It's unclear whether Clinton's story was classified,"" The New York Post clarifies, adding, ""But what she said in Toronto varies from other accounts of how the United States determined bin Laden's whereabouts.""The amount of work that was required to get a strong-enough basis of information on which to plan took more than a decade . . . and then all of a sudden putting this matrix together and saying, 'This guy used to protect bin Laden -- he has just made a phone call. He said this in the phone call. We need to figure out where he is. Then we need to follow him.SIGN UP"	['Clinton']	[]
6	6	http://www.breitbart.com/2016-presidential-race/2016/10/12/mike-pence-draws-overflow-crowd-to-north-carolina-rally/	Mike Pence Draws Overflow Crowd To North Carolina Rally	"FLETCHER, North Carolina -- Passionate crowds overflowed from the near 400 packed inside to approximately 100 more outside of a campaign rally with Republican vice presidential nominee Gov. Mike Pence in Fletcher, North Carolina.SIGN UP FOR OUR NEWSLETTER""Donald Trump won that debate,"" Pence declared not long after taking the stage in Fletcher. ""Donald Trump's vision won that debate and Donald Trump's ideas and policies to make America great again are gonna win all the way to Pennsylvania Avenue come November the 8th.""RSVPs for Monday's Pence events soared Sunday night. It was the same night that Republican presidential nominee Donald Trump took on Democratic nominee Hillary Clinton in their second, and very contentious, debate. It was a town hall-style format.Pence was introduced in Fletcher by Congressman Mark Meadows who enthusiastically promoted the Indiana governor on the Trump-Pence ticket, to those gathered. Meadows said Pence, a former congressman, would not change when he returns to Washington.""I joined this campaign in a heartbeat,"" Pence said, lauding praise on his running mate Republican presidential nominee Donald Trump. After recognizing the first responders who ""lead into the fight"" and have been coming to the aid of people caught in Hurricane Matthew, he took a moment to address the Trump comments controversy.Ahead of the debate he had expressed hope that America would see what is in Trump's heart during the debate. On Monday Pence said that Trump did indeed show ""the American people what is in his heart."" Pence said that as a Christian he believes in forgiveness and was thankful that Trump apologized and ""I am called to forgive as I am forgiven.""Pence moved on to say, ""The stakes in the election go far beyond what the media is focused on, on any given day. It really has to do with the things that, the things that reach your kitchen table.""At one point he recounted for the crowd, what he called an ""avalanche of scandals and controversies and conflicts of interests flowing just out of the recent Clinton years in public service.""He spoke of the more than 7 in 10 Americans that believe the country is headed in the wrong direction ""at the very moment that America's crying out for change."" He said that in such a year, the ""other party,"" Democratic Party, chose the candidate, Clinton, ""who literally personifies the failed establishment in Washington, D.C.""Pence strongly urged the cheerful crowd to ""work your hearts out the next 28 days,"" that when they tell a good friend it's far more effective than campaign ads and asked them to make sure that Donald Trump is elected the next President of the United States.""28 days everybody, it's going to go by in a blink,"" he said.""I'm encouraged by your enthusiasm,"" Pence closed as he thanked them for coming out for the rally.Just hours earlier in Charlotte, North Carolina, Pence addressed nearly 300 passionate Trump-Pence supporters in a town-hall style event.Follow Michelle Moons on Twitter @MichelleDiana SIGN UP"	['Pence', 'Clinton', 'Trump', 'Meadows']	[]
7	7	http://www.breitbart.com/jerusalem/2016/10/12/pentagon-islamic-state-arming-small-battlefield-drones-explosives/	Pentagon: Islamic State Arming Small Battlefield Drones with Explosives	"WASHINGTON, Oct. 12 (UPI) -- Though they have long used them for surveillance, ISIS is now arming small drones with explosives for use in attacks against American and Kurdish troops in Iraq, American officials say.SIGN UP FOR OUR NEWSLETTERThe Islamic State is now attempting to use small, commercially-available drones armed with explosives to launch attacks at American and Kurdish troops in Iraq, according to the Pentagon, posing a new challenge for the agency.A drone launched by the Islamic State, also known as ISIS, ISIL and Daesh, was shot down in northern Iraq by Kurdish forces last week. The drone, which appeared to be one used for surveillance, was taken back to their outpost for examination and exploded while being taken apart.There have been three attempted drone attacks by ISIS in Iraq in recent weeks, officials say. The other two -- one used to attack a checkpoint and destroyed buildings, and the other shot down by Iraqi troops had a small explosive attached to it -- did not result in any deaths.The most recent of the three drones, however, resulted in the deaths of two Kurdish soldiers and injured two French soldiers when an explosive device inside the drone, disguised as a battery, exploded.Pentagon officials say the drones are nothing like those used by the United States, which are about the size of small passenger planes. ISIS is using smaller drones, similar to those available for purchase on Amazon, and modifying them to carry explosives.""We should have been ready for this, and we weren't,"" said P. W. Singer, a specialist on robotic weaponry at the Washington-based think tank New America.SIGN UPWASHINGTON, Oct. 12 (UPI) --"	[]	[]
8	8	http://www.breitbart.com/jerusalem/2016/10/12/turkish-army-says-islamic-state-putting-stiff-resistance-syria/	Turkish Army says Islamic State Putting up ‘Stiff Resistance’ in Syria	"Islamic State militants in northern Syria are putting up ""stiff resistance"" to attacks by Turkish-backed rebel fighters, Turkey's military said on Wednesday, almost two months after it launched an incursion to drive them away from its border.SIGN UP FOR OUR NEWSLETTERSupported by Turkish tanks and air strikes, the rebels have been pushing towards the Islamic State stronghold of Dabiq. Clashes and air strikes over the past 24 hours have killed 47 jihadists, the military said in a statement.""Due to stiff resistance of the Daesh (Islamic State) terror group, progress could not be achieved in an attack launched to take four settlements,"" it said, naming the areas east of the town of Azaz as Kafrah, Suran, Ihtimalat and Duvaybik.The operation to drive the jihadists away from the Turkish border, dubbed ""Euphrates Shield"", was in its 50th day on Wednesday. The Turkish-backed rebels have seized control of about 1,100 square km (425 square miles) of territory from Islamic State since the operation began, the military said.In a daily round-up, it said 19 Islamic State fighters had been ""neutralized"" in clashes, while eight Turkish-backed rebels were also killed. Twenty-two rebels were wounded but Turkish forces did not suffer any casualties.Turkish warplanes destroyed five buildings used by Islamic State fighters, while U.S.-led coalition jets ""neutralized"" 28 of the jihadists and destroyed three buildings, it said.The operation has also targeted a Kurdish militia whose presence along its border Turkey sees as a threat.SIGN UP"	[]	[]
9	9	http://www.breitbart.com/jerusalem/2016/10/12/uk-labour-promotes-lawmaker-made-holocaust-reference-gaza/	UK Labour Promotes Lawmaker who Made Holocaust Reference on Gaza	"Arutz Sheva reports: The Labour party in Britain continues to make headlines, with its leader Jeremy Corbyn (pictured) promoting a lawmaker who seemingly compared Israel's treatment of Palestinian Arabs to the Holocaust.SIGN UP FOR OUR NEWSLETTERAccording to JTA, Corbyn made Yasmin Qureshi, who has apologized for causing any offense with her remark in 2014, shadow justice minister, a position that makes her Labour's point person on the subject.Qureshi, speaking in England's Westminster Hall a week after International Holocaust Memorial Day in 2014, made the surprising accusation that Israel is conducting a ""holocaust"" against Arabs in Gaza.In her subsequent apology, the Pakistani-born MP denied that she had meant to draw parallels between modern-day Israel and Nazi Germany.""The debate was about the plight of the Palestinian people and in no way did I mean to equate events in Gaza with the Holocaust. I apologize for any offense caused,"" she said. ""I am also personally hurt if people thought I meant this.""Read more here.SIGN UP"	['Israel']	[]
10	10	http://www.breitbart.com/london/2016/10/12/hillary-confirms-via-wikileaks-russia-funds-phony-anti-fracking-groups/	Hillary Confirms via Wikileaks: ‘Phony’ Anti-Fracking Groups Bankrolled by Putin	"Hillary Clinton has confirmed what green activists have long indignantly denied: the big money behind many anti-fracking campaigns comes from Putin's Russia.SIGN UP FOR OUR NEWSLETTERShe admitted this in a private speech on June 18, 2014 which has just been published on Wikileaks.This is the first semi-official confirmation of Russia's sponsorship of the vast, influential and obscenely well-funded anti-fracking industry.As we reported at Breitbart last year, a lot of the Russian money appears to have been funnelled through a shadowy Bermuda-registered company called Klein Ltd, whose directors have strong connections with the Russian government. Over just two years it paid $23 million to the aggressively environmentalist Sea Change Foundation, which in turn distributed the money among smaller organizations.I also brought it up two years earlier for an interview featured in Phelim McAleer and Ann McElhinney's movie FrackNation. We were laughed at at the time as conspiracy theorists. But of course the Russian connection always made perfect sense. The Russian economy is heavily dependent on its natural gas exports and clearly has a vested interest in preventing the adoption of fracking across the world. Hillary's comments - based, no doubt, on US intelligence data - simply confirm what environmentalists would prefer not believe: that far from being cosy, grass-roots, mom-and-pop outfits, anti-fracking groups - and campaigners such as Yoko Ono, Alec Baldwin, Vivienne Westwood and Emma Thompson - are essentially the puppets of Vladimir Putin.FrackNation's makers are now calling on Hillary and the State Department to release the names of all anti-fracking organizations which have received Russian funding.""They are basically acting as paid agents for a hostile foreign power,"" McAleer said. ""This is possibly illegal and is most definitely deeply disturbing and unethical. The State Department needs to name and shame these groups now.""This won't, of course, happen - not least because anti-fracking is one of those areas where Russia's views and those of both the Obama administration and that of its preferred successor Hillary Clinton align almost perfectly.Indeed, anti-fracking is the default position of the entire liberal political and media class, not to mention any number of US foundations (Rockefeller; Hewlett; Packard; Gordon and Betty Moore; etc) built on the proceeds of the capitalist system but now largely dedicated to undermining it.

""They are basically acting as paid agents for a hostile foreign power,"" McAleer said. ""This is possibly illegal and is most definitely deeply disturbing and unethical. The State Department needs to name and shame these groups now.""
SIGN UP""They are basically acting as paid agents for a hostile foreign power,"" McAleer said. ""This is possibly illegal and is most definitely deeply disturbing and unethical. The State Department needs to name and shame these groups now.""This won't, of course, happen - not least because anti-fracking is one of those areas where Russia's views and those of both the Obama administration and that of its preferred successor Hillary Clinton align almost perfectly.Indeed, anti-fracking is the default position of the entire liberal political and media class, not to mention any number of US foundations (Rockefeller; Hewlett; Packard; Gordon and Betty Moore; etc) built on the proceeds of the capitalist system but now largely dedicated to undermining it."	['Clinton', 'Obama']	[]
11	11	http://www.breitbart.com/jerusalem/2016/10/12/cruz-ros-lehtinen-criticize-un-resolution-ignore-jewish-ties-jerusalem/	Cruz, Ros-Lehtinen Criticize UN Resolution that Would Ignore Jewish Ties to Jerusalem	"The Washington Examiner reports: Sen. Ted Cruz, R-Texas, and Rep. Ileana Ros-Lehtinen, R-Fla., sent a letter this week to the Executive Board of the United Nations Educational, Scientific and Cultural Organization protesting a resolution the U.S. lawmakers say is part of a wider effort to delegitimize Israel.SIGN UP FOR OUR NEWSLETTER""The United Nations' obsessive hostility towards Israel will be on display yet again this week as UNESCO considers another blatantly biased resolution that unjustly singles out our close ally Israel with false accusations and criticism, and attempts to erase the specific deep-rooted, historical connection of Jews and Christians to Jerusalem, Israel's eternal capital,"" Cruz's office said Tuesday.The Texas senator and Florida congresswoman were joined in their letter by 39 of their congressional colleagues.""For thousands of years, Jerusalm [sic] has played a defining, central role in the history and identity of the Jewish people,"" Cruz's office said. ""For Christians, Jerusalem is a seminal spiritual site. This resolution flies in the face of, among other things, science as recent archeological excavations, notably in the City of David, have revealed incontrovertible, physical evidence that reaffirms Jewish and Christian ties to the holy city of Jerusalem. Members of the UNESCO Executive Board should vote against this intentional campaign to deny these historical truths, rewrite the history of Jerusalem, and delegitimize Israel.""Read more here.SIGN UP"	['Israel']	[]
12	12	http://www.breitbart.com/big-government/2016/10/12/new-deplorables-clinton-campaign-staffers-trash-conservative-catholics/	The New ‘Deplorables’: Clinton Campaign Staffers Trash Conservative Catholics	"In a new Wikileaks disclosure, key figures in the Clinton campaign reveal a visceral anti-Catholicism, attacking Rupert Murdoch for raising his children Catholic and calling conservative Catholicism ""an amazing bastardization of the faith.""SIGN UP FOR OUR NEWSLETTERTuesday's release of more than 1,000 hacked emails of John Podesta, chairman of Hillary Clinton's campaign, includes a 2011 thread called ""Conservative Catholicism"" between Podesta, Hillary for America Communications Director Jennifer Palmieri, and John Halpin, senior fellow at the Center for American Progress where Podesta served as Chairman of the Board at the time.In an email message to Podesta and Palmieri, Halpin cites a New Yorker article on media mogul Rupert Murdoch and the fact that he and then-managing editor for the Wall Street Journal, Robert Thompson, were raising their kids Catholic.""Friggin' Murdoch baptized his kids in the Jordan where John the Baptist baptized Jesus,"" he lamented.Halpin further complains that many of the ""most powerful elements of the conservative movement are all Catholic (many converts) from the SC and think tanks to the media and social groups.""""It's an amazing bastardization of the faith,"" he continues. ""They must be attracted to the systematic thought and severely backward gender relations and must be totally unaware of Catholic democracy.""In her response, Jennifer Palmieri wrote, ""I imagine they think it is the most socially acceptable politically conservative religion. Their rich friends wouldn't understand if they became evangelicals.""""They can throw around 'Thomistic' thought and 'subsidiarity' and sound sophisticated because no one knows what the hell they're talking about,"" she said.Bill Donahue, founder of the Catholic League for Religious and Civil Rights, was quick to decry the ""bigoted comments"" coming from key members of the Clinton campaign, noting that their ""contempt for Catholicism is palpable.""Donahue called on presidential candidate Hillary Clinton to react swiftly to the revelations, declaring that she ""has a moral obligation to sanction Podesta and Palmieri immediately.""Follow Thomas D. Williams on Twitter  Follow @tdwilliamsromeSIGN UP"	['Jordan', 'Clinton', 'Williams']	[]
