	Unnamed: 0	Link	Title	Text	Terms	Topics
22	22	http://www.breitbart.com/big-government/2016/10/11/wikileaks-hillary-clinton-ask-business-lobby-washington-spending-immigrants/	Wikileaks: Eight Times Hillary Clinton Asked Businesses to Lobby Washington for More Spending, More Immigrants	"Hillary Clinton asked business groups numerous times in 2013 and 2014 to play a larger role in federal decision making, according to a campaign document released by Wikileaks. SIGN UP FOR OUR NEWSLETTERThe hacked document includes the most politically awkward statements in Clinton's many paid speeches to business groups, including Goldman Sachs. In those speeches, Clinton urged business groups to back Republicans facing opposition from the Tea Party, to defund Republicans who wanted to trim spending on the 2012 storm aid for New Jersey, and to support Republicans and Democratic legislators who drafted the 2013 immigration expansion bill. She urged the business groups to lobby legislators for more H-1B outsourcing visas, to support Republicans who endorsed the 2013 decision to raise the federal government's credit-limit,  and to oppose Sen. Ted Cruz for his 2012 effort to defund the Obamacare health network.She did not mention Cruz, but she criticized a ""very few [Senators] in the Senate ... holding hostage the entire rest of the government and putting the full faith in [sic] credit of the United States at risk."" That's likely a reference to the 2013 Senate debate when Cruz tried to defund Obamacare.Here's are some of the examples cited in the Clinton campaign document.Hillary Clinton Said Moderate Voices In Congress Need More Support, Citing Eight-Senator Immigration Compromise. ""So we got to make sure that we begin listening to each other, we begin to reward people who try to make the tough decisions in the middle like these eight senators on immigration for republicans and for democrats. You know, they've got to be given support because they're trying to solve a real problem, and then we have to keep looking for more and more ways to do that as well."" [Hillary Clinton remarks to Apollo Global Management, 5/13/13]Hillary Clinton Said She Admired Peter King Because He Told New York Donors To Not Give Money To Republicans Who Voted Against Sandy Aid. ""MS. CLINTON:  Well, you know, I really admire Peter King.  He's a Republican representative from Long Island.  He and I did a lot of work together after 9/11 on terrorism and all of that.  But when the vote on Sandy came up--and a lot of Republicans voted against aid for New York and New Jersey, Peter King said to the New York funders:  Don't give any of them any money because somehow you have to get their attention. So I thought it was pretty clever.  I know what it's like.  I mean, everybody is New York on Mondays."" [ Speech to Goldman Sachs, 2013 IBD Ceo Annual Conference, 6/4/13]Hillary Clinton Said Politicians Treat NYC Like An ATM And ""Political Givers"" Need To Tell Politicians ""Here Are Things I Want You To Do For The Country."" ""So I think that we're going to have to take seriously how we fund disasters, but I think Peter's point was a larger one, which is--you know, New York is kind of an ATM machine for both Democrats and Republicans, and people come up and they visit with many of you and they ask for money, and often they're given--if they're coming they're going to get it.  And at some point the American public--and particularly political givers--have to say:  Here--and it's not just about me.  It's not just about my personal standings.  Here are things I want you to do for the country and be part of that debate about the country."" [ Speech to Goldman Sachs, 2013 IBD Ceo Annual Conference, 6/4/13]Clinton Said The Business View Speaking Out During The Debt Limit Debate Was Helpful In Getting Through The Crisis. ""So what you saw was a relatively small group in the House of Representatives and very few in the Senate who were trying to achieve one objective, namely make a political point about the health care law by holding hostage the entire rest of the government and putting the full faith in credit of the United States at risk. Although it went up to the last hour, the fact that they were a minority and that there were much more level heads, even in the same political party, that the business view started speaking out after having been relatively silent, thinking this is going to work out, but then people of experience and expertise began speaking out, it was possible to get through that crisis."" [Goldman Sachs AIMS Alternative Investments Symposium, 10/24/13]Clinton Said That Because Candidates Needed Money From Wall Street To Run For Office, People In New York Needed To Ask Tough Questions About The Economy Before Handing Over Campaign Contributions. ""Secondly, running for office in our country takes a lot of money, and candidates have to go out and raise it.  New York is probably the leading site for contributions for fundraising for candidates on both sides of the aisle, and it's also our economic center. And there are a lot of people here who should ask some tough questions before handing over campaign contributions to people who were really playing chicken with our whole economy."" [Goldman Sachs AIMS Alternative Investments Symposium, 10/24/13]Clinton Encouraged Attendees Of The ASCP Annual Meeting In Chicago To ""Spend Some Money, Because [Emanuel] Probably Has Surveillance Watching To Determine Who Does And Doesn't.""  ""Thank you so much.  I'm deeply honored to receive this award from such an esteemed organization.  I know that the mayor is rushing off to his next assigned event and responsibility.  I just want to thank him and tell you that reliving a lot of my experiences with Rahm makes me once again realize how much you want him in any foxhole you end up in, maybe not at Buckingham Palace for tea with the Queen, but for any other challenging situation, he always had my back. He always had both President Clinton's and President Obama's back, and now he's got Chicago's back.  So if I were you, I would find some way to go spend some money because he probably has surveillance watching to determine who does and who doesn't."" [American Society for Clinical Pathology Annual Meeting, 9/18/13]Hillary Clinton Praised Lamar Alexander For Standing Against Tea Party Extremism. ""SECRETARY CLINTON:  Yeah.  You want them to prove it by saying, you know, we're going to act differently in our voting and our giving.  And it could make a very big difference.              Now, some of the Republicans are also fighting back.  I mean, somebody like Lamar Alexander, who's been a governor and a senator of Tennessee, and they're mounting a Tea Party challenge against him.  He's going right at it.  He is not afraid to take them on.  And more moderate Republicans have to do that as well.  Take back their party from the extremists and the obstructionists."" [Goldman Sachs Builders And Innovators Summit, 10/29/13]Hillary Clinton Said It Was ""Essential to Keep Focused On the Visa Issue"" When H1B Visas Were Brought Up. ""PHIL FERNANDEZ: Thank you [...] 40 CEOs said like to a person, H1B, you know, we need more H1Bs. HILLARY CLINTON: Right. [...] So let me just make three quick points. One, I think it's essential to keep focused on the visa issue, because that's a discrete problem that even though I'd like to see it be part of an overall, comprehensive reform, you have to keep pushing to open the aperture, you know, get more and more opportunities."" [Hillary Clinton Remarks at Marketo, 4/8/14]Read the full document attached to this email. 

Hillary Clinton Said Moderate Voices In Congress Need More Support, Citing Eight-Senator Immigration Compromise. ""So we got to make sure that we begin listening to each other, we begin to reward people who try to make the tough decisions in the middle like these eight senators on immigration for republicans and for democrats. You know, they've got to be given support because they're trying to solve a real problem, and then we have to keep looking for more and more ways to do that as well."" [Hillary Clinton remarks to Apollo Global Management, 5/13/13]
Hillary Clinton Said She Admired Peter King Because He Told New York Donors To Not Give Money To Republicans Who Voted Against Sandy Aid. ""MS. CLINTON:  Well, you know, I really admire Peter King.  He's a Republican representative from Long Island.  He and I did a lot of work together after 9/11 on terrorism and all of that.  But when the vote on Sandy came up--and a lot of Republicans voted against aid for New York and New Jersey, Peter King said to the New York funders:  Don't give any of them any money because somehow you have to get their attention. So I thought it was pretty clever.  I know what it's like.  I mean, everybody is New York on Mondays."" [ Speech to Goldman Sachs, 2013 IBD Ceo Annual Conference, 6/4/13]
Hillary Clinton Said Politicians Treat NYC Like An ATM And ""Political Givers"" Need To Tell Politicians ""Here Are Things I Want You To Do For The Country."" ""So I think that we're going to have to take seriously how we fund disasters, but I think Peter's point was a larger one, which is--you know, New York is kind of an ATM machine for both Democrats and Republicans, and people come up and they visit with many of you and they ask for money, and often they're given--if they're coming they're going to get it.  And at some point the American public--and particularly political givers--have to say:  Here--and it's not just about me.  It's not just about my personal standings.  Here are things I want you to do for the country and be part of that debate about the country."" [ Speech to Goldman Sachs, 2013 IBD Ceo Annual Conference, 6/4/13]
Clinton Said The Business View Speaking Out During The Debt Limit Debate Was Helpful In Getting Through The Crisis. ""So what you saw was a relatively small group in the House of Representatives and very few in the Senate who were trying to achieve one objective, namely make a political point about the health care law by holding hostage the entire rest of the government and putting the full faith in credit of the United States at risk. Although it went up to the last hour, the fact that they were a minority and that there were much more level heads, even in the same political party, that the business view started speaking out after having been relatively silent, thinking this is going to work out, but then people of experience and expertise began speaking out, it was possible to get through that crisis."" [Goldman Sachs AIMS Alternative Investments Symposium, 10/24/13]
Clinton Said That Because Candidates Needed Money From Wall Street To Run For Office, People In New York Needed To Ask Tough Questions About The Economy Before Handing Over Campaign Contributions. ""Secondly, running for office in our country takes a lot of money, and candidates have to go out and raise it.  New York is probably the leading site for contributions for fundraising for candidates on both sides of the aisle, and it's also our economic center. And there are a lot of people here who should ask some tough questions before handing over campaign contributions to people who were really playing chicken with our whole economy."" [Goldman Sachs AIMS Alternative Investments Symposium, 10/24/13]
Clinton Encouraged Attendees Of The ASCP Annual Meeting In Chicago To ""Spend Some Money, Because [Emanuel] Probably Has Surveillance Watching To Determine Who Does And Doesn't.""  ""Thank you so much.  I'm deeply honored to receive this award from such an esteemed organization.  I know that the mayor is rushing off to his next assigned event and responsibility.  I just want to thank him and tell you that reliving a lot of my experiences with Rahm makes me once again realize how much you want him in any foxhole you end up in, maybe not at Buckingham Palace for tea with the Queen, but for any other challenging situation, he always had my back. He always had both President Clinton's and President Obama's back, and now he's got Chicago's back.  So if I were you, I would find some way to go spend some money because he probably has surveillance watching to determine who does and who doesn't."" [American Society for Clinical Pathology Annual Meeting, 9/18/13]
Hillary Clinton Praised Lamar Alexander For Standing Against Tea Party Extremism. ""SECRETARY CLINTON:  Yeah.  You want them to prove it by saying, you know, we're going to act differently in our voting and our giving.  And it could make a very big difference.              Now, some of the Republicans are also fighting back.  I mean, somebody like Lamar Alexander, who's been a governor and a senator of Tennessee, and they're mounting a Tea Party challenge against him.  He's going right at it.  He is not afraid to take them on.  And more moderate Republicans have to do that as well.  Take back their party from the extremists and the obstructionists."" [Goldman Sachs Builders And Innovators Summit, 10/29/13]
Hillary Clinton Said It Was ""Essential to Keep Focused On the Visa Issue"" When H1B Visas Were Brought Up. ""PHIL FERNANDEZ: Thank you [...] 40 CEOs said like to a person, H1B, you know, we need more H1Bs. HILLARY CLINTON: Right. [...] So let me just make three quick points. One, I think it's essential to keep focused on the visa issue, because that's a discrete problem that even though I'd like to see it be part of an overall, comprehensive reform, you have to keep pushing to open the aperture, you know, get more and more opportunities."" [Hillary Clinton Remarks at Marketo, 4/8/14]
SIGN UPHillary Clinton asked business groups numerous times in 2013 and 2014 to play a larger role in federal decision making, according to a campaign document released by Wikileaks. The hacked document includes the most politically awkward statements in Clinton's many paid speeches to business groups, including Goldman Sachs. In those speeches, Clinton urged business groups to back Republicans facing opposition from the Tea Party, to defund Republicans who wanted to trim spending on the 2012 storm aid for New Jersey, and to support Republicans and Democratic legislators who drafted the 2013 immigration expansion bill. She urged the business groups support Republicans who endorsed the 2013 decision to raise the federal government's credit-limit,  and to oppose Sen. Ted Cruz for his 2012 effort to defund the Obamacare health network.She did not mention Cruz, but she criticized a ""very few [Senators] in the Senate ... Here's are some of the examples cited in the Clinton campaign document.Hillary Clinton Said Moderate Voices In Congress Need More Support, Citing Eight-Senator Immigration Compromise. ""So we got to make sure that we begin listening to each other, we begin to reward people who try to make the tough decisions in the middle like these eight senators on immigration for republicans and for democrats. You know, they've got to be given support because they're trying to solve a real problem, and then we have to keep looking for more and more ways to do that as well."" [Hillary Clinton remarks to Apollo Global Management, 5/13/13]Hillary Clinton Said She Admired Peter King Because He Told New York Donors To Not Give Money To Republicans Who Voted Against Sandy Aid. ""MS. CLINTON:  Well, you know, I really admire Peter King.  He's a Republican representative from Long Island.  He and I did a lot of work together after 9/11 on terrorism and all of that.  But when the vote on Sandy came up--and a lot of Republicans voted against aid for New York and New Jersey, Peter King said to the New York funders:  Don't give any of them any money because somehow you have to get their attention. So I thought it was pretty clever.  I know what it's like.  I mean, everybody is New York on Mondays."" [ Speech to Goldman Sachs, 2013 IBD Ceo Annual Conference, 6/4/13]  Hillary Clinton Said Politicians Treat NYC Like An ATM And ""Political Givers"" Need To Tell Politicians ""Here Are Things I Want You To Do For The Country."" ""So I think that we're going to have to take seriously how we fund disasters, but I think Peter's point was a larger one, which is--you know, New York is kind of an ATM machine for both Democrats and Republicans, and people come up and they visit with many of you and they ask for money, and often they're given--if they're coming they're going to get it.  And at some point the American public--and particularly political givers--have to say:  Here--and it's not just about me.  It's not just about my personal standings.  Here are things I want you to do for the country and be part of that debate about the country."" [ Speech to Goldman Sachs, 2013 IBD Ceo Annual Conference, 6/4/13]Clinton Encouraged Attendees Of The ASCP Annual Meeting In Chicago To ""Spend Some Money, Because [Emanuel] Probably Has Surveillance Watching To Determine Who Does And Doesn't.""  ""Thank you so much.  I'm deeply honored to receive this award from such an esteemed organization.  I know that the mayor is rushing off to his next assigned event and responsibility.  I just want to thank him and tell you that reliving a lot of my experiences with Rahm makes me once again realize how much you want him in any foxhole you end up in, maybe not at Buckingham Palace for tea with the Queen, but for any other challenging situation, he always had my back. He always had both President Clinton's and President Obama's back, and now he's got Chicago's back.  So if I were you, I would find some way to go spend some money because he probably has surveillance watching to determine who does and who doesn't."" [American Society for Clinical Pathology Annual Meeting, 9/18/13]Hillary Clinton Praised Lamar Alexander For Standing Against Tea Party Extremism. ""SECRETARY CLINTON:  Yeah.  You want them to prove it by saying, you know, we're going to act differently in our voting and our giving.  And it could make a very big difference.              Now, some of the Republicans are also fighting back.  I mean, somebody like Lamar Alexander, who's been a governor and a senator of Tennessee, and they're mounting a Tea Party challenge against him.  He's going right at it.  He is not afraid to take them on.  And more moderate Republicans have to do that as well.  Take back their party from the extremists and the obstructionists."" [Goldman Sachs Builders And Innovators Summit, 10/29/13]              Hillary Clinton Said It Was ""Essential to Keep Focused On the Visa Issue"" When H1B Visas Were Brought Up. ""PHIL FERNANDEZ: Thank you [...] 40 CEOs said like to a person, H1B, you know, we need more H1Bs. HILLARY CLINTON: Right. [...] So let me just make three quick points. One, I think it's essential to keep focused on the visa issue, because that's a discrete problem that even though I'd like to see it be part of an overall, comprehensive reform, you have to keep pushing to open the aperture, you know, get more and more opportunities."" [Hillary Clinton Remarks at Marketo, 4/8/14]Read the full document attached to this email. "	['Cruz', 'Clinton', 'Long', 'Alexander']	[]
23	23	http://www.breitbart.com/2016-presidential-race/2016/10/11/obama-ridicules-christians-forgive-donald-trump/	Obama Ridicules Christians Who Say They Forgive Donald Trump	"President Barack Obama ridiculed Republicans -- particularly Christians -- who said they forgave Donald Trump after a 2005 video was leaked featuring him making lewd comments about women.SIGN UP FOR OUR NEWSLETTER""I hear people saying, 'I'm a Christian and so I'm all about forgiveness because nobody's perfect,'"" Obama said, adding that he himself was a Christian who believed in redemption for people who made mistakes.""If someone does something terrible ... I can forgive 'em, I suppose, if they're sincere about it, but I don't want them necessarily leading the country,"" he said.Obama said that it was impossible for both Christians and Republicans to continue to denounce Trump's comments but to still support him for president.""You can't have it both ways here,"" he said. ""You can't repeatedly denounce what is said by someone and then say, 'But I'm still going to endorse them to be the most powerful person in the planet and to put them in charge.'""He ridiculed Republicans for suddenly running away from Trump after standing by him despite offensive comments.""We saw this coming, he's been saying really bad things for a while now. What did you think? He's just going to transform himself?"" Obama asked. ""I mean, I'm 55, I know it's hard for me to change, I know at 70 it's going to be harder.""Obama said that Trump's comments about women were unacceptable, adding that someone who acted like that couldn't get hired at a 7/11, let alone become president of the United States.""You don't have to be a husband or father to say, 'That's not right.' You just have to be a decent human being,"" he said.SIGN UP"	['Trump', 'Obama']	[]
24	24	http://www.breitbart.com/big-government/2016/10/11/donald-trump-hillary-wants-dismantle-2nd-amendment-not-security-detail/	Donald Trump: Hillary ‘Wants to Dismantle Our 2nd Amendment,’ Why Not Dismantle Her Security Detail?	"During his October 11 speech in Panama City, Florida, Donald Trump said Hillary Clinton ""wants to dismantle our Second Amendment"" and asked why she can't start by dismantling her armed security detail.SIGN UP FOR OUR NEWSLETTERTrump segued into his Second Amendment comments by talking about Clinton's relationship with law enforcement personnel:We've all read the reports and heard the stories about how disrespectfully she treats law enforcement, how disrespectful she is to the Secret Service and many others in uniform-even [those] there to protect her. And by the way, these are weapon-carrying people. They carry weapons. Hillary Clinton wants to dismantle our Second Amendment, so maybe she should start with her security people not carrying weapons.On August 7, Breitbart News reported that Clinton ""snubbed"" the National Fraternal Order of Police (NFOP). The president of the NFOP -- Chuck Canterbury -- said he was ""disappointed and shocked"" that Clinton ""declined"" to even return a candidate questionnaire which had been sent to her campaign. Canterbury said the only other candidate to ever refuse to answer the questionnaire was John Kerry in 2004.Additionally, the October 7 Wikileaks release contained an email from Clinton's press secretary explaining that she is planning to use an ""executive order"" to implement gun control that Congress has rejected for decades. And during the October 9 presidential debate, part of Clinton's response to a question about the future of the Supreme Court was her emphasis on all the gun controls she wants to put in place.On the other hand, Trump was endorsed by the National Fraternal Order of Police and he pledged to nominate Supreme Court justices ""in the mold of Justice Scalia."" He described such justices as an integral part of guarding the Second Amendment, ""which is totally under siege by people like Hillary Clinton.""AWR Hawkins is the Second Amendment columnist for Breitbart News and political analyst for Armed American Radio. Follow him on Twitter: @AWRHawkins. Reach him directly at awrhawkins@breitbart.com.We've all read the reports and heard the stories about how disrespectfully she treats law enforcement, how disrespectful she is to the Secret Service and many others in uniform-even [those] there to protect her. And by the way, these are weapon-carrying people. They carry weapons. Hillary Clinton wants to dismantle our Second Amendment, so maybe she should start with her security people not carrying weapons.SIGN UP"	['Clinton', 'Trump']	[]
25	25	http://www.breitbart.com/big-government/2016/10/11/mother-charged-endangerment-vegan/	Mother Charged with Child Endangerment for Feeding Son Extreme Vegan Diet	"A woman taking her vegan diet to the extreme is accused of feeding her son only fruit and nuts.SIGN UP FOR OUR NEWSLETTERElizabeth Hawk, 33, is charged with child welfare endangerment for not giving her son enough food due to a strict vegan diet, KDKA reports.Brandy Hawk, the baby's aunt, said she noticed the boy had some physical problems and developed a severe rash that concerned her.""It was his motor skills; he couldn't use his hands at all."" Brandy Hawk tells KDKA.The boy's mother, Elizabeth, said to Brandy that the boy just had ""allergies"" and that there was nothing to worry about.Brandy didn't believe her and neither did the father, Jerry Hawk.Jerry brought the 11-month-old to a hospital, where a doctor said that the boy's development was delayed due to malnourishment and that not treating him for the rash was ""inhumane.""He told doctors that Elizabeth was ""obsessed"" with a strict, vegan diet.The boy's father has custody of the baby and the couple's two other children.Jerry and other family members say the boy's condition is improving.Elizabeth Hawk remains free on her own recognizance. There is no court date set yet for a preliminary hearing.SIGN UP"	[]	[]
