	Link	Title	Text
18	http://www.breitbart.com/jerusalem/2016/11/10/israeli-president-visit-india-next-week/	Israeli President To Visit India Next Week	"The Times of Israel reports: President Reuven Rivlin is to travel to India for an official visit next week, his office said Wednesday in a sign of increasingly close relations between the two countries.SIGN UP FOR OUR NEWSLETTERRivlin was invited by his Indian counterpart Pranab Mukherjee ""in order to strengthen the cooperation and the fruitful relations between the two countries,"" a statement from Rivlin's office said.It follows a visit by Mukherjee last year to Israel.Indian media reported that the trip was likely to pave the way for a historic first visit of an Indian prime minister to Israel.During the week-long visit starting November 14, Rivlin will meet with Indian Prime Minister Narendra Modi and Minister of External Affairs Sushma Swaraj, and other Indian leaders.Read more here.SIGN UP"
19	http://www.breitbart.com/london/2016/11/10/trump-victory-totally-rains-un-climate-parade/	Trump Victory Totally Rains On UN Climate Summit’s Parade	"The latest UN climate summit - COP22 in Marrakech, Morocco this time - has been tragically overshadowed by the dark cloud of Donald Trump's victory.SIGN UP FOR OUR NEWSLETTERDelegates are trying to put a brave face on it, according to this tear-by-bitter-tear live update from the summit:The reaction from the NGO community to Trump's victory has been tightly coordinated, professional and constructive. They pivoted swiftly from stressing the significance of the choice between the two candidates for the climate, to downplaying Trump's ability to derail the great green economic shift.But it has thrown negotiations into turmoil - for the US team at least because they now know they're toast:Spare a thought for the US negotiators right now. Technically, they still answer to the Obama administration, but they cannot promise anything Trump's people would overturn.This is the team that worked closely with China to make build consensus for the Paris Agreement and get it ratified early. They will soon be out of a job, watching from the sidelines as the new administration attacks that progress.Many tears are being shed, possibly contributing dangerously to global sea-level rise.""I'm 18 years old and voted for the first time for Hillary Clinton a few days before I left for COP. My heart is absolutely broken at the election of Trump. I have a president who no longer values who I am as a young woman or the child of immigrants,"" said Becky Chung, SustainUS delegate from Buena Park, California.To add to the greenies' misery, coal stocks have risen:While renewable stocks have plummeted. One of the many victims of Trump's victim is Vestas, the world's largest manufacturer of wind turbines. At one point their stock had fallen by as much as 14 per cent.According to an Ernst & Young LLP survey published last month, the U.S. stands to lose its position as the top-ranked renewable-energy market for investors under a Trump administration.Trump has made clear ""he hates wind turbines and will do what he can to fight them,"" Jacob Pedersen, head of equity analysis at Sydbank, said earlier this month.Yep. Trump really hates wind turbines. This presidency is going to be fun.The reaction from the NGO community to Trump's victory has been tightly coordinated, professional and constructive. They pivoted swiftly from stressing the significance of the choice between the two candidates for the climate, to downplaying Trump's ability to derail the great green economic shift.Spare a thought for the US negotiators right now. Technically, they still answer to the Obama administration, but they cannot promise anything Trump's people would overturn.
This is the team that worked closely with China to make build consensus for the Paris Agreement and get it ratified early. They will soon be out of a job, watching from the sidelines as the new administration attacks that progress.""I'm 18 years old and voted for the first time for Hillary Clinton a few days before I left for COP. My heart is absolutely broken at the election of Trump. I have a president who no longer values who I am as a young woman or the child of immigrants,"" said Becky Chung, SustainUS delegate from Buena Park, California.According to an Ernst & Young LLP survey published last month, the U.S. stands to lose its position as the top-ranked renewable-energy market for investors under a Trump administration.
Trump has made clear ""he hates wind turbines and will do what he can to fight them,"" Jacob Pedersen, head of equity analysis at Sydbank, said earlier this month.var _ndnq = _ndnq || []; _ndnq.push([""embed""]);SIGN UP"
20	http://www.breitbart.com/jerusalem/2016/11/10/pro-israel-groups-post-giant-pinocchio-near-un/	Pro-Israel Groups to Post Giant Pinocchio Near UN	"The Algemeiner reports: Pro-Israel groups will erect a giant Pinocchio effigy across from the United Nations headquarters in New York City in protest of the recent resolutions passed by its cultural body, UNESCO, which deny Jewish and Christian connections to Jerusalem.SIGN UP FOR OUR NEWSLETTERThe Pinocchio display will be put up in Dag Hammarskjold Plaza across from the UN following a ""We Stand Together"" rally at New York City's Israeli Consulate Thursday afternoon. The rally is organized by AMCHA-Coalition for Jewish Concerns and co-sponsored by StandWithUs New York and other groups.Roz Rothstein, CEO of StandWithUs, said UNESCO through its resolutions not only negates 3,000 years of Jewish roots in Jerusalem, but also ""deprecates and belittles"" Judaism.""These are lies that betray UNESCO's own mandate to 'contribute to peace and security by promoting collaboration among the nations through education, science and culture.' Instead of contributing to peace by building bridges between Israel and its Arab neighbors, UNESCO has become a vehicle for fomenting conflict and strife,"" Rothstein said.Read more here.SIGN UP"
21	http://www.breitbart.com/jerusalem/2016/11/10/warming-iran-egypt-steps-attacks-sinai-jihadists/	Egypt Steps Up Attacks on Sinai Jihadists	The Egyptian army has stepped up its campaign against Islamic State loyalists in the Sinai Peninsula against the backdrop of a warming of relations between Cairo and Tehran.SIGN UP FOR OUR NEWSLETTEROver the last few days, 50 IS fighters were reportedly killed and 30 were wounded, and vehicles were destroyed. According to reports in the pro-Iranian media, the Egyptian army shelled a gathering of militants in the village of Almuqataa, near Sheik Zuweid, leading to numerous casualties.Egyptian officials told state media outlets that the attack pre-empted a coordinated IS attack on military installations using APVs, motorcycles and RPG weapons. The officials added that some 30 militants have been arrested in villages near Rafah and Sheikh Zuweid. Pro-Iranian, pro-Hezbollah and pro-Syrian media outlets have shown growing interest in the Egyptian army's Sinai campaign, a possible testament to a future rapprochement between the Iran-allies and Cairo, as Egypt's relations with Saudi Arabia and other rivals of Iran in the Persian Gulf have continued to deteriorate. Hezbollah's Al Manar TV and other sympathizing stations have highlighted the news of the Egyptian army's success against the militants. Pro-Iranian and pro-Assad news sites in Iraq and Syria also covered the Sinai campaign favorably. SIGN UPOver the last few days, 50 IS fighters were reportedly killed and 30 were wounded, and vehicles were destroyed. According to reports in the pro-Iranian media, the Egyptian army shelled a gathering of militants in the village of Almuqataa, near Sheik Zuweid, leading to numerous casualties.Egyptian officials told state media outlets that the attack pre-empted a coordinated IS attack on military installations using APVs, motorcycles and RPG weapons. The officials added that some 30 militants have been arrested in villages near Rafah and Sheikh Zuweid. Pro-Iranian, pro-Hezbollah and pro-Syrian media outlets have shown growing interest in the Egyptian army's Sinai campaign, a possible testament to a future rapprochement between the Iran-allies and Cairo, as Egypt's relations with Saudi Arabia and other rivals of Iran in the Persian Gulf have continued to deteriorate. Hezbollah's Al Manar TV and other sympathizing stations have highlighted the news of the Egyptian army's success against the militants. 
22	http://www.breitbart.com/california/2016/11/09/massive-anti-trump-protest-shuts-101-freeway-l/	Massive anti-Trump Protest Shuts Down 101 Freeway in L.A.	"LOS ANGELES, California -- Thousands of anti-Trump protesters marched downtown Wednesday night and blocked traffic on the 101 Freeway to show their displeasure at Donald Trump's election as President of the United States.SIGN UP FOR OUR NEWSLETTER""This is not something you would ever see in L.A.,"" said the CBS Los Angeles reporter on the scene.The Los Angeles protest is just one of many around the country in major cities. Earlier Wednesday, in the wee hours of the morning, riots broke out in several West Coast cities, and on college campuses, as Hillary Clinton supporters struggled to deal with the election result.In her concession speech on Wednesday morning in New York -- delayed from the night before, when Clinton campaign chair John Podesta appeared to reject defeat -- Hillary Clinton urged Americans to accept the election result:We have seen that our nation is more deeply divided than we thought. But I still believe in America and I always will. And if you do, then we must accept this result and then look to the future. Donald Trump is going to be our president. We owe him an open mind and the chance to lead.Our constitutional democracy enshrines the peaceful transfer of power and we don't just respect that, we cherish it. It also enshrines other things; the rule of law, the principle that we are all equal in rights and dignity, freedom of worship and expression. We respect and cherish these values too and we must defend them.CBS Los Angeles reports that Wednesday evening's protests are still ""mostly peaceful,"" though they involved vandalism.The 101 Freeway is a major east-west artery connecting downtown Los Angeles to Ventura via the San Fernando Valley.Photo credit: @4n0nc47 / TwitterJoel B. Pollak is Senior Editor-at-Large at Breitbart News. His new book, See No Evil: 19 Hard Truths the Left Can't Handle, is available from Regnery through Amazon. Follow him on Twitter at @joelpollak.We have seen that our nation is more deeply divided than we thought. But I still believe in America and I always will. And if you do, then we must accept this result and then look to the future. Donald Trump is going to be our president. We owe him an open mind and the chance to lead.
Our constitutional democracy enshrines the peaceful transfer of power and we don't just respect that, we cherish it. It also enshrines other things; the rule of law, the principle that we are all equal in rights and dignity, freedom of worship and expression. We respect and cherish these values too and we must defend them.SIGN UP"
23	http://www.breitbart.com/big-government/2016/11/09/amnesty-rnc-2012-autopsy-said-immigration-reform-path-victory/	RNC’s 2012 ‘Autopsy’ Said Amnesty Was Only Path to Victory	"After the disappointment of the 2012 elections, the Republican National Committee commissioned an ""autopsy"" to examine the party's flaws, and ways to move forward. One of the key recommendations: the party must ""must embrace and champion comprehensive immigration reform.""SIGN UP FOR OUR NEWSLETTERThere was virtually no discussion in the document of that highly controversial claim, which was made almost in passing, as if the party would swiftly reach consensus on immigration reform and pass it without much debate.That sentiment reflected the prevailing orthodoxy among conservative pundits, as well. On November 8, 2012 -- four years to the day before Donald Trump's amazing victory -- the estimable Charles Krauthammer wrote:Hispanics ... should be a natural Republican constituency: striving immigrant community, religious, Catholic, family-oriented and socially conservative (on abortion, for example).The principal reason they go Democratic is the issue of illegal immigrants. In securing the Republican nomination, Mitt Romney made the strategic error of (unnecessarily) going to the right of Rick Perry. Romney could never successfully tack back.For the party in general, however, the problem is hardly structural. It requires but a single policy change: Border fence plus amnesty. Yes, amnesty. Use the word. Shock and awe -- full legal normalization (just short of citizenship) in return for full border enforcement.Amnesty -- as soon as possible. That was the conventional wisdom in Washington. But conservatives surprised the GOP establishment by resisting amnesty, by insisting on debating the fundamental issue of who is to become an American, and how.And President-elect Donald Trump shocked the political world by riding to the presidency on opposition to amnesty.What the Republican establishment underestimated was how deeply Americans -- including key Democratic constituencies, and even legal immigrants -- resented amnesty. For some, it was a matter of economic competition. For others, it was a matter of the rule of law. And for others, it was a matter of cultural coherence.Regardless, Donald Trump reached voters that the GOP had long forgotten by promising to ""build a wall"" with a ""big, beautiful door.""It was not a call to xenophobia. It was a claim that the diversity that Americans have always cherished -- e pluribus unum -- rested on the foundations of secure borders, and law enforcement, and fairness.If we don't have a border, Trump argued, we don't have a country.Joel B. Pollak is Senior Editor-at-Large at Breitbart News. His new book, See No Evil: 19 Hard Truths the Left Can't Handle, is available from Regnery through Amazon. Follow him on Twitter at @joelpollak.Hispanics ... should be a natural Republican constituency: striving immigrant community, religious, Catholic, family-oriented and socially conservative (on abortion, for example).
The principal reason they go Democratic is the issue of illegal immigrants. In securing the Republican nomination, Mitt Romney made the strategic error of (unnecessarily) going to the right of Rick Perry. Romney could never successfully tack back.
For the party in general, however, the problem is hardly structural. It requires but a single policy change: Border fence plus amnesty. Yes, amnesty. Use the word. Shock and awe -- full legal normalization (just short of citizenship) in return for full border enforcement.SIGN UP"
24	http://www.breitbart.com/2016-presidential-race/2016/11/09/clinton-dynasty-come-end/	The Clinton Dynasty Has Come to an End–McClatchy DC	"SIGN UP FOR OUR NEWSLETTERAnita Kumar writes at McClatchy DC:With Hillary Clinton's stunning defeat, a force in American political life for nearly four decades comes to an abrupt end.Bill and Hillary Clinton, a husband-and-wife duo unmatched in U.S. history, brought people across the country into politics, created a vast fundraising network and shaped the nation by holding some of the highest offices in the land.Clinton, 69, who has made two failed bids at the presidency, is unlikely to be on the front lines of politics again. Her husband, Bill Clinton, 70, a former president who was widely expected to be the first husband to accompany his wife to the White House, likely will return to philanthropic efforts at his family's foundation.""I'm glad the Clintons came along. They have contributed greatly to the country and the world,"" said Donald Fowler, a former Democratic National Committee chairman who's close to the Clintons. ""I think they will both be willing to help in the search for new leadership.""The Clintons represented the rise and maturation of the baby boom generation, perhaps the most discussed, analyzed and self-referential generation in our country's history. In that sense, they were emblematic of its aspirations, as well of its outsized feelings of self-worth.On Wednesday, as Donald Trump began to prepare to move into the White House, Clinton said goodbye to American politics and pushed the next generation to keep fighting.With Hillary Clinton's stunning defeat, a force in American political life for nearly four decades comes to an abrupt end.
Bill and Hillary Clinton, a husband-and-wife duo unmatched in U.S. history, brought people across the country into politics, created a vast fundraising network and shaped the nation by holding some of the highest offices in the land.
Clinton, 69, who has made two failed bids at the presidency, is unlikely to be on the front lines of politics again. Her husband, Bill Clinton, 70, a former president who was widely expected to be the first husband to accompany his wife to the White House, likely will return to philanthropic efforts at his family's foundation.
""I'm glad the Clintons came along. They have contributed greatly to the country and the world,"" said Donald Fowler, a former Democratic National Committee chairman who's close to the Clintons. ""I think they will both be willing to help in the search for new leadership.""
The Clintons represented the rise and maturation of the baby boom generation, perhaps the most discussed, analyzed and self-referential generation in our country's history. In that sense, they were emblematic of its aspirations, as well of its outsized feelings of self-worth.
On Wednesday, as Donald Trump began to prepare to move into the White House, Clinton said goodbye to American politics and pushed the next generation to keep fighting.SIGN UP"
25	http://www.breitbart.com/big-government/2016/11/09/glaad-trump-sits-atop-most-hateful-republican-platform-in-history/	GLAAD: ‘Trump Sits Atop Most Hateful Republican Platform in History’	"LGBT activist group GLAAD is lashing out at the election of Donald Trump as the next president of the United States.SIGN UP FOR OUR NEWSLETTERGLAAD, formerly known as the Gay & Lesbian Alliance Against Defamation, posts on its website, ""Donald Trump sits atop the most hateful Republican platform in history, one that sorely endangers the most fundamental American values of fairness and equality for all.""The group continues:America stands tallest when it stands firmly in its founding principle that all people are created equal. With the election behind him, President-elect Trump must now rise above divisive politics and side with the vast majority of Americans who demand equality for their LGBTQ friends, family, and neighbors. While disappointed, we are certainly not defeated; the pursuit of full acceptance will continue until everyone, no matter who they are or who they love, can simply live the life they love.The 2016 Republican Party platform says about marriage:The American family is the foundation of civil society and the cornerstone is marriage, the union of one man and one woman...we do not accept the Supreme Court's redefinition of marriage and we urge its reversal, whether through judicial reconsideration or a constitutional amendment returning control over marriage to the States.""We condemn the Supreme Court's ruling in United States v. Windsor, which wrongfully removed the ability of Congress to define marriage policy in federal law,"" the platform adds, continuing:We also condemn the Supreme Court's ruling in Obergefell v. Hodges, which in the words of the late Justice Antonin Scalia was a ""judicial Putsch""--""full of silly extravagances""--that ""reduced the disciplined legal reasoning of John Marshall and Joseph Story to the mythical aphorisms of a fortune cookie."" In Obergefell, five unelected lawyers robbed 320 million Americans of their legitimate constitutional authority to define marriage as the union of one man and one woman. The Court twisted the meaning of the Fourteenth Amendment beyond recognition. To echo Scalia, we dissent.""We therefore support the appointment of Justices and judges who respect the constitutional limits on their power and respect the authority of the states to decide such fundamental social questions,"" the platform reads.In announcing his expanded list of potential Supreme Court appointees in September, Trump said in a press release:We have a very clear choice in this election. The freedoms we cherish and the constitutional values and principles our country was founded on are in jeopardy. The responsibility is greater than ever to protect and uphold these freedoms and I will appoint justices, who like Justice Scalia, will protect our liberty with the highest regard for the Constitution.""This list is definitive and I will choose only from it in picking future Justices of the United States Supreme Court,"" Trump said.America stands tallest when it stands firmly in its founding principle that all people are created equal. With the election behind him, President-elect Trump must now rise above divisive politics and side with the vast majority of Americans who demand equality for their LGBTQ friends, family, and neighbors. While disappointed, we are certainly not defeated; the pursuit of full acceptance will continue until everyone, no matter who they are or who they love, can simply live the life they love.The American family is the foundation of civil society and the cornerstone is marriage, the union of one man and one woman...we do not accept the Supreme Court's redefinition of marriage and we urge its reversal, whether through judicial reconsideration or a constitutional amendment returning control over marriage to the States.We also condemn the Supreme Court's ruling in Obergefell v. Hodges, which in the words of the late Justice Antonin Scalia was a ""judicial Putsch""--""full of silly extravagances""--that ""reduced the disciplined legal reasoning of John Marshall and Joseph Story to the mythical aphorisms of a fortune cookie."" In Obergefell, five unelected lawyers robbed 320 million Americans of their legitimate constitutional authority to define marriage as the union of one man and one woman. The Court twisted the meaning of the Fourteenth Amendment beyond recognition. To echo Scalia, we dissent.We have a very clear choice in this election. The freedoms we cherish and the constitutional values and principles our country was founded on are in jeopardy. The responsibility is greater than ever to protect and uphold these freedoms and I will appoint justices, who like Justice Scalia, will protect our liberty with the highest regard for the Constitution.SIGN UP"
26	http://www.breitbart.com/big-government/2016/11/09/despondent-democrats-bring-therapy-dogs-capitol-hill-trump-victory/	Despondent Democrats Bring ‘Therapy Dogs’ to Capitol Hill After Trump Victory	"Democratic staffers were so upset over the popular election of President Elect Donald Trump that ""therapy dogs"" were brought into the U.S. Capitol to soothe their hurt feelings.SIGN UP FOR OUR NEWSLETTERTwo golden doodles, two American Eskimo dogs, and a beagle mix were walked around the Cannon Office Building where many members of the House of Representatives have offices, according to NBC News.""Organizers say it was a great way for workers to blow off steam especially for those whose bosses may have lost re-election bids,"" NBC noted.Much needed #therapy #dogs on Capitol Hill today! Thx @pet_partners @HABRITweets @PIJAC4PETS ! pic.twitter.com/Lodz2pZ0l8-- Steve Feldman (@SteveFeldman) November 9, 2016Several groups organized the visit by the animals including the Human Animal Bond Research Initiative, Pet Partners, the Pet Leadership Council and the Pet Industry Joint Advisory Council.In a press release the groups said, ""the help of a non-judgmental, furry, four-legged best friend that enjoys bipartisan support.""These adorable therapy  were brought to Capitol Hill to reduce stress post-election!#Election2016#PuppiesCc: @nbcwashington @HABRITweets pic.twitter.com/ZJcTGu4gfH-- Jenny Vasquez (@JennVasquez_DC) November 9, 2016A similar effort was mounted at the University of Massachusetts Boston, the Springfield News-Sun reported.TODAY in the First Floor Terrace!Therapy doggo, coloring books, and Appreciation Station!Come de-stress!We're here til 1pm! pic.twitter.com/Fsn89QGqJO-- UMass Boston UHS (@UMBWellness) November 9, 2016Follow Warner Todd Huston on Twitter @warnerthuston or email the author at igcolonel@hotmail.com.Much needed #therapy #dogs on Capitol Hill today! Thx @pet_partners @HABRITweets @PIJAC4PETS ! pic.twitter.com/Lodz2pZ0l8
-- Steve Feldman (@SteveFeldman) November 9, 2016These adorable therapy  were brought to Capitol Hill to reduce stress post-election!#Election2016#PuppiesCc: @nbcwashington @HABRITweets pic.twitter.com/ZJcTGu4gfH
-- Jenny Vasquez (@JennVasquez_DC) November 9, 2016TODAY in the First Floor Terrace!Therapy doggo, coloring books, and Appreciation Station!
Come de-stress!
We're here til 1pm! pic.twitter.com/Fsn89QGqJO
-- UMass Boston UHS (@UMBWellness) November 9, 2016SIGN UP"
