	Link	Title	Text
0	http://www.breitbart.com/big-government/2016/11/10/obama-welcomes-presidential-elect-donald-trump-white-house/	Obama Vows to Work With President-elect Donald Trump	"President Barack Obama says he'll work with President-elect Donald Trump to deliver a smooth transition of power.SIGN UP FOR OUR NEWSLETTERThe pair met for more than an hour and a half in the Oval Office before they spoke to reporters.""I want to emphasize to you, Mr. President-elect, that we now are going to want to do everything we can to help you succeed. Because if you succeed, then the country succeeds,"" Obama said.Trump thanked Obama for allowing the meeting to go long, explaining that it was supposed to last 15 minutes but went more than an hour.""I very much look forward to dealing with the president in the future,"" Trump said, citing that he would appreciate Obama's ""counsel"" as part of the transition.Trump said he had never met Obama personally before and says they spoke about domestic and offering policy.The pair shook hands but did not take questions.""Here's a good rule: Don't answer the questions when they just start yelling,"" Obama advises Trump of WH reporters https://t.co/caBJ6OC8Ah pic.twitter.com/mGVdHi59QB-- CNN (@CNN) November 10, 2016The Trump motorcade arrived at the White House at 11:02 a.m. via the south entrance of the White House, away from the view of cameras.Trump's campaign did not allow a press pool representative to travel with the motorcade, preventing details of his arrival from being reported.Obama's Chief of Staff Denis McDonough was spotted with Trump's son-in-law Jared Kushner taking a stroll on the White House lawn.""Here's a good rule: Don't answer the questions when they just start yelling,"" Obama advises Trump of WH reporters https://t.co/caBJ6OC8Ah pic.twitter.com/mGVdHi59QB
-- CNN (@CNN) November 10, 2016SIGN UP"
1	http://www.breitbart.com/big-government/2016/11/10/obama-meeting-president-elect-trump-excellent/	Obama: Meeting with President-Elect Trump ‘Excellent’	"SIGN UP FOR OUR NEWSLETTERWASHINGTON (AP) -- The Latest on the U.S. presidential transition (all times EST):12:50 p.m.President-elect Donald Trump says he's looking forward to benefiting from President Barack Obama's ""counsel"" in the future.Trump was speaking at the end of his meeting Thursday with Obama in the Oval Office. He's suggesting he may turn to Obama for advice on governing.Trump said he looks forward to being with Obama ""many, many more times."" He said they discussed a host of topics.Trump said that Obama explained ""some of the difficulties"" but also ""some of the really great things that have been achieved.""Trump is noting that the meeting was expected to be short, but lasted almost 90 minutes. He said as far as he's concerned, it could have gone on much longer.___""Here's a good rule: Don't answer the questions when they just start yelling,"" Obama advises Trump of WH reporters https://t.co/caBJ6OC8Ah pic.twitter.com/mGVdHi59QB-- CNN (@CNN) November 10, 201612:45 p.m.President-elect Donald Trump says he ""very much looks forward"" to dealing with President Barack Obama in the future.Trump was meeting with Obama Thursday in the Oval Office. He called the meeting a ""great honor.""Trump noted that he and Obama haven't met each other before. Their meeting lasted well over an hour.12:40 p.m.President Barack Obama has met with President-elect Donald Trump at the White House. Obama said that they had an ""excellent"" and ""wide-ranging"" conversation.Obama met with Trump in the Oval Office for more than an hour to discuss the transition of power.Obama said he was encouraged by Trump's wanting to work with his team on issues facing the country. He said it's important for all ""to now come together.""Later, Trump will go to Capitol Hill to talk with congressional leaders about the Republicans' legislative agenda for next year.""Here's a good rule: Don't answer the questions when they just start yelling,"" Obama advises Trump of WH reporters https://t.co/caBJ6OC8Ah pic.twitter.com/mGVdHi59QB
-- CNN (@CNN) November 10, 2016SIGN UP"
2	http://www.breitbart.com/radio/2016/11/10/prof-banzhaf-obama-pardon-hillary-clinton-help-trump/	Prof. Banzhaf: Obama Pardon of Hillary Clinton Could Help Trump	"On Thursday's Breitbart News Daily, SiriusXM host Alex Marlow asked Professor John Banzhaf of George Washington University Law School about the possibility that outgoing President Barack Obama - or maybe even incoming President Donald Trump - might pardon Hillary Clinton for the various offenses that have been investigated by the FBI, and could conceivably be reviewed by a special prosecutor in the future.SIGN UP FOR OUR NEWSLETTER""I think it's more likely that Obama would,"" said Banzhaf. ""In fact, the headlines today, the New York Post, 'White House Open to Clinton Pardon.' Politico, the Washington Times on the other side, they won't rule out a pardon. There is, of course, strong precedent for it. When Richard Nixon was forced to resign, Gerald Ford gave him a complete and unconditional pardon not because he deserved it, but in his own words, to heal the country, to get rid of prolonged and divisive debate.""""The same thing might very well happen here. Interestingly, if Obama were moved to grant the pardon, it might not only help him and Hillary and the Democratic Party, but it might also help Trump,"" Banzhaf speculated. ""Maybe I'm naive, but I take both Obama and Trump's statements that they want to move forward, they want to heal, they want to get rid of the divisiveness."" ""Trump has said over and over and over again, a centerpiece of his campaign, that Crooked Hillary is a crook; she ought to go to jail; there ought to be a special prosecutor. I don't know whether he meant it or not, but if he goes ahead with that, and there is no pardon, that would be tremendously divisive,"" he said. ""On the other hand, it would be politically difficult for him, having made the promise to appoint a special prosecutor, to now say, 'Whoops, no, I changed my mind.' But if Obama were to pardon Hillary, that gives Trump an out,"" Banzhaf continued. ""He can say, 'Look,' to his people, 'I promised you that I would have a special prosecutor. I promised you I would put Crooked Hillary in jail. But Obama has given her, as Ford gave Nixon, a full and complete pardon for any crimes she may have committed, so my hands are tied. So let's put that aside, and then I can go ahead with all these other things I want to do.'"" ""We all know Trump is going to have a lot of opposition, a lot of divisiveness. Maybe he would feel he doesn't need this one extra thing,"" Banzhaf speculated.""What a sunset for the Clinton years in American life, if that's how it ends,"" said Marlow.Banzhaf closed out the interview by reporting that he was ""not aware of any significant voter fraud, anything which would have come near to affecting the outcome"" in the 2016 election. He and many other observers had feared such problems might occur, possibly even including a major foreign effort to hack into the American election system.""We were all worried about cyber-fraud and so on,"" he said. ""I think we were well-advised to take the extraordinary precautions that we did, and we ought to be continuing to work on that so that the next election is even safer, and we don't have to worry as much about the possibility of Russians or others possibly hacking and influencing the election.""Breitbart News Daily airs on SiriusXM Patriot 125 weekdays from 6:00 a.m. to 9:00 a.m. Eastern.LISTEN:SIGN UP""I think it's more likely that Obama would,"" said Banzhaf. ""In fact, the headlines today, the New York Post, 'White House Open to Clinton Pardon.' Politico, the Washington Timeson the other side, they won't rule out a pardon. There is, of course, strong precedent for it. When Richard Nixon was forced to resign, Gerald Ford gave him a complete and unconditional pardon not because he deserved it, but in his own words, to heal the country, to get rid of prolonged and divisive debate.""""The same thing might very well happen here. Interestingly, if Obama were moved to grant the pardon, it might not only help him and Hillary and the Democratic Party, but it might also help Trump,"" Banzhaf speculated. ""Maybe I'm naive, but I take both Obama and Trump's statements that they want to move forward, they want to heal, they want to get rid of the divisiveness."" ""Trump has said over and over and over again, a centerpiece of his campaign, that Crooked Hillary is a crook; she ought to go to jail; there ought to be a special prosecutor. I don't know whether he meant it or not, but if he goes ahead with that, and there is no pardon, that would be tremendously divisive,"" he said. ""On the other hand, it would be politically difficult for him, having made the promise to appoint a special prosecutor, to now say, 'Whoops, no, I changed my mind.' But if Obama were to pardon Hillary, that gives Trump an out,"" Banzhaf continued. ""He can say, 'Look,' to his people, 'I promised you that I would have a special prosecutor. I promised you I would put Crooked Hillary in jail. But Obama has given her, as Ford gave Nixon, a full and complete pardon for any crimes she may have committed, so my hands are tied. So let's put that aside, and then I can go ahead with all these other things I want to do.'"" ""We all know Trump is going to have a lot of opposition, a lot of divisiveness. Maybe he would feel he doesn't need this one extra thing,"" Banzhaf speculated.""What a sunset for the Clinton years in American life, if that's how it ends,"" said Marlow.Banzhaf closed out the interview by reporting that he was ""not aware of any significant voter fraud, anything which would have come near to affecting the outcome"" in the 2016 election. He and many other observers had feared such problems might occur, possibly even including a major foreign effort to hack into the American election system.""We were all worried about cyber-fraud and so on,"" he said. ""I think we were well-advised to take the extraordinary precautions that we did, and we ought to be continuing to work on that so that the next election is even safer, and we don't have to worry as much about the possibility of Russians or others possibly hacking and influencing the election."""
3	http://www.breitbart.com/california/2016/11/10/ro-khanna-beats-mike-honda-on-second-try-ami-bera-barely-maintains-seat/	Ro Khanna Unseats Mike Honda in Silicon Valley Race	"Ro Khanna defeated eight-term incumbent fellow Democrat, Rep. Mike Honda, on Tuesday by 20 percent in a race for Silicon Valley's 17th congressional district, which has been deemed one of California's most expensive.SIGN UP FOR OUR NEWSLETTERKhanna, a former Obama trade official and an attorney, had also challenged Honda in 2014, losing to him by just four percentage points.With all precincts reporting, I'm proud to be the next Representative for #CA17. https://t.co/FJ0mk2xTBu-- Ro Khanna (@RoKhannaUSA) November 9, 2016Honda's campaign deteriorated, and the race seemingly took a turn in favor of Khanna, after an ethics investigation into whether Honda had blurred the lines between his official political and campaign reelection work. Honda lost the endorsement of President Barack Obama, who decided to sit out of picking a candidate for that particular race.Conversely, Honda, 73, filed a lawsuit in the final weeks of the race, alleging that Khanna's campaign manager, Brian Parvizshahi, had hacked into a private computer system and illegally downloaded lists of financial contributions. Khanna was forced to fire Parvizshahi.Khanna, 40, a left-liberal progressive, had consistently called for new blood in Silicon Valley leadership. He received donations and endorsements from big tech names involved in companies such as Yahoo, Google, and Facebook.According to the Los Angeles Times, a spokesman for Honda's campaign declined to comment, saying the campaign would be releasing a later statement Wednesday.Meanwhile, in California's 7th congressional district, Democratic Rep. Ami Bera barely led Republican Scott Jones, leading for reelection by two percentage points, (51 % to 49 %).Jones sent out a tweet, with a full statement attached, Wednesday afternoon. He said, ""the race is far from over"":Very grateful to the voters #CA07. With so many ballots left to count, the race is far from over. Full Statement: https://t.co/Ysw18c3ZHp-- Scott Jones (@ScottJonesCA7) November 9, 2016Bera had lost the endorsement of a major union over his support of trade policies, specifically, his support for the Trans-Pacific Partnership (TPP). In August, his elderly father, Babulal Bera, 84, was sentenced to one year in federal prison and fined $100,000 for providing straw donations to his son's campaign. The younger Bera  maintained that he did not know of his father's illegal activity.Follow Adelle Nazarian on Twitter and Periscope @AdelleNazWith all precincts reporting, I'm proud to be the next Representative for #CA17. https://t.co/FJ0mk2xTBu
-- Ro Khanna (@RoKhannaUSA) November 9, 2016Very grateful to the voters #CA07. With so many ballots left to count, the race is far from over. Full Statement: https://t.co/Ysw18c3ZHp
-- Scott Jones (@ScottJonesCA7) November 9, 2016SIGN UP@AdelleNaz"
4	http://www.breitbart.com/big-government/2016/11/10/justin-trudeau-canada-willing-renegotiate-nafta-trump/	Justin Trudeau: Canada Willing to Renegotiate NAFTA with Trump	"Ottawa (AFP) - Canadian Prime Minister Justin Trudeau said Thursday he is willing to renegotiate the North American Free Trade Agreement (NAFTA), which US President-elect Donald Trump has said he wants to change or scrap.SIGN UP FOR OUR NEWSLETTERDuring the campaign, Trump called NAFTA the worst trade deal the United States has ever signed, while proposing protectionist measures to repatriate American jobs lost to free trade.""I think it's important that we be open to talking about trade deals,"" Trudeau -- a fierce defender of free trade, which helps bolster the Canadian economy -- told reporters.""If the Americans want to talk about NAFTA, I'm more than happy to talk about it,"" he said, adding that it was important to periodically reassess trade deals to ensure that they continue to be of benefit to Canadians.Trudeau called the president-elect on Wednesday to congratulate him on his election victory.The 1994 North American Free Trade Agreement (NAFTA) binds 530 million consumers in Canada, the United States and Mexico.Bilateral trade crossing the US-Canadian border amounts to US$1.8 billion daily.Thirty-four US states rely on trade with Canada, which supports nine million American jobs, while exports to the United States represents 20 percent of Canada's GDP.SIGN UP"
