	Link	Title	Text
15	http://www.breitbart.com/big-government/2016/11/11/113000-votes-pa-wi-mi-gave-trump-56-electoral-college-votes/	108,600 Votes Swing 46 Electoral College Votes to Donald Trump	"Forty-six of the electoral college votes President-elect Donald Trump won on his way to a resounding 306 to 232 electoral college victory over Democrat nominee Hillary Clinton came from three states where his combined margin of victory was only 108,600 votes.SIGN UP FOR OUR NEWSLETTERNo major media outlet has yet called Michigan for Trump, but a spokesperson for the Michigan Secretary of State's office told Breitbart News on Thursday ""there's no reason to believe there will be large numbers of votes that will be found subsequent to the current reporting.""Trump won Pennsylvania, with its 20 electoral college votes, by 68,236 votes, Wisconsin, with its 10 electoral college votes, by 27,257 votes, and Michigan, with its 16 electoral college votes, by 13,107 votes.Had those 108,600 votes gone to Hillary Clinton, she would have won the presidency with a a 278 to 260 electoral college victory over Trump. (Though New Hampshire, with its 4 electoral college votes has not yet been called, Clinton holds a 1,614 vote margin there-0.2 percent of votes cast in the state- with 100 percent of precincts reporting.)Clinton won the popular vote by 0.2 percent, or about 200,000 votes out of a total of 120 million total votes cast.A key shift of less than 0.1 percent of those votes-108,600-would have given us President-elect Clinton instead of President-elect Trump.Clinton's inattention on the campaign trail to these three ""Rust Belt"" states cost her dearly.As The Week, points out, Hillary Clinton failed to visit Wisconsin, even once, after April.It could have been even worse for the Clinton campaign. Trump, who only visited Minnesota once during the last month of the campaign (an overflow rally held Sunday at the Minneapolis airport), almost won that traditionally liberal state's 10 electoral college votes as well.The final tally there gave Clinton only a 42,951 vote victory-1.4 percent of the votes cast in the state. Sources in Minnesota tell Breitbart News that Trump may well have won the state had he held an additional campaign rally in Duluth during the last week of the campaign.Over the last month of the campaign, in contrast, Trump visited Pennsylvania and Michigan numerous times. By the time the Clinton campaign realized those two states were in play, it was too late to catch up, a realization that may not have completely been understood by the Clinton campaign until early Wednesday morning when the networks called Pennsylvania for Trump, putting him over the top and making him President-elect.""Political experts insisted that it was folly for Trump and his team to believe Michigan and Wisconsin were within their grasp. Pennsylvania was also said to be fool's gold for Republicans every four years. Trump's team ignored them--and struck a rich vein across the Rust Belt,"" Carl Cannon wrote at Real Clear Politics on Thursday after the shock of Trump's victory began to set in.Trump's team understood a number of things about these Rust Belt states the Clinton team missed.First, the anger at the loss of manufacturing jobs was much greater than the Clinton team ever realized. Opposition to NAFTA, which Trump pointed to as one of the major causes of these job losses, resonated with blue collar voters.Second, the National Rifle Association mounted a very aggressive and effective get-out-the-vote effort on Trump's behalf in Ohio, Pennsylvania, Michigan, and Wisconsin.Third, Clinton's support for increasing the number of Syrian refugees by 550 percent, and the number of refugees overall, was very unpopular with middle-class voters, especially in Michigan and Minnesota. Trump's promise to suspend the Syrian refugee resettlement program if elected, as well as the resettlement of refugees from countries that were hostile to voters, motivated many Rust Belt voters to back him.Trump's call for an end to the resettlement of refugees without the support of local communities during his Sunday rally in Minneapolis served to emphasize the difference between the two candidates at the very moment that the last few undecided Rust Belt voters were making up their minds.SIGN UP"
16	http://www.breitbart.com/tech/2016/11/11/peter-thiel-wants-to-serve-trump-administration-as-technology-adviser/	Peter Thiel Wants to Serve Trump Administration as Technology Adviser	"Tech entrepreneur and co-founder of PayPal Peter Thiel suggested that he will work for the Trump administration as an informal adviser on subjects such as technology and innovation.SIGN UP FOR OUR NEWSLETTER""A page in the book of history has turned, and there is an opening to think about some of our problems from a new perspective,"" Thiel said. ""I'll try to help the president in any way I can.""Thiel, who publicly endorsed Donald Trump unlike the majority of other Silicon Valley leaders, donated $1.25 millon to the Trump campaign and also spoke at this year's Republican National Convention.He also gave a speech at the National Press Club in Washington, D.C., a week before the election where he warned people the movement behind the then Republican nominee was ""not going away.""Other Silicon Valley companies such as Google, Facebook, and Twitter all strongly opposed Trump's candidacy, and Thiel was even pressured from figures in the industry to step down from his role as a board member at Facebook.Silicon Valley leaders such as Facebook co-founder Dustin Moskovitz gave $35 million in an effort to defeat Donald Trump, while Apple CEO Tim cook and Microsoft founder Bill Gates were also considered as vice-presidential picks by the Clinton campaign.You can follow Ben Kew on Facebook, on Twitter at @ben_kew, or email him at bkew@breitbart.com.SIGN UP"
17	http://www.breitbart.com/2016-presidential-race/2016/11/11/boy-beaten-supporting-trump/	Boy Beaten After Backing Donald Trump in School Mock-Election	"An 11-year old boy was assaulted by several classmates in his Texas classroom, after he said he supported Donald Trump in a school mock-election.SIGN UP FOR OUR NEWSLETTERSchool officials suspended the children suspected of the attack, which took place Nov. 9 at the Stafford intermediate school near Houston, Texas, according to Fox 26.""This is America,"" said Mary Lemmon, the mother of attacked child. ""Everyone has the right to their own opinion, and they shouldn't be beat up for it.""""That's what America's about,"" said the child's father Buddy Lemmon. ""We had to respect the last election results, and I feel like everyone should respect this election's results.""The boy told Fox 26 that:These boys decided to ask the classroom, 'Who voted for Donald Trump?' And then I said, 'I did.' And then they come over here and jerked me out of my seat,"" said the student. ""Before I could get up they started kicking me and punching me ... [it] felt like it was forever.The school's students are mostly poor, 5 percent white, 45 percent Hispanic, and 40 percent black, reflecting the expanding diversity of Texas since immigration rules were relaxed in 1965. ""13% of the Stafford Intermediate School students are 'limited in English proficiency.' 59% of the 527 students here are classified as ""economically disadvantaged"", and 69% have subsidized lunches,"" according to Zillow.com.A statement from the school said:The Stafford Municipal School District is investigating an altercation that took place on its Intermediate School campus on Wednesday morning. The students allegedly involved in the altercation have been suspended, pending an investigation.Upon completion of the investigation, consequences will be applied in line with the District's Code of Conduct.The Stafford Municipal School District works diligently to ensure a safe environment for all students and staff and will not tolerate aggression of any kind.Technically, an ""altercation"" is an argument or disagreement, not an assault.Nationwide, examples of violent victimization have been rising since 2009, after falling for the prior 16 years, according to a federal report.Read the most recent federal report on school violence here.These boys decided to ask the classroom, 'Who voted for Donald Trump?' And then I said, 'I did.' And then they come over here and jerked me out of my seat,"" said the student. ""Before I could get up they started kicking me and punching me ... [it] felt like it was forever.The Stafford Municipal School District is investigating an altercation that took place on its Intermediate School campus on Wednesday morning. The students allegedly involved in the altercation have been suspended, pending an investigation.
Upon completion of the investigation, consequences will be applied in line with the District's Code of Conduct.
The Stafford Municipal School District works diligently to ensure a safe environment for all students and staff and will not tolerate aggression of any kind.SIGN UP"
18	http://www.breitbart.com/radio/2016/11/11/professor-accurately-predicted-trump-victory-accuses-media-poll-bias/	Professor Who Accurately Predicted Trump Victory Accuses Media of Poll Bias	"Stony Brook University Professor of Political Science Helmut Norpoth returned to Breitbart News Daily on Friday morning, two weeks after standing by his prediction that most polls were wrong and Donald Trump was highly likely to win the presidential race. Professor Norpoth was feeling rather good about that prediction on Friday.SIGN UP FOR OUR NEWSLETTERNorpoth also confirmed, in response to SiriusXM host Alex Marlow's first question, that it is indeed awesome to have a name like ""Helmut Norpoth"" and to hear it repeated with such gratitude and appreciation.""I've just gone through a ton of emails congratulating me, and saying how happy people were that I made that prediction, that when it looked pretty difficult that it would come true, I stuck to it. It made a lot of people happy. That makes me happy,"" he said.However, Norpoth said he was not receiving any apologies from the political analysts and media outlets that said he was crazy for predicting Trump's victory.""Nobody ever apologizes for these kinds of things,"" he mused. ""That's just the name of the game. I don't expect that. But I'm happy to get the congratulations, and I know deep down how they must feel, that they thought I was just ridiculous and absolutely wrong, I would fall on my face, etc. That's good enough for me to know that.""Norpoth said the 2016 election was ""a new phenomenon,"" and Trump was a candidate unlike any other in recent memory.""I think the polls just totally misjudged the potential and the kind of support that he engendered, and he just fell through the cracks of how they poll people - how they wait, whatever they get from the polls, to make a sort of forecast of the electorate, and it was just so way off,"" he said. ""Any time I looked at a poll, at some of the fine print about the breakdowns to see what they were weighting, I always saw a very heavy Democratic preponderance, which I thought was way off, even bigger than in 2012. So I had a feeling right away that that wouldn't be true, that we wouldn't get an electorate that was just like that, and so I always figured that Trump's chances were much better than these polls indicated.""""When they report, for example, how many Democrats they have in the poll, how many Republicans, independents, usually if they do that - many, many don't do that - of the kind of subsample they call the electorate, the 'likely voters.' And they tell me, like ABC, Washington Post, I follow them pretty closely, at some points they had leads of ten points, ten percent more Democrats than Republicans. And in the end, it was four points. I knew four years ago it was only six, so ten points was just way, way off, and so if you made an adjustment for that, you could see right away how that would narrow,"" Norpoth explained.""I just feel very skeptical about the way that they handled the information that they get from polls,"" he declared.When Marlow asked if there was any method for ""keeping these people in line for future polls,"" Norpoth laughed and asked if he was referring to the pollsters or the voters.On the assumption that pollsters truly want their surveys to be accurate, rather than using deliberately slanted surveys as tools to manipulate public opinion, Norpoth predicted ""a pretty thorough investigation of the polling business.""""I think they're very concerned about that because this kind of polling is very important to them. It's sort of a public benchmark about how they're doing with other things. If people can see that something happens in real life that you can sort of check against what they're doing, then some people might be sort of skeptical about doing business with them,"" he said.""Remember Gallup after that last election - Gallup had done this business for 80 years,  and you did figure Gallup really knew what it was doing - decided to quit this type of polling,"" he recalled. ""So you didn't see Gallup any more, and I think that's a sort of a real sad commentary on the business.""Professor Norpoth discussed his prediction model in more detail in an op-ed published at Newsday on Thursday: ""This is How Change Trumped Experience in 2016."" His new book, Commander-in-Chief: Franklin Roosevelt and the American People, will be released soon.Breitbart News Daily airs on SiriusXM Patriot 125 weekdays from 6:00 a.m. to 9:00 a.m. Eastern.LISTEN:SIGN UPNorpoth also confirmed, in response to SiriusXM host Alex Marlow's first question, that it is indeed awesome to have a name like ""Helmut Norpoth"" and to hear it repeated with such gratitude and appreciation.""I've just gone through a ton of emails congratulating me, and saying how happy people were that I made that prediction, that when it looked pretty difficult that it would come true, I stuck to it. It made a lot of people happy. That makes me happy,"" he said.However, Norpoth said he was not receiving any apologies from the political analysts and media outlets that said he was crazy for predicting Trump's victory.""Nobody ever apologizes for these kinds of things,"" he mused. ""That's just the name of the game. I don't expect that. But I'm happy to get the congratulations, and I know deep down how they must feel, that they thought I was just ridiculous and absolutely wrong, I would fall on my face, etc. That's good enough for me to know that.""Norpoth said the 2016 election was ""a new phenomenon,"" and Trump was a candidate unlike any other in recent memory.""I think the polls just totally misjudged the potential and the kind of support that he engendered, and he just fell through the cracks of how they poll people - how they wait, whatever they get from the polls, to make a sort of forecast of the electorate, and it was just so way off,"" he said. ""Any time I looked at a poll, at some of the fine print about the breakdowns to see what they were weighting, I always saw a very heavy Democratic preponderance, which I thought was way off, even bigger than in 2012. So I had a feeling right away that that wouldn't be true, that we wouldn't get an electorate that was just like that, and so I always figured that Trump's chances were much better than these polls indicated.""""When they report, for example, how many Democrats they have in the poll, how many Republicans, independents, usually if they do that - many, many don't do that - of the kind of subsample they call the electorate, the 'likely voters.' And they tell me, like ABC, Washington Post, I follow them pretty closely, at some points they had leads of ten points, ten percent more Democrats than Republicans. And in the end, it was four points. I knew four years ago it was only six, so ten points was just way, way off, and so if you made an adjustment for that, you could see right away how that would narrow,"" Norpoth explained.""I just feel very skeptical about the way that they handled the information that they get from polls,"" he declared.When Marlow asked if there was any method for ""keeping these people in line for future polls,"" Norpoth laughed and asked if he was referring to the pollsters or the voters.On the assumption that pollsters truly want their surveys to be accurate, rather than using deliberately slanted surveys as tools to manipulate public opinion, Norpoth predicted ""a pretty thorough investigation of the polling business.""""I think they're very concerned about that because this kind of polling is very important to them. It's sort of a public benchmark about how they're doing with other things. If people can see that something happens in real life that you can sort of check against what they're doing, then some people might be sort of skeptical about doing business with them,"" he said.""Remember Gallup after that last election - Gallup had done this business for 80 years,  and you did figure Gallup really knew what it was doing - decided to quit this type of polling,"" he recalled. ""So you didn't see Gallup any more, and I think that's a sort of a real sad commentary on the business.""Professor Norpoth discussed his prediction model in more detail in an op-ed published at Newsdayon Thursday: ""This is How Change Trumped Experience in 2016."" His new book, Commander-in-Chief: Franklin Roosevelt and the American People,will be released soon."
19	http://www.breitbart.com/big-government/2016/11/11/leftwing-media-mislead-abortion-supporters-obama-rule-preventing-states-defunding-planned-parenthood-permanent/	Leftwing Media Mislead Over Obama Planned Parenthood Rule	"Leftwing media are misleading their own readers by spreading a story that a rule drafted by the Obama administration to prevent states from defunding Planned Parenthood is now ""permanent.""SIGN UP FOR OUR NEWSLETTEROn Thursday, the Huffington Post marked its September 9 story - with the headline ""Obama Moves To Protect Planned Parenthood Funding, Permanently"" - about the proposed rule as ""updated."" Other outlets, such as Yahoo News and the UK's the Independent, followed suit in the wake of the election of Donald Trump as the next president of the United States. The stories were published as if the rule was now in effect.A look at the Federal Register, however, shows the public comment period on the proposed rule ended October 7, but that HHS has not yet published any final regulations.Even Snopes.com attempted to clear things up for Planned Parenthood supporters that the new rule is not yet law and is not in effect.Nevertheless, the rumor mill was launched into service through social media:Last night, @POTUS signed a bill permanently protecting Planned Parenthood. Thank you Obama for everything, you are our hero -- buttercup v (@pvnk_princess) November 10, 2016Thank you @POTUS (Obama) for protecting #PlannedParenthood -- Abigail Ann (@abigailannn) November 10, 2016Obama just made a move to protect planned parenthood permanently so the republicans can never defund it, his last stand essentially.-- jordan rose (@maliagif) November 10, 2016As Breitbart News reported on September 6 about the proposed regulation, the Obama administration has sought to override state laws that redirect federal funding from abortion provider Planned Parenthood - its political ally - toward other health care centers that have met the federal government's criteria.These federally qualified health care centers (FQHCs) provide more comprehensive services than Planned Parenthood to low-income families. Nationally, there are 13,000 FQHCs - a figure that outnumbers Planned Parenthood facilities by 20 to 1.Despite the overwhelming number of FQHCs, however, the Obama Department of Health and Human Services (HHS) says that by redirecting funding away from Planned Parenthood, the states ""have interfered with"" low-income individuals' ability to access federal assistance quickly.In addition to misleading abortion supporters that the proposed rule is now in effect, the notion that President Obama can ""permanently"" ban states from redirecting federal funds away from Planned Parenthood is false.""Nothing is permanent in politics, including this rule that has no support in the law actually passed by Congress,"" Casey Mattox, senior counsel at Alliance Defending Freedom, tells Breitbart News.Mattox adds:States are free to allocate funds to providers that provide better care for women and families rather than abortion businesses that hurt women. Planned Parenthood spent $38 million to elect political cronies, but ultimately they will not even have this rule to show for it because they failed to get their candidate into the White House.Trump has promised to repeal and replace Obamacare and to appoint pro-life Supreme Court justices. The president-elect has also said Planned Parenthood should be defunded. Abortion proponents have experienced melt-downs following his stunning victory, even to the extent of urging women to have IUDs implanted prior to Trump's inauguration in order to obtain them for ""free,"" or, on the taxpayer's dime.Last night, @POTUS signed a bill permanently protecting Planned Parenthood. Thank you Obama for everything, you are our hero 
-- buttercup v (@pvnk_princess) November 10, 2016var _ndnq = _ndnq || []; _ndnq.push([""embed""]);Thank you @POTUS (Obama) for protecting #PlannedParenthood 
-- Abigail Ann (@abigailannn) November 10, 2016Obama just made a move to protect planned parenthood permanently so the republicans can never defund it, his last stand essentially.
-- jordan rose (@maliagif) November 10, 2016States are free to allocate funds to providers that provide better care for women and families rather than abortion businesses that hurt women. Planned Parenthood spent $38 million to elect political cronies, but ultimately they will not even have this rule to show for it because they failed to get their candidate into the White House.SIGN UP"
