	Link	Title	Text
20	http://www.breitbart.com/jerusalem/2016/11/11/un-accuses-islamic-state-mass-executions-stockpiling-chemicals-mosul/	UN Accuses Islamic State of Mass Executions and Stockpiling Chemicals in Mosul	"(REUTERS) - Isis militants have executed scores more people around the northern Iraqi city of Mosul this week and are reported to be stockpiling dangerous chemicals in civilian areas, the UN human rights office said on Friday.SIGN UP FOR OUR NEWSLETTERA mass grave with over 100 bodies found in the town of Hammam al-Alil was one of several so called Islamic State killing grounds, spokeswoman Ravina Shamdasani said. She cited testimony gleaned from sources including a man who had survived an execution of some 50 former Iraqi soldiers by playing dead.""Clearly there are many other killing fields. We also have reports of other mass graves which we haven't yet been able to verify,"" Ms Shamdasani told reporters, mentioning sites at Mosul airport and the village of Tal al-Thahab.Iraqi troops had found large stockpiles of sulphur and there were credible reports that Isis had used ""phosphor projectiles"" over Qayyara, close to Mosul, Ms Shamdasani said.""Similar credible reports in Mosul state that they have placed sulphur pits in close proximity to civilians,"" she said.The UN's sources of information include people living in Isis-held areas who risk their lives to speak out.""We get so much information,"" Ms Shamdasani said, without going into details. ""We've been in Iraq a very long time.""
She said 40 civilians were reportedly shot on Tuesday for ""treason and collaboration"" with Iraqi government forces, and their bodies hung from electrical poles around Mosul.Mobile phoneThe same day a 27-year-old man was shot for using a mobile phone, Ms Shamdasani said. Six others had been hanged on October 20th for hiding SIM cards, and 20 more were reportedly shot on Wednesday for leaking information to the Iraqi security forces.Isis had deployed what it calls ""sons of the caliphate"" wearing explosive belts in the alleys of Old Mosul, and the UN had unconfirmed reports that they were teenagers and young boys, Ms Shamdasani said.Isis also announced on November 6th that it had beheaded seven of its own fighters for deserting the battlefield at Kokjali, Ms Shamdasani said.The UN had also verified an Isis propaganda video showing four children, purportedly including one Russian and one Uzbek, executing four people for spying.The UN had information that abducted women, including from the Yazidi minority, were being ""distributed"" to fighters or told they would be used to accompany Islamic State convoys, Ms Shamdasani said.""We're talking about war crimes, crimes against humanity, even genocide,"" she said.Meanwhile, Iraqi special forces said they pushed deeper into Mosul on Friday despite heavy resistance from militants using civilians as cover, and were holding half a dozen city neighbourhoods seized in the last 10 days.The elite Counter Terrorism Service troops broke through Isis defence lines to enter the city early last week and have since been embroiled in a brutal, close-quarter combat with waves of suicide bombers and snipers.The special forces are the spearhead of a wider coalition of 100,000 fighters seeking to crush a few thousand jihadists who have ruledMosul, the biggest city of their cross-border ""caliphate"" in Iraq and Syria, for the last two years.The campaign, nearly four weeks old, is the most complex military operation in Iraq in the 13 years of turmoil since the US invasion that toppled Saddam Hussein.Security forces and army infantry divisions, backed by a US-led air force, are preparing to move on southern and northern districts of Mosul in coming days, to step up pressure on the militants.Kurdish peshmerga and Shia paramilitary forces are holding territory to the northeast and to the west.On the eastern front, special forces pushed into the Qadisiya al-Thaniya district, on the northern edge of the small pocket of neighbourhoods they control so far, Sabah al-Numani, spokesman for the Counter Terrorism Service, told Reuters.""We have encountered heavy resistance from the enemy,"" he said, describing what he called ""obstructive patrols"" of militant forces trying to hold up the advance.""We are facing the most difficult form of urban warfare, fighting with the presence of civilians, but our forces are trained for this sort of combat.""Military officers have told Reuters that the fighting is some of the most lethal they have seen, with small groups of militants using a vast network of tunnels and narrow streets to launch an apparently endless sequence of attacks against troops.A Reuters correspondent in Kokjali, on the eastern edge of the city, saw US Apache helicopters overhead. Explosions, either from air strikes or suicide car bombs which the jihadists have deployed in the hundreds since the campaign started on October 17th, could be heard against a backdrop of artillery fire.As smoke rose above the city, hundreds of civilians were on the streets of Kokjali, some of them local residents but others fleeing the fighting in Mosul itself.The International Organization for Migration says nearly 48,000 people have been displaced by the fighting, still a relatively low figure compared to a UN warning before the campaign of a possible exodus of 700,000 or 800,000.Mr Numani said the army had told civilians to stay indoors for their safety, adding that the counter terrorism unit aimed to hand over neighbourhoods which it had secured to other forces. In other cities retaken from Isis, local police forces have moved in after the special forces have cleared territory.On Thursday, Iraqi soldiers advancing on the eastern side of the Tigris targeted two villages close to the ancient Assyrian city of Nimrud, a military statement said.Troops from the Ninth Armoured Division took control of one of them, the village of Abbas Rajab, 4km east of Nimrud, and raised the Iraqi flag, it said.The Iraqi government says Nimrud was bulldozed last year as part of Islamic State's campaign to destroy symbols which the Sunni Muslim zealots consider idolatrous. It would be the first such site to be recaptured from Isis. - (Reuters )SIGN UP"
21	http://www.breitbart.com/2016-presidential-race/2016/11/11/america-needs-use-energy-not-less/	American Manufacturing Needs More Energy, Not Less	"During the 2016 election, both candidates promised to bring manufacturing back to the U.S.SIGN UP FOR OUR NEWSLETTER""The rhetoric,"" reports US News, ""has struck home with Americans across the country--particularly those currently or formerly employed in the embattled U.S. goods-producing and manufacturing sectors, who have repeatedly borne the brunt of corporate efforts to move work overseas.""Harry Moser, founder and president of the Reshoring Initiative, which aims to bring manufacturing back home, is optimistic. He told me that we are now losing about as many jobs to offshoring as we are recovering. ""We've gone from losing somewhere around 200,000 manufacturing jobs a year in 2000 to 2003 to net breaking even,"" he explained. ""Balancing the trade deficit will increase U.S. manufacturing by about four million jobs at current levels of productivity""According to MarketWatch.com, the percentage of people who work in manufacturing is at a record low of 8.5%--which compares to ""20% in 1980, 30% in 1960 and a record 39% during World War Two.""While there are many factors driving offshoring, lower wages give countries like China and Mexico a competitive advantage. Energy costs, however, give the U.S. an advantage as ""manufacturers need a lot of energy to make their processes work,"" stated Gary Marmo, director of sales for New Jersey's Elizabethtown Gas. He says, ""A typical office building will use 5,000, 10,000, 20,000 therms a year. A good sized manufacturing plant will probably use that same amount in just a couple of days."" Electricity frequently represents one of the top operating costs for energy intensive industries such as plastics, metals, chemicals, and pharmaceuticals--and, according to a recent study comparing costs in the U.S. and China, electricity is about 50 percent higher in China.Because manufacturing is energy intensive, bringing industry back to the U.S. will increase our energy consumption.President Obama has derided U.S. energy use: ""The U.S. uses far more electricity than its North American neighbors combined,"" but the U.S. also does more with our energy. Comparing the Gross Domestic Product (GDP) and energy consumption numbers for the U.S. and Canada, for example, both use a similar volume of energy but the U.S. has substantially higher GDP. A study of global energy consumption versus GDP found: ""energy is so intrinsically linked to GDP that energy policy more or less dictates how our economy performs.""Mike Haseler, the study's author, explains that ""rising GDP is an indication of a prosperous economy""--which is why economic commentators cite GDP numbers when they say: ""President Barack Obama may become the first president since Herbert Hoover not to serve during a year in which the growth in real GDP was at least 3 percent."" Yet, in the name of climate change, through government policy, many countries are trying to discourage energy use by forcing costs up. Haseler states: ""They are cutting energy use as the economy of Europe collapses because European industry can no longer compete with countries where energy prices are not artificially raised by senseless 'green' policies.""The energy advantage is not just an issue between countries, it is a factor in where companies locate within the U.S.""High electricity bills are a strong disincentive to create new jobs associated with a new or expanded product line,"" writes Don Welch, president of New Hampshire based Globe Manufacturing Co, LLC. New Hampshire's electric prices are 55.6 percent higher than the national average. Welch's company is the leading producer of firefighting turnout gear.Welch explains: ""higher electricity costs not only add hundreds of thousands of dollars to the cost of making our products--firefighting suits and equipment--but it's money we could otherwise re-invest in the business, including creating new jobs here in New Hampshire. New Hampshire's high electricity prices are a drag on our economy. It puts New Hampshire companies like mine at a competitive disadvantage compared to companies in other parts of the country.""Because Globe also has plants in three different states, he clearly sees the difference energy costs make in doing business. Welch says: ""I already know that the electric bill I am paying at my facility in Oklahoma is half of what I pay in New Hampshire."" If he is going to add a product line, energy costs are a big factor in deciding where to expand.If we can bring back manufacturing jobs--or at least stem the flow of them from our country--we need to be encouraging low-cost energy and making more of it available. Moser believes: ""balancing the trade deficit should be the number 1 national priority."" He told me that would take a 25 percent increase in manufacturing--which would require about a 10 percent increase in energy usage. Yet, climate change policies demand that we take greater cuts than the developing countries like China and India. If our energy costs continue to go up, as they have in New Hampshire, we'll lose the best competitive advantage we have.Moser explains, ""Manufacturing has the highest multiplier effect among the major sectors. Every job created in manufacturing creates additional jobs in other sectors that supply, support and service manufacturers.""To bring manufacturing back to the U.S., or encourage expansion, we need energy that is abundant, available and affordable--and we'll need to use more, not less. If we want to balance our trade deficit, boost GDP, and have a prosperous economy, energy is the key. As I am known for saying: ""energy makes America great!""The author of Energy Freedom, Marita Noon serves as the executive director for Energy Makes America Great Inc., and the companion educational organization, the Citizens' Alliance for Responsible Energy (CARE). She hosts a weekly radio program: America's Voice for Energy--which expands on the content of her weekly column. Follow her @EnergyRabbit.SIGN UP"
22	http://www.breitbart.com/jerusalem/2016/11/11/trump-hails-israel-beacon-hope/	Trump Hails Israel as ‘Beacon of Hope’	"Jerusalem (AFP) - US president-elect Donald Trump pledged Friday to work for a ""just, lasting peace"" between Israel and the Palestinians, in his first public message on the issue since his upset victory.SIGN UP FOR OUR NEWSLETTER""I believe that my administration can play a significant role in helping the parties to achieve a just, lasting peace,"" Trump said in a message published by the Israel Hayom newspaper.He also said that any peace deal ""must be negotiated between the parties themselves, and not imposed on them by others"".France is currently pushing for an international conference to revitalise the moribund peace process, but Israel has said it will not take part -- saying any peace talks should be bilateral between the two sides.Russia has also offered to host direct talks between the two sides that have so far yet to take place.The Palestinians have called for international involvement, accusing Israel of reneging on past agreements.Speaking Friday after meeting Russian Prime Minister Dmitry Medvedev, Palestinian president Mahmud Abbas said Trump's victory was ""American business"".""We followed the electoral process for over a year. What matters to us is what Mr Trump will say once he enters the White House,"" he said at a press conference.He added that he had stressed to Medvedev his willingness to hold negotiations in Russia ""but the Israeli side asked to postpone it"".Medvedev said Russia was willing to ""immediately"" open a dialogue between the two sides, whether under Russian or international mediation.Israeli Prime Minister Benjamin Netanyahu and US President Barack Obama have had frosty relations for much of the past eight years, but initial indications are that Trump's victory could see a warming of personal relations.Netanyahu was among the first leaders Trump spoke to after his election victory, and the president-elect's message called Israel a ""beacon of hope"".""Israel and America share so many of the same values, such as freedom of speech, freedom of worship and the importance of creating opportunities for all citizens to pursue their dreams,"" Trump's Israel Hayom message said.""Israel is the one true democracy and defender of human rights in the Middle East and a beacon of hope to countless people.""Israeli right-wingers have hailed Trump's win as an opportunity to consolidate control over the occupied West Bank and annexed east Jerusalem.Meir Turjeman, chairman of the Jerusalem municipality planning committee, told public radio that it provided a green light to revive suspended permits for Israeli settlement expansion in Arab east Jerusalem.He said the municipality intended to authorise thousands of housing units that had been frozen.Education Minister Naftali Bennett, who heads the hardline Jewish Home party, said on Wednesday that the US election result meant the idea of a Palestinian state was over.SIGN UP"
23	http://www.breitbart.com/big-government/2016/11/11/transition-donald-trump-mapping-out-administration-with-top-aides/	Trump Tower Locked Down as Top Campaign Aides Plan Administration	"NEW YORK -- President-elect Donald Trump is meeting with his top aides to plan for his upcoming administration.SIGN UP FOR OUR NEWSLETTERThe NYPD and Secret Service have turned Trump Tower into a fortress for the president elect, as it appears to be the focal point of presidential activity for the next few days.Formal concrete blockades and steel barricades have replaced the cement and sanitation trucks that were used by the NYPD for a  temporary barricade. Trump fans and haters alike have gathered across the street to watch the building.""Busy day planned in New York,"" Trump wrote on Twitter. ""Will soon be making some very important decisions on the people who will be running our government!""At Trump Tower, Trump campaign CEO Stephen K. Bannon was spotted entering the building as well as Deputy campaign manager David Bossie. Trump's spokeswoman Hope Hicks also went in, as did Trump's former campaign manager Corey Lewandowski.Rudy Giuliani went in. He's a long-time surrogate who's expected to have a large role in the Trump administration.At this point, Trump and his team have made no official announcements about who will be working in his administration. But that hasn't stopped the media from speculating about various people within Trump's orbit.Reports suggest that Rep. Jeb Hensarling (R-TX) has been considered for Treasury Secretary, Rep. Mike McCaul (R-TX) has been floated for Homeland Security Secretary.New York Magazine, CNN, and the New York Times reported that Trump is considering Bannon to serve as his chief of staff although no announcements have been made.SIGN UP"
24	http://www.breitbart.com/big-government/2016/11/11/donald-trump-on-twitter-administration-decisions-coming-soon/	Donald Trump on Twitter: Administration Decisions Coming ‘Soon’	"President-elect Donald Trump promises he will make key administration staffing decisions ""soon.""SIGN UP FOR OUR NEWSLETTERBusy day planned in New York. Will soon be making some very important decisions on the people who will be running our government!-- Donald J. Trump (@realDonaldTrump) November 11, 2016The entire administration remains up for grabs, fueling rumors about every position, cabinet-level and right on down the line.So far, Trump has left the traditional press pool in the dark about his next moves, much to its chagrin.""While Trump previewed a 'busy day' on Friday, there's little insight about what specifically he has planned,"" Politico gripes. ""The transition pool of media reporters has gotten little guidance on what Trump is doing or where he is going.""""A pool report issued Friday morning said the reporters had gotten no assurance that there won't be movements, and that the only notable thing that had happened so far was that the Trump Tower marquee was temporarily papered over for window cleaning,"" Politico continued.During the presidential campaign, Trump repeatedly left an enraged traveling press behind, and mocked reporters for asking him if he would wait before starting his rally.But a Trump administration will let a press pool operate, according to spokeswoman Hope Hicks.""We fully expect to operate a traditional pool and look forward to implementing our plans in the near future. We appreciate your patience as we navigate the transition process,"" Hicks told Politico.Busy day planned in New York. Will soon be making some very important decisions on the people who will be running our government!SIGN UP FOR OUR NEWSLETTER
-- Donald J. Trump (@realDonaldTrump) November 11, 2016SIGN UP"
25	http://www.breitbart.com/2016-presidential-race/2016/11/11/hillary-campaign-ignored-bills-advice-target-working-class-whites/	Hillary Clinton Campaign Ignored Bill’s Advice to Target Working-Class Whites	"WASHINGTON, D.C. -- The Hillary Clinton campaign actively ignored Bill Clinton's political advice.SIGN UP FOR OUR NEWSLETTERThe campaign threw cold water on Bill's assertion that Hillary should target white working-class voters. In fact, the campaign said those voters are lost forever to Democrats and that the ethnic makeup of the party had changed.Politico reports:But Clinton allies are also faulting the campaign for failing to develop a credible message for downscale white voters, arguing she could have won by a larger margin on the economy.And some began pointing fingers at the young campaign manager, Robby Mook, who spearheaded a strategy supported by the senior campaign team that included only limited outreach to those voters -- a theory of the case that Bill Clinton had railed against for months, wondering aloud at meetings why the campaign was not making more of an attempt to even ask that population for its votes....But in general, Bill Clinton's viewpoint of fighting for the working class white voters was often dismissed with a hand wave by senior members of the team as a personal vendetta to win back the voters who elected him, from a talented but aging politician who simply refused to accept the new Democratic map. At a meeting ahead of the convention at which aides presented to both Clintons the ""Stronger Together"" framework for the general election, senior strategist Joel Benenson told the former president bluntly that the voters from West Virginia were never coming back to his party.Bill Clinton wavered on the trail between trashing Obamacare -- a rogue move that the campaign did not appreciate -- and sticking to progressive talking points, like about how ""old gray-haired white guys"" oppose immigration reform.Breitbart News lead Hillary Clinton reporter Patrick Howley witnessed the out-of-touch nature of the Clinton campaign in various states around the country throughout the election, before ultimately witnessing Clinton's defeat at the ballot box.Howley reported from a Clinton event in Washington, D.C., in November 2015:Young progressive women posed for cell phone pictures of themselves in the crowd, texted, scanned Facebook, and sought out good selfie angles while Clinton spoke, all the while cradling $10 cocktails purchased from multiple wet bars around the perimeter of the ballroom.""Lots of policy"" one twentysomething Clinton supporter complained to her male friend clad indoors in a high-dollar scarf.Before the speeches began, some middle-aged white women danced woodenly and offered supportive ""Woo""s to each other as the darkened venue blasted female-themed Top 40 hits like Andra Day's ""Rise Up"" and Martina McBride's ""This One's For The Girls."" A baby on a mother's body harness, meanwhile, made noise during the senators' speeches, and the occasional supporter, overly fired up, yelled out too loudly in agreement during Clinton's remarks while other women shot her a sideways glare.Clinton took the stage only after an extended video showing small cute children reciting progressive talking points, which was greeted with audible crows of ""Awww"" from the crowd.As the women and assorted bespectacled progressive men made their way outside to black cars and waiting valets, a homeless man desperately badgered the Clinton supporters for ""some help tonight.""And police sirens, just blocks away in the direction of Capitol Hill, blared in the city night.But Clinton allies are also faulting the campaign for failing to develop a credible message for downscale white voters, arguing she could have won by a larger margin on the economy.
And some began pointing fingers at the young campaign manager, Robby Mook, who spearheaded a strategy supported by the senior campaign team that included only limited outreach to those voters -- a theory of the case that Bill Clinton had railed against for months, wondering aloud at meetings why the campaign was not making more of an attempt to even ask that population for its votes.
...
But in general, Bill Clinton's viewpoint of fighting for the working class white voters was often dismissed with a hand wave by senior members of the team as a personal vendetta to win back the voters who elected him, from a talented but aging politician who simply refused to accept the new Democratic map. At a meeting ahead of the convention at which aides presented to both Clintons the ""Stronger Together"" framework for the general election, senior strategist Joel Benenson told the former president bluntly that the voters from West Virginia were never coming back to his party.var _ndnq = _ndnq || []; _ndnq.push([""embed""]);
Young progressive women posed for cell phone pictures of themselves in the crowd, texted, scanned Facebook, and sought out good selfie angles while Clinton spoke, all the while cradling $10 cocktails purchased from multiple wet bars around the perimeter of the ballroom.
""Lots of policy"" one twentysomething Clinton supporter complained to her male friend clad indoors in a high-dollar scarf.
Before the speeches began, some middle-aged white women danced woodenly and offered supportive ""Woo""s to each other as the darkened venue blasted female-themed Top 40 hits like Andra Day's ""Rise Up"" and Martina McBride's ""This One's For The Girls."" A baby on a mother's body harness, meanwhile, made noise during the senators' speeches, and the occasional supporter, overly fired up, yelled out too loudly in agreement during Clinton's remarks while other women shot her a sideways glare.
Clinton took the stage only after an extended video showing small cute children reciting progressive talking points, which was greeted with audible crows of ""Awww"" from the crowd.
As the women and assorted bespectacled progressive men made their way outside to black cars and waiting valets, a homeless man desperately badgered the Clinton supporters for ""some help tonight.""
And police sirens, just blocks away in the direction of Capitol Hill, blared in the city night.
SIGN UP"
