	Link	Title	Text
5	http://www.breitbart.com/big-government/2016/11/13/exclusive-acu-leader-matt-schlapp-rep-roger-williams-conservative-nrcc-needs-chairman/	Exclusive–ACU Leader Matt Schlapp: Rep. Roger Williams for NRCC Chairman ‘Open and Shut Case’	"The leader of the American Conservative Union told Breitbart News he is supporting Rep. Roger Williams (R.-Texas) to be the next leader of the National Republican Congressional Committee, the political wing for House Republicans.SIGN UP FOR OUR NEWSLETTER""The American Conservative Union feels it is very important that the leadership table includes conservatives. Roger Williams, in our opinion is one of the leading conservatives in Congress-having him around that leadership table will be very important-having someone around that leadership table, who has never wavered in his support for our nominee Donald Trump is very important,"" said Matt Schlapp, the chairman of the ACU.Schlapp said Williams has a rating with the American Conservative Union of 100 percent in 2014 and 96 percent in 2015.The Texas congressman is running against Ohio's Rep. Steve Stivers, whose 2014 and 2015 scores were 63 and 54, respectively. Stivers is the deputy chairman of the NRCC and an ally of the current outgoing chairman, Oregon's Rep. Greg Walden.""If you look at the two sets of scores, you can see why it is an open and shut case for ACU,"" he said.""Roger has a much, much better record,"" Schlapp said.""I've known Roger Williams for 16 years,"" said Schlapp, who met Williams when the two men worked to elect Texas Gov. George W. Bush president in 2000. At the time, Williams was a key fundraiser for the Bush campaign, a role he played in the Bush's 1994 and 1998 runs for governor and in President Bush's 2004 reelection campaign.Schlapp said he developed a strong bond with Williams, when the former minor league pitcher was the Texas secretary of state ramping up for a Senate run in 2012. Williams instead ran for Congress where he represents a north-south drawn district between Austin and Fort Worth.It is important to appreciate that Williams was an early and unwavering supporter of President-elect Donald J. Trump, Schlapp added.""I talked to Roger early about Trump and when it looked like he was going to get the nomination and he never wavered,"" he said. ""Even though, he has friendships with the Bush family, and others, too.""The whole way, when others were not solid, Williams was solid, he said.""I've never regretted stepping forward for Roger,"" he said. ""He's a campaign pro, who's run for office himself, as everyone up for NRCC has, but he has been around the operations of campaigns for decades and he has been at the side of the people, who write the big checks, who raise the big checks.""There is a tendency with politicians to hand over control of a campaign to the professionals, Schlapp continued. ""But, in Roger's case, he has an understanding of how the money 'should' be spent and I think he has a very innovative plan to change the way the NRCC has always done business.""The NRCC has not kept up with the way campaigns and campaign communication are handled in today's politics.""The Trump victory shows us that many Republican operatives are playing from a playbook that is a generation old and ineffective,"" Schlapp said. ""Roger is open to the idea that politics is not a stagnant operation.""Schlapp said he likes that Williams promised to keep the NRCC out of primaries. In the past, the NRCC has put its thumb on the scale for candidates in the primaries, who end up being less conservative.""I have been involved in these conversations through the cycles-should they be involved? should they not be involved?-the problem with the NRCC is that they fall in love with self-funded candidates, who more often than not tend to be philosophically much softer-they love self-funders because they have to spend less.""The job of a national party's committee is to pull people together and make sure the best candidates are supported, but when a committee tied to the national party, like the NRCC, plays in a primary, it creates bitterness and alienation, he said.""The NRCC's job is not to be the leading voice on ideology, but that can be so abused and I have seen past chairmen, where they almost always get involved in primaries to help the candidate that represents the quote-unquote business interests-right? and which is usually the euphemism for being a moderate.""It is okay that the GOP is a party of moderates and conservatives, he said.""But, the heart and soul of the party is the conservative activists,"" he said. ""When the party doesn't stand for that the party starts to have big trouble and I think Roger understands that very well-yes, we want Republicans from all over the country, and that means cities and towns and rural areas-but, the heart and soul of the party should never be changed and the heart and soul really spoke up in the last election.""Williams knows what he knows and like Trump he is full of energy, Schlapp said.""Roger never stops, that is why he is so successful in business, that's why he has so many friends, it's why he is such a good fundraiser,"" he concluded.SIGN UP"
6	http://www.breitbart.com/big-government/2016/11/13/safety-pin-anti-trump-protesters-adopt-diaper-symbol/	Red Diaper Babies: Anti-Trump Protesters Adopt Safety Pin as Symbol	"Protesters rejecting the election of Donald Trump as President of the United States have adopted the safety pin as a symbol of their movement. Safety pins were once associated with diapers, and were ubiquitous in the age before disposable diapers.SIGN UP FOR OUR NEWSLETTERUSA Today reports:Safety pins have become a symbol of solidarity with refugees and other migrants since the historic Brexit vote to leave the European Union in June.Now, people in the United States are showing that they are allies with groups -- including LGBT, minorities and women -- who say they feel threatened by Donald Trump's election.New York magazine, which taunted Donald Trump with a cover story entitled ""LOSER"", printed and distributed before the actual vote, reports further:As stories of post-election violence and hate speech circulate online, some people have begun wearing safety pins to identify themselves as allies in the fight against intolerance, and to show solidarity with women, LGBT people, immigrants, and people of color feeling frightened by Trump's presidency and the vitriol that some of his supporters display.Many of the stores of ""hate crimes"" by Trump supporters have been fabricated or exaggerated.Nevertheless, many anti-Trump celebrities have taken to wearing safety pins.#Safetypin pic.twitter.com/MGFcjx68BP-- Patrick Stewart (@SirPatStew) November 11, 2016
Support the vulnerable in Trump's America.
 Wear a safety pin as solidarity. #safetypin pic.twitter.com/G5aDWNbIUH-- James Melville (@JamesMelville) November 11, 2016
The American Civil Liberties Union is also encouraging the protest.Change your profile picture to a #safetypin to show that you stand against hate and bigotry https://t.co/A73un3ruoS #safetypinamerica pic.twitter.com/ka2Gk6c2fg-- ACLU National (@ACLU) November 13, 2016""Explainer"" website Vox.com is also promoting the safety pin as an anti-Trump symbol.Curiously, it avoids explaining the use of safety pins in an earlier age of child-rearing.Joel B. Pollak is Senior Editor-at-Large at Breitbart News. His new book, See No Evil: 19 Hard Truths the Left Can't Handle, is available from Regnery through Amazon. Follow him on Twitter at @joelpollak.Safety pins have become a symbol of solidarity with refugees and other migrants since the historic Brexit vote to leave the European Union in June.
Now, people in the United States are showing that they are allies with groups -- including LGBT, minorities and women -- who say they feel threatened by Donald Trump's election.As stories of post-election violence and hate speech circulate online, some people have begun wearing safety pins to identify themselves as allies in the fight against intolerance, and to show solidarity with women, LGBT people, immigrants, and people of color feeling frightened by Trump's presidency and the vitriol that some of his supporters display.
#Safetypin pic.twitter.com/MGFcjx68BP
-- Patrick Stewart (@SirPatStew) November 11, 2016
Support the vulnerable in Trump's America.
 Wear a safety pin as solidarity. #safetypin pic.twitter.com/G5aDWNbIUH
-- James Melville (@JamesMelville) November 11, 2016
var _ndnq = _ndnq || []; _ndnq.push([""embed""]);
Change your profile picture to a #safetypin to show that you stand against hate and bigotry https://t.co/A73un3ruoS #safetypinamerica pic.twitter.com/ka2Gk6c2fg
-- ACLU National (@ACLU) November 13, 2016SIGN UP"
7	http://www.breitbart.com/sports/2016/11/13/ufc-new-york-debut-victory-corruption-says-joe-rogan/	UFC New York Debut a Victory over ‘Corruption’ Says Joe Rogan	"Joe Rogan opened the UFC 205 broadcast by celebrating the triumph over ""corruption"" that allowed mixed-martial arts (MMA) to finally hold a sanctioned event in the Empire State.SIGN UP FOR OUR NEWSLETTERGovernor Andrew Cuomo signed legislation earlier this year that paved the way for professional MMA events in New York. The bill becoming law made New York the final state among the 50 to sanction the young sport.Longtime New York state assembly speaker Sheldon Silver blocked MMA legalization for years. But his arrest and conviction on public corruption charges imprisoned the speaker and freed up log-jammed legislation.A grudge against the open-shop policies of a casino chain owned by the former owners of the UFC strangely migrated from Nevada to New York to prevent MMA from holding professional events in the state. Silver's alliance with organized labor meant that any proposed bill to give the sport the state's imprimatur never received an up-or-down vote.""The reason MMA is not sanctioned in New York is because there is a lot of money from the culinary unions who have an old grudge with the Fertittas about Station Casinos not using the culinary unions in Las Vegas,"" Urijah Faber told Breitbart Sports at a UFC 169 presser strategically held in Madison Square Garden almost four years ago. ""It's corrupt. It's wrong. It's something that everyone should be ashamed of if you're a part of it.""Saturday night's Madison Square Garden event witnessed the Empire State debut of several New York-area natives, including Long Islander Chris Weidman. He entered the octagon Saturday night to the opening bars of Billy Joel's ""New York State of Mind"" before it transitioned into several other songs.""It would be an absolute dream come true,"" Weidman told Breitbart Sports two years ago about fighting in Madison Square Garden. ""I'm working really hard fighting all around the world. [Mixed-martial arts] is legal pretty much everywhere else in the world. That it's not in my home state is disheartening. Fighting in Madison Square Garden, or in the Nassau Coliseum, would definitely be a dream come true.""Weidman, ahead on the cards heading into the third round, caught a freak flying knee from Yoel Romero Saturday night that turned his dream into a nightmare from which he awoke after several seconds seemingly asleep.Though Weidman's loss disappointed the crowd, wins by locals Frankie Edgar and Jim Miller cheered up the packed house. A back-and-forth Tyron Woodley-Stephen Thompson draw and Joanna Jedrzejczyk decisioning a tough Karolina Kowalkiewicz similarly elevated the event. In the featured bout, Conor McGregor electrified the audience by knocking down Eddie Alvarez five times before intervention from the third man in the cage.""This is where the UFC belongs,"" UFC announcer Mike Goldberg declared. ""We are finally here.""SIGN UP"
8	http://www.breitbart.com/2016-presidential-race/2016/11/13/politico-ryan-no-concerns-bannon-trump-chief-staff/	Politico: Ryan Has ‘No Concerns’ with Bannon as Trump Chief of Staff	"From Politico:SIGN UP FOR OUR NEWSLETTERPaul Ryan on Sunday said he has ""no concerns"" about President-elect Donald Trump hiring one of the speaker's longtime critics as his chief of staff: Breitbart chief Steve Bannon.""I've never met the guy,"" Ryan said on CNN's ""State of the Union."" ""I don't know Steve Bannon so I have no concerns. I trust Donald's judgment. I think he will pick who will best serve him, and I'm sure we will work well with whomever his chief of staff is.""Bannon, the executive chairman of Breitbart who joined Trump's campaign in August as CEO, is believed to be one of two finalists for the top White House post. The other is Republican National Committee chairman Reince Priebus, a close Ryan ally and fellow Wisconsinite. Trump is expected to announce his chief of staff within days.Read the rest here. Paul Ryan on Sunday said he has ""no concerns"" about President-elect Donald Trump hiring one of the speaker's longtime critics as his chief of staff: Breitbart chief Steve Bannon.SIGN UP FOR OUR NEWSLETTER
""I've never met the guy,"" Ryan said on CNN's ""State of the Union."" ""I don't know Steve Bannon so I have no concerns. I trust Donald's judgment. I think he will pick who will best serve him, and I'm sure we will work well with whomever his chief of staff is.""
Bannon, the executive chairman of Breitbart who joined Trump's campaign in August as CEO, is believed to be one of two finalists for the top White House post. The other is Republican National Committee chairman Reince Priebus, a close Ryan ally and fellow Wisconsinite. Trump is expected to announce his chief of staff within days.SIGN UP"
9	http://www.breitbart.com/big-journalism/2016/11/13/trump-stress-expert-media-blame-lefts-post-election-freakout/	Stress Expert: Media to Blame for Left’s Post-Trump Freakout	"Dr. Pete Sulack, stress expert and founder of StressRX.com, told Breitbart News on Friday that the media bears some of the blame for the deep distress felt by some Hillary Clinton supporters, and the public unrest, after Tuesday's election results.SIGN UP FOR OUR NEWSLETTER""The media is partly to blame for actively fueling fears of some kind of Nazi regime under a Trump presidency,"" Sulack said, via e-mail. ""In part this is because problems and pain sell advertising space. Mass communications has always struggled with that balance between fair reporting, personal bias, and pressure from executives to keep things 'hot.'""He noted that people were responding negatively to anti-Trump images on television and social media.""When we read, we can rationally discuss the issues or definitions of terms at hand. When we see pictures, however, a different part of our brain is engaged.""That part is the limbic brain, a part also activated in stressful situations, because it is key to survival. This is the most primitive and unevolved part of us. It acts on emotion, is irrational, childish, and afraid. It can be rude and boorish, and sometimes even cruel,"" he said.Sulack notes that many voters are also upset because they feel ""hopeless and powerless."" To deal with the stress, he recommends avoiding alcohol and caffeine, and instead eating dark chocolate, ""tree nuts or nut butters,"" and ""kale and other leafy, green vegetables.""Teen mental health expert Jamison Monroe, Founder and CEO of Newport Academy, says that while the media are fueling some of the anxiety, much of it comes from information shared by peers through social media.""Media greatly influences people's thoughts and opinions. However, teens are very influenced by their peer groups, so reading their peers' political opinions on social platforms has just as much influence, for this is where a majority of millennials get their news from,"" he told Breitbart News, via email.He explained that feelings of stress were not just triggered by the election result, but the entire campaign. ""Feelings of distress are now heighted due to the snowball effect of emotions throughout the entire election,"" he said.For the distressed, Monroe recommended meditating, and avoiding social media altogether.""Many people post their thoughts about the election on social media, and election posts currently make up most people's news feeds,"" he said.Joel B. Pollak is Senior Editor-at-Large at Breitbart News. His new book, See No Evil: 19 Hard Truths the Left Can't Handle, is available from Regnery through Amazon. Follow him on Twitter at @joelpollak.SIGN UP"
10	http://www.breitbart.com/big-government/2016/11/13/police-charge-45-yr-old-louisiana-basketball-coach-molesting-sexting-3-students/	Police Charge 45-Yr-Old Louisiana Basketball Coach with Molesting and Sexting 3 Students	"Police in Louisiana have arrested and charged a married female high school basketball coach with having sex with multiple boys and sexting them on multiple occasions.SIGN UP FOR OUR NEWSLETTERAfter being confronted with the nude photos she sent the boys, Nicole Aymond, 45, of Port Barre, Louisiana, admitted to police that she had sex with two students and sexual contact with a third. All three Port Barre High School students are between the ages of 17 and 18.Officials became involved when the mother of one of the victims alerted police about the naked photos sent to her son by the teacher.While she faces three counts of prohibited sexual misconduct as an educator to a student, Aymond won't face child rape charges because the age of consent in Louisiana is 17.""I just think it's horrible they ought to let her go and never let her go back to where there are kids,"" one Port Barre resident told KLFY Channel 10.""It upset us very much,"" the resident added. ""We know of her and we know who she's married to and it just hurts us to think she could even do something like that.""The suspect's husband also works for the school district.Port Barre Police Chief, Deon Boudreaux, said his department has had allegations of untoward behavior between a teacher and students before, but this is the first time concrete evidence has turned up in such a case.Chief Boudreaux added, ""But there's another law that prohibits school teachers, educators from getting into a sexual relationship with a student at a school their [sic] employed too. Under the age of 21.""The St. Landry Parish School Board said they cannot comment until the investigation is complete.Aymond's bail was set at $7,500.Follow Warner Todd Huston on Twitter @warnerthuston or email the author at igcolonel@hotmail.com.SIGN UP"
11	http://www.breitbart.com/big-government/2016/11/13/university-admissions-officer-blasts-christians-conservatives-worthless-trash/	University Admissions Officer Blasts Christians and Conservatives as “Worthless Trash”	"FAIRFAX, Va.--A top admissions officer at George Mason University (GMU) condemns faithful Christians and conservatives as ""worthless trash,"" a sentiment that could alarm thousands of high school students seeking admission to the university, and raises serious First Amendment problems if it impacts any admission decisions.SIGN UP FOR OUR NEWSLETTERAndrew Bunting is senior assistant director of admissions at GMU, and also a member of the public university's Staff Senate. On his Facebook page, Bunting posted:Read article. NOM, a recognized HATE GROUP by the Southern Poverty Law Center, is not representative of the key pillars of American society. They seek to limit life. Limit liberty. Limit Freedom. Limit the pursuit of happiness for million of American [sic]. If you agree with them then that is your opinion. Just know that to the rest of us, you are a piece of worthless trash.This article Bunting referenced was from the blog of NOM: the National Organization for Marriage. NOM's president is a devout Roman Catholic, and the organization is staffed by individuals who share a deeply religious belief that marriage is between one man and one woman.Bunting is citing material from the Southern Poverty Law Center (SPLC), an ultra-left anti-Christian organization that has labeled dozens of conservative organizations as ""hate groups,"" including faith-based groups like the Family Research Council (FRC), immigration groups like the Federation for American Immigration Reform (FAIR), and various Tea Party groups.SPLC explicitly equates such conservative organizations with the racist Ku Klux Klan (KKK). SPLC also posts maps to their offices, one of which was used by Floyd Lee Corkins in 2012 to enter FRC's office in Washington, D.C., with a firearm and more than 50 rounds of ammunition. Corkins shot the office manager, and planned to assassinate everyone in the building. He was disarmed by the wounded manager, and later was convicted of domestic terrorism. Corkins is currently serving a 25-year prison sentence. SPLC never apologized, and continues to post maps with directions to the offices of conservative organizations it calls hate groups.Decades ago SPLC was a leading organization on identifying and combating racism. But in recent years its views are so extreme that even the Obama administration stopped using their material for military and anti-terrorism training.GMU is a state university, making it part of the Commonwealth of Virginia. As such, it is bound by the First Amendment's guarantees that the government will not oppose student applicants for exercising their rights to free speech and religious liberty. Those rights apply with full force to the university through the Constitution's Fourteenth Amendment.The First Amendment forbids viewpoint discrimination, which is when, for any particular issue, the government cannot take sides in favor of one viewpoint over another. For example, on the topic of abortion, the government cannot say it will allow pro-abortion statements but frown upon pro-life statements.The Supreme Court has held that the government can decide which views it wants to promote and adopt. But when it comes to private citizens expressing their personal views on politics or religion, the government cannot penalize citizens with whom someone representing the government disagrees.More than that, employers are legally liable for the actions taken by their employees when those employees are carrying out their job duties within the context of their employment.Taken together, in this situation, that means if Bunting plays a role in denying admission into GMU's freshman class a high-school senior because that student expresses Evangelical or Catholic beliefs on marriage or sexuality--or a secular conservative who expresses a conservative political viewpoint on any public issue or applaudes Republican victories on Election Day--then GMU would be violating the First Amendment, and could be sued by that applicant for illegal discrimination.Conservative and religious groups have noted increasing bias against their beliefs at colleges and universities in recent years.Ken Klukowski is senior legal editor for Breitbart News and earned his law degree from the Antonin Scalia Law School at George Mason University. Follow him on Twitter @kenklukowski.Read article. NOM, a recognized HATE GROUP by the Southern Poverty Law Center, is not representative of the key pillars of American society. They seek to limit life. Limit liberty. Limit Freedom. Limit the pursuit of happiness for million of American [sic]. If you agree with them then that is your opinion. Just know that to the rest of us, you are a piece of worthless trash.SIGN UP"
