	Unnamed: 0	Link	Title	Text	Terms	Topics
0	0	http://www.breitbart.com/jerusalem/2016/10/12/syrian-opposition-site-putin-will-take-advantage-lame-duck-obama/	Syrian Opposition Site: Putin Will Take Advantage of ‘Lame Duck’ Obama	"A Syrian opposition website has warned that Russian President Vladimir Putin will try to create a situation that is more beneficial to his own interests even as he takes advantage of the time he has left before the ""lame duck"" in Washington is replaced and that ""it is clear to Putin that the next administration will take a much tougher stance against the Kremlin.""SIGN UP FOR OUR NEWSLETTERIn an editorial titled ""Before the lame duck leaves,"" the website Sham Network opined that when Syrian President Bashar al-Assad announced in March he intended to retake all Syrian territories from opposition forces, Putin replied by announcing that he was withdrawing all of his forces from the country ""as a clear warning to Assad that he must contribute to the success of the third Geneva talks. But now the reality has changed; Assad again announced that he would liberate all of Syria, the Russian missiles and Navy continued to swarm toward Syria and Moscow has warned Washington against any attempt to harm the Syrian regime, saying that any American military action will lead to a crisis in the entire region.""The website added that, ""What's funny is that Putin knows that the Obama administration won't do anything militarily, but he insisted on increasing his threats against Washington in order to show that Russia is returning to its role as the polar opposite in the Middle East, and as many are saying in the U.S., Putin is taking advantage of the days left to the lame duck in the White House to help Assad rehabilitate his regime and to return more territories under his control to reduce the opposition that will still stand for the next President.""The site noted that Putin's window of opportunity will remain open until next March, when the next administration will begin to take action:""And within these five months, Putin will try to create a reality that matches his calculations in Syria and it is clear to him that the next administration will take a much tougher stance against the Kremlin and against the Syrian regime and that the policy of inaction that Obama adopted, claiming that Russia and Iran would be left to sink in the bloody mire of Syria."" SIGN UP"	['Obama']	[]
1	1	http://www.breitbart.com/big-government/2016/10/12/common-cores-workforce-development-mission-conflict-goals-catholic-schools/	Common Core’s ‘Workforce Development’ Mission in Conflict With Goals of Catholic Schools	"A study finds that the mission of the Common Core standards: to provide a school-to-work force of young people who will satisfy the need for low-pay workers in the United States, is incompatible with the goals of Catholic education.SIGN UP FOR OUR NEWSLETTERThe K-12 Common Core's focus on workforce development is at odds with the mission of Catholic schools and should be abandoned by their dioceses, says the study.The Boston-based Pioneer Institute and the Washington D.C.-based American Principles Project published the study, titled ""After the Fall: Catholic Education Beyond the Common Core.""Authors Anthony Esolen, Dan Guernsey, Jane Robbins, and Kevin Ryan are critical of the National Catholic Education Association's (NCEA) push to get Catholic schools on board with Common Core. They argue the Core's insistence that K-12 English and math standards focus on skills that can transfer easily to current-day work situations abandons a primary goal of Catholic education: to help students develop their spirituality and ethical principles.""[T]he Common Core is undoubtedly and unacceptably workforce-oriented, thereby misinforming student character and impoverishing academic content,"" the authors write. ""Catholic schools typically embrace character education and rely heavily on language arts, history, and religion curricula as crucial means to educate and inspire students toward a virtuous life. Adopting the new standards may seriously compromise this essential effort.""The authors also document how the Common Core's developers view ""workforce development"" as ""the proper goal of education,"" one that is considered primary by the political supporters of the standards.They continue:The workforce educational model currently being promoted by the government relies heavily on the concept of training. It aims to train students in certain skills of information-processing and mathematical abilities that transfer rather directly to today's world of work. Training consists of learning how to accomplish a task and ""getting the job done."" At the heart of the Common Core agenda is a century-old dream of Progressive educators to redirect education's mission away from engaging the young in the best of human thought and focusing instead on preparation for ""real life."" While a reasonable but quite secondary goal, workforce-development is dwarfed by Catholic schools' transcendent goals of human excellence, spiritual transformation, and preparation for ""the next life"" as well.In 2013, NCEA was awarded $100,007 by the Bill and Melinda Gates Foundation - the primary source of private funding for the promotion of the Common Core standards - to encourage Catholic schools in the adoption of the Common Core standards. Two years later, NCEA drew further outrage for inviting Common Core ""architect"" David Coleman to serve as the keynote speaker for the organization's annual convention.Also in 2013, with approximately 100 out of 195 Catholic dioceses in the United States embracing Common Core for its schools, more than 130 Catholic scholars sent a letter to the U.S. Catholic bishops requesting that they abandon any implementation of the Common Core standards.The letter read:Promoters of Common Core say that it is designed to make America's children ""college and career ready."" We instead judge Common Core to be a recipe for standardized workforce preparation. Common Core shortchanges the central goals of all sound education and surely those of Catholic education: to grow in the virtues necessary to know, love, and serve the Lord, to mature into a responsible, flourishing adult, and to contribute as a citizen to the process of responsible democratic self-government.In fact, we are convinced that Common Core is so deeply flawed that it should not be adopted by Catholic schools which have yet to approve it, and that those schools which have already endorsed it should seek an orderly withdrawal now.In place of Common Core, the new study's authors recommend building upon ""the long Catholic educational tradition, including recent Church and papal writings, to present a positive foundation for moving Catholic schools forward in a post-Common Core world.""The authors say Catholic schools distinguish themselves uniquely from public schools through their embrace of ""the transcendent and universal attributes of truth, beauty, and goodness.""""Goodness teaches about the perfection of being and the enduring goals of each of us,"" they write. ""Truth is to know reality, and proper schooling provides the tools to reason and to gain access to the true nature of reality.""""The advent of the Common Core has not only provided clarity to the unique value of Catholic schools, but also offers the opportunity for
 their advancement and the articulation of their competitive advantage,"" the authors conclude. ""Never were they more attractive. Never were they more needed.""The workforce educational model currently being promoted by the government relies heavily on the concept of training. It aims to train students in certain skills of information-processing and mathematical abilities that transfer rather directly to today's world of work. Training consists of learning how to accomplish a task and ""getting the job done."" At the heart of the Common Core agenda is a century-old dream of Progressive educators to redirect education's mission away from engaging the young in the best of human thought and focusing instead on preparation for ""real life."" While a reasonable but quite secondary goal, workforce-development is dwarfed by Catholic schools' transcendent goals of human excellence, spiritual transformation, and preparation for ""the next life"" as well.Promoters of Common Core say that it is designed to make America's children ""college and career ready."" We instead judge Common Core to be a recipe for standardized workforce preparation. Common Core shortchanges the central goals of all sound education and surely those of Catholic education: to grow in the virtues necessary to know, love, and serve the Lord, to mature into a responsible, flourishing adult, and to contribute as a citizen to the process of responsible democratic self-government.
In fact, we are convinced that Common Core is so deeply flawed that it should not be adopted by Catholic schools which have yet to approve it, and that those schools which have already endorsed it should seek an orderly withdrawal now.SIGN UP"	['Coleman']	[]
2	2	http://www.breitbart.com/radio/2016/10/12/frank-gaffney-hillary-clintons-immigration-policies-put-u-s-road-sharia-state/	Frank Gaffney: Hillary Clinton’s Immigration Policies Put U.S. on ‘Road to a Sharia State’	"Frank Gaffney, president and founder of the Center for Security Policy, joined SiriusXM host Alex Marlow on Wednesday's Breitbart News Daily to share his observations on the latest WikiLeaks disclosure of Hillary Clinton documents.SIGN UP FOR OUR NEWSLETTERGaffney said his biggest takeaway was that revelations about Hillary Clinton's ""personal involvement in corrupt activities and policy choices that have been disastrous for America"" are coming so rapidly that it is difficult to keep up with them all - and the mainstream media have very little interest in keeping up with any of it.""This stuff is hemorrhaging out now, and I think that especially when, as you say, we've got to spend really all of our available time focusing the banter, and the locker room, and so on. We're not doing justice to a fraction of it,"" he lamented.He zeroed in on a particular disclosure from an email revealed by WikiLeaks, in which Clinton privately said the governments of Saudi Arabia and Qatar were secretly funding the Islamic State.""It really puts back into focus - I know Mrs. Clinton doesn't want that, but we sure need it - it puts back into focus the double game the Saudis have been playing, and for that matter, other Islamic supremacists doing business under other banners, notably the Muslim Brotherhood,"" Gaffney said. ""But we're watching this election play out, and it's not just the progressive Left - which you've made some very important points about, and Andrew Breitbart, of course, was determined to defeat. Andrew was also, as you know so well, Alex, determined to prevent the Islamic supremacists, the jihadists, from accomplishing here what they've sought to do in Europe and elsewhere, which is to subvert us from within,"" he warned.Gaffney recommended a ""very powerful film"" called The Enemies Within by New Zealander Trevor Loudon, which explores ""the ties between the Clintons, and for that matter, a whole bunch of other Democratic Party operatives and leaders, in Congress and elsewhere, the labor unions and on and on - both with respect of course to the hard Left, and I'm talking not just the so-called progressives; I'm talking about the socialists, I'm talking about the communists, the radical Left - and the Islamists.""Gaffney called The Enemies Within a ""staggering indictment of what has been happening in our government now for many years.""""What Trevor does, a scrupulously careful researcher, and he's showing how you connect the dots between the people who have essentially penetrated our institutions - academia, the labor movement, the government, the media, and on and on, and how they have wrought this subversion from within by essentially grabbing the people who were coming up through the ranks of the Democratic Party over the years, and how they were training them, how they were getting them elected, and how they were now able to essentially direct and dominate the kinds of statutory work that they do in Congress, the kind of administrative policies and orders that the President's been executing, and so on.""""It's that combination of what Trevor, and the rest of us, I think, are increasingly calling the Red-Green Axis that's so important here,"" Gaffney stressed. ""It's not just the Left we're dealing with, it's not just the so-called Red. It's not just the Islamists, the so-called Green. It's the combination of the two. And oh, by the way, you can throw in the Black, as well, because they are very actively working, as Trevor documents in The Enemy Within, the Black Lives Matter movement, Soros money, and on and on.""""You can write this down if you want, as some elegant and exhaustive conspiracy theory,"" he acknowledged, ""but the dots are there to be connected. It's not a conspiracy theory; it's a conspiracy. We are facing the decades-long legacy that if we don't stop it now, if we don't prevent it from having another four years to metastasize further, I'm sorry to say I'm not sure it's reversible."" ""These are the sort of things that ought to be front and center in this election campaign, and I thank God for the work you're doing every day, trying to get this back into focus, and make sure that the kind of information that is coming out - not in dribs and drabs but in a fire hose, from WikiLeaks and other sources - about Hillary Clinton's judgment, policy predilections, associations, and corruption is given the kind of attention that it has to have before we turn over the country to her and her ilk,"" Gaffney told Marlow. Returning to the question of the Saudis and Qataris funding the Islamic State, Gaffney said, ""It's not exactly news, but the fact that they were also funding her, and her husband, and their family foundation, and the library, and on and on, is a big deal.""""To have it now out in her own words, according to these leaked documents, is a big deal, and the fact that it has allowed the Clintons - and, I'm sorry to say, the Bushes, too - to engage in a policy that has effectively supported people who are trying to take us down, namely the Saudis. They're supporting both the Islamic State, and the Muslim Brotherhood, and every other Islamic supremacist entity, with the possible exception of the guys that the Iranians, the Shiites, are supporting,"" Gaffney charged, adding that ""there seems to be a lot of crossover there, too.""He said this was nothing less than ""the betrayal of our country, and it ought to be front-and-center in an evaluation of whether this woman is fit to be our commander-in-chief, let alone what she would do if she were able to exercise the reins of power in that position.""Gaffney agreed with Marlow that the ""connective tissue"" between other leaked Clinton emails is that ""like those on the hard Left, Hillary Clinton does, in fact, admire central statism, and globalism, and yes, the elimination of our country.""""They can dress it up with other terms, but fundamentally, as you've said, and several of your callers did this morning, that's what open borders gets you,"" he argued. ""And, by the way, there was a terrific piece at Breitbart London yesterday about this woman, Dr. Machteld Zee out of the Netherlands, it turns out a former, pretty leftist academic there, who has done a study; she's published it in a book that talks about what she calls the holy alliance ... a powerful new book about the road to a sharia state. That is, in fact, what we're dealing with when we talk about at least some of the people that are intent on coming across, that Hillary Clinton is intent upon bringing across our open borders, or bringing in as refugees.""(The book Gaffney referred to is entitled Holy Identities: On the Road to a Sharia State. Breitbart London's article about Dr. Zee can be read here.)""When you look at these various leaks, when you look at the documentation that's coming out, when you look at her record, when you look at Huma Abedin, as we've been talking about, and her influence, it couldn't be more clear that Hillary Clinton's objective - as is true of so many others like her on the radical Left, and their Islamist allies - is mutating beyond recognition this country,"" Gaffney warned. ""The President called it 'fundamentally transforming' it. And if they can get away with it, over the next four years, we're done. We're literally done as a republic, recognizable by anyone who is familiar with our Constitution, at least.""Breitbart News Daily airs on SiriusXM Patriot 125 weekdays from 6:00 a.m. to 9:00 a.m. Eastern.LISTEN:SIGN UPGaffney said his biggest takeaway was that revelations about Hillary Clinton's ""personal involvement in corrupt activities and policy choices that have been disastrous for America"" are coming so rapidly that it is difficult to keep up with them all - and the mainstream media have very little interest in keeping up with any of it.""This stuff is hemorrhaging out now, and I think that especially when, as you say, we've got to spend really all of our available time focusing the banter, and the locker room, and so on. We're not doing justice to a fraction of it,"" he lamented.He zeroed in on a particular disclosure from an email revealed by WikiLeaks, in which Clinton privately said the governments of Saudi Arabia and Qatar were secretly funding the Islamic State.""It really puts back into focus - I know Mrs. Clinton doesn't want that, but we sure need it - it puts back into focus the double game the Saudis have been playing, and for that matter, other Islamic supremacists doing business under other banners, notably the Muslim Brotherhood,"" Gaffney said. ""But we're watching this election play out, and it's not just the progressive Left - which you've made some very important points about, and Andrew Breitbart, of course, was determined to defeat. Andrew was also, as you know so well, Alex, determined to prevent the Islamic supremacists, the jihadists, from accomplishing here what they've sought to do in Europe and elsewhere, which is to subvert us from within,"" he warned.Gaffney recommended a ""very powerful film"" called The Enemies Within by New Zealander Trevor Loudon, which explores ""the ties between the Clintons, and for that matter, a whole bunch of other Democratic Party operatives and leaders, in Congress and elsewhere, the labor unions and on and on - both with respect of course to the hard Left, and I'm talking not just the so-called progressives; I'm talking about the socialists, I'm talking about the communists, the radical Left - and the Islamists.""Gaffney called The Enemies Within a ""staggering indictment of what has been happening in our government now for many years.""""What Trevor does, a scrupulously careful researcher, and he's showing how you connect the dots between the people who have essentially penetrated our institutions - academia, the labor movement, the government, the media, and on and on, and how they have wrought this subversion from within by essentially grabbing the people who were coming up through the ranks of the Democratic Party over the years, and how they were training them, how they were getting them elected, and how they were now able to essentially direct and dominate the kinds of statutory work that they do in Congress, the kind of administrative policies and orders that the President's been executing, and so on.""""It's that combination of what Trevor, and the rest of us, I think, are increasingly calling the Red-Green Axis that's so important here,"" Gaffney stressed. ""It's not just the Left we're dealing with, it's not just the so-called Red. It's not just the Islamists, the so-called Green. It's the combination of the two. And oh, by the way, you can throw in the Black, as well, because they are very actively working, as Trevor documents in The Enemy Within, the Black Lives Matter movement, Soros money, and on and on.""""You can write this down if you want, as some elegant and exhaustive conspiracy theory,"" he acknowledged, ""but the dots are there to be connected. It's not a conspiracy theory; it's a conspiracy. We are facing the decades-long legacy that if we don't stop it now, if we don't prevent it from having another four years to metastasize further, I'm sorry to say I'm not sure it's reversible."" ""These are the sort of things that ought to be front and center in this election campaign, and I thank God for the work you're doing every day, trying to get this back into focus, and make sure that the kind of information that is coming out - not in dribs and drabs but in a fire hose, from WikiLeaks and other sources - about Hillary Clinton's judgment, policy predilections, associations, and corruption is given the kind of attention that it has to have before we turn over the country to her and her ilk,"" Gaffney told Marlow. Returning to the question of the Saudis and Qataris funding the Islamic State, Gaffney said, ""It's not exactly news, but the fact that they were also funding her, and her husband, and their family foundation, and the library, and on and on, is a big deal.""""To have it now out in her own words, according to these leaked documents, is a big deal, and the fact that it has allowed the Clintons - and, I'm sorry to say, the Bushes, too - to engage in a policy that has effectively supported people who are trying to take us down, namely the Saudis. They're supporting both the Islamic State, and the Muslim Brotherhood, and every other Islamic supremacist entity, with the possible exception of the guys that the Iranians, the Shiites, are supporting,"" Gaffney charged, adding that ""there seems to be a lot of crossover theretoo.""He said this was nothing less than ""the betrayal of our country, and it ought to be front-and-center in an evaluation of whether this woman is fit to be our commander-in-chief, let alone what she would do if she were able to exercise the reins of power in that position.""Gaffney agreed with Marlow that the ""connective tissue"" between other leaked Clinton emails is that ""like those on the hard Left, Hillary Clinton does, in fact, admire central statism, and globalism, and yes, the elimination of our country.""""They can dress it up with other terms, but fundamentally, as you've said, and several of your callers did this morning, that's what open borders gets you,"" he argued. ""And, by the way, there was a terrific piece at Breitbart London yesterday about this woman, Dr. Machteld Zee out of the Netherlands, it turns out a former, pretty leftist academic there, who has done a study; she's published it in a book that talks about what she calls the holy alliance ... a powerful new book about the road to a sharia state. That is, in fact, what we're dealing with when we talk about at least some of the people that are intent on coming across, that Hillary Clinton is intent upon bringing across our open borders, or bringing in as refugees.""(The book Gaffney referred to is entitled Holy Identities: On the Road to a Sharia State. Breitbart London's article about Dr. Zee can be read here.)""When you look at these various leaks, when you look at the documentation that's coming out, when you look at her record, when you look at Huma Abedin, as we've been talking about, and her influence, it couldn't be more clear that Hillary Clinton's objective - as is true of so many others like her on the radical Left, and their Islamist allies - is mutating beyond recognition this country,"" Gaffney warned. ""The President called it 'fundamentally transforming' it. And if they can get away with it, over the next four years, we're done. We're literally done as a republic, recognizable by anyone who is familiar with our Constitution, at least."""	['Black', 'Clinton']	['god']
3	3	http://www.breitbart.com/2016-presidential-race/2016/10/12/donald-trump-releases-tv-ad-attacking-hillary-clinton-pay-play-politics/	Donald Trump Releases TV Ad Attacking Hillary Clinton on Pay-To-Play Politics	"The Trump campaign is running a national television ad going after Hillary Clinton and the alleged pay-to-play scheme with the Clinton Foundation.SIGN UP FOR OUR NEWSLETTER""The Clintons: from dead broke to worth hundreds of millions...So how did Hillary end up filthy rich?"" the ad's voice over says.It continues:Pay to play politics. Staggering amounts of cash poured into the Clinton Foundation from criminals, dictators, countries that hate America. Hillary cut deals for donors. Sold out American workers, exploited Haitians in need, She even gave American uranium rights to the Russians. Hillary Clinton only cares about power, money and herself.The 30-second ad titled, ""Corruption,"" will be heavily aired in battle ground states.""Hillary Clinton knows nothing about creating jobs, but knows a lot about how to make money by abusing her and her husband's government positions. The Clintons have made a living out of selling government access to Wall Street donors and special interests in exchange for donations to their slush fund conspicuously disguised as the Clinton Foundation,"" Trump's senior communications advisor Jason Miller stated. ""Hillary Clinton might be the single most corrupt candidate to ever seek the Presidency and should be disqualified for her inability to tell truths to the American people.""Pay to play politics. Staggering amounts of cash poured into the Clinton Foundation from criminals, dictators, countries that hate America. Hillary cut deals for donors. Sold out American workers, exploited Haitians in need, She even gave American uranium rights to the Russians. Hillary Clinton only cares about power, money and herself.SIGN UP"	['Clinton', 'Trump']	[]
