	Unnamed: 0	Link	Title	Text	Terms	Topics
13	13	http://www.breitbart.com/jerusalem/2016/10/12/hezbollah-sees-conflict-syria-rising-regional-tension/	Hezbollah Sees More Conflict in Syria and Rising Regional Tension	"(REUTERS) - The leader of Lebanon's Hezbollah movement, Sayyed Hassan Nasrallah, said on Tuesday the Middle East was in a phase of escalating tension and there appeared to be no prospect of a political solution to the war in Syria.SIGN UP FOR OUR NEWSLETTER""The regional scene is currently one of tension and escalation, and it does not appear that there are paths for negotiations or solutions"", he said in a rare live televised speech before thousands of supporters in Beirut.Speaking about Syria, where the Iran-backed group is fighting alongside Syrian President Bashar al-Assad, Nasrallah said ""the theatre was open to more tension, escalation and confrontation"".However, large sections of his more than hour-long address, marking Shi'ite Islam's annual Ashura commemorations, were spent attacking Sunni power Saudi Arabia, the main regional rival of Iran, mostly over its military campaign in Yemen.Nasrallah said the Saudi leadership were pushing their country to ""the abyss"" and accused Riyadh of being responsible for an air strike on a Yemeni funeral in the capital Sanaa on Saturday that killed scores of people.Saudi Arabia, which backs Syrian rebels, earlier this year marshalled other Arab states to denounce Hezbollah as a terrorist group, part of Riyadh's efforts to contain Iran's influence and reduce its ability to support Assad.Hezbollah denies being involved in terrorism and Nasrallah accused Saudi Arabia of supporting terrorism in his speech on Tuesday.The thousands of Hezbollah supporters in the crowd, mostly dressed in the traditional dark colours worn by Shi'ites at Ashura, were shown repeatedly chanting ""Death to the Al Saud"", Riyadh's ruling dynasty, while pumping their fists in the air.SIGN UP"	['Hassan']	[]
14	14	http://www.breitbart.com/california/2016/10/12/donald-trump-no-alternative-fight-washington/	Donald Trump Has No Alternative but to Run Against Washington — All of It	"Speaker of the House Paul Ryan may have inadvertently done Donald Trump a favor on Monday, when he held a conference call with House Republicans to inform them he would not be campaigning for the party's nominee.SIGN UP FOR OUR NEWSLETTERRyan irritated pro-Trump Republicans while renewing a bad news cycle that Trump's strong debate performance on Sunday might have otherwise ended, probably to the benefit of nervous down-ticket candidates.But Ryan also gave Trump something new: clarity.Trump is now free to run against Washington as a whole, which is likely what he meant by tweeting Tuesday morning that ""the shackles have been taken off me.""Trump won the primary by attacking both Democrats and Republicans -- which is precisely how much of the electorate feels. As he moved closer to the nomination, he had to tone down some of his attacks.He is now free to renew them -- and they may work, provided he retains the message discipline he has learned (somewhat) along the way.There are some exceptions. Trump remains on friendly terms with Reince Priebus and the Republican National Committee (RNC). Trump obeys a simple principle in his relationships: he is friendly to those who are friendly to him, and nasty to those who are not, until they recant. (He seems willing to apply that rule to foreign policy as well, which is why he has not yet shown the requisite outrage towards Russia's Vladimir Putin.) He will not attack the party as a whole.Yet he will run against its leadership -- and he has no other choice, because the Republican Party will not be unified before November (if ever). He has to pull votes from the disaffected, and from Democrats.The simple truth of American politics is that while Republicans have better, and more popular, policies, they have a terrible brand. That is why Trump was able to lap the field in the primary.The question is whether Trump's own brand, battered by the political contest, is still any better.Strip away the daily news cycle, and the 2016 presidential election boils down to the following choice. Hillary Clinton offers a status quo that voters know is corrupt, and incapable of grappling with the country's challenges, both internal and external, but which might be just stable enough to stave off disaster for long enough for better leaders to emerge.Donald Trump offers a shakeup that is high-risk, high-reward: it could lead to making America great again, but it could also lead to greater chaos.To win, Trump has to minimize his own risk profile while making the status quo as intolerable as possible. The Republican leadership represents that status quo, even though every single Republican in high office in Congress owes his position to a revolt against Washington that stretches across three elections. They promised to change the system, and they barely tried.Ryan has given Trump a target, however inadvertently. Trump's challenge is to convince voters he is an acceptable alternative.Joel B. Pollak is Senior Editor-at-Large at Breitbart News. His new book, See No Evil: 19 Hard Truths the Left Can't Handle, is available from Regnery through Amazon. Follow him on Twitter at @joelpollak.SIGN UP"	['Paul', 'Clinton', 'Trump']	[]
15	15	http://www.breitbart.com/big-government/2016/10/11/mother-arranged-rape-murder-daughter-watched/	Report: Mother Who Arranged Rape, Murder of Daughter Watched Attack Then Had Sex with Killer	More details have emerged in the case of a New Mexico mother who is accused of arranging the rape, murder, and dismemberment of her own ten-year-old daughter. New reports say the woman not only sat back and watched the attack and murder but then had sex with the attacker 20 minutes after her daughter died.SIGN UP FOR OUR NEWSLETTERIn August, police in New Mexico discovered the burning body of ten-year-old Victoria Martens in an Albuquerque apartment building. An investigation showed that the child had been dosed with meth, viciously raped, then stabbed to death and dismembered.Shockingly, police accused the child's mother, Michelle Martens, 35, of arranging for her boyfriend, Fabian Gonzales, 31, to rape her child. Police also accused Martens of helping to stab the child to death and dismembering her. Gonzales's cousin, Jessica Kelley, 31, was also arrested for participating in the horrific crime.Now new details from the investigation obtained by KRQE News 13 reveal that police think Martens sat back and watched her own daughter's death and then had sex with the child's killer.One hundred pages of police records show that Martens initially tried to tell police that her boyfriend's cousin attacked them in the middle of the night and she was the one who killed the little girl.Then her story began to change. Martens later admitted that Gonzales had been sexually abusing the 10-year-old Victoria for up to a month before the murder.But ultimately the records show Martens gave up her claims of being a victim and admitted she had allowed several men to have sex with the child and named at least two men who did so. Worse, according to KTLA, Martens admitted she watched the murder and even had sex with Gonzales after her child was dead.Each suspect is being held on a one million dollar bond and will face trials early next year.Follow Warner Todd Huston on Twitter @warnerthuston or email the author at igcolonel@hotmail.com.SIGN UP	['Warner']	[]
16	16	http://www.breitbart.com/jerusalem/2016/10/11/third-times-a-firearm-abbas-fatah-party-celebrates-jerusalem-terror-attack-for-third-time-in-two-days/	Abbas’ Fatah Party Celebrates Jerusalem Terror Attack For Third Time In Two Days	"JERUSALEM - It seems that Palestinian President Mahmoud Abbas' Fatah party just doesn't know when to quit. A day after the faction praised Sunday's ""heroic"" terror attack that killed two Israelis, Fatah celebrated the deaths by posting a cartoon of the Dome of the Rock with a victorious hand clutching an assault rifle atop the mosque.SIGN UP FOR OUR NEWSLETTERThe cartoon, which appeared on Fatah's Facebook page and was first publicized by Israeli watchdog Palestinian Media Watch, also features two helmets with Stars of David on them askew in a pool of blood. The helmets apparently represent the two murdered Israelis despite the fact that neither of the victims were soldiers.One of the victims was recently married police officer Sgt. Major Yosef Kirma, who was slain while chasing the terrorist, and the other was 60-year-old grandmother Lavana Malihi, shot while at the wheel of a passing car.Six more were injured in the shooting spree carried out by an Arab with full Israeli citizenship.A day earlier, Fatah posted a roundup of the attack in two separate posts on its Facebook page, calling the terrorist a ""shahid"" (martyr) and praising his heroism. Fatah's Jerusalem branch also called for a general strike and day of mourning to honor the terrorist's ""soul"" and the souls of other murderers.The one who carried out the operation today in Jerusalem is a pilgrim [to Mecca] Martyr Musbah Abu Sbeih (40), one of the most prominent people in Jerusalem and the blessed Al-Aqsa Mosque and a released prisoner.He was supposed to turn himself in today and begin a sentence of four months on charges of Ribat (i.e., religious conflict/war over land claimed to be Islamic) at the Al-Aqsa Mosque and hitting the occupation's soldiers.He was arrested in 2013 in the Bab Huta region of the Old City of Jerusalem on charges of hitting an officer and was released, but to his surprise the case was reopened in 2015 and he was sentenced to a four month active sentence, and according to the ruling of the Israeli Magistrate Court that was given roughly one month ago, the ruling was supposed to be carried out in the middle of this month [October 2016].The occupation authorities persecuted him over the last two weeks and he was arrested and detained five times in a row, and after his last arrest he was released on condition of being distanced from East Jerusalem for one month, and before that he was given a ruling preventing him from traveling [abroad] until the end of this year, and he was forbidden from entering the Al-Aqsa Mosque for six months, after being released [from arrest] at the end of last year [2015].Below is the second post:The Jerusalem branch of Fatah announced mourning and a general strike today [Oct. 9, 2016] in Jerusalem in memory of the souls of the Martyrs of Palestine and this morning's Martyr Musbah Abu Sbeih.Due to the barbaric escalation being perpetrated by the occupation government and the herds of settlers, which includes killing, violence, destruction, and an attempt to instill fear in our Palestinian cities, villages, and refugee camps, and particularly in Jerusalem, we announce our complete objection to crimes of these types being carried out before the international community and its human rights organizations... The occupation government and its executive branches must bear the consequences of what they are perpetrating against the Al-Aqsa Mosque, the disregard of Muslim sensibilities, and the granting of permission to the settlers to invade it, defile it, and desecrate its sanctity on a daily basis under the umbrella and protection of the occupation police.The one who carried out the operation today in Jerusalem is a pilgrim [to Mecca] Martyr Musbah Abu Sbeih (40), one of the most prominent people in Jerusalem and the blessed Al-Aqsa Mosque and a released prisoner.
He was supposed to turn himself in today and begin a sentence of four months on charges of Ribat (i.e., religious conflict/war over land claimed to be Islamic) at the Al-Aqsa Mosque and hitting the occupation's soldiers.
He was arrested in 2013 in the Bab Huta region of the Old City of Jerusalem on charges of hitting an officer and was released, but to his surprise the case was reopened in 2015 and he was sentenced to a four month active sentence, and according to the ruling of the Israeli Magistrate Court that was given roughly one month ago, the ruling was supposed to be carried out in the middle of this month [October 2016].
The occupation authorities persecuted him over the last two weeks and he was arrested and detained five times in a row, and after his last arrest he was released on condition of being distanced from East Jerusalem for one month, and before that he was given a ruling preventing him from traveling [abroad] until the end of this year, and he was forbidden from entering the Al-Aqsa Mosque for six months, after being released [from arrest] at the end of last year [2015].The Jerusalem branch of Fatah announced mourning and a general strike today [Oct. 9, 2016] in Jerusalem in memory of the souls of the Martyrs of Palestine and this morning's Martyr Musbah Abu Sbeih.
Due to the barbaric escalation being perpetrated by the occupation government and the herds of settlers, which includes killing, violence, destruction, and an attempt to instill fear in our Palestinian cities, villages, and refugee camps, and particularly in Jerusalem, we announce our complete objection to crimes of these types being carried out before the international community and its human rights organizations... The occupation government and its executive branches must bear the consequences of what they are perpetrating against the Al-Aqsa Mosque, the disregard of Muslim sensibilities, and the granting of permission to the settlers to invade it, defile it, and desecrate its sanctity on a daily basis under the umbrella and protection of the occupation police.SIGN UP"	[]	[]
17	17	http://www.breitbart.com/2nd-amendment/2016/10/11/homicides-approaching-600-gun-controlled-chicago/	2016 Homicides Approaching 600 in Gun-Controlled Chicago	"Homicides in gun-controlled Chicago so far this year are approaching 600 following another weekend of firearm-related death and mayhem.SIGN UP FOR OUR NEWSLETTERThe Chicago Tribune reports that ""at least 35"" people were shot and wounded and another five were shot and killed between 6 pm Friday, October 7, and the morning of October 10. ""Four people were shot within six blocks of each other over one hour Sunday night.""The weekend's violence brings the total number of homicides in the city to 578 year-to-date.The Tribune reports there have been a total of 3,368 shooting victims between January 1 and October 11, 2016 -- that figure includes fatal and non-fatal shootings. There were 2,988 shooting victims for the whole of 2015.Violence in gun-controlled Chicago set a record in August 2016 with 472 people shot and 90 people killed, according to ABC News. It was the deadliest August in two decades and it came on the heels of the deadliest July since 2006.ABC News also reported ""nearly 12"" people, on average, were shot every day in Chicago between January 1 and September 1.AWR Hawkins is the Second Amendment columnist for Breitbart News and political analyst for Armed American Radio. Follow him on Twitter: @AWRHawkins. Reach him directly at awrhawkins@breitbart.com.SIGN UP"	[]	[]
18	18	http://www.breitbart.com/sports/2016/10/11/espn-promotes-fight-for-social-justice-at-obama-town-hall/	ESPN Promotes ‘Fight for Social Justice’ at Obama Town Hall	"Barack Obama spoke to an ESPN audience from North Carolina A&T State University on Tuesday night, addressing the ""My Brother's Keeper"" initiative, activism in sports, and historically-black colleges.SIGN UP FOR OUR NEWSLETTERThe sports analogies, like a citizen's vote in Obama's adopted hometown, came early and often.""We all get knocked down in life,"" the president informed the intimate gathering. ""The question is: How do you respond? Do you get back up after getting knocked down?"" He urged the students to ""learn from defeats, thereby rendering them temporary."" He pointed to his loss in a Chicago congressional race during the 1990s as an event that humbled him.The president credited Title IX with American women winning more medals than American men at Rio and cited Abraham Lincoln, Martin Luther King, and Nelson Mandela as inspirations. He referenced a poster of Dr. J from his youth and called Muhammad Ali and Arthur Ashe ""transformational"" athletes in their very different means of getting a point across.But what he didn't say spoke louder than what he did. He mentioned neither Colin Kaepernick and other athletes kneeling for the national anthem nor the NCAA puling 2017 basketball tournament games from the city where he spoke because of North Carolina's law restricting multiple-occupancy public restrooms in state buildings to people of the sex indicated on the entrance.President Obama cited discrimination and the criminal-justice system as roadblocks to full participation in American life. He declared that America gets stronger once it utilizes everyone's talents.""When you started getting black ball players in baseball, baseball became better,"" the president explained by way of metaphor. ""When you started getting black ball players in basketball, basketball became a lot better.""The product of private-school and Ivy League education defended his record against a somewhat pointed question on his administration's funding of historically-black colleges by blaming state legislatures for ""funding prisons but not funding schools."" He encouraged a student activist to aim to make specific demands rather than merely to raise awareness. The president noted his administration's efforts to compel police departments to allow ""independent investigations"" to avoid malfeasance by cops from ""being swept under the rug,"" for ""training and hiring...done in a way that encourages the de-escalation of confrontation,"" to highlight ""protecting and serving"" for law enforcement instead of ""keeping a lid on things.""Juxtaposing the conversational tone in the room were several confrontational ESPN-produced vignettes highlighting black activists, athletes and otherwise. Host Stan Verrett stridently spoke of how far Americans have come and have to go ""in the fight for social justice."" The president in merely encouraging the mostly student audience to vote, rather than to vote this way or that way, kept the discussion mostly away from current controversies. While the vibe became heavy when discussing the history of the civil rights movement, the president mostly kept matters light.""I might also just take your job at SportsCenter,"" he informed Verrett of his post-presidency plans at the hour-plus program's conclusion. ""I think I could do a pretty good job.""SIGN UP"	['Abraham', 'Nelson', 'Obama']	[]
19	19	http://www.breitbart.com/2016-presidential-race/2016/10/11/green-partys-jill-stein-hillary-is-the-face-of-new-republican-party-progressives-have-been-lied-to-and-sold-out-by-dnc/	Green Party’s Jill Stein: Hillary Is the Face of ‘New Republican Party’; Progressives ‘Have Been Lied to and Sold Out’ by DNC	"In a series of tweets in recent days, Green Party presidential nominee Jill Stein unloaded on Democratic nominee Hillary Clinton-slamming Clinton as the leader of the ""neoliberal uniparty that will fuel right-wing extremism.""SIGN UP FOR OUR NEWSLETTERStein blasted Clinton for her support for military adventurism, expanded international trade, and her ties to corporate interests and Wall Street banks.""Progressives have been lied to and sold out by the leadership of the corporate-controlled Democratic Party,"" Stein wrote on Twitter, as she urged voters to ""#BreakThe2PartyTrap""""There was very clear evidence that the DNC definitely tampered with elections behind closed doors to smear Bernie Sanders,"" Stein wrote, explaining that liberal progressives cannot support Hillary Clinton.Following Glenn Beck's decision to throw his weight behind Clinton, Stein wrote that Clinton is emerging as the face of the new Republican Party. ""Glenn Beck is promoting Hillary Clinton. What we're seeing is the birth of #TheNewRepublicanParty,"" Stein tweeted.""We're now seeing many Republican leaders join Hillary Clinton in a neoliberal uni-party that will fuel right-wing extremism,"" Stein wrote during Sunday night's presidential debate, adding, ""More Clinton-style trickle-down won't stop right-wing extremism. We need a people's party with a populist progressive agenda.""""We're told by both the right & left to accept militarism as normal--as if peace is a 60's era utopian fantasy. This is dangerous & immoral,"" Stein continued.""Both Democrats and Republicans are funded by big corporate interests including Wall St. Banks, fossil fuel giants, & war profiteers,"" Stein said, ""I'm the only candidate standing up for what the American people and future generations need, not what billionaires want.""Stein explained that the liberal progressive agenda-on health care, crime, climate change, trade, etc.- cannot be accomplished under a President Hillary Clinton. Stein argued that a Clinton presidency will simply be the continuation of the policies supported by Washington's ""uniparty"" that's controlled by special interest donors-and will not in any way advance the goals of liberal progressives.""Bill Clinton labeled universal health care as the ""craziest thing in the world."" I guess every other developed nation is 'crazy',"" Stein wrote.""The Clintons' crime bill opened the door to today's mass incarceration that is deeply entangled with systemic racism,"" Stein added.""The Clintons' support for NAFTA destroyed millions of jobs, including in Mexico where many farmers became economic refugees,"" Stein tweeted.One of the recent WikiLeaks releases revealed that Clinton privately told a group of bankers that her ""dream"" is to expand the international trade, opposed by the Bernie Sanders voters of her party, and to establish ""a hemispheric common market with open trade.""During the debate, the Green Party's official twitter account blasted Clinton for her declaration that politicians need to have ""both a public and private position"" on every issue, tweeting: ""When you watch the #Debate tonight, remember Secretary Clinton is only giving you her ""public position."" Don't be fooled. #PodestaEmails.""Stein is a Harvard Medical School graduate, a mother to two sons, and a practicing physician who became an environmental-health activist and organizer in the late 1990s. As the Green Party's 2012 presidential candidate, Stein holds the record for the most votes ever received by a female candidate for President in a general election.Stein has repeatedly argued that the Democratic Party has sold out liberal progressive values. In her introductory video message to voters featured on her website, Stein explains: ""You didn't want the massive expanding wars, you didn't want the meltdown of the climate, you didn't want the massive Wall Street bailouts, you didn't want the offshoring of our jobs, but these were all things brought to us-signed, sealed, and delivered-by a Democratic White House with two Democratic Houses of Congress.""SIGN UP"	['Sanders', 'Clinton']	[]
20	20	http://www.breitbart.com/big-government/2016/10/11/trump-thrills-thousands-florida-youre-going-look-back-rally-rest-life/	Trump Thrills Thousands in Florida: ‘You’re Going to Look Back at this Rally for the Rest of Your Life’	"PANAMA CITY BEACH, FL - On a mid-October night in front of a crowd strewn out on blankets and beach towels just a stone's throw from the Gulf of Mexico, Republican presidential nominee Donald Trump made another push in the solidly Republican part of Florida to heighten enthusiasm for his bid for the White House.SIGN UP FOR OUR NEWSLETTERIf Trump's more-than-a-decade-old lewd comments caught by Access Hollywood are having any effect on his presidential campaign, they are not showing in northwest Florida.As usual in the panhandle, twice -- in Pensacola 100 miles down the coast and now in Panama City Beach -- Trump easily achieved the capacity crowd set at 7,000. Opening the event for Trump as he has often done on the campaign trail was former New York City Mayor Rudy Giuliani.Giuliani commented on the news of the day, in particular the recent revelations included in the WikiLeaks drop, and he called out Trump's opponent Democratic presidential nominee Hillary Clinton.""I actually believe while looking at all these Wikileaks, we're dealing with a pathological liar,"" Giuliani said to a cheering crowd.The heaviest applause was saved for Trump himself, when he immediately attacked Clinton as a ""vessel"" for the establishment.""Hillary is a vessel for the corrupt global establishment that is raiding our country and ruining the sovereignty of our nation,"" he said in the opening moments of his rally.When asked by Breitbart News about the recently unveiled Access Hollywood audio from 2005 showing Trump making lewd comments about women, attendees shrugged it off and said he ""was still better than Hillary"" or that ""Clinton had done much worse"" while serving in government.Trump told attendees should Clinton be elected, it could mean the end of such rallies and urged attendees to get out the vote.""You're going to look back at this rally for the rest of your life,"" he said. ""You're going to remember this day. This is a movement like nobody has ever seen before. It really is. It is an amazing thing. We take it for granted almost. It is an amazing thing.Panama City Beach is the first of four stops in three days in Florida for the GOP nominee. Tomorrow, Trump will make appearances in Ocala and Lakeland. On Thursday, he will appear in West Palm Beach.Trump has lost some ground in Florida in recent polls -- down by less than six points, according to the Real Clear Politics average.Follow Jeff Poor on Twitter @jeff_poorSIGN UP"	['Clinton', 'Trump']	[]
