	Link	Title	Text
0	http://www.foxnews.com/sports/2015/07/25/fifa-blatter-get-back-to-world-cup-business-at-putin-home.html	FIFA, Blatter get back to World Cup business at Putin home	
1	http://www.foxnews.com/opinion/2013/10/10/false-arguments-vicious-name-calling-over-tea-party-plan-to-defund-obamacare.html	Let's stop the false arguments, vicious name calling over Tea Party plan to defund ObamaCare	
2	http://www.foxnews.com/transcript/2015/06/03/giuliani-on-why-america-is-not-respected-on-world-stage/	Giuliani on why America is not respected on the world stage	"This is a rush transcript from ""Hannity,"" June 2, 2015. This copy may not be in its final form and may be updated.SEAN HANNITY, HOST: Tonight, President Obama's completely out of touch with reality. Here is but the latest example.(BEGIN VIDEO CLIP)PRESIDENT BARACK OBAMA: People don't remember, when I came into office, the United States in world opinion ranked below China and just barely above Russia. And today, once again, the United States is the most respected country on Earth.And part of that, I think, is because of the work that we did to reengage the world and say that, We want to work with you as partners, with mutual interests and mutual respect. It's on that basis that we were able to end two wars while still focusing on the very real threat of terrorism.(END VIDEO CLIP)HANNITY: Pretty unbelievable! Now, the president's statement could not be further from the truth. Here are just some of the foreign policy failures during his time in office. Russian aggression led to the invasion and annexation of Crimea, and of course, Ukraine. ISIS is on the march in Iraq and Syria and continue to capture more territory by the day. Libya collapsed and has become a safe haven now for terrorists.Israel has all but abandoned -- been abandoned by the president and his fixation with a nuclear deal in Iran. And just take a look at President Obama's latest attempt to try and convince the Israelis that a nuclear deal with the Iranian mullahs is a good thing.(BEGIN VIDEO CLIP)OBAMA: We can, I think, demonstrate -- not based on any hope, but on facts and evidence and analysis -- that the best way to prevent Iran from having a nuclear weapon is a verifiable, tough agreement. A military solution will not fix it, even if the United States participates. It would temporarily slow down an Iranian nuclear program, but it will not eliminate it. What I can say is to the Israeli people I understand your concerns and I understand your fears.(END VIDEO CLIP)HANNITY: By the way, did I mention the Chinese are pursuing their territorial ambitions? Now, if that's not bad enough, the president also said this yesterday.(BEGIN VIDEO CLIP)OBAMA: I know that one of the important principles for me has always been treating everybody fairly. So whether that's women or people of different races or different religious faiths or different sexual orientations, that part of -- one of my core principles is that I will never engage in a politics in which I'm trying to divide people or make them less than me because they look different or have a different religion.  That's a core principle. That's not something I would violate.(END VIDEO CLIP)HANNITY: Of course, Republicans want dirty air and dirty water and all the other comments that he's made.Joining us now with reaction, former New York city mayor Rudy Giuliani. So he says he has turned America into the most respected country on earth. He also said he doesn't believe in using divisive politics. And then he said, Obama to Axelrod, I'm the closest thing to a Jewish president the U.S. has ever had!RUDY GIULIANI, R-FMR. NEW YORK CITY MAYOR: Hard to react, Sean.(CROSSTALK)GIULIANI: ... the first one. I went back and took a look, and in the last 12 months, I've made 23 foreign trips to 16 different countries, including some of the countries that are most deeply involved in this situation.And I would say without almost contradiction in each one of those countries, I find that America is less respected, completely disregarded in some cases. We know about Israel. I spoke to two high-ranking officials in Saudi Arabia and one in Jordan, who basically said, America with Obama as president, they said, it's out -- that we are out of the equation.  America is now...HANNITY: Same with Egypt!GIULIANI: Yes. Exactly. In the words, they now have to put together their own -- which is why they didn't send anybody to his summit. That's respect. Same thing is true, a recent trip to Germany. And then a few months ago in Poland, I was asked by some members of the Polish government if I thought that Obama would defend Poland if Poland were attacked by Putin.And I said, I can't believe you're asking me that question.HANNITY: Pretty amazing!GIULIANI: And they said, Well, we think your president wouldn't use military power, you know, to any extent. Look what he's doing in Iran. I mean, he -- the -- the -- the plan he has makes Iran a nuclear power 10 years from now.HANNITY: Scary!GIULIANI: Now -- now, that assumes that we trust Iran. And just revealed today, either in The Washington Post or The New York Times, that Iran has been enriching uranium all during the last year, while they said they weren't enriching it. Now, they cheated us twice before when we tried to have agreements with them. Why -- is there any reason to believe they're not going to cheat -- this is like -- this is like playing poker with a guy that has cheated you twice, and then you...(CROSSTALK)GIULIANI: Let me play -- let me play poker with him again.HANNITY: The world's sponsor, greatest sponsor...GIULIANI: I don't want -- I don't want that guy negotiating for me.HANNITY: The number one sponsor of terror, fighting proxy wars...GIULIANI: Which they're doing right now!(CROSSTALK)HANNITY: ... in Yemen. The destruction of Israel is not nonnegotiable. And America is the great Satan, and death to America.GIULIANI: And we're going to trust them not to enrich uranium behind our backs, when they've done it before. They're doing it now during this one-year period!HANNITY: It's unbelievable. All right, I want to ask you this because we've had this battle over the Patriot Act, Rand Paul -- he's been demonized by many in the party. I want to play a cut from you from Jim Sensenbrenner. He wrote the Patriot Act. He's making the adjustments with the USA protection and surveillance act. And this is what he said the Patriot Act evolved into, which he said is against the law. Listen to this.(BEGIN AUDIO CLIP)HANNITY: Is it fair to say that you suspect that every American's phone has been tapped by our government, in that sense, it was data-mined, conversations?REP. JAMES SENSENBRENNER, R-IND.: Yes.HANNITY: Is it fair to say that you believe that every American had electronic information that they thought was confidential intercepted by the government?SENSENBRENNER: Yes.HANNITY: I am stunned! And what are they doing with this information?SENSENBRENNER: well, they're storing it in a huge data warehouse that is west of Salt Lake City. And the point that I keep on making is what good has all of this done, aside from being an intrusion of privacy to a scale nobody imagined? There's not been one terrorist strike that has been exposed as a result of the data that has been mine.(END VIDEO CLIP)HANNITY: Now, I supported the Patriot Act, and I still believe we need a Patriot Act, but we've got to balance 4th Amendment constitutional rights, civil rights, privacy rights. And what he's saying is, is that the government has been breaking the law by data mining, which the Patriot Act specifically prohibited. What is your reaction?GIULIANI: My reaction is that's his interpretation. It is the fact he's the author, but you know, more than one person sets the intent of Congress...HANNITY: But the second circuit agreed with him.GIULIANI: OK.HANNITY: Yes.GIULIANI: But there may be a disagreement if it went to the -- if it went to the Supreme Court.HANNITY: There's always disagreement...(CROSSTALK)HANNITY: That's a good point.GIULIANI: And believe me, there'd be other circuits that would come to a different conclusion about that because the plain language of the statute is not really violated by what the government is doing.The second thing I would say is, the government has not misused the information. There's no evidence that under either President Bush or President Obama, there's been any misuse by the government.And I happen to know that the information is helpful. And the government has its hands tied behind its back because it can't defend itself. It can't point out the situations in which that information has been helpful.Also, in a situation where you have five minutes to get the information because there's only five minutes to go when you've information some place is going to be bombed and you got to -- you got to start hitting computers and getting information, you want that at -- you want that at your -- you want that at your fingertips.HANNITY: Do you...GIULIANI: So I know -- I know what they're going to do. They're going to leave it in the hands of private companies. That's the best...(CROSSTALK)HANNITY: You agree it shouldn't be used for any type of domestic prosecution, only for terrorism?GIULIANI: Never should be used for domestic prosecution.HANNITY: OK.GIULIANI: Never should be misused. The government has handled it responsibly They're going to put it in the hands of private companies.  And there may be a day that we get a bombing that we don't pick up fast enough because it's going to take a while for the government to get that from the private company.HANNITY: I understand.GIULIANI: And people could die a result of that, and I think Congress is making a mistake here.HANNITY: OK. Appreciate you being with us. Thank you.GIULIANI: Thank you.Content and Programming Copyright 2015 Fox News Network, LLC. ALL RIGHTS RESERVED. Copyright 2015 CQ-Roll Call, Inc. All materials herein are protected by United States copyright law and may not be reproduced, distributed, transmitted, displayed, published or broadcast without the prior written permission of CQ-Roll Call. You may not alter or remove any trademark, copyright or other notice from copies of the content."
3	http://www.foxnews.com/transcript/2016/06/07/will-trump-comments-about-judge-have-lasting-impact/	Will Trump's comments about the judge have a lasting impact?	"This is a rush transcript from ""Special Report,"" June 7, 2016. This copy may not be in its final form and may be updated.(BEGIN VIDEO CLIPS)DONALD TRUMP, PRESUMPTIVE REPUBLICAN PRESIDENTIAL NOMINEE: We thought we would win the case. I don't care if the judge is Mexican or not. I'm going to do great with the Mexican people because I provide jobs, so I don't care about Mexican. But we're being treated very unfairly, Bill, very, very unfairly.SPEAKER OF THE HOUSE PAUL RYAN, R-WIS.: I disavow those comments. I regret those comments that he made. I don't think, claiming a person can't do the job because of their race is sort of like the textbook definition of a racist comment. I think that should be absolutely disavowed. It's absolutely unacceptable.SENATE MAJORITY LEADER MITCH MCCONNELL, R-KY.: It's time to quit attacking various people that you competed with or various minority groups in the country and get on message.(END VIDEO CLIPS)BRET BAIER, ANCHOR: There you hear Donald Trump and some Republicans reacting to this whole dustup about what he said about that judge in the Trump University case. Trump putting out a statement today in part saying this, ""It is unfortunate that my comments have been misconstrued as a categorical attack against people of Mexican heritage. The American justice system relies on fair and impartial judges. All judges should be held to that standard. I do not feel that one's heritage makes them incapable of being impartial. But based on the rulings that I have received in the Trump University civil case I feel justified in questioning whether I am receiving a fair trial."" It goes on from there.The focus here on California is obviously on the Democratic race, but this issue has been the focus in the media for the past several days, and we'll see if this changes. Let's bring in our panel here in San Diego, Steve Hayes, senior writer for The Weekly Standard, Kirsten Powers, USA Today columnist, we welcome Dr. Gina Loudon, host of ""The Dr. Gina Show"" out here in San Diego, and Dana Perino, co-host of ""The Five.""Gina, we hear from all of these folks all the time, so welcome. What do you think, what do you make of this statement? Does this turn the corner? Does this, as Senator Corker said, is this the pivot that Trump needs?DR. GINA LOUDON, ""THE DR. GINA SHOW"": I like the statement. I think it's fine. I think a lot of people are watching this feeling like he'll probably tee this up like he did the veterans situation. It seems like there are two groups, Bret, that are particularly obsessed with race, and it's the left and it's the media. The center and the right, not so obsessed with race. And so I think this was a good way to make the statement to kind of reiterate what he meant in the first place, and I think it will resonate well with voters.BAIER: Dana, does this turn the page?DANA PERINO, FOX NEWS: It might turn the page in terms of the media page so that tomorrow maybe they're talking about something else. But I do think this will have a lasting impact.One of the things you just saw in the clips opening up this panel is you have Paul Ryan today trying to announce his big push to alleviate poverty. He did it in D.C. And there he is trying to make the statement, and the questions are about Donald Trump and whether he's racist, OK? That happened to Mitch McConnell. It happened to every Republican that is out there. That will happen between now and November, not just on this issue, but on all the ones going forward. I understand that Donald Trump is trying to turn the page on this one. It might work for Republicans, maybe, but it's not going to work for the left.BAIER: Steve, a couple of things. One is he said his statements were misconstrued. I think people looking at the original statements and a couple times wonder how we may have misconstrued what he was saying. But for Republicans like Paul Ryan who say ""I have a real problem,"" and ""this is the definition of racism, but I'm still endorsing him."" Mark Kirk is the only person who said I'm not endorsing him.STEVE HAYES, THE WEEKLY STANDARD: I think that's a huge problem for Paul Ryan. I think it's a huge problem for Mitch McConnell. I think it's a huge problems for Republicans more broadly.There's obvious tension between the fact that you're calling out the top Republican in the country's comments as racist, labeling them as such, I think accurately, and at the same time saying but he has to be the next president of the United States.I went back and I was rereading some the past controversies about Donald Trump and race and ethnicity, his comments about the same judge back in February where he made similar allusions to the judge's ethnic heritage. His refusal to condemn the KKK and David Duke, which led Paul Ryan and Mitch McConnell at that time to say I really hope that -- that the Republican party doesn't become the party that stands for bigotry or trades in bigotry, and they condemned those comments unequivocally.The only difference between what they said then and what they seem to be saying now is they're saying we condemn the bigotry, but the person we're accusing of this bigotry has to be the next president of the United States.BAIER: All right, Kirsten, here's what Chris Christie said after he voted in New Jersey today about this whole dustup.(BEGIN VIDEO CLIP)GOV. CHRIS CHRISTIE, R-N.J.: I know Donald Trump. I've known him for 14 years. And Donald Trump is not a racist.If you have this many microphones and cameras in front of you on a regular basis and you're not a preprogrammed, robotic politician, you're going to make some statements at times that you wish you could take back. I've done it, he's done it. And anybody who is honest in this business has done it.(END VIDEO CLIP)BAIER: To Gina's point, is this something that kind of just makes people mad, that there's this much focus? Is that statement enough to move on to issues he wants to talk about?KIRSTEN POWERS, USA TODAY: I think one of the problems of saying it's the left or media that are consumed with this is that you saw all of these high-profile Republicans come out and condemn it. So obviously Republicans are concerned about it as well. It's not just the left who is offended about it. In fact if anything it's more Republicans who seem to be really upset about it.So I think that Chris Christie also saying that, well, the preprogrammed politicians, but Trump really dug in on this. It wasn't as though he just said it and later on said, oh, I'm sorry, I misspoke. We have the reporting about the call he had with supporters basically telling them go and attack the journalists. He wasn't really backing down.It may be true what Christie is saying that he's not a racist. But when he says things that people think are racist, that's the problem. I don't think it's about what his heart is saying. It's about what he continues to say that people find offensive.BAIER: Gina, do you hear from Trump supporters on your show about concern over Donald Trump kind of doubling, tripling down on something they wish he would back off on. Or do you think this doesn't factor from what you're hearing?LOUDON: From what I'm hearing from people, Bret, the American people understand that he's not a politician and that the establishment on both sides has been attacking him all the way along. That's what happened today. That's what people expect to happen the next time.I think what people really appreciate about him is that he's willing to stand up for what he believes, even when he does it clumsily, right. Even when the whole country seems to be attacking him for it he'll continue to stand. And I think that's the leadership and the sort of outsider perspective that people have been looking for a long time. So I don't see this issue doing damage to him. And I could see him coming back, like he did on the veterans issue, and being, see, I told you, this judge really is corrupt. He really did refer to plaintiffs' attorneys that gave $650,000 to the Clinton Foundation. He is related to La Raza. This is a problem for people who understand what that means in this country.BAIER: Shannon Bream did the whole difference between the attorneys group and the National Council La Raza and we talked about that.Let's move on to the Democrats, though, and Bernie Sanders, who said today, today, after the Associated Press said Hillary Clinton has already got this nomination in the bag that he is not relenting no matter what happens here in California, Dana.PERINO: Apparently there is a big split amongst Sanders supporters and on his team, one saying that, look, we have come so far. We should take what we can, get a good spot at the convention and continue this movement and to push the nominee, Hillary Clinton, to the left as far as we can. Another says fight on, Bernie. You can't disappoint all of these voters across the country. It is remarkable what Bernie Sanders has been able to do, but he does not have the ability to become the nominee, and I'm thinking that President Obama is going to try to put some strong pressure on him and try to unite this party so that she can win.BAIER: Kirsten?POWERS: Yes. I think that's right, and the White House has indicated there's an imminent endorsement coming from President Obama of Hillary Clinton. But the thing to remember about Bernie Sanders is he's not really a Democrat and he's not invested in the Democratic Party. So you don't have the normal issues at play here. I think that he's more invested in his agenda and wanting to get certain issues on the table at the convention, and people who are supporters of his said they really want to see a fight on Israel, Israel and Palestine. They don't like what Hillary's position is, and they want to make sure they get the VP that they want. So they don't have a lot of incentive, he doesn't have a lot of incentive to get out.BAIER: But Hillary Clinton, meantime, I get the sense that she really would like to take advantage of what are disenfranchised Republicans and reach out that way but yet still has to reach to the progressive side of her own party to unify after Bernie Sanders is doing what he's doing.HAYES: Yes. And I think that's part of the risk. You also know that Hillary Clinton would like to be celebrating the fact that she is the first female nominee of a major party in the United States, and that's kind of being taken away from her by what Sanders is doing.I think the real risk for Democrats here is that Bernie Sanders has run an energetic campaign based on the idea that the system is rigged. He's continuing to make that argument and he's making it in the context of Democratic Party politics.It's not really rigged. It's a bad system, the super delegates stink. All of those things are true. But she also beat him. She's going to win. She's going to win fair and square by the rules as they were set forth. And the longer he keeps making that argument, the more he feeds that perception among his supporters and the less likely it becomes that they ultimately rally to Hillary Clinton.BAIER: Quickly here, Gina, the thing that we'll hear the most tonight about breaking the glass ceiling for a woman taking the nomination in a major party, for your listeners, for people on the conservative side, is the antipathy for Hillary Clinton just overwhelming that they don't celebrate that?LOUDON: I think that is the truth. I think that Hillary just is not a very likable candidate. Bernie came in at just the right time. And I think that his supporters are going to feel like this election was taken from them regardless of anything else. I think she's going to have a real fight on her hands.BAIER: Panel, thank you very much in this gorgeous setting.Content and Programming Copyright 2016 Fox News Network, LLC. ALL RIGHTS RESERVED. Copyright 2016 CQ-Roll Call, Inc. All materials herein are protected by United States copyright law and may not be reproduced, distributed, transmitted, displayed, published or broadcast without the prior written permission of CQ-Roll Call. You may not alter or remove any trademark, copyright or other notice from copies of the content."
4	http://www.foxnews.com/politics/2013/10/25/benghazi-attackers-told-guards-were-here-to-kill-americans.html	Benghazi attackers told guards 'We're here to kill Americans'	
5	http://www.foxnews.com/politics/2012/11/05/wisconsin-remains-swing-state-heading-into-election-day.html	Wisconsin remains a swing state heading into election day	
6	http://www.foxnews.com/politics/2015/05/15/press-gobbles-up-hillarys-spam-campaign.html	Press gobbles up Hillary’s spam campaign	
7	http://www.foxnews.com/world/2015/07/24/ukraine-new-police-on-charm-offensive-in-kiev-in-government-first-visible.html	Ukraine's new police on charm offensive in Kiev in the government's first visible reform	
8	http://www.foxnews.com/leisure/2013/10/23/10-foods-americans-eat-that-are-banned-around-world/	Foods Americans eat that are banned around the world	The United States government has set several rules and guidelines in place to protect us from eating potentially harmful foods. Several dishes considered real delicacies in other parts of the world, like haggis in Scotland or fugu (puffer fish) in Japan, are banned from the U.S. food market because of potential health risks. But looking at the issue from a reversed angle, there are actually several common foods eaten in America that are banned in other parts of the world.The shocking truth is that many of our favorite foods, like boxed mac and cheese and yogurt, include ingredients that other countries have established as potentially harmful for health, and therefore are banned. Clearly, mac and cheese on its own isn't poisonous in any way, but the yellow food colorings #5 and #6 have been shown to cause hypersensitivity in children, and are therefore banned in countries including Norway, Finland, and Australia. For yogurt and other milk products, it is the rBGH and rBST that some countries are concerned with -- these growth hormones are banned in several regions including the European Union, Canada, and Japan because of their potentially dangerous impacts on the health of both humans and cows.Though the studies and investigations showing the possible dangers of these ingredients are not to be taken lightly, food manufactures in America surely are not trying to poison the American people. Different countries have different policies and politics when it comes to food, and the U.S. Food and Drug Administration (USFDA) assures that it is monitoring the safety of all ingredients available for American consumers. The varying food-safety laws around the world are good reminders for all of us to be aware of what ingredients are in our foods, and not to panic, but to use common sense and mild precaution when choosing what foods we eat.
