	Link	Title	Text
0	http://www.foxnews.com/politics/2015/07/28/billionaire-mark-cuban-trump-is-the-best-thing-to-happen-to-politics-in.html	Billionaire Mark Cuban: Trump Is &#8216;The Best Thing To Happen To Politics In A Long Time&#8217;	
1	http://www.foxnews.com/entertainment/2014/07/29/deadliest-catchs-keith-colburn-washington-politics-hurt-my-business.html	'Deadliest Catch's' Keith Colburn: Washington politics hurt my business	
2	http://www.foxnews.com/transcript/2014/07/28/grapevine-family-politics-michigan-state-senate-primary/	Grapevine: Family politics in Michigan State Senate primary	"Now some fresh pickings from the Political Grapevine...Top SecretHaving a top secret clearance requires many things.Keeping up with your taxes is not one of them.The Government Accountability Office (GAO) says 83,000 Defense Department employees and contractors who are eligible for security clearances owe $730 million in unpaid federal taxes.That does not automatically prevent those people from having a government clearance but poor finances are a potential hazard because an individual may resort to illegal means to generate funds.Republican Senator Tom Coburn says it is not just about the money.Quote -- ""Federal tax cheats with security clearances jeopardize both our national and economic security, and could unnecessarily put our nation's classified information at risk.""The GAO found that less than half of the delinquents are in a repayment plan right now.Who's the Boss?California is a big state. So big it needs four governors this week.Right now, California's acting governor is actually the state's lieutenant governor.Yesterday, elected Governor Jerry Brown released his power before he left for Mexico.Tomorrow, the leadership carrousel continues when the lieutenant governor flies out of town for the Special Olympics, leaving the senate president pro temp with the reigns.Wednesday, the Senate leader takes off, so the assembly speaker gets the power, but only for about nine hours, until Governor Brown returns to reclaim his authority.The secession rules are all outlined in the state's constitution. Many states actually have similar procedures to handle a governor's absence.Politics Ain't BeanbagFinally, a Michigan State Senate primary is getting very personal.Wayne Schmidt has been endorsed by his opponent's mother, who says Schmidt is the better candidate.Schmidt gladly accepted the endorsement -- quote -- ""Politics can bring out many differences among friends and families.""Greg MacMaster says he wants people to focus on his record, not on his mother -- who he says he does not speak to -- quote -- ""For voters, politics should be about my positions, the votes I have taken, my conservative values."""
3	http://www.foxnews.com/on-air/special-report-bret-baier/2014/07/28/grapevine-family-politics-michigan-state-senate-primary	Grapevine: Family politics in Michigan State Senate primary	"Now some fresh pickings from the Political Grapevine...Top SecretHaving a top secret clearance requires many things.Keeping up with your taxes is not one of them.The Government Accountability Office (GAO) says 83,000 Defense Department employees and contractors who are eligible for security clearances owe $730 million in unpaid federal taxes.That does not automatically prevent those people from having a government clearance but poor finances are a potential hazard because an individual may resort to illegal means to generate funds.Republican Senator Tom Coburn says it is not just about the money.Quote -- ""Federal tax cheats with security clearances jeopardize both our national and economic security, and could unnecessarily put our nation's classified information at risk.""The GAO found that less than half of the delinquents are in a repayment plan right now.Who's the Boss?California is a big state. So big it needs four governors this week.Right now, California's acting governor is actually the state's lieutenant governor.Yesterday, elected Governor Jerry Brown released his power before he left for Mexico.Tomorrow, the leadership carrousel continues when the lieutenant governor flies out of town for the Special Olympics, leaving the senate president pro temp with the reigns.Wednesday, the Senate leader takes off, so the assembly speaker gets the power, but only for about nine hours, until Governor Brown returns to reclaim his authority.The secession rules are all outlined in the state's constitution. Many states actually have similar procedures to handle a governor's absence.Politics Ain't BeanbagFinally, a Michigan State Senate primary is getting very personal.Wayne Schmidt has been endorsed by his opponent's mother, who says Schmidt is the better candidate.Schmidt gladly accepted the endorsement -- quote -- ""Politics can bring out many differences among friends and families.""Greg MacMaster says he wants people to focus on his record, not on his mother -- who he says he does not speak to -- quote -- ""For voters, politics should be about my positions, the votes I have taken, my conservative values."""
