	Link	Title	Text
0	http://www.foxnews.com/world/2014/01/29/previous-unknown-egypt-army-chief-could-be-carried-into-presidency.html	A previous unknown, Egypt's army chief could be carried into presidency	
1	http://www.foxnews.com/transcript/2013/09/30/does-america-need-more-politicians-sen-cruzs-passion/	Does America need more politicians with Sen. Cruz's passion?	"DISCLAIMER: THE FOLLOWING ""Cost of Freedom Recap"" CONTAINS STRONG OPINIONS WHICH ARE NOT A REFLECTION OF THE OPINIONS OF FOX NEWS AND SHOULD NOT BE RELIED UPON AS INVESTMENT ADVICE WHEN MAKING PERSONAL INVESTMENT DECISIONS. IT IS FOX NEWS' POLICY THAT CONTRIBUTORS DISCLOSE POSITIONS THEY HOLD IN STOCKS THEY DISCUSS, THOUGH POSITIONS MAY CHANGE. READERS OF ""Cost of Freedom Recap"" MUST TAKE RESPONSIBILITY FOR THEIR OWN INVESTMENT DECISIONS.PASSION VS. POLITICS: SEN. TED CRUZ BLASTED BY BOTH SIDES IN HEALTH CARE FIGHTCHARLES PAYNE: Ted Cruz was articulate, passionate, smart, witty, and he had great interactions with his colleagues. He wasn't a nut. The idea of portraying him that way, as well as trying to dismiss the Tea Party has been the agenda of the media for a very long period of time. The Tea Party would be disingenuous if it didn't go after everyone.DAGEN MCDOWELL: I agree with other Republicans that believe ObamaCare should be allowed to collapse in on itself; you don't need this kind of up front talking, you don't need this kind of grandstanding, if you just sit back and let the chips fall the American people will turn away from this law.BEN STEIN: Just let ObamaCare go through, if it's a mess, it will bring down the whole Democrat Party. Then we can get a Republican president and a Republican Congress and we can start again. At this point the ship has sailed, the bill is law. If it's a mess, it will be the end of Obama. If it works, that's great.ADAM LASHINSKY: I think what he is doing is disgusting and shameful. What we should do is pull together for legislation that has already been enacted and help it be good.WHITE HOUSE OFFICIALS ANNOUNCE $300 MILLION IN AID FOR DETROITCHARLES PAYNE: Detroit is the ultimate poster child for progressive politics. You can throw money at the problem, but are they even in a position to pull them out of the problem? I don't think it will fix the fundamental problems.DAGEN MCDOWELL: It's no shock that the federal government is putting some money into this city. What is shocking is some of these undisclosed payments that were made to retirees; again, it is a bigger morass in this city than was thought before.BEN STEIN: This is not a progressive problem, it is a racial problem. This is the collapse of black family structure and the legacy of racism and slavery. It is a racial matter and has to be addressed as such.ADAM LASHINSKY: This is not a bailout. I think the federal government would like to do a bailout, I'm sure Detroit would like a bailout. The $300 million is redirected federal money to help out a city that needs its help.SAT SCORES SHOW 57 percent OF INCOMING FRESHMAN NOT READY FOR COLLEGEDAGEN MCDOWELL: There is something genius in this, I hope our educational system goes in this direction. If you can figure out what you want to do and do the cost benefit analysis before you commit to going to a four year university, then I am all in favor of this.CHARLES PAYNE: We've become a country that does not appreciate knowledge. We don't cherish intellect. We cherish sports and reality television. We don't encourage the idea of learning something new every day of your life.BEN STEIN: I love online learning. I think it is a fabulous innovation in education. If you have a kid that is willing to study and throw him into it, you have a very rare kid. For the rest of them that are just getting high all the time, it is a colossal waste of money and a colossal waste of time. I think online education is the wave of the future.ADAM LASHINSKY: On one hand, I think all sorts of students are wasting their time with college, on the other studies show that people with college degrees are the ones who get ahead. We have a conundrum there. It's a tough one.""FOURTH QUARTER"" WINNERS CHARLES PAYNE: Las Vegas Sands Corp. (LVS)ADAM LASHINSKY: Airgas, Inc. (ARG)BEN STEIN: iShares MSCI Thailand (THD)"
2	http://www.foxnews.com/on-air/special-report-bret-baier/transcript/reid-gets-earful-constituents	"
 Reid Gets an Earful From Constituents 
"	" Some fresh pickings from the Political Grapevine.Wise Move?Senate Majority Leader Harry Reid is catching some flack from Nevada Muslim supporters, who aren't happy with how he has handled his opposition to the proposed mosque near Ground Zero.The Las Vegas Review Journal reports that even though the director of the Islamic Society of Nevada does not support the Ground Zero mosque either, he says Reid's opposition was based on ""politics."" Aslam Abdullah says, ""He hasn't just lost support, he has lost respect. I was surprised and amused at his political immaturity. We'll know in November how the move will affect Reid's re-election bid.""Another Las Vegas imam said, ""I'm concerned that someone with so much influence wasn't more careful in his remarks.""Hard TimeThe man serving life in prison for conspiracy in the 1995 Oklahoma City bombing that killed 168 people will have to get by on regular prison food. A Colorado judge has dismissed Terry Nichols' lawsuit that claimed the prison violates his constitutional rights by depriving him of a diet rich in whole grains, fiber and raw fruits and vegetables.The judge disagreed, saying Nichols had not proved his diet qualified as cruel and unusual punishment or that it violated his Christian beliefs.Business as UsualThose of us here in the nation's capitol are used to presidential motorcade traffic headaches, but for some Los Angeles residents, President Obama's stopover for a fundraiser Monday was anything but rush hour as usual. In some cases commuters endured an extra hour of drive time.The Los Angeles Times wrote, ""No matter their politics, Los Angeles residents found themselves united. 'It was a beautiful thing,' said Brentwood resident Myles Berkowitz, commiserating with his neighbors on Montana Avenue, 'Young, old, black, white: Everyone was P.O.'d."""
3	http://www.foxnews.com/on-air/special-report-bret-baier/2012/10/23/all-star-panel-look-polls-ahead-last-candidate-showdown	All-Star Panel: A look at the polls ahead of last candidate showdown	"This is a rush transcript from ""Special Report,"" October 22, 2012. This copy may not be in its final form and may be updated.BRET BAIER, ANCHOR: Almost exactly two hours and ten minutes from now, Governor Romney and President Obama will be seated at that table on that stage with moderator Bob Schieffer and the third and final debate will begin. The topic is foreign policy. And this is a big deal, because in this election debates matter.Let's look at the latest polls, the most recent out tonight, Washington Post/ABC national poll, very close. We have President Obama at 49 percent, Governor Romney at 48 percent. Then you look at the national Gallup daily tracking poll. This has Mitt Romney with a big lead, 51 to 45. And then the Real Clear Politics average, this is seven of the most recent national polls, and this has Romney up less than a point. These are national polls, obviously. And we focus on the battleground states a lot.We're back with the panel. Chuck, your thoughts of where this race stands right now ahead of this debate?CHARLES LANE, EDITORIAL WRITER, WASHINGTON POST: Well, clearly, the momentum that began for Mitt Romney after that October 3 debate has not run out. Although the big question is whether it's going to keep flowing strongly enough to carry him Ohio and get him easily over 270. Within our poll, the Washington Post poll, one of the most interesting findings is that he has basically pulled even with the president on the question of foreign policy and fighting terrorism. So, he at least comes in to this debate tonight on an even footing with the president, which is not really what I would have expected a month ago.That tells you that in a way that the overall momentum that he's gained since that October 3 debate has spilled over now and is reflecting more broadly on his image. His favorability rating is nearly even with the president's.  He is in pretty good shape. Whether it's good enough to actually win, we'll find out.BAIER: A lot of focus, Steve, on Ohio as Chuck mentioned. The new Suffolk University poll out tonight has it tied 47-47 in Ohio. The Real Clear Politics average of polls in Ohio, and again, this is the seven most recent polls in the state of Ohio has the president with just a slight lead there. It seems like Governor Romney is closing the gap there, even though Democrats have been kind of crowing about Ohio for a long time.STEVE HAYES, SENIOR WRITER, THE WEEKLY STANDARD: Well, it does, and if I were the Obama campaign that is the poll of all the things that come out, both today and over the weekend that concerns me the most, the fact that Suffolk has it dead even there. There was also inside that same Washington Post/ABC poll -- poll of the seven battleground states, which found that Mitt Romney was up 52-46 in those battleground states. Those are the two things that I think would concern me most.I talked to people on the ground in Ohio over the past several days that says what echoes in part what Chuck is saying. After the first debate, Mitt Romney saw this surge in enthusiasm and energy. People were eager to rush in to the Romney headquarters. They were making phone calls, doing things they had had trouble getting people to do.There was just, remember, about three weeks ago some talk, loose talk maybe, of Mitt Romney pulling out of Ohio. He wasn't going to compete there anymore. That is gone. And the way that one person I talked to characterized it to me was, what happened was President Obama -- they are running a marathon and with one mile left, Mitt Romney looks up, President Obama is in front of him, and Obama has stumbled. And Mitt Romney now sees he can overtake him if he continues to press his case.BAIER: Quickly, Charles, one more state, Colorado another swing state. A new poll out by Rasmussen has Governor Romney up 50-46, and the Real Clear Politics average there has Romney up just slightly in the state of Colorado. It's possible also without Ohio that there is a way that Romney wins. What is your take of the state of the race?CHARLES KRAUTHAMMER, SYNDICATED COLUMNIST: That is exactly right. There are now other paths which are not at all terrible long shots that you can substitute for Ohio if he doesn't carry it.But I think what is happening tonight is that Romney has the momentum.  And as long as he draws even tonight, he doesn't even have to win. If he draws even tonight, the momentum continues and I think that would carry him to a victory. So he just has to hold serve. He doesn't have to hit a homerun to make seven scores into one metaphor.BAIER: Charles, Chuck, Steve, thank you. As always, that is it for the panel. We'll wrap things up here from the spin room after a quick break. Content and Programming Copyright 2012 Fox News Network, LLC. ALL RIGHTS RESERVED. Copyright 2012 CQ-Roll Call, Inc. All materials herein are protected by United States copyright law and may not be reproduced, distributed, transmitted, displayed, published or broadcast without the prior written permission of CQ-Roll Call. You may not alter or remove any trademark, copyright or other notice from copies of the content. "
4	http://www.foxnews.com/transcript/2013/06/11/sweeping-immigration-bill-clears-procedural-hurdle-senate/	Sweeping immigration bill clears procedural hurdle in Senate	"This is a rush transcript from ""The Five,"" June 11, 2013. This copy may not be in its final form and may be updated.ANDREA TANTAROS, CO-HOST: Well, some historic votes today in the Senate on an immigration bill that would open a door to citizenship for millions of illegals in this country.Here, two proponents of comprehensive immigration reform, President Obama and Republican Senator Marco Rubio.(BEGIN VIDEO CLIPS)PRESIDENT BARACK OBAMA: This bill isn't perfect. It's a compromise, and going forward nobody is going to get everything that they want. If you think that a broken system is the best America can do, I guess it might make sense to try to block it. But if you actually are serious and sincere about fixing a broken system, this is the vehicle to do it.SEN. MARCO RUBIO, R-FLA.: The first and foremost thing that it does, it says to the people that are here illegally, come forward, we have a process for you that you're going to have to undergo to be in this country legally.(END VIDEO CLIPS)TANTAROS: Recently, Marco Rubio came under fire for saying that citizenship should come before border security.Eric, you spent some time on the Hill today. You broke away from ""The Five"" for a little bit. Did you learn anything on what we can expect?ERIC BOLLING, CO-HOST: You know, I did. I sat with Senator Rand Paul for lunch in the Senate dining room -- very nice, by the way. I'll show you a picture later in the show.(CROSSTALK)TANTAROS: Get a haircut?BOLLING: No, I didn't get a haircut. I think they shut that down.By the way, you bought me a sandwich for lunch, too, thank you very much.I came up with something. We talked and we kind of -- he was talking about how Texas is working with the boarder, but Arizona and New Mexico weren't. I said, Senator, what's different. He said the Texas border is pretty much privately owned.So, if ranchers own the border between Texas and Mexico, that's not the case in New Mexico and Arizona and somewhat California, said why don't we do this? That's all federal land, by the way. Why don't we sell that federal land or give it to someone willing to secure the border. Let the private sector handle border security.Like you know, we have had this discussion, like an enlightening moment for a minute, I think it might certainly help.BOB BECKEL, CO-HOST: Those private land owners do not provide border security. They are the ones who bring illegals in so they can do their work.BOLLING: No, he said it's working. He says, they don't want the problems. They don't want the crime and they secure the border in Texas.PERINO: They also don't care about the lives, that they don't want people coming across on their land. Ranches are so big, and sometimes the heat so strong, and especially if it's a child or woman unable to take care of themselves, one of the thing ranchers do, but I am making his point.(LAUGHTER)TANTAROS: Could I ask you about the politics on this a little bit? So, Harry Reid said he would allow as many amendments as possible, and there's one school of thought believe he is purposely doing this so Republicans will add all of these amendments, then he can say, see, they're blocking immigration reform, maybe Republicans are adding amendments to go to their districts and having to say, see, these Democrats don't want border security but we do.Who do you think is right or maybe both?DANA PERINO, CO-HOST: Well, lots of gamesmanship, I have a particular opinion about Senator Reid's action in 2007 which ended that opportunity for comprehensive immigration reform, that was a political decision on his part.So, there's a lot of politics that go back and forth. The challenge for the politicians involved, they have to communicate very succinctly and clearly to the American people, because you're going to have so many theories on the left and the right about what's actually in the bill. You can already see it if you follow on Twitter, it's very confusing. I am going to watch this debate. After it passes the Senate, if it passes Senate, then I'll take a good hard look what's in it. It still has to go to the House and, you know, how the bill becomes law.BECKEL: The politics of this, Republicans are going to pass it because they've got to pass it, because without Hispanics, they have no chance of being a national party.TANTAROS: But there's a lot of opposition in the House. Even if they get it out of the senate this summer, there's still a lot of Republicans that are not psyched about the bill at all.GREG GUTFELD, CO-HOST: Look, I think I am like most Americans. I want a process but I don't want a procession. This is a procession. The fact is if we do this, why not cut out the middleman, have all of the new immigrants report to DNC headquarters and Wasserman Schultz can swear them in, because that's what they're talking about?I want to know, Bob, I want to know, will this path to citizenship include the Irish or Poles? I expect as much diversity to get in a Utah barbershop quartet.BECKEL: None of these people will vote for 15 or 20 years.TANTAROS: Is that why union bosses were standing with President Obama today because they're interested in membership and it is the quickest way to get it?BECKEL: They were fighting it, they didn't want underpaid workers coming in.BOLLING: There's no question the Republican Party has to figure out a way to bring the Hispanic vote back into the fold, when George Bush 40 something percent, they need to do it.Can I offer something else? How about increasing legal immigration? We let about a million people, how about letting 2 million or 3 million in.(CROSSTALK)GUTFELD: Why does the bill need to be a thousand pages?PERINO: Every comprehensive bill has to be a thousand pages or it is nothing.GUTFELD: Ground the government. Tell them to limit bills to 10 pages, including cartoons. This is ridiculous.TANTAROS: In Greg Gutfeld's world, they're grounded from a couple of episodes --GUTFELD: Exactly, government is still in it's room, not watching TV or listening to records.PERINO: Do you have Wi-Fi in there?GUTFELD: No.TANTAROS: It should get spanked.GUTFELD: Yes, everybody should.Content and Programming Copyright 2013 Fox News Network, LLC. ALL RIGHTS RESERVED. Copyright 2013 CQ-Roll Call, Inc. All materials herein are protected by United States copyright law and may not be reproduced, distributed, transmitted, displayed, published or broadcast without the prior written permission of CQ-Roll Call. You may not alter or remove any trademark, copyright or other notice from copies of the content."
