	Unnamed: 0	Link	Title	Text	Terms	Topics
0	0	http://www.foxnews.com/politics/2014/11/08/for-hillary-clinton-uncertain-return-to-campaign-trail.html	For Hillary Clinton, an uncertain return to the campaign trail			
1	1	http://www.foxnews.com/us/2015/06/16/profs-say-us-history-guidelines-would-shortchange-college-bound-seniors.html	Profs say US history guidelines would shortchange college-bound seniors			
2	2	http://www.foxnews.com/story/2007/06/27/warren-buffett-dishes-on-more-than-politics-at-hillary-clinton-fundraiser	Warren Buffett Dishes on More Than Politics at Hillary Clinton Fundraiser			
3	3	http://www.foxnews.com/world/2014/11/04/thailand-coup-government-appoints-committee-to-draft-new-constitution.html	Thailand's coup government appoints committee to draft new constitution			
4	4	http://www.foxnews.com/politics/2014/11/03/son-actor-robert-mitchum-blasts-dem-for-deceptive-ad-in-congressional-race.html	Son of actor Robert Mitchum blasts Dem for ‘deceptive’ ad in congressional race			
5	5	http://www.foxnews.com/story/2002/03/27/bush-talks-politics-security-in-south-carolina	Bush Talks Politics, Security in South Carolina			
