	Unnamed: 0	Link	Title	Text	Terms	Topics
0	0	http://www.foxnews.com/politics/2014/05/01/imprisoned-alabama-gov-gets-new-hearing-with-help-from-clinton-impeachment-lawyer.html	Imprisoned former Alabama governor vows to clear his name, as court hearing looms			
1	1	http://www.foxnews.com/us/2016/06/19/5-lessons-learned-from-my-father-for-business-and-for-life.html	5 Lessons I Learned From My Father -- for Business and for Life			
2	2	http://www.foxnews.com/us/2016/08/23/7-success-secrets-every-entrepreneur-must-eventually-learn.html	7 Success Secrets Every Entrepreneur Must Eventually Learn			
3	3	http://www.foxnews.com/politics/2016/05/18/dem-diagnosis-early-stage-jebola.html	Dem diagnosis: Early-stage Jebola			
4	4	http://www.foxnews.com/opinion/2016/02/09/trump-and-sanders-win-in-nh-trump-and-sanders-win-are-witnessing-full-scale-revolt-america.html	Trump and Sanders win: We are witnessing a full scale revolt, America			
5	5	http://www.foxnews.com/politics/2016/02/16/cracks-in-hillary-s-firewall-black-voters-divided-between-dem-candidates.html	Cracks in Hillary’s firewall? Black voters divided between Dem candidates			
6	6	http://www.foxnews.com/politics/2013/08/12/krauthammer-on-democrats-owning-obamacare-have-no-choicetheres-no-point-in.html	VIDEO: Krauthammer on Dems ‘owning’ ObamaCare: ‘They have no choice’			
7	7	http://www.foxnews.com/world/2015/11/15/opposition-decries-confusing-candidates-in-high-stakes-venezuela-congressional.html	Opposition decries confusing candidates in high-stakes Venezuela congressional elections			
