	Link	Title	Text
0	http://www.foxnews.com/world/2015/12/25/top-syrian-rebel-commander-reported-dead-in-airstrike.html	Syrian rebel commander battling Assad regime killed in airstrike	
1	http://www.foxnews.com/us/2015/12/25/clinton-obama-find-unlikely-ally-in-george-w-bush-as-counter-republicans-on.html	Clinton, Obama find an unlikely ally in George W Bush as they counter Republicans on Islam	
