	Unnamed: 0	Link	Title	Text	Terms	Topics
0	0	http://www.foxnews.com/world/2013/07/20/pm-abe-bids-for-stronger-hand-as-japan-votes.html	PM Abe bids for stronger hand as Japan votes			
1	1	http://www.foxnews.com/world/2013/07/20/mugabe-urges-zuma-to-silence-advisor.html	Mugabe urges Zuma to silence advisor			
2	2	http://www.foxnews.com/politics/2014/04/10/senate-dems-facing-tough-re-election-campaigns-urge-obama-to-approve-keystone.html	Senate Dems facing tough re-election campaigns urge Obama to approve Keystone			
3	3	http://www.foxnews.com/us/2013/10/19/us-rep-bill-young-remembered-as-military-supporter-worker-for-fla-in-43-years.html	US Rep. Bill Young remembered as military supporter, worker for Fla. in 43 years in Congress			
4	4	http://www.foxnews.com/opinion/2009/02/12/selling-stimulus-obama-takes-page-reagan.html	Selling the Stimulus -- Obama Takes a Page From Reagan			
5	5	http://www.foxnews.com/politics/2014/04/10/soviet-born-congressional-candidate-looks-to-make-history.html	Soviet-born congressional candidate looks to make history			
6	6	http://www.foxnews.com/world/2014/12/30/corruption-allegations-cast-doubt-on-future-key-party-ahead-israel-vote.html	Corruption allegations cast doubt on future of key party ahead of Israel vote			
7	7	http://www.foxnews.com/us/2015/05/20/editorial-roundup-excerpts-from-recent-editorials-in-newspapers-in-us-and.html	Editorial Roundup: Excerpts from recent editorials in newspapers in the US and abroad			
8	8	http://www.foxnews.com/us/2013/07/18/university-california-approves-napolitano-as-university-president.html	University of California approves Napolitano as president			
