	Unnamed: 0	Link	Title	Text	Terms	Topics
0	0	http://www.foxnews.com/world/2016/06/08/what-result-britain-eu-vote-could-mean-for-scotland.html	What the result of Britain's EU vote could mean for Scotland			
1	1	http://www.foxnews.com/politics/2016/01/27/obama-to-meet-with-bernie-sanders-at-white-house.html	Obama meets with Sanders at White House, after critical comments			
2	2	http://www.foxnews.com/transcript/2012/10/19/conservative-coworkers-shunned-workplace/	Conservative coworkers shunned in the workplace?	"This is a rush transcript from ""The Five,"" October 19, 2012. This copy may not be in its final form and may be updated.GREG GUTFELD, CO-HOST: So, the election is six or eight months away. No one really knows. And some wonder if talking politics in the workplace is OK. The Wall Street Journal -- owned by our parent company, Super Rich and Amazing People, Inc. -- reports that workplace debates are getting worse. And according to some survey I didn't read because I was preparing for my ""O'Reilly"" segment, a third of firms been a political chat altogether.But, look, when coworkers say don't talk politics, what is they're really saying is don't talk politic if you are a crazy right winger. Remember, it's perfectly acceptable for libs to wear the politics on their sleeves. They pretty much invented the sincerely wordy t-shirt.In fact, the Gutfeld Institute for Made Up Stuff found that a typical liberal owns seven bumper stickers but only half a car.So, when suddenly when conservatives finally join in the conversation, it's whoa, dude, back off!Back in the '90s, when Dana was sill wiping down tables at TCBY, I was editing a health magazine. I was well-liked mainly because I was in great shape. My abs had biceps. My biceps had triceps. My triceps dated Heather Locklear. But the place was super liberal and when folks found out I wasn't, they stared at me like I was a two-headed goat.So, by all means, crack down on political chatter. But if you are only in banning stuff you don't agree with, then you're a wuss and you should probably work at home or at Current TV where you will really be alone.(LAUGHTER)GUTFELD: So, Dana, I'm trying to think, how do you feel about people talking politics in an office? Is it as bad as people talking about their pets?DANA PERINO, CO-HOST: Well, you have to remember --(LAUGHTER)GUTFELD: Look at that, just doesn't even listen.PERINO: Pets are a safe place. This is actually one of the points I was going to make. You have to remember, I worked at a White House for eight years.GUTFELD: Right.PERINO: When we talked --GUTFELD: I never knew!PERINO: We talk politics it was great.(LAUGHTER)KIMBERLY GUILFOYLE, CO-HOST: Thank you.PERINO: I also have a dog and you might not have heard either.GUTFELD: Yes.PERINO: I think, I was on Twitter today asking people if they have this problem and they said they do. But I think that you need to have a safe place to go, like, hey, how are you kids, how is the weather? Like something about your dog, or something like that, that you don't get yourself in a bad situation, even get fired or demoted.GUTFELD: Yes.PERINO: Not get a raise.GUTFELD: Yes, that's true.PERINO: And I did not work at TCBY.And you can win half a car on ""Wheel of Fortune,"" by the way.GUTFELD: Oh, really, I had no idea. Thanks for that.Bob, what about the people who talk about, say, the events that go on the night before? Is that considered appropriate information?BOBO BECKEL, CO-HOST: Depending what night are you talking about? If you're talking about mine, it would not be appropriate. No.If you talk about the politics, listen, I wouldn't disagree. You want to hear the conversation?GUILFOYLE: No, don't repeat any of it.BECKEL: I'll repeat all of it. It's all right, conservative stuff and Eric is in there. He gets right over the hill.GUTFELD: Do you think so? I don't think we talk politics there.BECKEL: Are you kidding?GUTFELD: No, it all comes out here. We're the opposite of America. We talk about like, you know, regular stuff, because we get it out in the open.PERINO: That's true.GUTFELD: Don't you think?BECKEL: That's probably very true, but we still do talk about -- if you took general political views that take place in the green room and then the people we invite for guests, for example, are all right wingers. I don't think --GUTFELD: And Che Guevara is right winger.BECKEL: And I'm going to have him up.GUTFELD: Yes.Eric, what do you -- do you think it's a problem? You don't talk politics at work. I don't see you talking politics in the office.ERIC BOLLING, CO-HOST: We kind of talk about sports. We talk about what happened last night. What did you do last night, you write more of your -- whatever book you're --BECKEL: Yes.BOLLING: I enjoy my time with my son talking politics, believe it or not. He's 14. All of a sudden, we're talking about what the difference between Republicans and socialists, I mean, Democrats. We do. We talk politics. And believe it or not, kids, they're picking up on it, man.GUTFELD: The great thing, K.G, we never talk about politics when we're at home.GUILFOYLE: Well, today, yes, like when you pretended you want to buy my apartment and go, what does it look like? Send me pictures? Like you didn't know already.BECKEL: Greg told me you have the same apartment.GUILFOYLE: No, we don't. He occupies the tree space outside my window.GUTFELD: It's a fort, I made out of pillows.GUILFOYLE: There you go. I love talk politics at work. I mean, momma, we're getting paid to talk politics. Best thing ever. Only in America, baby.PERINO: Some people do have to worry.GUTFELD: Yes.PERINO: You can't like -- you don't in the parking lot, you don't want to have, you know, a GOP sticker on there.GUTFELD: I was harassed -- when they found out that I wasn't voting for Clinton in '92, people coming in to my office just to stare at me.BECKEL: Well; they should. The idea that you want to talk about politics, you can't let a minute go by without mentioning something bad about Obama.BOLLING: When we talk, we talk politics. But for the most part, it would be of a kind.GUILFOYLE: Bob, we wanted to talk about what you occupy the majority of our time talking about --Content and Programming Copyright 2012 Fox News Network, LLC. ALL RIGHTS RESERVED. Copyright 2012 CQ-Roll Call, Inc. All materials herein are protected by United States copyright law and may not be reproduced, distributed, transmitted, displayed, published or broadcast without the prior written permission of CQ-Roll Call. You may not alter or remove any trademark, copyright or other notice from copies of the content."	['Clinton', 'Obama']	[]
3	3	http://www.foxnews.com/transcript/2016/08/13/trump-clinton-clash-over-tax-plans/	Trump, Clinton clash over tax plans	"DISCLAIMER: THE FOLLOWING ""Cost of Freedom Recap"" CONTAINS STRONG OPINIONS WHICH ARE NOT A REFLECTION OF THE OPINIONS OF FOX NEWS AND SHOULD NOT BE RELIED UPON AS INVESTMENT ADVICE WHEN MAKING PERSONAL INVESTMENT DECISIONS. IT IS FOX NEWS' POLICY THAT CONTRIBUTORS DISCLOSE POSITIONS THEY HOLD IN STOCKS THEY DISCUSS, THOUGH POSITIONS MAY CHANGE. READERS OF ""Cost of Freedom Recap"" MUST TAKE RESPONSIBILITY FOR THEIR OWN INVESTMENT DECISIONS.Do Candidates' Tax Plans Address Mounting National Debt?Larry Glazer: Well unfortunately, neither plan really deals with the elephant in the room that soaring national debt. And in order to do that, both plans will actually increase the debt. We have to deal with the entitlement issue in this country. Social security, we've got Medicare, Medicaid, that are 50 percent of the budget. So outside of that we have one really key difference that is corporate income tax. Hilary talks about getting companies to pay their share but Donald's plan will do it. Lowering the corporate income tax gets companies to bring $2 billion sitting overseas back to this country to create jobs and get this economy really moving.Ben Stein: No, I don't like it at all. I've been saying that for some time. It's pretty simple if you raise taxes you will bring in more money. This is the formula if you low in taxes you will bring in money has been proved to be faulty over and over again. I'm afraid that even though I'm not a huge fan of Mrs. Clinton to put it mildly, her tax plan is much less better where the deficit is concerned. We just have to raise taxes. Horrible. I don't like paying taxes but we have to raise taxes on the very, very rich. They can afford it. They won't miss a thing.Charlie Gasparino: If you can look at history, Donald Trump has a better plan. Because history shows that over time, when you do keep -- when you lower regulations, when you keep -- when you lower taxes, businesses and I believe in economic growth, brings much more taxes than any government can. Economic growth increases. Now the problem with Donald's plan he does nothing to contain entitlements and, you know, that's the elephant in the room with that. But if you're going to net this thing, you know, this isn't even close. Her plan is horrible. It complicates everything. His plan is a lot simpler and by the way, I trust Donald trump with tax plan with a Paul Ryan led Congress, any day of the week.Julie Roginsky: Both plans are interesting. If you're Donald Trump and a corporation, or you're a really affluent human being Donald Trump's plan it won't graze. Ben Stein will do great. Middle class parent or somebody trying to get into the middle class, In the middle class or trying to get into the middle class, the breaks that she's given, the incentives she's giving in her tax plan.House GOP Task Force Finds ISIS Intelligence Manipulated to Downplay ThreatBen Stein: No. It isn't what taxpayers really deserve. Taxpayers rarely get what they deserve. As a matter of fact, human beings rarely get what they deserve. Unfortunately, it has been a commonplace of military history in the United States and in all other countries for the politicians to get the military to lie for them, exam rate for them. This has been true since the Revolutionary War very true during the Civil War, very, very true during World War I and World War II and true in Vietnam. So unfortunately, while I'm sure it is true that the politicians may exaggerate, this is standard operating procedure. It's unfortunate but not unusual.Julie Roginsky: You point out life is brutal and nasty and short. Thanks for ruining our Saturdays there. Ben is right, Centcom is actually doing this, and it's an inexcusable. Whoever is doing it should be held responsible. No indication it's coming from the white house or the secretary of defense. But nevertheless, Centcom -- if this is happening, awful.Charlie Gasparino: You worried when it's filtered through politics. As Ben made a brilliant point before, weapons of mass destruction, I'm sure Collin Powell when he heard the words weapons of mass destruction, went, I'm paraphrasing went to President Bush at the time and said let's be really sure, are we sure, he cautioned against it still, so -- but the policy guys still wanted to invade Iraq. The one thing I will say is this, is this, you know, are the policy guys doing this as a matter of course where they -- how they usually do it or is the Obama administration like the Nixon administration and/or Johnson where they're filtering every bad thing about ISIS through a purely, purely political framework. Is this worse than it was -- is this comparable to Nixon, Johnson? I don't know. If it is it's bad.Larry Glazer: Ever since Vietnam, the American people have had a very skeptical view of military intelligence, particularly when it looks like it's altered for political gain. And that's what we're seeing here. Look, it doesn't take a genius to turn around and see everywhere you look, there's a globally inspired ISIS event. Whether it's Paris, whether it's Nice, San Bernardino. It's all around us. It's not going so well. We just want transparency and truth. American lives are at stake here, we want to know people are safe including those in the Armed Forces.Poll: 69 Percent of Voters Disagree With Plan to Prosecute Some Climate Change SkepticsCharlie Gasparino: I think if the Democrats really want to do this efficiently -- these are mostly democratic AGs who want to basically prosecute thought. These are -- they should get re-education camps. Copy the Vietnam, Cambodian, Russian models of re-education camps and just change people's minds all at once modes to of doing stupid piecemeal things because it's not efficient enough to prosecute thought that way. They should just go whole hog I bet you if Hillary Clinton's watching, she's going to take this up.Julie Roginsky: Let's be clear. States pass laws, right, dealing with climate change. You may like those laws, you may not like those laws, it's a belief things. When you have corporations, Exxon, I don't know who it is, doctoring evidence, or otherwise breaking no state laws.Ben Stein: It's more than farfetched. It's unconstitutional, a violation of the First Amendment. It's gone way beyond suing corporations over their disclosure documents. There are prominent people in America on the Democratic side saying that climb change skeptics should be put in prison.Larry Glazer: This isn't about climate change. This is about government overreach and steps individuals stepping up and taking responsibility. Governments are always going to do things we don't like. It's for individuals and the media to call them on it, for the people to rise up. It's not the government's job to enforce everything. If the government enforces everything that doesn't satisfy their beliefs, where do you draw the line? Look, are we going to enforce religious, political beliefs? This is what happened with the IRS scandal. That's the problem.Stock PicksLarry Glazer: (GE) GENERAL ELECTRICBen Stein: (SPY) SPDR"	['Paul', 'Obama', 'Clinton', 'Trump', 'Nixon']	[]
4	4	http://www.foxnews.com/world/2015/09/08/former-policewoman-lawyer-is-face-singapore-energized-opposition-in-general.html	Former policewoman, lawyer is face of Singapore's energized opposition in general elections			
