	Link	Title	Text
0	http://www.foxnews.com/politics/2015/06/01/2016-gop-power-index-paul-fights-his-way-down.html	2016 GOP Power Index: Paul fights his way down	
1	http://www.foxnews.com/entertainment/2015/09/04/johnny-depp-shines-in-gritty-gangster-tale-black-mass.html	Johnny Depp shines in gritty gangster tale 'Black Mass'	
2	http://www.foxnews.com/world/2015/05/20/beatification-el-salvador-beloved-romero-confirms-new-understanding-in-church.html	Beatification of El Salvador's beloved Romero confirms new understanding in church of martyr	
3	http://www.foxnews.com/world/2016/02/12/in-southern-europe-astute-negotiator-unpicks-austerity.html	In southern Europe, an astute negotiator unpicks austerity	
4	http://www.foxnews.com/opinion/2016/02/12/what-makes-one-lady-in-2016.html	What makes someone a 'Lady' in 2016?	
5	http://www.foxnews.com/opinion/2016/02/12/does-bernie-sanders-really-want-to-win-three-observations-from-democratic-debate.html	Does Bernie Sanders really want to win? Three Democratic debate takeaways	
6	http://www.foxnews.com/world/2015/09/02/colombia-to-give-citizenship-to-158-venezuelans-separated-from-family-during.html	Colombia to give citizenship to 158 Venezuelans separated from family during border crackdown	
