	Link	Title	Text
0	http://www.foxnews.com/us/2016/09/30/is-your-best-self-entrepreneur-or-worker-bee.html	Is Your Best Self an Entrepreneur or a Worker Bee?	
1	http://www.foxnews.com/entertainment/2015/04/13/divorce-court-wife-accused-sleeping-with-entire-wu-tang-clan.html	'Divorce Court': Wife accused of sleeping with entire Wu-Tang Clan	
2	http://www.foxnews.com/politics/2016/04/04/connecticuts-budget-woes-taxes-make-it-prime-target-for-pro-biz-governors-like-scott-others.html	Connecticut's budget woes, taxes make it prime target for pro-biz governors like Scott, others	
3	http://www.foxnews.com/opinion/2015/08/18/tea-party-could-lose-senate-for-gop.html	Tea Party could lose Senate for GOP	
4	http://www.foxnews.com/us/2015/12/06/san-bernardino-gunman-obsessed-with-israel-isis-dad-says.html	San Bernardino gunman obsessed with ISIS and Israel, dad says	
5	http://www.foxnews.com/politics/2016/08/01/business-empress-now-super-surrogate-can-ivanka-trump-be-dad-s-deal-closer.html	Business empress, now super-surrogate: Can Ivanka Trump be dad’s deal-closer?	
